,name,text,id,url,created_at
0,WSJ,Airlines have lost the ability to extract as much money as possible from travelers. And their pricing computers may stay confused for some time to come. https://t.co/gdPF2xDv3p,1292254274727149571,https://www.wsj.com/articles/coronavirus-has-upended-everything-airlines-know-about-pricing-11596632998?mod=e2tw,Sun Aug 09 00:20:02 +0000 2020
0,WSJ,"A union of the four “Canzuk” countries of Canada, Australia, New Zealand and the U.K. would immediately enter the global stage as a superpower and ally of the U.S., writes historian Andrew Roberts https://t.co/MhlionsGb2",1292259325017239552,https://www.wsj.com/articles/its-time-to-revive-the-anglosphere-11596859260?mod=e2tw,Sun Aug 09 00:40:06 +0000 2020
0,WSJ,"Match may not be the most exciting name in tech right now, but it isn’t likely to break your heart. @WSJheard explains. #WSJWhatsNow https://t.co/MPjCsRSz3T https://t.co/Zbej12eHzi",1292264332001030146,https://www.wsj.com/articles/tinder-owner-match-group-lights-up-the-pandemic-11596637516,Sun Aug 09 01:00:00 +0000 2020
0,WSJ,Here's a breakdown of what's in the four coronavirus aid executive actions President Trump signed Saturday https://t.co/SzVzQdeKU4,1292269382631067650,https://www.wsj.com/articles/what-we-know-about-trumps-proposed-stimulus-executive-orders-11596895204?mod=e2tw,Sun Aug 09 01:20:04 +0000 2020
0,WSJ,Joe Biden is nearing a decision on his running mate for the November election. His choice could influence the direction of the Democratic Party for years. https://t.co/Ko0rrcfvfw,1292274407101145088,https://www.wsj.com/articles/joe-bidens-2020-vp-decision-draws-closer-11596805953?mod=e2tw,Sun Aug 09 01:40:02 +0000 2020
0,WSJ,"Nursing home deaths are rising again, fueled by increases in Sunbelt states  https://t.co/blVRJwMlbS",1292279460272779264,https://www.wsj.com/articles/nursing-home-deaths-are-rising-again-federal-data-show-11596899575?mod=e2tw,Sun Aug 09 02:00:07 +0000 2020
0,WSJ,"A germaphobe's dream vacation? These fanatically private getaways include a modern-day cowboy estate and a swanky pop-up camping trip 
https://t.co/xOTxSLJBJa",1292284477612470275,https://www.wsj.com/articles/how-to-travel-luxuriously-in-the-summer-of-covid-19-from-private-jets-to-hotel-buyouts-11596859251?mod=e2tw,Sun Aug 09 02:20:03 +0000 2020
0,WSJ,"Robot arms with ""eyes"" and ""brains"" join the FedEx workforce as e-commerce booms https://t.co/Xl81K6KmPc",1292289523888652288,https://www.wsj.com/articles/as-e-commerce-booms-robots-pick-up-human-slack-11596859205?mod=e2tw,Sun Aug 09 02:40:06 +0000 2020
0,WSJ,"How peer-to-peer resellers like Craigslist are getting a Covid-era influx of vintage furniture, and how to save serious money scouring it now
https://t.co/rxJosV2LfL",1292302095106834433,https://www.wsj.com/articles/how-to-score-major-furniture-finds-and-savings-on-sites-like-craigslist-11596859236?mod=e2tw,Sun Aug 09 03:30:03 +0000 2020
0,WSJ,Production of key drugs left America and China stepped in to fill the gap. The pandemic exposed the danger. https://t.co/XjcnbKQQNv,1292309664810532864,https://www.wsj.com/articles/how-the-u-s-ceded-control-of-drug-supplies-to-china-11596634936?mod=e2tw,Sun Aug 09 04:00:08 +0000 2020
0,WSJ,"Publishers world-wide have long sought compensation from Google and Facebook, which collect ad revenue based on visits to their platforms and increase traffic by including links to news articles https://t.co/haarWLpyqh",1292324760064536576,https://www.wsj.com/articles/australia-unveils-its-plan-to-make-facebook-and-google-pay-for-news-11596181433?mod=e2tw,Sun Aug 09 05:00:07 +0000 2020
