,name,text,id,url,created_at
0,AJEnglish,All of President Trump's careful plans for a “coup” to stay in power failed spectacularly https://t.co/82RvKpcAS4 https://t.co/lssNrqmxw0,1333923841479909376,https://www.aljazeera.com/news/2020/12/1/a-coup-was-not-in-the-cards-for-trump-after-all,Wed Dec 02 00:00:01 +0000 2020
0,AJEnglish,"""Deliberate depression.""

The World Bank sees Lebanon’s economy shrinking a huge 19.2 percent this year https://t.co/uCWfn01fpa https://t.co/IG0pyxQWmU",1333935181997236227,https://www.aljazeera.com/economy/2020/12/1/deliberate-depression-world-banks-dire-warning-on-lebanon,Wed Dec 02 00:45:05 +0000 2020
0,AJEnglish,The Supreme Court hears a case claiming Nestlé and Cargill knowingly bought from farms that used child slave labour in Africa https://t.co/KA8J7r8bTo,1333938971483795456,https://www.aljazeera.com/news/2020/12/1/can-us-corporations-be-sued-for-slavery-top-court-to-decide,Wed Dec 02 01:00:08 +0000 2020
0,AJEnglish,The Supreme Court hears a case claiming Nestlé and Cargill knowingly bought from farms that used child slave labour in Africa https://t.co/vgyonSh5YS https://t.co/j3LtdOBisE,1333941353340932096,https://www.aljazeera.com/news/2020/12/1/can-us-corporations-be-sued-for-slavery-top-court-to-decide,Wed Dec 02 01:09:36 +0000 2020
0,AJEnglish,Liberia’s President Weah might be in for a rude awakening at next week's elections https://t.co/vbz9bxXKFP https://t.co/Zfs59JirXr,1333946535625814018,https://www.aljazeera.com/opinions/2020/12/1/liberias-weah-might-be-in-for-a-rude-awakening-at-the-polls/,Wed Dec 02 01:30:12 +0000 2020
0,AJEnglish,"“As we continue to live, so does the movement.""

Hong Kong activist Joshua Wong remains defiant ahead of his sentencing https://t.co/f75MXogZyr https://t.co/0wgBnTbuJK",1333954072685240320,https://www.aljazeera.com/news/2020/12/2/who-is-joshua-wong,Wed Dec 02 02:00:09 +0000 2020
0,AJEnglish,"""Obama may be a flirt but he is no fool."" — writes @marwanbishara for #AJOpinion https://t.co/BgMU5HjUfV",1333957845553983488,https://www.aljazeera.com/opinions/2020/11/30/a-political-flirt-the-diaries-of-barack-hussein/,Wed Dec 02 02:15:08 +0000 2020
0,AJEnglish,China successfully landed a spacecraft on the moon – the first mission to collect lunar surface samples in 40 years https://t.co/NZW8mEeCKc https://t.co/1BuU3zV7bN,1333961610797457409,https://www.aljazeera.com/news/2020/12/2/china-lands-on-moon-in-mission-to-collect-samples-from-surface,Wed Dec 02 02:30:06 +0000 2020
0,AJEnglish,"""Dignified sanitation is a basic human need that does not end with a toilet.""— #AJOpinion, by Izabella Koziell https://t.co/wnEQThi8Nc https://t.co/nxR3ezu7ga",1333965402771238914,https://www.aljazeera.com/opinions/2020/12/1/how-to-defuse-the-human-waste-time-bomb-in-low-income-countries/,Wed Dec 02 02:45:10 +0000 2020
0,AJEnglish,"RT @AJListeningPost: Former prime minister Kevin Rudd has been the driving force in a campaign calling for an inquiry into News Corp Australia.

But Rudd’s history with Murdoch’s outlets is complicated and it’s given them an opening to attack him.

We spoke with @rgcooke &amp; Sally Young. https://t.co/9ihJwwEP2NFormer prime minister Kevin Rudd has been the driving force in a campaign calling for an inquiry into News Corp Aus… https://t.co/JbCl8pE8fc",1333969291784425474,https://twitter.com/i/web/status/1333893868882960388,Wed Dec 02 03:00:37 +0000 2020
0,AJEnglish,South Korea passes a law allowing celebrities such as BTS to defer military service https://t.co/8GaqSwFdEP https://t.co/Rjdo2PaZ1q,1333973215606149120,https://www.aljazeera.com/news/2020/12/2/south-korea-passes-law-allowing-bts-artists-to-postpone-service,Wed Dec 02 03:16:13 +0000 2020
0,AJEnglish,China's criticism of Australia's alleged war crimes shows their already tense relationship at its lowest in 50 years https://t.co/vLwt989H34,1333982022822457347,https://www.aljazeera.com/economy/2020/12/1/australia-china-tensions-explained-in-500-words,Wed Dec 02 03:51:13 +0000 2020
0,AJEnglish,"RT @AJListeningPost: ▶️ Watch our report on Murdoch media facing a reckoning in Australia now on @AJEnglish

👉🏾 https://t.co/rmBkPkIbLA https://t.co/1UGHCm1sOs",1333986094044606464,https://www.youtube.com/watch?v=jR29iTWZJeQ&feature=youtu.be,Wed Dec 02 04:07:23 +0000 2020
0,AJEnglish,"In the Mood for Love is an unforgettable story of unrequited love set in 1960s Hong Kong, romanticised the image of a city in constant flux https://t.co/z2GaG0Ns83",1333990471367061505,https://www.aljazeera.com/features/2020/11/30/the-romance-of-hong-kong-past-in-the-mood-for-love-20-years-on,Wed Dec 02 04:24:47 +0000 2020
0,AJEnglish,"PM Narendra Modi said new farm laws will “liberate” farmers from the tyranny of middlemen.

So, why have India's farmers traveled hundreds of miles to protest them? https://t.co/hDSHEydaVf https://t.co/SajpYpCoZP",1333995008182063104,https://www.aljazeera.com:443/economy/2020/12/1/why-are-thousands-of-indian-farmers-protesting,Wed Dec 02 04:42:49 +0000 2020
0,AJEnglish,"RT @AJEnglish: ""They want to turn us into slaves as well."" 

Thousands of Indian farmers blocked highways into New Delhi for days with their trucks and tractors – and vow to continue their protests against new government laws. https://t.co/dGFTpALvks""They want to turn us into slaves as well."" 

Thousands of Indian farmers blocked highways into New Delhi for days… https://t.co/kLrPyuMBCI",1333998956683124736,https://twitter.com/i/web/status/1333894225453256705,Wed Dec 02 04:58:30 +0000 2020
0,AJEnglish,US Congress to vote on F-35 sale to UAE: Republican senator https://t.co/pfGFPksjSB,1334006917648289793,https://www.aljazeera.com/news/2020/12/2/us-congress-to-vote-on-f-35-sale-to-uae-republican?taid=5fc72660585f620001536393&utm_campaign=trueAnthem%3A+Trending+Content&utm_medium=trueAnthem&utm_source=twitter,Wed Dec 02 05:30:08 +0000 2020
0,AJEnglish,What is behind India’s ‘love jihad’ legislation? — writes @pragyatiwari for #AJOpinion https://t.co/TG8HgzcJSQ https://t.co/6Jgiu7XlGB,1334006925751709698,https://www.aljazeera.com/opinions/2020/11/30/what-is-behind-indias-love-jihad-legislation/,Wed Dec 02 05:30:10 +0000 2020
0,AJEnglish,India plans dam on Brahmaputra river against China’s plans https://t.co/Df72vnXtSj,1334010680098377728,https://www.aljazeera.com/news/2020/12/2/india-plans-dam-on-brahmaputra-to-offset-chinese-plans?taid=5fc729e19870190001e52e85&utm_campaign=trueAnthem%3A+Trending+Content&utm_medium=trueAnthem&utm_source=twitter,Wed Dec 02 05:45:05 +0000 2020
0,AJEnglish,"“Lebanon’s recession is likely to be arduous and prolonged given the lack of necessary policymaking."" https://t.co/9AyQrQlVkw",1334014448865046528,https://www.aljazeera.com/economy/2020/12/1/deliberate-depression-world-banks-dire-warning-on-lebanon,Wed Dec 02 06:00:04 +0000 2020
0,AJEnglish,What’s happening in the US election in 500 words https://t.co/dp1pxPkC5z,1334018230587973633,https://www.aljazeera.com/news/2020/12/1/whats-happening-in-the-us-election-in-500-words?taid=5fc730e9585f6200015363bf&utm_campaign=trueAnthem%3A+Trending+Content&utm_medium=trueAnthem&utm_source=twitter,Wed Dec 02 06:15:05 +0000 2020
0,AJEnglish,COVID-19: India says entire population may not need vaccinating https://t.co/YkNVAkKMkW,1334022015439810560,https://www.aljazeera.com/news/2020/12/2/india-says-may-not-need-to-vaccinate-entire-population-to-control?taid=5fc7346f585f6200015363c9&utm_campaign=trueAnthem%3A+Trending+Content&utm_medium=trueAnthem&utm_source=twitter,Wed Dec 02 06:30:08 +0000 2020
0,AJEnglish,"“For us, the Orange Train is a symbol of loss, operating in a country which runs against the interests of the many and in the interests of the few.” - Khalid, Lahore resident and small business owner https://t.co/aeFztsDh3t",1334022496069283840,https://www.aljazeera.com/features/2020/12/1/pakistan-lahore-orange-train,Wed Dec 02 06:32:02 +0000 2020
0,AJEnglish,"India, Pakistan trade barbs over ‘OIC resolution’ on Kashmir https://t.co/yG0A7nlmAf",1334025781153034241,https://www.aljazeera.com/news/2020/12/1/india-pakistan-trade-barbs-over-oic-resolution-on-kashmir?taid=5fc737f19870190001e52ebe&utm_campaign=trueAnthem%3A+Trending+Content&utm_medium=trueAnthem&utm_source=twitter,Wed Dec 02 06:45:05 +0000 2020
0,AJEnglish,BREAKING: UK becomes first country in the world to approve Pfizer-BioNTech COVID-19 vaccine for use https://t.co/NYq24YsVhh https://t.co/RZsxzJrkyF,1334034321640919042,https://www.aljazeera.com/news/2020/12/2/uk-approves-pfizer-biontech-vaccine-for-use-first-in-the-world,Wed Dec 02 07:19:02 +0000 2020
0,AJEnglish,"'Very good news'

The UK gov't says it will roll out the Pfizer-BioNTech COVID-19 vaccine from next week https://t.co/J4ls7rAumq https://t.co/sHi8XnIUAU",1334036015602937857,https://www.aljazeera.com/news/2020/12/2/uk-approves-pfizer-biontech-vaccine-for-use-first-in-the-world,Wed Dec 02 07:25:45 +0000 2020
0,AJEnglish,"""Death threats, physical threats, intimidation, it's too much."" 

A Georgia official calls for an end to threats of… https://t.co/d8Vx7IwgTa",1334040856966410242,https://twitter.com/i/web/status/1334040856966410242,Wed Dec 02 07:45:00 +0000 2020
0,AJEnglish,"BREAKING: Hong Kong activist Joshua Wong jailed for 13.5 months over 2019 'illegal assembly'. Wong to be jailed alongside Agnes Chow, Ivan Lam https://t.co/JsthHaO4YK https://t.co/VOlx7Cyy2P",1334043186772242432,https://www.aljazeera.com/news/2020/12/2/joshua-wong-jailed-for-xx-years-over-2019-illegal-assembly,Wed Dec 02 07:54:15 +0000 2020
0,AJEnglish,Hong Kong sentences 24-year-old pro-democracy activist Joshua Wong to prison after pleading guilty to organising and inciting 'unauthorised assembly' https://t.co/6n0qbvmguU https://t.co/GBbNYcneWP,1334051878280237056,https://www.aljazeera.com/news/2020/12/2/joshua-wong-jailed-for-xx-years-over-2019-illegal-assembly,Wed Dec 02 08:28:47 +0000 2020
0,AJEnglish,"President-elect Joe Biden is seen wearing a protective boot on his foot, which he fractured while playing with one… https://t.co/cSCwc6hn5X",1334052181981458433,https://twitter.com/i/web/status/1334052181981458433,Wed Dec 02 08:30:00 +0000 2020
0,AJEnglish,Uganda's Bobi Wine suspends election campaign over violence https://t.co/tLusJCsGjZ https://t.co/aavSPgzfLQ,1334058080951283714,https://www.aljazeera.com/news/2020/12/2/uganda-bobi-wine-suspends-election-campaign-over-violence,Wed Dec 02 08:53:26 +0000 2020
0,AJEnglish,Many say Macron's rightward shift will not bring him any closer to pinching support from Le Pen’s stronghold base. https://t.co/FliovXo7KI,1334059760191213569,https://www.aljazeera.com/features/2020/11/30/is-frances-emmanuel-macron-pandering-to-the-far-right,Wed Dec 02 09:00:07 +0000 2020
0,AJEnglish,New Zealand has declared a “climate emergency” and pledges a carbon-neutral gov't by 2025 https://t.co/qzflmrt2XQ https://t.co/NidD0euiDt,1334063532820865030,https://www.aljazeera.com/news/2020/12/2/new-zealand-declares-climate-emergency,Wed Dec 02 09:15:06 +0000 2020
0,AJEnglish,"“This one-sided game is over.” 

Iran’s parliament votes to stop allowing IAEA inspections of its nuclear facilitie… https://t.co/GVYNGkKeUn",1334067281513615362,https://twitter.com/i/web/status/1334067281513615362,Wed Dec 02 09:30:00 +0000 2020
0,AJEnglish,Nike Japan advertisement against bullying and racism faces backlash and calls to boycott company https://t.co/7y8Bl3ubit https://t.co/0HSWlPVBWD,1334071075941085184,https://www.aljazeera.com/news/2020/12/2/nike-japan-causes-backlash-due-to-diversity-ad-campaign-on-racism,Wed Dec 02 09:45:05 +0000 2020
0,AJEnglish,India accuses Canada's Trudeau of interfering in its internal affairs after comments on the ongoing farmers’ protests https://t.co/DIZj1u3iOr https://t.co/JCLiaponcQ,1334076490691055617,https://www.aljazeera.com/news/2020/12/2/canada-pm-voices-solidarity-with-farmers-india-says-unwarranted,Wed Dec 02 10:06:35 +0000 2020
0,AJEnglish,"RT @AJEnglish: Thread🧵

Physical distancing and quarantining have been vital to beating this pandemic. But the COVID-19 lockdowns have also revealed the extent of another hidden public health issue - loneliness. 

Find out more with @hey_alirae in episode 2 of #AllHailTheLockdown 👇 https://t.co/P0RZNil4AhThread🧵

Physical distancing and quarantining have been vital to beating this pandemic. But the COVID-19 lockdowns… https://t.co/48R9Gs34FC",1334083621523746816,https://twitter.com/i/web/status/1333801489941237762,Wed Dec 02 10:34:56 +0000 2020
0,AJEnglish,"UN Security Council unlikely to act on killing of Iranian scientist, diplomats say https://t.co/d4JkdEe3Vm https://t.co/2DLUTMdTVU",1334086155361341441,https://www.aljazeera.com/news/2020/12/2/unsc-unlikely-to-act-on-killing-of-iranian-scientist-diplomats,Wed Dec 02 10:45:00 +0000 2020
0,AJEnglish,"From the first Black British supermodel, to one of the earliest Black African writers in Europe - we explore the lives of five Black Britons whose stories are rarely told 👉 https://t.co/dYxQmA5lhK https://t.co/XCDqboojhc",1334089964108320769,https://www.aljazeera.com/features/2020/12/2/five-black-british-figures-history-forgets,Wed Dec 02 11:00:08 +0000 2020
0,AJEnglish,"The UK ordered enough COVID-19 vaccine doses to inoculate 20 million people. 

With the roll out expected from next week, here's all you need to know about Pfizer-BioNTech's vaccine https://t.co/HJ4nCC5Y6J https://t.co/9VTgJsHBN7",1334095201061777408,https://www.aljazeera.com/news/2020/12/2/pfizer-biontech-vaccine-in-uk-what-you-need-to-know-in-500-words,Wed Dec 02 11:20:56 +0000 2020
0,AJEnglish,UN says it signed a deal with Ethiopia’s gov't to allow “unimpeded” humanitarian access to embattled Tigray region https://t.co/80f53493wm https://t.co/rEevT15vWF,1334101296266227712,https://www.aljazeera.com/news/2020/12/2/un-says-deal-signed-with-ethiopia-for-aid-access-to-tigray-ap,Wed Dec 02 11:45:10 +0000 2020
0,AJEnglish,We hear from Ethiopian refugees who have fled their homes to shelter in makeshift camps in Sudan ⬇️ https://t.co/bQtrProgbE,1334103555180023809,,Wed Dec 02 11:54:08 +0000 2020
0,AJEnglish,Here's a look at President-elect Joe Biden's all-women senior White House communications team https://t.co/jH255sfCmy https://t.co/ln5Vj1Cl5K,1334105221396639744,https://www.aljazeera.com/news/2020/11/30/biden-names-all-female-senior-communications-team,Wed Dec 02 12:00:45 +0000 2020
0,AJEnglish,⚡️Stories you shouldn't miss today - December 2👇 https://t.co/qQ54tTDNDk,1334108830343507969,https://twitter.com/i/events/1334106801843937281,Wed Dec 02 12:15:06 +0000 2020
0,AJEnglish,The moment it was announced the UK would be the first country to approve Pfizer-BioNTech’s COVID-19 vaccine for wid… https://t.co/Mpxq9Mmy0x,1334112914911932417,https://twitter.com/i/web/status/1334112914911932417,Wed Dec 02 12:31:20 +0000 2020
0,AJEnglish,"The UK is set to roll out Pfizer-BioNTech's vaccine next week.

For all COVID-19 news, follow our coverage here ➡️ https://t.co/BZbhPwekTs https://t.co/kXAQz9SMTP",1334116801005940737,https://www.aljazeera.com/tag/coronavirus-pandemic/,Wed Dec 02 12:46:46 +0000 2020
0,AJEnglish,How animal attacks take their toll in Kashmir — in pictures https://t.co/JWKbxQeiYI https://t.co/yvEkWKjI5x,1334120172840493056,https://www.aljazeera.com/gallery/2020/12/2/in-pictures-animal-attacks-taking-their-toll-in-kashmir/,Wed Dec 02 13:00:10 +0000 2020
