,name,text,id,url,created_at
0,TechCrunch,Startup brands like the shoe company Thousand Fell are bringing circular economics to the fashion industry https://t.co/tQ7SCeqGDK by @jshieber,1323096247704707073,https://techcrunch.com/2020/11/01/startup-brands-like-the-shoe-company-thousand-fell-are-bringing-circular-economics-to-the-fashion-industry/?tpcc=ECTW2020,Mon Nov 02 02:55:02 +0000 2020
0,TechCrunch,Tencent claims record 100M daily users on mobile game Honor of Kings https://t.co/zx7bbKnpiQ by @ritacyliao,1323104852944236557,https://techcrunch.com/2020/11/01/tencent-claims-record-100m-daily-users-on-mobile-game-honor-of-kings/?tpcc=ECTW2020,Mon Nov 02 03:29:13 +0000 2020
0,TechCrunch,Warren raises $1.4 million to help regional cloud infrastructure providers compete against Amazon and other giants https://t.co/fLKNYz9SBR by @catherineshu,1323142832023097345,https://techcrunch.com/2020/11/01/warren-gets-1-4-million-to-help-local-cloud-infrastructure-providers-compete-against-the-giants/?tpcc=ECTW2020,Mon Nov 02 06:00:08 +0000 2020
0,TechCrunch,Raspberry Pi Foundation announces the cute little Raspberry Pi 400 https://t.co/aiL6J4PRfK by @romaindillet,1323173316258127872,https://techcrunch.com/2020/11/02/raspberry-pi-foundation-announces-the-cute-little-raspberry-pi-400/?tpcc=ECTW2020,Mon Nov 02 08:01:16 +0000 2020
0,TechCrunch,Walmart's PhonePe zips past Google Pay in India as UPI tops 2B monthly transactions https://t.co/coZn7bB5Fb by @refsrc,1323179749993308165,https://techcrunch.com/2020/11/02/walmarts-phonepe-zips-past-google-pay-in-india-as-upi-tops-2-billion-monthly-transactions/?tpcc=ECTW2020,Mon Nov 02 08:26:50 +0000 2020
0,TechCrunch,Starling Bank founder Anne Boden says new book 'isn't a memoir' https://t.co/QVxv6gp4rx by @sohear,1323208728720658433,https://techcrunch.com/2020/11/02/anne-boden-discusses-banking-on-it-and-why-she-decided-to-go-public-with-her-story/?tpcc=ECTW2020,Mon Nov 02 10:21:59 +0000 2020
0,TechCrunch,UK's Marshmallow raises $30M on a $310M valuation for more 'inclusive' car insurance https://t.co/t8a43tHZMq by @ingridlunden,1323209773593038850,https://techcrunch.com/2020/11/02/uks-marshmallow-raises-30m-on-a-310m-valuation-for-more-inclusive-car-insurance/?tpcc=ECTW2020,Mon Nov 02 10:26:08 +0000 2020
0,TechCrunch,UK report spotlights the huge investment gap facing diverse founders https://t.co/9lCP7fPb22 by @riptari,1323244028855492608,https://techcrunch.com/2020/11/02/uk-report-spotlights-the-huge-investment-gap-facing-diverse-founders/?tpcc=ECTW2020,Mon Nov 02 12:42:15 +0000 2020
0,TechCrunch,Leena AI nabs $8M Series as it expands from chatbots to HR service platform https://t.co/VQIeq3oxLW by @ron_miller,1323278937699602434,https://techcrunch.com/2020/11/02/leena-ai-nabs-8m-series-as-it-expands-from-chatbots-to-hr-service-platform/?tpcc=ECTW2020,Mon Nov 02 15:00:58 +0000 2020
0,TechCrunch,Email creation startup Stensul raises $16M https://t.co/q1bbLT9Wrh by @anthonyha,1323282616355872775,https://techcrunch.com/2020/11/02/stensul-series-b/?tpcc=ECTW2020,Mon Nov 02 15:15:35 +0000 2020
0,TechCrunch,MIT develops a battery-free method for navigating underwater that could transform ocean exploration https://t.co/TXYkY9qcqt by @etherington,1323288222970060803,https://techcrunch.com/2020/11/02/mit-develops-a-battery-free-method-for-navigating-underwater-that-could-transform-ocean-exploration/?tpcc=ECTW2020,Mon Nov 02 15:37:52 +0000 2020
0,TechCrunch,Fortnite will be available for PlayStation 5 and Xbox Series X/S at launch https://t.co/tKZVYnlpFU by @bheater,1323288270453788674,https://techcrunch.com/2020/11/02/fortnite-will-be-available-for-playstation-5-and-xbox-series-x-s-at-launch/?tpcc=ECTW2020,Mon Nov 02 15:38:03 +0000 2020
0,TechCrunch,Haystack News adds 16 live news channels ahead of Election Day https://t.co/PZIrF70RJN by @sarahintampa,1323290789158465538,https://techcrunch.com/2020/11/02/haystack-news-adds-16-live-news-channels-ahead-of-election-day/?tpcc=ECTW2020,Mon Nov 02 15:48:04 +0000 2020
0,TechCrunch,Twilio wraps $3.2B purchase of Segment after warp speed courtship https://t.co/6eBKteSNc9 by @ron_miller,1323292839552421898,https://techcrunch.com/2020/11/02/twilio-wraps-3-2b-purchase-of-segment-after-warp-speed-courtship/?tpcc=ECTW2020,Mon Nov 02 15:56:13 +0000 2020
0,TechCrunch,Pandemic's impact disproportionately reduced VC funding for female founders https://t.co/WpknPwum9a by @alex and @nmasc_,1323294918828265473,https://techcrunch.com/2020/11/02/pandemics-impact-disproportionately-reduced-vc-funding-for-female-founders/?tpcc=ECTW2020,Mon Nov 02 16:04:28 +0000 2020
0,TechCrunch,"The Station: Waymo makes it safety case, AV partnerships abound and the rising cost of FSD https://t.co/OX4yMya2v6 by @kirstenkorosec",1323296899403862019,https://techcrunch.com/2020/11/02/the-station-waymo-makes-it-safety-case-av-partnerships-abound-and-the-rising-cost-of-fsd/?tpcc=ECTW2020,Mon Nov 02 16:12:21 +0000 2020
0,TechCrunch,TVision raises $16M to measure viewer attention on connected TVs https://t.co/6uWgoS1sZe by @anthonyha,1323297773027053568,https://techcrunch.com/2020/11/02/tvision-funding/?tpcc=ECTW2020,Mon Nov 02 16:15:49 +0000 2020
0,TechCrunch,Find out how Relativity Space will launch their first 3D printed Terran-1 rocket at our space-focused event this December https://t.co/g9J2d4iPfg by @techcrunch,1323299346289434624,https://techcrunch.com/2020/11/02/relativity-spaces-tim-ellis-is-coming-to-tc-sessions-space-2020/?tpcc=ECTW2020,Mon Nov 02 16:22:04 +0000 2020
0,TechCrunch,Bridgefy launches end-to-end encrypted messaging for the app used during protests and disasters https://t.co/WB5KWdKh6Z by @mikebutcher,1323308220472004608,https://techcrunch.com/2020/11/02/bridgefy-launches-end-to-end-encrypted-messaging-for-the-app-used-during-protests-and-disasters/?tpcc=ECTW2020,Mon Nov 02 16:57:20 +0000 2020
0,TechCrunch,Lidar startup Aeva to go public via $2.1 billion SPAC merger https://t.co/s2KI9gJl80 by @kirstenkorosec,1323310724836413440,https://techcrunch.com/2020/11/02/lidar-startup-aeva-to-go-public-via-2-1-billion-spac-merger/?tpcc=ECTW2020,Mon Nov 02 17:07:17 +0000 2020
0,TechCrunch,Coupa Software snags Llamasoft for $1.5B to bring together spending and supply chain data https://t.co/2wvDMMygXD by @ron_miller,1323316282905796610,https://techcrunch.com/2020/11/02/coupa-software-snags-llamasoft-for-1-5b-to-bring-together-spending-and-supply-chain-data/?tpcc=ECTW2020,Mon Nov 02 17:29:22 +0000 2020
0,TechCrunch,Join Greylock’s Asheem Chandna this week on November 5 at Noon PST/3 pm EST to discuss the future of enterprise and cybersecurity investing https://t.co/XxRjrDkmya,1323318473590714369,https://techcrunch.com/2020/10/30/join-greylocks-asheem-chandna-on-november-5-at-noon-pst-3-pm-est-8-pm-gmt-to-discuss-the-future-of-enterprise-and-cybersecurity-investing/?tpcc=ECTW2020,Mon Nov 02 17:38:04 +0000 2020
0,TechCrunch,Spotify will now allow artists and labels promote tracks in your recommendations https://t.co/RG5VvvdPJo by @sarahintampa,1323324050496770059,https://techcrunch.com/2020/11/02/spotify-will-now-allow-artists-and-labels-promote-tracks-in-your-recommendations/?tpcc=ECTW2020,Mon Nov 02 18:00:14 +0000 2020
0,TechCrunch,Booming edtech M&amp;A activity brings consolidation to a fragmented sector https://t.co/aSKojIamxS by @nmasc_,1323326746079514624,https://techcrunch.com/2020/11/02/booming-edtech-ma-activity-brings-consolidation-to-a-fragmented-sector/?tpcc=ECTW2020,Mon Nov 02 18:10:57 +0000 2020
0,TechCrunch,"Maze, a notorious ransomware group blamed for attacks on Xerox, Canon, and LG, says it's shutting down. But security experts aren't celebrating just yet. 

https://t.co/IfmDX1DaEP",1323329682394259458,https://techcrunch.com/2020/11/02/maze-ransomware-group-shutting-down/,Mon Nov 02 18:22:37 +0000 2020
0,TechCrunch,Aina is an AI powered smart ring device for your smartphone. https://t.co/oC85fhfem5,1323333518127112192,,Mon Nov 02 18:37:51 +0000 2020
0,TechCrunch,YC-backed nonprofit VotingWorks wants to rebuild trust in election systems through open source https://t.co/PwwlxsnQhb by @dannycrichton,1323333844490199042,https://techcrunch.com/2020/11/02/votingworks/?tpcc=ECTW2020,Mon Nov 02 18:39:09 +0000 2020
0,TechCrunch,Scaleway launches cloud instances that cost $2.10 per month https://t.co/d5EFxAKAMY by @romaindillet,1323333844750213130,https://techcrunch.com/2020/11/02/scaleway-launches-cloud-instances-that-cost-2-10-per-month/?tpcc=ECTW2020,Mon Nov 02 18:39:09 +0000 2020
0,TechCrunch,Spotify will now allow artists and labels to promote tracks in your recommendations https://t.co/qZ2BFTDdp4 by @sarahintampa,1323336833959256065,https://techcrunch.com/2020/11/02/spotify-will-now-allow-artists-and-labels-promote-tracks-in-your-recommendations/,Mon Nov 02 18:51:02 +0000 2020
0,TechCrunch,Rocket Lab's next launch will deliver 30 satellites to orbit - and a 3D-printed gnome from Gabe Newell https://t.co/OdDdeqNxNv | by Devin Coldewey,1323343973067464707,https://techcrunch.com/2020/11/02/rocket-labs-next-launch-will-deliver-30-satellites-to-orbit-and-a-3d-printed-gnome-from-gabe-newell/?tpcc=ECTW2020,Mon Nov 02 19:19:24 +0000 2020
0,TechCrunch,NerdWallet acquires small business loan marketplace Fundera https://t.co/rlAyARyqi7 by @anthonyha,1323358140432338946,https://techcrunch.com/2020/11/02/nerdwallet-acquires-fundera/?tpcc=ECTW2020,Mon Nov 02 20:15:42 +0000 2020
0,TechCrunch,"Alphabet's X details Project Amber, a quest for a single biomarker for depression that fell short of its goal https://t.co/FIkhSfL76V by @etherington",1323360030628945926,https://techcrunch.com/2020/11/02/alphabets-x-details-project-amber-a-quest-for-a-single-biomarker-for-depression-that-fell-short-of-its-goal/?tpcc=ECTW2020,Mon Nov 02 20:23:12 +0000 2020
0,TechCrunch,What social networks have learned since the 2016 election https://t.co/SMiXLbWkRl by @tayhatmaker,1323368709600235521,https://techcrunch.com/2020/11/02/2020-election-social-media-facebook-twitter-policies/?tpcc=ECTW2020,Mon Nov 02 20:57:42 +0000 2020
0,TechCrunch,"UPI, a four-year-old payments infrastructure built by India's largest banks, processed over 2 billion transactions in October. Walmart's PhonePe emerged as the top payments app in the country, putting an end to Google Pay's streak. 
  https://t.co/azd6Re1beq",1323370487267774464,https://techcrunch.com/2020/11/02/walmarts-phonepe-zips-past-google-pay-in-india-as-upi-tops-2-billion-monthly-transactions/,Mon Nov 02 21:04:45 +0000 2020
0,TechCrunch,TikTok strikes new licensing agreement with Sony Music https://t.co/FdpOWCqPJ2 by @sarahintampa,1323370891774955520,https://techcrunch.com/2020/11/02/tiktok-strikes-new-licensing-agreement-with-sony-music/?tpcc=ECTW2020,Mon Nov 02 21:06:22 +0000 2020
0,TechCrunch,"PayPal's earnings don't excite Wall Street, but bring good news for consumer fintech https://t.co/h0wmXHQkjE by @alex",1323391842449313793,https://techcrunch.com/2020/11/02/paypals-earnings-dont-excite-wall-street-but-bring-good-news-for-consumer-fintech/?tpcc=ECTW2020,Mon Nov 02 22:29:37 +0000 2020
