,name,text,id,url,created_at
0,NRO,How the Private Sector Is Shaping the Future of Nuclear Energy | https://t.co/WjW31l5TL8 via Christopher Barnard https://t.co/l7PT2PViFU,1306384881371488256,https://www.nationalreview.com/2020/09/nuclear-energy-private-sector-shaping-future-of-industry/,Thu Sep 17 00:10:01 +0000 2020
0,NRO,"Manhattan’s MoMA, Welcoming Once Again, Seven Days a Week | https://t.co/nrnQkS1eDA via Brian T. Allen https://t.co/EjR1Zq8H3D",1306389955393060865,https://www.nationalreview.com/2020/09/manhattans-moma-welcoming-once-again-seven-days-a-week/,Thu Sep 17 00:30:11 +0000 2020
0,NRO,Biden Tops 50 Percent in Wisconsin Polling Average https://t.co/gBHFjcKtiQ via @McCormackJohn,1306397576309112835,https://www.nationalreview.com/corner/biden-tops-50-percent-in-wisconsin-polling-average/?taid=5f62b52cfeb41b0001c9a954&utm_campaign=trueanthem&utm_medium=social&utm_source=twitter,Thu Sep 17 01:00:28 +0000 2020
0,NRO,Minneapolis City Council Members Complain of Rising Crime Months after Trying to Defund Police Department https://t.co/zqKOVyKB8R https://t.co/xuoz9NK9va,1306405053461389312,https://www.nationalreview.com/news/minneapolis-city-council-members-complain-of-rising-crime-months-after-trying-to-defund-police-department/?taid=5f62bc2252e7ef000110d3fb&utm_campaign=trueanthem&utm_medium=social&utm_source=twitter,Thu Sep 17 01:30:11 +0000 2020
0,NRO,A Surprising Minnesota Poll https://t.co/hTGJblEIgs via @jimgeraghty https://t.co/M0jQzhz3pd,1306412553631936515,https://www.nationalreview.com/the-morning-jolt/a-surprising-minnesota-poll/?taid=5f62c31e52e7ef000110d410&utm_campaign=trueanthem&utm_medium=social&utm_source=twitter,Thu Sep 17 01:59:59 +0000 2020
0,NRO,The Best and Worst of ABC News’ Town Hall with Trump https://t.co/AhobG3CQMW via @isaac_schorr https://t.co/e9PTn3DHfR,1306420224313511936,https://www.nationalreview.com/corner/the-best-and-worst-of-abc-news-town-hall-with-trump/?taid=5f62ca4307638d0001f2a494&utm_campaign=trueanthem&utm_medium=social&utm_source=twitter,Thu Sep 17 02:30:28 +0000 2020
0,NRO,The Helen Reddy Biopic Brings Back a Self-Pitying Hit Parade https://t.co/IhcnPBzCMe via @3xchair https://t.co/kkrtf48RgX,1306435227884171265,https://www.nationalreview.com/2020/09/movie-review-i-am-woman-helen-reddy-biopic-hammers-feminist-cliches/?taid=5f62d83cfeb41b0001c9a9d0&utm_campaign=trueanthem&utm_medium=social&utm_source=twitter,Thu Sep 17 03:30:05 +0000 2020
0,NRO,Trump Should Make Good on His Threat to Ban TikTok https://t.co/8PtO2Kofxv via @james_t_quinn https://t.co/t0kiI3ooOa,1306442951124549634,https://www.nationalreview.com/2020/09/trump-should-make-good-on-his-threat-to-ban-tiktok/?taid=5f62df6dfeb41b0001c9a9f2&utm_campaign=trueanthem&utm_medium=social&utm_source=twitter,Thu Sep 17 04:00:46 +0000 2020
0,NRO,What Merkel Doesn’t Get about Nord Stream 2 https://t.co/HWeCZFHhcT via @james_t_quinn https://t.co/UpmtPzfrvP,1306450882393968645,https://www.nationalreview.com/corner/nord-stream-2-pipeline-german-government-fights-to-protect-deal/?taid=5f62e6d0feb41b0001c9aa15&utm_campaign=trueanthem&utm_medium=social&utm_source=twitter,Thu Sep 17 04:32:17 +0000 2020
0,NRO,Imam of the Grand Mosque in Mecca: We Need to Treat Jews Well! https://t.co/P1uyMDCNSX via @jimgeraghty https://t.co/qk0PitJoic,1306473719792046080,https://www.nationalreview.com/corner/imam-of-the-grand-mosque-in-mecca-we-need-to-treat-jews-well/?taid=5f62fc15feb41b0001c9aa5e&utm_campaign=trueanthem&utm_medium=social&utm_source=twitter,Thu Sep 17 06:03:02 +0000 2020
0,NRO,Does the President Ever Talk to His CDC Director? https://t.co/hPTAHvtLtf via @jimgeraghty https://t.co/gIb2ZGnM78,1306481271984578560,https://www.nationalreview.com/corner/does-the-president-ever-talk-to-his-cdc-director/?taid=5f63031efeb41b0001c9aa74&utm_campaign=trueanthem&utm_medium=social&utm_source=twitter,Thu Sep 17 06:33:03 +0000 2020
0,NRO,The WEIRDest People in the World https://t.co/CruogIMrQr via @RazibKhan https://t.co/RLSyiMbQpG,1306511479458402310,https://www.nationalreview.com/2020/09/book-review-the-weirdest-people-in-the-world-audacious-surprising/?taid=5f631f4007638d0001a77a55&utm_campaign=trueanthem&utm_medium=social&utm_source=twitter,Thu Sep 17 08:33:05 +0000 2020
0,NRO,Minneapolis City Council Members Complain of Rising Crime Months after Trying to Defund Police Department https://t.co/wOYGbb0bUH https://t.co/iPiDNdFzZf,1306526577832927232,https://www.nationalreview.com/news/minneapolis-city-council-members-complain-of-rising-crime-months-after-trying-to-defund-police-department/?taid=5f632d4f52e7ef000154b5b5&utm_campaign=trueanthem&utm_medium=social&utm_source=twitter,Thu Sep 17 09:33:04 +0000 2020
0,NRO,The Best and Worst of ABC News’ Town Hall with Trump https://t.co/tS5a3FOpsN via @isaac_schorr https://t.co/L8s7CDBzva,1306541681307783168,https://www.nationalreview.com/corner/the-best-and-worst-of-abc-news-town-hall-with-trump/?taid=5f633b60feb41b0001c9ab34&utm_campaign=trueanthem&utm_medium=social&utm_source=twitter,Thu Sep 17 10:33:05 +0000 2020
0,NRO,How Biblical Illiteracy Is Ruining the Humanities https://t.co/n14Qet087k https://t.co/vZ7SftKHCe,1306556792294584320,https://www.nationalreview.com/2020/09/higher-education-biblical-illiteracy-ruining-humanities/?taid=5f63497307638d0001a77ae4&utm_campaign=trueanthem&utm_medium=social&utm_source=twitter,Thu Sep 17 11:33:08 +0000 2020
0,NRO,Climate Change Focus Obscures Complexities of Wild Fires https://t.co/BUKkrwxR0n https://t.co/0v4XnueCDi,1306571867084517378,https://www.nationalreview.com/news/california-fires-climate-change-focus-obscures-causes-solutions/?taid=5f63577c52e7ef000154b65e&utm_campaign=trueanthem&utm_medium=social&utm_source=twitter,Thu Sep 17 12:33:02 +0000 2020
0,NRO,What Is Our Constitution? | https://t.co/ZXIElVuqbi via Yuval Levin https://t.co/yaXHKuU87F,1306601465276964864,https://www.nationalreview.com/2020/09/constitution-day-what-is-our-constitution/,Thu Sep 17 14:30:39 +0000 2020
0,NRO,A Real Lifeboat for Main Street | https://t.co/l3aUuqn0dY via George Selgin https://t.co/awgE14zBz8,1306606343973986309,https://www.nationalreview.com/2020/09/a-real-lifeboat-for-main-street/,Thu Sep 17 14:50:02 +0000 2020
0,NRO,Is J. K. Rowling’s New Book ‘Transphobic’? | https://t.co/gHPLufNFzC via @madeleinekearns https://t.co/4C2Iv6nblx,1306611376056606721,https://www.nationalreview.com/2020/09/jk-rowling-new-book-troubled-blood-not-transphobic/,Thu Sep 17 15:10:02 +0000 2020
0,NRO,A Skidmore Professor Defends His Reputation | https://t.co/xYrafxgR1X via @JohnCFLoftus1 https://t.co/fUR1L65QJo,1306616407451414530,https://www.nationalreview.com/2020/09/skidmore-college-professor-david-peterson-defends-his-reputation-against-student-smear-campaign/,Thu Sep 17 15:30:01 +0000 2020
0,NRO,The Last Days of Robin Williams | https://t.co/p7kkoVpDaT via @rkylesmith https://t.co/YbqU60lcr2,1306621444588212225,https://www.nationalreview.com/2020/09/movie-review-robins-wish-robin-williams-documentary-offers-closure-for-fans/,Thu Sep 17 15:50:02 +0000 2020
0,NRO,Inflation Dashboard: Turkey’s Travails | https://t.co/hUD2FTStdM via Steve H. Hanke https://t.co/oMBEZ93YIG,1306626495520141317,https://www.nationalreview.com/2020/09/inflation-dashboard-turkeys-travails/,Thu Sep 17 16:10:07 +0000 2020
0,NRO,Shinzo Abe’s Secure and Enduring Legacy | https://t.co/xO0OFrO2Uy via Isaac Schorr https://t.co/r0QXLAMSZs,1306631637950697473,https://www.nationalreview.com/2020/09/shinzo-abe-legacy-secure-and-enduring/,Thu Sep 17 16:30:33 +0000 2020
0,NRO,Why Trump’s Mideast Peace Deals Matter | https://t.co/F7QHqXyrlz via @davidharsanyi https://t.co/bBGEgZWZuZ,1306636540794359814,https://www.nationalreview.com/2020/09/middle-east-politics-trump-diplomacy-works/,Thu Sep 17 16:50:02 +0000 2020
0,NRO,Democrats Promise to Be Sore (and Violent) Losers | https://t.co/qDGyPlnTMX via @michaelbd https://t.co/qhICL9snGN,1306641574261129220,https://www.nationalreview.com/2020/09/2020-election-democrats-promise-to-be-sore-violent-losers/,Thu Sep 17 17:10:02 +0000 2020
0,NRO,How Biblical Illiteracy Is Ruining the Humanities | https://t.co/F8remDaznq via Luther Ray Abel https://t.co/RDlLPnGt00,1306651649751080961,https://www.nationalreview.com/2020/09/higher-education-biblical-illiteracy-ruining-humanities/,Thu Sep 17 17:50:04 +0000 2020
0,NRO,What Is Our Constitution? | https://t.co/ZXIElVuqbi via Yuval Levin https://t.co/wAcSdbRHQ8,1306661743339372550,https://www.nationalreview.com/2020/09/constitution-day-what-is-our-constitution/,Thu Sep 17 18:30:10 +0000 2020
0,NRO,A Real Lifeboat for Main Street | https://t.co/l3aUuqn0dY via George Selgin https://t.co/IujrpZrccn,1306666744132575234,https://www.nationalreview.com/2020/09/a-real-lifeboat-for-main-street/,Thu Sep 17 18:50:03 +0000 2020
0,NRO,A Skidmore Professor Defends His Reputation | https://t.co/xYrafxgR1X via @JohnCFLoftus1 https://t.co/A1fFDWqpEN,1306676827562409990,https://www.nationalreview.com/2020/09/skidmore-college-professor-david-peterson-defends-his-reputation-against-student-smear-campaign/,Thu Sep 17 19:30:07 +0000 2020
0,NRO,The Last Days of Robin Williams | https://t.co/p7kkoVpDaT via @rkylesmith https://t.co/kgjgabLIik,1306681839889846273,https://www.nationalreview.com/2020/09/movie-review-robins-wish-robin-williams-documentary-offers-closure-for-fans/,Thu Sep 17 19:50:02 +0000 2020
0,NRO,Shinzo Abe’s Secure and Enduring Legacy | https://t.co/xO0OFrO2Uy via Isaac Schorr https://t.co/hXU5uDhLgz,1306691943896940545,https://www.nationalreview.com/2020/09/shinzo-abe-legacy-secure-and-enduring/,Thu Sep 17 20:30:11 +0000 2020
0,NRO,Why Trump’s Mideast Peace Deals Matter | https://t.co/F7QHqXyrlz via @davidharsanyi https://t.co/krfm2FGgUi,1306696940302856197,https://www.nationalreview.com/2020/09/middle-east-politics-trump-diplomacy-works/,Thu Sep 17 20:50:02 +0000 2020
0,NRO,Democrats Promise to Be Sore (and Violent) Losers | https://t.co/qDGyPlnTMX via @michaelbd https://t.co/c1qokxzIVF,1306701972955975680,https://www.nationalreview.com/2020/09/2020-election-democrats-promise-to-be-sore-violent-losers/,Thu Sep 17 21:10:02 +0000 2020
0,NRO,Interfering with Brexit | https://t.co/u6EpPOSj9V via @madeleinekearns https://t.co/bxOumWv8tv,1306707010822569991,https://www.nationalreview.com/2020/09/brexit-american-european-globalists-interfere-with-deal/,Thu Sep 17 21:30:03 +0000 2020
0,NRO,How Biblical Illiteracy Is Ruining the Humanities | https://t.co/F8remDaznq via Luther Ray Abel https://t.co/R8srzxbnJp,1306712041739169793,https://www.nationalreview.com/2020/09/higher-education-biblical-illiteracy-ruining-humanities/,Thu Sep 17 21:50:02 +0000 2020
0,NRO,RT @NRWire: Romney Slams GOP’s ‘Political’ Hunter Biden Probe: ‘Not the Legitimate Role of Government’ | https://t.co/GVYC6BLJpr https://t.co/K8qj0rfHQO,1306713466871439362,https://www.nationalreview.com/news/romney-says-gops-political-hunter-biden-burisma-probe-not-the-legitimate-role-of-government/,Thu Sep 17 21:55:42 +0000 2020
0,NRO,"RT @NRWire: Nashville Mayor’s Office, Health Department Concealed Low COVID Numbers Tied to Restaurants, Emails Show | https://t.co/b9IC1eRDh1 https://t.co/2o2cdAvTTu",1306713490799783936,https://www.nationalreview.com/news/nashville-mayors-office-health-department-concealed-low-covid-numbers-tied-to-restaurants-emails-show/,Thu Sep 17 21:55:48 +0000 2020
0,NRO,RT @NRWire: Trump Administration Wants U.S. Investors to Hold Majority Stake in TikTok | https://t.co/dPBSAY4DYm https://t.co/GzVXytGeBB,1306713505387761666,https://www.nationalreview.com/news/trump-administration-wants-u-s-investors-to-hold-majority-stake-in-tiktok/,Thu Sep 17 21:55:51 +0000 2020
0,NRO,Helvexit? | https://t.co/clYxZLtfr5 via Kevin D. Williamson https://t.co/hivDZyzDQM,1306722133045899264,https://www.nationalreview.com/2020/09/helvexit/,Thu Sep 17 22:30:08 +0000 2020
0,NRO,A Nashville Restriction Eats Away at Public Trust Like Acid | https://t.co/TdxlzH216d via @jimgeraghty https://t.co/3XYefQ8Nxo,1306727141212598277,https://www.nationalreview.com/corner/a-nashville-restriction-eats-away-at-public-trust-like-acid/,Thu Sep 17 22:50:02 +0000 2020
0,NRO,How American Journalism Died | https://t.co/o44pjDg9br via @VDHanson https://t.co/Mk0Gskf3x5,1306732172930437121,https://www.nationalreview.com/2020/09/how-american-journalism-died/,Thu Sep 17 23:10:02 +0000 2020
0,NRO,The Capital Note: Forward Guidance &amp; the Fate of Cities | https://t.co/XUKURguFOk via @TenreiroDaniel &amp; @AStuttaford https://t.co/qXJz8gFUxV,1306737213070336001,https://www.nationalreview.com/2020/09/the-capital-note-forward-guidance-the-fate-of-cities/,Thu Sep 17 23:30:04 +0000 2020
