,name,text,id,url,created_at
0,Slate,It never reached the White House. https://t.co/FimXWJte11,1307469793143001089,https://slate.com/news-and-politics/2020/09/letter-poison-ricin-white-house-trump-texas.html?via=rss_socialflow_twitter,Sun Sep 20 00:01:04 +0000 2020
0,Slate,"Mr. Centrism is now behind legalized weed, mass student debt forgiveness, and the Green New Deal. What? https://t.co/rpAmvTSMNU",1307473373598019591,https://slate.com/business/2020/09/chuck-schumer-is-a-lefty-now.html?via=rss_socialflow_twitter,Sun Sep 20 00:15:18 +0000 2020
0,Slate,Amy Coney Barrett has written a remarkable number of opinions that harm unpopular and powerless individuals. https://t.co/GFUIuuvo2z,1307476609146945536,https://slate.com/news-and-politics/2020/09/amy-coney-barrett-ginsburg-scotus-future.html?via=rss_socialflow_twitter,Sun Sep 20 00:28:10 +0000 2020
0,Slate,Two-thirds of Americans support a woman’s right to choose. https://t.co/WvDf2H9DUE,1307480015626530817,https://slate.com/news-and-politics/2020/09/majority-americans-support-abortion-access.html?via=rss_socialflow_twitter,Sun Sep 20 00:41:42 +0000 2020
0,Slate,“She was an indomitable spirit … that’s how she got to where she was.” https://t.co/VwpBuaWjQQ,1307486623215562753,https://slate.com/news-and-politics/2020/09/ruth-bader-ginsburg-retirement-question.html?via=rss_socialflow_twitter,Sun Sep 20 01:07:57 +0000 2020
0,Slate,"Principles will never stop him, but political realities still might. https://t.co/Gsr6Y8e3Jb",1307489986510548992,https://slate.com/news-and-politics/2020/09/mitch-mcconnell-senate-votes-ginsburg-supreme-court.html?via=rss_socialflow_twitter,Sun Sep 20 01:21:19 +0000 2020
0,Slate,“A great Justice; a woman of valour; a rock of righteousness.” https://t.co/6G0CWQUQW4,1307491427065176069,https://slate.com/news-and-politics/2020/09/justice-breyer-poem-honor-friend-ruth-bader-ginsburg.html?via=rss_socialflow_twitter,Sun Sep 20 01:27:02 +0000 2020
0,Slate,#DearPrudie: I frequently ask to speak to managers and write strongly worded letters. https://t.co/29CuXCyPIu,1307493435230879744,https://slate.com/human-interest/2020/09/dear-prudence-am-i-a-karen.html?via=rss_socialflow_twitter,Sun Sep 20 01:35:01 +0000 2020
0,Slate,Everything you need to know about televising games in a bubble. https://t.co/dYBOrmv9d3,1307495460039544832,https://slate.com/culture/2020/09/all-of-your-nba-playoffs-broadcasting-questions-answered.html?via=rss_socialflow_twitter,Sun Sep 20 01:43:04 +0000 2020
