,text,notes,date
/impossible-beirut-port-blast-caused-070907837.html,"'Impossible' that Beirut port blast was caused by Hezbollah arms, says presidentReuters",,20200819-0700
/biden-campaign-win-over-both-151803221.html,Can the Biden campaign win over both progressive and Republican voters at the DNC?,,20200819-0700
/rot-hell-golden-state-killer-002547621.html,'Rot in hell': 'Golden State Killer' Joseph DeAngelo faces his victims in court on first day of sentencing hearings,,20200819-0700
/golden-state-killer-survivors-prepare-100035044.html,Golden State Killer: survivors of Joseph DeAngelo's crimes speak out in courtThe Guardian,,20200819-0700
/golden-state-killer-east-area-rapist-victim-impact-165000046.html,Golden State Killer Rape Survivors And Family Give Heartbreaking Impact StatementsHuffPost,,20200819-0700
/james-comey-led-controversial-fbi-215603344.html,"James Comey, who led controversial FBI probe into Hillary Clinton's emails, wears 'Elect More Women' T-shirt",,20200819-0700
/judge-hear-arguments-richmond-lee-131116390.html,No immediate ruling on motion to dismiss Lee statue lawsuit,,20200819-0700
/trump-admits-moving-us-embassy-093504407.html,Trump admits moving US embassy from Tel Aviv to Jerusalem was ‘for the evangelicals’,,20200819-0700
/american-released-lebanon-jailed-months-124301928.html,American released from Lebanon after jailed for months dies,,20200819-0700
/nyc-mayor-move-13-000-161712523.html,"NYC mayor to move 13,000 homeless out of Manhattan hotels after residents' complaints",,20200819-0700
/guardian-angels-step-help-york-182518057.html,Guardian Angels step in to help New York neighborhoods overrun by homeless living in boutique hotelsFOX News Videos,,20200819-0700
/protest-held-over-plan-turn-170346530.html,"Hundreds protest to turn Long Island hotel into homeless shelter
      WABC – NY",,20200819-0700
/notre-dames-president-insisted-person-225500915.html,"Notre Dame's president insisted in-person classes were 'worth the risk.' A week into the semester, they're shutting down.",,20200819-0700
/biden-reportedly-not-leasing-own-195132963.html,"Biden is reportedly not leasing his own campaign plane, ending a decades-long tradition of presidential candidate jets",,20200819-0700
/democratic-national-convention-5-things-162813422.html,"Bernie, Michelle and … a former GOP gov? What to watch on DNC Night 1NBC News",,20200819-0700
/john-boehner-rather-set-himself-165300969.html,John Boehner would 'rather set himself on fire' than get involved in the 2020 electionThe Week,,20200819-0700
/israeli-german-military-jets-overfly-105628260.html,"Israeli, German military jets overfly Dachau in tribute",,20200819-0700
/pelosi-democrats-willing-cut-covid-183725254.html,Pelosi: Democrats willing to cut COVID-19 bill in half to get a deal,,20200819-0700
/u-official-sees-real-desire-033902114.html,U.S. official sees 'real desire' for smaller coronavirus relief billReuters,,20200819-0700
/senate-republicans-preparing-500b-virus-205507766.html,Senate Republicans preparing $500B virus relief proposalAssociated Press,,20200819-0700
/man-broke-aquatic-center-arizona-162423367.html,"A man broke into an aquatic center in Arizona, got trapped in a water slide support pipe, and died before rescuers could get to him",,20200819-0700
/trump-says-hes-pardoning-susan-142452116.html,"Trump says he's pardoning Susan B. Anthony, who was arrested for illegally voting in 1872",,20200819-0700
/susan-b-anthony-did-she-184827879.html,Who was Susan B Anthony and how did she change America forever?The Independent,,20200819-0700
/trump-honors-100th-anniversary-19th-134035918.html,Trump honors 100th anniversary of 19th Amendment by announcing pardon for Susan B. AnthonyUSA TODAY,,20200819-0700
/us-approves-oil-gas-leasing-134714576.html,"US approves oil, gas leasing plan for Alaska Wildlife refuge",,20200819-0700
/news-move-eu-calls-summit-155043680.html,"News On The Move: EU calls summit for Belarus protesters, Trump to open arctic wildlife refuge, Pepperoni shortageYahoo Finance Video",,20200819-0700
/trump-administration-moves-sell-arctic-031919758.html,Trump Administration Moves To Sell Arctic Wildlife Refuge Oil Leases By Year-EndBenzinga,,20200819-0700
/rapper-filmed-girlfriend-dying-taking-101842227.html,Rapper who filmed girlfriend dying after taking drugs at Bestival has manslaughter conviction overturned,,20200819-0700
/2009-tweet-ellen-degeneres-says-175727335.html,A 2009 tweet in which Ellen DeGeneres says she made an employee 'cry like a baby' resurfaces online amid allegations of the show's 'toxic' culture,,20200819-0700
/kevin-hart-defending-nick-cannon-ellen-degeneres-cancel-culture-220921609.html,"Kevin Hart opens up about why he defended Nick Cannon, Ellen DeGeneres in era of 'cancel culture': 'I know how lonely it gets'Yahoo Celebrity",,20200819-0700
/kevin-hart-learned-forgiveness-experiencing-232755390.html,What Kevin Hart learned about forgiveness after experiencing ‘cancel culture’Yahoo Entertainment,,20200819-0700
/impossible-hezbollah-arms-caused-blast-154636637.html,'Impossible' Hezbollah arms caused blast: Aoun,,20200819-0700
/u-postal-chief-testify-senate-130843732.html,"Trump postal chief pauses service cuts amid outcry, as Democrats ratchet up pressure",,20200819-0700
/maryland-dems-condemn-usps-postmaster-192746950.html,Maryland Dems condemn USPS postmaster generalAssociated Press Videos,,20200819-0700
/reversal-postmaster-general-dejoy-suspends-180600367.html,"As states threaten lawsuits, postmaster general suspends mail-handling changes until after electionABC News",,20200819-0700
/now-best-evidence-yet-everyone-195200113.html,We now have the best evidence yet that everyone develops long-term coronavirus immunity after infection — and it's not just about antibodies,,20200819-0700
/coronavirus-covid19-antibodies-immunity-vaccine-113733252.html,‘Remarkable’ study suggests antibodies do protect against second coronavirus infectionYahoo Style UK,,20200819-0700
/fishing-boat-outbreak-may-offer-145522075.html,Fishing boat outbreak may offer virus immunity insight: studyAFP,,20200819-0700
/dems-put-divides-aside-rally-052513930.html,"It's official: Biden will take on TrumpDemocrats cemented Joe Biden's status as their best hope to defeat President Trump, formally nominating the former VP in an online-only convention.Jill Biden's deeply personal portrait »",,20200819-0730
/sally-yates-ousted-from-doj-over-muslim-ban-says-trump-has-trampled-the-rule-of-law-021148727.html,DOJ official fired by Trump bites back at DNC,,20200819-0730
/jill-biden-joes-strength-of-will-is-unstoppable-042727090.html,Jill Biden makes emotional case for her husband,,20200819-0730
/bill-clinton-democratic-national-convention-dnc-speech-trump-bully-covid-biden-choice-022437972.html,Clinton: It's a clear choice in 2020 election,,20200819-0730
https://news.yahoo.com/dejoy-earned-millions-company-financial-121052964.html,Postmaster made millions from company tied to USPS,,20200819-0730
https://news.yahoo.com/senate-report-points-to-counterintelligence-risk-from-ties-between-trump-campaign-and-russia-184255484.html,Trump's 2016 campaign embraced Russia: Report,,20200819-0730
/rep-alexandria-ocasio-cortez-nominates-bernie-sanders-at-dnc-022239702.html,Rep. Alexandria Ocasio-Cortez nominates Bernie Sanders at DNC,,20200819-0730
/rep-ocasio-cortez-seconds-sanders-060339979.html,Rep. Ocasio-Cortez seconds Sanders nominationAssociated Press Videos,,20200819-0730
/bernie-sanders-made-strongest-possible-033800606.html,Bernie Sanders made the strongest possible argument for a Joe Biden presidencyThe Week,,20200819-0730
/19-old-admitted-blackmail-revenge-171504424.html,"A 19-year-old who admitted to blackmail, revenge porn, and bullying won his primary race for the Kansas House and is now running unopposed",,20200819-0730
/teens-nearly-2-million-narcotics-014525880.html,"Teens with nearly $2 million in narcotics arrested at border, feds say",,20200819-0730
/biden-says-picked-harris-running-004809811.html,Biden says he picked Harris as his running mate because 'the government should look like the country',,20200819-0730
/indians-erect-banners-pray-kamala-154002203.html,"Indians erect banners, pray for Kamala Harris to win U.S. electionReuters",,20200819-0730
/biden-pick-kamala-harris-may-100000900.html,"Biden’s pick of Kamala Harris may appear historic, but how does she help politically?Miami Herald",,20200819-0730
/virginia-consider-reducing-penalty-assaulting-194004013.html,Virginia to consider reducing penalty for assaulting police,,20200819-0730
/sen-john-kennedy-joe-biden-014445865.html,"Sen. John Kennedy: Joe Biden may be the nominee, but Bernie Sanders is the head of the Democratic Party",,20200819-0730
/alexandria-ocasio-cortez-republican-john-195839625.html,Alexandria Ocasio-Cortez and Republican John Kasich trade barbs before they both speak at the Democratic convention,,20200819-0730
/mike-bloomberg-gives-60m-help-144933039.html,Mike Bloomberg gives $60m to help Democrats in November as former campaign aides turn against him,,20200819-0730
/democratic-national-convention-this-wall-street-strategist-isnt-surprised-stocks-hit-a-record-after-day-one-of-dnc-164212456.html,Democratic National Convention: This Wall Street strategist isn't surprised stocks hit a record after day one of DNCYahoo Finance,,20200819-0730
/democratic-convention-put-spotlight-trumps-233725832.html,Democratic convention features pleas for unity and harsh attacks on TrumpLA Times,,20200819-0730
/notre-dames-president-insisted-person-225500915.html,"Notre Dame's president insisted in-person classes were 'worth the risk.' A week into the semester, they're shutting down.",,20200819-0730
/large-earthquake-hits-off-coast-233632117.html,2 strong earthquakes shake western Indonesia; no tsunami,,20200819-0730
/howard-dean-says-enthusiasm-for-biden-doesnt-matter-because-voters-have-had-it-with-trump-213810456.html,Howard Dean says enthusiasm for Biden doesn't matter because voters have 'had it' with Trump,,20200819-0730
/joe-biden-officially-because-democratic-051702942.html,Joe Biden officially becomes the Democratic nominee for presidentCBS News Videos,,20200819-0730
/joe-biden-plan-win-future-041637361.html,Joe Biden Bets on Nostalgia Over Young Rising Stars for DNC’s Night 2The Daily Beast,,20200819-0730
/rapper-filmed-girlfriend-dying-taking-101842227.html,Rapper who filmed girlfriend dying after taking drugs at Bestival has manslaughter conviction overturned,,20200819-0730
/mali-soldiers-detain-senior-officers-113738370.html,Mali's president announces resignation after armed mutiny,,20200819-0730
/gunfire-heard-army-outside-mali-124307674.html,Mali coup leaders pledge new elections after detaining presidentAFP,,20200819-0730
/un-chief-demands-immediate-unconditional-201612913.html,UN chief demands 'immediate and unconditional release' of Mali presidentAFP,,20200819-0730
/tv-networks-reportedly-afraid-giving-212242485.html,"TV networks are reportedly afraid of giving the RNC too much airtime, so they cut the DNC's time short too",,20200819-0730
/first-night-democratic-national-convention-185544393.html,First night of virtual Democratic convention draws 19.7 million viewers on 10 U.S. TV networksReuters,,20200819-0730
https://www.aol.com/article/news/2020/08/17/election-2020-democrats-open-a-new-kind-of-convention/24592315/,Election 2020: Democrats open a new kind of conventionAOL Associated Press,,20200819-0730
/biden-reportedly-not-leasing-own-195132963.html,"Biden is reportedly not leasing his own campaign plane, ending a decades-long tradition of presidential candidate jets",,20200819-0730
/nyc-mayor-move-13-000-161712523.html,"NYC mayor to move 13,000 homeless out of Manhattan hotels after residents' complaints",,20200819-0730
/guardian-angels-step-help-york-182518057.html,Guardian Angels step in to help New York neighborhoods overrun by homeless living in boutique hotelsFOX News Videos,,20200819-0730
/protest-held-over-plan-turn-170346530.html,"Hundreds protest to turn Long Island hotel into homeless shelter
      WABC – NY",,20200819-0730
/elected-reality-tv-star-marco-153233135.html,'You elected a reality TV star': Marco Rubio roasted after criticising DNC for choosing Eva Longoria as host,,20200819-0730
/michelle-obamas-vote-necklace-hit-123029385.html,Michelle Obama’s ‘Vote’ Necklace Was a Hit at the 2020 Democratic National ConventionGlamour,,20200819-0730
/fox-news-chris-wallace-michelle-133300304.html,Fox News' Chris Wallace: Michelle Obama 'sliced and diced' Trump in 'very effective' speechThe Week,,20200819-0730
/uk-data-shows-most-covid-070638258.html,"UK data shows most COVID-19 transmissions happen in homes, minister says",,20200819-0730
/rot-hell-golden-state-killer-002547621.html,'Rot in hell': 'Golden State Killer' Joseph DeAngelo faces his victims in court on first day of sentencing hearings,,20200819-0730
/golden-state-killer-survivors-prepare-100035044.html,Golden State Killer: survivors of Joseph DeAngelo's crimes speak out in courtThe Guardian,,20200819-0730
/golden-state-killer-east-area-rapist-victim-impact-165000046.html,Golden State Killer Rape Survivors And Family Give Heartbreaking Impact StatementsHuffPost,,20200819-0730
/trump-attacked-michelle-obama-citing-153100827.html,"Trump attacked Michelle Obama for citing an outdated COVID-19 death toll in her prerecorded DNC speech — 20,000 more Americans have died since she recorded her speech",,20200819-0730
/michelle-obama-calls-trump-clearly-113344118.html,Michelle Obama Calls Trump 'Clearly in Over His Head' in Democratic National Convention SpeechTime Magazine,,20200819-0730
/michelle-obama-vote-necklace-140402925.html,How To Get Michelle Obama's 'Vote' NecklaceHuffPost Life,,20200819-0730
/man-broke-aquatic-center-arizona-162423367.html,"A man broke into an aquatic center in Arizona, got trapped in a water slide support pipe, and died before rescuers could get to him",,20200819-0730
/florida-republicans-unseat-rep-ross-050421485.html,"Florida Republicans unseat Rep. Ross Spano, nominate far-right activist Laura Loomer, in GOP primaries",,20200819-0730
/tight-primary-races-congress-lead-022648442.html,Tight primary races for Congress will lead to large slate of contested races on Nov. 3Miami Herald,,20200819-0730
/floridians-voting-mail-huge-numbers-101757813.html,Scott Franklin beats US Rep. Spano in Fla. GOP primaryAssociated Press,,20200819-0730
/pelosi-democrats-willing-cut-covid-183725254.html,Pelosi: Democrats willing to cut COVID-19 bill in half to get a deal,,20200819-0730
/u-official-sees-real-desire-033902114.html,U.S. official sees 'real desire' for smaller coronavirus relief billReuters,,20200819-0730
/senate-republicans-preparing-500b-virus-205507766.html,Senate Republicans preparing $500B virus relief proposalAssociated Press,,20200819-0730
/senate-panel-finds-russia-interfered-142307231.html,"Trump campaign's Russia contacts 'grave' threat, Senate says",,20200819-0730
/russia-bitcoin-playing-bit-part-163257407.html,"Russia, With Bitcoin Playing Bit Part, Tried to Hack 2016 US Election, Senate Report FindsCoinDesk",,20200819-0730
/members-trumps-2016-campaign-posed-092301995.html,"Members of Trump's 2016 campaign posed major counterintelligence risk to US, Senate intelligence report saysThe Independent",,20200819-0730
/anderson-cooper-rips-apart-mypillow-192749870.html,Anderson Cooper rips apart MyPillow CEO as a 'snake oil salesman' in jaw-dropping interview,,20200819-0730
/watch-anderson-cooper-tear-apart-201532645.html,"Watch Anderson Cooper Tear Apart This CEO For Peddling A COVID-19 “Cure,” As A TreatRefinery29",,20200819-0730
/sleep-night-anderson-cooper-rips-230437222.html,'How do you sleep at night?: Anderson Cooper rips MyPillow CEO Mike Lindell on COVID 'cure' claimUSA TODAY,,20200819-0730
/dems-put-divides-aside-rally-052513930.html,"It's official: Biden will take on TrumpDemocrats cemented Joe Biden's status as their best hope to defeat President Trump, formally nominating the former VP in an online-only convention.Jill Biden's deeply personal portrait »",,20200819-0800
/sally-yates-ousted-from-doj-over-muslim-ban-says-trump-has-trampled-the-rule-of-law-021148727.html,DOJ official fired by Trump bites back at DNC,,20200819-0800
/jill-biden-joes-strength-of-will-is-unstoppable-042727090.html,Jill Biden makes emotional case for her husband,,20200819-0800
/bill-clinton-democratic-national-convention-dnc-speech-trump-bully-covid-biden-choice-022437972.html,Clinton: It's a clear choice in 2020 election,,20200819-0800
https://news.yahoo.com/dejoy-earned-millions-company-financial-121052964.html,Postmaster made millions from company tied to USPS,,20200819-0800
https://news.yahoo.com/senate-report-points-to-counterintelligence-risk-from-ties-between-trump-campaign-and-russia-184255484.html,Trump's 2016 campaign embraced Russia: Report,,20200819-0800
/biden-says-picked-harris-running-004809811.html,Biden says he picked Harris as his running mate because 'the government should look like the country',,20200819-0800
/watch-2020-democratic-national-convention-213047700.html,How to watch the 2020 Democratic National ConventionCBS News,,20200819-0800
/pioneer-kamala-harris-secret-code-134440618.html,‘Pioneer’: Kamala Harris’s Secret Service code name revealedThe Independent,,20200819-0800
/trump-attacked-michelle-obama-citing-153100827.html,"Trump attacked Michelle Obama for citing an outdated COVID-19 death toll in her prerecorded DNC speech — 20,000 more Americans have died since she recorded her speech",,20200819-0800
/michelle-obama-calls-trump-clearly-113344118.html,Michelle Obama Calls Trump 'Clearly in Over His Head' in Democratic National Convention SpeechTime Magazine,,20200819-0800
/love-michelle-obama-isnt-pure-182653838.html,Your love for Michelle Obama isn't as pure as you thinkThe Independent,,20200819-0800
/19-old-admitted-blackmail-revenge-171504424.html,"A 19-year-old who admitted to blackmail, revenge porn, and bullying won his primary race for the Kansas House and is now running unopposed",,20200819-0800
/german-israeli-air-forces-fly-114219479.html,"German, Israeli air forces fly past 1972 Munich Olympic attack site",,20200819-0800
/teens-nearly-2-million-narcotics-014525880.html,"Teens with nearly $2 million in narcotics arrested at border, feds say",,20200819-0800
/hong-kong-police-commander-no-093330278.html,Hong Kong police commander no longer travelling to UK for training after programme suspended,,20200819-0800
/tv-networks-reportedly-afraid-giving-212242485.html,"TV networks are reportedly afraid of giving the RNC too much airtime, so they cut the DNC's time short too",,20200819-0800
/first-night-democratic-national-convention-185544393.html,First night of virtual Democratic convention draws 19.7 million viewers on 10 U.S. TV networksReuters,,20200819-0800
https://www.aol.com/article/news/2020/08/17/election-2020-democrats-open-a-new-kind-of-convention/24592315/,Election 2020: Democrats open a new kind of conventionAOL Associated Press,,20200819-0800
/egyptian-envoys-gaza-bid-ease-123915417.html,Egyptian envoys leave Gaza after bid to ease Israel tensions,,20200819-0800
/gazas-lone-power-plant-shuts-100247170.html,Gaza's lone power plant shuts down amid tension with IsraelReuters,,20200819-0800
/israeli-planes-bomb-gaza-egyptians-053658998.html,Israel warns Hamas of war as Egypt seeks to ease tensionsAFP,,20200819-0800
/biden-reportedly-not-leasing-own-195132963.html,"Biden is reportedly not leasing his own campaign plane, ending a decades-long tradition of presidential candidate jets",,20200819-0800
/democrats-officially-nominate-joe-biden-025500922.html,"Democrats officially nominate Joe Biden for president, and then have an awkward Zoom partyThe Week",,20200819-0800
/yahoo-news-editor-chief-dan-221850256.html,Yahoo News Editor-in-Chief Dan Klaidman discusses Joe Biden's 2022 campaignYahoo Finance Video,,20200819-0800
/nyc-mayor-move-13-000-161712523.html,"NYC mayor to move 13,000 homeless out of Manhattan hotels after residents' complaints",,20200819-0800
/guardian-angels-step-help-york-182518057.html,Guardian Angels step in to help New York neighborhoods overrun by homeless living in boutique hotelsFOX News Videos,,20200819-0800
/protest-held-over-plan-turn-170346530.html,"Hundreds protest to turn Long Island hotel into homeless shelter
      WABC – NY",,20200819-0800
/notre-dames-president-insisted-person-225500915.html,"Notre Dame's president insisted in-person classes were 'worth the risk.' A week into the semester, they're shutting down.",,20200819-0800
/mauritius-copes-split-japanese-ship-124305205.html,Mauritius copes with split Japanese ship that spilled oil,,20200819-0800
/mauritius-arrests-captain-japanese-ship-135749683.html,Mauritius arrests captain of stricken Japanese oil tankerReuters,,20200819-0800
/japans-nagashiki-apologises-says-supports-064746216.html,"Japan's Nagashiki apologises, says it supports crew after arrests in Mauritius oil spillReuters",,20200819-0800
/first-night-democratic-convention-biden-035039204.html,The First Night of the Democratic Convention Was Like Biden: Disjointed and Emotional,,20200819-0800
/watch-fox-news-coverage-democratic-065303837.html,How to Watch Fox News’ Coverage of the Democratic National Convention Live OnlineThe Wrap,,20200819-0800
/abc-draws-largest-democratic-national-164031241.html,Democratic National Convention Kicks Off Down 27% on 2016Variety,,20200819-0800
/james-comey-led-controversial-fbi-215603344.html,"James Comey, who led controversial FBI probe into Hillary Clinton's emails, wears 'Elect More Women' T-shirt",,20200819-0800
/man-broke-aquatic-center-arizona-162423367.html,"A man broke into an aquatic center in Arizona, got trapped in a water slide support pipe, and died before rescuers could get to him",,20200819-0800
/us-approves-oil-gas-leasing-134714576.html,"US approves oil, gas leasing plan for Alaska Wildlife refuge",,20200819-0800
/news-move-eu-calls-summit-155043680.html,"News On The Move: EU calls summit for Belarus protesters, Trump to open arctic wildlife refuge, Pepperoni shortageYahoo Finance Video",,20200819-0800
/trump-administration-moves-sell-arctic-031919758.html,Trump Administration Moves To Sell Arctic Wildlife Refuge Oil Leases By Year-EndBenzinga,,20200819-0800
/trump-campaigning-battleground-states-during-165242478.html,Trump campaigning in battleground states during week of Democratic National Convention,,20200819-0800
/trump-says-hes-pardoning-susan-142452116.html,"Trump says he's pardoning Susan B. Anthony, who was arrested for illegally voting in 1872",,20200819-0800
/waiting-liberty-podcast-dissects-womens-141700897.html,WAITING FOR LIBERTY podcast dissects the women's suffrage movement with today's prominent scholars.PR Newswire,,20200819-0800
/susan-b-anthony-did-she-184827879.html,Who was Susan B Anthony and how did she change America forever?The Independent,,20200819-0800
/pelosi-democrats-willing-cut-covid-183725254.html,Pelosi: Democrats willing to cut COVID-19 bill in half to get a deal,,20200819-0800
/rapper-filmed-girlfriend-dying-taking-101842227.html,Rapper who filmed girlfriend dying after taking drugs at Bestival has manslaughter conviction overturned,,20200819-0800
/indigenous-activists-clash-un-over-043704032.html,Indigenous activists clash with UN over proposed park,,20200819-0800
/florida-republicans-unseat-rep-ross-050421485.html,"Florida Republicans unseat Rep. Ross Spano, nominate far-right activist Laura Loomer, in GOP primaries",,20200819-0800
/tight-primary-races-congress-lead-022648442.html,Tight primary races for Congress will lead to large slate of contested races on Nov. 3Miami Herald,,20200819-0800
/floridians-voting-mail-huge-numbers-101757813.html,Scott Franklin beats US Rep. Spano in Fla. GOP primaryAssociated Press,,20200819-0800
/eve-hariri-verdict-lebanese-grapple-140306290.html,"On eve of Hariri verdict, Lebanese grapple with new ordeal",,20200819-0800
/beirut-explosion-damage-seen-above-222413850.html,Beirut Explosion Damage Seen From Above in Moving Drone Footage of Lebanon CityInside Edition CBS,,20200819-0800
/impossible-beirut-port-blast-caused-070907837.html,"'Impossible' that Beirut port blast was caused by Hezbollah arms, says presidentReuters",,20200819-0800
/fortnite-files-injunction-against-apple-122524120.html,Fortnite: Epic files new injunction against Apple,,20200819-0800
/fortnite-drama-heats-epic-lose-230000057.html,Fortnite Drama Heats Up: Epic To Lose Apple Dev Accounts | Save StateGamespot Videos,,20200819-0800
/fortnite-maker-seeks-legal-action-195908382.html,Fortnite maker seeks legal action against Apple to stop 'catastrophic' App Store blockThe Telegraph,,20200819-0800
/state-senator-charged-injury-confederate-205241562.html,State senator charged with 'injury' to Confederate monument,,20200819-0800
/timing-confederate-statue-charges-against-192136481.html,"Timing of Confederate statue charges against Black lawmaker 'troubling,' Virginia governor saysNBC News",,20200819-0800
/portsmouth-police-confederate-stephanie-morales-195117452.html,Cops Who Charged Civil Rights Leaders With Felonies Try To Sideline Progressive ProsecutorHuffPost,,20200819-0800
/dems-put-divides-aside-rally-052513930.html,"It's official: Biden will take on TrumpDemocrats cemented Joe Biden's status as their best hope to defeat President Trump, formally nominating the former VP in an online-only convention.Jill Biden's deeply personal portrait »",,20200819-0830
/sally-yates-ousted-from-doj-over-muslim-ban-says-trump-has-trampled-the-rule-of-law-021148727.html,DOJ official fired by Trump bites back at DNC,,20200819-0830
/jill-biden-joes-strength-of-will-is-unstoppable-042727090.html,Jill Biden makes emotional case for her husband,,20200819-0830
