,text,notes,date
/trump-vows-put-toll-cars-233827067.html,Trump vows to put 'toll' on cars coming into US to force Mexico to pay for border wall,,20200819-1100
/trump-campaign-focuses-battleground-states-145551198.html,Trump campaign focuses on battleground states amid DNCFOX News Videos,,20200819-1100
/trump-accepts-endorsement-national-border-222157029.html,"Trump accepts endorsement from National Border Patrol Council, surveys border fence in Yuma, Arizona	FOX News Videos",,20200819-1100
/boeing-offer-another-round-employee-164105005.html,Boeing will offer another round of employee buyouts as its losses pile up amid the coronavirus pandemic,,20200819-1100
/boeing-plans-second-wave-layoffs-141954296.html,Boeing plans second wave of layoffsReuters Videos,,20200819-1100
/boeing-seeks-more-voluntary-layoffs-184831119.html,Boeing seeks more voluntary layoffsAFP,,20200819-1100
/denver-police-look-masked-suspects-005102446.html,Denver police look for masked suspects in fire that killed 5,,20200819-1100
/exclusive-gm-bets-electric-cadillacs-061146928.html,Exclusive: GM bets on electric Cadillacs and micro-vans to reverse China slide,,20200819-1100
https://news.yahoo.com/key-takeaways-from-the-second-night-of-the-democratic-convention-jill-biden-loves-joe-and-so-did-john-mc-cain-045531744.html,"4 takeaways from the 2nd night of the DNCThe old guard came out in force Tuesday, with speeches from Bill Clinton and John Kerry, as well as a video highlighting Joe Biden's friendship with the late John McCain.A nod to the party's rising stars »",,20200819-1130
/jill-biden-joes-strength-of-will-is-unstoppable-042727090.html,Jill Biden makes emotional case for her husband,,20200819-1130
/dems-put-divides-aside-rally-052513930.html,It's official: Biden will take on Trump,,20200819-1130
https://news.yahoo.com/dejoy-earned-millions-company-financial-121052964.html,Postmaster made millions from company tied to USPS,,20200819-1130
https://news.yahoo.com/coronavirus-doctors-battle-another-scourge-121627704.html,Virus doctors battle another scourge: Misinformation,,20200819-1130
/why-trump-and-the-republicans-have-turned-college-football-into-the-new-normandy-173055855.html,College football becomes new 'Normandy' for Trump,,20200819-1130
/mike-bloomberg-gives-60m-help-144933039.html,Mike Bloomberg gives $60m to help Democrats in November as former campaign aides turn against him,,20200819-1130
/democratic-convention-put-spotlight-trumps-233725832.html,Democratic convention features pleas for unity and harsh attacks on TrumpLA Times,,20200819-1130
/dnc-schedule-speakers-watch-democratic-151000595.html,"DNC: Schedule, speakers, and how to watch the Democratic National Convention worksThe Independent",,20200819-1130
/schools-touted-desantis-now-quarantine-081042599.html,Schools Touted by DeSantis Now in a Quarantine Nightmare,,20200819-1130
/biden-says-picked-harris-running-004809811.html,Biden says he picked Harris as his running mate because 'the government should look like the country',,20200819-1130
/joe-biden-officially-becomes-democratic-032952014.html,Joe Biden officially becomes Democratic presidential nomineeYahoo News Video,,20200819-1130
/jill-biden-pitch-joe-healed-040543100.html,Jill Biden’s Pitch: Joe Healed Our Family and He’ll Heal AmericaThe Daily Beast,,20200819-1130
/virginia-state-senator-faces-felony-161935010.html,Virginia state senator faces felony charges after protesters topple Confederate statue,,20200819-1130
/portsmouth-police-confederate-stephanie-morales-195117452.html,Cops Who Charged Civil Rights Leaders With Felonies Try To Sideline Progressive ProsecutorHuffPost,,20200819-1130
/senator-vindicated-confederate-monument-case-220411190.html,Senator: 'I will be vindicated' in Confederate monument caseAssociated Press,,20200819-1130
/martha-maccallum-jill-bidens-strong-033104914.html,Martha MacCallum on Jill Biden's 'strong' speech; Chris Wallace on 'return to normalcy' them at DNC,,20200819-1130
/james-comey-led-controversial-fbi-215603344.html,"James Comey, who led controversial FBI probe into Hillary Clinton's emails, wears 'Elect More Women' T-shirt",,20200819-1130
/trump-slams-zealands-big-surge-170755560.html,Trump slams New Zealand's 'big surge' of 13 COVID-19 cases. More than 400 US counties reported more than that in a day,,20200819-1130
/zealands-prime-minister-shuts-down-182446083.html,New Zealand's prime minister shuts down President Donald Trump's COVID-19 claimsUSA TODAY,,20200819-1130
/zealand-pm-hits-back-president-074622693.html,New Zealand PM hits back at Donald Trump's 'patently wrong' virus claimsThe Telegraph,,20200819-1130
/putin-tells-merkel-external-intervention-102615967.html,Putin tells Merkel external intervention in Belarus would be unacceptable,,20200819-1130
/protests-belarus-144442048.html,Protests in BelarusAFP Videographics,,20200819-1130
/know-belarus-protests-election-dispute-171232467.html,What To Know About The Belarus Protests: From An Election Dispute To Workers Going On StrikeRefinery29,,20200819-1130
/florida-republicans-unseat-rep-ross-050421485.html,"Florida Republicans unseat Rep. Ross Spano, nominate far-right activist Laura Loomer, in GOP primaries",,20200819-1130
/rep-ross-spano-becomes-8th-013727846.html,Rep. Ross Spano becomes 8th House incumbent to lose renominationPolitico,,20200819-1130
/florida-wyoming-alaska-hold-primaries-101439016.html,Florida Republicans boot out congressman facing campaign finance probeReuters,,20200819-1130
/tokyo-installed-see-public-toilets-101404243.html,"Tokyo installed see-through public toilets in a park to let people inspect their cleanliness before using them, at which point the glass turns opaque",,20200819-1130
/donald-trump-hits-back-michelle-175118343.html,"Donald Trump hits back at Michelle Obama, calling her convention speech 'extremely divisive'",,20200819-1130
/trump-erupts-angrily-michelle-obamas-124758798.html,Trump erupts angrily at Michelle Obama's convention takedownAFP,,20200819-1130
/michelle-obama-vote-necklace-going-143952367.html,Michelle Obama’s Vote Necklace Is Going Viral — Here’s Where You Can Buy ItRefinery29,,20200819-1130
/japans-nagashiki-apologises-says-supports-040020651.html,"Japan's Nagashiki apologises, says it supports crew after arrests in Mauritius oil spill",,20200819-1130
/mauritius-arrests-captain-japanese-ship-135749683.html,Mauritius arrests captain of stricken Japanese oil tankerReuters,,20200819-1130
/mauritius-copes-split-japanese-ship-124305205.html,Mauritius copes with split Japanese ship that spilled oilAssociated Press,,20200819-1130
/mali-soldiers-detain-senior-officers-113738370.html,Mali's president announces resignation after armed mutiny,,20200819-1130
/china-threatens-retaliate-against-uk-113538267.html,China threatens to retaliate against the UK for hosting 'anti-China forces' after Boris Johnson welcomed a pro-democracy activist who fled Hong Kong to escape arrest,,20200819-1130
/m/b2627d27-78dc-35d2-bf8c-e5f0346e97fa/hong-kong-government-responds.html,Hong Kong Government Responds on Tabled ElectionThe Wall Street Journal,,20200819-1130
/pro-democracy-milk-tea-alliance-085358002.html,Pro-democracy Milk Tea Alliance brews in AsiaReuters,,20200819-1130
/sketchy-drone-buzzes-under-air-125500053.html,Sketchy Drone Buzzes Under Air Force One,,20200819-1130
/air-force-one-trump-board-001500643.html,"Air Force One with Trump on board nearly hit by drone, report saysThe Independent",,20200819-1130
/us-officials-investigate-drone-sighting-235231394.html,US officials investigate drone sighting near Air Force OneThe Telegraph,,20200819-1130
/did-2020-dnc-already-happen-035252435.html,Did the 2020 DNC already happen?,,20200819-1130
/dnc-video-highlights-john-mccains-032206085.html,DNC video highlights John McCain's unlikely friendship with Joe Biden FOX News Videos,,20200819-1130
/jill-biden-talks-joe-bidens-033421570.html,Jill Biden talks of Joe Biden's 'unstoppable' will amid grief: Takeaways from night 2 of the DNCUSA TODAY,,20200819-1130
/irans-response-israel-uae-pact-144706546.html,"Iran's response to Israel-UAE pact: tough rhetoric, no action",,20200819-1130
/israels-president-invites-uaes-facto-115425693.html,Israel's president invites UAE's de facto leader to JerusalemReuters,,20200819-1130
/israels-mossad-spy-chief-visits-154324983.html,Israel's Mossad spy chief visits UAE for security talksAFP,,20200819-1130
/uk-set-limits-harmful-airborne-110053090.html,UK to set limits on harmful airborne particles,,20200819-1130
/sleep-night-anderson-cooper-rips-230437222.html,'How do you sleep at night?: Anderson Cooper rips MyPillow CEO Mike Lindell on COVID 'cure' claim,,20200819-1130
/watch-anderson-cooper-tear-apart-201532645.html,"Watch Anderson Cooper Tear Apart This CEO For Peddling A COVID-19 “Cure,” As A TreatRefinery29",,20200819-1130
/anderson-cooper-clashes-mypillow-ceo-211322638.html,Anderson Cooper clashes with MyPillow CEO over coronavirus cure claimsYahoo Entertainment,,20200819-1130
/north-korean-leader-kim-jong-155105095.html,North Korean leader Kim Jong Un reportedly condemns pet ownership as a 'decadence' and orders dogs be confiscated,,20200819-1130
/tension-washington-helps-fuel-turkey-202030915.html,Tension with Washington helps fuel Turkey-Venezuela alliance,,20200819-1130
/china-says-latest-u-sailing-095634610.html,China says latest U.S. sailing near Taiwan 'extremely dangerous',,20200819-1130
/heres-why-alexandria-ocasio-cortez-051310250.html,Here's why Alexandria Ocasio-Cortez nominated Bernie Sanders during the Democratic National Convention,,20200819-1130
/live-dnc-democratic-convention-night-2-aoc-bill-clinton-jill-biden-230041663.html,Jill Biden caps night two of the Democratic National Convention as Joe officially becomes the nomineeYahoo News,,20200819-1130
/democrat-convention-joe-biden-courts-053942987.html,Democrat Convention: Joe Biden courts the John McCain vote as left-wingers banishedThe Telegraph,,20200819-1130
/women-led-countries-handled-coronavirus-101715056.html,"Women-led countries handled the coronavirus pandemic 'systematically and significantly better' than those run by men, study says",,20200819-1130
/harry-hill-reveals-asked-return-144206262.html,Harry Hill reveals he was asked to return to work as a doctor at height of coronavirus pandemicEvening Standard,,20200819-1130
https://www.myrecipes.com/news/why-groceries-are-out-of-stock,Here's Why Some Grocery Items Are Still Out of StockMyRecipes,,20200819-1130
https://news.yahoo.com/key-takeaways-from-the-second-night-of-the-democratic-convention-jill-biden-loves-joe-and-so-did-john-mc-cain-045531744.html,"4 takeaways from the 2nd night of the DNCThe old guard came out in force Tuesday, with speeches from Bill Clinton and John Kerry, as well as a video highlighting Joe Biden's friendship with the late John McCain.A nod to the party's rising stars »",,20200819-1200
/jill-biden-joes-strength-of-will-is-unstoppable-042727090.html,Jill Biden makes emotional case for her husband,,20200819-1200
/dems-put-divides-aside-rally-052513930.html,It's official: Biden will take on Trump,,20200819-1200
https://news.yahoo.com/dejoy-earned-millions-company-financial-121052964.html,Postmaster made millions from company tied to USPS,,20200819-1200
https://news.yahoo.com/coronavirus-doctors-battle-another-scourge-121627704.html,Virus doctors battle another scourge: Misinformation,,20200819-1200
/why-trump-and-the-republicans-have-turned-college-football-into-the-new-normandy-173055855.html,College football becomes new 'Normandy' for Trump,,20200819-1200
/schools-touted-desantis-now-quarantine-081042599.html,Schools Touted by DeSantis Now in a Quarantine Nightmare,,20200819-1200
/james-comey-led-controversial-fbi-215603344.html,"James Comey, who led controversial FBI probe into Hillary Clinton's emails, wears 'Elect More Women' T-shirt",,20200819-1200
/alexandria-ocasio-cortez-slams-nbc-062200419.html,Alexandria Ocasio-Cortez slams NBC News for 'totally false and divisive' clickbait on her DNC speech,,20200819-1200
/colin-powell-cindy-mccain-become-005108484.html,"Colin Powell, Cindy McCain become latest Republicans to join DNC and endorse BidenThe Week",,20200819-1200
/dnc-security-guard-blurted-love-024511859.html,DNC: Security guard who blurted ‘I love you’ to Biden last year nominates him for presidentUSA TODAY,,20200819-1200
/putin-tells-merkel-external-intervention-102615967.html,Putin tells Merkel external intervention in Belarus would be unacceptable,,20200819-1200
/protests-belarus-144442048.html,Protests in BelarusAFP Videographics,,20200819-1200
/know-belarus-protests-election-dispute-171232467.html,What To Know About The Belarus Protests: From An Election Dispute To Workers Going On StrikeRefinery29,,20200819-1200
/virginia-state-senator-faces-felony-161935010.html,Virginia state senator faces felony charges after protesters topple Confederate statue,,20200819-1200
/portsmouth-police-confederate-stephanie-morales-195117452.html,Cops Who Charged Civil Rights Leaders With Felonies Try To Sideline Progressive ProsecutorHuffPost,,20200819-1200
/senator-vindicated-confederate-monument-case-220411190.html,Senator: 'I will be vindicated' in Confederate monument caseAssociated Press,,20200819-1200
/tokyo-installed-see-public-toilets-101404243.html,"Tokyo installed see-through public toilets in a park to let people inspect their cleanliness before using them, at which point the glass turns opaque",,20200819-1200
/sally-yates-says-president-trump-014125001.html,Sally Yates says President Trump used his position to benefit himself rather than his country,,20200819-1200
/florida-republicans-unseat-rep-ross-050421485.html,"Florida Republicans unseat Rep. Ross Spano, nominate far-right activist Laura Loomer, in GOP primaries",,20200819-1200
/rep-ross-spano-becomes-8th-013727846.html,Rep. Ross Spano becomes 8th House incumbent to lose renominationPolitico,,20200819-1200
/florida-wyoming-alaska-hold-primaries-101439016.html,Florida Republicans boot out congressman facing campaign finance probeReuters,,20200819-1200
/trump-slams-zealands-big-surge-170755560.html,Trump slams New Zealand's 'big surge' of 13 COVID-19 cases. More than 400 US counties reported more than that in a day,,20200819-1200
/zealands-prime-minister-shuts-down-182446083.html,New Zealand's prime minister shuts down President Donald Trump's COVID-19 claimsUSA TODAY,,20200819-1200
/zealand-pm-hits-back-president-074622693.html,New Zealand PM hits back at Donald Trump's 'patently wrong' virus claimsThe Telegraph,,20200819-1200
/biden-says-picked-harris-running-004809811.html,Biden says he picked Harris as his running mate because 'the government should look like the country',,20200819-1200
/unlikely-friendship-cindy-mccain-speaks-032524454.html,'An unlikely friendship.' Cindy McCain speaks of her late husband's relationship with Joe BidenLA Times,,20200819-1200
/voters-seem-endorsing-joe-biden-164412162.html,Voters seem to be endorsing Joe Biden because 'he is not Donald Trump': Maslansky & Partners PresidentYahoo Finance Video,,20200819-1200
/dr-fauci-cautiously-optimistic-end-205000494.html,Dr. Fauci is 'cautiously optimistic' that by the end of 2021 there will be enough coronavirus vaccine shots for all Americans,,20200819-1200
/dr-fauci-demonstrates-comfortably-wears-145307547.html,Dr. Fauci Demonstrates How He Comfortably Wears A Mask While JoggingScary Mommy,,20200819-1200
/dr-fauci-warns-states-really-110335162.html,"Dr. Fauci Warns These States Have 'Really High' COVID RatesEat This, Not That!",,20200819-1200
/gazas-power-plant-shuts-down-124517890.html,Gaza's power plant shuts down amid Israel-Hamas standoff,,20200819-1200
/irans-response-israel-uae-pact-144706546.html,"Iran's response to Israel-UAE pact: tough rhetoric, no actionReuters",,20200819-1200
/israels-mossad-spy-chief-visits-154324983.html,Israel's Mossad spy chief visits UAE for security talksAFP,,20200819-1200
/did-2020-dnc-already-happen-035252435.html,Did the 2020 DNC already happen?,,20200819-1200
/historic-speech-kamala-harris-expected-100343419.html,"In historic speech, Kamala Harris expected to train fire on TrumpReuters",,20200819-1200
/joe-biden-already-planning-failed-095502612.html,Joe Biden is already planning a failed presidencyThe Week,,20200819-1200
/pakistans-pm-khan-plays-down-090458100.html,Pakistan's PM Khan plays down differences with ally Saudi Arabia,,20200819-1200
/donald-trump-hits-back-michelle-175118343.html,"Donald Trump hits back at Michelle Obama, calling her convention speech 'extremely divisive'",,20200819-1200
/trump-erupts-angrily-michelle-obamas-124758798.html,Trump erupts angrily at Michelle Obama's convention takedownAFP,,20200819-1200
/michelle-obama-vote-necklace-going-143952367.html,Michelle Obama’s Vote Necklace Is Going Viral — Here’s Where You Can Buy ItRefinery29,,20200819-1200
/people-showed-home-york-times-105845803.html,"People showed up at the home of a New York Times photographer after Tucker Carlson named him on Fox News, according to a 911 call log",,20200819-1200
/19-threw-himself-over-grenade-100000385.html,He was 19 and threw himself over a grenade in Vietnam. He now will be buried at Arlington,,20200819-1200
/china-says-latest-u-sailing-095634610.html,China says latest U.S. sailing near Taiwan 'extremely dangerous',,20200819-1200
/trump-vows-put-toll-cars-233827067.html,Trump vows to put 'toll' on cars coming into US to force Mexico to pay for border wall,,20200819-1200
/trump-campaign-focuses-battleground-states-145551198.html,Trump campaign focuses on battleground states amid DNCFOX News Videos,,20200819-1200
/trump-accepts-endorsement-national-border-222157029.html,"Trump accepts endorsement from National Border Patrol Council, surveys border fence in Yuma, Arizona	FOX News Videos",,20200819-1200
/mississippi-quarantines-more-2-000-224528239.html,"Mississippi quarantines more than 2,000 students and 500 teachers as hundreds tested positive for coronavirus, but the governor says, 'It doesn't mean they caught it there'",,20200819-1200
/tension-washington-helps-fuel-turkey-202030915.html,Tension with Washington helps fuel Turkey-Venezuela alliance,,20200819-1200
/chinas-top-diplomat-visit-south-033247853.html,"China's top diplomat to visit South Korea amid stalled North Korea talks, coronavirus outbreaks",,20200819-1200
/impact-progressive-wing-democratic-party-230609801.html,Impact of progressive wing on Democratic Party platform,,20200819-1200
/john-kerry-marie-yovanovitch-colin-033526356.html,"John Kerry, Marie Yovanovitch, and Colin Powell assail Trump's foreign policy choices at DNC",,20200819-1200
/rep-ocasio-cortez-seconds-sanders-060339979.html,Rep. Ocasio-Cortez seconds Sanders nominationAssociated Press Videos,,20200819-1200
/schumer-tells-americans-trump-quit-023654510.html,Schumer Tells Americans ‘Trump Has Quit on You’ in DNC Convention SpeechNational Review,,20200819-1200
/ecuador-says-chinese-fishing-vessels-082059376.html,Ecuador says Chinese fishing vessels near the Galapagos have turned off tracking systems to prevent being monitored,,20200819-1200
https://news.yahoo.com/key-takeaways-from-the-second-night-of-the-democratic-convention-jill-biden-loves-joe-and-so-did-john-mc-cain-045531744.html,"4 takeaways from the 2nd night of the DNCThe old guard came out in force Tuesday, with speeches from Bill Clinton and John Kerry, as well as a video highlighting Joe Biden's friendship with the late John McCain.A nod to the party's rising stars »",,20200819-1230
/jill-biden-joes-strength-of-will-is-unstoppable-042727090.html,Jill Biden makes emotional case for her husband,,20200819-1230
/dems-put-divides-aside-rally-052513930.html,It's official: Biden will take on Trump,,20200819-1230
https://news.yahoo.com/dejoy-earned-millions-company-financial-121052964.html,Postmaster made millions from company tied to USPS,,20200819-1230
https://news.yahoo.com/coronavirus-doctors-battle-another-scourge-121627704.html,Virus doctors battle another scourge: Misinformation,,20200819-1230
/why-trump-and-the-republicans-have-turned-college-football-into-the-new-normandy-173055855.html,College football becomes new 'Normandy' for Trump,,20200819-1230
/mike-bloomberg-gives-60m-help-144933039.html,Mike Bloomberg gives $60m to help Democrats in November as former campaign aides turn against him,,20200819-1230
/democratic-convention-put-spotlight-trumps-233725832.html,Democratic convention features pleas for unity and harsh attacks on TrumpLA Times,,20200819-1230
/dnc-schedule-speakers-watch-democratic-151000595.html,"DNC: Schedule, speakers, and how to watch the Democratic National Convention worksThe Independent",,20200819-1230
/schools-touted-desantis-now-quarantine-081042599.html,Schools Touted by DeSantis Now in a Quarantine Nightmare,,20200819-1230
/tokyo-installed-see-public-toilets-101404243.html,"Tokyo installed see-through public toilets in a park to let people inspect their cleanliness before using them, at which point the glass turns opaque",,20200819-1230
/indiana-woman-faces-felony-charges-235143347.html,Indiana woman faces felony charges for allegedly burning a friend's baby with a treadmill and a cigarette lighter,,20200819-1230
/tv-networks-reportedly-afraid-giving-212242485.html,"TV networks are reportedly afraid of giving the RNC too much airtime, so they cut the DNC's time short too",,20200819-1230
/virtual-democratic-national-convention-begins-203234202.html,All-virtual Democratic National Convention beginsABC News Videos,,20200819-1230
/abc-draws-largest-democratic-national-164031241.html,Democratic National Convention Kicks Off Down 27% on 2016Variety,,20200819-1230
/trump-claims-never-heard-ex-144449222.html,Trump claims he has ‘never heard of’ ex-Homeland Security chief who called him ‘terrifying’ and endorsed Biden,,20200819-1230
/ex-trump-official-says-u-212817988.html,"Ex-Trump official says U.S. 'less secure' due to president's actions, endorses BidenReuters",,20200819-1230
/former-top-ranking-trump-official-205703830.html,"Former top-ranking Trump official endorses Biden, saying working under the current administration was 'terrifying'Business Insider",,20200819-1230
/james-comey-led-controversial-fbi-215603344.html,"James Comey, who led controversial FBI probe into Hillary Clinton's emails, wears 'Elect More Women' T-shirt",,20200819-1230
/putin-tells-merkel-external-intervention-102615967.html,Putin tells Merkel external intervention in Belarus would be unacceptable,,20200819-1230
/protests-belarus-144442048.html,Protests in BelarusAFP Videographics,,20200819-1230
/know-belarus-protests-election-dispute-171232467.html,What To Know About The Belarus Protests: From An Election Dispute To Workers Going On StrikeRefinery29,,20200819-1230
/19-threw-himself-over-grenade-100000385.html,He was 19 and threw himself over a grenade in Vietnam. He now will be buried at Arlington,,20200819-1230
/biden-says-picked-harris-running-004809811.html,Biden says he picked Harris as his running mate because 'the government should look like the country',,20200819-1230
/bill-clinton-says-joe-biden-014612965.html,Bill Clinton says Joe Biden helped bring America back from a recession before and he can do it againFOX News Videos,,20200819-1230
/eye-opener-joe-biden-formally-115156051.html,Eye Opener: Joe Biden formally accepts Democratic nominationCBS News Videos,,20200819-1230
/trump-slams-zealands-big-surge-170755560.html,Trump slams New Zealand's 'big surge' of 13 COVID-19 cases. More than 400 US counties reported more than that in a day,,20200819-1230
/zealands-prime-minister-shuts-down-182446083.html,New Zealand's prime minister shuts down President Donald Trump's COVID-19 claimsUSA TODAY,,20200819-1230
/zealand-pm-hits-back-president-074622693.html,New Zealand PM hits back at Donald Trump's 'patently wrong' virus claimsThe Telegraph,,20200819-1230
/hundreds-thousands-bikers-converged-massive-154705381.html,"Hundreds of thousands of bikers converged at the massive Sturgis Rally, one of the biggest gatherings during the pandemic. Mapping their phone data shows where they traveled across the US.",,20200819-1230
/sketchy-drone-buzzes-under-air-125500053.html,Sketchy Drone Buzzes Under Air Force One,,20200819-1230
/air-force-one-trump-board-001500643.html,"Air Force One with Trump on board nearly hit by drone, report saysThe Independent",,20200819-1230
/us-officials-investigate-drone-sighting-235231394.html,US officials investigate drone sighting near Air Force OneThe Telegraph,,20200819-1230
/chinese-diplomats-return-houston-consulate-022812551.html,Chinese diplomats return from Houston consulate shut by US,,20200819-1230
/china-threatens-retaliate-against-uk-113538267.html,China threatens to retaliate against the UK for hosting 'anti-China forces' after Boris Johnson welcomed a pro-democracy activist who fled Hong Kong to escape arrest,,20200819-1230
/m/b2627d27-78dc-35d2-bf8c-e5f0346e97fa/hong-kong-government-responds.html,Hong Kong Government Responds on Tabled ElectionThe Wall Street Journal,,20200819-1230
/pro-democracy-milk-tea-alliance-085358002.html,Pro-democracy Milk Tea Alliance brews in AsiaReuters,,20200819-1230
/florida-republicans-unseat-rep-ross-050421485.html,"Florida Republicans unseat Rep. Ross Spano, nominate far-right activist Laura Loomer, in GOP primaries",,20200819-1230
/rep-ross-spano-becomes-8th-013727846.html,Rep. Ross Spano becomes 8th House incumbent to lose renominationPolitico,,20200819-1230
/florida-wyoming-alaska-hold-primaries-101439016.html,Florida Republicans boot out congressman facing campaign finance probeReuters,,20200819-1230
/trump-bucks-tradition-again-hitting-225754912.html,Trump bucks tradition again by hitting campaign trail during DNC,,20200819-1230
/sleep-night-anderson-cooper-rips-230437222.html,'How do you sleep at night?: Anderson Cooper rips MyPillow CEO Mike Lindell on COVID 'cure' claim,,20200819-1230
