,name,text,id,url,created_at
0,TheAtlantic,"After Reddit published a letter in support of Black Lives Matter, its own users called the company out for hypocrisy. Now, they’re asking for real change on a site that has been famous for racism for years, @kait_tiffany reports. https://t.co/kcgwNKQLf3",1271961666670952448,-1,Sun Jun 14 00:24:27 +0000 2020
0,TheAtlantic,"The TV show “Cops” was a simulacrum of American police work, polished and cut and spliced into a hollow replica. @sophieGG on the long-running reality series that got canceled this week: https://t.co/vdcgRrhjIO",1271969661903659008,-1,Sun Jun 14 00:56:14 +0000 2020
0,TheAtlantic,"The truth buried beneath the surface: Your weekly guide to the best in books, by @mylmarche: https://t.co/GfieJEAvQn",1271977218953154562,-1,Sun Jun 14 01:26:15 +0000 2020
0,TheAtlantic,"“I wished I had a cigarette—I wish I smoked cigarettes. This was what they had been designed for, looking cool while waiting for things.” Read a new short story by Andrew Martin: https://t.co/XHzx3IKYXJ",1271985378963177478,-1,Sun Jun 14 01:58:41 +0000 2020
0,TheAtlantic,"Evidence of a looming coronavirus pandemic was building for years, but scientists who study the virus had struggled to get funding to convince Americans of the risk, Charles Schmidt writes. https://t.co/HlkWFoW9Wq",1271993051423145984,-1,Sun Jun 14 02:29:10 +0000 2020
0,TheAtlantic,The big tech companies are eager to help the government respond to the pandemic. What’s in it for them? @FranklinFoer asks. https://t.co/ZIHAqrwvcE,1272001199210999810,-1,Sun Jun 14 03:01:33 +0000 2020
0,TheAtlantic,"""Punk provides a kind of perfect buffet of opportunities to imagine yourself different than you really are—more engaged, more angry, more heartbroken."" Andrew Martin talks with Thomas Gebremedhin about the role of music in teenage life: https://t.co/sycFU4AofZ",1272008883104514048,-1,Sun Jun 14 03:32:05 +0000 2020
0,TheAtlantic,"Hollywood has made many Vietnam War stories over the past 50 years, but very few have dug into the experiences of black servicemen in that conflict. Spike Lee's ""Da 5 Bloods""—out on Netflix—is a masterful film that changes that, @davidlsims writes: https://t.co/Pw67oLMCWi",1272024784428322816,-1,Sun Jun 14 04:35:16 +0000 2020
0,TheAtlantic,"Bill de Blasio's turn from campaigning against racist police tactics to defending the NYPD’s crackdown on protests has disillusioned the city that twice elected him, @russellberman reports: https://t.co/RYCcxIQXzK",1272032734530228225,-1,Sun Jun 14 05:06:51 +0000 2020
0,TheAtlantic,"""If the first brick signals the beginning of a moral holiday for looters, the first thwack of a truncheon signals a moral holiday for cops primed to react to the unknown with fear and loathing,"" @gcaw writes: https://t.co/BG1NExZsOm",1272040633365037057,-1,Sun Jun 14 05:38:15 +0000 2020
0,TheAtlantic,"Americans seem antsy to restart their lives, but this pandemic isn’t over. In the meantime: Here’s what to watch, read, and listen to this weekend. The latest Atlantic Daily, from @mimbsy: https://t.co/uX7dZBquAN",1272056212096454658,-1,Sun Jun 14 06:40:09 +0000 2020
0,TheAtlantic,"Rhythmic gymnastics on a British seashore, anti-racism protests across the United States, the funeral procession of George Floyd in Houston, a wildfire in California, idled elephants in Thailand, and much more—via @TheAtlPhoto: https://t.co/9phn7n0Z4N",1272064207605903361,-1,Sun Jun 14 07:11:55 +0000 2020
0,TheAtlantic,"In our latest ""Behind the Byline"" feature, @edyong209 shares what it's like covering the coronavirus pandemic, how he got his journalism start, and the books and shows he's enjoying. https://t.co/PTCH95gySA",1272072001889472512,-1,Sun Jun 14 07:42:53 +0000 2020
0,TheAtlantic,One biscuit tells a billion stories. @aliaallana tracks India's lockdown through the country's favorite comfort food: https://t.co/LlFKiGWJWy,1272079597295882240,-1,Sun Jun 14 08:13:04 +0000 2020
0,TheAtlantic,"""By minimizing the trials of black women and girls, the country will miss the full picture of devastation that the American police state imposes on African Americans,"" @whattamisaid writes: https://t.co/HfH3uhOCML",1272148450222714880,-1,Sun Jun 14 12:46:40 +0000 2020
0,TheAtlantic,"""The number of activists, partisans, and politicians who hop back and forth across the literal/serious divide—saying something with no expectation they will be taken at their word—will only grow this season,"" Andrew Ferguson writes: https://t.co/5QlGWUW5Fu",1272153972107771904,-1,Sun Jun 14 13:08:37 +0000 2020
0,TheAtlantic,"RT @JeffreyGoldberg: ""Black girls are suspended from school at a rate six times higher than that of white girls. They are 'the fastest growing segment of the juvenile justice system....'"" -- 
Strong piece from @whattamisaid:
https://t.co/zrC1yN81PM",1272182219767975937,https://www.theatlantic.com/ideas/archive/2020/06/revolution-will-be-incomplete-without-black-women-and-girls/613045/,Sun Jun 14 15:00:51 +0000 2020
0,TheAtlantic,"RT @JeffreyGoldberg: Since everyone is talking about her, here is an interesting profile of @KamalaHarris from the primary season, from @lizweil:
https://t.co/PmKLk3AH7I",1272182255897772037,https://www.theatlantic.com/magazine/archive/2019/05/kamala-harris-2020-campaign/586033/,Sun Jun 14 15:01:00 +0000 2020
0,TheAtlantic,"RT @JeffreyGoldberg: “'No, I don’t support defunding the police,' [Biden] told CBS News, thereby saving his candidacy. Maybe he had to say it: A poll this week showed that just 16 percent of Americans support cuts to police funding."" -- 
Andrew Ferguson on police defunders: 
https://t.co/586VRUMzwE",1272182270632366084,https://www.theatlantic.com/ideas/archive/2020/06/what-does-defund-police-really-mean/612904/,Sun Jun 14 15:01:03 +0000 2020
0,TheAtlantic,"RT @whattamisaid: My latest in @TheAtlantic: ""By minimizing the trials of black women and girls, the country will miss the full picture of devastation that the American police state imposes on African Americans.""  https://t.co/DbrpNaGnmP",1272182300529262597,https://www.theatlantic.com/ideas/archive/2020/06/revolution-will-be-incomplete-without-black-women-and-girls/613045/?utm_source=twitter&utm_medium=social&utm_campaign=share,Sun Jun 14 15:01:11 +0000 2020
0,TheAtlantic,"RT @YAppelbaum: ""As Virginia turns blue, the question is whether the GOP can stay close enough to the center to hold competitive seats—or whether it will become more extreme as it shrinks.” Some good reporting here from @emmaogreen https://t.co/sSoAZmn87d",1272182320536195073,https://www.theatlantic.com/politics/archive/2020/06/riggleman-same-sex-marriage/612991/,Sun Jun 14 15:01:15 +0000 2020
0,TheAtlantic,"“This is not what a food bank was designed to do.” The pandemic is creating a crisis of food insecurity, writes @Kapoor_ML. https://t.co/h62onanLjT",1272197310110404609,-1,Sun Jun 14 16:00:49 +0000 2020
