,name,text,id,url,created_at
0,YahooNews,"POLL: Most Americans say race was a 'major factor' in George Floyd's death, but opinions on protests are split https://t.co/l9HBerN60o https://t.co/lnVzFMC6Cr",1267247661406617605,https://www.yahoo.com/news/yahoo-news-you-gov-poll-most-americans-say-race-was-a-major-factor-in-george-floyds-death-but-opinions-on-protests-are-split-193951336.html,Mon Jun 01 00:12:41 +0000 2020
0,YahooNews,"A fund to compensate victims of Jeffrey Epstein's sexual abuse may begin making payouts soon, after the deceased financier's estate, his accusers and the attorney general of the U.S. Virgin Islands resolved their differences over the process https://t.co/FrCjMYxnDv https://t.co/ClLAH91W7Q",1267248248386998273,https://news.yahoo.com/epstein-estate-victims-reach-agreement-213053147.html,Mon Jun 01 00:15:01 +0000 2020
0,YahooNews,"Biden lamented the “open wound” of the nation's systemic racism on Friday as he responded to the police killing of a black man in Minnesota. 

He drew an implicit contrast with Trump, who suggested authorities could respond with violence to the protests https://t.co/RQKaJ9hWXO https://t.co/HsEEdNatNg",1267252041484771328,https://news.yahoo.com/biden-speaks-racial-open-wound-063857572.html,Mon Jun 01 00:30:05 +0000 2020
0,YahooNews,Florida’s seen a ‘statistically significant’ uptick in pneumonia deaths. The CDC says it’s likely COVID. https://t.co/PIOpul47va https://t.co/cgLUXAgb9x,1267255806124265474,https://news.yahoo.com/florida-seen-statistically-significant-uptick-060847538.html,Mon Jun 01 00:45:03 +0000 2020
0,YahooNews,"Peaceful protesters lament violence at George Floyd demonstrations, but understand the rage behind it https://t.co/2aGFRGivlY https://t.co/vUuZZ6YQXn",1267259615818981382,https://news.yahoo.com/peaceful-protesters-lament-violence-george-114903695.html,Mon Jun 01 01:00:11 +0000 2020
0,YahooNews,What to know about traveling to the US at this stage of the pandemic https://t.co/jAJoc90EzA https://t.co/KNi2mqvCeq,1267263350691545089,https://www.yahoo.com/gma/know-traveling-us-stage-pandemic-172000196.html,Mon Jun 01 01:15:02 +0000 2020
0,YahooNews,How some cities plan to increase outdoor dining as restaurants reopen https://t.co/iKmz2Cssfg https://t.co/0MkEZf2AhI,1267267163536195590,https://www.yahoo.com/gma/cities-plan-increase-outdoor-dining-restaurants-reopen-164522053--abc-news-topstories.html,Mon Jun 01 01:30:11 +0000 2020
0,YahooNews,Sen. Klobuchar's past as prosecutor looms over vice presidential prospects https://t.co/qL4nfvA1c0 https://t.co/XXfmAb0sOJ,1267270900346478592,https://www.yahoo.com/gma/sen-klobuchars-past-prosecutor-looms-over-vice-presidential-202900005.html,Mon Jun 01 01:45:02 +0000 2020
0,YahooNews,Why people are flouting coronavirus social distancing precautions that we know save lives https://t.co/bKKxyQNxfo https://t.co/z0a9nmgWlQ,1267274783772889090,https://www.yahoo.com/gma/why-people-flouting-coronavirus-social-distancing-precautions-know-145700783--abc-news-topstories.html,Mon Jun 01 02:00:27 +0000 2020
0,YahooNews,CDC and WHO offer conflicting advice on masks. An expert tells us why https://t.co/vbPtjHRCwO https://t.co/2FoyADLTIZ,1267282223889342464,https://www.yahoo.com/gma/cdc-offer-conflicting-advice-masks-expert-tells-us-215000287.html,Mon Jun 01 02:30:01 +0000 2020
0,YahooNews,"RT @hunterw: Law enforcement including military police just advanced on the crowd of protesters in Lafayette Park across from White House. They used tear gas, flashbangs, and I believe were shooting rubber bullets. Much of the crowd dispersed but people are still here. Seven minutes to curfewLaw enforcement including military police just advanced on the crowd of protesters in Lafayette Park across from Wh… https://t.co/NrbSkIH4aK",1267288721885409284,https://twitter.com/i/web/status/1267288161497030656,Mon Jun 01 02:55:51 +0000 2020
0,YahooNews,RT @hunterw: Lots of flashbangs going off in the background. I am temporarily taking refuge in an alley. Was tear gassed earlier.,1267288738578735108,,Mon Jun 01 02:55:55 +0000 2020
0,YahooNews,RT @hunterw: LIVE - A citywide curfew has begun but protesters are still in the streets here in Downtown Washington DC https://t.co/qlt74WBeNQ,1267291888698171394,https://www.pscp.tv/w/caMWqzFlUkV4cWVST3lOUXd8MXpxS1ZsakJEb1BKQrnTqLfAt0qf2DOxOj-CF6kKxOP0TMQLZaZ0evBLsX7w,Mon Jun 01 03:08:26 +0000 2020
0,YahooNews,RT @weinbergersa: One minute to curfew. Follow ⁦@hunterw⁩ for more. https://t.co/h7KxE7yXx7,1267292129828757505,,Mon Jun 01 03:09:23 +0000 2020
0,YahooNews,"RT @NYTScience: While President Trump has frequently claimed that banning travelers from China prevented the epidemic from becoming much worse, the new data suggest that the virus that started Washington's epidemic arrived roughly two weeks after the ban was imposed https://t.co/9qTVdtgQ3q",1267292770131206144,https://www.nytimes.com/2020/05/27/health/coronavirus-spread-united-states.html?smtyp=cur&smid=tw-nytimesscience,Mon Jun 01 03:11:56 +0000 2020
0,YahooNews,"RT @PattersonNBC: One hour into curfew in #Chicago... and parts of the city are so sealed off that it feels like giant a movie set. 

Like Gotham before they roll on Batman.

That’s the State Street Bridge.

Some looting, some arrests, some fire but nearly all protests are peaceful. @NBCNews https://t.co/7PnwfNjx4fOne hour into curfew in #Chicago... and parts of the city are so sealed off that it feels like giant a movie set.… https://t.co/g3qstgqFC2",1267292909432430594,https://twitter.com/i/web/status/1267292439158685696,Mon Jun 01 03:12:29 +0000 2020
0,YahooNews,"Joe Biden visits George Floyd protest site, urges Americans to turn 'anguish into purpose.'

Trump reportedly rebuffed advice from advisers to deliver a nationally televised address on Sunday and remained out of sight. 

However, he continued tweeting... https://t.co/J6zsMptYoV https://t.co/r6rl5x7WQN",1267421899518328832,https://www.yahoo.com/huffpost/joe-biden-george-floyd-protest-wilmington-064212758.html,Mon Jun 01 11:45:03 +0000 2020
0,YahooNews,The driver of a tanker truck that was driven into a large crowd of peaceful protesters on a bridge near Minneapolis has been arrested by police after he was dragged from the vehicle and beaten by the crowd https://t.co/AcJ5lIwFPY https://t.co/nSFcvgLMER,1267425713227005953,https://au.news.yahoo.com/very-disturbing-truck-driver-who-sped-into-protesters-hauled-from-his-rig-and-beaten-043126701.html,Mon Jun 01 12:00:12 +0000 2020
0,YahooNews,Atlanta moved quickly Sunday to immediately fire two police officers involved in the violent arrest of two young Black people who were roughly dragged from a car and apparently shocked with stun guns as anti-racism protests erupted across the nation https://t.co/STTOmkjhLg https://t.co/zrCxeM3WMu,1267429451152924677,https://www.yahoo.com/huffpost/atlanta-students-arrest-car-protests-001458082.html,Mon Jun 01 12:15:03 +0000 2020
0,YahooNews,One dead in Louisville after police and national guard 'return fire' on protesters https://t.co/YQMYcDauCK https://t.co/ZP3roTv2Tn,1267433289859641344,https://news.yahoo.com/one-dead-louisville-police-national-103920997.html,Mon Jun 01 12:30:18 +0000 2020
0,YahooNews,States brace for disasters as pandemic collides with hurricane season https://t.co/gByoYbHt2H https://t.co/Tt5Hq9gwK8,1267440907453960193,https://news.yahoo.com/states-brace-disasters-pandemic-collides-083031437.html,Mon Jun 01 13:00:34 +0000 2020
0,YahooNews,'They're just doing whatever they want': Few masks are seen as beach town reopens https://t.co/lEi3jof7oR https://t.co/aBkoyQTpXP,1267443463613755392,https://news.yahoo.com/theyre-just-doing-whatever-want-164832625.html,Mon Jun 01 13:10:44 +0000 2020
0,YahooNews,'Just relax': George Floyd's brother condemns violent protesters https://t.co/na7FuQF3JR https://t.co/lpveLN0PNd,1267444555202416646,https://www.yahoo.com/gma/just-relax-george-floyds-brother-condemns-violent-protesters-032000199--abc-news-topstories.html,Mon Jun 01 13:15:04 +0000 2020
0,YahooNews,Downtown D.C. burns after another night of protests and provocation near the White House https://t.co/xEfkOhr1CG via @hunterw https://t.co/9vi7IKeyeL,1267448324367540226,https://news.yahoo.com/downtown-dc-burns-after-another-night-of-protests-and-provocation-near-the-white-house-121746636.html,Mon Jun 01 13:30:03 +0000 2020
0,YahooNews,RT @hunterw: Here's my story with original video and reporting from the ground. We are continuing to add clips. https://t.co/bTMYh4qa49,1267449291339071489,https://twitter.com/yahoonews/status/1267448324367540226,Mon Jun 01 13:33:53 +0000 2020
0,YahooNews,Curfews continue across the country as cities expect more protests https://t.co/FlfUV9wBKe https://t.co/3cKzIhbPdm,1267452097521483776,https://news.yahoo.com/curfews-continue-across-country-cities-211027184.html,Mon Jun 01 13:45:02 +0000 2020
0,YahooNews,RT @hunterw: Out walking my dog. The 7/11 on Wyoming Road had its windows smashed in. The looting and vandalism clearly stretched well into the residential neighborhoods of Northwest. https://t.co/RRm5S5GdFqOut walking my dog. The 7/11 on Wyoming Road had its windows smashed in. The looting and vandalism clearly stretche… https://t.co/UVKsjJm3Bd,1267452934733864960,https://twitter.com/i/web/status/1267450653804302336,Mon Jun 01 13:48:22 +0000 2020
0,YahooNews,New video appears to show moments before George Floyd was pinned to ground https://t.co/7PSahn60q7 https://t.co/eWHqRwL7QN,1267453137058779136,https://www.yahoo.com/gma/video-appears-show-moments-george-floyd-pinned-ground-024800262--abc-news-topstories.html,Mon Jun 01 13:49:10 +0000 2020
0,YahooNews,Facebook's Zuckerberg faces employee blowback over ruling on Trump comments https://t.co/FrTbydLWXJ https://t.co/RWdAFTriJr,1267454121742864384,https://www.yahoo.com/news/facebooks-zuckerberg-faces-employee-blowback-125829836.html,Mon Jun 01 13:53:05 +0000 2020
0,YahooNews,Facebook's Zuckerberg faces employee blowback over ruling on Trump comments https://t.co/FrTbydLWXJ https://t.co/RWdAFTriJr,1267454121742864384,https://www.yahoo.com/news/facebooks-zuckerberg-faces-employee-blowback-125829836.html,Mon Jun 01 13:53:05 +0000 2020
0,YahooNews,NEW: The Supreme Court refused to hear a bid by major banks and companies including Koch Industries Inc to prevent a trustee chasing money for victims of imprisoned Ponzi scheme swindler Bernard Madoff from recouping funds that were transferred overseas https://t.co/nUkUuaMhSR https://t.co/ULy7P7izeC,1267456035406729216,https://news.yahoo.com/u-supreme-court-rebuffs-investors-135020432.html,Mon Jun 01 14:00:41 +0000 2020
0,YahooNews,"A video posted to social media appears to show Minneapolis police firing paint rounds at people who were standing on their front porch Saturday night, simply because the people did not get inside the house when ordered to https://t.co/tHsdLwE7WR https://t.co/cabd51Mk1A",1267459658773561344,https://www.yahoo.com/huffpost/minneapolis-police-fire-residents-porch-043505064.html,Mon Jun 01 14:15:05 +0000 2020
0,YahooNews,"Michael Angelis, who narrated the children’s series “Thomas the Tank Engine” for decades, has died at his home, the BBC reported Sunday https://t.co/rATXoImhiM https://t.co/B86nyvNqvT",1267508842616815616,https://www.yahoo.com/huffpost/michael-angelis-dies-thomas-the-tank-engine-162905964.html,Mon Jun 01 17:30:31 +0000 2020
0,YahooNews,"""Washington was under very good control, but we're going to have it under much more control,"" Trump said. ""We're going to pull in thousands of people.""

He added: ""We're going to clamp down very, very strong."" https://t.co/hZQmxUwAAv",1267510807526617089,https://news.yahoo.com/trump-george-floyd-protests-conference-call-governors-weak-you-have-to-dominate-173410831.html?ncid=facebook_yahoonewsf_akfmevaatca,Mon Jun 01 17:38:20 +0000 2020
0,YahooNews,"U.S. President Donald Trump called Russian President Vladimir Putin Monday to tell him about his proposal to convene an international summit that would involve Russia, the Kremlin said.

The White House has released no information on such a call. https://t.co/MION8IDuZr https://t.co/505eJC8LTW",1267515295918370816,https://news.yahoo.com/kremlin-trump-tells-putin-idea-175116574.html,Mon Jun 01 17:56:10 +0000 2020
0,YahooNews,A reporter's cry on live TV: 'I'm getting shot! I'm getting shot!' https://t.co/OXj5tKARQY https://t.co/x2VVOZ2AGg,1267516358176182278,https://news.yahoo.com/reporters-cry-live-tv-im-163004689.html,Mon Jun 01 18:00:23 +0000 2020
0,YahooNews,"Martin Luther King III: 'Had my father lived, we wouldn't be dealing with these issues' https://t.co/1eHIyO2KS9 https://t.co/6aiDTa6p59",1267520043560157190,https://news.yahoo.com/martin-luther-king-iii-had-175600902.html,Mon Jun 01 18:15:02 +0000 2020
0,YahooNews,"With two-thirds of Americans worried about a second wave of the coronavirus, a new poll finds nearly 6 in 10 people are unready to resume their pre-pandemic activities, underscoring continued public unease as the nation seeks a return to normalcy https://t.co/itlTqhamFo https://t.co/RUvxIQ3Ku0",1267523876340236288,https://www.yahoo.com/gma/hesitancy-resume-activities-marks-reopening-challenges-poll-100001698--abc-news-topstories.html,Mon Jun 01 18:30:16 +0000 2020
0,YahooNews,Trump reportedly rebuffed advice from advisers to deliver a nationally televised address on Sunday and remained out of sight https://t.co/J6zsMptYoV,1267527602190852097,https://www.yahoo.com/huffpost/joe-biden-george-floyd-protest-wilmington-064212758.html,Mon Jun 01 18:45:04 +0000 2020
0,YahooNews,Gregg Popovich unleashes fiery statement on Trump: 'What we have is a fool in place of a president' https://t.co/WLdgiEUGFO https://t.co/Cn0b9RqULt,1267531417082347523,https://sports.yahoo.com/gregg-popovich-unleashes-fiery-statement-on-trump-what-we-have-is-a-fool-in-place-of-a-president-184310589.html,Mon Jun 01 19:00:14 +0000 2020
0,YahooNews,WATCH LIVE: George Floyd's family speaks about autopsy results https://t.co/iJIyXJVZkV https://t.co/HJLChHAj8Y,1267532415087640576,https://news.yahoo.com/george-floyd-family-release-results-131914413.html?ncid=facebook_yahoonewsf_akfmevaatca,Mon Jun 01 19:04:12 +0000 2020
0,YahooNews,George Floyd's family to release results of own autopsy https://t.co/sFnp4thPvg https://t.co/9gpPyOxCGL,1267535166169374727,https://news.yahoo.com/george-floyd-family-release-results-131914413.html,Mon Jun 01 19:15:07 +0000 2020
0,YahooNews,"Coronavirus began spreading in the US in January, predating President Trump's travel restrictions and the detection of community transmission, CDC says https://t.co/e1qFAf1Mk7 https://t.co/QGIjkk1HUR",1267542708995923968,https://news.yahoo.com/coronavirus-began-spreading-us-january-185548352.html,Mon Jun 01 19:45:06 +0000 2020
0,YahooNews,Open season on the free press: Journalists targeted in attacks as U.S. protests rage https://t.co/AdY98t9iNR https://t.co/t9JlWXp0FK,1267546599334580226,https://news.yahoo.com/open-season-free-press-journalists-041438288.html,Mon Jun 01 20:00:33 +0000 2020
0,YahooNews,"Pelosi ignores Trump’s protest tweets, says she won’t ‘take his bait’ https://t.co/NSo9wnByfT https://t.co/CqxwJfLNiS",1267550253559033869,https://www.yahoo.com/gma/pelosi-ignores-trump-protest-tweets-says-she-won-163843821.html?ncid=facebook_yahoonewsf_akfmevaatca,Mon Jun 01 20:15:05 +0000 2020
0,YahooNews,Russian artist fashions tiny face masks for insects amid COVID outbreak https://t.co/bJhLfd72Q0 https://t.co/IFZkrOdFOy,1267554027274932224,https://www.yahoo.com/gma/russian-artist-fashions-tiny-face-masks-insects-amid-165800358--abc-news-topstories.html?ncid=facebook_yahoonewsf_akfmevaatca,Mon Jun 01 20:30:04 +0000 2020
0,YahooNews,'We're sick of it': Protesters explain method to the madness of violent demonstrations https://t.co/KaBsTiMbdZ https://t.co/5LuftG5VKz,1267561637717987328,https://www.yahoo.com/gma/were-sick-protesters-explain-method-madness-violent-demonstrations-002100556--abc-news-topstories.html,Mon Jun 01 21:00:19 +0000 2020
0,YahooNews,Having high blood pressure may make coronavirus more dangerous https://t.co/fJY3UGvHVB https://t.co/FZFss3a1VG,1267565349697880066,https://www.yahoo.com/gma/having-high-blood-pressure-may-coronavirus-more-dangerous-103630669--abc-news-topstories.html,Mon Jun 01 21:15:04 +0000 2020
0,YahooNews,"Atlantic hurricane season is now underway, and there's a 60% chance of an above-normal season, according to forecasters with the National Oceanic and Atmospheric Administration https://t.co/8nMMJlKiht https://t.co/r7ga8SYudw",1267572902506967040,https://www.yahoo.com/gma/atlantic-hurricane-season-underway-experts-predict-above-normal-093703480--abc-news-topstories.html,Mon Jun 01 21:45:04 +0000 2020
0,YahooNews,Peaceful protesters cleared out of White House area with tear gas as Trump promised to 'dominate the streets' https://t.co/0FVhlEPxil https://t.co/qHfFG0iDbH,1267596636999634944,https://news.yahoo.com/ag-barr-deploying-federal-riot-153443212.html,Mon Jun 01 23:19:23 +0000 2020
0,YahooNews,"BREAKING: Trump says he will deploy military if state officials can't contain protest violence
https://t.co/ohmzrIYsnP https://t.co/vBPLPOACTw",1267599001286828032,https://news.yahoo.com/trump-considering-move-invoke-insurrection-202700701.html,Mon Jun 01 23:28:47 +0000 2020
