,text,notes,date
https://nypost.com/2020/06/20/us-attorney-geoffrey-berman-steps-down-ends-tug-of-war-with-ag-barr/,"US Attorney Geoffrey Berman steps down, ends tug of war with AG William Barr",,20200621-0000
https://nypost.com/2020/06/20/my-terrifying-5-day-stay-inside-seattles-autonomous-zone/,My terrifying 5-day stay inside Seattle's cop-free zone,,20200621-0000
https://nypost.com/2020/06/20/man-who-filmed-macys-beatdown-of-white-man-says-attack-was-instinct/,Rapper who filmed Macy's beatdown of white man says attack was 'instinct',,20200621-0000
https://nypost.com/2020/06/20/at-least-3-feared-dead-in-terror-related-england-stabbings-report/,At least three feared dead in 'terror-related' stabbings in England: reports,,20200621-0000
https://nypost.com/2020/06/20/kim-jong-uns-princess-sister-is-turning-into-the-terminator/,Kim Jong Un's 'Princess' sister is turning into the Terminator,,20200621-0000
https://nypost.com/2020/06/20/paige-spiranac-my-husband-always-wants-me-to-show-more-cleavage/,Paige Spiranac: ‘My husband always wants me to show more cleavage’,,20200621-0000
https://nypost.com/2020/06/19/the-posts-week-in-photos-new-yorkers-crowd-public-spaces-amid-reopening/,New Yorkers crowd public spaces as reopening continues: The Post’s week in photos,,20200621-0000
https://nypost.com/2020/06/19/juneteenth-celebrations-around-the-country/,Juneteenth celebrations around the country,,20200621-0000
https://nypost.com/2020/06/20/jackie-robinson-would-support-george-floyd-protests-son-says/,Jackie Robinson's son on what father would think of protests,,20200621-0000
https://nypost.com/2020/06/20/alexandria-ocasio-cortez-picks-battles-in-june-primaries/,AOC's 'squad' is more about 'personality' than 'politics',,20200621-0000
https://nypost.com/2020/06/20/burglars-steal-60k-of-saffron-in-london-spice-heist/,Spice heist: Burglars steal $60K of saffron in London,,20200621-0000
https://nypost.com/2020/06/20/liquor-store-owner-88-who-shot-alleged-thief-no-little-old-lady/,88-year-old liquor store owner who shot alleged thief no 'little old lady',,20200621-0000
https://nypost.com/2020/06/20/one-killed-two-injured-during-shooting-inside-seattles-cop-free-zone/,"1 killed, another injured as bullets fly inside Seattle's cop-free zone",,20200621-0000
https://nypost.com/2020/06/20/tekashi-6ix9ines-ego-could-put-his-life-in-danger-insiders-worry/,'He's got a death wish': Insiders worry Tekashi's ego could put his life in danger,,20200621-0000
https://nypost.com/2020/06/20/democrats-fear-they-cant-compete-with-gop-convention/,Democrats fear they can't compete with expected GOP convention blowout,,20200621-0000
https://nypost.com/2020/06/20/trumps-primary-vote-totals-trounce-previous-incumbents-numbers/,Trump's primary vote totals trounce previous incumbents' numbers,,20200621-0000
https://nypost.com/2020/06/20/missing-autistic-toddler-found-safe-with-familys-dogs/,Missing autistic toddler found safe with family's dogs,,20200621-0000
https://nypost.com/covers/,Browse covers archive,,20200621-0000
https://nypost.com/coronavirus/,Read Latest Updates,,20200621-0000
https://nypost.com/2020/06/20/baseballs-bickering-looks-silly-as-coronavirus-news-gets-worse/,Baseball needs to put everything on hold,,20200621-0000
https://nypost.com/2020/06/20/the-top-12-lines-in-rangers-devils-and-islanders-history/,"The top 12 lines in Rangers, Devils and Islanders history",,20200621-0000
https://nypost.com/2020/06/20/travelers-will-reap-benefits-of-pgas-coronavirus-silver-lining/,Travelers Championship will reap benefits of PGA's coronavirus 'silver lining',,20200621-0000
https://nypost.com/2020/06/20/muhammad-alis-son-says-he-wouldve-hated-black-lives-matters/,Muhammad Ali Jr.: Dad would have hated 'racist' Black Lives Matter,,20200621-0000
https://nypost.com/horoscopes/gemini/,Gemini,,20200621-0000
https://nypost.com/horoscopes/,See all Horoscopes,,20200621-0000
https://nypost.com/2020/06/20/multiple-yankees-members-test-positive-for-coronavirus/,Yankees hit hard by coronavirus again,,20200621-0000
https://nypost.com/2020/06/20/tiz-the-law-cruises-to-victory-at-belmont-stakes/,Tiz the Law cruises to victory at Belmont Stakes,,20200621-0000
https://nypost.com/2020/06/20/tom-brady-calls-out-skinny-rob-gronkowski-in-buccaneers-jersey/,Tom Brady calls out 'skinny' Rob Gronkowski,,20200621-0000
https://nypost.com/2020/06/20/mlb-may-enforce-ties-in-2020-season-to-fight-coronavirus/,MLB considering unprecedented rule change,,20200621-0000
https://nypost.com/2020/06/20/three-top-nyc-doe-execs-leave-embattled-school-system/,Three top DOE execs have now jumped 'Titanic' NYC school system,,20200621-0000
https://nypost.com/2020/06/20/nypd-cops-joke-welcome-to-new-york-when-woman-reports-gunshots/,NYPD cops joke 'Welcome to New York' when woman reports gunshots,,20200621-0000
https://nypost.com/2020/06/20/summer-wont-be-much-fun-for-kids-in-cash-starved-nyc-amid-coronavirus/,Summer won't be much fun for kids in cash-starved NYC amid coronavirus,,20200621-0000
https://nypost.com/2020/06/20/nyc-teachers-segregated-by-race-for-affinity-groups-amid-protests/,NYC teachers segregated by race for 'affinity groups' amid protests,,20200621-0000
https://nypost.com/2020/06/20/birdwatcher-christian-cooper-calls-for-more-cops-in-central-park/,Birdwatcher Christian Cooper calls for more cops in Central Park,,20200621-0000
https://nypost.com/2020/06/20/photographer-mark-seliger-reveals-true-meaning-behind-obama-portrait/,Photographer Mark Seliger reveals true meaning behind Obama portrait,,20200621-0000
https://nypost.com/2020/06/20/connecting-with-my-angels-via-medium-matt-fraser/,Connecting with my angels via medium Matt Fraser,,20200621-0000
https://nypost.com/2020/06/19/kellyanne-conway-and-other-celebs-who-look-like-they-had-plastic-surgery/,Kellyanne Conway wasn't the first famous face to get mysteriously 'refreshed',,20200621-0000
https://nypost.com/2020/06/19/fall-tv-schedule-takes-shape-with-cancellations-renewals-and-additions/,"Fall TV schedule takes shape with cancellations, renewals and additions",,20200621-0000
https://nypost.com/2020/06/19/jimmy-kimmel-needs-to-apologize-for-blackface-sketch-not-take-a-vacation/,"Jimmy Kimmel needs to apologize for blackface sketch, not take a vacation",,20200621-0000
https://nypost.com/2020/06/20/amazon-slammed-for-catering-chicken-and-waffles-on-juneteenth/,Amazon slammed for offering workers chicken and waffles on Juneteenth,,20200621-0000
https://nypost.com/2020/06/19/nyc-hotels-agree-to-strict-cleaning-protocols-amid-coronavirus/,"NYC hotels agree on cleaning, disinfecting standards for reopening",,20200621-0000
https://nypost.com/2020/06/19/apple-shutters-11-recently-opened-stores-as-coronavirus-cases-surge/,Apple shutters 11 recently opened stores as coronavirus cases surge,,20200621-0000
https://nypost.com/2020/06/19/complex-networks-accused-of-having-racist-misogynistic-workplace/,"Digital publisher owned by Hearst and Verizon accused of racism, misogyny",,20200621-0000
https://nypost.com/2020/06/19/amc-reverses-controversial-mask-policy-now-all-guests-must-wear-masks/,AMC reverses controversial mask policy,,20200621-0000
https://nypost.com/2020/06/20/whiny-us-open-tennis-stars-need-to-check-their-privilege/,Whiny US Open tennis stars need to check their privilege,,20200621-0000
https://nypost.com/2020/06/20/de-blasios-agenda-could-put-another-giuliani-in-city-hall/,De Blasio's progressive agenda could put another Giuliani in City Hall,,20200621-0000
https://nypost.com/2020/06/19/joe-biden-needs-a-vice-president-who-wont-try-to-steal-his-job/,Joe Biden needs a vice president who won't try to steal his job,,20200621-0000
https://nypost.com/2020/06/19/ousting-thomas-jefferson-sends-message-of-ignorance/,Ousting Thomas Jefferson sends a message of ignorance and denial of America's ideals,,20200621-0000
https://nypost.com/2020/06/19/andrew-cuomos-big-lie-on-nursing-homes-and-the-post/,Andrew Cuomo's big lie on nursing homes and The Post,,20200621-0000
https://nypost.com/2020/06/15/pride-2020-colorful-products-that-give-back-to-lgbt-causes/,Pride 2020: Colorful products to buy that give back to LGBT causes,,20200621-0000
https://nypost.com/2020/06/15/lockdown-is-over-so-stop-dressing-like-slobs/,"Coronavirus lockdown is over, so stop dressing like slobs",,20200621-0000
https://nypost.com/2020/06/20/learn-to-play-the-guitar-from-home-with-these-expert-led-classes/,Learn to play the guitar from home with these expert-led classes,,20200621-0000
https://nypost.com/2020/06/20/this-40-kit-has-everything-you-need-to-upgrade-your-airpods/,This handy $40 kit has everything you need to upgrade your AirPods,,20200621-0000
https://nypost.com/article/spanx-sale/,Spanx takes 50 percent off sculpting bodysuit for one-day flash sale,,20200621-0000
https://nypost.com/article/last-minute-fathers-day-gifts-you-can-send-digitally/,Last-minute Father’s Day 2020 gifts you can send Dad digitally,,20200621-0000
https://nypost.com/list/best-fathers-day-sales/,Here are the best Father’s Day sales to shop right now,,20200621-0000
https://nypost.com/2020/06/20/how-coronavirus-has-forever-changed-sex-and-dating-in-america/,How coronavirus has forever changed sex and dating,,20200621-0000
https://nypost.com/2020/06/20/mountain-lion-may-have-killed-marsupials-at-san-francisco-zoo/,Mountain lion may be responsible for animal massacre at San Francisco Zoo,,20200621-0000
https://nypost.com/2020/06/20/internet-struggles-to-come-up-with-name-for-male-karens/,Tucker? Brandon? Internet struggles with what to call male 'Karens',,20200621-0000
https://nypost.com/2020/06/20/dream-job-alert-brewery-hiring-a-chief-hiking-officer/,Dream job alert: Brewery hiring a chief hiking officer,,20200621-0000
https://nypost.com/2020/06/20/bananas-fighting-deadly-fungus-in-worldwide-crisis/,Bananas fighting deadly fungus in global crisis amid terrible 2020,,20200621-0000
https://nypost.com/2020/06/19/elon-musk-sells-la-mansion-for-30m-amid-quest-to-own-no-house/,Elon Musk sells LA mansion for $29M amid quest to 'own no house',,20200621-0000
https://nypost.com/2020/06/17/stoopers-track-down-artist-ralph-serrano-after-saving-his-works-from-the-street/,'Stoopers' track down artist after saving his works from the street,,20200621-0000
https://nypost.com/2020/06/17/manhattan-townhouse-with-hidden-panic-room-finally-sells/,Manhattan townhouse with hidden panic room finally sells,,20200621-0000
https://nypost.com/2020/06/17/gigi-and-bella-hadid-quietly-spent-millions-on-nyc-real-estate/,Gigi and Bella Hadid quietly spent millions on NYC real estate,,20200621-0000
https://nypost.com/2020/06/17/luann-de-lesseps-lists-upstate-ny-home-for-1-15m/,Luann de Lesseps selling Hudson River home she barely visited,,20200621-0000
https://nypost.com/2020/06/20/inside-the-us-governments-plan-to-blow-up-the-moon/,Inside the US government's plans to blow up the moon,,20200621-0000
https://nypost.com/2020/06/19/jony-ive-ex-apple-design-chief-clashed-with-vr-headset-team/,Ex-design chief reportedly clashed with Apple's VR headset team,,20200621-0000
https://nypost.com/2020/06/19/nasas-next-mars-mission-will-honor-those-fighting-coronavirus/,NASA's next Mars mission will honor those fighting coronavirus,,20200621-0000
https://nypost.com/2020/06/18/facebook-outlines-plans-to-increase-workforce-diversity/,Facebook outlines plans to increase workforce diversity,,20200621-0000
https://nypost.com/2020/06/17/fbi-nabbed-accused-cop-car-arsonist-by-tracing-t-shirt-to-etsy/,FBI nabbed accused cop car arsonist by tracing her T-shirt to Etsy,,20200621-0000
https://nypost.com/2020/06/20/cnn-center-in-atlanta-erects-fence-to-ward-off-protesters/,CNN Center in Atlanta erects fence to ward off protesters,,20200621-0000
https://nypost.com/2020/06/19/twitter-bans-controversial-british-commentator-katie-hopkins/,Twitter bans controversial British conservative commentator,,20200621-0000
https://nypost.com/2020/06/19/gregory-e-miller-cherished-post-entertainment-writer-dies-at-30/,"Gregory E. Miller, cherished Post entertainment writer, dies at 30",,20200621-0000
https://nypost.com/2020/06/18/hearst-magazines-employees-vote-to-decide-union-fate/,Hearst Magazines employees vote to decide union fate,,20200621-0000
https://nypost.com/2020/06/20/us-attorney-geoffrey-berman-steps-down-ends-tug-of-war-with-ag-barr/,"US Attorney Geoffrey Berman steps down, ends tug of war with AG William Barr",,20200621-0030
https://nypost.com/2020/06/20/my-terrifying-5-day-stay-inside-seattles-autonomous-zone/,My terrifying 5-day stay inside Seattle's cop-free zone,,20200621-0030
https://nypost.com/2020/06/20/man-who-filmed-macys-beatdown-of-white-man-says-attack-was-instinct/,Rapper who filmed Macy's beatdown of white man says attack was 'instinct',,20200621-0030
https://nypost.com/2020/06/20/at-least-3-feared-dead-in-terror-related-england-stabbings-report/,At least three feared dead in 'terror-related' stabbings in England: reports,,20200621-0030
https://nypost.com/2020/06/20/kim-jong-uns-princess-sister-is-turning-into-the-terminator/,Kim Jong Un's 'Princess' sister is turning into the Terminator,,20200621-0030
https://nypost.com/2020/06/20/paige-spiranac-my-husband-always-wants-me-to-show-more-cleavage/,Paige Spiranac: ‘My husband always wants me to show more cleavage’,,20200621-0030
https://nypost.com/2020/06/19/the-posts-week-in-photos-new-yorkers-crowd-public-spaces-amid-reopening/,New Yorkers crowd public spaces as reopening continues: The Post’s week in photos,,20200621-0030
https://nypost.com/2020/06/19/juneteenth-celebrations-around-the-country/,Juneteenth celebrations around the country,,20200621-0030
https://nypost.com/2020/06/20/jackie-robinson-would-support-george-floyd-protests-son-says/,Jackie Robinson's son on what father would think of protests,,20200621-0030
https://nypost.com/2020/06/20/alexandria-ocasio-cortez-picks-battles-in-june-primaries/,AOC's 'squad' is more about 'personality' than 'politics',,20200621-0030
https://nypost.com/2020/06/20/burglars-steal-60k-of-saffron-in-london-spice-heist/,Spice heist: Burglars steal $60K of saffron in London,,20200621-0030
https://nypost.com/2020/06/20/liquor-store-owner-88-who-shot-alleged-thief-no-little-old-lady/,88-year-old liquor store owner who shot alleged thief no 'little old lady',,20200621-0030
https://nypost.com/2020/06/20/one-killed-two-injured-during-shooting-inside-seattles-cop-free-zone/,"1 killed, another injured as bullets fly inside Seattle's cop-free zone",,20200621-0030
https://nypost.com/2020/06/20/tekashi-6ix9ines-ego-could-put-his-life-in-danger-insiders-worry/,'He's got a death wish': Insiders worry Tekashi's ego could put his life in danger,,20200621-0030
https://nypost.com/2020/06/20/democrats-fear-they-cant-compete-with-gop-convention/,Democrats fear they can't compete with expected GOP convention blowout,,20200621-0030
https://nypost.com/2020/06/20/trumps-primary-vote-totals-trounce-previous-incumbents-numbers/,Trump's primary vote totals trounce previous incumbents' numbers,,20200621-0030
https://nypost.com/2020/06/20/missing-autistic-toddler-found-safe-with-familys-dogs/,Missing autistic toddler found safe with family's dogs,,20200621-0030
https://nypost.com/covers/,Browse covers archive,,20200621-0030
https://nypost.com/coronavirus/,Read Latest Updates,,20200621-0030
https://nypost.com/2020/06/20/baseballs-bickering-looks-silly-as-coronavirus-news-gets-worse/,Baseball needs to put everything on hold,,20200621-0030
https://nypost.com/2020/06/20/the-top-12-lines-in-rangers-devils-and-islanders-history/,"The top 12 lines in Rangers, Devils and Islanders history",,20200621-0030
https://nypost.com/2020/06/20/travelers-will-reap-benefits-of-pgas-coronavirus-silver-lining/,Travelers Championship will reap benefits of PGA's coronavirus 'silver lining',,20200621-0030
https://nypost.com/horoscopes/gemini/,Gemini,,20200621-0030
https://nypost.com/horoscopes/,See all Horoscopes,,20200621-0030
https://nypost.com/2020/06/20/union-delays-vote-on-mlbs-restart-proposal-after-coronavirus-spike/,Union delays vote on MLB proposal after coronavirus spike,,20200621-0030
https://nypost.com/2020/06/20/tiz-the-law-cruises-to-victory-at-belmont-stakes/,Tiz the Law cruises to victory at Belmont Stakes,,20200621-0030
https://nypost.com/2020/06/20/multiple-yankees-members-test-positive-for-coronavirus/,Yankees hit hard by coronavirus again,,20200621-0030
https://nypost.com/2020/06/20/tom-brady-calls-out-skinny-rob-gronkowski-in-buccaneers-jersey/,Tom Brady calls out 'skinny' Rob Gronkowski,,20200621-0030
https://nypost.com/2020/06/20/three-top-nyc-doe-execs-leave-embattled-school-system/,Three top DOE execs have now jumped 'Titanic' NYC school system,,20200621-0030
https://nypost.com/2020/06/20/nypd-cops-joke-welcome-to-new-york-when-woman-reports-gunshots/,NYPD cops joke 'Welcome to New York' when woman reports gunshots,,20200621-0030
https://nypost.com/2020/06/20/summer-wont-be-much-fun-for-kids-in-cash-starved-nyc-amid-coronavirus/,Summer won't be much fun for kids in cash-starved NYC amid coronavirus,,20200621-0030
https://nypost.com/2020/06/20/nyc-teachers-segregated-by-race-for-affinity-groups-amid-protests/,NYC teachers segregated by race for 'affinity groups' amid protests,,20200621-0030
https://nypost.com/2020/06/20/birdwatcher-christian-cooper-calls-for-more-cops-in-central-park/,Birdwatcher Christian Cooper calls for more cops in Central Park,,20200621-0030
https://nypost.com/2020/06/20/photographer-mark-seliger-reveals-true-meaning-behind-obama-portrait/,Photographer Mark Seliger reveals true meaning behind Obama portrait,,20200621-0030
https://nypost.com/2020/06/20/connecting-with-my-angels-via-medium-matt-fraser/,Connecting with my angels via medium Matt Fraser,,20200621-0030
https://nypost.com/2020/06/19/kellyanne-conway-and-other-celebs-who-look-like-they-had-plastic-surgery/,Kellyanne Conway wasn't the first famous face to get mysteriously 'refreshed',,20200621-0030
https://nypost.com/2020/06/19/fall-tv-schedule-takes-shape-with-cancellations-renewals-and-additions/,"Fall TV schedule takes shape with cancellations, renewals and additions",,20200621-0030
https://nypost.com/2020/06/19/jimmy-kimmel-needs-to-apologize-for-blackface-sketch-not-take-a-vacation/,"Jimmy Kimmel needs to apologize for blackface sketch, not take a vacation",,20200621-0030
https://nypost.com/2020/06/20/amazon-slammed-for-catering-chicken-and-waffles-on-juneteenth/,Amazon slammed for offering workers chicken and waffles on Juneteenth,,20200621-0030
https://nypost.com/2020/06/19/nyc-hotels-agree-to-strict-cleaning-protocols-amid-coronavirus/,"NYC hotels agree on cleaning, disinfecting standards for reopening",,20200621-0030
https://nypost.com/2020/06/19/apple-shutters-11-recently-opened-stores-as-coronavirus-cases-surge/,Apple shutters 11 recently opened stores as coronavirus cases surge,,20200621-0030
https://nypost.com/2020/06/19/complex-networks-accused-of-having-racist-misogynistic-workplace/,"Digital publisher owned by Hearst and Verizon accused of racism, misogyny",,20200621-0030
https://nypost.com/2020/06/19/amc-reverses-controversial-mask-policy-now-all-guests-must-wear-masks/,AMC reverses controversial mask policy,,20200621-0030
https://nypost.com/2020/06/20/whiny-us-open-tennis-stars-need-to-check-their-privilege/,Whiny US Open tennis stars need to check their privilege,,20200621-0030
https://nypost.com/2020/06/20/de-blasios-agenda-could-put-another-giuliani-in-city-hall/,De Blasio's progressive agenda could put another Giuliani in City Hall,,20200621-0030
https://nypost.com/2020/06/19/joe-biden-needs-a-vice-president-who-wont-try-to-steal-his-job/,Joe Biden needs a vice president who won't try to steal his job,,20200621-0030
https://nypost.com/2020/06/19/ousting-thomas-jefferson-sends-message-of-ignorance/,Ousting Thomas Jefferson sends a message of ignorance and denial of America's ideals,,20200621-0030
https://nypost.com/2020/06/19/andrew-cuomos-big-lie-on-nursing-homes-and-the-post/,Andrew Cuomo's big lie on nursing homes and The Post,,20200621-0030
https://nypost.com/2020/06/15/pride-2020-colorful-products-that-give-back-to-lgbt-causes/,Pride 2020: Colorful products to buy that give back to LGBT causes,,20200621-0030
https://nypost.com/2020/06/15/lockdown-is-over-so-stop-dressing-like-slobs/,"Coronavirus lockdown is over, so stop dressing like slobs",,20200621-0030
https://nypost.com/2020/06/20/learn-to-play-the-guitar-from-home-with-these-expert-led-classes/,Learn to play the guitar from home with these expert-led classes,,20200621-0030
https://nypost.com/2020/06/20/this-40-kit-has-everything-you-need-to-upgrade-your-airpods/,This handy $40 kit has everything you need to upgrade your AirPods,,20200621-0030
https://nypost.com/article/spanx-sale/,Spanx takes 50 percent off sculpting bodysuit for one-day flash sale,,20200621-0030
https://nypost.com/article/last-minute-fathers-day-gifts-you-can-send-digitally/,Last-minute Father’s Day 2020 gifts you can send Dad digitally,,20200621-0030
https://nypost.com/list/best-fathers-day-sales/,Here are the best Father’s Day sales to shop right now,,20200621-0030
https://nypost.com/2020/06/20/how-coronavirus-has-forever-changed-sex-and-dating-in-america/,How coronavirus has forever changed sex and dating,,20200621-0030
https://nypost.com/2020/06/20/mountain-lion-may-have-killed-marsupials-at-san-francisco-zoo/,Mountain lion may be responsible for animal massacre at San Francisco Zoo,,20200621-0030
https://nypost.com/2020/06/20/internet-struggles-to-come-up-with-name-for-male-karens/,Tucker? Brandon? Internet struggles with what to call male 'Karens',,20200621-0030
https://nypost.com/2020/06/20/dream-job-alert-brewery-hiring-a-chief-hiking-officer/,Dream job alert: Brewery hiring a chief hiking officer,,20200621-0030
https://nypost.com/2020/06/20/bananas-fighting-deadly-fungus-in-worldwide-crisis/,Bananas fighting deadly fungus in global crisis amid terrible 2020,,20200621-0030
https://nypost.com/2020/06/19/elon-musk-sells-la-mansion-for-30m-amid-quest-to-own-no-house/,Elon Musk sells LA mansion for $29M amid quest to 'own no house',,20200621-0030
https://nypost.com/2020/06/17/stoopers-track-down-artist-ralph-serrano-after-saving-his-works-from-the-street/,'Stoopers' track down artist after saving his works from the street,,20200621-0030
https://nypost.com/2020/06/17/manhattan-townhouse-with-hidden-panic-room-finally-sells/,Manhattan townhouse with hidden panic room finally sells,,20200621-0030
https://nypost.com/2020/06/17/gigi-and-bella-hadid-quietly-spent-millions-on-nyc-real-estate/,Gigi and Bella Hadid quietly spent millions on NYC real estate,,20200621-0030
https://nypost.com/2020/06/17/luann-de-lesseps-lists-upstate-ny-home-for-1-15m/,Luann de Lesseps selling Hudson River home she barely visited,,20200621-0030
https://nypost.com/2020/06/20/inside-the-us-governments-plan-to-blow-up-the-moon/,Inside the US government's plans to blow up the moon,,20200621-0030
https://nypost.com/2020/06/19/jony-ive-ex-apple-design-chief-clashed-with-vr-headset-team/,Ex-design chief reportedly clashed with Apple's VR headset team,,20200621-0030
https://nypost.com/2020/06/19/nasas-next-mars-mission-will-honor-those-fighting-coronavirus/,NASA's next Mars mission will honor those fighting coronavirus,,20200621-0030
https://nypost.com/2020/06/18/facebook-outlines-plans-to-increase-workforce-diversity/,Facebook outlines plans to increase workforce diversity,,20200621-0030
https://nypost.com/2020/06/17/fbi-nabbed-accused-cop-car-arsonist-by-tracing-t-shirt-to-etsy/,FBI nabbed accused cop car arsonist by tracing her T-shirt to Etsy,,20200621-0030
https://nypost.com/2020/06/20/cnn-center-in-atlanta-erects-fence-to-ward-off-protesters/,CNN Center in Atlanta erects fence to ward off protesters,,20200621-0030
https://nypost.com/2020/06/19/twitter-bans-controversial-british-commentator-katie-hopkins/,Twitter bans controversial British conservative commentator,,20200621-0030
https://nypost.com/2020/06/19/gregory-e-miller-cherished-post-entertainment-writer-dies-at-30/,"Gregory E. Miller, cherished Post entertainment writer, dies at 30",,20200621-0030
https://nypost.com/2020/06/18/hearst-magazines-employees-vote-to-decide-union-fate/,Hearst Magazines employees vote to decide union fate,,20200621-0030
https://nypost.com/2020/06/20/trump-campaign-blames-protests-media-for-modest-rally-crowd-in-tulsa/,"Trump campaign blames protests, media for modest rally crowd in Tulsa",,20200621-0100
https://nypost.com/2020/06/20/us-attorney-geoffrey-berman-steps-down-ends-tug-of-war-with-ag-barr/,"US Attorney Geoffrey Berman steps down, ends tug of war with AG William Barr",,20200621-0100
https://nypost.com/2020/06/20/my-terrifying-5-day-stay-inside-seattles-autonomous-zone/,My terrifying 5-day stay inside Seattle's cop-free zone,,20200621-0100
https://nypost.com/2020/06/20/man-who-filmed-macys-beatdown-of-white-man-says-attack-was-instinct/,Rapper who filmed Macy's beatdown of white man says attack was 'instinct',,20200621-0100
https://nypost.com/2020/06/20/kim-jong-uns-princess-sister-is-turning-into-the-terminator/,Kim Jong Un's 'Princess' sister is turning into the Terminator,,20200621-0100
https://nypost.com/2020/06/20/paige-spiranac-my-husband-always-wants-me-to-show-more-cleavage/,How Paige Spiranac became golf’s sex symbol — and pissed off other players,,20200621-0100
https://nypost.com/2020/06/19/the-posts-week-in-photos-new-yorkers-crowd-public-spaces-amid-reopening/,New Yorkers crowd public spaces as reopening continues: The Post’s week in photos,,20200621-0100
https://nypost.com/2020/06/19/juneteenth-celebrations-around-the-country/,Juneteenth celebrations around the country,,20200621-0100
https://nypost.com/2020/06/20/jackie-robinson-would-support-george-floyd-protests-son-says/,Jackie Robinson's son on what father would think of protests,,20200621-0100
