,name,text,id,url,created_at
0,DailySignal,‘Plot to Change America’ Driven by Identity Politics https://t.co/FMMgYhMyPh https://t.co/YZbxXrvl8x,1296961285037400064,https://www.dailysignal.com/2020/08/20/plot-to-change-america-driven-by-identity-politics/,Sat Aug 22 00:04:01 +0000 2020
0,DailySignal,"RT @li88yinc: School district demands that parents not observe remote learning classroom 

https://t.co/cVyF6iFx1W",1296973111464808449,https://thepostmillennial.com/school-district-demands-that-parents-not-observe-remote-learning-classroom,Sat Aug 22 00:51:01 +0000 2020
0,DailySignal,"RT @AGHamilton29: Still crazy knowing that we have businesses shut down and limits on gatherings due to the pandemic, but these mobs of anarchists are free to terrorize residential neighborhoods at night.Still crazy knowing that we have businesses shut down and limits on gatherings due to the pandemic, but these mobs… https://t.co/HjJxf6LDo5",1297058387155443713,https://twitter.com/i/web/status/1297044543217508352,Sat Aug 22 06:29:52 +0000 2020
0,DailySignal,"RT @MrAndyNgo: Antifa protesters are marching in residential areas in NE Portland and shining lights into people homes, demanding they come out. #PortlandRiots #antifa https://t.co/DlsNMegg1hAntifa protesters are marching in residential areas in NE Portland and shining lights into people homes, demanding… https://t.co/xD2cfAwWw5",1297075899523899392,https://twitter.com/i/web/status/1297036843955793923,Sat Aug 22 07:39:27 +0000 2020
0,DailySignal,4 States Supporting Private Schools With COVID-19 Relief Lead Way on Education Choice https://t.co/8Xh9YmVFow https://t.co/EAlJVNcC8s,1297137194281373696,https://www.dailysignal.com/2020/08/18/states-supporting-private-schools-with-covid-19-relief-lead-way-on-education-choice/,Sat Aug 22 11:43:01 +0000 2020
0,DailySignal,The New Zealand government has chosen a strategy more extreme than many others—and one can only hope that it works ultimately for the people of New Zealand. https://t.co/KHo16ANn1i,1297155313246834688,https://www.dailysignal.com/2020/08/17/with-new-zealands-new-lockdown-auckland-is-trapped-in-a-covid-19-nightmare/,Sat Aug 22 12:55:01 +0000 2020
0,DailySignal,"A month ago, President Trump lashed out about a 3-mile section of border wall built by a private company. 

After Steve Bannon was indicted for fraud for his role in the privately funded wall project, Trump offered little sympathy: https://t.co/Kc2vo4UArW",1297156256914866176,https://www.dailysignal.com/2020/08/20/trump-keeps-his-distance-after-bannons-indictment-in-wall-scheme/,Sat Aug 22 12:58:46 +0000 2020
0,DailySignal,"Steve Bannon, Partner Indicted on Charges They Defrauded Border Wall Donors https://t.co/4xlJsH94T5 https://t.co/WD1EeoI4iM",1297162613437140992,https://www.dailysignal.com/2020/08/20/steve-bannon-and-brian-kolfage-indicted-for-allegedly-defrauding-crowdfunded-border-wall-donors/,Sat Aug 22 13:24:01 +0000 2020
0,DailySignal,RT @emzanotti: Two things to notice about this video: (1) this has become a wacky fringe group with insane demands and is threatening the mayor - a Democrat - from the left. And (2) every news org in Chicago has their microphone in her face.Two things to notice about this video: (1) this has become a wacky fringe group with insane demands and is threaten… https://t.co/WM3ElIJkL9,1297171690355593216,https://twitter.com/i/web/status/1297162713114783744,Sat Aug 22 14:00:05 +0000 2020
0,DailySignal,"Black Lives Matter, Antifa, and other progressive groups use the plight of poor black people to organize left-leaning, middle-class, college-educated, guilt-ridden suburbanite whites. 

READ @WE_Williams: https://t.co/Mw3gWo8wCF",1297172677350785026,https://www.dailysignal.com/2020/08/12/are-todays-leftists-truly-marxists/,Sat Aug 22 14:04:01 +0000 2020
0,DailySignal,"Your children are being indoctrinated. 

The education system designed to teach them how to think critically has been weaponized by the radical left to push an anti-American agenda. https://t.co/rYOX5vyOJi",1297190548416143361,https://www.dailysignal.com/2020/08/16/im-a-former-teacher-heres-how-your-children-are-getting-indoctrinated-by-leftist-ideology/,Sat Aug 22 15:15:02 +0000 2020
0,DailySignal,Every month we publish some of the many news stories on defensive gun use that you may have missed... or that probably didn't make it to the national spotlight in the first place. https://t.co/FhpfuOrBqS,1297193815921561600,https://www.dailysignal.com/2020/08/10/defensive-uses-of-guns-in-july-prove-importance-of-removing-barriers-to-ownership/,Sat Aug 22 15:28:01 +0000 2020
