,name,text,id,url,created_at
0,BreitbartNews,RT @LibertarianBlue: Breitbart Senior Tech Correspondent details Facebook and Google's censorship of conservative news  https://t.co/uLftdviLLd,1289650239557627905,https://www.kusi.com/breitbart-senior-tech-correspondent-details-facebook-and-googles-censorship-of-conservative-news/,Sat Aug 01 19:52:32 +0000 2020
0,BreitbartNews,Mayor Lori Lightfoot’s (D) Chicago witnessed a 139 percent increase in murder during July 2020 when compared to July 2019. https://t.co/cIqSRDNS4g,1289670441326407681,https://www.breitbart.com/politics/2020/08/01/mayor-lightfoots-chicago-sees-139-percent-increase-murder/,Sat Aug 01 21:12:48 +0000 2020
0,BreitbartNews,"POLLAK: A Biden win would vindicate Democrats' strategy: to frighten the public about Trump, deny his legitimacy, and remove him from office. https://t.co/qXrpYHxmiR",1289670831874793473,https://www.breitbart.com/politics/2020/07/27/pollak-will-voters-reward-democrats-for-anti-democratic-tactics/?utm_medium=social&utm_source=facebook,Sat Aug 01 21:14:21 +0000 2020
0,BreitbartNews,BRAIN FREEZE: Joe Biden appeared to be unaware of President Trump's ongoing efforts to combat the coronavirus and suggested the President do something that he is already doing. https://t.co/mgzOr6WvSv,1289684952418672640,https://www.breitbart.com/politics/2020/07/31/joe-biden-suggests-trump-do-something-on-covid-19-that-trump-is-already-doing/?utm_source=facebook&utm_medium=social,Sat Aug 01 22:10:28 +0000 2020
0,BreitbartNews,Oh no...not the BLM MLB shutting down! *yawn* https://t.co/0UPNtAsJma,1289699527457255425,https://www.breitbart.com/news/mlb-commissioner-rob-manfred-warns-2020-season-could-be-shut-down/?utm_source=facebook&utm_medium=social&__twitter_impression=true&__twitter_impression=true&__twitter_impression=true&__twitter_impression=true&__twitter_impression=true&__twitter_impression=true&__twitter_impression=true&__twitter_impression=true&__twitter_impression=true&__twitter_impression=true&__twitter_impression=true&__twitter_impression=true&__twitter_impression=true&__twitter_impression=true&__twitter_impression=true&__twitter_impression=true&__twitter_impression=true&__twitter_impression=true&__twitter_impression=true,Sat Aug 01 23:08:23 +0000 2020
0,BreitbartNews,President Donald Trump criticized America’s top billionaires on Saturday for massively increasing their net worth during the coronavirus pandemic. https://t.co/vLpZQlO1JW,1289709540540395525,https://www.breitbart.com/politics/2020/08/01/donald-trump-demands-change-too-much-income-disparity-after-covid-19/,Sat Aug 01 23:48:10 +0000 2020
