,name,text,id,url,created_at
0,arstechnica,"Building Meet and Chat into Gmail is basically Google resurrecting the old Google Buzz strategy of ""Shove our new product into Gmail."" https://t.co/z1d6DPqkQw",1296615815836573696,https://arstechnica.com/gadgets/2020/08/gmails-all-in-one-productivity-revamp-starts-rolling-out-to-gsuite-users/?utm_brand=ars&utm_social-type=owned&utm_medium=social&utm_source=twitter,Fri Aug 21 01:11:15 +0000 2020
0,arstechnica,"Tesla stock reaches $2,000 amid soaring interest in EV companies https://t.co/s0Sjwtdca8 by @binarybits",1296625073500098561,https://arstechnica.com/cars/2020/08/tesla-stock-reaches-2000-amid-soaring-interest-in-ev-companies/?utm_brand=arstechnica&utm_source=twitter&utm_social-type=owned&utm_medium=social,Fri Aug 21 01:48:02 +0000 2020
0,arstechnica,"The 2020 Hyundai Veloster Turbo is a quirky hot hatch, but not enough fun :( https://t.co/7dGIQ6xDKj https://t.co/NoIhKmXQxT",1296695733693886464,https://arstechnica.com/cars/2020/08/the-2020-hyundai-veloster-turbo-a-quirky-hot-hatch-but-not-enough-fun/?utm_source=twitter&utm_social-type=owned&utm_brand=ars&utm_medium=social,Fri Aug 21 06:28:49 +0000 2020
0,arstechnica,"Rocket Report: Raptor engine sets record, Northrop may say “Aloha!” to Omega https://t.co/UK9ZQz7woh by @SciGuySpace",1296766759047966721,https://arstechnica.com/science/2020/08/rocket-report-raptor-engine-sets-record-northrop-may-say-aloha-to-omega/?utm_brand=arstechnica&utm_source=twitter&utm_social-type=owned&utm_medium=social,Fri Aug 21 11:11:02 +0000 2020
0,arstechnica,Pixel 5 renders show Google returning to rear fingerprint reader https://t.co/YKHanWp7FQ by @RonAmadeo,1296823638382043138,https://arstechnica.com/gadgets/2020/08/pixel-5-renders-suggest-google-is-scrapping-face-id-clone-soli-air-gestures/?utm_brand=arstechnica&utm_source=twitter&utm_social-type=owned&utm_medium=social,Fri Aug 21 14:57:03 +0000 2020
0,arstechnica,"One more reason to love #NBABubble basketball? The league helped a new faster, cheaper, more abundant #COVID19 saliva test become a reality https://t.co/5qwphQP5zA",1296826018959896580,https://arstechnica.com/science/2020/08/covid-spit-test-is-faster-cheaper-avoids-shortages-and-now-greenlit-by-fda/?utm_source=twitter&utm_brand=ars&utm_social-type=owned&utm_medium=social,Fri Aug 21 15:06:31 +0000 2020
0,arstechnica,"Untested COVID-19 vaccine, Sputnik V, begins 40,000-person trial next week https://t.co/Z64pHxfJRY by @BethMarieMole",1296836720843988992,https://arstechnica.com/science/2020/08/untested-covid-19-vaccine-sputnik-v-begins-40000-person-trial-next-week/?utm_brand=arstechnica&utm_source=twitter&utm_social-type=owned&utm_medium=social,Fri Aug 21 15:49:02 +0000 2020
0,arstechnica,Ancient lake sites suggest lots of precipitation on Mars https://t.co/wo3qmY4yoA by @j_timmer,1296839744245174275,https://arstechnica.com/science/2020/08/studying-mars-former-lakes-to-figure-out-how-much-rain-and-snow-once-fell/?utm_brand=arstechnica&utm_source=twitter&utm_social-type=owned&utm_medium=social,Fri Aug 21 16:01:03 +0000 2020
0,arstechnica,"Not exactly a fun subject, but any excuse to rewatch Godzilla and WarGames is an excuse worth taking https://t.co/h0yRMrFzH8",1296844525118398465,https://arstechnica.com/gaming/2020/08/lest-we-forget-mark-75-years-of-the-atomic-bomb-with-the-ars-watch-list/?utm_medium=social&utm_source=twitter&utm_social-type=owned&utm_brand=ars,Fri Aug 21 16:20:03 +0000 2020
