,name,text,id,url,created_at
0,TechCrunch,Greycroft has rounded up $678 million in capital across two new funds https://t.co/NKu5F0HStV by @cookie,1313665021684133893,https://techcrunch.com/2020/10/06/greycroft-has-rounded-up-678-million-in-capital-across-two-new-funds/?tpcc=ECTW2020,Wed Oct 07 02:18:42 +0000 2020
0,TechCrunch,Helsinki rides the Slush wave toward a booming startup future https://t.co/tO7fTp9WSq by @mikebutcher,1313705812825698304,https://techcrunch.com/2020/10/06/helsinki-rides-the-slush-wave-toward-a-booming-startup-future/?tpcc=ECTW2020,Wed Oct 07 05:00:47 +0000 2020
0,TechCrunch,Helsinki rides the Slush wave toward a booming startup future https://t.co/JZqydLjMaH by @mikebutcher,1313708525785358337,https://techcrunch.com/2020/10/06/helsinki-rides-the-slush-wave-toward-a-booming-startup-future/?tpcc=ECTW2020,Wed Oct 07 05:11:34 +0000 2020
0,TechCrunch,Dictionary app Reverso launches desktop app https://t.co/5gH19EvIqv by @romaindillet,1313779794555830274,https://techcrunch.com/2020/10/07/dictionary-app-reverso-launches-desktop-app/?tpcc=ECTW2020,Wed Oct 07 09:54:46 +0000 2020
0,TechCrunch,Big tech blows a collective raspberry at the House's antitrust report https://t.co/iKhpdWqL6V by @riptari,1313802985139515392,https://techcrunch.com/2020/10/07/big-tech-blows-a-collective-raspberry-at-the-houses-antitrust-report/?tpcc=ECTW2020,Wed Oct 07 11:26:55 +0000 2020
0,TechCrunch,Shogun raises $35M to help brands take on Amazon with faster and better sites of their own https://t.co/x9i9GZz48y by @ingridlunden,1313803103217553408,https://techcrunch.com/2020/10/07/shogun-raises-35m-to-help-brands-take-on-amazon-with-faster-and-better-sites-of-their-own/?tpcc=ECTW2020,Wed Oct 07 11:27:23 +0000 2020
0,TechCrunch,Apple brings Health Records to iPhone in the UK and Canada https://t.co/RIATuOu9tH by @etherington,1313835433525215232,https://techcrunch.com/2020/10/07/apple-brings-health-records-to-iphone-in-the-uk-and-canada/?tpcc=ECTW2020,Wed Oct 07 13:35:51 +0000 2020
0,TechCrunch,"Uber still sees micromobility and AVs in its future, and could push Prop 22 beyond California https://t.co/1ReBQsdcbw by @meganrosedickey",1313841709034414087,https://techcrunch.com/2020/10/07/uber-micromobility-prop-22-avs/?tpcc=ECTW2020,Wed Oct 07 14:00:48 +0000 2020
0,TechCrunch,European antitrust regulators settle with Broadcom a year after 'interim measures' flex https://t.co/oH9qJgdo79 by @riptari,1313844080405774336,https://techcrunch.com/2020/10/07/european-antitrust-regulators-settle-with-broadcom-a-year-after-interim-measures-flex/?tpcc=ECTW2020,Wed Oct 07 14:10:13 +0000 2020
0,TechCrunch,Nobel laureate Jennifer Doudna shares her perspective on COVID-19 and CRISPR https://t.co/SxdWmddSHv by @etherington,1313855819193221121,https://techcrunch.com/2020/10/07/nobel-laureate-jennifer-doudna-shares-her-perspective-on-covid-19-and-crispr/?tpcc=ECTW2020,Wed Oct 07 14:56:52 +0000 2020
0,TechCrunch,Solvo raises $3M seed round to automatically manage permissions in the cloud https://t.co/RfXsDY5Yb5 by @fredericl,1313856824047788032,https://techcrunch.com/2020/10/07/solvo-raises-3m-seed-round-to-automatically-manage-cloud-infrastructure-permissions/?tpcc=ECTW2020,Wed Oct 07 15:00:51 +0000 2020
0,TechCrunch,"DoorDash introduces a new corporate product, DoorDash for Work https://t.co/qWzjn5UPok by @anthonyha",1313856826736357376,https://techcrunch.com/2020/10/07/doordash-for-work/?tpcc=ECTW2020,Wed Oct 07 15:00:52 +0000 2020
0,TechCrunch,Unqork's $207M Series C underscores growing enterprise demand for no-code apps https://t.co/QyGyirgM6t by @alex,1313857139027456000,https://techcrunch.com/2020/10/07/unqorks-207m-series-c-underscores-growing-enterprise-demand-for-no-code-apps/?tpcc=ECTW2020,Wed Oct 07 15:02:06 +0000 2020
0,TechCrunch,See what’s happening on day two of TC Sessions: Mobility 2020. It's not too late to get your tickets to join! https://t.co/yUqViVCIxa,1313860497670901767,https://techcrunch.com/2020/10/07/see-whats-happening-on-day-two-of-tc-sessions-mobility-2020/?tpcc=ECTW2020,Wed Oct 07 15:15:27 +0000 2020
0,TechCrunch,Here's your first look at Boom Supersonic's faster-than-sound XB-1 demonstrator aircraft https://t.co/PXwcbVqgBb by @etherington https://t.co/gYJKNlI0EI,1313864708731080706,https://techcrunch.com/2020/10/07/heres-your-first-look-at-boom-supersonics-faster-than-sound-xb-1-demonstrator-aircraft/,Wed Oct 07 15:32:11 +0000 2020
0,TechCrunch,"Instagram's Threads app now lets you message everyone, like its Direct app once did https://t.co/A9YpHM9h1u by @sarahintampa",1313870135141249027,https://techcrunch.com/2020/10/07/instagrams-threads-app-now-lets-you-message-everyone-like-its-direct-app-once-did/?tpcc=ECTW2020,Wed Oct 07 15:53:45 +0000 2020
0,TechCrunch,YC grad DigitalBrain snags $3.4M seed to streamline customer service tasks https://t.co/wt53HH4Or5 by @ron_miller,1313870463089729538,https://techcrunch.com/2020/10/07/yc-grad-digitalbrain-snags-3-4m-seed-to-streamline-customer-service-tasks/?tpcc=ECTW2020,Wed Oct 07 15:55:03 +0000 2020
0,TechCrunch,Google Assistant gets an incognito-like guest mode https://t.co/uSdmXun1ea by @fredericl,1313887017206517760,https://techcrunch.com/2020/10/07/google-assistant-gets-an-incognito-like-guest-mode/?tpcc=ECTW2020,Wed Oct 07 17:00:50 +0000 2020
0,TechCrunch,Tech-publisher coalition backs new push for browser-level privacy controls https://t.co/h4FG4WtuBl by @riptari,1313898189179760640,https://techcrunch.com/2020/10/07/tech-publisher-coalition-backs-new-push-for-browser-level-privacy-controls/?tpcc=ECTW2020,Wed Oct 07 17:45:14 +0000 2020
0,TechCrunch,Transportation VCs suggest frayed US-China ties will impact mobility markets https://t.co/sPV1fIuKwM by @cookie,1313913194054852609,https://techcrunch.com/2020/10/07/transportation-vcs-suggest-frayed-us-china-ties-will-impact-mobility-markets/?tpcc=ECTW2020,Wed Oct 07 18:44:51 +0000 2020
0,TechCrunch,Decrypted: The major ransomware attack you probably didn't hear about https://t.co/yzoHnpU6YZ by @zackwhittaker,1313916029391843331,https://techcrunch.com/2020/10/07/decrypted-blackbaud-ransomware-attack-gets-worse/?tpcc=ECTW2020,Wed Oct 07 18:56:07 +0000 2020
0,TechCrunch,"Media roundup: Google to cut big checks for news publishers, Substack continues to draw top creators, more https://t.co/4MyMrrRsow by @anthonyha",1313921945935675392,https://techcrunch.com/2020/10/07/media-roundup-google-to-cut-big-checks-for-news-publishers-substack-continues-to-draw-top-creators-more/?tpcc=ECTW2020,Wed Oct 07 19:19:38 +0000 2020
0,TechCrunch,Here's the curtain raise on the Sight Tech Global agenda https://t.co/K5qWZFV2sU by @neddesmond,1313930117987655680,https://techcrunch.com/2020/10/07/heres-the-curtain-raise-on-the-sight-tech-global-agenda/?tpcc=ECTW2020,Wed Oct 07 19:52:06 +0000 2020
0,TechCrunch,"Media roundup: Google to cut big checks for news publishers, Substack continues to draw top creators, more https://t.co/4MyMrrRsow by @anthonyha https://t.co/9BmQUaGxdL",1313930729643016203,https://techcrunch.com/2020/10/07/media-roundup-google-to-cut-big-checks-for-news-publishers-substack-continues-to-draw-top-creators-more/?tpcc=ECTW2020,Wed Oct 07 19:54:32 +0000 2020
0,TechCrunch,Facebook: Trump can't recruit 'army' of poll watchers under new voter intimidation rules https://t.co/qb0JOzsUF7 by @tayhatmaker,1313954960669913089,https://techcrunch.com/2020/10/07/facebook-poll-watching-trump-election-political-ads/?tpcc=ECTW2020,Wed Oct 07 21:30:49 +0000 2020
0,TechCrunch,Startups joining SK Telecom's accelerator include AI-driven mapping and vision for delivery robots https://t.co/KwdLYsYi9E by @mikebutcher,1313957104412233730,https://techcrunch.com/2020/10/07/startups-joining-sk-telecoms-accelerator-include-ai-driven-mapping-and-vision-for-delivery-robots/?tpcc=ECTW2020,Wed Oct 07 21:39:20 +0000 2020
0,TechCrunch,Daily Crunch: Big tech responds to antitrust report https://t.co/WxKRneEtXy by @anthonyha,1313964590263341059,https://techcrunch.com/2020/10/07/daily-crunch-big-tech-responds-to-antitrust-report/?tpcc=ECTW2020,Wed Oct 07 22:09:05 +0000 2020
0,TechCrunch,"Arm CEO Simon Segars discusses AI, data centers, getting acquired by Nvidia and more https://t.co/wNyIGA3tK9",1313970219380076544,https://techcrunch.com/2020/10/06/arm-ceo-simon-segars-discusses-ai-data-centers-getting-acquired-by-nvidia-and-more/?tpcc=ECTW2020,Wed Oct 07 22:31:27 +0000 2020
