,name,text,id,url,created_at
0,BreitbartNews,American Citizens are coming together to support Law Enforcement as the Woke Leftist Mob continues its destruction. https://t.co/EbHYevQDue,1285729348662722560,https://www.breitbart.com/crime/2020/07/19/community-comes-together-clean-up-statue-fallen-officer/?utm_medium=social&utm_source=facebook,Wed Jul 22 00:12:19 +0000 2020
0,BreitbartNews,"Conservative author and entrepreneur Michelle Malkin and other conservative activists were violently attacked by Antifa and Black Lives Matter supporters at a ""Back the Blue"" rally in Denver, Colorado. https://t.co/JEicSyrSYG",1285734686241816576,https://www.breitbart.com/politics/2020/07/20/michelle-malkin-others-assaulted-by-antifa-at-pro-police-rally-in-denver/?utm_source=facebook&utm_medium=social&__twitter_impression=true&__twitter_impression=true,Wed Jul 22 00:33:31 +0000 2020
0,BreitbartNews,RT @kimguilfoyle: Amazing day! Trump Raises $20 Million in First-Ever Virtual Fundraiser https://t.co/ezQlob9QZ0,1285737409792086016,https://www.breitbart.com/politics/2020/07/21/trump-raises-20-million-from-300000-donors-in-first-ever-virtual-fundraiser/,Wed Jul 22 00:44:20 +0000 2020
0,BreitbartNews,"President Donald Trump on Tuesday kicks off eight weeks of presidential action, outlining what four more years in office will look like. https://t.co/VN1MjLtUz7",1285741640154517504,https://www.breitbart.com/politics/2020/07/21/donald-trump-kicks-off-eight-week-action-sprint-toward-election-day/?utm_source=facebook&utm_medium=social&__twitter_impression=true,Wed Jul 22 01:01:09 +0000 2020
0,BreitbartNews,"The Royal Navy has succumbed to political correctness, reportedly banning the terms ""unmanned"" and ""manpower"" over sexism fears. https://t.co/nt44rsWlP6",1285747165680279552,https://www.breitbart.com/europe/2020/07/21/woke-distraction-royal-navy-bans-sexist-terms-like-manpower-unmanned/?utm_medium=social&utm_source=facebook,Wed Jul 22 01:23:06 +0000 2020
