,name,text,id,url,created_at
0,BBCWorld,Covid-19: US pulls plan to give early vaccine to Santa Claus performers https://t.co/8acJyj8T8r,1320521288964866048,https://www.bbc.com/news/world-us-canada-54686844?xtor=AL-72-%5Bpartner%5D-%5Bbbc.news.twitter%5D-%5Bheadline%5D-%5Bnews%5D-%5Bbizdev%5D-%5Bisapi%5D&at_custom3=%40BBCWorld&at_custom4=68ADE7E6-1721-11EB-BB47-45F04744363C&at_custom2=twitter&at_custom1=%5Bpost+type%5D&at_campaign=64&at_medium=custom7,Mon Oct 26 00:23:04 +0000 2020
0,BBCWorld,Egypt sex attacks fuel 'feminist revolution' https://t.co/AnHZITi3Q7,1320531532495421440,https://www.bbc.com/news/world-middle-east-54643463?xtor=AL-72-%5Bpartner%5D-%5Bbbc.news.twitter%5D-%5Bheadline%5D-%5Bnews%5D-%5Bbizdev%5D-%5Bisapi%5D&at_custom3=%40BBCWorld&at_custom4=17FDE408-1727-11EB-BB47-45F04744363C&at_custom2=twitter&at_custom1=%5Bpost+type%5D&at_campaign=64&at_medium=custom7,Mon Oct 26 01:03:46 +0000 2020
0,BBCWorld,US election 2020: Indian and Pakistani diaspora rally together https://t.co/LVJ5noOcry,1320533208908312578,https://www.bbc.com/news/world-asia-india-54640998?xtor=AL-72-%5Bpartner%5D-%5Bbbc.news.twitter%5D-%5Bheadline%5D-%5Bnews%5D-%5Bbizdev%5D-%5Bisapi%5D&at_campaign=64&at_medium=custom7&at_custom2=twitter&at_custom1=%5Bpost+type%5D&at_custom3=%40BBCWorld&at_custom4=05EF094E-1728-11EB-BB47-45F04744363C,Mon Oct 26 01:10:25 +0000 2020
0,BBCWorld,Tanzania elections: Why pop stars are hailing President Magufuli https://t.co/G5qZT1wmoh,1320534339709505537,https://www.bbc.com/news/world-africa-54073206?xtor=AL-72-%5Bpartner%5D-%5Bbbc.news.twitter%5D-%5Bheadline%5D-%5Bnews%5D-%5Bbizdev%5D-%5Bisapi%5D&at_custom4=A545417A-1728-11EB-BB47-45F04744363C&at_custom3=%40BBCWorld&at_custom1=%5Bpost+type%5D&at_custom2=twitter&at_campaign=64&at_medium=custom7,Mon Oct 26 01:14:55 +0000 2020
0,BBCWorld,China tests entire city of Kashgar in Xinjiang after virus outbreak https://t.co/GBpw4KUaHP,1320572849623629824,https://www.bbc.com/news/world-asia-china-54687533?xtor=AL-72-%5Bpartner%5D-%5Bbbc.news.twitter%5D-%5Bheadline%5D-%5Bnews%5D-%5Bbizdev%5D-%5Bisapi%5D&at_custom4=074712C6-173E-11EB-BB47-45F04744363C&at_custom3=%40BBCWorld&at_medium=custom7&at_campaign=64&at_custom2=twitter&at_custom1=%5Bpost+type%5D,Mon Oct 26 03:47:57 +0000 2020
0,BBCWorld,China Communist Party plenum kicks off in Beijing https://t.co/UintgDop91,1320580216654319617,https://www.bbc.com/news/world-asia-china-54626091?xtor=AL-72-%5Bpartner%5D-%5Bbbc.news.twitter%5D-%5Bheadline%5D-%5Bnews%5D-%5Bbizdev%5D-%5Bisapi%5D&at_medium=custom7&at_campaign=64&at_custom2=twitter&at_custom1=%5Bpost+type%5D&at_custom4=1D50CCF2-1742-11EB-BB47-45F04744363C&at_custom3=%40BBCWorld,Mon Oct 26 04:17:13 +0000 2020
0,BBCWorld,"Belarusian opposition leader Svetlana Tikhanovskaya calls for nationwide strike to begin after police fired stun grenades at crowds marching against President Lukashenko

https://t.co/aBjdaO3lpC https://t.co/nrTi5eNlqd",1320643795021684737,https://www.bbc.co.uk/news/world-europe-54684753,Mon Oct 26 08:29:51 +0000 2020
0,BBCWorld,"Melbourne, Australia to exit 112-day lockdown after recording no new coronavirus cases for first time since June https://t.co/i8OPznoCkU",1320647497887453184,https://www.bbc.co.uk/news/world-australia-54686812?at_custom4=375F1756-1766-11EB-A37E-15DE39982C1E&at_custom1=%5Bpost+type%5D&at_custom2=twitter&at_campaign=64&at_custom3=%40BBCWorld&at_medium=custom7,Mon Oct 26 08:44:34 +0000 2020
0,BBCWorld,"US ""not going to control pandemic"" admits Trump's chief of staff Mark Meadows https://t.co/QDoHgQVEZY",1320650801807806465,https://www.bbc.co.uk/news/election-us-2020-54687096?at_custom4=C12E69E2-1765-11EB-BFE1-F38C4D484DA4&at_custom3=%40BBCWorld&at_custom2=twitter&at_medium=custom7&at_custom1=%5Bpost+type%5D&at_campaign=64,Mon Oct 26 08:57:42 +0000 2020
0,BBCWorld,"RT @BBCBusiness: ""We haven't got Covid here yet""

Sian Williams has lived on Gili Trawangan, a tiny island in Indonesia, for the last eight years

She takes us through a week in her life during the coronavirus pandemic

#MyMoney 

https://t.co/pcVsrV3m5H",1320652152621174786,https://www.bbc.co.uk/news/business-54615937,Mon Oct 26 09:03:04 +0000 2020
0,BBCWorld,Pakistan's PM asks Facebook to ban Islamophobic content https://t.co/vN3JytPfft,1320666544351989762,https://www.bbc.com/news/world-asia-54689283?xtor=AL-72-%5Bpartner%5D-%5Bbbc.news.twitter%5D-%5Bheadline%5D-%5Bnews%5D-%5Bbizdev%5D-%5Bisapi%5D&at_campaign=64&at_medium=custom7&at_custom1=%5Bpost+type%5D&at_custom2=twitter&at_custom3=%40BBCWorld&at_custom4=161BE188-176F-11EB-BB47-45F04744363C,Mon Oct 26 10:00:15 +0000 2020
0,BBCWorld,"Millions of highly polluting used cars from rich countries being ""dumped"" on developing nations, according to UN report https://t.co/9bro3KMICg",1320667637265977347,https://www.bbc.co.uk/news/science-environment-54665545?at_medium=custom7&at_custom1=%5Bpost+type%5D&at_custom3=%40BBCWorld&at_custom2=twitter&at_campaign=64&at_custom4=C80F6AC0-1771-11EB-9DE7-FEF9923C408C,Mon Oct 26 10:04:36 +0000 2020
0,BBCWorld,"Italy brings in sweeping new coronavirus measures

Gyms, pools, cinemas and theatres close, while restaurants and bars cut short their table service https://t.co/YEh36eeqvh",1320692858530205696,https://www.bbc.com/news/world-europe-54688846?xtor=AL-72-%5Bpartner%5D-%5Bbbc.news.twitter%5D-%5Bheadline%5D-%5Bnews%5D-%5Bbizdev%5D-%5Bisapi%5D&at_campaign=64&at_medium=custom7&at_custom2=twitter&at_custom1=%5Bpost+type%5D&at_custom3=%40BBCWorld&at_custom4=7B6FF240-177E-11EB-BB47-45F04744363C,Mon Oct 26 11:44:49 +0000 2020
0,BBCWorld,"Google, Facebook &amp; Microsoft should be paying more corporation tax in developing nations, aid charity says
https://t.co/Hx7b2iw52j",1320702848276045824,https://www.bbc.co.uk/news/business-54691572?at_custom3=%40BBCWorld&at_custom2=twitter&at_custom1=%5Bpost+type%5D&at_medium=custom7&at_campaign=64&at_custom4=9608C648-1785-11EB-9AA1-482416F31EAE,Mon Oct 26 12:24:31 +0000 2020
0,BBCWorld,"Taylor Swift becomes only artist to sell a million copies of an album in the US in 2019 &amp; 2020
https://t.co/rNGGfpZQXi",1320705428523786246,https://www.bbc.co.uk/news/entertainment-arts-54689800?at_custom4=06243E76-1786-11EB-B93E-59944D484DA4&at_custom2=twitter&at_custom3=%40BBCWorld&at_medium=custom7&at_custom1=%5Bpost+type%5D&at_campaign=64,Mon Oct 26 12:34:46 +0000 2020
0,BBCWorld,"RT @bbcworldservice: These children were studying at school - then, they woke up in hospital

@LivvyLePoids finds out how a toxic waste crisis, which hospitalised hundreds of people, has impacted the lives of young people in Pasir Gudang, Malaysia https://t.co/vZHzO1nsbQ https://t.co/MeLKbeqDx9",1320710479560478722,https://www.bbc.co.uk/news/av/world-asia-54668829?at_medium=custom7&at_custom1=%5Bpost+type%5D&at_custom3=BBC+World+Service&at_custom2=twitter&at_custom4=A3AF6DB4-177C-11EB-B828-83FC923C408C&at_campaign=64,Mon Oct 26 12:54:50 +0000 2020
0,BBCWorld,Irish couple in their 80s finally marry 40 years after meeting https://t.co/12d69JCVRi,1320714724615606273,https://www.bbc.com/news/world-europe-54691038?xtor=AL-72-%5Bpartner%5D-%5Bbbc.news.twitter%5D-%5Bheadline%5D-%5Bnews%5D-%5Bbizdev%5D-%5Bisapi%5D&at_medium=custom7&at_campaign=64&at_custom2=twitter&at_custom1=%5Bpost+type%5D&at_custom3=%40BBCWorld&at_custom4=9B9DFB9E-1787-11EB-BB47-45F04744363C,Mon Oct 26 13:11:42 +0000 2020
0,BBCWorld,Turkey's President Erdogan called on Turks to boycott French goods amid row over France's tougher stance on radical Islam https://t.co/UAPyng4yZ6,1320717310643048449,https://www.bbc.com/news/world-europe-54692485?xtor=AL-72-%5Bpartner%5D-%5Bbbc.news.twitter%5D-%5Bheadline%5D-%5Bnews%5D-%5Bbizdev%5D-%5Bisapi%5D&at_medium=custom7&at_campaign=64&at_custom1=%5Bpost+type%5D&at_custom2=twitter&at_custom3=%40BBCWorld&at_custom4=0F883C7E-178B-11EB-BB47-45F04744363C,Mon Oct 26 13:21:59 +0000 2020
0,BBCWorld,"More than 50 people have been killed by 'Russian air strikes' in Idlib, reports say https://t.co/0EWagdY2AZ",1320725097691447296,https://www.bbc.com/news/world-middle-east-54693472?xtor=AL-72-%5Bpartner%5D-%5Bbbc.news.twitter%5D-%5Bheadline%5D-%5Bnews%5D-%5Bbizdev%5D-%5Bisapi%5D&at_custom2=twitter&at_custom1=%5Bpost+type%5D&at_campaign=64&at_medium=custom7&at_custom3=%40BBCWorld&at_custom4=D3FE8D80-178E-11EB-BB47-45F04744363C,Mon Oct 26 13:52:55 +0000 2020
0,BBCWorld,"All the latest news from the US election as Amy Coney Barrett v Hilary Clinton memes emerge ⬇️

https://t.co/lgToIKRapf",1320727525543301122,https://www.bbc.co.uk/news/election-us-2020-54689293?at_custom2=twitter&at_medium=custom7&at_custom3=%40BBCWorld&at_custom1=%5Bpost+type%5D&at_custom4=B64C8304-178F-11EB-B155-2600933C408C&at_campaign=64,Mon Oct 26 14:02:34 +0000 2020
0,BBCWorld,"The Czech Republic was initially praised for its response to the Covid-19 pandemic

Now the country is preparing for the worst - what went wrong? https://t.co/u3dViRkK0w",1320731248227221507,https://www.bbc.com/news/world-europe-54639351?xtor=AL-72-%5Bpartner%5D-%5Bbbc.news.twitter%5D-%5Bheadline%5D-%5Bnews%5D-%5Bbizdev%5D-%5Bisapi%5D&at_custom3=%40BBCWorld&at_custom4=997BA34C-1792-11EB-BB47-45F04744363C&at_custom1=%5Bpost+type%5D&at_custom2=twitter&at_medium=custom7&at_campaign=64,Mon Oct 26 14:17:22 +0000 2020
0,BBCWorld,Workers and students strike in Belarus after call by opposition leader Svetlana Tikhanovskaya to press for President Lukashenko's resignation https://t.co/hFpxVGKf3e,1320737703755943938,https://www.bbc.co.uk/news/world-europe-54684753?at_custom3=%40BBCWorld&at_medium=custom7&at_custom1=%5Bpost+type%5D&at_custom2=twitter&at_custom4=A32B34FA-1794-11EB-BF9E-7801933C408C&at_campaign=64,Mon Oct 26 14:43:01 +0000 2020
0,BBCWorld,Therapy patients blackmailed for cash after clinic data breach in Finland https://t.co/7vbCXYn5Fx,1320741568446386181,https://www.bbc.co.uk/news/technology-54692120?at_custom1=%5Bpost+type%5D&at_custom4=C329166E-1794-11EB-8075-08E839982C1E&at_campaign=64&at_custom3=%40BBCWorld&at_medium=custom7&at_custom2=twitter,Mon Oct 26 14:58:22 +0000 2020
0,BBCWorld,Jack Ma's Chinese financial technology giant Ant Group set for record $34bn stock market listing https://t.co/OOvFjk4nZQ,1320754429776302082,https://www.bbc.com/news/business-54692537?xtor=AL-72-%5Bpartner%5D-%5Bbbc.news.twitter%5D-%5Bheadline%5D-%5Bnews%5D-%5Bbizdev%5D-%5Bisapi%5D&at_custom4=04062BB0-179D-11EB-BB47-45F04744363C&at_custom3=%40BBCNews&at_campaign=64&at_medium=custom7&at_custom2=twitter&at_custom1=%5Bpost+type%5D,Mon Oct 26 15:49:29 +0000 2020
0,BBCWorld,Production of cannabis products could become legal on Isle of Man https://t.co/vpbrfWAV4p,1320758624227123216,https://www.bbc.com/news/world-europe-isle-of-man-54694317?xtor=AL-72-%5Bpartner%5D-%5Bbbc.news.twitter%5D-%5Bheadline%5D-%5Bnews%5D-%5Bbizdev%5D-%5Bisapi%5D&at_custom3=%40BBCWorld&at_custom4=4C8AD2A0-179D-11EB-BB47-45F04744363C&at_medium=custom7&at_campaign=64&at_custom2=twitter&at_custom1=%5Bpost+type%5D,Mon Oct 26 16:06:09 +0000 2020
0,BBCWorld,Pakistan's first metro line opens to passengers in Lahore https://t.co/FUjoUfVeOJ,1320762253969362945,https://www.bbc.com/news/world-asia-54692488?xtor=AL-72-%5Bpartner%5D-%5Bbbc.news.twitter%5D-%5Bheadline%5D-%5Bnews%5D-%5Bbizdev%5D-%5Bisapi%5D&at_custom4=A8259BCC-17A2-11EB-BB47-45F04744363C&at_custom3=%40BBCWorld&at_medium=custom7&at_campaign=64&at_custom2=twitter&at_custom1=%5Bpost+type%5D,Mon Oct 26 16:20:34 +0000 2020
0,BBCWorld,"Three men dead after shooting in County Cork, Ireland https://t.co/5RYmFxpfxp",1320771603630858241,https://www.bbc.com/news/uk-northern-ireland-54696561?xtor=AL-72-%5Bpartner%5D-%5Bbbc.news.twitter%5D-%5Bheadline%5D-%5Bnews%5D-%5Bbizdev%5D-%5Bisapi%5D&at_custom4=D01D9BE0-17AA-11EB-BB47-45F04744363C&at_custom3=%40BBCWorld&at_custom2=twitter&at_custom1=%5Bpost+type%5D&at_campaign=64&at_medium=custom7,Mon Oct 26 16:57:43 +0000 2020
