,text,notes,date
https://www.foxnews.com/politics/bidens-notes-suggest-kamala-harris-may-be-his-chosen-running-mate-do-not-hold-grudges,Photo of Biden’s notes may shed light on relationship with Harris,,20200729-0600
https://www.foxnews.com/media/msnbc-chris-hayes-nypd-arrest-kidnapping,MSNBC host called out by colleague after calling NYPD arrest a kidnapping,,20200729-0600
https://www.foxnews.com/media/ben-shapiro-democrats-barr-hearing-absurdity,Ben Shapiro decries Barr hearing as 'moral absurdity': 'Just ridiculous from beginning to end',,20200729-0600
https://www.foxnews.com/auto/houston-drivers-not-paying-tickets-make-550000-ineligible-for-license-renewal-study,"Houston drivers not paying tickets make 550,000 ineligible for license renewal: study",,20200729-0600
https://knewz.com/courtney-love-epstein-book/,"Courtney Love: Jeffrey Epstein should ‘burn in hell,’ claims they never met after she’s found in his address book",,20200729-0600
https://video.foxnews.com/v/6176081037001/,"Ingraham: Berating Barr, befriending rioters",,20200729-0600
https://www.foxnews.com/politics/pennsylvania-health-secretary-condemns-transphobic-attacks-against-her,Pennsylvania health secretary condemns transphobic attacks against her,,20200729-0600
https://www.foxnews.com/us/california-man-apparently-set-on-fire-in-gruesome-death-investigation-underway,"California man apparently set on fire in gruesome death, family claims; investigation underway",,20200729-0600
https://video.foxnews.com/v/6176090046001/,"Sen. Josh Hawley says he has no sympathy for Big Pharma, praises President Trump for standing up to them",,20200729-0600
https://www.foxnews.com/politics/arizona-gop-chair-kelli-ward-has-twitter-account-limited-one-week-ahead-of-state-primary-report,Arizona GOP Chair Kelli Ward has Twitter account ‘limited’ – one week ahead of state primary: report,,20200729-0600
https://www.foxnews.com/media/trey-gowdy-nadler-nyc-violence-barr-hearing,Gowdy challenges Nadler to tell NYC murder victims' families 'that the violence is manufactured',,20200729-0600
https://www.foxnews.com/media/justice-department-kerri-kupec-barr-hearing-democrats,Justice Department spokeswoman laments heated Barr hearing as 'lost opportunity' for Americans,,20200729-0600
https://www.foxnews.com/entertainment/prince-william-gift-kate-middleton-never-let-him-forget,William's ODD gift to his wife,,20200729-0600
https://www.foxnews.com/us/chicago-deputy-police-chief-dead-in-apparent-suicide-soon-after-promotion-officials-say,"Chicago deputy police chief dead in apparent suicide soon after promotion, officials say",,20200729-0600
https://www.foxnews.com/us/texas-surfer-67-helps-save-2-women-from-hannas-rough-water-reports,"Texas surfer, 67, helps save 2 women from Hanna’s rough water: reports",,20200729-0600
https://www.foxnews.com/media/cnn-chris-cuomo-florida-ron-desantis-mishandled-pandemic,Critics question CNN's Cuomo after he condemns Florida gov's COVID response,,20200729-0600
https://www.foxnews.com/media/msnbc-analyst-maya-wiley-leaving-network-nyc-mayoral-run,MSNBC analyst Maya Wiley leaving network to mull NYC mayoral run: reports,,20200729-0600
https://www.foxnews.com/media/detroit-police-chief-we-dont-retreat-here,Detroit police chief explains lack of violent riots in Motor City: 'We don't retreat here',,20200729-0600
https://www.foxnews.com/entertainment/eva-larue-john-callahan-broken-into-car-identity-stolen-death,Late star's ex-wife tells ALL,,20200729-0600
https://www.foxnews.com/us/this-day-in-history-july-29,Prince Charles marries Lady Diana in London -- and other events this day in history,,20200729-0600
https://www.foxnews.com/world/rembrandt-painting-sold-sothebys-record-self-portraits,Rembrandt painting sold at Sotheby's virtual auction shatters record for one of his self-portraits,,20200729-0600
https://www.foxnews.com/entertainment/madonna-shares-same-coronavirus-video-as-trump-instagram-flags-report,"Madonna shares same coronavirus video as Trump, Instagram flags: report",,20200729-0600
https://www.foxbusiness.com/technology/ceo-tim-cook-apple-is-uniquely-american-company-with-no-dominant-market-share,"Apple CEO Cook says his company is ""uniquely American"" with no ""dominant market share""",,20200729-0600
https://www.foxnews.com/politics/trump-press-briefing-coronavirus-hydroxychloroquine-doctor,Trump ends press briefing after defending pro-hydroxychloroquine doctor who says virus has a 'cure',,20200729-0600
https://www.foxbusiness.com/markets/spirit-airlines-says-20-to-30-of-workers-at-risk-of-furloughs,Spirit Airlines says 20% to 30% of workers at risk of furloughs,,20200729-0600
https://www.foxnews.com/world/china-ship-fleet-galapagos-islands-ecuador-navy-alert,Ecuador navy 'on alert' as 260-strong Chinese fleet nears Galapagos Islands,,20200729-0600
https://nation.foxnews.com/watch/24916db76eee8db2f17683df4c14ba50/?cmpid=org=NAT::ag=owned::mc=FNC_display::src=FNC_web::cmp=homepage::add=watch_platform_vd_creative&utm_source=FNC_display&utm_medium=FNC_web&utm_campaign=homepage&utm_content=watch_platform_vd_creative,A football quarterback turned political icon reached across the aisle & grabbed the best of everyone.. Watch how he did it!,,20200729-0600
https://www.foxnews.com/world/head-of-chinese-cdc-says-hes-taking-experimental-coronavirus-drug,Head of Chinese CDC says he's taking experimental coronavirus drug,,20200729-0600
https://www.foxnews.com/us/north-carolina-curfew-alcohol-coronavirus-spike,"As coronavirus cases spike, North Carolina puts curfew on alcohol sales",,20200729-0600
https://www.foxnews.com/politics/why-the-coronavirus-bill-wont-get-finalized-until-the-11th-hour,Why the coronavirus bill won’t get finalized until the 11th hour,,20200729-0600
https://www.foxnews.com/world/coronavirus-leads-to-mass-hunger-killing-10000-children-a-month-un-warns,"Coronavirus leads to mass hunger, killing 10,000 children a month, UN warns",,20200729-0600
https://www.foxnews.com/health/coronavirus-face-mask-face-shield-which-better,Protecting against coronavirus: is a face mask or face shield better?,,20200729-0600
https://www.foxbusiness.com/money/7-common-mistakes-refinancing-into-lower-mortgage-rate,7 common mistakes when refinancing into a low mortgage rate,,20200729-0600
https://www.foxnews.com/opinion/fbi-comey-strzok-mccabe-gregg-jarrett,"Disgraced fired FBI officials Comey, McCabe and Strzok profit from a pathology of lies",,20200729-0600
https://www.foxnews.com/opinion/coronavirus-plan-reopen-oct-1-drs-hotez-and-rimoin,Controlling coronavirus — this plan could allow us to safely reopen by Oct. 1,,20200729-0600
https://www.foxnews.com/opinion/biden-crime-donald-trump-jr,Biden wouldn’t reduce rioting and crime – he’s controlled by left-wing puppet masters,,20200729-0600
https://www.foxnews.com/lifestyle/matchmaker-explains-coparenting-no-romance,"Matchmaker wants family, no romance",,20200729-0600
https://www.foxnews.com/real-estate/gigi-hadid-nyc-apartment-divides-twitter-users,Gigi's decision DIVIDES fans,,20200729-0600
https://www.foxnews.com/entertainment/dwayne-the-rock-johnson-considered-willy-wonka,'The Rock' considered for THIS movie,,20200729-0600
https://www.foxnews.com/entertainment/kim-kardashian-family-shielding-kids,Kim and family 'SHIELDING' kids,,20200729-0600
https://www.foxnews.com/auto/nascars-jimmie-johnson-tests-indycar-indianapolis-motor-speedway,Jimmie Johnson tests INDYCAR,,20200729-0600
https://www.foxnews.com/science/super-space-sunblock-made-from-skin-pigment-could-shield-astronauts-from-radiation,Could THIS shield astronauts from radiation?,,20200729-0600
https://www.foxnews.com/science/mediterranean-sea-significantly-warmer-roman-empire,WHAT happened during Roman Empire?,,20200729-0600
https://www.foxnews.com/science/incredible-photo-shows-epic-showdown-between-lioness-and-male-lion,'Epic showdown' happened WHY?,,20200729-0600
https://www.foxnews.com/food-drink/servers-generous-tips-movement,Bartender’s unexpected death prompts BIG act,,20200729-0600
https://www.foxnews.com/great-outdoors/north-carolina-fishermen-hook-state-record-catfish-days-apart,SEE IT: Angler's CRAZY catch,,20200729-0600
https://www.foxnews.com/entertainment/kelly-ripa-regis-philbin-life-lesson,Kelly reveals life lesson from Regis,,20200729-0600
https://www.foxnews.com/entertainment/megan-fox-machine-gun-kelly-instagram-official,We 'waited for ETERNITY',,20200729-0600
https://www.foxnews.com/entertainment/riverdale-vanessa-morgan-husband-michael-kopech-divorce-pregnancy,Pregnant star's hubby files for DIVORCE,,20200729-0600
https://www.foxnews.com/entertainment/britney-spears-demanding-attention-new-bikini-pic-henna-tattoos,Star 'DEMANDING attention' with bikini pic,,20200729-0600
https://www.foxnews.com/science/pentagon-ufo-unit-spotlight-vehicles-earth,UFOs? Pentagon mentions 'vehicles not made on Earth',,20200729-0600
https://www.foxnews.com/great-outdoors/humpback-whale-shocks-fisherman-feet-from-boat,"California man apparently set on fire in gruesome death, family claims; investigation underway",,20200729-0600
https://video.foxnews.com/v/6175990578001/,Rep. Brady: I'm not sure Biden understands the modern economy,,20200729-0630
https://video.foxnews.com/v/6176022132001/,President Trump comments on Dr. Fauci's 'very good approval rating',,20200729-0630
https://video.foxnews.com/v/6175859243001/,Trey Gowdy blasts Nadler over police misconduct: Why haven’t you called Michael Horowitz?,,20200729-0630
https://video.foxnews.com/v/6175896204001/,"AG Barr spars with Nadler: Portland is under attack, we're on the defense",,20200729-0630
https://video.foxnews.com/v/6175884858001/,Jim Jordan calls out Obama-Biden DOJ for spying: 17 lies told to secret court,,20200729-0630
https://video.foxnews.com/v/6175888938001/,"AG Barr testifies: Anarchists hijacked legitimate protests, assaulting gov't of United States",,20200729-0630
https://video.foxnews.com/v/6175836826001/,Kayleigh McEnany on Steele dossier: 'Documented history of lies' from Obama admin,,20200729-0630
https://video.foxnews.com/v/6175842901001/,"Ted Cruz's plan to bring U.S. cities back from chaos, hold officials liable",,20200729-0630
https://video.foxnews.com/v/6175830602001/,"Miranda Devine: Biden's platform a 'sham,' he's an 'empty shell'",,20200729-0630
https://video.foxnews.com/v/6175805794001/,"Judge Napolitano: NJ governor is a 'fraud,' making up his own laws",,20200729-0630
https://www.foxnews.com/politics/barr-testifies-before-house-judiciary-committee-maintains-independence-from-trump,"Barr asks Democrats why only Republicans appear to be against mob violence, destructive demonstrations",,20200729-0630
https://www.foxnews.com/politics/dem-impeachment-lawyer-nadler-barr,Dem impeachment lawyer dings Nadler’s ‘ineffective’ questioning of Barr,,20200729-0630
https://www.foxnews.com/media/don-lemon-chuck-todd-barr-hearing-jim-jordan,"Don Lemon, Chuck Todd make cameos at Barr hearing when Jim Jordan plays video of 'peaceful' protesters",,20200729-0630
https://www.foxnews.com/politics/barr-dings-nadler-sparring-hearing-break-real-class-act,Barr dings Nadler after sparring over whether to take a hearing break: ‘You're a real class act’,,20200729-0630
https://www.foxnews.com/opinion/william-barr-portland-von-spakovsky-stimson,"VON SPAKOVSKY & STIMSON: Barr rightfully defends fed response to dangerous rioting, as House Dems attack him",,20200729-0630
https://www.foxnews.com/media/laura-ingraham-house-democrats-rioters-william-barr,Democrats acted like ‘mobsters’ in attacks against Barr: Ingraham,,20200729-0630
https://www.foxnews.com/media/pence-barr-hearing-house-judiciary-committee-democrats,Pence rips House Judiciary Democrats for treatment of Attorney General Barr,,20200729-0630
https://www.foxnews.com/media/guy-benson-democrats-barr-hearing-embarrassing-behavior,Guy Benson torches Democrats over 'embarrassing' behavior toward Barr: 'Sort of painful to watch',,20200729-0630
https://www.foxnews.com/politics/portland-maximum-fines-federal-government-fence-courthouse,Portland hits feds with 'maximum' fine for fence outside besieged courthouse,,20200729-0630
https://www.foxnews.com/us/portland-man-charged-justice-center-arson-back-tattoo,Portland man charged in Justice Center arson after back tattoo leads authorities to him,,20200729-0630
https://www.foxnews.com/us/contraband-portland-rioters-bleach-molotov-cocktail-feds,"Contraband recovered from Portland rioters includes bleach, Molotov cocktail equipment, feds say",,20200729-0630
https://www.foxnews.com/politics/bidens-notes-suggest-kamala-harris-may-be-his-chosen-running-mate-do-not-hold-grudges,Photo of Biden’s notes may shed light on relationship with Harris,,20200729-0630
https://www.foxnews.com/media/msnbc-chris-hayes-nypd-arrest-kidnapping,MSNBC host called out by colleague after calling NYPD arrest a kidnapping,,20200729-0630
https://www.foxnews.com/politics/california-considers-its-own-600-weekly-benefit-if-congress-fails-to-act-report,California considers its own $600 weekly benefit if Congress fails to act: report,,20200729-0630
https://www.foxnews.com/auto/houston-drivers-not-paying-tickets-make-550000-ineligible-for-license-renewal-study,"Houston drivers not paying tickets make 550,000 ineligible for license renewal: study",,20200729-0630
https://knewz.com/minnesota-man-kills-mom/,"Man brutally kills his city council member mom, who had to be ID’d with dental records",,20200729-0630
https://video.foxnews.com/v/6176075461001/,Veep leak? Joe Biden prepped talking points about Sen. Kamala Harris,,20200729-0630
https://www.foxnews.com/politics/pennsylvania-health-secretary-condemns-transphobic-attacks-against-her,Pennsylvania health secretary condemns transphobic attacks against her,,20200729-0630
https://www.foxnews.com/us/california-man-apparently-set-on-fire-in-gruesome-death-investigation-underway,"California man apparently set on fire in gruesome death, family claims; investigation underway",,20200729-0630
https://video.foxnews.com/v/6176074020001/,Attorney for Nicholas Sandmann says Brian Stelter showed 'poor judgment' by retweeting post about settlement,,20200729-0630
https://www.foxnews.com/politics/arizona-gop-chair-kelli-ward-has-twitter-account-limited-one-week-ahead-of-state-primary-report,Arizona GOP Chair Kelli Ward has Twitter account ‘limited’ – one week ahead of state primary: report,,20200729-0630
https://www.foxnews.com/media/trey-gowdy-nadler-nyc-violence-barr-hearing,Gowdy challenges Nadler to tell NYC murder victims' families 'that the violence is manufactured',,20200729-0630
https://www.foxnews.com/media/justice-department-kerri-kupec-barr-hearing-democrats,Justice Department spokeswoman laments heated Barr hearing as 'lost opportunity' for Americans,,20200729-0630
https://www.foxnews.com/politics/trump-press-briefing-coronavirus-hydroxychloroquine-doctor,Trump ends press briefing after defending pro-hydroxychloroquine doctor who says virus has a 'cure',,20200729-0630
https://www.foxnews.com/media/ben-shapiro-democrats-barr-hearing-absurdity,Ben Shapiro decries Barr hearing as 'moral absurdity': 'Just ridiculous from beginning to end',,20200729-0630
https://www.foxnews.com/entertainment/prince-william-gift-kate-middleton-never-let-him-forget,William's ODD gift to his wife,,20200729-0630
https://www.foxnews.com/us/chicago-deputy-police-chief-dead-in-apparent-suicide-soon-after-promotion-officials-say,"Chicago deputy police chief dead in apparent suicide soon after promotion, officials say",,20200729-0630
https://www.foxnews.com/us/texas-surfer-67-helps-save-2-women-from-hannas-rough-water-reports,"Texas surfer, 67, helps save 2 women from Hanna’s rough water: reports",,20200729-0630
https://www.foxnews.com/media/cnn-chris-cuomo-florida-ron-desantis-mishandled-pandemic,Critics question CNN's Cuomo after he condemns Florida gov's COVID response,,20200729-0630
https://www.foxnews.com/media/msnbc-analyst-maya-wiley-leaving-network-nyc-mayoral-run,MSNBC analyst Maya Wiley leaving network to mull NYC mayoral run: reports,,20200729-0630
https://www.foxnews.com/media/detroit-police-chief-we-dont-retreat-here,Detroit police chief explains lack of violent riots in Motor City: 'We don't retreat here',,20200729-0630
https://www.foxnews.com/entertainment/eva-larue-john-callahan-broken-into-car-identity-stolen-death,Late star's ex-wife tells ALL,,20200729-0630
https://www.foxnews.com/us/this-day-in-history-july-29,Prince Charles marries Lady Diana in London -- and other events this day in history,,20200729-0630
https://www.foxnews.com/world/rembrandt-painting-sold-sothebys-record-self-portraits,Rembrandt painting sold at Sotheby's virtual auction shatters record for one of his self-portraits,,20200729-0630
https://www.foxnews.com/entertainment/madonna-shares-same-coronavirus-video-as-trump-instagram-flags-report,"Madonna shares same coronavirus video as Trump, Instagram flags: report",,20200729-0630
https://www.foxbusiness.com/technology/coronavirus-bowdoin-college-free-ipad-students-staff,"Coronavirus makes Bowdoin College provide iPads for students, staff",,20200729-0630
https://www.foxnews.com/world/china-ship-fleet-galapagos-islands-ecuador-navy-alert,Ecuador navy 'on alert' as 260-strong Chinese fleet nears Galapagos Islands,,20200729-0630
https://nation.foxnews.com/watch/24916db76eee8db2f17683df4c14ba50/?cmpid=org=NAT::ag=owned::mc=FNC_display::src=FNC_web::cmp=homepage::add=watch_platform_vd_creative&utm_source=FNC_display&utm_medium=FNC_web&utm_campaign=homepage&utm_content=watch_platform_vd_creative,A football quarterback turned political icon reached across the aisle & grabbed the best of everyone.. Watch how he did it!,,20200729-0630
https://www.foxnews.com/world/head-of-chinese-cdc-says-hes-taking-experimental-coronavirus-drug,Head of Chinese CDC says he's taking experimental coronavirus drug,,20200729-0630
https://www.foxnews.com/us/north-carolina-curfew-alcohol-coronavirus-spike,"As coronavirus cases spike, North Carolina puts curfew on alcohol sales",,20200729-0630
https://www.foxnews.com/politics/why-the-coronavirus-bill-wont-get-finalized-until-the-11th-hour,Why the coronavirus bill won’t get finalized until the 11th hour,,20200729-0630
https://www.foxnews.com/world/coronavirus-leads-to-mass-hunger-killing-10000-children-a-month-un-warns,"Coronavirus leads to mass hunger, killing 10,000 children a month, UN warns",,20200729-0630
https://www.foxnews.com/health/coronavirus-face-mask-face-shield-which-better,Protecting against coronavirus: is a face mask or face shield better?,,20200729-0630
https://www.foxbusiness.com/money/7-common-mistakes-refinancing-into-lower-mortgage-rate,7 common mistakes when refinancing into a low mortgage rate,,20200729-0630
https://www.foxnews.com/opinion/fbi-comey-strzok-mccabe-gregg-jarrett,"Disgraced fired FBI officials Comey, McCabe and Strzok profit from a pathology of lies",,20200729-0630
https://www.foxnews.com/opinion/coronavirus-plan-reopen-oct-1-drs-hotez-and-rimoin,Controlling coronavirus — this plan could allow us to safely reopen by Oct. 1,,20200729-0630
https://www.foxnews.com/opinion/biden-crime-donald-trump-jr,Biden wouldn’t reduce rioting and crime – he’s controlled by left-wing puppet masters,,20200729-0630
https://www.foxnews.com/lifestyle/matchmaker-explains-coparenting-no-romance,"Matchmaker wants family, no romance",,20200729-0630
https://www.foxnews.com/real-estate/gigi-hadid-nyc-apartment-divides-twitter-users,Gigi's decision DIVIDES fans,,20200729-0630
https://www.foxnews.com/entertainment/dwayne-the-rock-johnson-considered-willy-wonka,'The Rock' considered for THIS movie,,20200729-0630
https://www.foxnews.com/entertainment/kim-kardashian-family-shielding-kids,Kim and family 'SHIELDING' kids,,20200729-0630
https://www.foxnews.com/auto/nascars-jimmie-johnson-tests-indycar-indianapolis-motor-speedway,Jimmie Johnson tests INDYCAR,,20200729-0630
https://www.foxnews.com/science/super-space-sunblock-made-from-skin-pigment-could-shield-astronauts-from-radiation,Could THIS shield astronauts from radiation?,,20200729-0630
https://www.foxnews.com/science/mediterranean-sea-significantly-warmer-roman-empire,WHAT happened during Roman Empire?,,20200729-0630
https://www.foxnews.com/science/incredible-photo-shows-epic-showdown-between-lioness-and-male-lion,'Epic showdown' happened WHY?,,20200729-0630
https://www.foxnews.com/food-drink/servers-generous-tips-movement,Bartender’s unexpected death prompts BIG act,,20200729-0630
https://www.foxnews.com/great-outdoors/north-carolina-fishermen-hook-state-record-catfish-days-apart,SEE IT: Angler's CRAZY catch,,20200729-0630
https://www.foxnews.com/entertainment/kelly-ripa-regis-philbin-life-lesson,Kelly reveals life lesson from Regis,,20200729-0630
https://www.foxnews.com/entertainment/megan-fox-machine-gun-kelly-instagram-official,We 'waited for ETERNITY',,20200729-0630
https://www.foxnews.com/entertainment/riverdale-vanessa-morgan-husband-michael-kopech-divorce-pregnancy,Pregnant star's hubby files for DIVORCE,,20200729-0630
https://www.foxnews.com/entertainment/britney-spears-demanding-attention-new-bikini-pic-henna-tattoos,Star 'DEMANDING attention' with bikini pic,,20200729-0630
https://www.foxnews.com/science/pentagon-ufo-unit-spotlight-vehicles-earth,UFOs? Pentagon mentions 'vehicles not made on Earth',,20200729-0630
https://www.foxnews.com/great-outdoors/humpback-whale-shocks-fisherman-feet-from-boat,"California man apparently set on fire in gruesome death, family claims; investigation underway",,20200729-0630
https://video.foxnews.com/v/6175990578001/,Rep. Brady: I'm not sure Biden understands the modern economy,,20200729-0700
https://video.foxnews.com/v/6176022132001/,President Trump comments on Dr. Fauci's 'very good approval rating',,20200729-0700
https://video.foxnews.com/v/6175859243001/,Trey Gowdy blasts Nadler over police misconduct: Why haven’t you called Michael Horowitz?,,20200729-0700
https://video.foxnews.com/v/6175896204001/,"AG Barr spars with Nadler: Portland is under attack, we're on the defense",,20200729-0700
https://video.foxnews.com/v/6175884858001/,Jim Jordan calls out Obama-Biden DOJ for spying: 17 lies told to secret court,,20200729-0700
https://video.foxnews.com/v/6175888938001/,"AG Barr testifies: Anarchists hijacked legitimate protests, assaulting gov't of United States",,20200729-0700
https://video.foxnews.com/v/6175836826001/,Kayleigh McEnany on Steele dossier: 'Documented history of lies' from Obama admin,,20200729-0700
https://video.foxnews.com/v/6175842901001/,"Ted Cruz's plan to bring U.S. cities back from chaos, hold officials liable",,20200729-0700
https://video.foxnews.com/v/6175830602001/,"Miranda Devine: Biden's platform a 'sham,' he's an 'empty shell'",,20200729-0700
https://video.foxnews.com/v/6175805794001/,"Judge Napolitano: NJ governor is a 'fraud,' making up his own laws",,20200729-0700
https://www.foxnews.com/politics/barr-testifies-before-house-judiciary-committee-maintains-independence-from-trump,"Barr asks Democrats why only Republicans appear to be against mob violence, destructive demonstrations",,20200729-0700
https://www.foxnews.com/politics/dem-impeachment-lawyer-nadler-barr,Dem impeachment lawyer dings Nadler’s ‘ineffective’ questioning of Barr,,20200729-0700
https://www.foxnews.com/media/don-lemon-chuck-todd-barr-hearing-jim-jordan,"Don Lemon, Chuck Todd make cameos at Barr hearing when Jim Jordan plays video of 'peaceful' protesters",,20200729-0700
https://www.foxnews.com/politics/barr-dings-nadler-sparring-hearing-break-real-class-act,Barr dings Nadler after sparring over whether to take a hearing break: ‘You're a real class act’,,20200729-0700
https://www.foxnews.com/opinion/william-barr-portland-von-spakovsky-stimson,"VON SPAKOVSKY & STIMSON: Barr rightfully defends fed response to dangerous rioting, as House Dems attack him",,20200729-0700
https://www.foxnews.com/opinion/michael-goodwin-barr-eats-nadlers-lunch-during-testimony,"MICHAEL GOODWIN: Another hearing, another Dem disaster",,20200729-0700
https://www.foxnews.com/media/laura-ingraham-house-democrats-rioters-william-barr,Democrats acted like ‘mobsters’ in attacks against Barr: Ingraham,,20200729-0700
https://www.foxnews.com/media/guy-benson-democrats-barr-hearing-embarrassing-behavior,Guy Benson torches Democrats over 'embarrassing' behavior toward Barr: 'Sort of painful to watch',,20200729-0700
https://www.foxnews.com/politics/portland-maximum-fines-federal-government-fence-courthouse,Portland hits feds with 'maximum' fine for fence outside besieged courthouse,,20200729-0700
https://www.foxnews.com/us/portland-man-charged-justice-center-arson-back-tattoo,Portland man charged in Justice Center arson after back tattoo leads authorities to him,,20200729-0700
https://www.foxnews.com/us/contraband-portland-rioters-bleach-molotov-cocktail-feds,"Contraband recovered from Portland rioters includes bleach, Molotov cocktail equipment, feds say",,20200729-0700
https://www.foxnews.com/politics/bidens-notes-suggest-kamala-harris-may-be-his-chosen-running-mate-do-not-hold-grudges,Photo of Biden’s notes may shed light on relationship with Harris,,20200729-0700
https://www.foxnews.com/media/msnbc-chris-hayes-nypd-arrest-kidnapping,MSNBC host called out by colleague after calling NYPD arrest a kidnapping,,20200729-0700
https://www.foxnews.com/politics/california-considers-its-own-600-weekly-benefit-if-congress-fails-to-act-report,California considers its own $600 weekly benefit if Congress fails to act: report,,20200729-0700
https://www.foxnews.com/auto/houston-drivers-not-paying-tickets-make-550000-ineligible-for-license-renewal-study,"Houston drivers not paying tickets make 550,000 ineligible for license renewal: study",,20200729-0700
https://knewz.com/minnesota-man-kills-mom/,"Man brutally kills his city council member mom, who had to be ID’d with dental records",,20200729-0700
