,text,notes,date
https://www.foxnews.com/media/tim-scott-ag-barr-hearing-embarrassing-democrats,Tim Scott: Barr hearing was 'embarrassing' for House Democrats,,20200729-1700
https://nation.foxnews.com/watch/24916db76eee8db2f17683df4c14ba50/?cmpid=org=NAT::ag=owned::mc=FNC_display::src=FNC_web::cmp=homepage::add=watch_platform_vd_creative&utm_source=FNC_display&utm_medium=FNC_web&utm_campaign=homepage&utm_content=watch_platform_vd_creative,A football quarterback turned political icon reached across the aisle & grabbed the best of everyone.. Watch how he did it!,,20200729-1700
https://www.foxnews.com/world/malta-says-65-migrants-have-coronavirus,Malta says 65 migrants rescued at sea test positive for coronavirus,,20200729-1700
https://www.foxnews.com/sports/nbas-2020-pandemic-shortened-season-everything-you-need-to-know,NBA's 2020 pandemic-shortened season: Everything you need to know,,20200729-1700
https://www.foxnews.com/world/hong-kong-leader-warns-hospital-system-could-collapse-as-city-on-verge-of-large-scale-outbreak,Hong Kong leader warns hospital system could collapse,,20200729-1700
https://www.foxbusiness.com/money/is-600-a-week-in-extra-unemployment-aid-deterring-people-from-seeking-work,Is $600 a week in extra unemployment aid deterring people from seeking work?,,20200729-1700
https://www.foxnews.com/politics/trump-press-briefing-coronavirus-hydroxychloroquine-doctor,Trump ends press briefing after defending pro-hydroxychloroquine doctor who says virus has a 'cure',,20200729-1700
https://www.foxbusiness.com/money/how-to-land-lowest-15-year-mortgage-rate-refinance,How to land the lowest 15-year mortgage rate for your refinance,,20200729-1700
https://www.foxnews.com/opinion/2020-election-conservatives-cancel-culture-ken-buck,2020 election is opportunity for conservatives to stand up to cancel-culture mob,,20200729-1700
https://www.foxnews.com/opinion/seattle-portland-seditionists-cal-thomas,"Rioters in Seattle, Portland are seditionists, not protesters",,20200729-1700
https://www.foxnews.com/opinion/andrew-mccarthy-democrats-use-hearing-for-political-attacks-on-barr-and-trump-not-interested-in-hearing-barr,Dems use hearing for political attacks on Barr and Trump – uninterested in hearing from AG,,20200729-1700
https://www.foxnews.com/food-drink/michigan-bartender-raises-money-charity-man-face-mask-mandate,SEE IT: Customer's viral APOLOGY,,20200729-1700
https://www.foxnews.com/science/where-is-cleopatras-tomb,Cleopatra's tomb FOUND?,,20200729-1700
https://www.foxnews.com/entertainment/tom-hanks-returning-childhood-job-sell-hot-dogs-oakland,Hanks HILARIOUSLY helps MLB,,20200729-1700
https://www.foxnews.com/entertainment/ashley-graham-new-mom-bod,Model shows OFF 'mom bod',,20200729-1700
https://www.foxnews.com/entertainment/little-house-on-the-praire-star-karen-grassle,Little House’ star: I was BROKE,,20200729-1700
https://www.foxnews.com/entertainment/eva-larue-john-callahan-broken-into-car-identity-stolen-death,Late star's ex-wife tells ALL,,20200729-1700
https://www.foxnews.com/science/universe-1-2-billion-years-younger-than-previously-believed,Universe is HOW OLD?,,20200729-1700
https://www.foxnews.com/food-drink/national-chicken-wing-day-backstory-deals,Best National Chicken Wing Day DEALS,,20200729-1700
https://www.foxnews.com/lifestyle/matchmaker-explains-coparenting-no-romance,"Matchmaker wants family, no romance",,20200729-1700
https://www.foxnews.com/entertainment/kim-kardashian-family-shielding-kids,Kim 'SHIELDING' kids from Kanye drama,,20200729-1700
https://www.foxnews.com/entertainment/prince-william-gift-kate-middleton-never-let-him-forget,William's ODD gift to Kate,,20200729-1700
https://www.foxnews.com/entertainment/britney-spears-demanding-attention-new-bikini-pic-henna-tattoos,Star 'DEMANDING attention' with bikini pic,,20200729-1700
https://www.foxnews.com/entertainment/megan-fox-machine-gun-kelly-instagram-official,We 'waited for ETERNITY',,20200729-1700
https://www.foxnews.com/entertainment/riverdale-vanessa-morgan-husband-michael-kopech-divorce-pregnancy,Pregnant star's hubby files for DIVORCE,,20200729-1700
https://www.foxnews.com/entertainment/dwayne-the-rock-johnson-considered-willy-wonka,'The Rock' considered for THIS movie,,20200729-1700
https://www.foxnews.com/science/mediterranean-sea-significantly-warmer-roman-empire,WHAT happened during Roman Empire?,,20200729-1700
https://www.foxnews.com/science/incredible-photo-shows-epic-showdown-between-lioness-and-male-lion,'Epic showdown' happened WHY?,,20200729-1700
https://www.foxnews.com/great-outdoors/north-carolina-fishermen-hook-state-record-catfish-days-apart,"Florida man sentenced for threats against Christian organization on Facebook, tech giant ignored posts",,20200729-1700
https://video.foxnews.com/v/6176286471001/,Howard Kurtz: Is the 'Trump-obsessed' media downplaying violent protests?,,20200729-1730
https://video.foxnews.com/v/6176250090001/,Sen. Blackburn's 3 key needs for next COVID-19 relief bill,,20200729-1730
https://video.foxnews.com/v/6176238282001/,Greg Gutfeld on conservative censorship: 'Abuse only goes one way',,20200729-1730
https://video.foxnews.com/v/6176229883001/,Geraldo Rivera: Nadler in 'denial' over anarchy in Portland,,20200729-1730
https://video.foxnews.com/v/6176226483001/,"Sen. Scott: 'Barr was undeniably powerful,' America witnessed 'chaos in Congress'",,20200729-1730
https://video.foxnews.com/v/6176220815001/,"Gov. Noem unveils plan to get kids back in the classroom, without masks",,20200729-1730
https://video.foxnews.com/v/6176200377001/,Jim Jordan calls out Dems at AG Barr hearing: 'Out to get this guy' since he called out 'spying',,20200729-1730
https://video.foxnews.com/v/6176196183001/,Andy McCarthy's takeaway from AG Barr hearing: 'Tragic for America',,20200729-1730
https://www.foxnews.com/politics/tech-ceos-testify-to-congress-live,LIVE UPDATES: Top tech CEOs face grilling as lawmakers warn 'they have too much power',,20200729-1730
https://video.foxnews.com/v/6176287049001/,"WATCH: Bezos, Zuckerberg, Cook and Pichai to testify at House hearing",,20200729-1730
https://www.foxnews.com/media/greg-gutfeld-on-conservative-censorship-abuse-only-goes-one-way,Greg Gutfeld on conservative censorship: 'Abuse only goes one way',,20200729-1730
https://www.foxnews.com/opinion/big-tech-censors-covid-19-video-tucker-carlson,TUCKER CARLSON: Big Tech pulled vid of doctors and hid it from public,,20200729-1730
https://www.foxnews.com/tech/big-tech-on-capitol-hill-facebook-amazon-google-apple-ceos-set-to-testify-in-antitrust-hearing,"Big Tech on Capitol Hill: Facebook, Amazon, Google, Apple CEOs set to testify in antitrust hearing",,20200729-1730
https://www.foxnews.com/politics/tight-biden-trump-race-in-georgia-poll,New poll shows Biden and Trump in even race in this state,,20200729-1730
https://www.foxnews.com/politics/trump-says-harris-would-be-fine-choice-as-biden-running-mate,Trump weighs in on speculation Harris could be Biden's running mate,,20200729-1730
https://www.foxnews.com/media/trump-scolds-cnn-hydroxychloroquine-tweet,Trump scolds ‘dishonest’ CNN when asked about deleted hydroxychloroquine tweet,,20200729-1730
https://www.foxnews.com/us/federal-agents-leave-portland-oregon,"Fed agents who clashed with protesters in Portland will exit downtown, gov says",,20200729-1730
https://www.foxnews.com/politics/dojs-operation-legend-expanded-to-cleveland-detroit-and-milwaukee-amid-violence,DOJ's 'Operation Legend' expanded to three cities,,20200729-1730
https://www.foxnews.com/media/howard-kurtz-media-coverage-reducing-riots,Howard Kurtz says media coverage is reducing violent riots to a 'footnote' in the Portland story,,20200729-1730
https://www.foxnews.com/politics/jim-jordan-says-dems-cut-off-gop-video-at-barr-hearing-heres-the-full-version,Here’s full video introduced by Jordan at Barr hearing that set off Dems,,20200729-1730
https://www.foxnews.com/entertainment/ellen-degeneres-show-investigation-end-tv-career,"Ellen DeGeneres investigation could end TV career, expert says",,20200729-1730
https://www.foxnews.com/politics/mcconnell-dems-sabotage-coronavirus-bill,McConnell suggests Dems are trying to 'sabotage' the next coronavirus bill,,20200729-1730
https://www.foxnews.com/media/us-marshals-service-director-says-portland-protests-hijacked-by-violent-extremists,US Marshals Service director says Portland protests 'hijacked by violent extremists',,20200729-1730
https://www.foxbusiness.com/money/a-second-1200-stimulus-check-is-likely-and-26m-more-people-might-qualify-for-the-cash-this-round,A second stimulus check is likely — and 26M more people might get cash this round,,20200729-1730
https://video.foxnews.com/v/6176289338001/,Karl Rove previews Joe Biden's top VP contenders,,20200729-1730
https://www.foxnews.com/politics/third-un-staffer-leave-video-alleged-sex-act,Third UN staffer put on leave over video of alleged sex act in official car,,20200729-1730
https://www.foxnews.com/world/us-announces-plans-to-send-troops-home,"US announces plans to remove 12,000 troops from Germany",,20200729-1730
https://video.foxnews.com/v/6176295135001/,"Big tech CEO's on hot seat, to testify before Congress over political bias",,20200729-1730
https://www.foxnews.com/health/coronavirus-smell-loss-harvard-study,Why do some coronavirus patients lose sense of smell? Harvard researchers have an answer,,20200729-1730
https://www.foxnews.com/health/how-coronavirus-particles-spread-classrooms-indoors-study,"Preliminary study investigates how coronavirus particles may travel in classrooms, indoor areas",,20200729-1730
https://www.foxnews.com/world/british-family-on-vacation-finds-migrants-hiding,British family on vacation finds migrants hiding in their car's rooftop cargo box,,20200729-1730
https://www.foxnews.com/us/man-videotaped-ahmaud-arbery-death-child-molestation,Man who videotaped Ahmaud Arbery's death subject of child molestation investigation: report,,20200729-1730
https://www.foxnews.com/world/germany-political-economic-threats,"Germany emerges as key target for Russia, China interference, report warns",,20200729-1730
https://www.foxnews.com/food-drink/new-mexico-restaurant-suspended-food-permit-coronavirus-sign,Restaurant has food permit suspended for violating health order months after posting controversial sign,,20200729-1730
https://www.foxnews.com/us/nevada-sheriff-library-911-calls-black-lives-matter,Nevada sheriff tells library not to call 911 if they support BLM,,20200729-1730
https://www.foxnews.com/us/nyc-man-shot-staten-island-deli-see-it,NYC man fatally shot inside Staten Island deli in front of customer,,20200729-1730
https://www.foxnews.com/us/arizona-bridge-tempe-town-lake-train-derailment-collapse-fire-phoenix,"Arizona bridge burns, partially collapses after train derailment near Tempe Town Lake",,20200729-1730
https://www.foxnews.com/us/facebook-death-threat-florida-christian-mississippi,"Florida man sentenced for threats against Christian organization on Facebook, tech giant ignored posts",,20200729-1730
https://www.foxnews.com/media/chicago-tribune-columnist-colleagues-george-soros,Chicago Tribune columnist refuses to apologize to colleagues peeved over George Soros piece: ‘I will not bow’,,20200729-1730
https://www.foxbusiness.com/money/should-i-use-personal-loan-consolidate-debt,Should I use a personal loan to consolidate debt?,,20200729-1730
https://www.foxnews.com/entertainment/derek-hough-reacts-tom-bergeron-erin-andrews-not-returning,'Dancing with the Stars' pro Derek Hough reacts to Tom Bergeron and Erin Andrews not returning as hosts,,20200729-1730
https://www.foxnews.com/entertainment/queen-elizabeth-royal-feud-william-harry-sources,"Queen Elizabeth wants Princes William, Harry to solve their royal feud ‘like grown adults,’ source claims",,20200729-1730
https://www.foxnews.com/entertainment/si-swimsuit-model-camille-kostek-2020-issue,SI Swimsuit model Camille Kostek talks appearing in mag: 'I always have to work through that first bikini’,,20200729-1730
https://www.foxnews.com/sports/packers-aaron-rodgers-green-bays-rival-jordan-love,Packers’ Aaron Rodgers talks playing for Green Bay rival after this pick,,20200729-1730
https://www.foxnews.com/sports/marlins-coronavirus-outbreak-cause-mlb-insider,Marlins' coronavirus outbreak may have been caused by this,,20200729-1730
https://www.foxnews.com/sports/eagles-jalen-mills-shares-video-doctors-praising-hydroxychloroquine-coronavirus,NFL player shares video of doctors praising hydroxychloroquine: 'The world should hear this',,20200729-1730
https://www.foxnews.com/sports/raiders-jon-gruden-nfl-toughest-opponent,Raiders' head coach Jon Gruden believes this will be the NFL's 'toughest opponent',,20200729-1730
https://www.foxnews.com/auto/gmc-hummer-ev-teased-in-photos-ahead-of-fall-reveal,GMC HUMMER EV teased in photos ahead of fall reveal,,20200729-1730
https://www.foxnews.com/lifestyle/late-mothers-wedding-ring-found,Man shocked to find late mother's lost wedding ring in the garden after 34 years,,20200729-1730
https://www.foxbusiness.com/lifestyle/trader-joes-product-labels-not-racist-petition,Trader Joe's to keep popular international food labels despite 'racist' accusations,,20200729-1730
https://www.foxnews.com/health/taller-people-risk-covid-19-survey,"Taller people face higher risk of catching COVID-19, survey says",,20200729-1730
https://www.foxnews.com/media/trump-supporter-killed-milwaukee,Man who interviewed sign-bearing Trump supporter day he was killed believes shooting may be politically motivated,,20200729-1730
https://www.foxnews.com/media/virginia-newspaper-calls-out-local-leaders-riots,Virginia newspaper calls out local leaders after Richmond riots: 'Enough is enough',,20200729-1730
https://nation.foxnews.com/watch/24916db76eee8db2f17683df4c14ba50/?cmpid=org=NAT::ag=owned::mc=FNC_display::src=FNC_web::cmp=homepage::add=watch_platform_vd_creative&utm_source=FNC_display&utm_medium=FNC_web&utm_campaign=homepage&utm_content=watch_platform_vd_creative,A football quarterback turned political icon reached across the aisle & grabbed the best of everyone.. Watch how he did it!,,20200729-1730
https://www.foxnews.com/politics/rep-louie-gohmert-tests-positive-for-coronavirus-before-planning-to-fly-with-trump-to-texas,Rep. Louie Gohmert tests positive for coronavirus before planning to fly with Trump to Texas,,20200729-1730
https://www.foxnews.com/world/malta-says-65-migrants-have-coronavirus,Malta says 65 migrants rescued at sea test positive for coronavirus,,20200729-1730
https://www.foxnews.com/sports/nbas-2020-pandemic-shortened-season-everything-you-need-to-know,NBA's 2020 pandemic-shortened season: Everything you need to know,,20200729-1730
https://www.foxnews.com/world/hong-kong-leader-warns-hospital-system-could-collapse-as-city-on-verge-of-large-scale-outbreak,Hong Kong leader warns hospital system could collapse,,20200729-1730
https://www.foxbusiness.com/money/is-600-a-week-in-extra-unemployment-aid-deterring-people-from-seeking-work,Is $600 a week in extra unemployment aid deterring people from seeking work?,,20200729-1730
https://www.foxbusiness.com/money/how-to-land-lowest-15-year-mortgage-rate-refinance,How to land the lowest 15-year mortgage rate for your refinance,,20200729-1730
https://www.foxnews.com/opinion/2020-election-conservatives-cancel-culture-ken-buck,2020 election is opportunity for conservatives to stand up to cancel-culture mob,,20200729-1730
https://www.foxnews.com/opinion/seattle-portland-seditionists-cal-thomas,"Rioters in Seattle, Portland are seditionists, not protesters",,20200729-1730
https://www.foxnews.com/opinion/andrew-mccarthy-democrats-use-hearing-for-political-attacks-on-barr-and-trump-not-interested-in-hearing-barr,Dems use hearing for political attacks on Barr and Trump – uninterested in hearing from AG,,20200729-1730
https://www.foxnews.com/food-drink/michigan-bartender-raises-money-charity-man-face-mask-mandate,SEE IT: Customer's viral APOLOGY,,20200729-1730
https://www.foxnews.com/science/where-is-cleopatras-tomb,Cleopatra's tomb FOUND?,,20200729-1730
https://www.foxnews.com/entertainment/elizabeth-pipko-talks-patriotism-modeling-trump-faith-new-book,Why star doesn't hide her patriotism,,20200729-1730
https://www.foxnews.com/entertainment/tom-hanks-returning-childhood-job-sell-hot-dogs-oakland,Hanks HILARIOUSLY helps MLB,,20200729-1730
https://www.foxnews.com/entertainment/little-house-on-the-praire-star-karen-grassle,Little House’ star: I was BROKE,,20200729-1730
https://www.foxnews.com/entertainment/eva-larue-john-callahan-broken-into-car-identity-stolen-death,Late star's ex-wife tells ALL,,20200729-1730
https://www.foxnews.com/lifestyle/designer-purse-roasted-dog-poop-waste-bag,Twitter users compare bag to THIS,,20200729-1730
https://www.foxnews.com/science/universe-1-2-billion-years-younger-than-previously-believed,Universe is HOW OLD?,,20200729-1730
https://www.foxnews.com/food-drink/national-chicken-wing-day-backstory-deals,Best National Chicken Wing Day DEALS,,20200729-1730
https://www.foxnews.com/lifestyle/matchmaker-explains-coparenting-no-romance,"Matchmaker wants family, no romance",,20200729-1730
https://www.foxnews.com/entertainment/ashley-graham-new-mom-bod,Model shows OFF 'mom bod',,20200729-1730
https://www.foxnews.com/entertainment/kim-kardashian-family-shielding-kids,Kim 'SHIELDING' kids from Kanye drama,,20200729-1730
https://www.foxnews.com/entertainment/prince-william-gift-kate-middleton-never-let-him-forget,William's ODD gift to Kate,,20200729-1730
https://www.foxnews.com/entertainment/britney-spears-demanding-attention-new-bikini-pic-henna-tattoos,Star 'DEMANDING attention' with bikini pic,,20200729-1730
https://www.foxnews.com/entertainment/megan-fox-machine-gun-kelly-instagram-official,We 'waited for ETERNITY',,20200729-1730
https://www.foxnews.com/entertainment/riverdale-vanessa-morgan-husband-michael-kopech-divorce-pregnancy,Pregnant star's hubby files for DIVORCE,,20200729-1730
https://www.foxnews.com/entertainment/dwayne-the-rock-johnson-considered-willy-wonka,'The Rock' considered for THIS movie,,20200729-1730
https://www.foxnews.com/science/mediterranean-sea-significantly-warmer-roman-empire,WHAT happened during Roman Empire?,,20200729-1730
https://www.foxnews.com/science/incredible-photo-shows-epic-showdown-between-lioness-and-male-lion,'Epic showdown' happened WHY?,,20200729-1730
https://www.foxnews.com/lifestyle/twitter-users-praise-woman-photo-nyc-wedding,Twitter HUNTS for mystery couple,,20200729-1730
https://www.foxnews.com/great-outdoors/north-carolina-fishermen-hook-state-record-catfish-days-apart,"Federal agents to begin leaving Portland’s downtown: DHS, Oregon governor",,20200729-1730
https://video.foxnews.com/v/6176289338001/,Karl Rove previews Joe Biden's top VP contenders,,20200729-1800
https://video.foxnews.com/v/6176295135001/,"Big tech CEO's on hot seat, to testify before Congress over political bias",,20200729-1800
https://video.foxnews.com/v/6176286471001/,Howard Kurtz: Is the 'Trump-obsessed' media downplaying violent protests?,,20200729-1800
https://video.foxnews.com/v/6176250090001/,Sen. Blackburn's 3 key needs for next COVID-19 relief bill,,20200729-1800
https://video.foxnews.com/v/6176238282001/,Greg Gutfeld on conservative censorship: 'Abuse only goes one way',,20200729-1800
https://video.foxnews.com/v/6176229883001/,Geraldo Rivera: Nadler in 'denial' over anarchy in Portland,,20200729-1800
https://video.foxnews.com/v/6176226483001/,"Sen. Scott: 'Barr was undeniably powerful,' America witnessed 'chaos in Congress'",,20200729-1800
https://video.foxnews.com/v/6176220815001/,"Gov. Noem unveils plan to get kids back in the classroom, without masks",,20200729-1800
https://video.foxnews.com/v/6176200377001/,Jim Jordan calls out Dems at AG Barr hearing: 'Out to get this guy' since he called out 'spying',,20200729-1800
https://www.foxnews.com/politics/tech-ceos-testify-to-congress-live,LIVE UPDATES: Jeff Bezos says Americans trust only military and their doctor more than tech giant,,20200729-1800
https://video.foxnews.com/v/6176287049001/,"WATCH: Bezos, Zuckerberg, Cook and Pichai to testify at House hearing",,20200729-1800
https://www.foxnews.com/media/buck-sexton-big-tech-bias,Buck Sexton calls out 'clear gaslighting' by those who deny Big Tech bias against conservatives,,20200729-1800
https://www.foxnews.com/media/greg-gutfeld-on-conservative-censorship-abuse-only-goes-one-way,Greg Gutfeld on conservative censorship: 'Abuse only goes one way',,20200729-1800
https://www.foxnews.com/opinion/big-tech-censors-covid-19-video-tucker-carlson,TUCKER CARLSON: Big Tech pulled vid of doctors and hid it from public,,20200729-1800
https://www.foxnews.com/politics/tight-biden-trump-race-in-georgia-poll,New poll shows Biden and Trump in even race in this state,,20200729-1800
https://www.foxnews.com/politics/trump-says-harris-would-be-fine-choice-as-biden-running-mate,Trump weighs in on speculation Harris could be Biden's running mate,,20200729-1800
https://www.foxnews.com/media/trump-scolds-cnn-hydroxychloroquine-tweet,Trump scolds ‘dishonest’ CNN when asked about deleted hydroxychloroquine tweet,,20200729-1800
https://www.foxnews.com/us/federal-agents-leave-portland-oregon,"Fed agents who clashed with protesters in Portland will exit downtown, gov says",,20200729-1800
https://www.foxnews.com/politics/dojs-operation-legend-expanded-to-cleveland-detroit-and-milwaukee-amid-violence,DOJ's 'Operation Legend' expanded to three cities,,20200729-1800
https://www.foxnews.com/media/howard-kurtz-media-coverage-reducing-riots,Howard Kurtz says media coverage is reducing violent riots to a 'footnote' in the Portland story,,20200729-1800
https://www.foxnews.com/auto/gmc-hummer-ev-teased-in-photos-ahead-of-fall-reveal,GMC Hummer teased in photos ahead of its fall reveal,,20200729-1800
https://www.foxnews.com/entertainment/ellen-degeneres-show-investigation-end-tv-career,"Ellen DeGeneres investigation could end TV career, expert says",,20200729-1800
https://www.foxnews.com/politics/jim-jordan-says-dems-cut-off-gop-video-at-barr-hearing-heres-the-full-version,Here’s full video introduced by Jordan at Barr hearing that set off Dems,,20200729-1800
https://www.foxnews.com/media/seattle-police-union-leader-trump-martial-law,Seattle police union leader hits back after mayor claims Trump using feds as 'dry run for martial law',,20200729-1800
https://www.foxbusiness.com/money/a-second-1200-stimulus-check-is-likely-and-26m-more-people-might-qualify-for-the-cash-this-round,A second stimulus check is likely — and 26M more people might get cash this round,,20200729-1800
https://video.foxnews.com/v/6176338697001/,"Gutfeld: Biden isn't picking a running mate, 'he's picking the president'",,20200729-1800
https://www.foxnews.com/politics/mcconnell-dems-sabotage-coronavirus-bill,McConnell suggests Dems are trying to 'sabotage' the next coronavirus bill,,20200729-1800
https://www.foxnews.com/politics/third-un-staffer-leave-video-alleged-sex-act,Third UN staffer put on leave over video of alleged sex act in official car,,20200729-1800
https://video.foxnews.com/v/6176331709001/,Durham report: Should AG Barr release Russia review before the election?,,20200729-1800
https://www.foxnews.com/us/nypd-police-arrest-woman-minivan-video-cameras,Police video appears to show woman damaging cameras 5 times after controversial NYPD arrest,,20200729-1800
https://www.foxnews.com/world/iran-launches-underground-ballistic-missiles-during-exercise,"Iran launches underground ballistic missiles during exercise, aims at replica American aircraft carrier",,20200729-1800
https://www.foxnews.com/world/us-announces-plans-to-send-troops-home,"US announces plans to remove 12,000 troops from Germany",,20200729-1800
https://www.foxnews.com/world/british-family-on-vacation-finds-migrants-hiding,Family on vacation finds migrants hiding in their car's rooftop cargo box,,20200729-1800
https://www.foxnews.com/world/new-zealand-charge-travelers-coronavirus-quarantine-cost-taxpayers,New Zealand to charge some travelers for coronavirus quarantine to ease burden on taxpayers,,20200729-1800
https://www.foxnews.com/world/north-korean-defector-shocked-by-kindness-racial-diversity-of-u-s,"North Korean defector ‘shocked’ by kindness, racial diversity of US",,20200729-1800
https://www.foxnews.com/us/man-videotaped-ahmaud-arbery-death-child-molestation,Man who videotaped Ahmaud Arbery's death subject of child molestation investigation: report,,20200729-1800
https://www.foxnews.com/world/pakistani-man-on-trial-for-blasphemy-shot-dead-in-court,Pakistani man on trial for blasphemy shot dead in court,,20200729-1800
https://www.foxnews.com/food-drink/new-mexico-restaurant-suspended-food-permit-coronavirus-sign,Restaurant has food permit suspended for violating health order months after posting controversial sign,,20200729-1800
https://www.foxnews.com/us/nevada-sheriff-library-911-calls-black-lives-matter,Nevada sheriff tells library not to call 911 if they support BLM,,20200729-1800
https://www.foxnews.com/media/chicago-tribune-columnist-colleagues-george-soros,Chicago Tribune columnist refuses to apologize to colleagues peeved over George Soros piece: ‘I will not bow’,,20200729-1800
https://www.foxbusiness.com/money/should-i-use-personal-loan-consolidate-debt,Should I use a personal loan to consolidate debt?,,20200729-1800
https://www.foxnews.com/entertainment/derek-hough-reacts-tom-bergeron-erin-andrews-not-returning,'Dancing with the Stars' pro Derek Hough reacts to Tom Bergeron and Erin Andrews not returning as hosts,,20200729-1800
https://www.foxnews.com/entertainment/queen-elizabeth-royal-feud-william-harry-sources,"Queen Elizabeth wants Princes William, Harry to solve their royal feud ‘like grown adults,’ source claims",,20200729-1800
