,text,notes,date
https://www.foxnews.com/media/msnbc-chris-hayes-nypd-arrest-kidnapping,MSNBC host called out by colleague after calling NYPD arrest a kidnapping,,20200729-1200
https://www.foxnews.com/entertainment/prince-william-gift-kate-middleton-never-let-him-forget,William's ODD gift to his wife,,20200729-1200
https://www.foxnews.com/entertainment/madonna-shares-same-coronavirus-video-as-trump-instagram-flags-report,Madonna's account flagged,,20200729-1200
https://www.foxnews.com/sports/dodgers-astros-benches-clear-joe-kelly-alex-bregman-and-carlos-correa,"Dodgers, Astros' benches clear after Joe Kelly buzzes Alex Bregman and Carlos Correa",,20200729-1200
https://www.foxnews.com/sports/nbas-2020-pandemic-shortened-season-everything-you-need-to-know,NBA's 2020 pandemic-shortened season: Everything you need to know,,20200729-1200
https://www.foxbusiness.com/real-estate/mystery-buyer-snags-nyc-penthouse,Mystery buyer snags $102M penthouse in record-setting NYC tower,,20200729-1200
https://www.foxnews.com/food-drink/national-chicken-wing-day-backstory-deals,Best National Chicken Wing Day DEALS,,20200729-1200
https://www.foxnews.com/food-drink/tesla-upgrades-chocolate-chips,TESLA making chocolate chips?,,20200729-1200
https://www.foxnews.com/auto/these-10-vehicles-short-supply,These 10 vehicles are in short supply due to COVID-19,,20200729-1200
https://www.foxbusiness.com/money/time-early-retirement-checklist,Is it time for an early retirement? Use this checklist,,20200729-1200
https://nation.foxnews.com/watch/24916db76eee8db2f17683df4c14ba50/?cmpid=org=NAT::ag=owned::mc=FNC_display::src=FNC_web::cmp=homepage::add=watch_platform_vd_creative&utm_source=FNC_display&utm_medium=FNC_web&utm_campaign=homepage&utm_content=watch_platform_vd_creative,A football quarterback turned political icon reached across the aisle & grabbed the best of everyone.. Watch how he did it!,,20200729-1200
https://www.foxnews.com/sports/cuomo-invites-all-mlb-teams-to-play-in-new-york-state-amid-covid-19-issues,Governor invites all MLB teams to play in his state,,20200729-1200
https://www.foxnews.com/world/head-of-chinese-cdc-says-hes-taking-experimental-coronavirus-drug,Head of Chinese CDC says he's taking experimental coronavirus drug,,20200729-1200
https://www.foxnews.com/us/north-carolina-curfew-alcohol-coronavirus-spike,"As coronavirus cases spike, North Carolina puts curfew on alcohol sales",,20200729-1200
https://www.foxnews.com/politics/why-the-coronavirus-bill-wont-get-finalized-until-the-11th-hour,Why the coronavirus bill won’t get finalized until the 11th hour,,20200729-1200
https://www.foxnews.com/world/coronavirus-leads-to-mass-hunger-killing-10000-children-a-month-un-warns,"Coronavirus leads to mass hunger, killing 10,000 children a month, UN warns",,20200729-1200
https://www.foxbusiness.com/money/7-common-mistakes-refinancing-into-lower-mortgage-rate,7 common mistakes when refinancing into a low mortgage rate,,20200729-1200
https://www.foxnews.com/opinion/seattle-portland-seditionists-cal-thomas,"Rioters in Seattle, Portland are seditionists, not protesters",,20200729-1200
https://www.foxnews.com/opinion/joe-bidens-womens-agenda-patrice-onwuka,Joe Biden's 'Women's Agenda' would not result in future women want,,20200729-1200
https://www.foxnews.com/science/where-is-cleopatras-tomb,Cleopatra's tomb FOUND?,,20200729-1200
https://www.foxnews.com/entertainment/little-house-on-the-praire-star-karen-grassle,Little House’ star: I was BROKE,,20200729-1200
https://www.foxnews.com/lifestyle/matchmaker-explains-coparenting-no-romance,"Matchmaker wants family, no romance",,20200729-1200
https://www.foxnews.com/auto/nascars-jimmie-johnson-tests-indycar-indianapolis-motor-speedway,Jimmie Johnson tests INDYCAR,,20200729-1200
https://www.foxnews.com/science/super-space-sunblock-made-from-skin-pigment-could-shield-astronauts-from-radiation,Could THIS shield astronauts from radiation?,,20200729-1200
https://www.foxnews.com/entertainment/kim-kardashian-family-shielding-kids,Kim and family 'SHIELDING' kids,,20200729-1200
https://www.foxnews.com/science/mediterranean-sea-significantly-warmer-roman-empire,WHAT happened during Roman Empire?,,20200729-1200
https://www.foxnews.com/science/incredible-photo-shows-epic-showdown-between-lioness-and-male-lion,'Epic showdown' happened WHY?,,20200729-1200
https://www.foxnews.com/food-drink/servers-generous-tips-movement,Bartender’s unexpected death prompts BIG act,,20200729-1200
https://www.foxnews.com/great-outdoors/north-carolina-fishermen-hook-state-record-catfish-days-apart,SEE IT: Angler's CRAZY catch,,20200729-1200
https://www.foxnews.com/entertainment/kelly-ripa-regis-philbin-life-lesson,Kelly reveals life lesson from Regis,,20200729-1200
https://www.foxnews.com/real-estate/gigi-hadid-nyc-apartment-divides-twitter-users,Gigi's decision DIVIDES fans,,20200729-1200
https://www.foxnews.com/entertainment/megan-fox-machine-gun-kelly-instagram-official,We 'waited for ETERNITY',,20200729-1200
https://www.foxnews.com/entertainment/riverdale-vanessa-morgan-husband-michael-kopech-divorce-pregnancy,Pregnant star's hubby files for DIVORCE,,20200729-1200
https://www.foxnews.com/entertainment/dwayne-the-rock-johnson-considered-willy-wonka,'The Rock' considered for THIS movie,,20200729-1200
https://www.foxnews.com/entertainment/britney-spears-demanding-attention-new-bikini-pic-henna-tattoos,Star 'DEMANDING attention' with bikini pic,,20200729-1200
https://www.foxnews.com/science/pentagon-ufo-unit-spotlight-vehicles-earth,UFOs? Pentagon mentions 'vehicles not made on Earth',,20200729-1200
https://www.foxnews.com/great-outdoors/humpback-whale-shocks-fisherman-feet-from-boat,Georgia inmates credited with helping save deputy’s life: report,,20200729-1200
https://video.foxnews.com/v/6176231408001/,Sen. Scott proposes an incentive to help restaurants recover,,20200729-1230
https://video.foxnews.com/v/6176206879001/,Michigan swing voters voice concerns about Joe Biden's 2020 platform,,20200729-1230
https://video.foxnews.com/v/6176049992001/,Tucker: Big Tech censors COVID video featuring doctors,,20200729-1230
https://video.foxnews.com/v/6175990578001/,Rep. Brady: I'm not sure Biden understands the modern economy,,20200729-1230
https://video.foxnews.com/v/6176022132001/,President Trump comments on Dr. Fauci's 'very good approval rating',,20200729-1230
https://video.foxnews.com/v/6175859243001/,Trey Gowdy blasts Nadler over police misconduct: Why haven’t you called Michael Horowitz?,,20200729-1230
https://video.foxnews.com/v/6175896204001/,"AG Barr spars with Nadler: Portland is under attack, we're on the defense",,20200729-1230
https://video.foxnews.com/v/6175884858001/,Jim Jordan calls out Obama-Biden DOJ for spying: 17 lies told to secret court,,20200729-1230
https://video.foxnews.com/v/6175888938001/,"AG Barr testifies: Anarchists hijacked legitimate protests, assaulting gov't of United States",,20200729-1230
https://www.foxnews.com/opinion/michael-goodwin-barr-eats-nadlers-lunch-during-testimony,MICHAEL GOODWIN: Barr feasts on a 'gaggle of Democratic amateurs' at disastrous hearing,,20200729-1230
https://www.foxnews.com/media/john-kennedy-barr-hearing-dems,Sen. John Kennedy says Barr hearing triggered his gag reflex: Dems upset 'he's out of their control',,20200729-1230
https://www.foxnews.com/media/ben-shapiro-democrats-barr-hearing-absurdity,Ben Shapiro decries Barr hearing as 'moral absurdity': 'Just ridiculous from beginning to end',,20200729-1230
https://www.foxnews.com/opinion/andrew-mccarthy-democrats-use-hearing-for-political-attacks-on-barr-and-trump-not-interested-in-hearing-barr,Dems use hearing for political attacks on Barr and Trump – uninterested in hearing from AG,,20200729-1230
https://www.foxnews.com/politics/barr-testifies-before-house-judiciary-committee-maintains-independence-from-trump,"Barr spars with Dems on Trump ties, riots at fiery House hearing",,20200729-1230
https://www.foxnews.com/media/trey-gowdy-nadler-nyc-violence-barr-hearing,Gowdy challenges Nadler to tell NYC murder victims' families 'that the violence is manufactured',,20200729-1230
https://www.foxnews.com/media/justice-department-kerri-kupec-barr-hearing-democrats,Justice Department spokeswoman laments heated Barr hearing as 'lost opportunity' for Americans,,20200729-1230
https://www.foxnews.com/politics/bidens-notes-suggest-kamala-harris-may-be-his-chosen-running-mate-do-not-hold-grudges,Photo of Biden’s notes may shed light on relationship with Harris,,20200729-1230
https://www.foxnews.com/politics/dems-say-bloomberg-not-helping-2020-campaign-as-much-as-promised-report,Dems say Bloomberg not helping 2020 campaign as much as promised: report,,20200729-1230
https://www.foxnews.com/media/politico-biden-vp-kamala-harris-running-mate-mistake,Politico accidentally reports Biden picked Kamala Harris as his running mate,,20200729-1230
https://www.foxnews.com/media/portland-business-owner-on-impact-of-riots-coronavirus-its-terrifying,"Portland business owner opens up about protests, virus",,20200729-1230
https://www.foxnews.com/media/giuliani-portland-mayor-ted-wheeler-violence-riots,"Giuliani knocks 'pathetic' Portland mayor over handling of riots, defends dispatching federal agents",,20200729-1230
https://www.foxnews.com/politics/trump-administration-in-talks-with-oregon-governor-to-draw-down-federal-agents-report,Trump administration in talks with Oregon governor to draw down federal agents: report,,20200729-1230
https://www.foxbusiness.com/money/second-stimulus-check-calculator-see-how-much-money-you-could-receive,Use this stimulus check calculator to see how much $$ you will get,,20200729-1230
https://www.foxnews.com/entertainment/eva-larue-john-callahan-broken-into-car-identity-stolen-death,EXCLUSIVE: ‘CSI’ star details identity-theft horror after soap star hubby’s death,,20200729-1230
https://www.foxnews.com/politics/trump-calls-gop-coronavirus-proposal-semi-irrelevant-as-deal-appears-far-off,Trump calls GOP coronavirus proposal 'semi-irrelevant' as deal appears far off,,20200729-1230
https://www.foxnews.com/media/detroit-police-chief-we-dont-retreat-here,Detroit police chief offers explanation for lack of violent riots in Motor City,,20200729-1230
https://www.foxnews.com/politics/pennsylvania-health-secretary-condemns-transphobic-attacks-against-her,Pennsylvania health secretary condemns transphobic attacks against her,,20200729-1230
https://video.foxnews.com/v/6176196183001/,Andy McCarthy's takeaway from AG Barr hearing: 'Tragic for America',,20200729-1230
https://www.foxnews.com/media/virginia-newspaper-calls-out-local-leaders-riots,Virginia newspaper calls out local leaders after Richmond riots: 'Enough is enough',,20200729-1230
https://www.foxnews.com/politics/california-considers-its-own-600-weekly-benefit-if-congress-fails-to-act-report,One state considers its own massive unemployment benefit,,20200729-1230
https://video.foxnews.com/v/6176200377001/,Jim Jordan calls out Dems at AG Barr hearing: 'Out to get this guy' since he called out 'spying',,20200729-1230
https://www.foxbusiness.com/economy/teacher-union-strike-threat-coronavirus,Teachers threaten 'safety strikes' over schools reopening amid coronavirus,,20200729-1230
https://www.foxnews.com/us/chicago-deputy-police-chief-dead-in-apparent-suicide-soon-after-promotion-officials-say,Chicago deputy police chief dead in apparent suicide,,20200729-1230
https://www.foxnews.com/us/california-man-apparently-set-on-fire-in-gruesome-death-investigation-underway,"California man apparently set on fire in gruesome death, family claims; investigation underway",,20200729-1230
https://www.foxnews.com/world/hong-kong-leader-warns-hospital-system-could-collapse-as-city-on-verge-of-large-scale-outbreak,Hong Kong leader warns hospital system could collapse,,20200729-1230
https://www.foxnews.com/us/mystery-seeds-now-arriving-in-texas-mailboxes-report,Mystery seeds found in another state,,20200729-1230
https://www.foxnews.com/us/georgia-inmates-credited-with-helping-save-deputys-life-report,Georgia inmates credited with helping save deputy’s life: report,,20200729-1230
https://www.foxnews.com/world/china-ship-fleet-galapagos-islands-ecuador-navy-alert,Ecuador navy 'on alert' as 260-strong Chinese fleet nears Galapagos Islands,,20200729-1230
https://www.foxnews.com/media/msnbc-chris-hayes-nypd-arrest-kidnapping,MSNBC host called out by colleague after calling NYPD arrest a kidnapping,,20200729-1230
https://www.foxnews.com/entertainment/prince-william-gift-kate-middleton-never-let-him-forget,William's ODD gift to his wife,,20200729-1230
https://www.foxnews.com/entertainment/madonna-shares-same-coronavirus-video-as-trump-instagram-flags-report,Madonna's account flagged,,20200729-1230
https://www.foxnews.com/sports/nuggets-michael-porter-jr-coronavirus-pandemic-bigger-agenda-population-control,NBA player: Coronavirus pandemic being used for 'bigger agenda',,20200729-1230
https://www.foxnews.com/sports/dodgers-astros-benches-clear-joe-kelly-alex-bregman-and-carlos-correa,"Dodgers, Astros' benches clear after Joe Kelly buzzes Alex Bregman and Carlos Correa",,20200729-1230
https://www.foxnews.com/sports/nbas-2020-pandemic-shortened-season-everything-you-need-to-know,NBA's 2020 pandemic-shortened season: Everything you need to know,,20200729-1230
https://www.foxnews.com/sports/eagles-jalen-mills-shares-video-doctors-praising-hydroxychloroquine-coronavirus,Eagles' Jalen Mills shares video of doctors praising hydroxychloroquine: 'The world should hear this',,20200729-1230
https://www.foxnews.com/auto/these-10-vehicles-short-supply,These 10 vehicles are in short supply due to COVID-19,,20200729-1230
https://www.foxnews.com/auto/houston-drivers-not-paying-tickets-make-550000-ineligible-for-license-renewal-study,More than a half million drivers in Texas city ineligible for license renewal: study,,20200729-1230
https://www.foxnews.com/food-drink/national-chicken-wing-day-backstory-deals,Best National Chicken Wing Day DEALS,,20200729-1230
https://www.foxnews.com/food-drink/tesla-upgrades-chocolate-chips,TESLA making chocolate chips?,,20200729-1230
https://www.foxbusiness.com/money/time-early-retirement-checklist,Is it time for an early retirement? Use this checklist,,20200729-1230
https://nation.foxnews.com/watch/24916db76eee8db2f17683df4c14ba50/?cmpid=org=NAT::ag=owned::mc=FNC_display::src=FNC_web::cmp=homepage::add=watch_platform_vd_creative&utm_source=FNC_display&utm_medium=FNC_web&utm_campaign=homepage&utm_content=watch_platform_vd_creative,A football quarterback turned political icon reached across the aisle & grabbed the best of everyone.. Watch how he did it!,,20200729-1230
https://www.foxbusiness.com/money/is-600-a-week-in-extra-unemployment-aid-deterring-people-from-seeking-work,Is $600 a week in extra unemployment aid deterring people from seeking work?,,20200729-1230
https://www.foxnews.com/politics/trump-press-briefing-coronavirus-hydroxychloroquine-doctor,Trump ends press briefing after defending pro-hydroxychloroquine doctor who says virus has a 'cure',,20200729-1230
https://www.foxnews.com/sports/cuomo-invites-all-mlb-teams-to-play-in-new-york-state-amid-covid-19-issues,Governor invites all MLB teams to play in his state,,20200729-1230
https://www.foxnews.com/world/head-of-chinese-cdc-says-hes-taking-experimental-coronavirus-drug,Head of Chinese CDC says he's taking experimental coronavirus drug,,20200729-1230
https://www.foxnews.com/us/north-carolina-curfew-alcohol-coronavirus-spike,"As coronavirus cases spike, North Carolina puts curfew on alcohol sales",,20200729-1230
https://www.foxbusiness.com/money/how-to-land-lowest-15-year-mortgage-rate-refinance,How to land the lowest 15-year mortgage rate for your refinance,,20200729-1230
https://www.foxnews.com/opinion/2020-election-conservatives-cancel-culture-ken-buck,2020 election is opportunity for conservatives to stand up to cancel-culture mob,,20200729-1230
https://www.foxnews.com/opinion/big-tech-censors-covid-19-video-tucker-carlson,Big Tech censors COVID-19 video featuring doctors,,20200729-1230
https://www.foxnews.com/science/where-is-cleopatras-tomb,Cleopatra's tomb FOUND?,,20200729-1230
https://www.foxnews.com/entertainment/little-house-on-the-praire-star-karen-grassle,Little House’ star: I was BROKE,,20200729-1230
https://www.foxnews.com/lifestyle/what-is-instagram-new-women-supporting-women-selfie-trend,SEE IT: Instagram's NEW challenge,,20200729-1230
https://www.foxnews.com/lifestyle/matchmaker-explains-coparenting-no-romance,"Matchmaker wants family, no romance",,20200729-1230
https://www.foxnews.com/auto/nascars-jimmie-johnson-tests-indycar-indianapolis-motor-speedway,Jimmie Johnson tests INDYCAR,,20200729-1230
https://www.foxnews.com/entertainment/megan-fox-machine-gun-kelly-instagram-official,We 'waited for ETERNITY',,20200729-1230
https://www.foxnews.com/science/mediterranean-sea-significantly-warmer-roman-empire,WHAT happened during Roman Empire?,,20200729-1230
https://www.foxnews.com/entertainment/riverdale-vanessa-morgan-husband-michael-kopech-divorce-pregnancy,Pregnant star's hubby files for DIVORCE,,20200729-1230
https://www.foxnews.com/science/incredible-photo-shows-epic-showdown-between-lioness-and-male-lion,'Epic showdown' happened WHY?,,20200729-1230
https://www.foxnews.com/entertainment/dwayne-the-rock-johnson-considered-willy-wonka,'The Rock' considered for THIS movie,,20200729-1230
https://www.foxnews.com/entertainment/britney-spears-demanding-attention-new-bikini-pic-henna-tattoos,Star 'DEMANDING attention' with bikini pic,,20200729-1230
https://www.foxnews.com/great-outdoors/north-carolina-fishermen-hook-state-record-catfish-days-apart,Mystery seeds now arriving in Texas mailboxes: report,,20200729-1230
https://video.foxnews.com/v/6176200377001/,Jim Jordan calls out Dems at AG Barr hearing: 'Out to get this guy' since he called out 'spying',,20200729-1300
https://video.foxnews.com/v/6176196183001/,Andy McCarthy's takeaway from AG Barr hearing: 'Tragic for America',,20200729-1300
https://video.foxnews.com/v/6176231408001/,Sen. Scott proposes an incentive to help restaurants recover,,20200729-1300
https://video.foxnews.com/v/6176206879001/,Michigan swing voters voice concerns about Joe Biden's 2020 platform,,20200729-1300
https://video.foxnews.com/v/6176049992001/,Tucker: Big Tech censors COVID video featuring doctors,,20200729-1300
https://video.foxnews.com/v/6175990578001/,Rep. Brady: I'm not sure Biden understands the modern economy,,20200729-1300
https://video.foxnews.com/v/6176022132001/,President Trump comments on Dr. Fauci's 'very good approval rating',,20200729-1300
https://video.foxnews.com/v/6175859243001/,Trey Gowdy blasts Nadler over police misconduct: Why haven’t you called Michael Horowitz?,,20200729-1300
https://video.foxnews.com/v/6175896204001/,"AG Barr spars with Nadler: Portland is under attack, we're on the defense",,20200729-1300
https://video.foxnews.com/v/6175884858001/,Jim Jordan calls out Obama-Biden DOJ for spying: 17 lies told to secret court,,20200729-1300
https://video.foxnews.com/v/6175888938001/,"AG Barr testifies: Anarchists hijacked legitimate protests, assaulting gov't of United States",,20200729-1300
https://www.foxnews.com/opinion/michael-goodwin-barr-eats-nadlers-lunch-during-testimony,MICHAEL GOODWIN: Barr feasts on a 'gaggle of Democratic amateurs' at disastrous hearing,,20200729-1300
https://www.foxnews.com/media/john-kennedy-barr-hearing-dems,Sen. John Kennedy says Barr hearing triggered his gag reflex: Dems upset 'he's out of their control',,20200729-1300
https://www.foxnews.com/media/ben-shapiro-democrats-barr-hearing-absurdity,Ben Shapiro decries Barr hearing as 'moral absurdity': 'Just ridiculous from beginning to end',,20200729-1300
https://www.foxnews.com/opinion/andrew-mccarthy-democrats-use-hearing-for-political-attacks-on-barr-and-trump-not-interested-in-hearing-barr,Dems use hearing for political attacks on Barr and Trump – uninterested in hearing from AG,,20200729-1300
https://www.foxnews.com/politics/barr-testifies-before-house-judiciary-committee-maintains-independence-from-trump,"Barr spars with Dems on Trump ties, riots at fiery House hearing",,20200729-1300
https://www.foxnews.com/media/trey-gowdy-nadler-nyc-violence-barr-hearing,Gowdy challenges Nadler to tell NYC murder victims' families 'that the violence is manufactured',,20200729-1300
https://www.foxnews.com/media/justice-department-kerri-kupec-barr-hearing-democrats,Justice Department spokeswoman laments heated Barr hearing as 'lost opportunity' for Americans,,20200729-1300
https://www.foxnews.com/politics/bidens-notes-suggest-kamala-harris-may-be-his-chosen-running-mate-do-not-hold-grudges,Photo of Biden’s notes may shed light on relationship with Harris,,20200729-1300
https://www.foxnews.com/politics/dems-say-bloomberg-not-helping-2020-campaign-as-much-as-promised-report,Dems say Bloomberg not helping 2020 campaign as much as promised: report,,20200729-1300
https://www.foxnews.com/media/politico-biden-vp-kamala-harris-running-mate-mistake,Politico accidentally reports Biden picked Kamala Harris as his running mate,,20200729-1300
https://www.foxnews.com/media/virginia-newspaper-calls-out-local-leaders-riots,Va. paper calls out local officials after a weekend of riots,,20200729-1300
https://www.foxnews.com/media/detroit-police-chief-we-dont-retreat-here,Detroit police chief offers explanation for lack of violent riots in Motor City,,20200729-1300
https://www.foxnews.com/media/giuliani-portland-mayor-ted-wheeler-violence-riots,"Giuliani knocks 'pathetic' Portland mayor over handling of riots, defends dispatching federal agents",,20200729-1300
https://www.foxbusiness.com/money/second-stimulus-check-calculator-see-how-much-money-you-could-receive,Use this stimulus check calculator to see how much $$ you will get,,20200729-1300
https://www.foxnews.com/sports/nbas-2020-pandemic-shortened-season-everything-you-need-to-know,Here’s everything you need to know about NBA’s shortened season,,20200729-1300
https://video.foxnews.com/v/6176233227001/,Rep. Lewis departure ceremony takes place at the US Capitol,,20200729-1300
https://www.foxnews.com/politics/trump-calls-gop-coronavirus-proposal-semi-irrelevant-as-deal-appears-far-off,Trump calls GOP coronavirus proposal 'semi-irrelevant' as deal appears far off,,20200729-1300
https://www.foxnews.com/media/portland-business-owner-on-impact-of-riots-coronavirus-its-terrifying,"Portland business owner opens up about protests, virus",,20200729-1300
https://video.foxnews.com/v/6176220815001/,"Gov. Noem unveils plan to get kids back in the classroom, without masks",,20200729-1300
https://www.foxnews.com/politics/pennsylvania-health-secretary-condemns-transphobic-attacks-against-her,Pennsylvania health secretary condemns transphobic attacks against her,,20200729-1300
https://www.foxnews.com/politics/california-considers-its-own-600-weekly-benefit-if-congress-fails-to-act-report,One state considers its own massive unemployment benefit,,20200729-1300
https://video.foxnews.com/v/6176226483001/,"Sen. Scott: 'Barr was undeniably powerful,' America witnessed 'chaos in Congress'",,20200729-1300
https://www.foxbusiness.com/economy/teacher-union-strike-threat-coronavirus,Teachers threaten 'safety strikes' over schools reopening amid coronavirus,,20200729-1300
https://www.foxnews.com/us/chicago-deputy-police-chief-dead-in-apparent-suicide-soon-after-promotion-officials-say,Chicago deputy police chief dead in apparent suicide,,20200729-1300
https://www.foxnews.com/us/california-man-apparently-set-on-fire-in-gruesome-death-investigation-underway,"California man apparently set on fire in gruesome death, family claims; investigation underway",,20200729-1300
https://www.foxnews.com/world/hong-kong-leader-warns-hospital-system-could-collapse-as-city-on-verge-of-large-scale-outbreak,Hong Kong leader warns hospital system could collapse,,20200729-1300
https://www.foxnews.com/us/mystery-seeds-now-arriving-in-texas-mailboxes-report,Mystery seeds found in another state,,20200729-1300
https://www.foxnews.com/us/georgia-inmates-credited-with-helping-save-deputys-life-report,Georgia inmates credited with helping save deputy’s life: report,,20200729-1300
https://www.foxnews.com/world/china-ship-fleet-galapagos-islands-ecuador-navy-alert,Ecuador navy 'on alert' as 260-strong Chinese fleet nears Galapagos Islands,,20200729-1300
https://www.foxnews.com/media/msnbc-chris-hayes-nypd-arrest-kidnapping,MSNBC host called out by colleague after calling NYPD arrest a kidnapping,,20200729-1300
https://www.foxbusiness.com/money/how-to-land-lowest-15-year-mortgage-rate-refinance,How to land the lowest 15-year mortgage rate for your refinance,,20200729-1300
https://www.foxnews.com/entertainment/eva-larue-john-callahan-broken-into-car-identity-stolen-death,EXCLUSIVE: ‘CSI’ star details identity-theft horror after soap star hubby’s death,,20200729-1300
https://www.foxnews.com/entertainment/jeopardy-resume-production-wheel-of-fortune,'Jeopardy!' and 'Wheel of Fortune' to resume production with new safety guidelines,,20200729-1300
https://www.foxnews.com/entertainment/tom-hanks-returning-childhood-job-sell-hot-dogs-oakland,Tom Hanks returning to childhood job to ‘sell’ hot dogs at Oakland A’s games amid MLB season with no crowds,,20200729-1300
https://www.foxnews.com/entertainment/prince-william-gift-kate-middleton-never-let-him-forget,William's ODD gift to his wife,,20200729-1300
https://www.foxnews.com/entertainment/madonna-shares-same-coronavirus-video-as-trump-instagram-flags-report,Madonna's account flagged,,20200729-1300
https://www.foxnews.com/sports/nuggets-michael-porter-jr-coronavirus-pandemic-bigger-agenda-population-control,NBA player: Coronavirus pandemic being used for 'bigger agenda',,20200729-1300
