,name,text,id,url,created_at
0,BostonGlobe,"After criticism, Dianne Feinstein to step down as top Judiciary Dem https://t.co/sXc23JzW7l",1331025845218119683,-1,Tue Nov 24 00:04:25 +0000 2020
0,BostonGlobe,Mass. unemployment claims are being rejected at a high rate due to possible fraud https://t.co/TGDFBP8S0b,1331029234328997894,-1,Tue Nov 24 00:17:53 +0000 2020
0,BostonGlobe,Revolution aim to halt skid vs. Philadelphia Union in MLS playoff match https://t.co/j96XDd8zgt,1331032293784350722,-1,Tue Nov 24 00:30:02 +0000 2020
0,BostonGlobe,Ask @MatthewGilbert: What if I don’t want to start at the beginning of ‘The Crown’? https://t.co/TZP0lKVyNr,1331036084185292800,-1,Tue Nov 24 00:45:06 +0000 2020
0,BostonGlobe,"Amtrak to furlough 1,950 employees throughout the month of November amid decreased ridership https://t.co/Qry9NZlzLF",1331039843347017730,-1,Tue Nov 24 01:00:02 +0000 2020
0,BostonGlobe,Ken Jennings will be first interim ‘Jeopardy!’ host https://t.co/xmLi2nhvrH,1331043649065512972,-1,Tue Nov 24 01:15:10 +0000 2020
0,BostonGlobe,Millions of Americans are traveling for Thanksgiving despite warnings about COVID-19 from public health officials https://t.co/SeHeQG5euC,1331044896086626304,-1,Tue Nov 24 01:20:07 +0000 2020
