,name,text,id,url,created_at
0,politico,"Trump’s actions, and the endless partisan battles over the Russia probe and impeachment, have left the intelligence community bruised and battered https://t.co/PI4qjGUQmZ",1318137338933936134,https://www.politico.com/news/2020/10/19/biden-revamp-fraying-intel-community-430090,Mon Oct 19 10:30:06 +0000 2020
0,politico,"The race to serve as Joe Biden’s secretary of State has already begun, and the signs are surprisingly obvious if you know where to look https://t.co/jF86apEfYC",1318145159004147712,https://www.politico.com/news/2020/10/19/joe-biden-secretary-of-state-430089,Mon Oct 19 11:01:10 +0000 2020
0,politico,"President Donald Trump is racing to close a yawning gap in the polls in his final, frantic sprint to Election Day — and also rushing to restore a key element of his personal brand https://t.co/KOmGFxONGn",1318152458728767488,https://www.politico.com/news/2020/10/19/trump-post-coronavirus-health-personal-brand-430096,Mon Oct 19 11:30:10 +0000 2020
0,politico,"Short. Fast. Daily. Analysis of the most important stories of the day layered with important context from top experts across our newsroom. Subscribe to POLITICO Dispatch today.
https://t.co/DPUpEFlsul https://t.co/Oh5e2mkKwW",1318162502333665280,https://www.politico.com/podcasts/dispatch?cid=mkt_politico_dispatch_twitter,Mon Oct 19 12:10:05 +0000 2020
0,politico,"Opinion: While most environmental groups tend to be on the side of a ban, there are actually strong environmental justifications for Joe Biden and Kamala Harris’ light touch on fracking today https://t.co/i9ZMU92hRA",1318167575080128512,https://www.politico.com/news/agenda/2020/10/19/could-fracking-help-the-climate-429929,Mon Oct 19 12:30:14 +0000 2020
