,text,notes,date
/2020/07/01/politics/jill-biden-running-mate/index.html,Jill Biden plays key role in her husband's search for a running mate,,20200703-0700
/2020/07/01/us/mississippi-state-flag-confederacy-flag-trnd/index.html,Mississippi changing its flag isn't the end of Confederate symbols in state flags,,20200703-0700
/2020/06/30/politics/mask-wearing-alabama-senate-race-doug-jones/index.html,The politics of wearing a mask hits Alabama's Senate race,,20200703-0700
https://www.cnn.com/factsfirst/politics?xid=ff_btn,CNN holds officials accountable. View our Facts First database,,20200703-0700
/2020/07/01/health/fireworks-toxic-air-safety-wellness/index.html,Some consumer fireworks emit high levels of lead ,,20200703-0700
/2020/07/02/health/coronavirus-social-distancing-resilience-wellness/index.html,Finding resilience during the coronavirus pandemic,,20200703-0700
/2020/07/01/health/covid-19-staying-home-saved-lives-wellness/index.html,People who stay home voluntarily save lives,,20200703-0700
/2020/06/16/health/flush-toilet-spray-coronavirus-wellness-trnd/index.html,Flush carefully. Coronavirus could spread in toilet spray,,20200703-0700
https://healthguides.cnn.com/getting-the-right-treatment-for-hepatitis-c/how-to-get-the-most-out-of-a-virtual-doctor-visit-for-hepatitis-c?did=t1_rss5,How telehealth can help your hep C,,20200703-0700
/travel/article/detox-rehab-facilities-thailand/index.html,Western addicts head to Thailand to detox,,20200703-0700
/travel/article/outdoor-dining-united-states-covid-19/index.html,Scenes from reopened US restaurants in the coronavirus era,,20200703-0700
/travel/article/japan-new-shinkansen-model-n700s/index.html,"Japan debuts new safer, faster bullet train",,20200703-0700
/travel/article/face-shields-qatar-airways/index.html,Airline requiring face shields AND face masks ,,20200703-0700
/travel/article/czech-public-dinner-lockdown-scli-intl/index.html,"Mass dinner party at 1,600-foot table marks end of lockdown",,20200703-0700
https://www.cnn.com/audio/podcasts/corona-virus,Coronavirus Fact vs Fiction: This is going to be a house on fire for a long time,,20200703-0700
https://www.cnn.com/audio/podcasts/axe-files,Axe Files: Shannon Watts of Moms Demand Action,,20200703-0700
https://cnn.com/audio/podcasts/daily-dc,The Daily DC: Trump's Congressional losses,,20200703-0700
https://www.cnn.com/audio/podcasts/the-point,The Point: Trump digging in on Confederate statues,,20200703-0700
/world/live-news/coronavirus-pandemic-07-03-20-intl/index.html,Coronavirus: Live updates,,20200703-0730
/2020/07/03/health/coronavirus-lockdown-lifting-deadly-charts-intl/index.html,"The US, Brazil and others lifted lockdowns early. These charts show just how deadly that decision was",,20200703-0730
/2020/07/02/us/ghislaine-maxwell-jeffrey-epstein/index.html,TRENDING: Ghislaine Maxwell,,20200703-0730
/2020/07/02/us/vanessa-guillen-fort-hood-disappearance/index.html,"Pfc. Vanessa Guillen bludgeoned to death on Army base, family attorney says",,20200703-0730
/2020/07/02/asia/hong-kong-security-law-intl-hnk/index.html,Hong Kong protest leader flees as government warns calls for 'revolution' are now illegal,,20200703-0730
/2020/07/02/politics/bolton-scars-russia-trump-cnntv/index.html,John Bolton,,20200703-0730
/2020/07/02/media/hugh-downs-obituary/index.html,Hugh Downs death,,20200703-0730
/2020/07/02/health/coronavirus-mutation-spread-study/index.html,"The new mutation does not seem to make people any sicker than earlier variations of the virus, researchers say",h2,20200703-0730
https://www.cnn.com/2020/07/02/health/us-coronavirus-thursday/index.html,Texas implements mask mandate,h2,20200703-0730
http://www.cnn.com/2020/07/02/us/florida-coronavirus-thursday/index.html,Florida cases hit record ,h2,20200703-0730
/2020/07/02/politics/trump-state-dept-new-pandemic-office/index.html,Trump admin moves ahead with plan to open new pandemic office,,20200703-0730
/videos/politics/2020/07/02/florida-voters-zeleny-pkg-lead-vpx.cnn,"Ex-Trump supporter: Based on my friends, he has no chance",,20200703-0730
https://www.cnn.com/world/live-news/coronavirus-pandemic-07-03-20-intl/index.html,"Live Updates The US confirms more than 52,000 new cases today, in the biggest one-day jump so far",,20200703-0730
/2020/07/02/health/hydroxychloroquine-coronavirus-detroit-study/index.html,Study finds hydroxychloroquine helped coronavirus patients survive better,,20200703-0730
/2020/07/02/success/mortgage-rates-july-2-record-low/index.html,Mortgage rates hit (another) all-time low,,20200703-0730
https://www.cnn.com/2020/07/02/success/work-transformed-july-2/index.html,Bracing for a second shutdown,,20200703-0730
https://www.cnn.com/2020/07/02/us/michigan-bar-coronavirus-cases/index.html,At least 152 coronavirus cases linked to bar in Michigan,,20200703-0730
http://www.cnn.com/2020/07/02/asia/india-wedding-coronavirus-infections-scli-intl/index.html,Groom dies and 80 are infected with virus days after wedding,,20200703-0730
/2020/07/02/politics/donald-trump-jr-masks-meme-facebook-fact-check/index.html,Fact-checking a dangerous mask meme Trump Jr. shared,,20200703-0730
https://www.cnn.com/2020/07/02/opinions/seven-reasons-to-wear-a-mask-july-4th-weekend-lee/index.html,Opinion: Seven reasons to wear a mask this July 4 weekend,,20200703-0730
https://www.cnn.com/travel/article/face-shields-qatar-airways/index.html,Face shields and face masks are now mandatory on this airline,,20200703-0730
https://www.cnn.com/2020/07/03/politics/donald-trump-coronavirus-texas-arizona-florida/index.html,Analysis: Rocketing Covid-19 infections expose Trump's callous claim pandemic is 'handled',,20200703-0730
/2020/07/03/us/oregon-state-troopers-defy-mask-mandate/index.html,Oregon State Trooper put on leave after defying mask mandate in coffee shop,,20200703-0730
/videos/politics/2020/07/02/trump-coronavirus-response-jake-tapper-lead-vpx.cnn,'On another planet': Jake Tapper reacts to President Trump's virus comment,,20200703-0730
/2020/07/03/us/ohio-priest-child-pornography-sex-trafficking-indictment/index.html,Ohio priest indicted on charges of child pornography and juvenile sex trafficking,,20200703-0730
/2020/07/02/us/indiana-priest-suspended-trnd/index.html,"Indiana priest suspended after calling Black Lives Matter and antifa protesters 'maggots,' 'parasites' and 'serpents in the garden'",,20200703-0730
/videos/politics/2020/07/02/bolton-trump-russian-bounty-intel-lead-tapper-sot-vpx.cnn,President Trump calls Russia intel a 'hoax.' Hear what John Bolton has to say.,,20200703-0730
/2020/07/02/us/massachusetts-city-recognizes-polyamorous-trnd/index.html,A Massachusetts city will recognize polyamorous relationships,,20200703-0730
/videos/tech/2020/07/02/parler-conservative-republicans-trump-social-media-twitter-free-speech-todd-pkg-lead-vpx.cnn,Big-name Republicans signing up for new social media platform,,20200703-0730
/2020/07/03/opinions/ghislaine-maxwell-jeffrey-epstein-indictment-honig/index.html,Opinion: Indictment puts Epstein associate Ghislaine Maxwell in a tough spot,,20200703-0730
https://www.cnn.com/interactive/2020/health/coronavirus-us-maps-and-cases/,Tracking Covid-19 in the US,,20200703-0730
/2020/04/20/health/10-key-coronavirus-symptoms-wellness/index.html,10 key symptoms,,20200703-0730
https://www.cnn.com/interactive/2020/health/coronavirus-questions-answers/,Your questions answered,,20200703-0730
/2020/06/30/health/us-coronavirus-toll-in-numbers-june-trnd/index.html,US toll vs. the world,,20200703-0730
/2020/07/02/entertainment/nick-cordero-coronavirus/index.html,Nick Cordero's wife says he may need a double lung transplant,,20200703-0730
/videos/media/2020/07/01/children-interrupt-live-tv-interview-bbc-sky-news-orig-llr.cnn,Young daughter crashing mom's live BBC interview will be the best thing you see today,,20200703-0730
http://www.cnn.com/2020/07/03/us/broadway-actor-adam-perry-survives-covid-19-lingering-symptoms/index.html,Broadway actor says he still has symptoms three months after testing positive for Covid-19,,20200703-0730
/2020/07/03/asia/north-korea-covid-intl-hnk/index.html,Kim Jong Un claims North Korea's Covid-19 response has been a 'shining success',,20200703-0730
/videos/us/2020/07/01/boy-hides-from-police-george-floyd-death-pkg-vpx.news-12-connecticut,Dad stunned by what he saw on his family's home security camera,,20200703-0730
http://www.cnn.com/2020/07/03/tech/facial-recognition-police/index.html,Amazon and Microsoft stopped working with police on facial recognition. For others it's still big business,,20200703-0730
/videos/business/2020/07/01/ryan-reynolds-crashes-xmen-video-call-mh-orig.cnn,Actor awkwardly crashes an 'X-men' video call,,20200703-0730
/videos/health/2020/07/02/texas-hospital-crowded-coronavirus-marquez-pkg-newday-vpx.cnn,CNN reporter goes inside Texas hospital. See why it brought him to tears.,,20200703-0730
/2020/07/02/opinions/child-care-for-economic-recovery-act-lowey-neal/index.html,Opinion: Child care is essential to reopening the economy,,20200703-0730
/videos/health/2020/07/01/mom-with-twins-in-nicu-coronavirus-baldwin-nr-vpx.cnn,Brooke Baldwin brought to tears by colleague's harrowing story,,20200703-0730
/2020/07/02/us/coronavirus-contact-tracing-subpoena/index.html,NY county forced party-goers to speak to virus contact tracers. It worked.,,20200703-0730
https://www.cnn.com/2020/06/29/cnn-underscored/fourth-of-july-sales-2020/index.html?iid=underscoredtentpole,4th of July sales have kicked off,,20200703-0730
http://www.cnn.com/2020/06/19/cnn-underscored/best-beard-trimmers/index.html?iid=underscoredtentpole,The best beard trimmers of 2020,,20200703-0730
https://www.cnn.com/2020/06/15/cnn-underscored/adidas-sale-sitewide/index.html?iid=underscoredtentpole&iid_retailer=Adidas,Adidas is offering 25% off everything on site,,20200703-0730
https://www.cnn.com/2020/07/01/cnn-underscored/best-cooling-sheets/index.html?iid=underscoredtentpole,13 sheet sets perfect for summer sleeping,,20200703-0730
https://www.cnn.com/2020/06/29/cnn-underscored/etsy-face-masks/index.html?iid=underscoredtentpole&iid_retailer=etsy,20 of our favorite face masks on Etsy,,20200703-0730
http://www.cnn.com/2020/07/02/us/banking-while-black-racism-trnd/index.html,A Black man tried to cash his first paycheck. The teller called 911.,,20200703-0730
/style/article/nicolas-abdelkader-planters/index.html,Designer reimagines planes and ships as giant planters in plea to 'slow down' energy use,,20200703-0730
/videos/politics/2020/06/30/chris-cuomo-ron-desantis-florida-coronavirus-cpt-vpx.cnn,"Chris Cuomo: Florida governor had a chance to speak, and he spoke too soon",,20200703-0730
/2020/07/02/entertainment/paris-jackson-lesbian-jesus/index.html,Paris Jackson's portrayal as lesbian Jesus sparks backlash,,20200703-0730
/2020/07/02/investing/jeff-bezos-wealth/index.html,Jeff Bezos is so rich he just set a new record,,20200703-0730
/2020/07/02/economy/job-buyout-offer/index.html,It's a scary time to be unemployed. These people still chose to get laid off,,20200703-0730
/2020/07/01/business/odwalla-juice-coca-cola/index.html,Coca-Cola is shutting down a smoothie brand it's owned for nearly 20 years,,20200703-0730
https://bleacherreport.com/articles/2898666-washington-football-team-asked-by-sponsor-fedex-to-change-nickname,FedEx asks Washington Redskins to change team name,,20200703-0730
https://bleacherreport.com/articles/2898699-nike-appears-to-remove-all-washington-nfl-team-apparel-from-online-store,Nike removes 'Redskins' merchandise,,20200703-0730
https://bleacherreport.com/articles/2898655-report-nba-may-use-chicago-bubble-for-teams-not-involved-in-orlando-restart?utm_source=cnn.com&utm_medium=referral&utm_campaign=editorial,Report: NBA may have 2nd bubble in Chicago,,20200703-0730
https://bleacherreport.com/articles/2898654-nfl-reportedly-planning-to-play-black-national-anthem-before-all-week-1-games?utm_source=cnn.com&utm_medium=referral&utm_campaign=editorial,NFL reportedly planning for Black National Anthem,,20200703-0730
https://bleacherreport.com/articles/2898196-saying-goodbye-to-the-hitting-pitcher-in-mlb-after-long-overdue-switch-to-nl-dh?utm_source=cnn.com&utm_medium=referral&utm_campaign=editorial,What universal DH means for MLB,,20200703-0730
https://bleacherreport.com/articles/2898643-over-30-mlb-players-organized-informal-training-camp-in-florida-amid-pandemic?utm_source=cnn.com&utm_medium=referral&utm_campaign=editorial,Report: MLB stars played secret quarantine games,,20200703-0730
/2020/07/02/opinions/william-perry-pendley-bureau-of-land-management-sutter/index.html,The 'other BLM' needs scrutiny,,20200703-0730
/2020/06/25/opinions/coronavirus-pandemic-racism-generation-resilient-fredrick/index.html,A generation hit by three soul-crushing crises,,20200703-0730
/2020/07/02/opinions/real-russia-hoax-bounties-bergen/index.html,opinion The real Russia hoax,,20200703-0730
/2020/07/02/opinions/steady-death-rate-covid-19-infections-spike-sepkowitz/index.html,Why have Covid deaths stayed steady?,,20200703-0730
/2020/07/02/opinions/girl-bosses-feminism-solis/index.html,What the fall of the 'girlboss' reveals,,20200703-0730
/2020/07/02/opinions/black-lives-matter-fourth-of-july-joseph/index.html,How Black Lives Matter transformed July 4,,20200703-0730
/2020/07/02/opinions/gop-qanon-caucus-avlon/index.html,The GOP's QAnon caucus ,,20200703-0730
https://ck.lendingtree.com/?a=343&c=2546&p=r&s1=partnerbin&mtaid=A944E&ctype=hppaidpartner&cmethod=refiform&rcode=1000&ccreative=refiratesat25315yrdoyouqualify_none&placement_name=hppaidpartner&ad_headline=refiratesat25315yrdoyouqualify&ad_image_name=none,LendingTreeRefi rates at 2.53% APR (15 yr). Do you qualify?,,20200703-0730
https://www.comparecards.com/guide/pay-0-interest-until-2021?esourceid=6382186&utm_source=cnn&utm_medium=native&pla=cnn.com&bdst=rv&acqs=prospecting&utm_campaign=hppaidpartner&grp=pay-0-2021&tar=hppaidpartner&utm_content=Pay+0+interest+until+2021+with+a+better+card&adt=none,CompareCardsPay 0% interest until 2021 with a better card,,20200703-0730
https://www.fool.com/mms/mark/a-sa-dd-3?utm_source=cnn&utm_medium=contentmarketing&utm_campaign=sar-doubledown3-may2020&paid=9431&waid=9431&aid=9431&psource=esaccnwdg0210093&source=esaccnwdg0210093&wsource=esaccnwdg0210093,Motley FoolThis may be the big winner of the market crash,,20200703-0730
/2020/07/02/americas/brazil-coronavirus-restaurants-rio-intl/index.html,'Sending the population to the slaughterhouse': Restaurants and bars open in Rio amid pandemic,,20200703-0730
/videos/world/2020/06/30/west-bank-israeli-palestinian-explainer-lon-orig.cnn,What is the West Bank and why is it important?,,20200703-0730
/2020/07/02/us/china-hair-uyghur-cpb-trnd/index.html,13-ton shipment of human hair seized,,20200703-0730
/2020/07/02/us/elijah-mcclain-aurora-police/index.html,A police officer in photos near where Elijah McClain was put in a chokehold has resigned,,20200703-0730
/2020/07/02/us/miami-dade-police-officer-struck-woman-airport/index.html,"A Miami-Dade officer who struck a woman at an airport will be terminated, officials say",,20200703-0730
/2020/07/02/sport/nfl-black-national-anthem-week-1-spt-intl/index.html,The NFL plans to play the Black national anthem before Week 1 games,,20200703-0730
/2020/07/02/business/home-depot-nooses-rope/index.html,Home Depot changes the way it sells rope after nooses are found in store,,20200703-0730
/style/article/lgbtq-artists-taiwan/index.html,The place that's a haven for LGBTQ creativity in Asia,,20200703-0730
/style/article/kanye-west-latest-music-video-directed-by-arthur-jafa/index.html,Kanye West's new video is called 'Wash Us in the Blood' and it has a star-studded team behind it,,20200703-0730
/style/article/francis-bacon-sothebys-hybrid-auction/index.html,$84M painting smashes sales expectations in virtual auction,,20200703-0730
/style/article/remember-when-twin-peaks-david-lynch/index.html,The drama that changed TV history 30 years ago,,20200703-0730
/style/article/natural-history-museum-whitewashing-monuments-statues-trnd/index.html,People are calling for museums to be abolished. Can whitewashed American history be rewritten?,,20200703-0730
/2020/07/02/entertainment/entertainment-newsletter/index.html,Meet your new American patriots,,20200703-0730
/videos/tv-shows/2020/07/02/flyers-hockey-mascot-gritty-queer-eye-fab-5-makeover-season-5-orig-kj.cnn,Gritty gets a makeover,,20200703-0730
/2020/06/30/entertainment/netflix-hulu-amazon-july/index.html,See what's streaming in July,,20200703-0730
/2020/06/30/entertainment/the-dick-van-dyke-show-carl-reiner/index.html,Carl Reiner's signature performance,,20200703-0730
/2020/07/01/entertainment/the-truth-review/index.html,Catherine Deneuve shines in 'The Truth',,20200703-0730
/2020/07/01/tech/facebook-advertiser-boycott-demands/index.html,Advertisers have Facebook's attention. Now here's what they want,,20200703-0730
/2020/06/30/tech/amazon-warehouse-infection-rate-shakopee/index.html,An internal Amazon memo shows how closely it's tracking coronavirus data at warehouses,,20200703-0730
/2020/06/30/tech/fedmyster-removed-offlinetv/index.html,Gaming world faces a big #MeToo moment,,20200703-0730
/2020/06/29/tech/twitch-suspends-trump-account/index.html,Twitch suspends Trump campaign account,,20200703-0730
/2020/06/30/tech/facebook-boogaloo-ban/index.html,Facebook bans Boogaloo-related accounts,,20200703-0730
/2020/07/01/politics/jill-biden-running-mate/index.html,Jill Biden plays key role in her husband's search for a running mate,,20200703-0730
/2020/07/01/us/mississippi-state-flag-confederacy-flag-trnd/index.html,Mississippi changing its flag isn't the end of Confederate symbols in state flags,,20200703-0730
/2020/06/30/politics/mask-wearing-alabama-senate-race-doug-jones/index.html,The politics of wearing a mask hits Alabama's Senate race,,20200703-0730
https://www.cnn.com/factsfirst/politics?xid=ff_btn,CNN holds officials accountable. View our Facts First database,,20200703-0730
/2020/07/01/health/fireworks-toxic-air-safety-wellness/index.html,Some consumer fireworks emit high levels of lead ,,20200703-0730
/2020/07/02/health/coronavirus-social-distancing-resilience-wellness/index.html,Finding resilience during the coronavirus pandemic,,20200703-0730
/2020/07/01/health/covid-19-staying-home-saved-lives-wellness/index.html,People who stay home voluntarily save lives,,20200703-0730
/2020/06/16/health/flush-toilet-spray-coronavirus-wellness-trnd/index.html,Flush carefully. Coronavirus could spread in toilet spray,,20200703-0730
https://healthguides.cnn.com/getting-the-right-treatment-for-hepatitis-c/how-to-get-the-most-out-of-a-virtual-doctor-visit-for-hepatitis-c?did=t1_rss5,How telehealth can help your hep C,,20200703-0730
/travel/article/detox-rehab-facilities-thailand/index.html,Western addicts head to Thailand to detox,,20200703-0730
/travel/article/outdoor-dining-united-states-covid-19/index.html,Scenes from reopened US restaurants in the coronavirus era,,20200703-0730
/travel/article/japan-new-shinkansen-model-n700s/index.html,"Japan debuts new safer, faster bullet train",,20200703-0730
/travel/article/face-shields-qatar-airways/index.html,Airline requiring face shields AND face masks ,,20200703-0730
/travel/article/czech-public-dinner-lockdown-scli-intl/index.html,"Mass dinner party at 1,600-foot table marks end of lockdown",,20200703-0730
https://www.cnn.com/audio/podcasts/corona-virus,Coronavirus Fact vs Fiction: This is going to be a house on fire for a long time,,20200703-0730
https://www.cnn.com/audio/podcasts/axe-files,Axe Files: Shannon Watts of Moms Demand Action,,20200703-0730
https://cnn.com/audio/podcasts/daily-dc,The Daily DC: Trump's Congressional losses,,20200703-0730
https://www.cnn.com/audio/podcasts/the-point,The Point: Trump digging in on Confederate statues,,20200703-0730
/world/live-news/coronavirus-pandemic-07-03-20-intl/index.html,Coronavirus: Live updates,,20200703-0800
/2020/07/03/health/coronavirus-lockdown-lifting-deadly-charts-intl/index.html,"The US, Brazil and others lifted lockdowns early. These charts show just how deadly that decision was",,20200703-0800
/2020/07/02/us/ghislaine-maxwell-jeffrey-epstein/index.html,TRENDING: Ghislaine Maxwell,,20200703-0800
/2020/07/02/us/vanessa-guillen-fort-hood-disappearance/index.html,"Pfc. Vanessa Guillen bludgeoned to death on Army base, family attorney says",,20200703-0800
/2020/07/02/asia/hong-kong-security-law-intl-hnk/index.html,Hong Kong protest leader flees as government warns calls for 'revolution' are now illegal,,20200703-0800
/2020/07/02/politics/bolton-scars-russia-trump-cnntv/index.html,John Bolton,,20200703-0800
/2020/07/02/media/hugh-downs-obituary/index.html,Hugh Downs death,,20200703-0800
/2020/07/02/health/coronavirus-mutation-spread-study/index.html,"The new mutation does not seem to make people any sicker than earlier variations of the virus, researchers say",h2,20200703-0800
https://www.cnn.com/2020/07/02/health/us-coronavirus-thursday/index.html,Texas implements mask mandate,h2,20200703-0800
http://www.cnn.com/2020/07/02/us/florida-coronavirus-thursday/index.html,Florida cases hit record ,h2,20200703-0800
/2020/07/02/politics/trump-state-dept-new-pandemic-office/index.html,Trump admin moves ahead with plan to open new pandemic office,,20200703-0800
/videos/politics/2020/07/02/florida-voters-zeleny-pkg-lead-vpx.cnn,"Ex-Trump supporter: Based on my friends, he has no chance",,20200703-0800
https://www.cnn.com/world/live-news/coronavirus-pandemic-07-03-20-intl/index.html,Live Updates An 11-year-old boy has become Florida's youngest Covid-19 fatality,,20200703-0800
/2020/07/02/health/hydroxychloroquine-coronavirus-detroit-study/index.html,Study finds hydroxychloroquine helped coronavirus patients survive better,,20200703-0800
/2020/07/02/success/mortgage-rates-july-2-record-low/index.html,Mortgage rates hit (another) all-time low,,20200703-0800
https://www.cnn.com/2020/07/02/success/work-transformed-july-2/index.html,Bracing for a second shutdown,,20200703-0800
https://www.cnn.com/2020/07/02/us/michigan-bar-coronavirus-cases/index.html,At least 152 coronavirus cases linked to bar in Michigan,,20200703-0800
http://www.cnn.com/2020/07/02/asia/india-wedding-coronavirus-infections-scli-intl/index.html,Groom dies and 80 are infected with virus days after wedding,,20200703-0800
/2020/07/02/politics/donald-trump-jr-masks-meme-facebook-fact-check/index.html,Fact-checking a dangerous mask meme Trump Jr. shared,,20200703-0800
https://www.cnn.com/2020/07/02/opinions/seven-reasons-to-wear-a-mask-july-4th-weekend-lee/index.html,Opinion: Seven reasons to wear a mask this July 4 weekend,,20200703-0800
https://www.cnn.com/travel/article/face-shields-qatar-airways/index.html,Face shields and face masks are now mandatory on this airline,,20200703-0800
https://www.cnn.com/2020/07/03/politics/donald-trump-coronavirus-texas-arizona-florida/index.html,Analysis: Rocketing Covid-19 infections expose Trump's callous claim pandemic is 'handled',,20200703-0800
/2020/07/03/us/oregon-state-troopers-defy-mask-mandate/index.html,Oregon State Trooper put on leave after defying mask mandate in coffee shop,,20200703-0800
/videos/politics/2020/07/02/trump-coronavirus-response-jake-tapper-lead-vpx.cnn,'On another planet': Jake Tapper reacts to President Trump's virus comment,,20200703-0800
/2020/07/03/us/ohio-priest-child-pornography-sex-trafficking-indictment/index.html,Ohio priest indicted on charges of child pornography and juvenile sex trafficking,,20200703-0800
/2020/07/02/us/indiana-priest-suspended-trnd/index.html,"Indiana priest suspended after calling Black Lives Matter and antifa protesters 'maggots,' 'parasites' and 'serpents in the garden'",,20200703-0800
/videos/politics/2020/07/02/bolton-trump-russian-bounty-intel-lead-tapper-sot-vpx.cnn,President Trump calls Russia intel a 'hoax.' Hear what John Bolton has to say.,,20200703-0800
/2020/07/02/us/massachusetts-city-recognizes-polyamorous-trnd/index.html,A Massachusetts city will recognize polyamorous relationships,,20200703-0800
/videos/tech/2020/07/02/parler-conservative-republicans-trump-social-media-twitter-free-speech-todd-pkg-lead-vpx.cnn,Big-name Republicans signing up for new social media platform,,20200703-0800
/2020/07/03/opinions/ghislaine-maxwell-jeffrey-epstein-indictment-honig/index.html,Opinion: Indictment puts Epstein associate Ghislaine Maxwell in a tough spot,,20200703-0800
https://www.cnn.com/interactive/2020/health/coronavirus-us-maps-and-cases/,Tracking Covid-19 in the US,,20200703-0800
/2020/04/20/health/10-key-coronavirus-symptoms-wellness/index.html,10 key symptoms,,20200703-0800
https://www.cnn.com/interactive/2020/health/coronavirus-questions-answers/,Your questions answered,,20200703-0800
/2020/06/30/health/us-coronavirus-toll-in-numbers-june-trnd/index.html,US toll vs. the world,,20200703-0800
/2020/07/02/entertainment/nick-cordero-coronavirus/index.html,Nick Cordero's wife says he may need a double lung transplant,,20200703-0800
/videos/media/2020/07/01/children-interrupt-live-tv-interview-bbc-sky-news-orig-llr.cnn,Young daughter crashing mom's live BBC interview will be the best thing you see today,,20200703-0800
http://www.cnn.com/2020/07/03/us/broadway-actor-adam-perry-survives-covid-19-lingering-symptoms/index.html,Broadway actor says he still has symptoms three months after testing positive for Covid-19,,20200703-0800
/2020/07/03/asia/north-korea-covid-intl-hnk/index.html,Kim Jong Un claims North Korea's Covid-19 response has been a 'shining success',,20200703-0800
/videos/us/2020/07/01/boy-hides-from-police-george-floyd-death-pkg-vpx.news-12-connecticut,Dad stunned by what he saw on his family's home security camera,,20200703-0800
http://www.cnn.com/2020/07/03/tech/facial-recognition-police/index.html,Amazon and Microsoft stopped working with police on facial recognition. For others it's still big business,,20200703-0800
