,name,text,id,url,created_at
0,CNN,"Walmart is returning firearms and ammunition to shelves after the retail giant removed the products in some of its US stores as a ""precaution"" in response to protests in Philadelphia https://t.co/glGiNEipjW",1323052277956042760,https://www.cnn.com/2020/11/01/business/walmart-firearms-ammunition/index.html?utm_term=link&utm_source=twCNN&utm_medium=social&utm_content=2020-11-02T00%3A00%3A18,Mon Nov 02 00:00:18 +0000 2020
0,CNN,"From sun vibrations to Saturn's sound waves to a lightning storm on Jupiter, NASA has put together a playlist of spooky space-related sounds https://t.co/ZPuZDmJwsD https://t.co/iE9hAsStAM",1323075115144433669,https://www.cnn.com/videos/world/2020/10/30/nasa-space-sounds-halloween-orig-mss.cnn?utm_term=video&utm_source=twCNN&utm_medium=social&utm_content=2020-11-02T01%3A31%3A02,Mon Nov 02 01:31:03 +0000 2020
0,CNN,These are some of Africa's most anticipated architecture projects: https://t.co/2KP4jC8NBN https://t.co/9qX95Zw4Zj,1323082685800218626,https://edition.cnn.com/style/article/africa-most-anticipated-architecture-spc-intl/index.html?utm_content=2020-11-02T02%3A01%3A05&utm_source=twCNN&utm_medium=social&utm_term=multi-image,Mon Nov 02 02:01:08 +0000 2020
0,CNN,A Muslim advocacy group has issued an advisory warning American Muslims against traveling to France as tensions rise following recent terrorist attacks https://t.co/Q9jMEjgMkt,1323089974254882816,https://www.cnn.com/2020/11/01/us/french-muslim-travel-warning-trnd/index.html?utm_source=twCNN&utm_medium=social&utm_term=link&utm_content=2020-11-02T02%3A30%3A05,Mon Nov 02 02:30:06 +0000 2020
0,CNN,"Scientists developing new materials are studying an unlikely source of strength: The diabolical ironclad beetle, which can withstand being run over by a car https://t.co/11GZpYc6GN https://t.co/twH2P7pJtk",1323105321435451397,https://www.cnn.com/2020/10/21/world/beetle-engineering-intl-scli-scn/index.html?utm_content=2020-11-02T03%3A31%3A03&utm_medium=social&utm_term=video&utm_source=twCNN,Mon Nov 02 03:31:05 +0000 2020
0,CNN,"Saturn's largest moon, Titan, is the only moon in our solar system that has a thick atmosphere. It's four times denser than Earth's. And now, scientists have discovered a molecule in it that has never been found in any other atmosphere. https://t.co/bFJGSxg6Bi",1323112864153030656,https://www.cnn.com/2020/10/28/world/titan-atmosphere-molecule-chemistry-scn-trnd/index.html?utm_source=twCNN&utm_medium=social&utm_term=link&utm_content=2020-11-02T04%3A01%3A03,Mon Nov 02 04:01:03 +0000 2020
0,CNN,"A couple got married at the same Dunkin' drive-thru window where they first met, surrounded by friends, family and many, many donuts https://t.co/nywxLrGUic",1323120169691074560,https://www.cnn.com/2020/11/01/us/dunkin-couple-married-drive-thru-trnd/index.html?utm_source=twCNN&utm_medium=social&utm_term=link&utm_content=2020-11-02T04%3A30%3A05,Mon Nov 02 04:30:05 +0000 2020
0,CNN,"The smallest state in the nation bears the longest name: ""State of Rhode Island and Providence Plantations."" Rhode Island voters have the chance to strike ""Plantations"" from the state's full name. https://t.co/t1v3QFNHIA",1323135280359133184,https://www.cnn.com/2020/11/01/politics/rhode-island-providence-plantations-ballot-question/index.html?utm_source=twCNN&utm_medium=social&utm_term=link&utm_content=2020-11-02T05%3A30%3A07,Mon Nov 02 05:30:08 +0000 2020
0,CNN,"""If you don't want to shut down, at least do the fundamental basic things, which are really the flagship of which is wearing a mask,"" said Dr. Anthony Fauci, director of the National Institute of Allergy and Infectious Diseases https://t.co/VGDC2Zv8Yq",1323142836104081415,https://www.cnn.com/world/live-news/coronavirus-pandemic-10-28-20-intl/h_f0d7b576a1c5efbd17ce8d8849ec10b1?utm_medium=social&utm_source=twCNN&utm_term=link&utm_content=2020-11-02T06%3A00%3A09,Mon Nov 02 06:00:09 +0000 2020
