,name,text,id,url,created_at
0,CNN,"Joe Biden's victory in Pennsylvania has now eclipsed President Trump's winning margin from 2016. If mail ballots had been counted first -- not last -- the trajectory of the entire election would've looked different, writes Marshall Cohen
https://t.co/JEdbeTmccJ",1327763261106888704,https://www.cnn.com/2020/11/14/politics/pennsylvania-election-crisis/index.html?utm_medium=social&utm_content=2020-11-15T00%3A00%3A04&utm_term=link&utm_source=twCNN,Sun Nov 15 00:00:04 +0000 2020
0,CNN,"Phoenix police officials are reviewing the investigation into the death of Joseph Ryan, Lori Vallow's third husband, a spokeswoman for the department said https://t.co/9Fk1rtn60R",1327771311041622016,https://www.cnn.com/2020/11/13/us/lori-vallow-husband-death-investigation-arizona/index.html?utm_term=link&utm_source=twCNN&utm_medium=social&utm_content=2020-11-15T00%3A32%3A03,Sun Nov 15 00:32:04 +0000 2020
0,CNN,"The term pickle comes from the Dutch word pekel, which means salt or brine. In honor of the holiday, here are five surprising facts about pickles. https://t.co/MEiluP8oC5",1327778393593700353,https://www.cnn.com/2020/11/14/us/national-pickle-day-facts-trnd/index.html?utm_content=2020-11-15T01%3A00%3A12&utm_medium=social&utm_source=twCNN&utm_term=link,Sun Nov 15 01:00:12 +0000 2020
0,CNN,"Thousands of President Trump's supporters of all stripes, including right-wing and far-right groups, rallied in Washington, DC, on Saturday to protest the election results. https://t.co/PgChmG8Xii",1327785929843630080,https://www.cnn.com/2020/11/14/us/trump-washington-voters-rally-far-right/index.html?utm_source=twCNN&utm_term=link&utm_content=2020-11-15T01%3A30%3A08&utm_medium=social,Sun Nov 15 01:30:09 +0000 2020
0,CNN,"While Election Day has come and gone, the races for Georgia's US Senate seats are headed to runoffs since none of the candidates received a majority of the vote in November. Voters will go to the polls once again on January 5 https://t.co/q8ZiZP7NBA",1327793495155896322,https://www.cnn.com/2020/11/14/politics/georgia-runoffs-young-voters/index.html?utm_source=twCNN&utm_term=link&utm_content=2020-11-15T02%3A00%3A12&utm_medium=social,Sun Nov 15 02:00:13 +0000 2020
0,CNN,"Amid a Covid-19 resurgence across American communities in October and an explosion of new cases in Kentucky, the virus seeped into  the Thomson-Hood Veterans Center, and spread like wildfire. https://t.co/HBfU7doJ15",1327808564002500608,https://www.cnn.com/2020/11/14/us/kentucky-veterans-center-covid/index.html?utm_term=link&utm_source=twCNN&utm_content=2020-11-15T03%3A00%3A05&utm_medium=social,Sun Nov 15 03:00:05 +0000 2020
0,CNN,"As he works to rebuild and rejoin alliances, President-elect Joe Biden's greatest hurdle could be convincing the rest of the world and even the US' closest allies that once again, America really can be trusted https://t.co/LHSp9wR7LQ",1327823902580551683,https://www.cnn.com/2020/11/14/politics/biden-foreign-policy-challenges-ahead/index.html?utm_medium=social&utm_content=2020-11-15T04%3A01%3A02&utm_term=link&utm_source=twCNN,Sun Nov 15 04:01:02 +0000 2020
0,CNN,"Sixty years ago, Ruby Bridges walked to school escorted by four federal marshals as a White mob hurled insults at her. https://t.co/DtJPO3jwgi",1327830951758602240,https://www.cnn.com/2020/11/14/us/ruby-bridges-desegregation-60-years-trnd/index.html?utm_term=link&utm_source=twCNN&utm_content=2020-11-15T04%3A29%3A03&utm_medium=social,Sun Nov 15 04:29:03 +0000 2020
0,CNN,"Will travel post-vaccine go back to how things were, or has your vacation been irrevocably changed? https://t.co/JixrbDbCx9",1327839514111434752,https://edition.cnn.com/travel/article/covid-vaccine-travel/index.html?utm_content=2020-11-15T05%3A03%3A04&utm_medium=social&utm_term=link&utm_source=twCNN,Sun Nov 15 05:03:04 +0000 2020
0,CNN,"In one day, nine cases meant to attack President-elect Joe Biden's win in key states were denied or dropped, adding up to a brutal series of losses for President Trump, who's already lost and refuses to let go https://t.co/jFT9hnXMaq",1327854102202765322,https://www.cnn.com/2020/11/14/politics/trump-election-cases-status/index.html?utm_content=2020-11-15T06%3A01%3A02&utm_medium=social&utm_term=link&utm_source=twCNN,Sun Nov 15 06:01:02 +0000 2020
0,CNN,The scientists who developed the Pfizer/BioNTech Covid-19 vaccine are a Turkish-German power couple https://t.co/jiCFUayiX3 https://t.co/PpJTflRcZ8,1327869215605460992,https://www.cnn.com/2020/11/10/europe/biontech-pfizer-vaccine-team-couple-intl/index.html?utm_source=twCNN&utm_term=image&utm_medium=social&utm_content=2020-11-15T07%3A01%3A05,Sun Nov 15 07:01:06 +0000 2020
0,CNN,"Now that Ivanka Trump's and Jared Kushner's Washington political lives are over -- the question for this once-golden power couple is what their time in the political spotlight has meant for their brand, particularly in their old Manhattan stomping grounds https://t.co/EhgYYyDQ9a",1327876518350114816,https://www.cnn.com/2020/11/14/politics/jared-kushner-ivanka-trump-post-white-house/index.html?utm_content=2020-11-15T07%3A30%3A06&utm_medium=social&utm_term=link&utm_source=twCNN,Sun Nov 15 07:30:07 +0000 2020
0,CNN,"""President Trump will return to just plain old Donald Trump in January. And in case you forgot, there are at least a half dozen ongoing cases involving him — and placing him in various levels of legal jeopardy — still pending."" | Analysis by @CillizzaCNN https://t.co/4G19C2h0Tj",1327884309596958720,https://www.cnn.com/2020/11/10/politics/donald-trump-lawsuits/index.html?utm_source=twCNN&utm_term=link&utm_medium=social&utm_content=2020-11-15T08%3A01%3A04,Sun Nov 15 08:01:04 +0000 2020
0,CNN,"Due to the planet's warming climate, hurricanes are maintaining their strength after landfall for much longer, and in turn, exposing populations far inland to damaging winds that they have rarely experienced before, a new study finds. https://t.co/7qKSsiRsot",1327899405958213633,https://www.cnn.com/2020/11/11/weather/hurricane-decay-slowing-after-landfall-climate-change/index.html?utm_medium=social&utm_content=2020-11-15T09%3A01%3A03&utm_term=link&utm_source=twCNN,Sun Nov 15 09:01:04 +0000 2020
0,CNN,"In December 2008, Republican President George W. Bush approved a $17.4 billion rescue of GM and Chrysler because he didn't want the auto industry to collapse before Barack Obama was sworn in.

""I feel an obligation to my successor,"" Bush said at the time. https://t.co/e9qfRq5gow",1327914521273528320,https://www.cnn.com/2020/11/11/business/trump-biden-transition-stimulus/index.html?utm_term=link&utm_source=twCNN&utm_content=2020-11-15T10%3A01%3A07&utm_medium=social,Sun Nov 15 10:01:07 +0000 2020
0,CNN,Several governors have issued stringent new measures to get the virus under control ahead of what could be a brutal winter. https://t.co/BfRdkkZvi0,1327931328550023169,https://www.cnn.com/2020/11/14/health/us-coronavirus-saturday/index.html?utm_content=2020-11-15T11%3A07%3A54&utm_medium=social&utm_source=twCNN&utm_term=link,Sun Nov 15 11:07:55 +0000 2020
0,CNN,"The fourth season of ""The Crown"" is dominated by two women, and neither is the Queen. Take a look at the series' Princess Diana and Margaret Thatcher: https://t.co/QURwagRt4R https://t.co/OvV7zeuTJy",1327944718911762432,https://www.cnn.com/2020/11/10/entertainment/the-crown-season-4-review/index.html?utm_content=2020-11-15T12%3A01%3A05&utm_medium=social&utm_term=video&utm_source=twCNN,Sun Nov 15 12:01:07 +0000 2020
0,CNN,CNN's international correspondents explain what a Joe Biden presidency means for US relations around the world https://t.co/x9rn8YMpnX https://t.co/STRzV0kNP6,1327952262556250116,https://www.cnn.com/2020/11/07/americas/biden-global-reaction-election-intl/index.html?utm_content=2020-11-15T12%3A31%3A03&utm_source=twCNN&utm_term=video&utm_medium=social,Sun Nov 15 12:31:06 +0000 2020
0,CNN,"New York City is creating new teams to respond to emergency mental health calls instead of police, as part of a pilot program that will launch next year https://t.co/emuu9PCipK",1327959799565348864,https://www.cnn.com/2020/11/11/us/new-york-city-mental-health-911-trnd/index.html?utm_medium=social&utm_content=2020-11-15T13%3A01%3A02&utm_term=link&utm_source=twCNN,Sun Nov 15 13:01:03 +0000 2020
0,CNN,We asked US voters to share their thoughts about the historic 2020 election. They left us tons of voicemails. Here's what they said. https://t.co/8qAg3G2pme https://t.co/7ZyYD0QejP,1327967349362847747,https://www.cnn.com/2020/11/09/politics/election-voicemail-reaction/index.html?utm_content=2020-11-15T13%3A31%3A01&utm_medium=social&utm_term=video&utm_source=twCNN,Sun Nov 15 13:31:03 +0000 2020
0,CNN,"“In my 20 years as a journalist, I’ve experienced crises and devastation around the world first-hand,"" @DrSanjayGupta writes. ""I never thought I would feel that sense of loss and suffering about my own country.” https://t.co/hwbnQlZwdJ",1327974916411383808,https://www.cnn.com/2020/11/13/health/coronavirus-humanitarian-disaster-gupta/index.html?utm_medium=social&utm_content=2020-11-15T14%3A01%3A06&utm_term=link&utm_source=twCNN,Sun Nov 15 14:01:07 +0000 2020
0,CNN,"Virgin Hyperloop has completed the first test of its high-speed transportation technology with humans on board. The company's hyperloop pod traveled 500 meters (about 1,640 feet) and reached speeds of 100mph. https://t.co/v2Kcn1JZdH https://t.co/h2Ua5TfjSn",1327982461607931905,https://www.cnn.com/2020/11/08/tech/virgin-hyperloop-passengers/index.html?utm_source=twCNN&utm_medium=social&utm_term=video&utm_content=2020-11-15T14%3A31%3A04,Sun Nov 15 14:31:06 +0000 2020
0,CNN,How to decline a Thanksgiving invitation due to the pandemic https://t.co/gRvAMWZpN0,1327990011690684417,https://www.cnn.com/2020/11/12/health/skip-thanksgiving-covid-wellness/index.html?utm_content=2020-11-15T15%3A01%3A05&utm_medium=social&utm_source=twCNN&utm_term=link,Sun Nov 15 15:01:06 +0000 2020
0,CNN,"""Once all the ranting and suing is over, Biden will almost certainly be inaugurated as the President of the United… https://t.co/Kw6llup6Ed",1328002044037390336,https://twitter.com/i/web/status/1328002044037390336,Sun Nov 15 15:48:55 +0000 2020
0,CNN,"An 85-year-old primary school in Shanghai has been lifted off the ground — in its entirety — and relocated using new technology dubbed the ""walking machine."" https://t.co/tZX8AxhnN6 https://t.co/Xgzrlb1FAO",1328005110169997313,https://edition.cnn.com/style/article/shanghai-relocate-building-preservation-intl-hnk-scli/index.html?utm_term=video&utm_source=twCNN&utm_medium=social&utm_content=2020-11-15T16%3A01%3A04,Sun Nov 15 16:01:06 +0000 2020
0,CNN,"""I think that his message of, 'Hey... I'm going to be a President for all Americans,' it's exactly what you want to… https://t.co/KnVwLtofto",1328006558010236928,https://twitter.com/i/web/status/1328006558010236928,Sun Nov 15 16:06:51 +0000 2020
0,CNN,"Fmr. US national security adviser John Bolton says history will remember Donald Trump ""as a failed President.""

""He… https://t.co/fokt404xmT",1328010817162371074,https://twitter.com/i/web/status/1328010817162371074,Sun Nov 15 16:23:46 +0000 2020
0,CNN,What happens to Black Friday in the midst of social distancing? CNN Business explains why the shopping event will never be the same. https://t.co/GRWsKFBP5Z https://t.co/uVUTiNA2Qn,1328020213846175747,https://www.cnn.com/videos/business/2020/11/11/black-friday-online-sales-pandemic-orig.cnn-business?utm_term=video&utm_medium=social&utm_source=twCNN&utm_content=2020-11-15T17%3A01%3A05,Sun Nov 15 17:01:07 +0000 2020
0,CNN,"Apple has unveiled its M1 processor chip, the company's first proprietary chip, that will power a new lineup of Macbooks https://t.co/FcBYqAbfyh https://t.co/BvHNxrGVKP",1328050432342626304,https://www.cnn.com/2020/11/10/tech/apple-silicon-chips-mac/index.html?utm_content=2020-11-15T19%3A01%3A09&utm_source=twCNN&utm_medium=social&utm_term=video,Sun Nov 15 19:01:11 +0000 2020
