,name,text,id,url,created_at
0,thedailybeast,"Isaias has been upgraded to a Category 1 hurricane by the National Hurricane Center as it approaches the Carolinas, where it is expected to make landfall https://t.co/PSPLy6O9Hn",1290443410151821313,https://www.thedailybeast.com/isaias-upgraded-to-category-1-hurricane-as-it-heads-for-carolinas?via=twitter_page,Tue Aug 04 00:24:18 +0000 2020
0,thedailybeast,"Dr. Birx had, in recent days, not only trampled on the everything-is-fine messaging from the White House, she’d contradicted key COVID policies too https://t.co/prE8s5dMd3",1290452479105269761,https://www.thedailybeast.com/trump-attacks-dr-birx-in-an-attempt-to-keep-a-loyal-soldier-in-line?via=twitter_page,Tue Aug 04 01:00:21 +0000 2020
0,thedailybeast,"“I went from thinking a Twitter friend and colleague died of COVID after being forced by her institution to teach, to doubting she had existed in the first place,” Jacquelyn Gill, a University of Maine climate scientist, told The Daily Beast https://t.co/nuSCMBeW6S",1290459985185570816,https://www.thedailybeast.com/inside-the-sick-hoax-coronavirus-death-roiling-arizona-state-university/?via=twitter_page,Tue Aug 04 01:30:10 +0000 2020
0,thedailybeast,"Seth Meyers exposes ""sociopath"" Jared Kushner's ""evil"" coronavirus plan https://t.co/96vvSathNe",1290463746029166594,https://www.thedailybeast.com/seth-meyers-exposes-sociopath-jared-kushners-evil-coronavirus-plan?via=twitter_page,Tue Aug 04 01:45:07 +0000 2020
0,thedailybeast,"RT @MarlowNYC: .@SethMeyers on “sociopath” Jared Kushner letting blue-state people die of COVID: “Not only is that evil, it’s stupid. This is an infectious disease. This virus has traveled all over the world. Did they not realize it could travel to red states too?” https://t.co/OfBeiPd4S9",1290464085931425798,https://www.thedailybeast.com/seth-meyers-exposes-sociopath-jared-kushners-evil-coronavirus-plan,Tue Aug 04 01:46:28 +0000 2020
0,thedailybeast,"“I don’t want a vaccine,” Pirro said, expressing deep skepticism about the safety of a potential COVID-19 vaccine. “I want a therapeutic.” https://t.co/UcYBHmpfc7",1290467756282990592,https://www.thedailybeast.com/fox-news-host-jeanine-pirro-says-she-wont-take-the-coronavirus-vaccine?via=twitter_page,Tue Aug 04 02:01:03 +0000 2020
0,thedailybeast,"Actor Reni Santoni, best known for his roles as Inspector Chico Gonzalez in “Dirty Harry” and Poppie the restaurant owner on “Seinfeld,” has died at age 81 https://t.co/ArMeoAGF5K",1290480381213384704,https://www.thedailybeast.com/actor-reni-santoni-of-dirty-harry-and-seinfeld-dies-at-age-81?via=twitter_page,Tue Aug 04 02:51:13 +0000 2020
