,name,text,id,url,created_at
0,CNBC,"The stock market rally may give a boost to your 401(k) balance, but 
@sharon_epperson
 gives you the steps you should take now with your retirement savings to reach your money goals in this video. #investinyou (in partnership with @acorns) https://t.co/gMYXwooMIj https://t.co/HpzWZJKZuB",1328126636852559873,https://www.cnbc.com/video/2020/11/10/market-rally-401k-investment-strategy-squawk-box.html?__source=twitter%7Cmain,Mon Nov 16 00:04:00 +0000 2020
0,CNBC,"Dig behind the numbers, and strengthen your investment strategy with the @CNBCTheExchange newsletter. https://t.co/Nw0TyNA0Bz https://t.co/eaHwJ9cgLi",1328133179971153921,https://www.cnbc.com/sign-up-for-cnbc-newsletters/?__source=twitter%7Cmain,Mon Nov 16 00:30:00 +0000 2020
0,CNBC,Here’s how much you need to put in a 529 savings plan every month to send your child to Harvard debt-free. #investinyou (in partnership with @acorns) https://t.co/3V2pFunuOU,1328139308570714115,https://www.cnbc.com/2020/11/13/coronavirus-college-total-tuition-at-harvard-with-a-529-savings-plan.html?__source=twitter%7Cmain,Mon Nov 16 00:54:21 +0000 2020
0,CNBC,"Elon Musk's SpaceX launches Crew-1 mission, beginning a new era of NASA human spaceflight https://t.co/lhS1KatEBs",1328140264037371904,https://www.cnbc.com/2020/11/16/spacex-enters-new-era-of-nasa-human-spaceflight.html?__source=twitter%7Cmain,Mon Nov 16 00:58:09 +0000 2020
0,CNBC,"Mall owners Simon and Taubman revise merger terms, with $800 million price cut https://t.co/SRM92CEOaw",1328142520224722944,https://www.cnbc.com/2020/11/15/mall-owners-simon-taubman-revise-merger-terms-800-million-price-cut.html?__source=twitter%7Cmain,Mon Nov 16 01:07:07 +0000 2020
0,CNBC,"The government has the power to print money, but the process may be different than you think. Watch this video to learn where the money comes from for your stimulus check. #investinyou (in partnership with @acorns) https://t.co/4E9xlSsMZu https://t.co/LcE5FW7Qbv",1328142742707265537,https://www.cnbc.com/2020/08/21/second-stimulus-check-how-congress-will-fund-the-payment-you-get.html?__source=twitter%7Cmain,Mon Nov 16 01:08:00 +0000 2020
0,CNBC,Op-ed: Josh Brown's 5 questions to ask your next financial advisor. #investinyou (In partnership with @acorns.) https://t.co/l3gaGDHMfB,1328145635711791104,https://www.cnbc.com/2020/11/13/op-ed-josh-brown-five-questions-to-ask-your-next-financial-advisor-.html?__source=twitter%7Cmain,Mon Nov 16 01:19:29 +0000 2020
0,CNBC,Nasdaq CEO Adena Friedman says investors hold an “enormous amount of influence” when it comes to fixing inequalities in the workforce. https://t.co/i7BlXalr6Y https://t.co/Tq6TdqsvfB,1328148280144904192,https://www.cnbc.com/2020/08/17/nasdaq-ceo-adena-friedman-investors-play-a-role-in-fixing-inequality.html?__source=twitter%7Cmain,Mon Nov 16 01:30:00 +0000 2020
0,CNBC,"The average Gen Xer has $32,878 in non-mortgage debt—here's how they compare to other generations. https://t.co/H70RVxgY9X",1328154506631262208,https://www.cnbc.com/select/average-american-debt-in-40s/?__source=twitter%7Cmain,Mon Nov 16 01:54:44 +0000 2020
0,CNBC,Watch this video to learn 4 strategies you can use right now to help you pay off your student loans. #investinyou (in partnership with @acorns.) https://t.co/JQ5m0DEJ8k https://t.co/lAARnTPTZN,1328155831687213057,https://www.cnbc.com/2020/08/14/how-to-pay-off-student-loans-while-repayments-paused.html?__source=twitter%7Cmain,Mon Nov 16 02:00:00 +0000 2020
0,CNBC,Gen Z grew up with climate change. Now it’s starting to have an effect on their career choices. #investinyou (In partnership with @acorns.) https://t.co/Wnoxd0voXJ,1328157106927792129,https://www.cnbc.com/2020/11/12/gen-z-grew-up-with-climate-change-now-its-affecting-career-choices.html?__source=twitter%7Cmain,Mon Nov 16 02:05:04 +0000 2020
0,CNBC,"Electric cars are quickly making diesel fuel a fossil — but it isn't done just yet. What place does it have in 2020, and beyond? https://t.co/5rjruwktvG https://t.co/X4CkPIqLcd",1328163630500593664,https://www.cnbc.com/2020/06/19/diesel-is-on-the-decline-but-dont-count-it-out-yet.html?__source=twitter%7Cmain,Mon Nov 16 02:31:00 +0000 2020
0,CNBC,"Hertz tried in mid-2020 to take advantage of an odd spike in its share price and sell stock to pay off its debts. Now, it is bankrupt. Could the car rental company recover, or has its century-old ride come to an end? https://t.co/TSRfX5r9TW https://t.co/x3eH5mcWTQ",1328171180524638208,https://www.cnbc.com/2020/08/17/why-hertz-landed-in-bankruptcy-court-when-its-rivals-didnt.html?__source=twitter%7Cmain,Mon Nov 16 03:01:00 +0000 2020
0,CNBC,This is the best 3-month CD for beginners looking to save and earn money for a short-term goal. https://t.co/w79Tre6w0d,1328172932212862977,https://www.cnbc.com/select/briodirect-high-rate-cd-review/?__source=twitter%7Cmain,Mon Nov 16 03:07:57 +0000 2020
0,CNBC,Here’s how Robinhood and Covid opened the floodgates for 13 million amateur stock traders. Watch the full video here: https://t.co/IkXIlzZ8jy https://t.co/w93HPazMXc,1328178981653389312,https://www.cnbc.com/2020/10/07/how-robinhood-and-covid-introduced-millions-to-the-stock-market.html?__source=twitter%7Cmain,Mon Nov 16 03:32:00 +0000 2020
0,CNBC,Why Elon Musk called an all-hands meeting at 1 in the morning on a Sunday — and what it says about him. (via @CNBCMakeIt) https://t.co/QlDROo6q9g,1328185757962543105,https://www.cnbc.com/2020/03/06/what-elon-musks-early-morning-spacex-all-hands-meeting-says-about-him.html?__source=twitter%7Cmain,Mon Nov 16 03:58:55 +0000 2020
0,CNBC,"Here's how much you need to invest every month to retire with $1 million to $3 million, broken down by age. #investinyou (In partnership with @acorns.) https://t.co/ZqacqzYz9S",1328188643001982976,https://www.cnbc.com/2020/10/15/how-much-you-need-to-invest-a-month-to-retire-with-over-1-million.html?__source=twitter%7Cmain,Mon Nov 16 04:10:23 +0000 2020
0,CNBC,"Huawei hopes Biden presidency brings a 'reset' to relations, says tech officer https://t.co/GdpwyREf6V",1328193480968056832,https://www.cnbc.com/2020/11/16/huawei-hopes-biden-brings-a-reset-to-relations-cto-scanlan.html?__source=twitter%7Cmain,Mon Nov 16 04:29:37 +0000 2020
0,CNBC,"""Government does tend to get pretty hand fisted with solutions and I don't think this is a sledge hammer I think this should be more like a scalpel."" Reddit founder @alexisohanian says social media polarization has gotten ""way ahead of our skis."" https://t.co/AAncnGMOPT https://t.co/v85oW03oCt",1328194332940144643,https://www.cnbc.com/video/2020/11/13/reddit-co-founder-alexis-ohanian-on-hate-speech-radicalization-on-social-media.html?&qsearchterm=ohanian?__source=twitter%7Cmain,Mon Nov 16 04:33:00 +0000 2020
0,CNBC,"RT @laurenthomas: A contested legal battle in mall world looks to be coming to an end.

Simon and Taubman revise the terms of their merger agreement. $spg will now pay $43/share for $tco, down from an OG price of $52.50. A pandemic price cut. Details about the merger here:

https://t.co/i289ZZfnki",1328198671549288450,https://www.cnbc.com/2020/11/15/mall-owners-simon-taubman-revise-merger-terms-800-million-price-cut.html?__source=sharebar%7Ctwitter&par=sharebar,Mon Nov 16 04:50:14 +0000 2020
0,CNBC,"RT @thesheetztweetz: LIFTOFF for Crew-1!

SpaceX’s Falcon 9 rocket roars off the launchpad and heads for orbit, with Crew Dragon Resilience carrying NASA astronauts Mike Hopkins, Victor Glover, Shannon Walker and JAXA astronaut Soichi Noguchi on the company’s first operational mission. https://t.co/UZoTiT41BWLIFTOFF for Crew-1!

SpaceX’s Falcon 9 rocket roars off the launchpad and heads for orbit, with Crew Dragon Resilie… https://t.co/cWBJx0xo8r",1328198808275185664,https://twitter.com/i/web/status/1328132936273715200,Mon Nov 16 04:50:47 +0000 2020
0,CNBC,"Here's how to find your passion and turn it into a successful career, according to Kevin O'Leary: https://t.co/w2vhU7iPwd (via @CNBCMakeIt) https://t.co/pEnuzzsPOU",1328203140588396544,https://www.cnbc.com/2020/09/23/kevin-oleary-how-to-turn-your-passion-into-a-successful-career.html?__source=twitter%7Cmakeit,Mon Nov 16 05:08:00 +0000 2020
0,CNBC,"World's largest trade deal 'signals a commitment' to economic integration, Singapore minister says https://t.co/8TFnIBpa7a",1328208200596905984,https://www.cnbc.com/2020/11/16/rcep-trade-agreement-includes-china-but-not-us-or-india.html?__source=twitter%7Cmain,Mon Nov 16 05:28:06 +0000 2020
0,CNBC,"""Shark Tank"": Mark Cuban invested 6 figures in a company that turned just $2,500 into $490,000 in sales in 16 months. (via @CNBCMakeIt) https://t.co/yqls5Im7Qf",1328210980099252224,https://www.cnbc.com/2020/11/02/shark-tank-mark-cuban-invests-6-figures-company-started-from-2500-dollars.html?__source=twitter%7Cmain,Mon Nov 16 05:39:09 +0000 2020
0,CNBC,"Whole Foods CEO John Mackey: Store managers could be making ""well over $100,000,"" without a college degree. (via @CNBCMakeIt) https://t.co/hyKVwxag3G",1328213699073609734,https://www.cnbc.com/2020/11/05/ceo-john-mackey-on-how-much-you-can-make-working-at-whole-foods.html?__source=twitter%7Cmain,Mon Nov 16 05:49:57 +0000 2020
0,CNBC,Here are 2 ways you can make money if you’re looking for work during the coronavirus pandemic. https://t.co/a0xJr2PYdl #investinyou (In partnership with @acorns.) https://t.co/UzcJKxMnwz,1328217988588298240,https://www.cnbc.com/2020/05/14/heres-how-you-can-make-money-during-the-coronavirus-pandemic.html?__source=twitter%7Cmain,Mon Nov 16 06:07:00 +0000 2020
0,CNBC,"European markets head for higher open as U.S. election, coronavirus remain in focus https://t.co/CGhXbRs88i",1328219072983609346,https://www.cnbc.com/2020/11/16/european-stock-futures-us-election-coronavirus-remain-in-focus.html?__source=twitter%7Cmain,Mon Nov 16 06:11:18 +0000 2020
0,CNBC,PNC to buy U.S. operations of Spanish bank BBVA for $11.6 billion https://t.co/CKsN4vniFE,1328221896610082821,https://www.cnbc.com/2020/11/16/pnc-to-buy-us-operations-of-spanish-bank-bbva.html?__source=twitter%7Cmain,Mon Nov 16 06:22:31 +0000 2020
0,CNBC,I tried Mark Cuban's morning routine for a week — and it boosted my productivity significantly. (via @CNBCMakeIt) https://t.co/pD27CNRamS https://t.co/4LrRoaRvCQ,1328226478056742912,https://www.cnbc.com/2019/05/30/i-tried-mark-cubans-morning-routine-for-a-week.html?__source=twitter%7Cmain,Mon Nov 16 06:40:44 +0000 2020
0,CNBC,New for subscribers:  JPMorgan says these 3 energy stocks have found the 'optimal balance' between oil and renewables https://t.co/uzSMvO7OTd Check out @CNBCPro today.,1328226998167199746,https://www.cnbc.com/2020/11/16/oil-jpmorgan-is-overweight-on-these-3-energy-stocks.html?__source=Twitter%7CPRO%7CNA%7CArticle%7COrganic%26%26tpcc%3DTwitter%7CNA%7CArticle%7COrganic,Mon Nov 16 06:42:48 +0000 2020
0,CNBC,"How much you need to save every month to earn $75,000 a year in interest for retirement. #investinyou (In partnership with @acorns.) https://t.co/qee72fTCCr",1328229532525060096,https://www.cnbc.com/2020/03/13/how-to-earn-75000-a-year-with-an-interest-only-retirement-plan.html?__source=twitter%7Cmain,Mon Nov 16 06:52:52 +0000 2020
0,CNBC,Patrice Washington reacts: Living on $145K a year in Austin. https://t.co/JqGQUEEdWX (via @CNBCMakeIt) https://t.co/r0uwianUKh,1328233591365537792,https://www.cnbc.com/2020/10/01/patrice-washington-reacts-to-a-millennial-with-30000-dollars-in-student-debt.html?__source=twitter%7Cmakeit,Mon Nov 16 07:09:00 +0000 2020
0,CNBC,"India's Paytm is not worried about growing competition in online payments sector, a top exec says https://t.co/fqj94dP4nJ",1328237202833354753,https://www.cnbc.com/2020/11/16/east-tech-west-paytm-on-indias-digital-payments-sector.html?__source=twitter%7Cmain,Mon Nov 16 07:23:21 +0000 2020
0,CNBC,"China is not an 'expansionist empire,' state media says after signing of mega trade deal https://t.co/N0YHEAEvsO",1328240606095810560,https://www.cnbc.com/2020/11/16/chinese-state-media-on-the-signing-of-worlds-largest-trade-deal-rcep.html?__source=twitter%7Cmain,Mon Nov 16 07:36:52 +0000 2020
0,CNBC,"Here's the budget breakdown of two ballet dancers earning $178,000 a year who bought a condo in Chicago. (via @CNBCMakeIt) https://t.co/ijqrBxu5zn",1328243314647298049,https://www.cnbc.com/2020/10/29/couple-makes-178000-dollars-a-year-as-professional-ballet-dancers-in-chicago.html?__source=twitter%7Cmain,Mon Nov 16 07:47:38 +0000 2020
0,CNBC,Warren Buffett: This is the No. 1 mistake parents make when teaching kids about money. (via @CNBCMakeIt) https://t.co/w0LB0NE7Ec,1328245948657569792,https://www.cnbc.com/2019/07/30/warren-buffett-this-is-the-no-1-mistake-parents-make-when-teaching-kids-about-money.html?__source=twitter%7Cmain,Mon Nov 16 07:58:06 +0000 2020
0,CNBC,Watch this video to learn 4 strategies you can use right now to help you pay off your student loans. #investinyou (in partnership with @acorns.) https://t.co/JQ5m0DEJ8k https://t.co/UyH1T2ZL69,1328248690746609666,https://www.cnbc.com/2020/08/14/how-to-pay-off-student-loans-while-repayments-paused.html?__source=twitter%7Cmain,Mon Nov 16 08:09:00 +0000 2020
0,CNBC,"How Warren Buffett's son spent the $90,000 of Berkshire stock he got at 19—worth $200 million now: ""I don't regret it."" (via @CNBCMakeIt) https://t.co/MUikzwi3v5",1328257409597534208,https://www.cnbc.com/2020/05/07/warren-buffett-son-doesnt-regret-spending-berkshire-stock-he-got-at-19-worth-200-million-now.html?__source=twitter%7Cmain,Mon Nov 16 08:43:38 +0000 2020
0,CNBC,"This Japanese 80% diet rule can help you live a longer life, a longevity researcher says. (via @CNBCMakeIt) https://t.co/72YTpzfHiR",1328260025773600773,https://www.cnbc.com/2020/11/10/japanese-80-percent-diet-rule-can-help-you-live-longer-says-longevity-expert.html?__source=twitter%7Cmain,Mon Nov 16 08:54:02 +0000 2020
