,name,text,id,url,created_at
0,BostonGlobe,"From Michigan to Massachusetts, a national system to deliver COVID-19 vaccines to your neighborhood takes shape https://t.co/srJgEe0zHW",1336823002999230465,-1,Thu Dec 10 00:00:15 +0000 2020
0,BostonGlobe,New projects in Boston could soon have to weigh rents and risk of housing displacement https://t.co/9yvhfZ7mHz,1336830493766131714,-1,Thu Dec 10 00:30:01 +0000 2020
0,BostonGlobe,Movie Review: ‘I’m Your Woman’: Imagine Mrs. Maisel married to the mob https://t.co/lPSQaVFTPe,1336830494147796994,-1,Thu Dec 10 00:30:01 +0000 2020
0,BostonGlobe,"Bruins valued at $1 billion, good for fifth wealthiest in NHL, according to Forbes https://t.co/vQiPqTawuV",1336834285421072384,-1,Thu Dec 10 00:45:05 +0000 2020
0,BostonGlobe,Thermo Fisher sees demand for super-cold freezers surge in efforts to preserve Pfizer’s COVID-19 vaccine. https://t.co/Od4DF5bbqm,1336838083728334848,-1,Thu Dec 10 01:00:11 +0000 2020
0,BostonGlobe,From @GlobeOpinion: What’s next for Joe Kennedy III? https://t.co/4LurRu4T5R,1336838085255032835,-1,Thu Dec 10 01:00:11 +0000 2020
0,BostonGlobe,Mayor Walsh continues to fundraise; now has $6 million in bank https://t.co/p3WwTL5U8Z,1336838085410238468,-1,Thu Dec 10 01:00:11 +0000 2020
0,BostonGlobe,"“Even with all of the complications that come with existing as a Black trans woman, in the conversation of Black Lives Matter and who it centers, I have to choose to hope.” #ABeautifulResistance episode 4 from cultire columnist @SincerelyJenee: 
 https://t.co/X4pi2EriAd",1336838100165779457,-1,Thu Dec 10 01:00:14 +0000 2020
