,name,text,id,url,created_at
0,cnsnews,"The speech to the COVID19-hit meeting was short, but covered a lot of ground ... https://t.co/IcdRd2wpfE",1308560481704124417,https://cnsnews.com/article/international/patrick-goodenough/trump-un-hold-beijing-accountable-china-virus,Wed Sep 23 00:15:05 +0000 2020
0,cnsnews,Growing Russia-China military cooperation has sparked unease in the West. https://t.co/pjx7llc3ZE,1308651079513657345,https://cnsnews.com/article/international/dimitri-simes/russia-china-iran-and-others-begin-joint-military-drills,Wed Sep 23 06:15:05 +0000 2020
0,cnsnews,Ginsburg ought to be remembered for two things: attacks on life &amp; liberty. https://t.co/wlSXGcoymY,1308685053015330817,https://cnsnews.com/commentary/terence-p-jeffrey/ruth-bader-ginsburg-v-life-and-liberty,Wed Sep 23 08:30:05 +0000 2020
0,cnsnews,"""I'm all for masks,"" Trump said. ""When you need them.""  https://t.co/SeA1Ajft7p",1308700152346140672,https://cnsnews.com/article/national/susan-jones/trump-why-did-biden-spend-all-money-plastic-surgery-if-hes-going-cover,Wed Sep 23 09:30:05 +0000 2020
0,cnsnews,"Sen. Whitehouse on nixing filibuster: ""The public to see intransigence first."" https://t.co/AAL2YlhJ25",1308705185158569985,https://cnsnews.com/article/washington/susan-jones/sen-whitehouse-dems-have-no-triple-secret-procedural-trick-block,Wed Sep 23 09:50:05 +0000 2020
0,cnsnews,SCOTUS needs a tie-breaking 9 members heading into an already contested election https://t.co/nT9gQEeSkz,1308710218973556736,https://cnsnews.com/article/washington/susan-jones/pence-concern-about-mail-voting-just-one-more-reason-confirm-9th,Wed Sep 23 10:10:05 +0000 2020
0,cnsnews,Schumer used a personal example to argue against Republican action on SCOTUS. https://t.co/Edi3fk5tPF,1308742935031275526,https://cnsnews.com/article/washington/susan-jones/schumer-my-daughter-and-her-wife-hearing-about-ginsburgs-death-worry,Wed Sep 23 12:20:05 +0000 2020
