,name,text,id,url,created_at
0,chicagotribune,Will County health officials are trying to track down dozens of Lincoln-Way East graduates and chaperones who recently attended a student-organized prom in Indiana after a “couple” of attendees tested positive for the coronavirus https://t.co/KNF4ZjkHZD,1288629789998354433,https://www.chicagotribune.com/suburbs/daily-southtown/ct-sta-lincoln-way-east-prom-st-0730-20200729-yldlyt2yu5c3hmbjpe25yxe5fu-story.html,Thu Jul 30 00:17:38 +0000 2020
0,chicagotribune,The fate of St. Louis’ elected prosecutor may rest with which side city voters pick in a bigger national debate https://t.co/FPj1L21VZ9,1288637045989167105,https://www.chicagotribune.com/midwest/ct-ct-louis-prosecutor-mccloskey-20200729-wn6jd3l3nfczfgiwebesthtvz4-story.html,Thu Jul 30 00:46:28 +0000 2020
0,chicagotribune,Traveling out of state? Here's what to know to avoid the chance of a hefty fine when you return home. https://t.co/NQiA9zg3Nx,1288639831694770176,https://www.chicagotribune.com/coronavirus/ct-cb-coronavirus-chicago-self-quarantine-rules-to-know-20200729-rzt3x7jj5fbsxi2ewq4oxvgs5i-story.html,Thu Jul 30 00:57:32 +0000 2020
0,chicagotribune,"Police find AK-47, guns with laser attachments and body armor inside Burnside shooting victims’ home https://t.co/RAmM5w6bX2",1288642739593261058,https://www.chicagotribune.com/news/breaking/ct-guns-armor-found-victims-house-20200730-kf5w2fqdgraujj6gwtvispzghy-story.html,Thu Jul 30 01:09:05 +0000 2020
0,chicagotribune,"Theodore Roosevelt was treated at Mercy Hospital. Mayor Richard M. Daley was born there. Now, after more than 150 years on the South Side, it’s closing. https://t.co/ZeOWkqOO0I",1288645571369107456,https://www.chicagotribune.com/business/ct-biz-mercy-hospital-closing-20200729-dql6xd36g5dazkzviq3upyukvi-story.html,Thu Jul 30 01:20:20 +0000 2020
0,chicagotribune,"Since 2005, Lollapalooza has attracted fans who flocked to Grant Park to listen to artists perform everything from hard rock, hip-hop and indie rock to electronic dance music.

Chicago Tribune photographers have been there to capture it all. https://t.co/yujqZe8gGm",1288650965323849730,https://www.chicagotribune.com/visuals/ct-viz-best-lollapalooza-photos-20200729-h4rew6emnfehvhmzyb757drkii-photogallery.html,Thu Jul 30 01:41:46 +0000 2020
0,chicagotribune,"Illinois teachers and other school employees could strike if school districts implement in-person learning without meeting safety measures outlined by government entities or medical professionals, two of the largest teachers unions in the state announced https://t.co/xPvRx8f9PV",1288656272712175617,https://www.chicagotribune.com/coronavirus/ct-coronavirus-illinois-teachers-health-safety-strikes-20200729-5lwxq4ydozgv3inuwhpqdqiq2a-story.html,Thu Jul 30 02:02:52 +0000 2020
0,chicagotribune,"President Donald Trump vowed Wednesday to protect suburbanites from low-income housing being built in their neighborhoods, making an appeal to white suburban voters by trying to stir up racist fears about affordable housing

From The New York Times https://t.co/l0NPoTwZ7h",1288659143964987392,https://www.chicagotribune.com/election-2020/ct-nw-nyt-trump-suburbs-white-voters-20200730-v333zq2u4vfdro7ig22rzwqz7i-story.html,Thu Jul 30 02:14:16 +0000 2020
0,chicagotribune,"Researchers found that some of the lead from the April 2019 fire that nearly destroyed Notre Dame Cathedral in Paris landed in a surprising place: honey produced by urban beehives. 

From The New York Times.  https://t.co/PmfOgVcyMq",1288667154846556166,https://www.chicagotribune.com/nation-world/ct-nw-nyt-notre-dame-fire-lead-fallout-20200729-76qsgr6zu5gvbd7llqcipnnr6u-story.html,Thu Jul 30 02:46:06 +0000 2020
0,chicagotribune,"Scientists are learning more about just where the stones of Stonehenge came from.

Story from The New York Times: https://t.co/zFcnU2cypX",1288677327677861888,https://www.chicagotribune.com/nation-world/ct-nw-nyt-stonehenge-origin-mystery-20200729-7zv6s6tdgrbppc3gfpm7elwdem-story.html,Thu Jul 30 03:26:32 +0000 2020
0,chicagotribune,"Many parents at Chicago-area Catholic schools are facing a tough decision: commit their children to five days of in-person instruction, or opt for more e-learning, possibly conducted by a third-party vendor. https://t.co/wYu7NxtX8d",1288782903967653888,https://www.chicagotribune.com/coronavirus/ct-catholic-schools-remote-learning-fall-20200729-kzvozygi25drdjxyb2u3d747ra-story.html,Thu Jul 30 10:26:03 +0000 2020
0,chicagotribune,"Darnell McMiller, the reputed leader of the Black Disciples street gang who goes by the street name “Murder,” was among 23 people arrested in a federal gang takedown involving drug and weapons trafficking in Chicago, authorities said https://t.co/t1svR9sJAK",1288786521596846082,https://www.chicagotribune.com/news/criminal-justice/ct-chicago-black-disciples-drug-trafficking-probe-20200729-ubsapkcpijfa3fhkhpxgz42ua4-story.html,Thu Jul 30 10:40:25 +0000 2020
0,chicagotribune,Gov. J.B. Pritzker warned on Wednesday that Illinois could be headed for a “reversal” in its reopening if COVID-19 cases keep rising https://t.co/ApSDs4W0p5,1288797677728210946,https://www.chicagotribune.com/coronavirus/ct-coronavirus-illinoiis-pritzker-20200729-tokhpmz2x5ejpdswqysxzgobim-story.html,Thu Jul 30 11:24:45 +0000 2020
0,chicagotribune,"RT @ElyssaCherney: At least 12 students at Bradley University in Peoria (a warning-level county) have tested positive for COVID-19.

Some of the students helped lead freshmen orientations &amp; were at a social gathering w/o masks or distancing.

https://t.co/0gA8h4ViHB",1288801515105386496,https://www.chicagotribune.com/coronavirus/ct-coronavirus-illinois-bradley-university-outbreak-20200730-ebe5vfsz25g33hijkhnc5vplbu-story.html,Thu Jul 30 11:40:00 +0000 2020
0,chicagotribune,Traveling to one of the 22 states deemed a COVID-19 risk by Chicago Mayor Lori Lightfoot? Here's what you need to know to avoid a large fine. https://t.co/Zs9JQLUGSv,1288801994061287427,https://www.chicagotribune.com/coronavirus/ct-cb-coronavirus-chicago-self-quarantine-rules-to-know-20200729-rzt3x7jj5fbsxi2ewq4oxvgs5i-story.html,Thu Jul 30 11:41:54 +0000 2020
0,chicagotribune,"Good morning, Chicago. Here are some top stories to start your day:
-Pritzker warns of ‘reversal’ on reopening
-Mercy Hospital is closing
-Sketchbook Brewing is launching in Skokie
https://t.co/UV4nIRK5Dg",1288806575549960192,https://www.chicagotribune.com/news/ct-cb-daywatch-newsletter-july30-20200730-a6tbbxme5za77cm3pyyyamni64-story.html,Thu Jul 30 12:00:07 +0000 2020
0,chicagotribune,"In 1871, victims of the Great Chicago Fire were treated at Mercy Hospital in Bronzeville. The hospital is closing next year, though it hopes to establish an outpatient care center. https://t.co/StB5koqeol",1288810047523426304,https://www.chicagotribune.com/business/ct-biz-mercy-hospital-closing-20200729-dql6xd36g5dazkzviq3upyukvi-story.html,Thu Jul 30 12:13:54 +0000 2020
0,chicagotribune,"Twelve students at Bradley University have tested positive for the coronavirus, including some who helped lead orientation programs for incoming freshmen last week https://t.co/MRYPyGlmj2",1288812614043291649,https://www.chicagotribune.com/coronavirus/ct-coronavirus-illinois-bradley-university-outbreak-20200730-ebe5vfsz25g33hijkhnc5vplbu-story.html,Thu Jul 30 12:24:06 +0000 2020
0,chicagotribune,"Chicago Park District workers are calling for better communication and safety protocols from the district about COVID-19, saying they often learn of park closures by “word-of-mouth” https://t.co/HOwH9KJ6br",1288815534717513728,https://www.chicagotribune.com/news/breaking/ct-coronavirus-chicago-park-district-closures-safety-20200730-cfvfvreluzgmdnjuhbchzzz6cu-story.html,Thu Jul 30 12:35:43 +0000 2020
0,chicagotribune,"Jobs are coming back slowly and unevenly in Illinois amid a rise in COVID-19 cases. “In the short run, the economy and the virus are intertwined.” https://t.co/IMzdnyUXkw",1288821770158473216,https://www.chicagotribune.com/coronavirus/ct-coronavirus-illinois-jobs-recovery-economy-20200730-gnhhzrrwivfxbb2avipassanbe-story.html,Thu Jul 30 13:00:29 +0000 2020
0,chicagotribune,"A toddler was shot and critically injured Wednesday night while riding in a car with her mother in Hammond, and authorities are asking the public to help find the shooter. https://t.co/o2VgAYcyS0",1288826599593381888,https://www.chicagotribune.com/news/breaking/ct-hammond-indiana-toddler-shot-20200730-paadojwhfzdnxgiplo3jduaoda-story.html,Thu Jul 30 13:19:41 +0000 2020
0,chicagotribune,The U.S. economy shrank at a dizzying 33% annual rate in the April-June quarter — by far the worst quarterly plunge ever. https://t.co/grBi1N4lfk,1288832940294713344,https://www.chicagotribune.com/business/ct-biz-us-economic-plunge-20200730-t25tj4pzdvcmrirdufstpla2nm-story.html,Thu Jul 30 13:44:52 +0000 2020
0,chicagotribune,"As the economy struggles to climb out of the COVID-19 crisis, jobs are coming back slowly and unevenly. https://t.co/77LHY8aRye",1288836561887469568,https://www.chicagotribune.com/coronavirus/ct-covid-19-pandemic-chicago-illinois-news-20200730-u5rletd2a5fi3cgt63gibjow6q-story.html,Thu Jul 30 13:59:16 +0000 2020
0,chicagotribune,"Herman Cain, 2012 Republican presidential candidate and businessman, dies after battling COVID-19 https://t.co/jxQhwenwTl",1288852656845447170,https://www.chicagotribune.com/coronavirus/ct-nw-herman-cain-dead-covid-19-20200730-cxk2tygjxfdp7a3l37mjlaavpi-story.html,Thu Jul 30 15:03:13 +0000 2020
0,chicagotribune,"A Chicago police officer was shot Thursday morning, officials say. Check back for updates. https://t.co/cR6Ky2mNfW",1288854736456777731,https://www.chicagotribune.com/news/breaking/ct-chicago-police-officer-shot-shooting-20200730-lcixi5q6wremxj3i5s2fw24q4a-story.html,Thu Jul 30 15:11:29 +0000 2020
0,chicagotribune,Will Chicago teachers strike —again — if CPS schools reopen this fall? Here's what we know so far. https://t.co/pkmjcwAJMh,1288859817545736200,https://www.chicagotribune.com/coronavirus/ct-ctu-strike-school-reopening-20200730-ig73sxuyfzgsrng66kqmpoiio4-story.html,Thu Jul 30 15:31:41 +0000 2020
0,chicagotribune,RT @TedSlowik1: In which I discover the legal basis for the privilege of growing up in an exclusive community. https://t.co/oRM2GCXsWy,1288865843980402695,https://www.chicagotribune.com/suburbs/daily-southtown/opinion/ct-sta-slowik-legal-racist-covenant-st-0730-20200729-ga3x4bud7zctjb53ncasmwidti-story.html,Thu Jul 30 15:55:37 +0000 2020
0,chicagotribune,Watch live as Illinois Gov. J.B. Pritzker shares updates on the state’s coronavirus response https://t.co/52dqG9FLvY,1288867578111234049,https://www.chicagotribune.com/news/ct-live-stream-video-20191101-mmzazul6lrfspbf7d5as6ju2am-htmlstory.html,Thu Jul 30 16:02:31 +0000 2020
0,chicagotribune,"Dozens of shots were fired at a Chicago police station this morning in an exchange of gunfire that wounded at least two police officers and a person in custody, authorities say. https://t.co/cUHkZvRLIo",1288874711229833216,https://www.chicagotribune.com/news/breaking/ct-chicago-police-officer-shot-shooting-20200730-lcixi5q6wremxj3i5s2fw24q4a-story.html,Thu Jul 30 16:30:51 +0000 2020
0,chicagotribune,"Just months before the first residents move into what will become Chicago’s third-tallest skyscraper, a Chinese developer has agreed to sell its ownership stake in Vista Tower for $270 million. https://t.co/7JI7Nkh9Im",1288883342876737548,https://www.chicagotribune.com/columns/ryan-ori/ct-biz-vista-tower-sale-magellan-ryan-ori-20200730-xar3h25bpjabxblhhkftzaha4i-story.html,Thu Jul 30 17:05:09 +0000 2020
0,chicagotribune,"Illinois announced 1,772 new known cases of COVID-19 on Thursday, the 8th straight day with more than 1,000 new cases. The state also announced 18 new confirmed deaths. https://t.co/fbnBmhSj4O",1288886760248942592,https://www.chicagotribune.com/coronavirus/ct-covid-19-pandemic-chicago-illinois-news-20200730-u5rletd2a5fi3cgt63gibjow6q-story.html,Thu Jul 30 17:18:44 +0000 2020
0,chicagotribune,"Electric scooters are returning to Chicago in just under two weeks. And this time, they'll be available across most of the city. Here's a look at the new pilot program. https://t.co/txAm1Hyi6u",1288891591214727169,https://www.chicagotribune.com/news/breaking/ct-electric-scooters-pilot-20200730-g6w6sp4eizd3pchgrztcknya2q-story.html,Thu Jul 30 17:37:56 +0000 2020
0,chicagotribune,"Two men were wounded Thursday morning in a drive-by shooting in the South Chicago neighborhood, police say https://t.co/t3V4vj5P7a",1288892191423766530,https://www.chicagotribune.com/news/breaking/ct-violence-shootings-chicago-20200730-3zx3qzmm2vfmpfrqdumudxlyvu-story.html,Thu Jul 30 17:40:19 +0000 2020
0,chicagotribune,"“We’re at a danger point,” Gov. J.B. Pritzker said Thursday as state officials reported 1,772 new COVID-19 cases and 18 more deaths in Illinois. https://t.co/V1e5EJqyJx",1288895259985018880,https://www.chicagotribune.com/coronavirus/ct-covid-19-pandemic-chicago-illinois-news-20200730-u5rletd2a5fi3cgt63gibjow6q-story.html,Thu Jul 30 17:52:31 +0000 2020
0,chicagotribune,"Wisconsin governor issues statewide mask order, joining majority of states with similar order https://t.co/Yk194OLh5C",1288896566913388544,https://www.chicagotribune.com/coronavirus/ct-nw-wiscosin-coronavirus-statewide-mask-mandate-20200730-npoj7lucvfgqfh46zw4xyzco5e-story.html,Thu Jul 30 17:57:42 +0000 2020
0,chicagotribune,Frustrated negotiators of a massive coronavirus relief bill face heightened pressure with brutal economic news and the rapidly approaching lapse in the $600 boost to unemployment benefits https://t.co/RJXAE13xU6,1288899744367026177,https://www.chicagotribune.com/coronavirus/ct-nw-second-coronavirus-stimulus-check-updates-20200730-uohbtoqen5eahoty3bmaepazni-story.html,Thu Jul 30 18:10:20 +0000 2020
0,chicagotribune,This Deerfield home on an oversized lot boasts a two-sided fireplace under a heated pergola. Take a look inside. https://t.co/0RAZvXfjvD,1288905189794160641,https://www.chicagotribune.com/real-estate/dream-homes/ct-re-home-of-the-week-0805-20200730-2tm2uqq3ynfs3l7p4uuo3ycodi-photogallery.html,Thu Jul 30 18:31:58 +0000 2020
0,chicagotribune,"While deaths from the coronavirus in the U.S. are mounting rapidly, public health experts are seeing a flicker of good news: The second surge of confirmed cases appears to be leveling off https://t.co/vHkPx9kBlV",1288908937413173256,https://www.chicagotribune.com/coronavirus/ct-nw-coronavirus-updates-20200730-dg3ltsn5f5hudcaws7cxzy3p3q-story.html,Thu Jul 30 18:46:52 +0000 2020
0,chicagotribune,"RT @John_Kass: Police families: Three #Chicago police officers shot, two others taken in for chest pains.  &amp; the other day, a #CPD  deputy chief apparent suicide. What about police families everywhere? How do they bear it? My Thursday column:
https://t.co/V2pC3PjnBC",1288910376441204736,https://www.chicagotribune.com/columns/john-kass/ct-police-suicide-kass-20200730-birfmjr3tjhgljqsiqitgavi2u-story.html,Thu Jul 30 18:52:35 +0000 2020
0,chicagotribune,"President Trump floats delaying the presidential election, something experts say ""he has absolutely no power to do"" https://t.co/XfVX2MGebL",1288912638223753216,https://www.chicagotribune.com/election-2020/ct-trump-election-delay-tweet-20200730-yozygdfoizgmhjeavw3e2oojdy-story.html,Thu Jul 30 19:01:34 +0000 2020
0,chicagotribune,The North Shore’s engineered shoreline and man-made beaches have proved to be no match for Lake Michigan. https://t.co/WWs3r6fqxJ,1288915538870181889,https://www.chicagotribune.com/suburbs/wilmette/ct-wml-north-shore-erosion-lake-levels-story-one-tl-0806-20200730-qvkricfsnnefbci33l5uulvjbq-story.html,Thu Jul 30 19:13:06 +0000 2020
0,chicagotribune,"President Donald Trump does not have the authority to move the date of a federal election. And his claim that widespread mail-in voting would make the election “inaccurate and fraudulent” is false.

Answers to key questions, from The New York Times: https://t.co/mCzjH86dJg",1288924535690067968,https://www.chicagotribune.com/election-2020/ct-nw-nyt-cb-2020-election-delay-20200730-uuva4hhohjdh5cm25jbhqxrmlu-story.html,Thu Jul 30 19:48:51 +0000 2020
0,chicagotribune,"Mayor Lori Lightfoot pulled out of a virtual roundtable hosted by Crain’s Chicago Business to avoid appearing on the same digital stage as Minneapolis Mayor Jacob Frey, sources say https://t.co/zlCdBdXGDB",1288942224441565186,https://www.chicagotribune.com/politics/ct-lightfoot-crains-chicago-minneapolis-canceled-20200730-kpqtjegzkba37drfaontomqwsu-story.html,Thu Jul 30 20:59:08 +0000 2020
0,chicagotribune,"Lollapalooza 2020 starts tonight, and you don't even have to leave your house to watch. Here's the lineup. https://t.co/VEQHQiVUEM",1288953860812345345,https://www.chicagotribune.com/entertainment/lollapalooza/ct-lollapalooza-2020-watch-livestream-20200730-pnaad5yokjhabffbnpmf6ziqzq-htmlstory.html,Thu Jul 30 21:45:22 +0000 2020
0,chicagotribune,UPDATE: St. Louis County prosecutor declines to charge the former Ferguson police officer who fatally shot Michael Brown in 2014. https://t.co/lQXJg4kK2W,1288956009910874113,https://www.chicagotribune.com/nation-world/ct-nw-ferguson-michael-brown-darren-wilson-charges-20200730-2ysejycl5bdbva5cmeen7zr5da-story.html,Thu Jul 30 21:53:55 +0000 2020
