,name,text,id,url,created_at
0,NewYorker,"H. G. Wells, who was born on this date in 1866, had a gift that was perhaps even rarer than being a great novelist: he represented an era by dreaming its nightmares for it. 
https://t.co/xMiJTAvbWO",1308203667544313856,-1,Tue Sep 22 00:37:14 +0000 2020
0,NewYorker,"“I just couldn’t sleep,” Max Kennedy, Jr., said, of what he witnessed while working on President Trump’s coronavirus task force. “I was so distressed and disturbed by what I’d seen.” https://t.co/PtlPDlRlP3",1308208138475180034,-1,Tue Sep 22 00:55:00 +0000 2020
0,NewYorker,"Maira Kalman on the two trees that changed her life—one in the Bronx, and the other in a little village outside of London.
https://t.co/ousUedkYax",1308212966337249281,-1,Tue Sep 22 01:14:11 +0000 2020
0,NewYorker,"""Residue"" is the story of a Black filmmaker who returns to his home town of Washington, D.C., to make a film set in his former neighborhood.
https://t.co/JPFMjPdN5U",1308218271481696262,-1,Tue Sep 22 01:35:16 +0000 2020
0,NewYorker,In our Monday crossword—our most challenging puzzle of the week—eight letters: Colonial housing? https://t.co/bbukHLGSBz,1308222833001197568,-1,Tue Sep 22 01:53:23 +0000 2020
0,NewYorker,The many strategies devised to surmount the challenges of whole-roasting a chicken include grilling it with a beer can inside and cooking it “in the style of a toad.” https://t.co/P97EhjEZHO,1308227204438843392,-1,Tue Sep 22 02:10:45 +0000 2020
0,NewYorker,"The ragged end of Donald Trump's Presidency, if it comes, will be full of conflict and resentment, @mashagessen writes. There will be no orderly handover, no constructive transition—a disastrous prospect during a pandemic and a deep recession. https://t.co/UnlNO975Cc",1308238033611829248,-1,Tue Sep 22 02:53:47 +0000 2020
0,NewYorker,"“When you comment on a celebrity’s Instagram or Twitter, it’s unreciprocated. With Cameo, it’s about the exchange of love,” the app's founder said. https://t.co/l73toVYU51",1308242297990021120,-1,Tue Sep 22 03:10:44 +0000 2020
0,NewYorker,"The awfulness of the latest Trump revelations is no less awful for having been both anticipated and completely consistent with what we already suspected, @sbg1 writes. https://t.co/jEVhktM0YV",1308249182063427584,-1,Tue Sep 22 03:38:05 +0000 2020
0,NewYorker,Recent poll findings suggest President Trump is still confronting the same basic challenge that the Republican Party faced in the 2018 midterms: a majority of voters don’t like the President or approve of the job he is doing. https://t.co/Ibfzedro35,1308253420445487106,-1,Tue Sep 22 03:54:56 +0000 2020
