,name,text,id,url,created_at
0,NewYorker,Iceland didn’t just manage to flatten the curve; it virtually eliminated it. https://t.co/JgBtOFpQ5o,1302043007433281539,-1,Sat Sep 05 00:36:58 +0000 2020
0,NewYorker,"He opens doors for women at work, but they’re metaphorical doors, like the ones that lead to promotions. https://t.co/l4DMDmsseK",1302050890547855360,-1,Sat Sep 05 01:08:17 +0000 2020
0,NewYorker,"How to kick your human-flesh-eating habit in no time.
https://t.co/62yme8qW5c",1302062568467509254,-1,Sat Sep 05 01:54:42 +0000 2020
0,NewYorker,"In a series of iPhone photographs taken over the course of two and a half years, Jeff Mermelstein captures the quotidian dramas taking place on the phone screens of unsuspecting strangers.

https://t.co/Xv8ivLJ7f8",1302072783099265025,-1,Sat Sep 05 02:35:17 +0000 2020
0,NewYorker,"""Anybody who knows me knows that I want to do right by everyone, so to learn that my actions—specifically, eating humans—were ever at anybody’s expense makes my heart hurt."" https://t.co/5hTekwcgcy",1302076761610555392,-1,Sat Sep 05 02:51:06 +0000 2020
