,name,text,id,url,created_at
0,Reuters,"An iconic Japanese symbol, geisha are dwindling, with women scared off by the rigors of training and traditional rules. The coronavirus and Japan's soft lockdown cut engagements to nothing and forced the women into days at home https://t.co/5oA6Vmeq54 https://t.co/CQagpxm3tq",1283915037531426823,https://www.reuters.com/article/us-health-coronavirus-japan-geisha-life/what-does-a-geisha-do-with-spare-time-read-manga-play-with-cats-idUSKCN24H149?utm_source=twitter&utm_medium=Social,Fri Jul 17 00:02:53 +0000 2020
0,Reuters,Morgan Stanley posted a record quarterly profit that blew past analysts’ expectations as another of Wall Street’s big investment banks gained from huge swings in financial markets despite the economic turmoil https://t.co/RIqaZFxCRf https://t.co/zvceQWdZXe,1283919343533858824,https://www.reuters.com/article/us-morgan-stanley-results/morgan-stanley-posts-record-profit-on-trading-boom-idUSKCN24H1Q5,Fri Jul 17 00:20:00 +0000 2020
0,Reuters,Senate Republican asks Twitter for urgent briefing on hacking incident https://t.co/yQPTjtOJkM https://t.co/2YVK6mmhUX,1283919351222067202,https://www.reuters.com/article/us-twitter-cyber-congress-idUSKCN24H2YZ?taid=5f10eeb0502a3e00018644bc&utm_campaign=trueAnthem%3A+Trending+Content&utm_medium=trueAnthem&utm_source=twitter,Fri Jul 17 00:20:02 +0000 2020
0,Reuters,"RT @ReutersBiz: From @Breakingviews: Netflix’s results clashed with sky-high expectations. But the streaming service remains well placed, even if TV-viewing is reaching a peak https://t.co/dYwnood2kB $NFLX https://t.co/MPiDX2SkFd",1283920039175913474,https://www.reuters.com/article/us-netflix-results-breakingviews/breakingviews-netflix-is-still-the-pointiest-faang-idUSKCN24H3BD,Fri Jul 17 00:22:46 +0000 2020
0,Reuters,RT @reuterspictures: Hundreds of Detroit-area students turned out in protest outside their high school calling for the release of a classmate who is in juvenile detention after not completing schoolwork during remote learning this past semester. Read more: https://t.co/BT269nfCqv 📷 @emily_elconin https://t.co/5FMrTn62Al,1283920107643768832,https://www.reuters.com/article/us-health-coronavirus-usa-detention/protests-in-michigan-after-student-jailed-for-not-doing-online-schoolwork-idUSKCN24H38Q,Fri Jul 17 00:23:02 +0000 2020
0,Reuters,U.S. Supreme Court leaves in place curbs on voting by ex-felons in Florida https://t.co/6CcRtjRdfj https://t.co/mnzReeKavs,1283920608150138883,https://www.reuters.com/article/us-usa-court-election-felons-idUSKCN24H2WN?taid=5f10efdcc3d9480001c43a48&utm_campaign=trueAnthem%3A+Trending+Content&utm_medium=trueAnthem&utm_source=twitter,Fri Jul 17 00:25:01 +0000 2020
0,Reuters,"China's economy rebounds after steep slump, but weak consumption raises challenges https://t.co/DIS7GXBMOM https://t.co/UEFZDthEs3",1283921860263018507,https://www.reuters.com/article/us-china-economy-gdp/chinas-economy-rebounds-after-steep-slump-u-s-tensions-weak-consumption-raise-challenges-idUSKCN24H0AM,Fri Jul 17 00:30:00 +0000 2020
0,Reuters,EU regulators are seeking information from 400 companies to establish if there are problems in the market for voice assistants and other internet-connected devices relating to data use and competition https://t.co/Q5KH2TKxMe https://t.co/uGUumWKzpw,1283924376719687687,https://www.reuters.com/article/us-eu-antitrust-tech/eu-regulators-to-probe-alexa-siri-and-other-voice-assistants-idUSKCN24H1VP,Fri Jul 17 00:40:00 +0000 2020
0,Reuters,Brazil hits grim milestone as COVID-19 outbreak worsens https://t.co/5OmG6cPCn9 https://t.co/egl4gL3siz,1283924387394203649,https://www.reuters.com/article/us-health-coronavirus-brazil-tally-idUSKCN24H32T?taid=5f10f360977e0100010f0574&utm_campaign=trueAnthem%3A+Trending+Content&utm_medium=trueAnthem&utm_source=twitter,Fri Jul 17 00:40:02 +0000 2020
0,Reuters,"Four out of 10 parents in the U.S. said they would likely keep their children home even if classes resume, according to a Reuters/Ipsos poll https://t.co/3dx4TSB6mw https://t.co/YEZLFMw2Jh",1283930668393730051,https://www.reuters.com/article/us-health-coronavirus-usa-schools-poll/despite-trumps-pressure-most-americans-think-it-is-unsafe-to-reopen-schools-reuters-ipsos-poll-idUSKCN24H2OX,Fri Jul 17 01:05:00 +0000 2020
0,Reuters,Asian markets look for fresh upswing after U.S. market dip https://t.co/bU5AMBJ67B https://t.co/lvTzRHHdZS,1283930674978791424,https://www.reuters.com/article/us-global-markets-idUSKCN24H3I2?taid=5f10f93dc3d9480001c43a7c&utm_campaign=trueAnthem%3A+Trending+Content&utm_medium=trueAnthem&utm_source=twitter,Fri Jul 17 01:05:01 +0000 2020
0,Reuters,Small businesses including restaurants and hair salons are hit by a second shutdown in California as coronavirus ca… https://t.co/RHtb3OzhL6,1283931926735261698,https://twitter.com/i/web/status/1283931926735261698,Fri Jul 17 01:10:00 +0000 2020
0,Reuters,U.N. aid chief to G20 on coronavirus: 'Step up now or pay price later' https://t.co/6lxh6rIkJO https://t.co/ZE5l1LBvqL,1283931935169970176,https://www.reuters.com/article/us-health-coronavirus-un-idUSKCN24H3DB?taid=5f10fa69c3d9480001c43a80&utm_campaign=trueAnthem%3A+Trending+Content&utm_medium=trueAnthem&utm_source=twitter,Fri Jul 17 01:10:02 +0000 2020
0,Reuters,Fauci implores young people to stay vigilant on coronavirus risk https://t.co/z2MN8is2Wx https://t.co/cr1Q8IM3De,1283934450439593984,https://www.reuters.com/article/us-health-coronavirus-facebook-fauci-idUSKCN24H3F9?taid=5f10fcc0977e0100010f0594&utm_campaign=trueAnthem%3A+Trending+Content&utm_medium=trueAnthem&utm_source=twitter,Fri Jul 17 01:20:01 +0000 2020
0,Reuters,Thousands of supporters from Ivory Coast's ruling RHDP party flocked to Abidjan's main sports stadium to attend a m… https://t.co/I9PSFChUBq,1283935701436739586,https://twitter.com/i/web/status/1283935701436739586,Fri Jul 17 01:25:00 +0000 2020
0,Reuters,Protests in Michigan after student jailed for not doing online schoolwork https://t.co/N2B7QxMTP0 https://t.co/enaYKk2eRh,1283935708076560384,https://www.reuters.com/article/us-health-coronavirus-usa-detention-idUSKCN24H38Q?taid=5f10fdec977e0100010f0596&utm_campaign=trueAnthem%3A+Trending+Content&utm_medium=trueAnthem&utm_source=twitter,Fri Jul 17 01:25:01 +0000 2020
0,Reuters,"‘We can no longer continue to sweep these things under the carpet,’ activist @GretaThunberg said, calling on leaders to protect the most vulnerable https://t.co/OvN5nPdhsD https://t.co/HWrF062aI3",1283936960319492097,https://www.reuters.com/article/us-climate-change-greta/greta-thunberg-world-must-tear-up-old-systems-contracts-to-tackle-climate-idUSKCN24H1KQ,Fri Jul 17 01:30:00 +0000 2020
0,Reuters,California blames PG&amp;E for Kincade wildfire in wine country https://t.co/pjNhQnSywz https://t.co/7UZ2SYn9dJ,1283936979273560065,https://www.reuters.com/article/us-pg-e-us-california-wildfire-idUSKCN24H3II?taid=5f10ff19502a3e00018644e5&utm_campaign=trueAnthem%3A+Trending+Content&utm_medium=trueAnthem&utm_source=twitter,Fri Jul 17 01:30:04 +0000 2020
0,Reuters,House Speaker Nancy Pelosi on President Trump’s response to the coronavirus pandemic: ‘The President continues to go down the wrong path and refuses to ask for directions from scientists who know better than any of us’ https://t.co/Haf1iWIH4B https://t.co/MLpKauvtDP,1283938218057109510,https://www.reuters.com/article/us-health-coronavirus-usa/more-u-s-states-mandate-masks-to-staunch-coronavirus-pandemic-idUSKCN24H2L1,Fri Jul 17 01:35:00 +0000 2020
0,Reuters,"Pandemic-hit Arizona, Texas counties order coolers, refrigerated trucks for bodies https://t.co/vip0JCE1tJ https://t.co/krO97dChSX",1283938225602600965,https://www.reuters.com/article/us-health-coronavirus-usa-casualties-idUSKCN24H3HK?taid=5f110044c3d9480001c43a98&utm_campaign=trueAnthem%3A+Trending+Content&utm_medium=trueAnthem&utm_source=twitter,Fri Jul 17 01:35:02 +0000 2020
0,Reuters,"A plan to fence land along the southern border of the Nairobi National Park, seeks to reduce conflict between people and wild animals. But conservationists say the animals are under threat from plans to block their movement https://t.co/9HrKylfzQs https://t.co/AVwY49fsA8",1283939476134170624,https://www.reuters.com/article/us-kenya-conservation/wild-animals-losing-freedom-to-roam-as-city-encroaches-on-nairobi-park-idUSKCN24G0TD,Fri Jul 17 01:40:00 +0000 2020
0,Reuters,"Hydroxychloroquine ineffective against mild COVID-19, U.S. study shows https://t.co/vlE0bd5XiM https://t.co/eYvaPKyptX",1283939486984962049,https://www.reuters.com/article/us-health-coronavirus-hydroxychloroquine-idUSKCN24H2YC?taid=5f110170502a3e00018644ee&utm_campaign=trueAnthem%3A+Trending+Content&utm_medium=trueAnthem&utm_source=twitter,Fri Jul 17 01:40:02 +0000 2020
0,Reuters,Wall Street ended lower on heightened concerns about the economic recovery from COVID-19 and higher-than-expected filings for jobless claims https://t.co/0XD9vkwCMf https://t.co/6dgV0Hi5w8,1283940734479986688,https://www.reuters.com/article/us-usa-stocks/wall-street-ends-lower-on-covid-19-worries-tech-weighs-idUSKCN24H1ML,Fri Jul 17 01:45:00 +0000 2020
0,Reuters,"Jailed executive in Wirecard scandal offers confession, lawyer says https://t.co/QFFPMs95hk https://t.co/RyMrWCMs2t",1283940744097673218,https://www.reuters.com/article/us-wirecard-accounts-idUSKCN24H35T?taid=5f11029d977e0100010f05a3&utm_campaign=trueAnthem%3A+Trending+Content&utm_medium=trueAnthem&utm_source=twitter,Fri Jul 17 01:45:02 +0000 2020
0,Reuters,"'The whole point of the channel was for our other family members to watch but then a bunch of other people started joining in,' says 8-year-old YouTube star Ryan Kaji who creates content around fun indoor activities https://t.co/HQ0ahSjVpD https://t.co/KCzhFLOqLR",1283944512180686849,https://www.reuters.com/article/us-television-ryans-world/child-youtube-star-ryan-kaji-adds-lockdown-fun-virus-education-to-repertoire-idUSKCN24G30A,Fri Jul 17 02:00:00 +0000 2020
0,Reuters,TUI to offer free coronavirus insurance to lure travellers: report https://t.co/eUGOx5VlSl https://t.co/7L51qFoib0,1283944535878443017,https://www.reuters.com/article/us-health-coronavirus-tui-idUSKCN24H3GC?taid=5f110624c3d9480001c43aa6&utm_campaign=trueAnthem%3A+Trending+Content&utm_medium=trueAnthem&utm_source=twitter,Fri Jul 17 02:00:06 +0000 2020
0,Reuters,U.S. prepares push to reduce 'unnecessary' COVID-19 testing: official https://t.co/Z0d527lkOZ https://t.co/ylMHpbVLkf,1283945775450525696,https://www.reuters.com/article/us-health-coronavirus-testing-idUSKCN24H37M?taid=5f11074c502a3e000186450a&utm_campaign=trueAnthem%3A+Trending+Content&utm_medium=trueAnthem&utm_source=twitter,Fri Jul 17 02:05:02 +0000 2020
0,Reuters,"London’s Brixton Village is usually bustling with people eating out. Despite the government's plea for people to get out and spend, there's little sign of that happening, some business owners fear the lockdown may have changed customer behavior for good https://t.co/8BcG50MzFp https://t.co/sOsXgkjk6r",1283947025986281472,https://www.reuters.com/article/us-health-coronavirus-britain-goingout/london-restaurants-fret-as-going-out-goes-out-of-style-idUSKCN24H1NN,Fri Jul 17 02:10:00 +0000 2020
0,Reuters,So close yet so far: EU seeks deal on stimulus for COVID-hit economy https://t.co/rHdB1z6Q2S https://t.co/HLATr5nDAx,1283947036287672327,https://www.reuters.com/article/us-eu-summit-idUSKCN24H3CK?taid=5f110879502a3e000186450d&utm_campaign=trueAnthem%3A+Trending+Content&utm_medium=trueAnthem&utm_source=twitter,Fri Jul 17 02:10:02 +0000 2020
0,Reuters,"Foreign students coming from Europe are exempt from a travel ban the U.S. imposed because of the pandemic, the State Department said https://t.co/6C3rk2BENh https://t.co/xUxigZa44n",1283947226394492930,https://www.reuters.com/article/us-health-coronavirus-usa-students/trump-administration-exempts-european-students-from-coronavirus-travel-restrictions-idUSKCN24H3HC?utm_medium=Social&utm_source=twitter,Fri Jul 17 02:10:48 +0000 2020
0,Reuters,"New Yorkers soak up the sun on High Line park, nearly empty at its reopening https://t.co/LX9HNavjfo https://t.co/oVJQ39agS1",1283948294927003649,https://www.reuters.com/article/us-health-coronavirus-new-york-high-line-idUSKCN24H37Y?taid=5f1109a5977e0100010f05b7&utm_campaign=trueAnthem%3A+Trending+Content&utm_medium=trueAnthem&utm_source=twitter,Fri Jul 17 02:15:02 +0000 2020
0,Reuters,"Activist @GretaThunberg said that climate change negotiations and talks ‘won't change a thing,’ and ‘we need to see it as, above all, an existential crisis’ https://t.co/OvN5nPdhsD https://t.co/nIcIE2i0K4",1283949542552080386,https://www.reuters.com/article/us-climate-change-greta/greta-thunberg-world-must-tear-up-old-systems-contracts-to-tackle-climate-idUSKCN24H1KQ,Fri Jul 17 02:20:00 +0000 2020
0,Reuters,British Airways retires entire fleet of Boeing's jumbo jets https://t.co/d2eyCCghB7 https://t.co/5es0lj2LS5,1283949550928003073,https://www.reuters.com/article/us-health-coronavirus-iag-idUSKCN24I04J?taid=5f110ad0502a3e0001864512&utm_campaign=trueAnthem%3A+Trending+Content&utm_medium=trueAnthem&utm_source=twitter,Fri Jul 17 02:20:02 +0000 2020
0,Reuters,Dollar holds gains on safe haven bid as economic risks grow https://t.co/clj8DbytEJ https://t.co/UBCMZRUVdi,1283952074150088710,https://www.reuters.com/article/uk-global-forex-idUSKCN24I031?taid=5f110d2a977e0100010f05ba&utm_campaign=trueAnthem%3A+Trending+Content&utm_medium=trueAnthem&utm_source=twitter,Fri Jul 17 02:30:03 +0000 2020
0,Reuters,"The Vatican is toughening its stance on child sexual abuse, advising bishops to report cases to civil authorities even if they're not obliged to by local law. The advice is contained in a new 20-page ‘vademecum,’ or guidebook https://t.co/9Rvpcl9OwZ https://t.co/AKs2A76cUe",1283953317500997632,https://www.reuters.com/article/us-vatican-abuse-handbook/vatican-handbook-on-sex-abuse-cases-urges-reporting-to-authorities-idUSKCN24H26S,Fri Jul 17 02:35:00 +0000 2020
0,Reuters,"Fed kicks off Main Street lending, balance sheet tops $7 trillion https://t.co/6V5YW3d8Rc https://t.co/ZvylcvWWy7",1283953323566080002,https://www.reuters.com/article/us-usa-fed-assets-idUSKCN24H38P?taid=5f110e54c3d9480001c43acd&utm_campaign=trueAnthem%3A+Trending+Content&utm_medium=trueAnthem&utm_source=twitter,Fri Jul 17 02:35:01 +0000 2020
0,Reuters,"With shift toward merit-based pay, Japan's Hitachi to drop old ways https://t.co/GjOBPly0OC https://t.co/k8WK87cFTN",1283954584512274433,https://www.reuters.com/article/us-hitachi-pay-idUSKCN24H3CW?taid=5f110f80977e0100010f05bd&utm_campaign=trueAnthem%3A+Trending+Content&utm_medium=trueAnthem&utm_source=twitter,Fri Jul 17 02:40:02 +0000 2020
0,Reuters,"Singapore exports surge 16.1% in June, beating forecasts https://t.co/0iVCCAbSl7 https://t.co/adDYywts07",1283955843076165632,https://www.reuters.com/article/us-singapore-economy-tradefigures-idUSKCN24I026?taid=5f1110adc3d9480001c43ad4&utm_campaign=trueAnthem%3A+Trending+Content&utm_medium=trueAnthem&utm_source=twitter,Fri Jul 17 02:45:02 +0000 2020
0,Reuters,EU antitrust regulators have launched a probe into internet voice assistants such as Alexa and Siri to make sure market players did not use their control of such data to hurt competition or thwart rivals https://t.co/Q5KH2TKxMe https://t.co/Cst8MaiEa8,1283957092244742145,https://www.reuters.com/article/us-eu-antitrust-tech/eu-regulators-to-probe-alexa-siri-and-other-voice-assistants-idUSKCN24H1VP,Fri Jul 17 02:50:00 +0000 2020
0,Reuters,Australia's Victoria sets record for new COVID-19 cases second day in a row https://t.co/yw8KRAkJms https://t.co/LOjnSFtsmp,1283957099383402496,https://www.reuters.com/article/us-health-coronavirus-australia-state-idUSKCN24I062?taid=5f1111d8977e0100010f05c1&utm_campaign=trueAnthem%3A+Trending+Content&utm_medium=trueAnthem&utm_source=twitter,Fri Jul 17 02:50:01 +0000 2020
0,Reuters,"Brazil coronavirus cases reach two million, doubling in less than a month https://t.co/jHXJQxoJft https://t.co/gb1at3SIMh",1283958358626701313,https://www.reuters.com/article/us-health-coronavirus-brazil-idUSKCN24H3BN?taid=5f111304c3d9480001c43ad7&utm_campaign=trueAnthem%3A+Trending+Content&utm_medium=trueAnthem&utm_source=twitter,Fri Jul 17 02:55:02 +0000 2020
0,Reuters,"Daimler's second-quarter EBIT hit by coronavirus, restructuring costs https://t.co/yGoVg0bt9U https://t.co/9NmWHti0OS",1283959640418594817,https://www.reuters.com/article/us-daimler-results-idUSKCN24H339?taid=5f111436977e0100010f05c3&utm_campaign=trueAnthem%3A+Trending+Content&utm_medium=trueAnthem&utm_source=twitter,Fri Jul 17 03:00:07 +0000 2020
0,Reuters,Ex-Pemex boss faces hearing over graft charges on return to Mexico https://t.co/odVzYX6k56 https://t.co/LLQmfFr5JF,1283962134003691520,https://www.reuters.com/article/us-mexico-corruption-idUSKCN24H2QB?taid=5f111688977e0100010f05d6&utm_campaign=trueAnthem%3A+Trending+Content&utm_medium=trueAnthem&utm_source=twitter,Fri Jul 17 03:10:02 +0000 2020
0,Reuters,"Netflix names content chief Ted Sarandos co-CEO, forecasts weaker growth https://t.co/fd549cgmBY https://t.co/1ScvPEkQxe",1283963436175699968,https://www.reuters.com/article/us-netflix-results-idUSKCN24H35E?taid=5f1117bfc3d9480001c43af7&utm_campaign=trueAnthem%3A+Trending+Content&utm_medium=trueAnthem&utm_source=twitter,Fri Jul 17 03:15:12 +0000 2020
0,Reuters,BOK starts lending through special purpose vehicle to stabilize local debt market https://t.co/HyddGkMbjX https://t.co/cyDmASojuF,1283964650628042753,https://www.reuters.com/article/us-southkorea-economy-cenbank-idUSKCN24I03F?taid=5f1118e0c3d9480001c43afa&utm_campaign=trueAnthem%3A+Trending+Content&utm_medium=trueAnthem&utm_source=twitter,Fri Jul 17 03:20:02 +0000 2020
0,Reuters,A curious cow wandered into a police station in Queensland and even practiced social distancing by staying within t… https://t.co/PTkYTWWtlO,1283964642016899072,https://twitter.com/i/web/status/1283964642016899072,Fri Jul 17 03:20:00 +0000 2020
0,Reuters,"Hazardous tsunami waves possible for coasts located within 300 km of epicenter after earthquake of magnitude 7.3 strikes off Wau, Papua New Guinea - Pacific Tsunami Warning Center. More: https://t.co/xz1YN4KAon https://t.co/auSP4sjCFa",1283964677840490497,https://www.reuters.com/article/us-papua-quake/magnitude-7-3-strikes-off-wau-in-papua-new-guinea-usgs-idUSKCN24I0A1,Fri Jul 17 03:20:08 +0000 2020
0,Reuters,"Oil prices steady as clouds gather over fuel demand, looser supply curbs https://t.co/pu3XNa34yq https://t.co/PTyBY571DX",1283965905966444545,https://www.reuters.com/article/us-global-oil-idUSKCN24I06Z?taid=5f111a0c502a3e0001864537&utm_campaign=trueAnthem%3A+Trending+Content&utm_medium=trueAnthem&utm_source=twitter,Fri Jul 17 03:25:01 +0000 2020
0,Reuters,"U.S. shatters daily record for coronavirus infections with over 77,000 cases in a day https://t.co/KsPWbYJawp by @LisaLShumaker https://t.co/CbSr3akzrj",1283965949524271106,https://www.reuters.com/article/us-health-coronavirus-usa-records/u-s-shatters-coronavirus-record-with-over-77000-cases-in-a-day-idUSKCN24I014?utm_source=twitter&utm_medium=Social,Fri Jul 17 03:25:11 +0000 2020
0,Reuters,"Before hack tore through Twitter, online forum offered accounts for sale https://t.co/kC9te1fKqV https://t.co/ZZRZ77Aq2q",1283968425493225472,https://www.reuters.com/article/us-twitter-cyber-hackers-idUSKCN24H3HO?taid=5f111c64502a3e000186453f&utm_campaign=trueAnthem%3A+Trending+Content&utm_medium=trueAnthem&utm_source=twitter,Fri Jul 17 03:35:02 +0000 2020
0,Reuters,"Before a hacking campaign tore through Twitter and compromised some of its most high-profile users, an online forum offered accounts for sale https://t.co/FZyQbqRZJ1 by @razhael @josephmenn https://t.co/9jSmFHBuDg",1283968827051724802,https://www.reuters.com/article/us-twitter-cyber-hackers/before-hack-tore-through-twitter-online-forum-offered-accounts-for-sale-idUSKCN24H3HO?utm_medium=Social&utm_source=twitter,Fri Jul 17 03:36:38 +0000 2020
0,Reuters,"Bank of America saw its profit more than halve in the second quarter as it set aside $5 billion to cover potential loan losses, while warning that it would struggle as long as interest rates stayed low https://t.co/h69PkJit1F https://t.co/nxvzgImvvF",1283969675085438983,https://www.reuters.com/article/us-bank-of-america-results/bank-of-america-profit-slumps-as-heavy-loan-losses-loom-idUSKCN24H1LN,Fri Jul 17 03:40:00 +0000 2020
0,Reuters,'In the fight of our lives': Australia posts surge in new COVID-19 cases https://t.co/6QWv6SWvNc https://t.co/yFg6dnqeH9,1283969682849046531,https://www.reuters.com/article/us-health-coronavirus-australia-idUSKCN24I08U?taid=5f111d91502a3e0001864541&utm_campaign=trueAnthem%3A+Trending+Content&utm_medium=trueAnthem&utm_source=twitter,Fri Jul 17 03:40:02 +0000 2020
0,Reuters,China finance ministry says Jan-June fiscal revenues fell 10.8% year-on-year https://t.co/HDRAKMb2gI https://t.co/93rWMWu21y,1283970941131935746,https://www.reuters.com/article/us-china-economy-fiscal-revenues-idUSKCN24I07P?taid=5f111ebc502a3e0001864542&utm_campaign=trueAnthem%3A+Trending+Content&utm_medium=trueAnthem&utm_source=twitter,Fri Jul 17 03:45:02 +0000 2020
0,Reuters,The Trump administration is considering banning travel to the United States by all members of the Chinese Communist Party and their families: source https://t.co/YTtcdUEj7Z by @mattspetalnick https://t.co/Rxfb7yXetf,1283971056215228418,https://www.reuters.com/article/us-usa-china-travel/u-s-targets-all-chinese-communist-party-members-for-possible-travel-ban-source-idUSKCN24H2TQ?utm_source=twitter&utm_medium=Social,Fri Jul 17 03:45:29 +0000 2020
0,Reuters,Netflix shares tumbled more than 10 percent in after-hours trading after the company forecast weaker subscriber growth for the third quarter https://t.co/AJf4TPS9WZ https://t.co/D8TzSjY4R9,1283972191751725058,https://www.reuters.com/article/us-netflix-results/netflix-names-content-chief-ted-sarandos-co-ceo-forecasts-weaker-growth-idUSKCN24H35E,Fri Jul 17 03:50:00 +0000 2020
0,Reuters,India's coronavirus cases rise to 1 million https://t.co/UlNFGlgFuj,1283972757877743616,,Fri Jul 17 03:52:15 +0000 2020
0,Reuters,Aeromexico defaults on interest payments for two debt issuances https://t.co/fOOQQOaPt1 https://t.co/qtVCUiq6Rr,1283972975843254273,https://www.reuters.com/article/us-aeromexico-debt-idUSKCN24I040?taid=5f1120a1c3d9480001c43b12&utm_campaign=trueAnthem%3A+Trending+Content&utm_medium=trueAnthem&utm_source=twitter,Fri Jul 17 03:53:07 +0000 2020
0,Reuters,Firefighters put out flames aboard U.S. Navy ship in San Diego; vessel's future unknown https://t.co/fydDDFhkVN https://t.co/sqZoP9cm3O,1283974666365927424,https://www.reuters.com/article/us-usa-navy-fire-idUSKCN24H3GA?taid=5f112234c3d9480001c43b15&utm_campaign=trueAnthem%3A+Trending+Content&utm_medium=trueAnthem&utm_source=twitter,Fri Jul 17 03:59:50 +0000 2020
0,Reuters,Colorado and Arkansas joined a growing list of U.S. states mandating face masks in public places to combat a surge in coronavirus infections https://t.co/brIh02LvgL https://t.co/fqJYpMmVRP,1283974710305476609,https://www.reuters.com/article/us-health-coronavirus-usa/mixed-mask-mandates-u-s-states-issue-conflicting-orders-in-politicized-pandemic-idUSKCN24H2L1,Fri Jul 17 04:00:00 +0000 2020
0,Reuters,"China reports 10 new coronavirus cases in mainland, nearly all imported https://t.co/Pg0Pmzrq1u https://t.co/ZN0yq63q6X",1283975969762619392,https://www.reuters.com/article/us-health-coronavirus-china-cases-idUSKCN24I00Y?taid=5f11236bc3d9480001c43b28&utm_campaign=trueAnthem%3A+Trending+Content&utm_medium=trueAnthem&utm_source=twitter,Fri Jul 17 04:05:00 +0000 2020
0,Reuters,Queen to knight 100-year-old UK fundraiser Captain Tom on Friday https://t.co/pFUQBbpu29 https://t.co/MUeKNs5Ps9,1283975975223599107,https://www.reuters.com/article/us-britain-royals-veteran-idUSKCN24H3GI?taid=5f11236c977e0100010f05f6&utm_campaign=trueAnthem%3A+Trending+Content&utm_medium=trueAnthem&utm_source=twitter,Fri Jul 17 04:05:02 +0000 2020
0,Reuters,"UPDATE: Quake of magnitude 7.3 hits Papua New Guinea, tsunami warning briefly issued https://t.co/xEQLpVvuuy https://t.co/8aZuxcT1hS",1283976328165724160,https://www.reuters.com/article/us-papua-quake/magnitude-7-3-strikes-off-wau-in-papua-new-guinea-usgs-idUSKCN24I0A1,Fri Jul 17 04:06:26 +0000 2020
0,Reuters,"UPDATE: Earthquake of magnitude 7.0 hits Papua New Guinea, tsunami risk fades https://t.co/TPXMrk4tSI https://t.co/iHk0J42LUS",1283979347460632578,https://www.reuters.com/article/us-papua-quake/quake-of-magnitude-7-3-hits-papua-new-guinea-tsunami-warning-briefly-issued-idUSKCN24I0A1,Fri Jul 17 04:18:26 +0000 2020
0,Reuters,U.S. judge approves transfer of jailed former VW executive to Germany https://t.co/KvzWBQafoH https://t.co/oljpfpYDoh,1283980793191292933,https://www.reuters.com/article/us-volkswagen-emissions-idUSKCN24H367?taid=5f1127e9977e0100010f0600&utm_campaign=trueAnthem%3A+Trending+Content&utm_medium=trueAnthem&utm_source=twitter,Fri Jul 17 04:24:10 +0000 2020
0,Reuters,"Asia stocks rebound, hopes of more stimulus offset virus worries https://t.co/QiJ18XyNFu https://t.co/Mo8wfCi2fX",1283982204587192321,https://www.reuters.com/article/us-global-markets-idUSKCN24H3I2?taid=5f11293ac3d9480001c43b32&utm_campaign=trueAnthem%3A+Trending+Content&utm_medium=trueAnthem&utm_source=twitter,Fri Jul 17 04:29:47 +0000 2020
0,Reuters,"Activist @GretaThunberg called on European leaders to take emergency action on climate change, and accused some people in power of ‘giving up’ on the possibility of handing over a decent future to coming generations https://t.co/OvN5nPdhsD https://t.co/2ZVR4UupG8",1283982258060353537,https://www.reuters.com/article/us-climate-change-greta/greta-thunberg-world-must-tear-up-old-systems-contracts-to-tackle-climate-idUSKCN24H1KQ,Fri Jul 17 04:30:00 +0000 2020
