,name,text,id,url,created_at
0,Reuters,California blames PG&amp;E for Kincade wildfire in wine country https://t.co/O8O1Gx1CzC https://t.co/YcCA4AGJ3F,1283983524241039361,https://www.reuters.com/article/us-pg-e-us-california-wildfire-idUSKCN24H3II?taid=5f112a74502a3e0001864567&utm_campaign=trueAnthem%3A+Trending+Content&utm_medium=trueAnthem&utm_source=twitter,Fri Jul 17 04:35:02 +0000 2020
0,Reuters,Volkswagen sees mild growth in China's premium car segment this year https://t.co/R7oIdzbP04 https://t.co/qn0Pi95HSW,1283984388854820865,https://www.reuters.com/article/us-volkswagen-china-idUSKCN24I0BW?taid=5f112b42c3d9480001c43b3c&utm_campaign=trueAnthem%3A+Trending+Content&utm_medium=trueAnthem&utm_source=twitter,Fri Jul 17 04:38:28 +0000 2020
0,Reuters,Fauci implores young people to stay vigilant on coronavirus risk https://t.co/W8031BOODe https://t.co/j0rvGENIZR,1283986039137337350,https://www.reuters.com/article/us-health-coronavirus-facebook-fauci-idUSKCN24H3F9?taid=5f112cccc3d9480001c43b3f&utm_campaign=trueAnthem%3A+Trending+Content&utm_medium=trueAnthem&utm_source=twitter,Fri Jul 17 04:45:01 +0000 2020
0,Reuters,"Meet Atanasio, the first white rhino calf born in Latin America during the shutdown https://t.co/BsmeTFhbZW",1283987291124326400,,Fri Jul 17 04:50:00 +0000 2020
0,Reuters,Philippines to allow some foreigners to enter country from August https://t.co/wNFQbySYcP https://t.co/U0bxOrWJtX,1283987299873816576,https://www.reuters.com/article/us-health-coronavirus-philippines-travel-idUSKCN24I09D?taid=5f112df8502a3e000186456b&utm_campaign=trueAnthem%3A+Trending+Content&utm_medium=trueAnthem&utm_source=twitter,Fri Jul 17 04:50:02 +0000 2020
0,Reuters,"COVID-19, electric vehicles to reshape Thailand’s auto industry https://t.co/0UeuFgflQJ https://t.co/BcGMK8cSig",1283988556466327552,https://www.reuters.com/article/us-thailand-autos-idUSKCN24I009?taid=5f112f24977e0100010f0613&utm_campaign=trueAnthem%3A+Trending+Content&utm_medium=trueAnthem&utm_source=twitter,Fri Jul 17 04:55:01 +0000 2020
0,Reuters,Real Madrid has beaten Barcelona to the La Liga title for the first time in three years. @Rich9908 explains how they did it https://t.co/6v8QFyfjdL https://t.co/GlIx4TNYSm,1283989808235212804,https://www.reuters.com/article/us-soccer-spain-mad-vil-report/real-madrid-seal-spanish-title-with-win-over-villarreal-idUSKCN24H39X,Fri Jul 17 05:00:00 +0000 2020
0,Reuters,"United Airlines, pilots union reach creative deal to limit furloughs https://t.co/I7ttw9Lucp https://t.co/1wlrBbR36R",1283989827948617728,https://www.reuters.com/article/us-health-coronavirus-united-arlns-jobs-idUSKCN24I0DB?taid=5f113052c3d9480001c43b49&utm_campaign=trueAnthem%3A+Trending+Content&utm_medium=trueAnthem&utm_source=twitter,Fri Jul 17 05:00:05 +0000 2020
0,Reuters,Microsoft trims jobs as it enters new fiscal year https://t.co/Yv0jMBF2SX https://t.co/LXFFKYsXRr,1283991071891103744,https://www.reuters.com/article/us-microsoft-layoffs-idUSKCN24I03A?taid=5f11317c977e0100010f061d&utm_campaign=trueAnthem%3A+Trending+Content&utm_medium=trueAnthem&utm_source=twitter,Fri Jul 17 05:05:01 +0000 2020
0,Reuters,India tops a million coronavirus cases as pandemic hits villages https://t.co/ZSl5qlmmrS by @zebatweets https://t.co/vgcEb5z5Tx,1283992777211039744,https://www.reuters.com/article/us-health-coronavirus-india/india-tops-a-million-coronavirus-cases-as-pandemic-hits-villages-idUSKCN24I0EI,Fri Jul 17 05:11:48 +0000 2020
0,Reuters,"Jailed executive in Wirecard scandal offers confession, lawyer says https://t.co/RzJH97hwhX https://t.co/sCUuQTmq4Z",1283993589387755522,https://www.reuters.com/article/us-wirecard-accounts-idUSKCN24H35T?taid=5f1133d4c3d9480001c43b64&utm_campaign=trueAnthem%3A+Trending+Content&utm_medium=trueAnthem&utm_source=twitter,Fri Jul 17 05:15:01 +0000 2020
0,Reuters,"Twitter says hackers targeted about 130 accounts during the cyber attack this week, an incident in which profiles of many prominent personalities and organizations were compromised https://t.co/LgHbfcL6XP https://t.co/rPPCiyifDQ",1283993827376758785,https://www.reuters.com/article/us-twitter-cyber/twitter-says-about-130-accounts-were-targeted-in-cyber-attack-this-week-idUSKCN24I0EV?utm_medium=Social&utm_source=twitter,Fri Jul 17 05:15:58 +0000 2020
0,Reuters,"Germany's confirmed coronavirus cases rise by 583 to 200,843: RKI https://t.co/2kByhVpP78 https://t.co/QBTMeDvMRp",1283994847284797447,https://www.reuters.com/article/us-health-coronavirus-germany-cases-idUSKCN24I09Z?taid=5f113500c3d9480001c43b68&utm_campaign=trueAnthem%3A+Trending+Content&utm_medium=trueAnthem&utm_source=twitter,Fri Jul 17 05:20:01 +0000 2020
0,Reuters,Japan's Prime Minister Shinzo Abe faces anger over backflip on coronavirus-spurred tourism subsidy https://t.co/KInoVI5Rx0 @sakmurakami https://t.co/ssBhLZWBVJ,1283994937835565056,https://www.reuters.com/article/us-health-coronavirus-japan/japans-abe-faces-anger-over-backflip-on-coronavirus-spurred-tourism-subsidy-idUSKCN24I08G?utm_source=twitter&utm_medium=Social,Fri Jul 17 05:20:23 +0000 2020
0,Reuters,British Airways retires entire fleet of Boeing's jumbo jets https://t.co/ZuJmFWFtjd https://t.co/2Jxozx3ytL,1283996107803156485,https://www.reuters.com/article/us-health-coronavirus-iag-idUSKCN24I04J?taid=5f11362c502a3e0001864586&utm_campaign=trueAnthem%3A+Trending+Content&utm_medium=trueAnthem&utm_source=twitter,Fri Jul 17 05:25:02 +0000 2020
0,Reuters,'In the fight of our lives': Australia posts surge in new COVID-19 cases https://t.co/XEees7QljL by @Colpackham https://t.co/5ZSpdB8cWq,1283996535647350787,https://www.reuters.com/article/us-health-coronavirus-australia/in-the-fight-of-our-lives-australia-posts-surge-in-new-covid-19-cases-idUSKCN24I08U?utm_medium=Social&utm_source=twitter,Fri Jul 17 05:26:44 +0000 2020
0,Reuters,Israel sets new weekend shutdown to fight coronavirus surge https://t.co/hlXKXavkpS https://t.co/RqXk0Pa54h,1283997369852399618,https://www.reuters.com/article/us-health-coronavirus-israel-idUSKCN24I0ET?taid=5f113759c3d9480001c43b6e&utm_campaign=trueAnthem%3A+Trending+Content&utm_medium=trueAnthem&utm_source=twitter,Fri Jul 17 05:30:03 +0000 2020
0,Reuters,Hitachi is moving to scrap a remnant of one of Japan Inc’s most famous practices: seniority-based pay https://t.co/D2xzxMQPAu https://t.co/BABxcUjuq3,1283997788993318913,https://www.reuters.com/article/us-hitachi-pay/with-shift-toward-merit-based-pay-japans-hitachi-to-drop-old-ways-idUSKCN24H3CW?utm_medium=Social&utm_source=twitter,Fri Jul 17 05:31:43 +0000 2020
0,Reuters,"Dollar supported by virus fears, euro awaits word on stimulus https://t.co/XpUXWhtmp3 https://t.co/DnLQoPPgpF",1283999881078734848,https://www.reuters.com/article/uk-global-forex-idUSKCN24I031?taid=5f1139b0502a3e0001864591&utm_campaign=trueAnthem%3A+Trending+Content&utm_medium=trueAnthem&utm_source=twitter,Fri Jul 17 05:40:01 +0000 2020
0,Reuters,Coronavirus surge and renewed lockdowns fan fresh worries about global fuel demand https://t.co/XRWzWbIO6B by @aghaddar @StephanieKellyM @LauraSanicola https://t.co/7mwU0fsTFt,1284000109710192642,https://www.reuters.com/article/us-global-oil-demand-gasoline/coronavirus-surge-renewed-lockdowns-fan-fresh-worries-about-global-fuel-demand-idUSKCN24I0GR?utm_medium=Social&utm_source=twitter,Fri Jul 17 05:40:56 +0000 2020
0,Reuters,China's Wuhan declares red alert as floods disrupt supply chains https://t.co/EQwgD9X2az https://t.co/C1ArEmBIVG,1284001141295132676,https://www.reuters.com/article/us-china-weather-floods-idUSKCN24I0G0?taid=5f113adc977e0100010f0630&utm_campaign=trueAnthem%3A+Trending+Content&utm_medium=trueAnthem&utm_source=twitter,Fri Jul 17 05:45:02 +0000 2020
0,Reuters,"Netflix elevated its content chief Ted Sarandos to co-CEO, as the company forecast its subscriber growth during the coronavirus pandemic would slow even more than Wall Street expected during the third quarter https://t.co/AJf4TPAyyp https://t.co/gcpzMqCfJO",1284002390878728193,https://www.reuters.com/article/us-netflix-results/netflix-names-content-chief-ted-sarandos-co-ceo-forecasts-weaker-growth-idUSKCN24H35E,Fri Jul 17 05:50:00 +0000 2020
0,Reuters,"Japan June exports seen tumbling again, CPI drop to keep deflation fears alive: Reuters poll https://t.co/5PZvmQrGJV https://t.co/lM76YuPp3A",1284002397912805376,https://www.reuters.com/article/us-japan-economy-trade-idUSKCN24I0F7?taid=5f113c08977e0100010f0632&utm_campaign=trueAnthem%3A+Trending+Content&utm_medium=trueAnthem&utm_source=twitter,Fri Jul 17 05:50:01 +0000 2020
0,Reuters,Australia's Victoria sets record for new COVID-19 cases second day in a row https://t.co/GOksX4MNWZ https://t.co/N9ezCh90xt,1284003655423864833,https://www.reuters.com/article/us-health-coronavirus-australia-state-idUSKCN24I062?taid=5f113d34c3d9480001c43b7c&utm_campaign=trueAnthem%3A+Trending+Content&utm_medium=trueAnthem&utm_source=twitter,Fri Jul 17 05:55:01 +0000 2020
0,Reuters,"More U.S. states are issuing face-mask mandates as coronavirus cases rise, but Georgia’s governor barred such measures from being imposed at the local level https://t.co/brIh02LvgL https://t.co/coMnm0ZDok",1284004908279136257,https://www.reuters.com/article/us-health-coronavirus-usa/mixed-mask-mandates-u-s-states-issue-conflicting-orders-in-politicized-pandemic-idUSKCN24H2L1,Fri Jul 17 06:00:00 +0000 2020
0,Reuters,"U.S. shatters daily record for coronavirus infections with over 77,000 cases in a day https://t.co/9BBoYVIVAO via @LisaLShumaker https://t.co/YFTIODRimR",1284006015432826880,https://www.reuters.com/article/us-health-coronavirus-usa-records/u-s-shatters-coronavirus-record-with-over-77000-cases-in-a-day-idUSKCN24I014?utm_source=twitter&utm_medium=Social,Fri Jul 17 06:04:24 +0000 2020
0,Reuters,"Surges in coronavirus infections are slowing a recovery in fuel use from the doldrums of lockdowns, fanning worries that it could be years before consumption rebounds from the impact of the pandemic https://t.co/cxaL67qIq8 by @aghaddar @StephanieKellyM @LauraSanicola https://t.co/C2ImpEzojq",1284006812589621248,https://www.reuters.com/article/us-global-oil-demand-gasoline/coronavirus-surge-renewed-lockdowns-fan-fresh-worries-about-global-fuel-demand-idUSKCN24I0GR?utm_source=twitter&utm_medium=Social,Fri Jul 17 06:07:34 +0000 2020
0,Reuters,"Mexico reports 324,041 total cases of coronavirus, 37,574 deaths https://t.co/XurkRMEaJf https://t.co/3r7g4x85eJ",1284007432042287105,https://www.reuters.com/article/us-health-coronavirus-mexico-idUSKCN24I01G?taid=5f1140b8977e0100010f0641&utm_campaign=trueAnthem%3A+Trending+Content&utm_medium=trueAnthem&utm_source=twitter,Fri Jul 17 06:10:02 +0000 2020
0,Reuters,Anthony Fauci implores young people to continue social distancing and other measures to curtail spread of the novel coronavirus https://t.co/roQKitqMl2 https://t.co/u3T7lbMNqy,1284009545359142915,https://www.reuters.com/article/us-health-coronavirus-facebook-fauci/fauci-implores-young-people-to-stay-vigilant-on-coronavirus-risk-idUSKCN24H3F9?utm_source=twitter&utm_medium=Social,Fri Jul 17 06:18:26 +0000 2020
0,Reuters,Some K-pop stars’ accounts have been blocked from view on TikTok’s China version https://t.co/8EjfHU48Z7 https://t.co/QPRa8tdMOh,1284011101601046529,https://www.reuters.com/article/us-tiktok-china-kpop/some-k-pop-stars-tiktok-china-accounts-blocked-from-view-idUSKCN24I0LD?utm_medium=Social&utm_source=twitter,Fri Jul 17 06:24:37 +0000 2020
0,Reuters,EU's greenhouse gas strategy fails to plug methane hole https://t.co/hHw2nNA52g https://t.co/Wr7ZJ15G25,1284012469208350721,https://www.reuters.com/article/us-eu-energy-methane-insight-idUSKCN24I0IV?taid=5f114569977e0100010f0645&utm_campaign=trueAnthem%3A+Trending+Content&utm_medium=trueAnthem&utm_source=twitter,Fri Jul 17 06:30:03 +0000 2020
0,Reuters,"Morgan Stanley posted record quarterly profits and sales despite the economic turmoil. But at rival Bank of America, quarterly profits were slashed in half as it took a hit due to weakness in consumer lending https://t.co/h69PkJit1F https://t.co/G23FVCRzO0",1284014973685989377,https://www.reuters.com/article/us-bank-of-america-results/bank-of-america-profit-slumps-as-heavy-loan-losses-loom-idUSKCN24H1LN,Fri Jul 17 06:40:00 +0000 2020
0,Reuters,Deutsche Boerse proposes new rules for quick DAX expulsion in wake of Wirecard https://t.co/aKzPWT5B2K https://t.co/Z1Vj5z2CsD,1284014980912877569,https://www.reuters.com/article/us-wirecard-accounts-dax-idUSKCN24I0KJ?taid=5f1147c0977e0100010f064f&utm_campaign=trueAnthem%3A+Trending+Content&utm_medium=trueAnthem&utm_source=twitter,Fri Jul 17 06:40:01 +0000 2020
0,Reuters,"Gold steadies near $1,800 on virus fears, U.S.-China spat https://t.co/78MxOLguOS https://t.co/kO4yXLE2HA",1284016238453313537,https://www.reuters.com/article/global-precious-idINKCN24I0B6?taid=5f1148ecc3d9480001c43ba7&utm_campaign=trueAnthem%3A+Trending+Content&utm_medium=trueAnthem&utm_source=twitter,Fri Jul 17 06:45:01 +0000 2020
0,Reuters,The Trump administration is considering banning travel to the United States by all members of the Chinese Communist Party and their families: source https://t.co/NOHtZqU4bZ via @mattspetalnick https://t.co/B6BvwqNZJS,1284016239606665216,https://www.reuters.com/article/us-usa-china-travel/u-s-targets-all-chinese-communist-party-members-for-possible-travel-ban-source-idUSKCN24H2TQ?utm_source=twitter&utm_medium=Social,Fri Jul 17 06:45:02 +0000 2020
0,Reuters,Arizona and Texas counties hit hard by COVID-19 are ordering coolers and refrigerated trailers to store bodies as their morgues fill up https://t.co/rhBBMGnxc5 via @theblueroute https://t.co/kffXzUMVss,1284017012893769728,https://www.reuters.com/article/us-health-coronavirus-usa-casualties/pandemic-hit-arizona-texas-counties-order-coolers-refrigerated-trucks-for-bodies-idUSKCN24H3HK?utm_source=twitter&utm_medium=Social,Fri Jul 17 06:48:06 +0000 2020
0,Reuters,China finance ministry says Jan-June fiscal revenues fell 10.8% year-on-year https://t.co/TpbCeIXHJP https://t.co/GX4qcQMBw7,1284018756478472195,https://www.reuters.com/article/us-china-economy-fiscal-revenues-idUSKCN24I07P?taid=5f114b44c3d9480001c43bac&utm_campaign=trueAnthem%3A+Trending+Content&utm_medium=trueAnthem&utm_source=twitter,Fri Jul 17 06:55:02 +0000 2020
0,Reuters,"At EU summit, Italy will fight changes to Recovery Fund, minister says https://t.co/vg8nOg4QUy https://t.co/scPN8xgdLr",1284018758470729729,https://www.reuters.com/article/us-eu-italy-idUSKCN24I0KT?taid=5f114b45c3d9480001c43bad&utm_campaign=trueAnthem%3A+Trending+Content&utm_medium=trueAnthem&utm_source=twitter,Fri Jul 17 06:55:02 +0000 2020
0,Reuters,What you need to know about the coronavirus right now https://t.co/MUvXO7PxMo https://t.co/jifjbwByha,1284020037016260610,https://www.reuters.com/article/us-health-coronavirus-snapshot-idUSKCN24I0KX?taid=5f114c75977e0100010f065e&utm_campaign=trueAnthem%3A+Trending+Content&utm_medium=trueAnthem&utm_source=twitter,Fri Jul 17 07:00:07 +0000 2020
0,Reuters,Australian researchers invent 20-minute coronavirus blood test https://t.co/C8JKgm6dFy https://t.co/QQcxyJUL8i,1284020537476419584,https://www.reuters.com/article/us-health-coronavirus-research/australian-researchers-invent-20-minute-coronavirus-blood-test-idUSKCN24I0OR?utm_medium=Social&utm_source=twitter&__twitter_impression=true,Fri Jul 17 07:02:06 +0000 2020
0,Reuters,"Pandemic-hit Arizona, Texas counties order coolers, refrigerated trucks for bodies https://t.co/PgZ9PWs2YT https://t.co/1SGieOOe3B",1284022523353534464,https://www.reuters.com/article/us-health-coronavirus-usa-casualties/pandemic-hit-arizona-texas-counties-order-coolers-refrigerated-trucks-for-bodies-idUSKCN24H3HK,Fri Jul 17 07:10:00 +0000 2020
0,Reuters,"Ericsson second-quarter core profit beats, margins improve on telecom equipment sales https://t.co/9dm0k6akpp https://t.co/ju6pEY7z26",1284022528965586944,https://www.reuters.com/article/us-ericsson-results-idUSKCN24I0IL?taid=5f114ec8977e0100010f0667&utm_campaign=trueAnthem%3A+Trending+Content&utm_medium=trueAnthem&utm_source=twitter,Fri Jul 17 07:10:01 +0000 2020
0,Reuters,Plane carrying ex-Pemex boss facing corruption charges lands in Mexico: Mexican media https://t.co/keXvWjDFFQ https://t.co/IuM5VDz9sA,1284023791249760257,https://www.reuters.com/article/us-mexico-corruption-idUSKCN24I0MP?taid=5f114ff4502a3e0001c83131&utm_campaign=trueAnthem%3A+Trending+Content&utm_medium=trueAnthem&utm_source=twitter,Fri Jul 17 07:15:02 +0000 2020
0,Reuters,CCTV footage shows a cow wandering off the streets and into a police station in Queensland https://t.co/xKh5UqpZqX,1284025039906635776,,Fri Jul 17 07:20:00 +0000 2020
0,Reuters,Australian mining magnate Clive Palmer charged over alleged fraud https://t.co/yXEpJLNoEx https://t.co/HEL7XGWRL1,1284025045501739010,https://www.reuters.com/article/us-australia-palmer-idUSKCN24I0JB?taid=5f115120502a3e0001c83132&utm_campaign=trueAnthem%3A+Trending+Content&utm_medium=trueAnthem&utm_source=twitter,Fri Jul 17 07:20:01 +0000 2020
0,Reuters,"RT @ReutersGraphics: Still, we'll see whether the EU recovery effort will be enough to restore regional economies' health, and whether it can compensate for the difference in scale between the national aid packages of the wealthiest EU members. https://t.co/VQRQvtTM9JStill, we'll see whether the EU recovery effort will be enough to restore regional economies' health, and whether i… https://t.co/vOUhB3Gyqj",1284025962863222786,https://twitter.com/i/web/status/1283843653618798592,Fri Jul 17 07:23:40 +0000 2020
0,Reuters,"RT @ReutersGraphics: Follow @Reuters for more coverage of the summit starting tomorrow and read the whole story on the Euro safety nets being discussed. 

by @OvaskaOvaska @reutersJanS and Balazs Koranyi

https://t.co/ICNkCblE3J",1284025980051501056,https://graphics.reuters.com/EU-RECOVERY/jznvnzwomvl/index.html,Fri Jul 17 07:23:44 +0000 2020
0,Reuters,India's coronavirus cases cross 1 million https://t.co/IywGSxVmqn https://t.co/UWnVbnzlsn,1284026305059512321,https://www.reuters.com/article/us-health-coronavirus-india-idUSKCN24I0DW?taid=5f11524cc3d9480001c43bcf&utm_campaign=trueAnthem%3A+Trending+Content&utm_medium=trueAnthem&utm_source=twitter,Fri Jul 17 07:25:01 +0000 2020
0,Reuters,"RT @ReutersGraphics: Let's talk about 💶 and 📉. 1/€

Starting tomorrow, 🇪🇺 EU member states will meet to agree on the terms of a recovery fund designed to help their economies balance the deficit left by the COVID-19 pandemic.

https://t.co/ICNkCblE3J https://t.co/geky9WG48j",1284026412538695680,https://graphics.reuters.com/EU-RECOVERY/jznvnzwomvl/index.html,Fri Jul 17 07:25:27 +0000 2020
0,Reuters,"RT @reuterspictures: A woman cries as she watches people being detained on the Brooklyn Bridge just outside the 'City Hall Autonomous Zone' in support of Black Lives Matter in Manhattan, New York. More photos of protests across the country: https://t.co/ARDMDMZG54 📷 @carloallegri https://t.co/8dKUXPVFye",1284027247297548288,https://www.reuters.com/news/picture/protests-against-racial-inequality-sweep-idUSRTS3K8DT,Fri Jul 17 07:28:46 +0000 2020
0,Reuters,RT @reuterspictures: The first visitors arrive at Disneyland Paris as the theme park reopens its doors to the public in Marne-la-Vallee. More photos of the day: https://t.co/DVcPW2Ctt2 📷 @PlatiauCharles https://t.co/dgturNG39D,1284027264284479489,https://www.reuters.com/news/picture/top-photos-of-the-day-idUSRTS3K44P,Fri Jul 17 07:28:50 +0000 2020
0,Reuters,"RT @reuterspictures: Passengers sit separated from their neighbors by a curtain on a bus in Lima, Peru. More images of life in the age of coronavirus: https://t.co/ersKmJ6DPw 📷 Sebastian Castaneda https://t.co/ukRV3WkfwD",1284027281053229059,https://www.reuters.com/news/picture/life-in-the-age-of-coronavirus-idUSRTS3K8EP,Fri Jul 17 07:28:54 +0000 2020
0,Reuters,"RT @reuterspictures: Atanasio, a 10-day-old white rhino calf and the first white rhino born in captivity in Latin America, stands next to his mother Hanna at Buin Zoo in Santiago, Chile. More photos of the day: https://t.co/9nbtcYJvmZ 📷 Pablo Sanhueza https://t.co/NI8MgRfwZI",1284027297910194176,https://www.reuters.com/news/picture/top-photos-of-the-day-idUSRTS3K44P,Fri Jul 17 07:28:58 +0000 2020
0,Reuters,"RT @reuterspictures: Children cool off during a hot day on the Mexican side of the Rio Bravo near the fence marking the U.S.-Mexico border, as pictured from Ciudad Juarez, Mexico. More photos of the day: https://t.co/MbcogXOfTp 📷 Jose Luis Gonzalez https://t.co/EYVPyKKjOX",1284027306189758464,https://www.reuters.com/news/picture/top-photos-of-the-day-idUSRTS3K44P,Fri Jul 17 07:29:00 +0000 2020
0,Reuters,"RT @reuterspictures: Fireworks explode near the Eiffel Tower, in a picture taken from the Montparnasse Tower Observation Deck, at the end of Bastille Day celebrations in Paris, France. More photos of the week: https://t.co/sSQhyPLHnI 📷 @PlatiauCharles https://t.co/akQRBPpFoj",1284027316709064704,https://www.reuters.com/news/picture/photos-of-the-week-idUSRTS3K63M,Fri Jul 17 07:29:03 +0000 2020
0,Reuters,"RT @ReutersGraphics: So, to address a financial crisis of this scale, the proposed funding mechanisms are also MASSIVE.

The overall value of support on offer, combined with access to trillions of euros of cheap loans and new EU-level funding still under debate, will amount to over 10 TRILLION EUROS. https://t.co/TVvkGdLIHQSo, to address a financial crisis of this scale, the proposed funding mechanisms are also MASSIVE.

The overall val… https://t.co/CBKsvTDYxN",1284027494056763392,https://twitter.com/i/web/status/1283843646702399489,Fri Jul 17 07:29:45 +0000 2020
0,Reuters,RT @ReutersGraphics: One of the more novel parts of the EU's relief proposal would see the European Commission borrowing money on the market against EU government guarantees to give outright grants to member states (as opposed to just loans). https://t.co/ZB8QabKbnBOne of the more novel parts of the EU's relief proposal would see the European Commission borrowing money on the ma… https://t.co/g1Si6ZM61b,1284027524809400320,https://twitter.com/i/web/status/1283843649881739265,Fri Jul 17 07:29:52 +0000 2020
0,Reuters,Westpac says regulator-ordered report finds governance 'immature and reactive' https://t.co/EJdk0C8Trd https://t.co/3TMy0WHx6R,1284027570028249090,https://www.reuters.com/article/us-westpac-restructuring-idUSKCN24I02E?taid=5f115379502a3e0001c83136&utm_campaign=trueAnthem%3A+Trending+Content&utm_medium=trueAnthem&utm_source=twitter,Fri Jul 17 07:30:03 +0000 2020
0,Reuters,"Exclusive: EU stimulus funds attract 1,000-plus green projects https://t.co/Z9cv0NQLjF https://t.co/1wJt0wRO4w",1284030083666247680,https://www.reuters.com/article/us-climate-change-eu-exclusive-idUSKCN24I0Q5?taid=5f1155d0977e0100010f0678&utm_campaign=trueAnthem%3A+Trending+Content&utm_medium=trueAnthem&utm_source=twitter,Fri Jul 17 07:40:02 +0000 2020
0,Reuters,"Buildings collapse in heavy rain in India's Mumbai, killing eight https://t.co/3zNATsAS7X https://t.co/wOrgRGxJrb",1284031340753682433,https://www.reuters.com/article/us-india-collapse-mumbai-idUSKCN24I0NW?taid=5f1156fd502a3e0001c8313d&utm_campaign=trueAnthem%3A+Trending+Content&utm_medium=trueAnthem&utm_source=twitter,Fri Jul 17 07:45:02 +0000 2020
0,Reuters,Factbox: Latest on the worldwide spread of the coronavirus https://t.co/4UAu0K7u1m https://t.co/2AIXwSlgYW,1284032598205964288,https://www.reuters.com/article/us-health-coronavirus-latest-factbox-idUSKCN24I0JW?taid=5f115828502a3e0001c83140&utm_campaign=trueAnthem%3A+Trending+Content&utm_medium=trueAnthem&utm_source=twitter,Fri Jul 17 07:50:02 +0000 2020
0,Reuters,"China's Wuhan declares red alert as floods disrupt supply chains, including crucial personal protective equipment for fighting the coronavirus https://t.co/nzmzTDzBv8 by @DavidStanway https://t.co/LXfKdZ55Lx",1284032800929316866,https://www.reuters.com/article/us-china-weather-floods/chinas-wuhan-declares-red-alert-as-floods-disrupt-supply-chains-idUSKCN24I0G0?utm_medium=Social&utm_source=twitter,Fri Jul 17 07:50:50 +0000 2020
0,Reuters,RT @ReutersUK: Prime Minister Boris Johnson is to pour 3 billion pounds into #NHS to try to ward off any resurgence of the coronavirus https://t.co/FPgxfTmbyY,1284033427218542592,https://uk.reuters.com/article/uk-health-coronavirus-britain-johnson/uk-boosts-healthcare-funding-to-ward-off-winter-covid-19-wave-idUKKCN24H3B4?utm_source=twitter&utm_medium=Social,Fri Jul 17 07:53:19 +0000 2020
0,Reuters,"Heavy rains lashing India’s financial capital of Mumbai have caused the collapse of a multi-storey building, killing six people and injuring several https://t.co/uJlRAFGE1b https://t.co/3HDIsPDUPY",1284033490380562433,https://www.reuters.com/article/us-india-collapse-mumbai/buildings-collapse-in-heavy-rain-in-indias-mumbai-killing-eight-idUSKCN24I0NW?il=0&utm_source=twitter&utm_medium=Social,Fri Jul 17 07:53:34 +0000 2020
0,Reuters,Philippines to allow some foreigners to enter country from August https://t.co/dj7wu1iX85 https://t.co/Yq1vgBPmFO,1284034979308150787,https://www.reuters.com/article/us-health-coronavirus-philippines-travel-idUSKCN24I09D?taid=5f115a60c3d9480001c43be3&utm_campaign=trueAnthem%3A+Trending+Content&utm_medium=trueAnthem&utm_source=twitter,Fri Jul 17 07:59:29 +0000 2020
