,name,text,id,url,created_at
0,ABC,"RT @ABCNewsLive: Dr. @johnbrownstein breaks down what you need to know about coronavirus testing in the United States. https://t.co/elpAEkbT2Z

""The gold standard that we're looking for right now are those PCR tests, even though those are in short supply."" https://t.co/QYi9hL4Odf",1296962478283337728,https://abcnews.go.com/US/coronavirus-updates-cdc-director-biggest-fear-flu-covid/story?id=72509514&cid=clicksource_4380645_8_heads_posts_card_hed,Sat Aug 22 00:08:45 +0000 2020
0,ABC,"NEW ADDITION: Mei Xiang, the 22-year-old giant panda, gave birth to the cub on Friday at 6:35 p.m., according to the National Zoo. https://t.co/gaR4fKR4rS https://t.co/ZHp2XM05uW",1296963268255330305,https://abcnews.go.com/US/national-zoo-announces-birth-giant-panda-cub/story?id=72534187&cid=social_twitter_abcn,Sat Aug 22 00:11:54 +0000 2020
0,ABC,"“I would shut it down. I would listen to the scientists.”

Joe Biden tells @DavidMuir in an exclusive interview that as president, he would shut the country down to stop the spread of COVID-19 if the move was recommended by scientists. https://t.co/2A9r07d7EC https://t.co/e8yTrT9G56",1296975372916084737,https://abcnews.go.com/Politics/biden-abcs-david-muir-shut-country-prevent-spread/story?id=72519690,Sat Aug 22 01:00:00 +0000 2020
0,ABC,Who will win in November? See how the Electoral College could play out with @ABC News' 2020 interactive election map: https://t.co/PaCusr83Tb https://t.co/IvmZl80SG5,1296975375398891521,https://abcnews.go.com/Politics/2020-Electoral-Interactive-Map,Sat Aug 22 01:00:00 +0000 2020
0,ABC,STREAMING NOW: Complete live coverage of #DemConvention is available for all @Hulu subscribers via @ABCNewsLive. https://t.co/1Lsb8aRooV https://t.co/U29TIzj8mr,1296977921681358849,https://www.hulu.com/welcome?cid=social_twitter_abcn,Sat Aug 22 01:10:07 +0000 2020
0,ABC,"WELCOME HOME: The National Zoo in Washington, D.C., announced a small bundle of good news amid the coronavirus pandemic.

Mei Xiang, the 22-year-old giant panda, gave birth to the cub on Friday at 6:35 p.m., according to the National Zoo. https://t.co/6ZkLLzq7hC https://t.co/IqaZyuq0ta",1296986085843771392,https://abcnews.go.com/US/national-zoo-announces-birth-giant-panda-cub/story?id=72534187&cid=social_twitter_abcn,Sat Aug 22 01:42:34 +0000 2020
0,ABC,"NEW ADDITION: The National Zoo in Washington, D.C., announced a small bundle of good news amid the coronavirus pandemic.

Mei Xiang, the 22-year-old giant panda, gave birth to the cub on Friday at 6:35 p.m., according to the National Zoo. https://t.co/lL6MXNcsBk https://t.co/XCvD0ea31h",1296987156578275328,https://abcnews.go.com/US/national-zoo-announces-birth-giant-panda-cub/story?id=72534187,Sat Aug 22 01:46:49 +0000 2020
0,ABC,"EXCLUSIVE: Asked about Pres. Trump's charge that he wants to ""defund the police,"" Joe Biden tells @RobinRoberts, ""No I don't""—and counters that the Trump administration has proposed cutting a federal program that helps hire more local law enforcement. https://t.co/HOks1fmoGv https://t.co/5XlRrdkjOo",1296990473186234369,https://abcnews.go.com/Politics/biden-abcs-robin-roberts-dont-defund-police-trump/story?id=72524405,Sat Aug 22 02:00:00 +0000 2020
0,ABC,The first-ever virtual convention is complete. https://t.co/VvrJCUlWnp,1296994261423005702,https://abcnews.go.com/Politics/note-democrats-cast-virtual-virtue-convention-ends/story?id=72503744&cid=social_twitter_abcn,Sat Aug 22 02:15:03 +0000 2020
0,ABC,"Michael Bloomberg: ""Donald Trump's economic plan was to give a huge tax cut to guys like me who didn't need it, and then lie about it to everyone else."" https://t.co/3GY6mSSgRv #DemConvention https://t.co/b2a0E79NJu",1296996809546530818,https://abcnews.go.com/Politics/biden-accept-nomination-president-closing-day-democratic-national/story?id=72426135,Sat Aug 22 02:25:11 +0000 2020
0,ABC,"More than 70 former Republican national security officials, including some former members of the Trump administration, back Joe Biden in an open letter: ""We are profoundly concerned about the course of our nation under the leadership of Donald Trump."" https://t.co/VThKzjm9WJ",1296997039813918720,https://abcnews.go.com/Politics/70-republican-national-security-officials-support-biden/story?id=72501455&cid=social_twitter_abcn,Sat Aug 22 02:26:05 +0000 2020
0,ABC,"Edward Good, a 95-year-old WWII and Korea War veteran, is a lifelong Republican who voted for Donald Trump in 2016, but he is now backing Joe Biden: “I think Trump has been the worst president we’ve ever had, so I’ll be glad to see him go.” https://t.co/tOb4mEw6vH #DemConvention https://t.co/IkZgHvvtf0",1296997054003195906,https://abcnews.go.com/Politics/biden-accept-nomination-president-closing-day-democratic-national/story?id=72426135,Sat Aug 22 02:26:09 +0000 2020
0,ABC,"It is a milestone that likely would have seemed unimaginable to the engineers that designed the Air Force's Minuteman III missile, but this week marks the 50th year of service for the intercontinental ballistic missile. https://t.co/vY8z34ake7",1296997278721486848,https://abcnews.go.com/Politics/minuteman-iii-icbm-marks-50-years-service-week/story?id=72470959&cid=social_twitter_abcn,Sat Aug 22 02:27:02 +0000 2020
0,ABC,At least 41 schools in Berlin have reported that students or teachers have become infected with the coronavirus not even two weeks after schools reopened in the German capital. https://t.co/5wkftHt8O0,1296997278838923264,https://abcnews.go.com/Health/wireStory/virus-cases-reported-41-schools-germanys-capital-72517419?cid=social_twitter_abcn,Sat Aug 22 02:27:02 +0000 2020
0,ABC,Pres. Donald Trump says he wants police at polling sites. Experts say that's unlawful. https://t.co/tIHgr2pgak,1296997526495789056,https://abcnews.go.com/Politics/trump-police-polling-sites-experts-unlawful/story?id=72529553&cid=social_twitter_abcn,Sat Aug 22 02:28:02 +0000 2020
0,ABC,"Prince Harry and Meghan, the Duke and Duchess of Sussex, volunteered with local Los Angeles charity, Baby2Baby, which provides basic necessities like diapers, wipes and clothes for children and families in need. https://t.co/gJGASeDk9T https://t.co/DS9k1WhI3b",1297005380720111616,https://abcnews.go.com/alerts/uk-royals,Sat Aug 22 02:59:14 +0000 2020
0,ABC,"EXCLUSIVE: Asked about Pres. Trump’s insults against her, Sen. Kamala Harris tells @DavidMuir, “There is so much about what comes out of Donald Trump's mouth that is designed to distract the American people from what he is doing.” https://t.co/IQsUqgpryX https://t.co/8EvCPv73T9",1297005574719119366,https://abcnews.go.com/Politics/harris-abcs-david-muir-trump-insults-distractions-neglect/story?id=72530958,Sat Aug 22 03:00:00 +0000 2020
0,ABC,A black bear dashed into the woods when it was released back into the wild after officials spotted it roaming in Wyoming and relocated it. https://t.co/YE94MEdKgJ https://t.co/o8YQMay0rJ,1297006595642134529,https://abcnews.go.com/?cid=social_twitter_abcn,Sat Aug 22 03:04:04 +0000 2020
0,ABC,Experts warn many schools should delay reopening as data indicates surge in cases. https://t.co/zEcAyiBszq,1297020434412601345,https://abcnews.go.com/GMA/Wellness/experts-warn-schools-delay-reopening-data-virus-resurgence/story?id=72476932&cid=social_twitter_abcn,Sat Aug 22 03:59:03 +0000 2020
0,ABC,"In the span of Pres. Trump's term in office, the far-right fringe culture known as QAnon has made its way from cryptic posts on 4chan message boards to the White House press briefing room. https://t.co/HFm2u2icZt",1297020435167686661,https://abcnews.go.com/Politics/qanon-/story?id=72350231&cid=social_twitter_abcn,Sat Aug 22 03:59:03 +0000 2020
0,ABC,"The seed money for the study—courtesy of country music superstar Dolly Parton, who donated $1 million for coronavirus research—was used for a proof-of-concept study on 40 patients. https://t.co/9VbGOvXvkj",1297020438728646657,https://abcnews.go.com/US/clinical-trial-convalescent-plasma-treatment-means-real-data/story?id=72518469&cid=social_twitter_abcn,Sat Aug 22 03:59:04 +0000 2020
0,ABC,"Wolverines have returned to Mount Rainier National Park for the first time in 100 years, the National Park Service says. https://t.co/vjXWT2NiIr https://t.co/ifPWKUiHU9",1297020450552328193,https://abcnews.go.com/Lifestyle/photos/photos-amazing-animals-8537483,Sat Aug 22 03:59:07 +0000 2020
0,ABC,"Comedian Sarah Cooper: ""Whether you plan to vote by mail or in person wearing your mask, it is your vote and it's your right. Don't let Donald Trump take that away from you."" https://t.co/H8eKRYShmP #DemConvention https://t.co/cGJ0Sm37vN",1297020466171981825,https://abcnews.go.com/Politics/biden-accept-nomination-president-closing-day-democratic-national/story?id=72426135,Sat Aug 22 03:59:11 +0000 2020
0,ABC,EXCLUSIVE: Joe Biden to @DavidMuir on Pres. Trump’s attacks on Sen. Kamala Harris: “No President has ever used those words.” https://t.co/IQsUqgpryX https://t.co/Xr6faveHQX,1297020671659139074,https://abcnews.go.com/Politics/harris-abcs-david-muir-trump-insults-distractions-neglect/story?id=72530958,Sat Aug 22 04:00:00 +0000 2020
0,ABC,"""We are aware of the students' complaints, which are valid."" https://t.co/fssBMFwyA8",1297024942064754689,https://www.goodmorningamerica.com/food/story/college-students-share-disappointing-quarantine-meals-tiktok-72518880?cid=social_twitter_abcn,Sat Aug 22 04:16:58 +0000 2020
0,ABC,A single mom who committed to cooking at home during the coronavirus pandemic to protect the health of her daughter with lung disease has now cooked over 200 meals for her family and started her own food business. https://t.co/04Sgnt9uuB,1297028941048360965,https://www.goodmorningamerica.com/wellness/story/single-mom-starts-cooking-business-making-200-meals-72192236?cid=social_twitter_abcn,Sat Aug 22 04:32:51 +0000 2020
0,ABC,"Tracee Ellis Ross has always had her ""Black-ish"" character's back. https://t.co/WT0f0161Z8",1297032907073236992,https://www.goodmorningamerica.com/culture/story/powerful-reason-tracee-ellis-ross-refused-gendered-chores-72521035?cid=social_twitter_abcn,Sat Aug 22 04:48:37 +0000 2020
0,ABC,"A statement shared to DeVayne's official Instagram page ended by saying her ""final words"" were a reminder to ""never give up."" https://t.co/7IMHd5wM8L",1297041238005342208,https://www.goodmorningamerica.com/culture/story/rupauls-drag-race-alum-chi-chi-devayne-dies-72521036?cid=social_twitter_abcn,Sat Aug 22 05:21:43 +0000 2020
0,ABC,.@FiveThirtyEight breaks down the final night of the #DemConvention. https://t.co/AuN3vZBvHr,1297045095552880641,https://fivethirtyeight.com/videos/does-biden-have-the-broad-appeal-he-thinks-he-does/?cid=social_twitter_abcn,Sat Aug 22 05:37:03 +0000 2020
0,ABC,"The Southern California mayor was selected as one of 17 ""rising stars"" to deliver the Democratic National Convention's keynote address Tuesday, in which he slammed the Trump Administration's response to the coronavirus pandemic. https://t.co/ZDhDYihHqZ",1297050195394535424,https://abcnews.go.com/GMA/GMA3/long-beach-mayor-reveals-left-republican-party/story?id=72497385&cid=social_twitter_abcn,Sat Aug 22 05:57:19 +0000 2020
0,ABC,"""Surgeon generals are appointed by presidents, but our work isn't about politics. Our highest duty to the public.""

During the final night of the Democratic National Convention, Dr. Vivek Murthy addressed the nation. https://t.co/1DXEZxfwuc",1297055331927941120,https://abcnews.go.com/Politics/job-speak-truth-surgeon-general-unconventional-dnc-speech/story?id=72520961&cid=social_twitter_abcn,Sat Aug 22 06:17:43 +0000 2020
0,ABC,"Progressive groups are picking their battles more carefully.

More, via @FiveThirtyEight: https://t.co/wHpDqrsXPQ",1297066620863623168,https://fivethirtyeight.com/features/progressive-groups-are-getting-more-selective-in-targeting-incumbents-is-it-working/?cid=social_twitter_abcn,Sat Aug 22 07:02:35 +0000 2020
0,ABC,"It is a milestone that likely would have seemed unimaginable to the engineers that designed the Air Force's Minuteman III missile, but this week marks the 50th year of service for the intercontinental ballistic missile. https://t.co/afCD8RkUZi",1297081341058703360,https://abcnews.go.com/Politics/minuteman-iii-icbm-marks-50-years-service-week/story?id=72470959&cid=social_twitter_abcn,Sat Aug 22 08:01:04 +0000 2020
0,ABC,"After weeks of the Trump administration publicly demanding schools reopen, U.S. health officials this week pressed a new message for the American public: 

Get your virus levels under control and you can keep kids in classrooms. https://t.co/JL8GyT8AnW",1297111368659869699,https://abcnews.go.com/Politics/us-health-officials-message-virus-check-open-schools/story?id=72530832&cid=social_twitter_abcn,Sat Aug 22 10:00:24 +0000 2020
0,ABC,A mom's funny TikTok performances are getting lots of online love as her son dives into remote learning. https://t.co/5ZBpFwDMIX,1297126864453013505,https://www.goodmorningamerica.com/family/story/moms-daily-remote-learning-announcements-teenage-son-taking-72499893?cid=social_twitter_abcn,Sat Aug 22 11:01:58 +0000 2020
0,ABC,Mom's viral work station for kids is the perfect homeschooling hack. https://t.co/fyhKydCYSR,1297141526980636672,https://abcnews.go.com/GMA/Family/moms-viral-work-station-kids-perfect-homeschooling-hack/story?id=72467263&cid=social_twitter_abcn,Sat Aug 22 12:00:14 +0000 2020
0,ABC,The House is set to vote on a bill related to the ailing U.S. Postal Service in an unusual Saturday session amid an ongoing political controversy over mail-in voting. https://t.co/L3Eppc5syN,1297146634653048832,https://abcnews.go.com/Politics/house-set-vote-usps-bill-amid-mail-voting/story?id=72528681&cid=social_twitter_abcn,Sat Aug 22 12:20:32 +0000 2020
0,ABC,"WEATHER: Tropical Storm Laura and Tropical Storm Marco are both expected to travel towards the Gulf of Mexico in the next few days, with both storms likely to impact parts of the U.S. coast by the early half of next week. https://t.co/LvLIjQ09mj",1297151406403616768,https://abcnews.go.com/US/tropical-storm-laura-marco-simultaneously-heading-gulf-mexico/story?id=72538785&cid=social_twitter_abcn,Sat Aug 22 12:39:29 +0000 2020
0,ABC,"This aquatic-inclined bovine brings a whole new meaning to ""sea cow,"" as beachgoers in Ireland witnessed it appearing to ""emerge"" from the water and trot back to shore. https://t.co/kVKmhADPvV https://t.co/K0S9GPuLDI",1297156584930500610,https://abcnews.go.com/Lifestyle/photos/photos-amazing-animals-8537483/image-venomous-deathstalker-scorpion-glows-ultraviolet-light-72354188?cid=social_twitter_abcn,Sat Aug 22 13:00:04 +0000 2020
0,ABC,"At least 32 positive coronavirus cases and now a woman's death are linked to an Aug. 7 wedding reception in Maine, according to local health officials. https://t.co/1KwTLxapY4",1297161640803262464,https://abcnews.go.com/US/coronavirus-updates-32-cases-death-linked-maine-wedding/story?id=72538460&cid=social_twitter_abcn,Sat Aug 22 13:20:09 +0000 2020
0,ABC,"Nearly two decades after 17-year-old Alissa Turney disappeared, Phoenix police have arrested the man believed to be responsible for her death: her stepfather. https://t.co/DcM1LGhhfy",1297167071340568576,https://abcnews.go.com/US/19-years-teen-disappeared-stepfather-arrested-charged-murder/story?id=72528835&cid=social_twitter_abcn,Sat Aug 22 13:41:44 +0000 2020
0,ABC,"WHALE OF A RESCUE: A baby humpback got some big help from authorities after getting caught in a shark control net off the coast of Australia.

Several teams worked for about four hours to free the calf. https://t.co/TIaWC1usmy https://t.co/cVoVSczemg",1297171703488012291,https://abcnews.go.com/?cid=social_twitter_abcn,Sat Aug 22 14:00:09 +0000 2020
0,ABC,South Korea's presidential office says senior South Korean and Chinese officials have reaffirmed plans to arrange a summit between their leaders “at an early date” once coronavirus concerns subside. https://t.co/0kmcwHKaNO,1297176615881932801,https://abcnews.go.com/International/wireStory/south-korea-china-reaffirm-plans-leaders-summit-72538660?cid=social_twitter_abcn,Sat Aug 22 14:19:40 +0000 2020
0,ABC,"The sky above Susanville, California, appeared orange and hazy as smoke from the LNU Lightning Complex Fire rises above the city. https://t.co/hlTSKB2xt0 https://t.co/H1ngPc3M9r",1297182217752510465,https://abcnews.go.com/alerts/weather?cid=social_twitter_abcn,Sat Aug 22 14:41:55 +0000 2020
0,ABC,"TO THE RESCUE: The Indian Air Force airlifted a man who was stranded in rapid flowing water at a flooded dam for hours, after jumping into the water and failing to return to shore. https://t.co/qpv1dlfZP3 https://t.co/5NvckSQQc6",1297186789191487489,https://abcnews.go.com/?cid=social_twitter_abcn,Sat Aug 22 15:00:05 +0000 2020
0,ABC,"""Doc said his goal was to have me walking in five weeks. Hayley and I said, 'Make it four weeks because that's when baby number three gets here.'"" https://t.co/6wsEb9CihR",1297190706444996608,https://www.goodmorningamerica.com/culture/story/florida-georgia-lines-tyler-hubbard-injured-dirt-bike-72522820?cid=social_twitter_abcn,Sat Aug 22 15:15:39 +0000 2020
0,ABC,"Brazil, the second-worst-hit country by the coronavirus pandemic, is seeing daily case reports and death rolls continue to rise. https://t.co/oiVY9YYJrz",1297205921630871555,https://abcnews.go.com/International/covid-ravaged-brazil-vaccine-lab-english-chinese-researchers/story?id=72415456&cid=social_twitter_abcn,Sat Aug 22 16:16:07 +0000 2020
0,ABC,"EXCLUSIVE: Asked about Pres. Trump's charge that he wants to ""defund the police,"" Joe Biden tells @RobinRoberts, ""No I don't""—and counters that the Trump administration has proposed cutting a federal program that helps hire more local law enforcement. https://t.co/HOks1fE055 https://t.co/nOtOkgYaTu",1297206946773241857,https://abcnews.go.com/Politics/biden-abcs-robin-roberts-dont-defund-police-trump/story?id=72524405,Sat Aug 22 16:20:11 +0000 2020
0,ABC,"Joe Biden is favored to win the 2020 election—but there’s still time for the race to tighten, according to @FiveThirtyEight’s presidential forecast.

More right here: https://t.co/czVOMIiUw9 https://t.co/cSxlve24Yy",1297208352175468544,https://projects.fivethirtyeight.com/2020-election-forecast/,Sat Aug 22 16:25:46 +0000 2020
0,ABC,SOUND ON: Four leopard cubs born in an Indian farmer's hut meow and stumble around as their mother stays close by. https://t.co/HjanUAIigV https://t.co/sYswAebYT6,1297212795583373313,https://abcnews.go.com/International/Pets/photos/baby-animals-3351912/image-69600778?cid=social_twitter_abcn,Sat Aug 22 16:43:26 +0000 2020
0,ABC,"“I would shut it down. I would listen to the scientists.”

Joe Biden tells @DavidMuir in an exclusive interview that as president, he would shut the country down to stop the spread of COVID-19 if the move was recommended by scientists. https://t.co/2A9r07uIwa https://t.co/imHrA4aax3",1297216971176464384,https://abcnews.go.com/Politics/biden-abcs-david-muir-shut-country-prevent-spread/story?id=72519690,Sat Aug 22 17:00:01 +0000 2020
0,ABC,"BACKYARD BEARS: A group of bears cooled off by taking a dip in a pond of a home in Pasadena, California. https://t.co/4LGhIe0aSG https://t.co/sRoBbhbnPS",1297217002239655936,https://abcnews.go.com/?cid=social_twitter_abcn,Sat Aug 22 17:00:09 +0000 2020
0,ABC,"Steve Bannon calls his arrest ""a political hit job,"" says effort was in support of Pres. Donald Trump. https://t.co/DfzSkPRzi8",1297222471339442176,https://abcnews.go.com/Politics/steve-bannon-calls-arrest-political-hit-job-effort/story?id=72531208&cid=social_twitter_abcn,Sat Aug 22 17:21:53 +0000 2020
0,ABC,"A farmer came to the rescue of a koala he found who found itself facing a herd of cattle at a farm in Victoria.

The farmer later posted a photo of the koala separated safely from the cows behind a fence. https://t.co/EuWy4gefEX https://t.co/hbXJwW6rqP",1297232107178266624,https://abcnews.go.com/?cid=social_twitter_abcn,Sat Aug 22 18:00:10 +0000 2020
0,ABC,"A statement shared to DeVayne's official Instagram page ended by saying her ""final words"" were a reminder to ""never give up."" https://t.co/PeP11MW9Ta",1297236328195723265,https://www.goodmorningamerica.com/culture/story/rupauls-drag-race-alum-chi-chi-devayne-dies-72521036?cid=social_twitter_abcn,Sat Aug 22 18:16:56 +0000 2020
0,ABC,LGBTQ advocates are pressuring broadcast executives to sever ties with veteran Cincinnati Reds play-by-play man Thom Brennaman amid growing outrage over his use of an anti-gay slur caught on a hot mic. https://t.co/8zeqn2xg0y,1297241467463901184,https://abcnews.go.com/US/thom-brennamans-apology-anti-lgbtq-slur-falls-flat/story?id=72494081&cid=social_twitter_abcn,Sat Aug 22 18:37:22 +0000 2020
0,ABC,"A diver captured a standoff between a brittle star and a fish as they came to a head on the sea floor at Port Phillip Bay in Victoria, Australia. https://t.co/BPjHhZ0Kdm https://t.co/ATYKHBYsgr",1297247186615508993,https://abcnews.go.com/?cid=social_twitter_abcn,Sat Aug 22 19:00:05 +0000 2020
0,ABC,Authorities in Belarus have blocked an array of news media websites reporting on the country shaken by two weeks of protests against authoritarian President Alexander Lukashenko. https://t.co/jTCudtaize,1297249441330716673,https://abcnews.go.com/International/wireStory/belarus-blocks-news-websites-amid-large-protests-72539402?cid=social_twitter_abcn,Sat Aug 22 19:09:03 +0000 2020
0,ABC,"In April, this educator lost her mother to COVID. Now New York City wants her to go back to work. https://t.co/bxbhyokoHG",1297253565510057986,https://abcnews.go.com/Health/april-educator-lost-mother-covid-now-nyc-back/story?id=72233586&cid=social_twitter_abcn,Sat Aug 22 19:25:26 +0000 2020
0,ABC,"Racial disparities among lung cancer diagnoses have nearly vanished, new study shows. https://t.co/S4McTzWp78",1297257793364393984,https://abcnews.go.com/Health/racial-disparities-lung-cancer-diagnoses-vanished-study-finds/story?id=72508732&cid=social_twitter_abcn,Sat Aug 22 19:42:14 +0000 2020
0,ABC,"Russia's best-known opposition leader, Alexey Navalny, was flown from Siberia to Berlin for emergency treatment for suspected poisoning. https://t.co/VRmCfFIEnC",1297260151389532162,https://abcnews.go.com/International/poisoned-russian-opposition-leader-navalny-lands-berlin-emergency/story?id=72541848&cid=social_twitter_abcn,Sat Aug 22 19:51:36 +0000 2020
0,ABC,Record number of absentee ballots requested in state first to vote for president. https://t.co/ykdVl9Fe4o,1297267186390700032,https://abcnews.go.com/Politics/north-carolina-1st-state-begin-voting-president-sees/story?id=72514498&cid=social_twitter_abcn,Sat Aug 22 20:19:33 +0000 2020
