,name,text,id,url,created_at
0,WSJ,"The #Emmys are virtual this year. “A train wreck? Could be. Hope not. But if I was a viewer I’d tune in for that,” says the executive producer of the ceremony. Here's how it's all coming together. https://t.co/R9WWVWFaeT",1307831971272421376,https://www.wsj.com/articles/emmys-2020-five-things-to-know-from-hbo-vs-netflix-to-red-carpet-less-fashion-11600297200?mod=e2tw,Mon Sep 21 00:00:14 +0000 2020
0,WSJ,"As the #Emmys get underway, HBO’s limited series “Watchmen” leads the contenders with 26 nominations. Other top nominees include Amazon’s “The Marvelous Mrs. Maisel,” Netflix’s “Ozark” and HBO’s “Succession.” https://t.co/7aS8yh335C",1307834709246967808,https://www.wsj.com/articles/emmy-nominations-2020-hbos-watchmen-leads-contenders-11595957392?mod=e2tw,Mon Sep 21 00:11:07 +0000 2020
0,WSJ,"Taking home the second award of the night and the second for ""Schitt's Creek,"" Eugene Levy wins Outstanding Lead Actor In A Comedy Series for his role as Johnny Rose. Here is a list of tonight's nominees and winners. #Emmys  https://t.co/iw4GnExHtM",1307839814583103488,https://www.wsj.com/articles/emmys-2020-winners-in-key-categories-11600647649,Mon Sep 21 00:31:24 +0000 2020
0,WSJ,"Daniel Levy wins the third award for ""Schitt's Creek"" with Outstanding Writing for a Comedy Series. He spoke to @WSJMag about the show’s final season and 15 nominations, ""It is truly a fairy-tale ending for us."" https://t.co/iUdYU6VSmo",1307841500424925184,https://www.wsj.com/articles/schitts-creeks-dan-levy-glasses-11596545651,Mon Sep 21 00:38:06 +0000 2020
0,WSJ,"Daniel Levy wins the third award for ""Schitt's Creek"" for Outstanding Writing for a Comedy Series. He spoke to 
@WSJMag about the show’s final season and 15 nominations, ""It is truly a fairy-tale ending for us."" https://t.co/iUdYU6VSmo",1307841910808117248,https://www.wsj.com/articles/schitts-creeks-dan-levy-glasses-11596545651,Mon Sep 21 00:39:44 +0000 2020
0,WSJ,"Daniel Levy wins the third award for ""Schitt's Creek"" with Outstanding Writing for a Comedy Series. He spoke to @WSJMag about the show’s final season and 15 nominations, ""It is truly a fairy-tale ending for us."" https://t.co/iUdYU6VSmo",1307842242787319808,https://www.wsj.com/articles/schitts-creeks-dan-levy-glasses-11596545651,Mon Sep 21 00:41:03 +0000 2020
0,WSJ,"""Schitt's Creek"" is on a roll! The Canadian comedy takes home the fourth and fifth awards of the night with wins in Outstanding Directing for a Comedy Series and for Daniel Levy in Outstanding Supporting Actor in a Comedy Series. #Emmys https://t.co/qkEK8e5ZLd",1307843889164886016,https://www.wsj.com/articles/an-emmys-ceremony-for-the-covid-era-kicks-off-11600648478,Mon Sep 21 00:47:36 +0000 2020
0,WSJ,"""Schitt's Creek"" wins Outstanding Comedy Series and Annie Murphy wins Outstanding Supporting Actress in a Comedy Series for her role as Alexis Rose. Our winners from the #Emmys so far: https://t.co/iw4GnExHtM",1307847166677987330,https://www.wsj.com/articles/emmys-2020-winners-in-key-categories-11600647649,Mon Sep 21 01:00:37 +0000 2020
0,WSJ,"Emmy-nominated writers and directors spent their year staring at a television, just like the rest of us. We spoke to four nominees about the movies and shows that they couldn’t stop watching—new, nominated and otherwise. https://t.co/RkXWI0W0GF",1307849990228905984,https://www.wsj.com/articles/what-to-watch-four-emmy-nominees-on-what-they-binged-this-year-11600282702?mod=e2tw,Mon Sep 21 01:11:51 +0000 2020
0,WSJ,Mark Ruffalo wins Outstanding Lead Actor in a Limited Series or Movie for playing divergent identical twins in the adaptation of “I Know This Much Is True” #Emmys https://t.co/4zaD3CRHka,1307853603550396417,https://www.wsj.com/articles/i-know-this-much-is-true-review-birdseys-of-different-feathers-11588881957?mod=e2tw,Mon Sep 21 01:26:12 +0000 2020
0,WSJ,Yahya Abdul-Mateen II wins Outstanding Supporting Actor in a Limited Series or Movie for his role in #WatchmenHBO. @WSJMag spoke to the actor in 2019 after he filmed the HBO drama. #Emmys https://t.co/rgbCcc0ROM,1307859833526288384,https://www.wsj.com/articles/why-yahya-abdul-mateen-ii-is-the-actor-to-know-this-fall-11567601090?mod=e2tw,Mon Sep 21 01:50:57 +0000 2020
0,WSJ,"Uzo Aduba wins Outstanding Supporting Actress in a Limited Series or Movie for her portrayal of presidential candidate Shirley Chisholm in ""Mrs. America"" #Emmys https://t.co/8YjebHT1Gi",1307861768975388672,https://www.wsj.com/articles/emmys-2020-winners-in-key-categories-11600647649?mod=e2tw,Mon Sep 21 01:58:39 +0000 2020
0,WSJ,There’s no silver bullet for California’s electricity problems nor its solutions. @djtgallagher explains. #WSJWhatsNow https://t.co/nh76TqJgDv https://t.co/LubkVaJ8le,1307862111662608384,https://www.wsj.com/articles/how-to-keep-the-lights-on-in-california-11600254000,Mon Sep 21 02:00:00 +0000 2020
0,WSJ,"""Watchmen"" wins Outstanding Limited Series at the #Emmys",1307862382438424576,,Mon Sep 21 02:01:05 +0000 2020
0,WSJ,"Jeremy Strong wins Outstanding Lead Actor In A Drama Series for his role as Kendall Roy in ""Succession."" See the rest of tonight's #Emmys winners so far: https://t.co/BlvLUr9zlU",1307870271693639680,https://www.wsj.com/articles/emmys-2020-winners-in-key-categories-11600647649?mod=e2tw,Mon Sep 21 02:32:26 +0000 2020
0,WSJ,"Zendaya wins Outstanding Lead Actress In A Drama Series for her role as Rue in the HBO drama, ""Euphoria"" #Emmys https://t.co/ySrFp0XkGa",1307872156525756416,https://www.wsj.com/articles/in-euphoria-hbo-offers-a-gritty-dark-take-on-the-teen-drama-11560690000?mod=e2tw,Mon Sep 21 02:39:55 +0000 2020
0,WSJ,"""Succession"" won the Emmy for Outstanding Drama Series, while Pop TV's “Schitt’s Creek” swept the major comedy categories https://t.co/PjEaw6rsx1",1307879297265303553,https://www.wsj.com/articles/an-emmys-ceremony-for-the-covid-era-kicks-off-11600648478?mod=e2tw,Mon Sep 21 03:08:18 +0000 2020
0,WSJ,"#WSJWhatsNow: DraftKings stock hit a new high after announcing a deal, while regulators are preparing to reprimand… https://t.co/2p1VPxm6n1",1307884758777491457,https://twitter.com/i/web/status/1307884758777491457,Mon Sep 21 03:30:00 +0000 2020
0,WSJ,"The white Omaha, Neb., bar owner who shot and killed a 22-year-old Black man during a May protest, has died by suicide, his attorney said Sunday https://t.co/JzBSvgE2gU",1307884785340157952,https://www.wsj.com/articles/jake-gardner-dies-by-suicide-days-after-being-charged-in-james-scurlock-shooting-11600650037?mod=e2tw,Mon Sep 21 03:30:06 +0000 2020
0,WSJ,"A woman suspected of sending an envelope containing the poison ricin to the White House was arrested on Sunday soon after crossing the Canadian border, according to a U.S. official familiar with the matter https://t.co/BliSpc6xS9",1307888564705865728,https://www.wsj.com/articles/suspect-arrested-for-mailing-ricin-envelope-to-white-house-11600649793?mod=e2tw,Mon Sep 21 03:45:07 +0000 2020
0,WSJ,How can you stop yourself from ordering dinner on a delivery app every night? Behavioral economist Dan Ariely has the answer https://t.co/M24T4qI3oU,1307892341177487360,https://www.wsj.com/articles/breaking-the-delivery-app-habit-11600369410?mod=e2tw,Mon Sep 21 04:00:08 +0000 2020
0,WSJ,Covid-19’s collateral damage: More Americans are dying from heart attacks and other health issues https://t.co/Fw7n18HUBc,1307899888315895808,https://www.wsj.com/articles/death-toll-from-covid-19-pandemic-extends-far-beyond-virus-victims-11600507800?mod=e2tw,Mon Sep 21 04:30:07 +0000 2020
0,WSJ,“Million Dollar Listing” star Ryan Serhant has hung out of helicopters and stood on top of an SUV in the middle of Manhattan—all in the name of one thing: clicks. His ultimate goal is selling real estate. Now he’s launching his own firm. https://t.co/QHEq7jGBHk,1307907475434336256,https://www.wsj.com/articles/ryan-serhant-brokerage-new-york-11600183598?mod=e2tw,Mon Sep 21 05:00:16 +0000 2020
0,WSJ,China's aging car fleet is huge and will soon start needing significant repairs. Chinese tech companies want a slice of the action. https://t.co/vm81AsJV1W,1307914984660389889,https://www.wsj.com/articles/alibaba-and-tencent-kick-the-tires-on-a-new-ideakeeping-chinas-jalopies-on-the-road-11600513201?mod=e2tw,Mon Sep 21 05:30:06 +0000 2020
0,WSJ,"Facial recognition is everywhere in China. Despite that, Ant Group’s Alipay finds shoppers are reluctant to use its facial-recognition machines  https://t.co/HomHo7befE",1307922533136642048,https://www.wsj.com/articles/in-china-paying-with-your-face-is-hard-sell-11600597240?mod=e2tw,Mon Sep 21 06:00:06 +0000 2020
0,WSJ,Does having the flu make you more vulnerable to Covid-19? Can you get them at the same time? Here’s what doctors say. https://t.co/4Vlbarz8TW,1307930098121703425,https://www.wsj.com/articles/flu-vs-covid-ways-to-identify-symptoms-and-differences-11600088401?mod=e2tw,Mon Sep 21 06:30:10 +0000 2020
0,WSJ,"An emergency fund helps make tough times a little better, but some people fail to fully leverage their savings. Here’s advice from experts. https://t.co/S19lTS7stg",1307937663266238465,https://www.wsj.com/articles/the-biggest-money-mistakes-people-make-in-a-recession-11600009201?mod=e2tw,Mon Sep 21 07:00:13 +0000 2020
0,WSJ,“Where I come from we weren’t tricked into believing we had rights.” Trevor Noah isn’t kidding around about police aggression. The South African comedian says recent events have exposed the social pact between white and Black America as counterfeit. https://t.co/xdv95rBeLx,1307945174761459712,https://www.wsj.com/articles/trevor-noah-interview-daily-show-trump-11600172814?mod=e2tw,Mon Sep 21 07:30:04 +0000 2020
0,WSJ,Nikola's founder resigned as chairman as the electric-truck startup faces a probe into allegations it misled investors with claims about its technology https://t.co/iZyLXFYBoT,1307948941145767937,https://www.wsj.com/articles/nikola-chairman-steps-down-as-company-faces-probe-11600672351?mod=e2tw,Mon Sep 21 07:45:02 +0000 2020
0,WSJ,What does the operating room of the future look like? We give you a 3-D tour https://t.co/eTzLDALLak,1307952749670268928,https://www.wsj.com/graphics/future-of-surgery/?mod=e2tw,Mon Sep 21 08:00:10 +0000 2020
0,WSJ,"Many millennials started 2020 with all sorts of money and career plans. Now, all they can do is look one month into the future. https://t.co/c6cx7Va04U",1307960275849670658,https://www.wsj.com/articles/how-covid-19-derailed-my-financial-goals-11599922800?mod=e2tw,Mon Sep 21 08:30:05 +0000 2020
0,WSJ,The Allens thought their days living with family were numbered. Then came the pandemic. https://t.co/4wMgwJAsJd,1307967869720956928,https://www.wsj.com/articles/what-you-gain-and-sacrifice-when-you-move-back-in-with-parents-11600603200?mod=e2tw,Mon Sep 21 09:00:15 +0000 2020
0,WSJ,Take an early look at the front page of The Wall Street Journal https://t.co/5xQPDPcm8q https://t.co/Xch2ephPZO,1307971607755993088,https://www.wsj.com/,Mon Sep 21 09:15:06 +0000 2020
0,WSJ,Justice Ginsburg became a legal trailblazer decades ago as she challenged laws discriminating on the basis of sex. Yet few generations of lawyers—particularly women—have looked to her as a role model as much as the students entering the profession today. https://t.co/nzlcwQohM6,1307975373834072067,https://www.wsj.com/articles/what-ruth-bader-ginsburg-means-to-the-next-generation-of-legal-minds-11600631280?mod=e2tw,Mon Sep 21 09:30:04 +0000 2020
0,WSJ,The pandemic is wreaking havoc on white-collar workers who are deep in debt. “There’s a professional workforce that’s getting slammed.” https://t.co/gp4yJwvtz0,1307979158073606144,https://www.wsj.com/articles/covid-unemployment-debt-middle-class-family-finances-11600122791?mod=e2tw,Mon Sep 21 09:45:07 +0000 2020
0,WSJ,“There’s no opportunity for serendipity when every interaction requires a phone call or text message.” Freshman year just isn’t the same in 2020. https://t.co/0Me28sGDqr,1307982960931504129,https://www.wsj.com/articles/college-university-freshman-campus-life-covid-11600624951?mod=e2tw,Mon Sep 21 10:00:13 +0000 2020
0,WSJ,"Investors and big auto makers are pouring money into electric-vehicle startups in a search for the next Tesla, with the hopes of cashing in. One company is drawing more scrutiny than most. https://t.co/tpiAboas6X",1307983214380748800,https://www.wsj.com/video/nikola-and-the-race-to-find-the-next-tesla/40404603-143B-4213-AD40-5D396A382EF1.html?mod=e2tw,Mon Sep 21 10:01:14 +0000 2020
0,WSJ,"Dr. Anthony Fauci said it is unlikely Covid-19 could be eradicated, but that public-health measures could pave the way for a return to a “reasonable form of normality” by the end of 2021 https://t.co/FEA8ErTSZ7",1307986693488771072,https://www.wsj.com/articles/fauci-says-there-will-be-an-end-to-covid-19-11600309449?mod=e2tw,Mon Sep 21 10:15:03 +0000 2020
0,WSJ,Lycra biker bottoms are quickly becoming the chic set’s athleisure item of choice. But is the divisive garment a suitable style to wear outside the gym? https://t.co/pyqybYYTDu,1307990468110749697,https://www.wsj.com/articles/are-bike-shorts-as-controversial-as-leggings-11600285740?mod=e2tw,Mon Sep 21 10:30:03 +0000 2020
0,WSJ,What you wear while working actually matters. “All you need to do is just dress a little bit more formally than you would at home normally.” https://t.co/ap5CSyBhx6,1307994257253376000,https://www.wsj.com/articles/the-science-behind-wfh-dressing-for-zoom-11600626704?mod=e2tw,Mon Sep 21 10:45:06 +0000 2020
0,WSJ,The U.S. Department of Commerce will delay its download ban on TikTok after President Trump approved “in concept” t… https://t.co/klSk5pjYWm,1307999084301688833,https://twitter.com/i/web/status/1307999084301688833,Mon Sep 21 11:04:17 +0000 2020
0,WSJ,"Diamond Standard, which is preparing a $25 million offering on Sept. 28, is trying to create a new diamond product that is analogous to a gold bar https://t.co/GKng2IT7oX",1308002050811269120,https://www.wsj.com/articles/easy-diamond-trading-set-to-be-available-for-first-time-11600680611?mod=e2tw,Mon Sep 21 11:16:05 +0000 2020
0,WSJ,"Electric-truck maker Nikola is turning to an outside supplier to provide batteries for its first semi-truck model, a contrast to the company’s earlier statements that it has developed its own battery technology https://t.co/v4X1ZOPt7X",1308005617353846785,https://www.wsj.com/articles/nikolas-first-trucks-to-use-batteries-made-by-outside-supplier-11600684954?mod=e2tw,Mon Sep 21 11:30:15 +0000 2020
0,WSJ,"Shares in HSBC slumped after news articles detailed “suspicious activity reports” filed by it and other major banks to U.S. authorities, putting fresh pressure on a stock that has already dropped sharply this year https://t.co/RrWngZEvgQ",1308009343086886913,https://www.wsj.com/articles/hsbc-stock-hits-25-year-low-11600672778?mod=e2tw,Mon Sep 21 11:45:03 +0000 2020
0,WSJ,Republicans and Democrats are weighing options in a high-stakes fight as President Trump says he’ll nominate a woma… https://t.co/lqO1476Iry,1308012743514034178,https://twitter.com/i/web/status/1308012743514034178,Mon Sep 21 11:58:34 +0000 2020
0,WSJ,Nikola plunged over 35% premarket after the electric-truck startup’s founder said he would quit. Here's what else you should know when the market opens. https://t.co/NgOZQ6DKcN,1308016915768578048,https://www.wsj.com/articles/oracle-nikola-illumina-what-to-watch-when-the-stock-market-opens-11600686695?mod=e2tw,Mon Sep 21 12:15:09 +0000 2020
0,WSJ,President Trump said he will make a Supreme Court nomination on Friday or Saturday and has five names under consideration to replace Justice Ruth Bader Ginsburg https://t.co/3mUzhFtSH3,1308023061841575937,https://www.wsj.com/articles/trump-says-hell-make-supreme-court-nomination-friday-or-saturday-11600691095?mod=e2tw,Mon Sep 21 12:39:34 +0000 2020
0,WSJ,"Trevor Milton, Nikola’s founder and executive chairman, is stepping down with immediate effect in the wake of allegations from a short seller that he and the electric-truck startup had made false statements to investors https://t.co/x87peAq4fJ",1308024453574656002,https://www.wsj.com/articles/nikola-chairman-steps-down-as-company-faces-probe-11600672351?mod=e2tw,Mon Sep 21 12:45:06 +0000 2020
0,WSJ,"The founder of the electric-truck startup Nikola is leaving, marking the latest twist in a series of developments t… https://t.co/woJ6Toi1zk",1308028206126182402,https://twitter.com/i/web/status/1308028206126182402,Mon Sep 21 13:00:00 +0000 2020
0,WSJ,"The U.S., in effect, is following steps a number of other governments have taken to treat citizens’ data as a national-security issue and restrict how it is stored and shared https://t.co/ISJZ2ETjRK",1308032016890433536,https://www.wsj.com/articles/u-s-joins-global-bid-to-carve-up-the-internet-with-tiktok-move-11600689612?mod=e2tw,Mon Sep 21 13:15:09 +0000 2020
0,WSJ,"Postponed Virginia Tech games and virtual classes dashed hopes for fall rebound in Blacksburg, Va., as many students remain reluctant to fill the restaurants, shops and other local businesses https://t.co/O2XclY2hZm",1308035769840406535,https://www.wsj.com/articles/college-town-economies-suffer-as-students-avoid-bars-football-tailgating-11600686000?mod=e2tw,Mon Sep 21 13:30:04 +0000 2020
0,WSJ,"The Dow industrials dropped nearly 500 points as trading began, extending last week's declines https://t.co/Lx79fawd0h",1308037932192759809,https://www.wsj.com/articles/global-stock-markets-dow-update-9-21-2020-11600681496?mod=e2tw,Mon Sep 21 13:38:39 +0000 2020
0,WSJ,The Federal Reserve was set to take an initial step to rewrite rules for hundreds of billions of dollars in lending in lower-income neighborhoods https://t.co/kiOp0CXK70,1308040813365145600,https://www.wsj.com/articles/fed-to-propose-overhaul-of-lending-rules-for-poorer-communities-11600695600?mod=e2tw,Mon Sep 21 13:50:06 +0000 2020
0,WSJ,"From @WSJopinion: The TikTok deal reeks of corporate cronyism that will damage the U.S. government’s credibility and reputation for free-market rules, writes The Editorial Board https://t.co/cVnvbAZOE7",1308047116514848768,https://www.wsj.com/articles/trump-tiktok-and-crony-capitalism-11600639766?mod=e2tw,Mon Sep 21 14:15:09 +0000 2020
0,WSJ,"President Trump says he will announce his nominee to replace Justice Ruth Bader Ginsburg on the Supreme Court Friday or Saturday, following the death of Justice Ginsburg. Here’s a Q&amp;A about the nominating process. https://t.co/aYaU6SjmUn",1308054643939962882,https://www.wsj.com/articles/supreme-court-q-a-how-trump-plans-to-fill-ruth-bader-ginsburgs-seat-11600626742?mod=e2tw,Mon Sep 21 14:45:04 +0000 2020
0,WSJ,"New York City’s former top doctor says the city will inevitably face a resurgence of Covid-19, its coronavirus testing needs to be recalibrated to work effectively and older children attending in-person instruction pose a health risk https://t.co/4hOtaLezhz",1308058429878153219,https://www.wsj.com/articles/new-york-citys-former-top-health-official-on-its-covid-19-response-11600697623?mod=e2tw,Mon Sep 21 15:00:06 +0000 2020
0,WSJ,The potential role of TikTok‘s Chinese owner in a newly created company involving Oracle remains a point of contention despite steps toward an agreement over the weekend https://t.co/zcd7Di29oy,1308069752024293378,https://www.wsj.com/articles/tiktok-and-oracle-spar-over-ownership-threatening-deal-11600702185?mod=e2tw,Mon Sep 21 15:45:06 +0000 2020
0,WSJ,"President Trump wants to put a stop to what he calls “endless war,” while Biden calls them “forever wars.”… https://t.co/0aKxtSyq45",1308073508048519169,https://twitter.com/i/web/status/1308073508048519169,Mon Sep 21 16:00:01 +0000 2020
0,WSJ,"Medicare wouldn’t cover the cost of administering any coronavirus vaccine approved for emergency use, leaving Trump administration officials exploring options to quickly fix the government’s plan to make the vaccine free for all Americans https://t.co/3mBrznVh7F",1308077329789456391,https://www.wsj.com/articles/medicare-wouldnt-cover-costs-of-administering-coronavirus-vaccine-approved-under-emergency-use-authorization-11600704447?mod=e2tw,Mon Sep 21 16:15:12 +0000 2020
0,WSJ,"The Justice Department threatened to withhold federal funding from New York, Portland and Seattle over the cities’ responses to violence that sometimes accompanied demonstrations against racial injustice this summer https://t.co/kLvdKwE0Cj",1308081103199236097,https://www.wsj.com/articles/justice-department-threatens-to-cut-funds-to-new-york-seattle-and-portland-11600704061?mod=e2tw,Mon Sep 21 16:30:12 +0000 2020
