,name,text,id,url,created_at
0,WSJ,"How did small, family-owned companies make it through the pandemic? We spent five months with one to find out https://t.co/Pi9FyBYrRw",1303128453177372672,https://www.wsj.com/articles/furniture-maker-coronavirus-11597875260?mod=e2tw,Tue Sep 08 00:30:08 +0000 2020
0,WSJ,"The new coronavirus has a powerful ability to infect and spread. Taken on its own terms, it is the infectious disease success of the past 100 years. https://t.co/FTWDkG7UyA",1303136010038108161,https://www.wsj.com/articles/really-diabolical-inside-the-coronavirus-that-outsmarted-science-11599498840?mod=e2tw,Tue Sep 08 01:00:10 +0000 2020
0,WSJ,J.Crew was the first big retail chain to file bankruptcy in the wake of coronavirus lockdowns. But analysts say J.C… https://t.co/z53ABDkFgN,1303143516449669121,https://twitter.com/i/web/status/1303143516449669121,Tue Sep 08 01:30:00 +0000 2020
0,WSJ,Getting an M.B.A. used to be a sure-fire way to land a job. Not anymore. https://t.co/MV33mkYEjt,1303147295215681536,https://www.wsj.com/articles/m-b-a-s-are-usually-swimming-in-job-offers-by-now-not-this-year-11598866200?mod=e2tw,Tue Sep 08 01:45:01 +0000 2020
0,WSJ,"There are still advantages to buying muni bonds issued in your home state, but you might be pleasantly surprised at rates available elsewhere https://t.co/0WZYQF4yf0",1303158640057233409,https://www.wsj.com/articles/when-buying-muni-bonds-investors-should-look-beyond-their-own-states-11599490801?mod=e2tw,Tue Sep 08 02:30:05 +0000 2020
0,WSJ,How workers and families are making fall a new season of deeper adaptation https://t.co/lWbkijolXF,1303166226768760837,https://www.wsj.com/articles/we-cant-just-limp-along-americans-reinvent-fall-11599511767?mod=e2tw,Tue Sep 08 03:00:14 +0000 2020
0,WSJ,"Closed-end funds typically are more risky than open-end, but their returns tend to be higher. https://t.co/MkN4EUETBC",1303173756345618434,https://www.wsj.com/articles/closed-end-funds-are-trying-to-make-a-comeback-11599491743?mod=e2tw,Tue Sep 08 03:30:09 +0000 2020
0,WSJ,"PG&amp;E said it planned to cut power in parts of California due to high winds, to reduce the risk of wildfires https://t.co/ziySSrTO5N",1303177511275311104,https://www.wsj.com/articles/new-blackouts-to-darken-california-11599535514?mod=e2tw,Tue Sep 08 03:45:05 +0000 2020
0,WSJ,"China’s top investment bank is remaking an iconic Hong Kong brokerage in its own image, in a microcosm of how the Asian financial hub is changing https://t.co/bRieHzoKdK",1303181300828975106,https://www.wsj.com/articles/how-chinas-top-broker-tamed-the-insane-asylum-of-hong-kong-finance-11599473150?mod=e2tw,Tue Sep 08 04:00:08 +0000 2020
