,name,text,id,url,created_at
0,businessinsider,This device can turn your normal old razor into an electric shaver https://t.co/2fzkCcttzd,1284278479031328769,,Sat Jul 18 00:07:04 +0000 2020
0,businessinsider,"Deeper G Suite integrations pose an existential threat to Zoom and Slack, as enterprises will look to cut redundant software subscriptions  https://t.co/YFiv7QQ8Rx",1284290364426399749,https://www.businessinsider.com/g-suite-redesign-poses-existential-threat-to-zoom-slack-2020-7?IR=T&itm_source=twitter&itm_medium=social&itm_content=briefings_post&itm_campaign=7-17-2020,Sat Jul 18 00:54:18 +0000 2020
0,businessinsider,"16 easy cocktails to make at home during lockdown, recommended by bartenders, food influencers, and people who can deliver alcohol straight to your door https://t.co/9E9ZVLGnwQ",1284315330060353544,https://www.businessinsider.com/easy-cocktails-to-make-at-home-recommended-by-experts-2020-4,Sat Jul 18 02:33:30 +0000 2020
0,businessinsider,G/O Media just fired a Black Muslim travel writer for leaving the country. The reporter has worked abroad for years and has written that she left to protect her son from police violence. https://t.co/pGBVlmmPCH,1284316597545574405,https://www.businessinsider.com/go-media-fired-a-black-travel-writer-leaving-the-country-2020-7,Sat Jul 18 02:38:32 +0000 2020
0,businessinsider,"After years of sleeping in, I started waking up at 5 a.m., and I'm amazed by how it changes my day https://t.co/FAK9zBS3Gc",1284316613228081152,https://www.businessinsider.com/how-to-start-waking-up-earlier-5-am-club-2018-12,Sat Jul 18 02:38:36 +0000 2020
0,businessinsider,RT @Politicsinsider: Civil Rights icon Rep. John Lewis has died https://t.co/WGMHEeaA3a,1284338343548014594,https://www.businessinsider.com/rep-john-lewis-has-died-2020-7,Sat Jul 18 04:04:57 +0000 2020
0,businessinsider,How Beyoncé and Jay-Z make and spend their $1.26 billion https://t.co/1P2v90j6sF,1284418298399076353,,Sat Jul 18 09:22:40 +0000 2020
0,businessinsider,Bugatti's La Voiture Noire costs $18 million https://t.co/SCuWEuCXIV,1284423587747766272,,Sat Jul 18 09:43:41 +0000 2020
