,name,text,id,url,created_at
0,YahooNews,Secret Service members asked about protecting soon-to-be-former president Trump full time in Florida: Sources https://t.co/NRbrXBhQOy https://t.co/MfypGvBtEN,1331024865453858816,https://www.yahoo.com/gma/secret-members-asked-protecting-soon-205816566.html?ncid=twitter_yahoonewst_sjwumo1bpf4,Tue Nov 24 00:00:31 +0000 2020
0,YahooNews,"While President Donald Trump has publicly praised his legal team’s efforts, he has privately expressed frustration with the slapdash nature of his election defense fight, according to several people familiar with the discussions https://t.co/gyxTJr0p1d via @NBCNews https://t.co/guGuO7dd5C",1331028516331204624,https://news.yahoo.com/behind-scenes-trump-frustrated-legal-185200393.html?ncid=twitter_yahoonewst_sjwumo1bpf4,Tue Nov 24 00:15:02 +0000 2020
0,YahooNews,'Special jeopardy': 100 former Republican national security officials warn Trump must allow transition https://t.co/3o61hYSOHD https://t.co/tSome3Fb7z,1331032296359649289,https://news.yahoo.com/special-jeopardy-100-former-republican-182831278.html?ncid=twitter_yahoonewst_sjwumo1bpf4,Tue Nov 24 00:30:03 +0000 2020
0,YahooNews,State-by-state breakdown of coronavirus travel restrictions https://t.co/4CT3C79RDB https://t.co/Wn1aFBIJdu,1331036065776414725,https://news.yahoo.com/map-per-state-coronavirus-travel-162703472.html?ncid=twitter_yahoonewst_sjwumo1bpf4,Tue Nov 24 00:45:02 +0000 2020
0,YahooNews,350-pound loggerhead among more than 150 cold-stunned turtles rescued in Massachusetts https://t.co/sIbQhfjjB2 https://t.co/gCCRQV8388,1331039988784435200,https://news.yahoo.com/350-pound-loggerhead-among-more-144956101.html?ncid=twitter_yahoonewst_sjwumo1bpf4,Tue Nov 24 01:00:37 +0000 2020
0,YahooNews,"Nintendo Switch Online gives you online multiplayer, free Switch games, secure save data, and more — here's how it works https://t.co/7CzMiIFieg https://t.co/3cl1917nFe",1331043623828410369,https://news.yahoo.com/nintendo-switch-online-play-nintendo-204900387.html?ncid=twitter_yahoonewst_sjwumo1bpf4,Tue Nov 24 01:15:04 +0000 2020
0,YahooNews,Arctic temperatures are astonishingly warmer than they should be https://t.co/tstScxcZfw https://t.co/2OfLQOkHp7,1331047388170084352,https://news.yahoo.com/arctic-temperatures-astonishingly-warmer-152621552.html?ncid=twitter_yahoonewst_sjwumo1bpf4,Tue Nov 24 01:30:01 +0000 2020
0,YahooNews,How misinformation 'superspreaders' seed false election theories https://t.co/UNVTq8BWKx https://t.co/Q6NdGQcfNa,1331054948675710982,https://news.yahoo.com/misinformation-superspreaders-seed-false-election-192514132.html?ncid=twitter_yahoonewst_sjwumo1bpf4,Tue Nov 24 02:00:04 +0000 2020
0,YahooNews,Can an algorithm prevent suicide? https://t.co/55aiYNcICG https://t.co/7EDRv3Se0u,1331058724920844289,https://news.yahoo.com/algorithm-prevent-suicide-194856341.html?ncid=twitter_yahoonewst_sjwumo1bpf4,Tue Nov 24 02:15:04 +0000 2020
0,YahooNews,Biden's choice for UN envoy signals return to US engagement https://t.co/YxtI1fAbSY https://t.co/KL3gco5rIp,1331062488633323522,https://news.yahoo.com/bidens-choice-un-envoy-signals-212005930.html?ncid=twitter_yahoonewst_sjwumo1bpf4,Tue Nov 24 02:30:01 +0000 2020
0,YahooNews,New York City to open field hospital for first time since spring as Covid-19 cases spike https://t.co/FYg50Kqpd0 https://t.co/HpoP0AbJjW,1331066271752990720,https://news.yahoo.com/york-city-open-field-hospital-200930757.html?ncid=twitter_yahoonewst_sjwumo1bpf4,Tue Nov 24 02:45:03 +0000 2020
0,YahooNews,"Georgia Is a purple state, but don't expect centrist politicians https://t.co/XacyLMVPBE https://t.co/TMVs0OE9vt",1331070043254362112,https://news.yahoo.com/georgia-purple-state-dont-expect-195400054.html?ncid=twitter_yahoonewst_sjwumo1bpf4,Tue Nov 24 03:00:03 +0000 2020
0,YahooNews,China just launched a mission to the moon to collect rock samples — the first time a country will have done so in more than 40 years https://t.co/9VLHIg2XIe https://t.co/ckk8RXWvM5,1331073819033935875,https://news.yahoo.com/china-just-launched-mission-moon-203600592.html?ncid=twitter_yahoonewst_sjwumo1bpf4,Tue Nov 24 03:15:03 +0000 2020
0,YahooNews,Feds charge ‘Tony Meatballs’ and other Philly mobsters with drug trafficking https://t.co/bnvrzrpjYr https://t.co/Ziz6Vhd07c,1331077593639030784,https://news.yahoo.com/feds-charge-tony-meatballs-other-202954855.html?ncid=twitter_yahoonewst_sjwumo1bpf4,Tue Nov 24 03:30:03 +0000 2020
0,YahooNews,China launches Moon probe to bring back lunar rocks https://t.co/mplfQemuAl https://t.co/5Z4lV93zG0,1331081370261655553,https://news.yahoo.com/china-prepares-moon-probe-bring-092316161.html?ncid=twitter_yahoonewst_sjwumo1bpf4,Tue Nov 24 03:45:03 +0000 2020
0,YahooNews,An OAN host has been helping Rudy with Trump’s legal efforts https://t.co/azyubWKVDb https://t.co/AEP3QKEu0Y,1331226129429123078,https://news.yahoo.com/oan-host-helping-rudy-trump-013016522.html?ncid=twitter_yahoonewst_sjwumo1bpf4,Tue Nov 24 13:20:16 +0000 2020
0,YahooNews,Intelligence employees vent frustrations over being forced to return to the office https://t.co/Pl1NWzrKgI https://t.co/3YMdxHrpQ1,1331228691872043008,https://news.yahoo.com/intelligence-employees-vent-frustrations-over-being-forced-to-return-to-the-office-100036400.html?ncid=twitter_yahoonewst_sjwumo1bpf4,Tue Nov 24 13:30:27 +0000 2020
0,YahooNews,Should Joe Biden cancel billions in student loan debt? https://t.co/dbRzgaWZzF https://t.co/4md1bXC0B8,1331232359908302850,https://news.yahoo.com/should-joe-biden-cancel-billions-in-student-loan-debt-193325004.html?ncid=twitter_yahoonewst_sjwumo1bpf4,Tue Nov 24 13:45:02 +0000 2020
0,YahooNews,Education Department removed tool for defrauded students 9 days after launch https://t.co/sKmPJG8mhy https://t.co/7rTTeYXr3d,1331236199445434370,https://finance.yahoo.com/news/education-department-removes-tool-for-defrauded-students-two-weeks-after-launching-the-new-website-212738359.html?ncid=twitter_yahoonewst_sjwumo1bpf4,Tue Nov 24 14:00:17 +0000 2020
0,YahooNews,"RT @NatashaBertrand: Some background on Biden’s DNI pick Avril Haines...with help from @dklaidman’s great 2013 profile https://t.co/t47YfStFfx

https://t.co/ho9Wqt4YXH https://t.co/GIscu36nxc",1331241561083047940,https://www.newsweek.com/2013/06/26/avril-haines-least-likely-spy-237616.html,Tue Nov 24 14:21:36 +0000 2020
0,YahooNews,Purdue Pharma is expected Tuesday to plead guilty to federal conspiracy and kickback charges and acknowledge that its aggressive marketing of opioids over the last three decades helped propel a crisis that killed hundreds of thousands of Americans https://t.co/52vYXLfzNq https://t.co/mEYfWmsyw9,1331243818201591812,https://www.yahoo.com/gma/purdue-pharma-maker-oxycontin-expected-140800393.html?ncid=twitter_yahoonewst_sjwumo1bpf4,Tue Nov 24 14:30:34 +0000 2020
0,YahooNews,"Outgoing President Donald Trump retweeted a series of bizarre video from actor Randy Quaid on Twitter Tuesday morning, while President-elect Joe Biden further prepared to take office by setting his transition team and members of his Cabinet https://t.co/oLbaa53p6s https://t.co/5I2l7vs5ks",1331245059229052930,https://www.yahoo.com/news/trump-retweets-bizarre-randy-quaid-142509998.html?ncid=twitter_yahoonewst_sjwumo1bpf4,Tue Nov 24 14:35:30 +0000 2020
0,YahooNews,"Trump went along with Biden's transition only after aides told him he didn't have to admit he lost, NYT report says https://t.co/N4TrozfbCk https://t.co/sfdrO6Qkm7",1331251235308130304,https://news.yahoo.com/trump-only-agreed-unlock-bidens-113051732.html?ncid=twitter_yahoonewst_sjwumo1bpf4,Tue Nov 24 15:00:02 +0000 2020
0,YahooNews,"Emily Murphy, the top official in General Services Administration in charge of making millions of dollars in transition funding available to the winner of the presidential election, said Monday that President-elect Joe Biden would receive those funds https://t.co/numj4ckdkU https://t.co/o3NUHR45T2",1331258892089774080,https://www.yahoo.com/news/in-latest-blow-to-trump-gsa-administrator-releases-transition-funds-to-biden-235344475.html?ncid=twitter_yahoonewst_sjwumo1bpf4,Tue Nov 24 15:30:28 +0000 2020
0,YahooNews,'Jeopardy!' will resume production with Ken Jennings as 1st interim guest host https://t.co/YvgRtDX0re https://t.co/eelQDUiC3t,1331262584092291075,https://news.yahoo.com/jeopardy-resume-production-ken-jennings-232800768.html?ncid=twitter_yahoonewst_sjwumo1bpf4,Tue Nov 24 15:45:08 +0000 2020
0,YahooNews,"The billionaire is working with the W.H.O., drugmakers and nonprofits to defeat the coronavirus everywhere, including in the world’s poorest nations. Can they do it? https://t.co/p9cSPsNYHi",1331266467799719938,https://news.yahoo.com/bill-gates-virus-quest-vaccinate-200200883.html?ncid=twitter_yahoonewst_sjwumo1bpf4,Tue Nov 24 16:00:34 +0000 2020
0,YahooNews,"Need a COVID-19 nurse? That'll be $8,000 a week https://t.co/km9bMooLPB https://t.co/kPTTOlRb7n",1331270110431096837,https://news.yahoo.com/covid-nurse-thatll-8-000-101943706.html?ncid=twitter_yahoonewst_sjwumo1bpf4,Tue Nov 24 16:15:02 +0000 2020
0,YahooNews,Pa. Lt. Gov. Fetterman says GOP 'put a Grubhub order in for chaos' after the election https://t.co/oTymcTbY9M https://t.co/lvh4Pqdpj9,1331274053542404096,https://news.yahoo.com/fetterman-says-gop-put-a-grubhub-order-in-for-chaos-after-the-election-202239990.html?ncid=twitter_yahoonewst_sjwumo1bpf4,Tue Nov 24 16:30:42 +0000 2020
0,YahooNews,"Optimism over the imminent deployment of a COVID-19 vaccine propelled the Dow Jones Industrial Average above 30,000 for the first time ever on Tuesday, extending a breathtaking rally that’s carried stocks deep into a bull market https://t.co/xrFMRCMgux https://t.co/VAdRmAf74Y",1331284147558608896,https://finance.yahoo.com/news/stock-market-news-live-november-24-2020-233338198.html?ncid=twitter_yahoonewst_sjwumo1bpf4,Tue Nov 24 17:10:49 +0000 2020
0,YahooNews,"Michele Flournoy,  Biden's probable pick to run the Pentagon, would be the first female secretary of defense if confirmed and could appoint an unprecedented number of women to senior roles at DoD

But she could also face resistance from progressive Dems https://t.co/HQlpdTbj7N https://t.co/eUp8TvW2hW",1331289089568595969,https://news.yahoo.com/flournoy-first-woman-run-pentagon-122115674.html?ncid=twitter_yahoonewst_sjwumo1bpf4,Tue Nov 24 17:30:27 +0000 2020
0,YahooNews,"Pennsylvania, Nevada certify Biden wins as battlegrounds make 2020 results official https://t.co/oZnklaehLO https://t.co/Bwu2YJ9Xcy",1331292826169192448,https://news.yahoo.com/pennsylvania-certifies-biden-victory-battlegrounds-164337356.html?ncid=twitter_yahoonewst_sjwumo1bpf4,Tue Nov 24 17:45:18 +0000 2020
0,YahooNews,"LIVE: President-elect Biden announces key foreign policy, national security nominees &amp; appointments  https://t.co/HismVkNgP2",1331293955347111941,https://twitter.com/i/broadcasts/1ypJdgVoMaVGW,Tue Nov 24 17:49:47 +0000 2020
0,YahooNews,Intelligence employees vent frustrations over being forced to return to the office https://t.co/FL2zLXAvas https://t.co/FTRF9qR2xx,1331294790844108801,https://www.yahoo.com/news/intelligence-employees-vent-frustrations-over-being-forced-to-return-to-the-office-100036400.html,Tue Nov 24 17:53:07 +0000 2020
0,YahooNews,Rapid testing could 'drive the epidemic toward extinction' https://t.co/EcvgCtcKeQ https://t.co/gFni7ElHfr,1331296739006042112,https://www.yahoo.com/news/rapid-testing-could-drive-the-epidemic-toward-extinction-164845892.html?ncid=twitter_yahoonewst_sjwumo1bpf4,Tue Nov 24 18:00:51 +0000 2020
0,YahooNews,Russia's defense ministry claimed on Tuesday that one of its warships had caught a U.S. Navy destroyer operating in Russia's Pacific territorial waters and chased it off https://t.co/wC3YY02NQV https://t.co/91QqHoHxPz,1331304152975216640,https://news.yahoo.com/russia-claims-chased-off-u-123648965.html?ncid=twitter_yahoonewst_sjwumo1bpf4,Tue Nov 24 18:30:19 +0000 2020
0,YahooNews,Joe Biden to join Lester Holt on ‘NBC Nightly News’ for first interview since election victory https://t.co/n5GZYLi9Sm https://t.co/k3QnffGDQZ,1331307864527413248,https://www.yahoo.com/news/joe-biden-join-lester-holt-003009294.html?ncid=twitter_yahoonewst_sjwumo1bpf4,Tue Nov 24 18:45:04 +0000 2020
0,YahooNews,"Nevada Supreme Court certifies Biden's presidential win, praises state's top election official https://t.co/bwLfjYiMUp https://t.co/qZFL1ECLeV",1331311639526838272,https://news.yahoo.com/nevada-supreme-court-certifies-bidens-181455938.html?ncid=twitter_yahoonewst_sjwumo1bpf4,Tue Nov 24 19:00:04 +0000 2020
0,YahooNews,Scotland becomes world's first country to make pads and tampons free https://t.co/N9v3wPTE4y https://t.co/yHNZqCrHGX,1331322981147176962,https://news.yahoo.com/scotland-set-become-worlds-first-163052285.html?ncid=twitter_yahoonewst_sjwumo1bpf4,Tue Nov 24 19:45:08 +0000 2020
0,YahooNews,Family sends Thanksgiving COVID-19 warning as 15 family members infected https://t.co/KjnYaG6bKA https://t.co/mQwEiX1FxV,1331326750001950724,https://www.yahoo.com/gma/family-sends-thanksgiving-covid-19-212900145.html?ncid=twitter_yahoonewst_sjwumo1bpf4,Tue Nov 24 20:00:06 +0000 2020
0,YahooNews,The presidential pardon of the Thanksgiving turkey has become an annual event. Here’s a look back from Truman to Trump https://t.co/anfrI84JIF https://t.co/A2DDHGZmY4,1331330505539772417,https://news.yahoo.com/photos-presidential-turkey-pardons-a-look-back-175624831.html?ncid=twitter_yahoonewst_sjwumo1bpf4,Tue Nov 24 20:15:02 +0000 2020
0,YahooNews,'Alarmingly low': US facing another blood shortage amid ongoing school closures https://t.co/Z7ylyV03yO https://t.co/OLdleagbG1,1331334280170139652,https://www.yahoo.com/gma/alarmingly-low-us-facing-another-110617349.html?ncid=twitter_yahoonewst_sjwumo1bpf4,Tue Nov 24 20:30:02 +0000 2020
0,YahooNews,Kentucky teenage cancer survivor dies from COVID-19 https://t.co/p9NZ15dhtz https://t.co/7FxsfksmcQ,1331338067106537472,https://news.yahoo.com/kentucky-teenage-cancer-survivor-dies-002900043.html?ncid=twitter_yahoonewst_sjwumo1bpf4,Tue Nov 24 20:45:04 +0000 2020
0,YahooNews,John Kerry returns as Biden's climate czar https://t.co/lIb5vFgB5H https://t.co/uyr3DyOlmh,1331341901593718786,https://news.yahoo.com/john-kerry-returns-as-bidens-climate-czar-203756282.html?ncid=twitter_yahoonewst_sjwumo1bpf4,Tue Nov 24 21:00:19 +0000 2020
0,YahooNews,RT @YahooNews: WATCH: Lame-duck Trump pardons turkeys https://t.co/JectgQDMjX https://t.co/3mwbJNET6P,1331348272074661890,https://news.yahoo.com/trump-turkey-pardon-thanksgiving-2020-lame-duck-corn-cob-203633819.html?ncid=twitter_yahoonewst_sjwumo1bpf4,Tue Nov 24 21:25:37 +0000 2020
0,YahooNews,"OxyContin-maker Purdue Pharma admits role in opioid epidemic, pleads guilty to federal charges https://t.co/6g8lrwUBiP https://t.co/je9PUrRtFR",1331349417916575751,https://news.yahoo.com/oxycontin-maker-purdue-pharma-admits-210646589.html?ncid=twitter_yahoonewst_sjwumo1bpf4,Tue Nov 24 21:30:11 +0000 2020
0,YahooNews,"The federal government recognized President-elect Joe Biden as the “apparent winner” of the Nov. 3 election, formally starting the transition of power after Trump spent weeks testing the boundaries of American democracy https://t.co/y1MDXdQlFL https://t.co/Y6LklmVehG",1331353154693324802,https://news.yahoo.com/biden-transition-gets-govt-ok-050846809.html?ncid=twitter_yahoonewst_sjwumo1bpf4,Tue Nov 24 21:45:02 +0000 2020
0,YahooNews,"Lisa Montgomery, the only woman on federal death row, is set to be executed on Jan. 12, just days before the inauguration of President-elect Joe Biden, who has pledged to end the death penalty https://t.co/gjRPQxGqgS https://t.co/8Im4VUkXhD",1331355731510128640,https://news.yahoo.com/u-execute-only-woman-federal-151115773.html?ncid=twitter_yahoonewst_sjwumo1bpf4,Tue Nov 24 21:55:16 +0000 2020
0,YahooNews,Home Depot agrees to $17.5m settlement in 2014 data breach https://t.co/4bFhCBJXNh https://t.co/kdUpEIkfMZ,1331356937083105285,https://news.yahoo.com/home-depot-agrees-17-5m-202653091.html?ncid=twitter_yahoonewst_sjwumo1bpf4,Tue Nov 24 22:00:03 +0000 2020
0,YahooNews,Restaurant workers out of work again as virus surges anew https://t.co/W2lppgxCUs https://t.co/gIRZzNMk0p,1331362971461832708,https://news.yahoo.com/restaurants-workers-again-virus-surges-182620804.html?ncid=twitter_yahoonewst_sjwumo1bpf4,Tue Nov 24 22:24:02 +0000 2020
