,name,text,id,url,created_at
0,NYDailyNews,Would you get a nasal swab test as part of your bar/meal package?,1329214378122616834,,Thu Nov 19 00:06:18 +0000 2020
0,NYDailyNews,"Canada, expected to have enough COVID-19 vaccine doses to administer to its residents several times over, plans to donate its excess doses to poorer countries
https://t.co/TXNL6zOg3p",1329215937493557248,https://www.nydailynews.com/coronavirus/ny-coronavirus-canada-donate-extra-vaccine-doses-poorer-countries-20201118-pcsjphnahfcw5gpbczozxzh4q4-story.html,Thu Nov 19 00:12:29 +0000 2020
0,NYDailyNews,"Apple will slice its App Store commission fees for smaller, less profitable app developers, but not for the big moneymakers
https://t.co/H0QMy9EI7C",1329217149626425348,https://www.nydailynews.com/news/national/ny-apple-app-store-fee-commission-cut-spotify-epic-20201118-t36hx4wamrfv5oniqeuec22ww4-story.html,Thu Nov 19 00:17:18 +0000 2020
0,NYDailyNews,"A maskless young couple attacked a 60-year-old woman who asked them to wear masks on a Brooklyn subway station elevator.

Cops need help identifying the thugs: (800) 577-TIPS.
https://t.co/3y2RpBs8mK",1329218548091265028,https://www.nydailynews.com/new-york/nyc-crime/ny-mask-fight-brooklyn-video-20201118-utwqo7fpbfbqnbsdfi73hgkjdy-story.html,Thu Nov 19 00:22:52 +0000 2020
0,NYDailyNews,"OPINION | A message to the maskless

Clearly, you must be an epidemiologist. Or an infectious disease specialist. 

Then again, you’re probably an economist.
https://t.co/Ks1TiD0W8F",1329219532150419457,https://www.nydailynews.com/opinion/ny-oped-a-message-to-the-maskless-20200624-abyd7zgavnflfc4wwfzecpvmbe-story.html,Thu Nov 19 00:26:46 +0000 2020
