,name,text,id,url,created_at
0,NYDailyNews,"The Sturgis Motorcycle Rally, which drew some 460,000 people to small-town South Dakota, is linked to dozens of coronavirus cases across state lines in Minnesota, the CDC says
https://t.co/myTEcXmP8G",1329938330537095168,https://www.nydailynews.com/coronavirus/ny-coronavirus-sturgis-motorcycle-rally-20201120-3zu52b2hhnhebbaxtkpqasbvze-story.html,Sat Nov 21 00:03:01 +0000 2020
0,NYDailyNews,"A rematch between a former GOP congressional member and the Democrat who ousted her from office has come down to just a few dozen votes, with a judge likely to play a role now.
https://t.co/rvpiMQjvgS",1329939857473474562,https://www.nydailynews.com/news/politics/new-york-elections-government/ny-election-2020-new-york-20201120-zb7rfo2gc5heffe7pgl7oie5gi-story.html,Sat Nov 21 00:09:05 +0000 2020
0,NYDailyNews,The NYPD released body-cam footage Friday that includes the sounds of 59 police shots and frantic commands on a quiet Queens street. https://t.co/V3x11DzbzF,1329940861996724227,https://www.nydailynews.com/new-york/nyc-crime/ny-body-cameras-queens-shooting-nypd-20201120-orog2mp235el5c3ea6nhwtj6be-story.html,Sat Nov 21 00:13:05 +0000 2020
0,NYDailyNews,"Celebrity chef Gordon Ramsay reportedly donated $50,000 to support cancer treatment for Ben Watkins, a promising young cooking star on “MasterChef Junior” who died at age 14 this week. https://t.co/GOFak7uZ0J",1329944115149148161,https://www.nydailynews.com/news/national/ny-20201120-l7paoionorcp3gyuc4yjod6pou-story.html,Sat Nov 21 00:26:00 +0000 2020
