,name,text,id,url,created_at
0,TheAtlantic,"“You about to lose yo job,” a months-old warning from a Black woman to the officer detaining her, has become the protest song of the moment. @skornhaber on how demonstrators are creating new political anthems: https://t.co/5iroPDODmy",1325595280583118850,-1,Mon Nov 09 00:25:17 +0000 2020
0,TheAtlantic,"A new poem by @officialdonika: ""I think of you, in the spring soon come. / Friend, should you give a holler from your porch,"" https://t.co/0kyisSYWWU",1325610598269415425,-1,Mon Nov 09 01:26:09 +0000 2020
0,TheAtlantic,"Hundreds of centuries-old European shipwrecks seem to have vanished without a trace. The suspected culprit? Worms, writes @MatthewHalliday. 
https://t.co/O1PNQK9O6p",1325618198293716995,-1,Mon Nov 09 01:56:21 +0000 2020
0,TheAtlantic,"A press conference so bizarre, it demanded poetry. James Parker's ode to Philadelphia's other Four Seasons: https://t.co/g640gmfiCK",1325634203422224384,-1,Mon Nov 09 02:59:57 +0000 2020
0,TheAtlantic,"“FDT,” this era’s signature protest song, attracted attention for its outrage against Donald Trump, @skornhaber writes. But the track’s co-writer, the late Nipsey Hussle, knew that through carefully crafted verses, the song's message could create unity. https://t.co/lXBcPKb44x",1325642028693282822,-1,Mon Nov 09 03:31:03 +0000 2020
0,TheAtlantic,"From Buffalo, through the Finger Lakes, to the Hudson Valley, Manhattan, and more, here are a few glimpses of the landscape of New York, and some of the wildlife and people calling it home—via @TheAtlPhoto: https://t.co/7kl9Wq4nue",1325649752059424768,-1,Mon Nov 09 04:01:44 +0000 2020
0,TheAtlantic,"""You can’t understand the present without seeing the connections between this history and the socioeconomic and racial imbalances it created."" Chuck Yarborough talked to @KristinaRizga about resetting students' understanding of the Civil War: https://t.co/SjeoMojbz9",1325657642220609541,-1,Mon Nov 09 04:33:06 +0000 2020
