,name,text,id,url,created_at
0,TheAtlantic,"Taylor Swift’s surprise eighth album, “Folklore,” has been nominated for six Grammy Awards. Swift’s writing in the album is “the stuff of which obsessive listening is built,” @skornhaber wrote in July. https://t.co/hYhBHkV1fO",1331389728323735553,-1,Wed Nov 25 00:10:21 +0000 2020
0,TheAtlantic,Experts are predicting a significant drop-off in births in the U.S. next year. @jpinsk reports on its possible size and consequences: https://t.co/r78snh4L9K,1331397353056718849,-1,Wed Nov 25 00:40:39 +0000 2020
0,TheAtlantic,"""In a pandemic, what is individually rational can be collectively disastrous,"" @Yascha_Mounk writes: https://t.co/1Go4rK6C87",1331403510747951105,-1,Wed Nov 25 01:05:07 +0000 2020
0,TheAtlantic,"BTS’s English-language single, ‘Dynamite,’ has been nominated for a Grammy Award for Best Pop Duo/Group Performance. Earlier this fall, Lenika Cruz explained how the group—and its fans—are helping upend the music industry: https://t.co/s5YTnPzc2E",1331409568883216391,-1,Wed Nov 25 01:29:12 +0000 2020
0,TheAtlantic,"If you insist on having a Thanksgiving gathering this year, here's how to reduce the risk, writes @jameshamblin: https://t.co/y3TtvdcpwR",1331417181448511491,-1,Wed Nov 25 01:59:27 +0000 2020
