,name,text,id,url,created_at
0,CNN,"Looking for the lowest prices on the best products? We’ve got you covered. @CNNUnderscored: Uncovering the best.

https://t.co/t6YhC975C0 https://t.co/Pg7uL3wRkL",1308194372731768841,https://www.cnn.com/cnn-underscored?source=twitter,Tue Sep 22 00:00:18 +0000 2020
0,CNN,"A man has been arrested after driving his Dodge sedan over a rising drawbridge ""Dukes of Hazzard"" style, authorities say.

He was speeding when he drove through a security gate and went airborne, landing on the other side of the bridge, prosecutors say. https://t.co/nGj6XpzArt",1308199405774876679,https://www.cnn.com/2020/09/21/us/driver-drawbridge-detroit-arrest-trnd/index.html?utm_content=2020-09-22T00%3A20%3A17&utm_term=link&utm_medium=social&utm_source=twCNN,Tue Sep 22 00:20:18 +0000 2020
0,CNN,Florida Gov. Ron DeSantis has released a sweeping set of proposals that would dramatically crack down on people who attend protests that turn violent or disorderly by threatening them with a mix of felonies and increased jail time https://t.co/Whvq7moyvf,1308201756204171264,https://www.cnn.com/2020/09/21/politics/florida-desantis-protests-legislation-trnd/index.html?utm_term=link&utm_content=2020-09-22T00%3A29%3A38&utm_source=twCNN&utm_medium=social,Tue Sep 22 00:29:38 +0000 2020
0,CNN,"Justice Ruth Bader Ginsburg's death leaves the Supreme Court with a vacancy just weeks before the presidential election.

Here's what we know about what happens next, and why it matters. https://t.co/jfUvGx5ge8",1308206268633542657,https://www.cnn.com/2020/09/21/politics/supreme-court-nomination-process-explainer/index.html?utm_content=2020-09-22T00%3A47%3A33&utm_term=link&utm_medium=social&utm_source=twCNN,Tue Sep 22 00:47:34 +0000 2020
0,CNN,Some Twitter users are pointing out that the automatic method the platform employs to display previews of images may be biased toward showing pictures of white people. Twitter agreed the issues was something it needs to work on. https://t.co/k1dUNfhc1D,1308209295759155200,https://www.cnn.com/2020/09/21/tech/twitter-racial-bias-preview/index.html?utm_content=2020-09-22T00%3A59%3A35&utm_term=link&utm_medium=social&utm_source=twCNN,Tue Sep 22 00:59:36 +0000 2020
0,CNN,"In a new ad from the Georgia GOP senator's campaign, a woman asks, ""Did you know Kelly Loeffler was ranked the most conservative senator in America?""

A man replies, ""Yup, she's more conservative than Attila the Hun."" https://t.co/izRxGP5EKZ",1308212592616374272,https://www.cnn.com/2020/09/21/politics/kelly-loeffler-ad-attila-the-hun/index.html?utm_source=twCNN&utm_medium=social&utm_term=link&utm_content=2020-09-22T01%3A12%3A41,Tue Sep 22 01:12:42 +0000 2020
0,CNN,"Justice Ruth Bader Ginsburg will become the first woman in history to lie in state in the US Capitol when her casket is placed in National Statuary Hall on Friday, according to congressional historians https://t.co/5chyaORQCP",1308215150965673987,https://www.cnn.com/2020/09/21/politics/ruth-bader-ginsburg-funeral-plans/index.html?utm_medium=social&utm_source=twCNN&utm_content=2020-09-22T01%3A22%3A51&utm_term=link,Tue Sep 22 01:22:52 +0000 2020
0,CNN,"The Pentagon's two most senior figures were so angry about President Trump's unprecedented attack on senior military leadership earlier this month that they got on the phone with the White House chief of staff to express their dismay, sources say https://t.co/5kmC6kBKiQ",1308217888529174534,https://www.cnn.com/2020/09/21/politics/esper-milley-trump/index.html?utm_term=link&utm_content=2020-09-22T01%3A33%3A44&utm_source=twCNN&utm_medium=social,Tue Sep 22 01:33:44 +0000 2020
0,CNN,"Michelob Ultra is hiring a ""chief exploration officer"" to travel the country for six months and represent the brand at national parks.

The pay: $50,000 plus expenses. https://t.co/irXPtSA8sY",1308225958713982977,https://edition.cnn.com/travel/article/michelob-ultra-chief-exploration-officer-trnd/index.html?utm_medium=social&utm_source=twCNN&utm_content=2020-09-22T02%3A05%3A48&utm_term=link,Tue Sep 22 02:05:48 +0000 2020
0,CNN,"""What they had on the website for a short period of time ... really does reflect the science"" - Dr. Sanjay Gupta on… https://t.co/S8bt8PFHah",1308226483534487552,https://twitter.com/i/web/status/1308226483534487552,Tue Sep 22 02:07:54 +0000 2020
0,CNN,RT @OutFrontCNN: CNN's Erin Burnett shows Sen. John Barrasso his own words from 2016 about a filling Supreme Court vacancy during an election year. https://t.co/fJDEs1orHn https://t.co/HgeX59aKcp,1308226721808703489,https://www.cnn.com/videos/politics/2020/09/21/john-barrasso-gop-senate-supreme-court-nomination-vote-ebof-sot-vpx.cnn,Tue Sep 22 02:08:50 +0000 2020
0,CNN,"Nearly 200,000 Americans have been killed by coronavirus.

""Tonight, we remember,"" says @andersoncooper. ""…The numbers are staggering, the list of names staggering. ... Each is a person with a family and people who love them and miss them terribly."" https://t.co/BrwSTOHUQo https://t.co/Nmr7u2wTI9",1308227233618620417,https://www.cnn.com/world/live-news/coronavirus-pandemic-09-21-20-intl/index.html?utm_medium=social&utm_source=twCNN&utm_content=2020-09-22T02:10:36,Tue Sep 22 02:10:52 +0000 2020
0,CNN,“It’s incredibly confusing because … the science on this is clear; airborne transmission is not only just a real th… https://t.co/b2uQIZFdWT,1308229135743942659,https://twitter.com/i/web/status/1308229135743942659,Tue Sep 22 02:18:26 +0000 2020
0,CNN,"Edward Snowden, the former CIA contractor who leaked intelligence secrets in 2013, has agreed to forfeit more than $5 million he earned from his book and speaking fees to the US government, according to court records https://t.co/BkzS2oOiOB",1308229563458125824,https://www.cnn.com/2020/09/21/politics/edward-snowden-money-books/index.html?utm_source=twCNN&utm_medium=social&utm_term=link&utm_content=2020-09-22T02%3A20%3A07,Tue Sep 22 02:20:08 +0000 2020
0,CNN,"Joe Biden's campaign has centered its strategy on the traits that make the former vice president a unique political figure — empathy, calm and compassion — and actively tried to stay away from matching President Trump's online fire with more fire https://t.co/6I6TvgY70B",1308232155735248896,https://www.cnn.com/2020/09/21/politics/biden-campaign-digital-strategy/index.html?utm_medium=social&utm_source=twCNN&utm_content=2020-09-22T02%3A30%3A25&utm_term=link,Tue Sep 22 02:30:26 +0000 2020
0,CNN,"The Pima County Attorney's Office in Arizona has declined to file charges against four Tucson police officers who were involved in an April incident that left a man dead, according to a report released by the office https://t.co/vsZQwVnDM6",1308236100553539586,https://www.cnn.com/2020/09/21/us/no-charges-4-tucson-police-carlos-lopez-ingram-death/index.html?utm_term=link&utm_content=2020-09-22T02%3A46%3A06&utm_source=twCNN&utm_medium=social,Tue Sep 22 02:46:06 +0000 2020
0,CNN,"""All of you Republicans in the Senate said it was wrong to do it with an election that close and now you all just s… https://t.co/6dRfL8tGZF",1308248009361195008,https://twitter.com/i/web/status/1308248009361195008,Tue Sep 22 03:33:26 +0000 2020
0,CNN,This melting wax panther is an artistic metaphor for the toll human-caused climate change is taking on Florida's wildlife and people. And scientists say it could get even worse. https://t.co/Eu0W1dLf18,1308249429372215296,https://www.cnn.com/2020/09/21/weather/florida-panther-sculpture-climate-change-trnd/index.html?utm_content=2020-09-22T03%3A39%3A04&utm_term=link&utm_medium=social&utm_source=twCNN,Tue Sep 22 03:39:04 +0000 2020
0,CNN,"""We're going to take our case to the American people.""

Democratic Sen. Richard Blumenthal lays out his party's options to stop President Trump's pick to fill the late Supreme Court Justice Ruth Bader Ginsburg's seat. https://t.co/v9w7iay8qo https://t.co/LUYOlmlQXa",1308253091276390400,https://www.cnn.com/politics/live-news/us-election-news-09-21-2020/index.html?utm_medium=social&utm_content=2020-09-22T03%3A53%3A36&utm_term=video&utm_source=twCNN,Tue Sep 22 03:53:37 +0000 2020
0,CNN,"""I am not going to give up because Ruth Bader Ginsburg never gave up."" 

Sen. Amy Klobuchar says she and Democrats… https://t.co/7ADalwdHeh",1308256627640864768,https://twitter.com/i/web/status/1308256627640864768,Tue Sep 22 04:07:40 +0000 2020
0,CNN,"“Doing it in this political fashion will harm the Supreme Court for decades to come and it certainly so demeans what the US Senate should be,” Democratic @SenatorLeahy says on Republicans attempting to fill the Supreme Court vacancy before the election. https://t.co/JPaihNRAMz https://t.co/bGhQPiJUmx",1308257110975684608,https://www.cnn.com/2020/09/21/politics/supreme-court-confirmation-fight-congress-state-of-play/index.html?utm_medium=social&utm_source=twCNN&utm_content=2020-09-21T21:11:00,Tue Sep 22 04:09:36 +0000 2020
0,CNN,"""It's not over,"" says Democratic Sen. Chris Murphy, even as two key senators say they'll back Majority Leader Mitch McConnell's push to vote on a Supreme Court nominee. https://t.co/FVbWxiRCk9 https://t.co/QiPs9hteEU",1308257755569049601,https://www.cnn.com/politics/live-news/us-election-news-09-21-2020/index.html?utm_content=2020-09-22T04%3A12%3A02&utm_term=video&utm_medium=social&utm_source=twCNN,Tue Sep 22 04:12:09 +0000 2020
0,CNN,"""They died holding hands.""

@brikeilarcnn grows emotional telling the story of a husband and wife who died together in North Carolina after battling Covid-19.

""Their son ... says the family feels cheated."" https://t.co/NPYRflyw8R https://t.co/dcgKXcm1WI",1308260105876459521,https://www.cnn.com/2020/09/20/us/north-carolina-married-couple-covid-death-trnd/index.html?utm_medium=social&utm_source=twCNN&utm_content=2020-09-21T19:57:14,Tue Sep 22 04:21:30 +0000 2020
0,CNN,"Several subway signs in New York City were temporarily altered to read ""Ruth St"" over the weekend to honor the late Justice Ruth Bader Ginsburg https://t.co/qOWsw67R4Y",1308260586657067009,https://www.cnn.com/2020/09/21/us/ruth-st-nyc-subway-signs-trnd/index.html?utm_medium=social&utm_source=twCNN&utm_content=2020-09-22T04%3A23%3A24&utm_term=link,Tue Sep 22 04:23:24 +0000 2020
