,name,text,id,url,created_at
0,CNBC,"We still have two months left in 2020, but the IRS has already released a breakdown of next year’s marginal income tax rates. https://t.co/lWOtFBvAUS",1321967297754521600,https://www.cnbc.com/2020/10/26/here-are-the-new-income-tax-brackets-for-2021.html?__source=twitter%7Cmain,Fri Oct 30 00:08:59 +0000 2020
0,CNBC,"COVID-19 misinformation is everywhere, and companies are trying to control it. In April, 47% of Republicans believed that the coronavirus has been made a bigger deal than it really is. By June, it grew to 63%. Among Democrats, it went from 14% to 18%. https://t.co/YaT1tD7TsK https://t.co/MPhnyu0lQv",1321969062864453632,https://www.cnbc.com/2020/07/19/covid-19-misinformation-is-everywhere-but-it-could-have-been-worse.html?__source=twitter%7Cmain,Fri Oct 30 00:16:00 +0000 2020
0,CNBC,Etsy CEO calls this is the 'perfect moment' to invest in marketing https://t.co/hS45E0rKlx,1321969700096659456,https://www.cnbc.com/2020/10/29/etsy-ceo-calls-this-is-the-perfect-moment-to-invest-in-marketing.html?__source=twitter%7Cmain,Fri Oct 30 00:18:32 +0000 2020
0,CNBC,"RT @thenewsoncnbc: How can you say no to these cute pups?🐶The pandemic puppy frenzy first took off in March, and demand is still high — especially for Goldendoodles. Take a look. https://t.co/z8ck34ylGLHow can you say no to these cute pups?🐶The pandemic puppy frenzy first took off in March, and demand is still high… https://t.co/oFvuOj880X",1321970190138118155,https://twitter.com/i/web/status/1321969774604226563,Fri Oct 30 00:20:29 +0000 2020
0,CNBC,Apple One subscription bundles launch on Friday starting at $14.95 a month. https://t.co/QET5JLiOJ3,1321973836456337410,https://www.cnbc.com/2020/10/29/-apple-one-launches-friday-at-14point95-a-month.html?__source=twitter%7Cmain,Fri Oct 30 00:34:58 +0000 2020
0,CNBC,Virgin Galactic is sharing a first glimpse inside the cabin that will carry passengers to the edge of space and back — take a look. https://t.co/lsLfxk2Jdd https://t.co/XPRaEH7Gx8,1321974347842703361,https://www.cnbc.com/2020/07/28/virgin-galactics-spaceship-cabin-interior-and-seats-revealed.html?__source=twitter%7Cmain,Fri Oct 30 00:37:00 +0000 2020
0,CNBC,"RT @lesliejosephs: Delta, pilots union reach preliminary deal to avoid close to 2,000 furloughs. Down to the wire with cuts looming on Nov. 1. https://t.co/RX6gA7ocf1",1321976793411293184,https://www.cnbc.com/2020/10/29/delta-and-pilot-union-reach-preliminary-deal-to-avoid-furloughs-until-2022.html,Fri Oct 30 00:46:43 +0000 2020
0,CNBC,Apple now has $191.83 billion in cash on hand — down nearly 7% from a year ago. https://t.co/wjoG1wtZIC,1321977087150956545,https://www.cnbc.com/2020/10/29/apple-q4-cash-hoard-heres-how-much-apple-has-on-hand.html?__source=twitter%7Cmain,Fri Oct 30 00:47:53 +0000 2020
0,CNBC,"On Alibaba's Singles Day, Chinese shoppers set to splurge on foreign brands as fewer travel overseas https://t.co/JATz6rv5zb",1321979908327964674,https://www.cnbc.com/2020/10/29/alibaba-singles-day-foreign-brands-expected-to-be-a-big-hit.html?__source=twitter%7Cmain,Fri Oct 30 00:59:06 +0000 2020
0,CNBC,"In the U.S. and Canada, Facebook’s user base fell to 196 million daily active users from 198 million a quarter earlier. https://t.co/j9tdF3Lw4X",1321983851200131072,https://www.cnbc.com/2020/10/29/facebook-fb-earnings-q3-2020.html?__source=twitter%7Cmain,Fri Oct 30 01:14:46 +0000 2020
0,CNBC,Here’s how Robinhood and Covid opened the floodgates for 13 million amateur stock traders. Watch the full video here: https://t.co/IkXIlAgJb6 https://t.co/bBReCUiS5c,1321984414021152768,https://www.cnbc.com/2020/10/07/how-robinhood-and-covid-introduced-millions-to-the-stock-market.html?__source=twitter%7Cmain,Fri Oct 30 01:17:00 +0000 2020
0,CNBC,You may be able to score a free Thanksgiving dinner this year by shopping at Walmart. Here's how. (via @CNBCMakeIt) https://t.co/c2F9tMWY5o,1321995139234045952,https://www.cnbc.com/2020/10/29/get-a-free-thanksgiving-dinner-this-year-by-shopping-at-walmart.html?__source=twitter%7Cmain,Fri Oct 30 01:59:37 +0000 2020
0,CNBC,How do local police get military grade weaponry and equipment and pay very little for it? https://t.co/mrsAoeANYr https://t.co/3DYMzPPMYF,1321998003557732352,https://www.cnbc.com/2020/07/09/why-police-pay-nothing-for-military-equipment.html?__source=twitter%7Cmain,Fri Oct 30 02:11:00 +0000 2020
0,CNBC,"Former First Lady Michelle Obama offered words of empowerment and inspiration to Black Girls Lead, an organization providing young Black girls with mentorship, discussion and networking opportunities. #investinyou (in partnership with @acorns.) https://t.co/GXpTtb8UIW https://t.co/8jCHrYtYUO",1322004798254755842,https://www.cnbc.com/2020/08/26/michelle-obama-heres-what-it-takes-for-black-girls-to-become-leaders.html?__source=twitter%7Cmain,Fri Oct 30 02:38:00 +0000 2020
0,CNBC,UBS gives 3 reasons for why the Chinese yuan is 'attractive' right now https://t.co/kc4XqVb9Zo,1322005384941416448,https://www.cnbc.com/2020/10/30/ubs-gives-3-reasons-for-why-the-chinese-yuan-is-attractive-right-now.html?__source=twitter%7Cmain,Fri Oct 30 02:40:20 +0000 2020
0,CNBC,Here are 5 in-demand seasonal jobs: A few pay more than $40 per hour. (via @CNBCMakeIt) https://t.co/GzR7A5IFB5,1322008901433348096,https://www.cnbc.com/2020/10/29/5-in-demand-seasonal-jobs-a-few-pay-more-than-40-per-hour.html?__source=twitter%7Cmain,Fri Oct 30 02:54:18 +0000 2020
0,CNBC,Education experts weigh in on Biden’s proposal to triple funding for low-income schools. (via @CNBCMakeIt) https://t.co/Uiizm8kLJO,1322012340657786912,https://www.cnbc.com/2020/10/28/biden-proposes-tripling-funding-for-low-income-schools.html?__source=twitter%7Cmain,Fri Oct 30 03:07:58 +0000 2020
0,CNBC,"Today, Nintendo is part of a crowded video game market and competes with Sony, Microsoft, Apple and Google. But the company has been around for 130 years, so how has it been able to stay relevant for so long? https://t.co/gE3QGlW59G https://t.co/x8Utm4A7Xq",1322020149453414401,https://www.cnbc.com/2020/04/12/the-failures-and-successes-that-kept-nintendo-relevant-for-130-years.html?__source=twitter%7Cmain,Fri Oct 30 03:39:00 +0000 2020
0,CNBC,China's Huawei smartphone shipments plunge as U.S. sanctions continue to bite https://t.co/2zmsZC7xEQ,1322022943459889152,https://www.cnbc.com/2020/10/30/huawei-q3-smartphone-shipments-plunge-as-us-sanctions-continue-to-bite.html?__source=twitter%7Cmain,Fri Oct 30 03:50:06 +0000 2020
0,CNBC,"""Dirty Jobs"" host Mike Rowe: Following your passion ""rarely works out"" — do this instead. https://t.co/U5tU76TvEl (via @CNBCMakeIt) https://t.co/wOQKWhY8qS",1322057646384521218,https://www.cnbc.com/2020/07/07/dirty-jobs-mike-rowes-career-advice-follow-opportunity-not-passion.html?__source=twitter%7Cmakeit,Fri Oct 30 06:08:00 +0000 2020
0,CNBC,"Here's why you're not getting a $1,200 stimulus check before election day. #investinyou (In partnership with @acorns.) https://t.co/rJIDQ20iDo",1322057967378845697,https://www.cnbc.com/2020/10/29/coronavirus-relief-bill-second-stimulus-checks-election.html?__source=twitter%7Cmain,Fri Oct 30 06:09:16 +0000 2020
0,CNBC,"India’s gold demand fell 30%, but ‘cautious optimism’ may be returning https://t.co/SpYVSbuCQR",1322067702509408256,https://www.cnbc.com/2020/10/30/india-gold-demand-fell-world-gold-council.html?__source=twitter%7Cmain,Fri Oct 30 06:47:57 +0000 2020
