,text,notes,date
https://nypost.com/2020/09/11/nasa-measures-california-wildfire-temperatures-from-iss/,NASA measures California wildfire temperatures from ISS,,20200914-1400
https://nypost.com/2020/09/11/pentagon-planning-pilot-versus-ai-controlled-fighter-jet-showdown/,Pentagon planning pilot versus AI-controlled fighter jet showdown,,20200914-1400
https://nypost.com/2020/09/11/apple-loosens-some-of-its-in-app-app-store-payment-rules-amid-controversy/,Apple loosens some of its in-app payment rules amid controversy,,20200914-1400
https://nypost.com/2020/09/11/microsoft-xbox-series-x-may-have-just-forced-sony-to-lower-the-playstation-5s-price/,Sony may discount PlayStation 5 after Xbox Series X price reveal,,20200914-1400
https://nypost.com/2020/09/11/tesla-plans-to-expand-electric-supercharger-network-in-europe/,Tesla plans to expand electric supercharger network in Europe,,20200914-1400
https://nypost.com/2020/09/10/megyn-kelly-gets-into-podcasting-with-devil-may-care-media/,Megyn Kelly returning to media with new venture,,20200914-1400
https://nypost.com/2020/09/12/cnn-anchor-chris-cuomo-praises-rudy-giuliani-for-9-11-response/,Chris Cuomo praises Rudy Giuliani for 9/11 response,,20200914-1400
https://nypost.com/2020/09/11/nfl-ratings-plummet-in-chiefs-texans-season-opener/,NFL ratings plummet in season opener,,20200914-1400
https://nypost.com/2020/09/10/new-york-times-theater-critic-ben-brantley-stepping-down/,New York Times theater critic Ben Brantley stepping down,,20200914-1400
https://nypost.com/2020/09/11/spy-thriller-tenet-to-be-screened-at-los-angeles-drive-ins/,Spy thriller 'Tenet' to be screened at Los Angeles drive-ins,,20200914-1400
https://nypost.com/2020/09/14/police-shoot-knife-wielding-man-in-lancaster-pennsylvania/,'Justice' protests erupt for knife-wielding attacker shot dead after charging PA cop,,20200914-1430
https://nypost.com/2020/09/14/ex-porn-star-zoe-parker-dead-at-24/,"Ex-porn star Zoe Parker dead at 24, months after leaving industry",,20200914-1430
https://nypost.com/2020/09/14/man-who-pooped-on-pelosis-driveway-calls-it-peaceful-protest/,Here's why a homeless YouTuber pooped in Pelosi's driveway — and filmed it,,20200914-1430
https://nypost.com/2020/09/14/trump-accepts-offer-from-joe-rogan-to-moderate-debate-with-biden/,Joe Rogan details terms if he were to host a Trump-Biden debate,,20200914-1430
https://nypost.com/2020/09/14/jamal-adams-shades-jets-after-seahawks-debut-not-used-to-it/,Jamal Adams shades Jets after monster Seahawks debut: 'Not used to it',,20200914-1430
https://nypost.com/2020/09/13/andrew-cuomos-parole-board-keeps-setting-monsters-free/,Andrew Cuomo's Parole Board keeps setting monsters free,,20200914-1430
https://nypost.com/2020/09/11/will-smith-finally-buries-hatchet-with-first-aunt-viv-janet-hubert/,Will Smith finally buries hatchet with 'First Aunt Viv' Janet Hubert,,20200914-1430
https://nypost.com/2020/09/11/florida-man-arrested-for-impersonating-officer-after-pulling-over-cop/,Florida man arrested for impersonating officer after trying to pull over real cop,,20200914-1430
https://nypost.com/2020/09/11/kids-return-to-school-as-nyc-celebrates-labor-day-the-posts-week-in-photos/,Kids return to school as NYC celebrates Labor Day: The Post's week in photos,,20200914-1430
https://nypost.com/2020/09/14/raging-west-coast-wildfires-could-worsen-with-rising-wind-gusts/,Raging West Coast wildfires could get worse this week,,20200914-1430
https://nypost.com/2020/09/14/la-county-deputies-out-of-surgery-after-ambush-shooting-in-compton/,Two LA County deputies out of surgery after ambush shooting,,20200914-1430
https://nypost.com/2020/09/14/us-ambassador-to-china-terry-branstad-to-step-down/,US ambassador to China to step down as tensions escalate with Beijing,,20200914-1430
https://nypost.com/2020/09/14/crowd-aims-lock-him-up-chant-at-obama-during-trump-rally/,Crowd chants ‘Lock him up’ after Trump accuses Obama of ‘spying’ on campaign,,20200914-1430
https://nypost.com/2020/09/14/biden-condemns-violence-of-any-kind-after-officers-shootings/,"Joe Biden condemns 'violence of any kind' after officers shot in LA, NC",,20200914-1430
https://nypost.com/2020/09/13/armed-oregonians-set-up-roadblocks-ask-for-ids-amid-wildfires/,Armed Oregonians set up illegal roadblocks as wildfire conspiracies spread,,20200914-1430
https://nypost.com/2020/09/13/west-coast-smoke-seen-sucked-into-cyclone-over-1000-miles-away/,"West Coast wildfire smoke seen sucked into cyclone over 1,000 miles away",,20200914-1430
https://nypost.com/2020/09/14/tropical-storm-sally-could-hit-new-orleans-as-category-2-hurricane/,Another 'life-threatening' storm could hit US as a hurricane,,20200914-1430
https://nypost.com/covers/,Browse covers archive,,20200914-1430
https://nypost.com/2020/09/13/ciara-posts-tribute-to-husband-russell-wilson-on-nfl-week-1/,Ciara celebrates Russell Wilson on game day: ‘Hardest working man I know’,,20200914-1430
https://nypost.com/horoscopes/virgo/,Virgo,,20200914-1430
https://nypost.com/horoscopes/,See all Horoscopes,,20200914-1430
https://nypost.com/2020/09/14/drew-barrymore-on-her-new-talk-show-the-rule-book-is-on-fire/,Drew Barrymore on her new talk show: 'The rule book is on fire',,20200914-1430
https://nypost.com/2020/09/14/the-most-important-thing-to-remember-in-joe-judges-giants-debut/,The most important thing to remember in Joe Judge's debut,,20200914-1430
https://nypost.com/2020/09/14/desperation-is-last-hope-for-maddening-mets/,Desperation is last hope for maddening Mets,,20200914-1430
https://nypost.com/2020/09/14/five-people-infected-by-flesh-eating-bacteria-from-long-island-sound/,Five people infected by flesh-eating bacteria from Long Island Sound,,20200914-1430
https://nypost.com/2020/09/14/youtuber-livestreams-himself-taking-poop-on-nancy-pelosis-driveway/,YouTuber livestreams himself taking poop on Nancy Pelosi's driveway,,20200914-1430
https://nypost.com/2020/09/14/jets-miss-cj-mosley-the-most-in-disturbing-loss-to-bills/,The player Jets miss the most in truly disturbing performance,,20200914-1430
https://nypost.com/2020/09/14/bruce-arians-doesnt-hold-back-on-tom-brady-bad-decision/,Bucs coach doesn't hold back on Tom Brady: 'Bad decision',,20200914-1430
https://nypost.com/2020/09/13/knicks-first-workout-back-could-feature-chris-paul-irony/,Knicks' first workout back could feature Chris Paul irony,,20200914-1430
https://nypost.com/2020/09/13/devante-downs-is-shocking-answer-to-giants-linebacker-need/,Unknown linebacker is shocking Giants starter,,20200914-1430
https://nypost.com/2020/09/14/ny-lawmakers-propose-law-to-prevent-trump-from-avoiding-prosecution/,NY lawmakers propose law to prevent Trump from avoiding prosecution,,20200914-1430
https://nypost.com/2020/09/13/chuck-schumer-clanks-as-he-tries-stand-up-alongside-jerry-seinfeld/,Schumer clanks as he tries stand-up alongside Jerry Seinfeld,,20200914-1430
https://nypost.com/2020/09/14/2-wounded-in-overnight-brooklyn-and-queens-shootings/,Two hurt in overnight Brooklyn and Queens shootings,,20200914-1430
https://nypost.com/2020/09/13/de-blasio-downplayed-dire-extent-of-nycha-lead-poisoning-issue/,De Blasio downplayed dire extent of NYCHA lead poisoning issue,,20200914-1430
https://nypost.com/2020/09/12/lucky-letter-landed-judge-judys-bailiff-a-career-in-hollywood/,Lucky letter landed Judge Judy's bailiff a career in Hollywood,,20200914-1430
https://nypost.com/2020/09/12/theaters-may-not-be-safe-for-a-year-or-more-fauci/,"It may be more than a year before we can safely go to theaters, Fauci says",,20200914-1430
https://nypost.com/2020/09/14/oracles-tiktok-deal-may-not-include-apps-key-algorithm/,TikTok's deal with Oracle may not include app's key algorithm,,20200914-1430
https://nypost.com/2020/09/14/pfizer-should-know-if-covid-vaccine-works-by-end-of-october/,Pfizer says it should know if COVID-19 vaccine works by end of October,,20200914-1430
https://nypost.com/2020/09/13/microsoft-rejected-oracle-wins-bid-for-tiktoks-us-operations/,"Microsoft rejected, Oracle wins bid for TikTok's US operations",,20200914-1430
https://nypost.com/2020/09/12/feds-cant-scapegoat-google-and-big-tech-as-anti-trust-targets-forever/,Feds can't scapegoat Google and Big Tech as anti-trust targets forever,,20200914-1430
https://nypost.com/2020/09/11/nyse-eyes-exiting-nj-if-state-taxes-stock-trades/,NYSE may move trading systems from NJ over stock trade taxes,,20200914-1430
https://nypost.com/2020/09/13/columbus-statue-swiped-from-apartment-building/,Columbus statue swiped from apartment building in name of cancel culture: Devine,,20200914-1430
https://nypost.com/2020/09/13/biden-cant-answer-without-a-script-how-can-he-run-the-country/,"If Biden can't answer questions without a script, how can he run the country?",,20200914-1430
https://nypost.com/2020/09/13/welkin-health-startup-cut-staff-three-days-before-ppp-loan/,Josh Kushner-linked startup axed staff three days before snagging PPP loan,,20200914-1430
https://nypost.com/2020/09/13/new-york-city-needs-more-neighborhoods-in-revolt-against-city-hall/,New York City needs more neighborhoods in revolt against City Hall,,20200914-1430
https://nypost.com/2020/09/09/princess-dianas-stylist-on-recreating-her-do-for-the-crown/,Princess Diana's stylist: It was 'weird' to recreate her hair for 'The Crown',,20200914-1430
https://nypost.com/2020/09/12/naomi-campbell-sued-her-billionaire-ex-months-before-he-sued-her/,Naomi Campbell trades lawsuits with billionaire ex in ugly uncoupling,,20200914-1430
https://nypost.com/2020/09/11/louis-vuitton-is-designing-a-luxury-face-shield-for-nearly-1k/,Louis Vuitton designed a luxury face shield selling for nearly $1K,,20200914-1430
https://nypost.com/2020/09/13/20-non-medical-face-masks-that-wont-clash-with-your-ootd/,20 non-medical face masks that won’t clash with your OOTD,,20200914-1430
https://nypost.com/article/where-to-buy-n95-masks-online-to-protect-yourself-from-covid-19/,Mask and you shall receive: Where to pick up the best face coverings,,20200914-1430
https://nypost.com/2020/09/12/18-coffee-makers-brewers-and-accessories-that-are-on-sale/,"18 coffee makers, brewers and accessories that are on sale",,20200914-1430
https://nypost.com/2020/09/12/get-leadership-and-business-coaching-training-for-just-40/,Get leadership and business coaching training for just $40,,20200914-1430
https://nypost.com/2020/09/13/master-the-art-of-branding-and-marketing-with-this-45-training/,Master the art of branding and marketing with this $45 training,,20200914-1430
https://nypost.com/2020/09/13/why-are-there-less-days-in-bereavement-leave-compared-to-child-birth/,Why are there fewer days for bereavement leave compared to child birth?,,20200914-1430
https://nypost.com/2020/09/13/companies-getting-creative-onboarding-new-hires-working-remotely/,Companies are getting creative onboarding new hires working from home,,20200914-1430
https://nypost.com/2020/09/12/missing-serval-cat-found-safe-after-being-spooked-by-family-dog/,Missing serval cat found safe after being spooked by family dog,,20200914-1430
https://nypost.com/2020/09/12/meet-pga-championship-winner-collin-morikawas-secret-weapon/,Meet PGA champ Collin Morikawa's secret weapon,,20200914-1430
https://nypost.com/2020/09/12/doctor-dealer-explores-atlantic-city-radio-hosts-bizarre-death/,"'Doctor Dealer' explores radio host's bizarre, motorcycle gang-linked death",,20200914-1430
https://nypost.com/2020/09/14/iconic-fresh-prince-of-bel-air-mansion-listed-on-airbnb/,The 'Fresh Prince of Bel Air' mansion just went up on AirBnb for less than you might think,,20200914-1430
https://nypost.com/2020/09/13/one-vanderbilt-skyscraper-in-midtown-opens-to-office-tenants-monday/,Behind the rise of the 77-story One Vanderbilt,,20200914-1430
https://nypost.com/2020/09/10/native-new-yorker-moving-to-new-jersey-during-covid-19-grapples-with-guilt/,Why a lifelong New Yorker deployed the nuclear option: A move to Jersey,,20200914-1430
https://nypost.com/2020/09/11/ex-notre-dame-coach-lou-holtz-seeks-massive-profit-for-orlando-home/,Lou Holtz seeks massive profit for Orlando home,,20200914-1430
https://nypost.com/2020/09/11/kathy-griffin-wants-16m-for-bel-air-mansion/,Kathy Griffin wants $16M for Bel-Air 'middle finger to Hollywood' mansion,,20200914-1430
https://nypost.com/2020/09/11/nasa-measures-california-wildfire-temperatures-from-iss/,NASA measures California wildfire temperatures from ISS,,20200914-1430
https://nypost.com/2020/09/11/pentagon-planning-pilot-versus-ai-controlled-fighter-jet-showdown/,Pentagon planning pilot versus AI-controlled fighter jet showdown,,20200914-1430
https://nypost.com/2020/09/11/apple-loosens-some-of-its-in-app-app-store-payment-rules-amid-controversy/,Apple loosens some of its in-app payment rules amid controversy,,20200914-1430
https://nypost.com/2020/09/11/microsoft-xbox-series-x-may-have-just-forced-sony-to-lower-the-playstation-5s-price/,Sony may discount PlayStation 5 after Xbox Series X price reveal,,20200914-1430
https://nypost.com/2020/09/11/tesla-plans-to-expand-electric-supercharger-network-in-europe/,Tesla plans to expand electric supercharger network in Europe,,20200914-1430
https://nypost.com/2020/09/10/megyn-kelly-gets-into-podcasting-with-devil-may-care-media/,Megyn Kelly returning to media with new venture,,20200914-1430
https://nypost.com/2020/09/12/cnn-anchor-chris-cuomo-praises-rudy-giuliani-for-9-11-response/,Chris Cuomo praises Rudy Giuliani for 9/11 response,,20200914-1430
https://nypost.com/2020/09/11/nfl-ratings-plummet-in-chiefs-texans-season-opener/,NFL ratings plummet in season opener,,20200914-1430
https://nypost.com/2020/09/10/new-york-times-theater-critic-ben-brantley-stepping-down/,New York Times theater critic Ben Brantley stepping down,,20200914-1430
https://nypost.com/2020/09/11/spy-thriller-tenet-to-be-screened-at-los-angeles-drive-ins/,Spy thriller 'Tenet' to be screened at Los Angeles drive-ins,,20200914-1430
https://nypost.com/2020/09/14/police-shoot-knife-wielding-man-in-lancaster-pennsylvania/,'Justice' protests erupt for knife-wielding attacker shot dead after charging PA cop,,20200914-1500
https://nypost.com/2020/09/14/trump-accepts-offer-from-joe-rogan-to-moderate-debate-with-biden/,Joe Rogan details terms if he were to host a Trump-Biden debate,,20200914-1500
https://nypost.com/2020/09/14/ex-porn-star-zoe-parker-dead-at-24/,"Ex-porn star Zoe Parker dead at 24, months after leaving industry",,20200914-1500
https://nypost.com/2020/09/14/man-who-pooped-on-pelosis-driveway-calls-it-peaceful-protest/,Here's why a homeless YouTuber pooped in Pelosi's driveway — and filmed it,,20200914-1500
https://nypost.com/2020/09/11/will-smith-finally-buries-hatchet-with-first-aunt-viv-janet-hubert/,Will Smith finally buries hatchet with 'First Aunt Viv' Janet Hubert,,20200914-1500
https://nypost.com/2020/09/11/florida-man-arrested-for-impersonating-officer-after-pulling-over-cop/,Florida man arrested for impersonating officer after trying to pull over real cop,,20200914-1500
https://nypost.com/2020/09/11/kids-return-to-school-as-nyc-celebrates-labor-day-the-posts-week-in-photos/,Kids return to school as NYC celebrates Labor Day: The Post's week in photos,,20200914-1500
https://nypost.com/2020/09/14/raging-west-coast-wildfires-could-worsen-with-rising-wind-gusts/,Raging West Coast wildfires could get worse this week,,20200914-1500
https://nypost.com/2020/09/14/la-county-deputies-out-of-surgery-after-ambush-shooting-in-compton/,Two LA County deputies out of surgery after ambush shooting,,20200914-1500
https://nypost.com/2020/09/14/us-ambassador-to-china-terry-branstad-to-step-down/,US ambassador to China to step down as tensions escalate with Beijing,,20200914-1500
https://nypost.com/2020/09/14/biden-condemns-violence-of-any-kind-after-officers-shootings/,"Joe Biden condemns 'violence of any kind' after officers shot in LA, NC",,20200914-1500
https://nypost.com/2020/09/14/crowd-aims-lock-him-up-chant-at-obama-during-trump-rally/,Crowd chants ‘Lock him up’ after Trump accuses Obama of ‘spying’ on campaign,,20200914-1500
https://nypost.com/2020/09/13/west-coast-smoke-seen-sucked-into-cyclone-over-1000-miles-away/,"West Coast wildfire smoke seen sucked into cyclone over 1,000 miles away",,20200914-1500
https://nypost.com/2020/09/14/tropical-storm-sally-could-hit-new-orleans-as-category-2-hurricane/,Another 'life-threatening' storm could hit US as a hurricane,,20200914-1500
https://nypost.com/2020/09/14/ted-cruz-says-he-doesnt-want-to-be-on-the-supreme-court/,Ted Cruz says he doesn't want to be on the Supreme Court,,20200914-1500
https://nypost.com/covers/,Browse covers archive,,20200914-1500
https://nypost.com/2020/09/13/ciara-posts-tribute-to-husband-russell-wilson-on-nfl-week-1/,Ciara celebrates Russell Wilson on game day: ‘Hardest working man I know’,,20200914-1500
https://nypost.com/horoscopes/virgo/,Virgo,,20200914-1500
https://nypost.com/horoscopes/,See all Horoscopes,,20200914-1500
https://nypost.com/2020/09/14/drew-barrymore-on-her-new-talk-show-the-rule-book-is-on-fire/,Drew Barrymore on her new talk show: 'The rule book is on fire',,20200914-1500
https://nypost.com/2020/09/14/the-most-important-thing-to-remember-in-joe-judges-giants-debut/,The most important thing to remember in Joe Judge's debut,,20200914-1500
https://nypost.com/2020/09/14/desperation-is-last-hope-for-maddening-mets/,Desperation is last hope for maddening Mets,,20200914-1500
https://nypost.com/2020/09/14/five-people-infected-by-flesh-eating-bacteria-from-long-island-sound/,Five people infected by flesh-eating bacteria from Long Island Sound,,20200914-1500
https://nypost.com/2020/09/14/youtuber-livestreams-himself-taking-poop-on-nancy-pelosis-driveway/,YouTuber livestreams himself taking poop on Nancy Pelosi's driveway,,20200914-1500
https://nypost.com/2020/09/14/jets-miss-cj-mosley-the-most-in-disturbing-loss-to-bills/,The player Jets miss the most in truly disturbing performance,,20200914-1500
https://nypost.com/2020/09/14/bruce-arians-doesnt-hold-back-on-tom-brady-bad-decision/,Bucs coach doesn't hold back on Tom Brady: 'Bad decision',,20200914-1500
https://nypost.com/2020/09/14/jamal-adams-shades-jets-after-seahawks-debut-not-used-to-it/,Jamal Adams shades Jets after monster Seahawks debut: 'Not used to it',,20200914-1500
https://nypost.com/2020/09/13/knicks-first-workout-back-could-feature-chris-paul-irony/,Knicks' first workout back could feature Chris Paul irony,,20200914-1500
https://nypost.com/2020/09/13/devante-downs-is-shocking-answer-to-giants-linebacker-need/,Unknown linebacker is shocking Giants starter,,20200914-1500
https://nypost.com/2020/09/14/ny-lawmakers-propose-law-to-prevent-trump-from-avoiding-prosecution/,NY lawmakers propose law to prevent Trump from avoiding prosecution,,20200914-1500
https://nypost.com/2020/09/13/chuck-schumer-clanks-as-he-tries-stand-up-alongside-jerry-seinfeld/,Schumer clanks as he tries stand-up alongside Jerry Seinfeld,,20200914-1500
https://nypost.com/2020/09/14/2-wounded-in-overnight-brooklyn-and-queens-shootings/,Two hurt in overnight Brooklyn and Queens shootings,,20200914-1500
https://nypost.com/2020/09/13/de-blasio-downplayed-dire-extent-of-nycha-lead-poisoning-issue/,De Blasio downplayed dire extent of NYCHA lead poisoning issue,,20200914-1500
https://nypost.com/2020/09/12/lucky-letter-landed-judge-judys-bailiff-a-career-in-hollywood/,Lucky letter landed Judge Judy's bailiff a career in Hollywood,,20200914-1500
https://nypost.com/2020/09/12/theaters-may-not-be-safe-for-a-year-or-more-fauci/,"It may be more than a year before we can safely go to theaters, Fauci says",,20200914-1500
https://nypost.com/2020/09/14/oracles-tiktok-deal-may-not-include-apps-key-algorithm/,TikTok's deal with Oracle may not include app's key algorithm,,20200914-1500
https://nypost.com/2020/09/14/amazon-hiring-100000-workers-amid-e-commerce-boom/,"Amazon hiring 100,000 workers amid COVID-19 online sales boom",,20200914-1500
https://nypost.com/2020/09/14/pfizer-should-know-if-covid-vaccine-works-by-end-of-october/,Pfizer says it should know if COVID-19 vaccine works by end of October,,20200914-1500
https://nypost.com/2020/09/13/microsoft-rejected-oracle-wins-bid-for-tiktoks-us-operations/,"Microsoft rejected, Oracle wins bid for TikTok's US operations",,20200914-1500
https://nypost.com/2020/09/12/feds-cant-scapegoat-google-and-big-tech-as-anti-trust-targets-forever/,Feds can't scapegoat Google and Big Tech as anti-trust targets forever,,20200914-1500
https://nypost.com/2020/09/13/andrew-cuomos-parole-board-keeps-setting-monsters-free/,Andrew Cuomo's Parole Board keeps setting monsters free,,20200914-1500
https://nypost.com/2020/09/13/columbus-statue-swiped-from-apartment-building/,Columbus statue swiped from apartment building in name of cancel culture: Devine,,20200914-1500
https://nypost.com/2020/09/13/biden-cant-answer-without-a-script-how-can-he-run-the-country/,"If Biden can't answer questions without a script, how can he run the country?",,20200914-1500
https://nypost.com/2020/09/13/welkin-health-startup-cut-staff-three-days-before-ppp-loan/,Josh Kushner-linked startup axed staff three days before snagging PPP loan,,20200914-1500
https://nypost.com/2020/09/13/new-york-city-needs-more-neighborhoods-in-revolt-against-city-hall/,New York City needs more neighborhoods in revolt against City Hall,,20200914-1500
https://nypost.com/2020/09/09/princess-dianas-stylist-on-recreating-her-do-for-the-crown/,Princess Diana's stylist: It was 'weird' to recreate her hair for 'The Crown',,20200914-1500
https://nypost.com/2020/09/12/naomi-campbell-sued-her-billionaire-ex-months-before-he-sued-her/,Naomi Campbell trades lawsuits with billionaire ex in ugly uncoupling,,20200914-1500
https://nypost.com/2020/09/11/louis-vuitton-is-designing-a-luxury-face-shield-for-nearly-1k/,Louis Vuitton designed a luxury face shield selling for nearly $1K,,20200914-1500
https://nypost.com/2020/09/13/20-non-medical-face-masks-that-wont-clash-with-your-ootd/,20 non-medical face masks that won’t clash with your OOTD,,20200914-1500
https://nypost.com/article/where-to-buy-n95-masks-online-to-protect-yourself-from-covid-19/,Mask and you shall receive: Where to pick up the best face coverings,,20200914-1500
https://nypost.com/2020/09/12/18-coffee-makers-brewers-and-accessories-that-are-on-sale/,"18 coffee makers, brewers and accessories that are on sale",,20200914-1500
https://nypost.com/2020/09/12/get-leadership-and-business-coaching-training-for-just-40/,Get leadership and business coaching training for just $40,,20200914-1500
https://nypost.com/2020/09/13/master-the-art-of-branding-and-marketing-with-this-45-training/,Master the art of branding and marketing with this $45 training,,20200914-1500
https://nypost.com/2020/09/13/why-are-there-less-days-in-bereavement-leave-compared-to-child-birth/,Why are there fewer days for bereavement leave compared to child birth?,,20200914-1500
https://nypost.com/2020/09/13/companies-getting-creative-onboarding-new-hires-working-remotely/,Companies are getting creative onboarding new hires working from home,,20200914-1500
https://nypost.com/2020/09/12/missing-serval-cat-found-safe-after-being-spooked-by-family-dog/,Missing serval cat found safe after being spooked by family dog,,20200914-1500
https://nypost.com/2020/09/12/meet-pga-championship-winner-collin-morikawas-secret-weapon/,Meet PGA champ Collin Morikawa's secret weapon,,20200914-1500
https://nypost.com/2020/09/12/doctor-dealer-explores-atlantic-city-radio-hosts-bizarre-death/,"'Doctor Dealer' explores radio host's bizarre, motorcycle gang-linked death",,20200914-1500
https://nypost.com/2020/09/14/iconic-fresh-prince-of-bel-air-mansion-listed-on-airbnb/,The 'Fresh Prince of Bel Air' mansion just went up on AirBnb for less than you might think,,20200914-1500
https://nypost.com/2020/09/13/one-vanderbilt-skyscraper-in-midtown-opens-to-office-tenants-monday/,Behind the rise of the 77-story One Vanderbilt,,20200914-1500
https://nypost.com/2020/09/10/native-new-yorker-moving-to-new-jersey-during-covid-19-grapples-with-guilt/,Why a lifelong New Yorker deployed the nuclear option: A move to Jersey,,20200914-1500
https://nypost.com/2020/09/11/ex-notre-dame-coach-lou-holtz-seeks-massive-profit-for-orlando-home/,Lou Holtz seeks massive profit for Orlando home,,20200914-1500
https://nypost.com/2020/09/11/kathy-griffin-wants-16m-for-bel-air-mansion/,Kathy Griffin wants $16M for Bel-Air 'middle finger to Hollywood' mansion,,20200914-1500
https://nypost.com/2020/09/11/nasa-measures-california-wildfire-temperatures-from-iss/,NASA measures California wildfire temperatures from ISS,,20200914-1500
https://nypost.com/2020/09/11/pentagon-planning-pilot-versus-ai-controlled-fighter-jet-showdown/,Pentagon planning pilot versus AI-controlled fighter jet showdown,,20200914-1500
https://nypost.com/2020/09/11/apple-loosens-some-of-its-in-app-app-store-payment-rules-amid-controversy/,Apple loosens some of its in-app payment rules amid controversy,,20200914-1500
https://nypost.com/2020/09/11/microsoft-xbox-series-x-may-have-just-forced-sony-to-lower-the-playstation-5s-price/,Sony may discount PlayStation 5 after Xbox Series X price reveal,,20200914-1500
https://nypost.com/2020/09/11/tesla-plans-to-expand-electric-supercharger-network-in-europe/,Tesla plans to expand electric supercharger network in Europe,,20200914-1500
https://nypost.com/2020/09/10/megyn-kelly-gets-into-podcasting-with-devil-may-care-media/,Megyn Kelly returning to media with new venture,,20200914-1500
https://nypost.com/2020/09/12/cnn-anchor-chris-cuomo-praises-rudy-giuliani-for-9-11-response/,Chris Cuomo praises Rudy Giuliani for 9/11 response,,20200914-1500
https://nypost.com/2020/09/11/nfl-ratings-plummet-in-chiefs-texans-season-opener/,NFL ratings plummet in season opener,,20200914-1500
