,text,notes,date
https://nypost.com/2020/08/24/sorry-seinfeld-your-love-of-nyc-wont-change-the-facts-about-its-crisis/,"Sorry, Seinfeld: Your love of NYC won't change the facts about its crisis",,20200825-0000
https://nypost.com/2020/08/24/missing-nj-girl-dulce-maria-alavez-likely-snatched-by-predator-fbi/,Feds reveal disturbing new details in disappearance of missing NJ girl,,20200825-0000
https://nypost.com/2020/08/24/young-people-dont-trust-anyone-who-use-this-punctuation-mark/,"Young people don't trust anyone who uses this punctuation, period",,20200825-0000
https://nypost.com/2020/08/24/jerry-falwell-jr-resigns-as-president-of-liberty-university/,"Farewell, Falwell? Conservative college prez's status unclear amid pool boy sex scandal",,20200825-0000
https://nypost.com/2020/08/24/kim-yo-jong-could-be-north-koreas-worst-dictator-yet-experts-say/,Kim Yo Jong could be North Korea's worst dictator yet,,20200825-0000
https://nypost.com/2020/08/24/brooklyn-club-called-the-illmore-ignores-coronavirus-precautions/,"This NYC club is throwing secret, indoor ragers amid pandemic",,20200825-0000
https://nypost.com/2020/08/24/lebron-james-knows-how-ridiculous-his-balding-head-looks/,LeBron knows how ridiculous his balding head looks,,20200825-0000
https://nypost.com/2020/08/23/at-least-13-die-in-peru-running-away-from-cops-amid-covid-19-club-raid/,At least 13 die in stampede as cops raid club breaking COVID-19 rules,,20200825-0000
https://nypost.com/2020/08/21/social-distancing-and-school-reopening-the-posts-week-in-photos/,Social distancing and the struggle to reopen schools: The Post's week in photos,,20200825-0000
https://nypost.com/2020/08/24/trump-to-direct-federal-agencies-to-move-into-opportunity-zones/,Trump to direct federal agencies to move into 'Opportunity Zones',,20200825-0000
https://nypost.com/2020/08/24/covid-19-researchers-record-first-case-of-reinfection/,COVID-19 researchers record first case of reinfection,,20200825-0000
https://nypost.com/2020/08/24/scott-peterson-spared-from-death-penalty-in-infamous-slaying-of-pregnant-wife/,Scott Peterson spared from death penalty in infamous slaying of pregnant wife,,20200825-0000
https://nypost.com/2020/08/24/kellyanne-conways-daughter-claudia-reacts-to-her-moms-resignation/,Claudia Conway reacts to her mom Kellyanne's resignation,,20200825-0000
https://nypost.com/2020/08/24/2020-rnc-guide-when-its-on-how-to-watch-plus-speaker-schedule/,The RNC kicks off on Monday: Here's what to expect and how to watch,,20200825-0000
https://nypost.com/2020/08/24/first-gay-cabinet-member-says-trump-rejects-identity-politics/,First openly gay cabinet member: Trump rejects 'identity politics',,20200825-0000
https://nypost.com/2020/08/24/officer-knocked-out-by-brick-thrown-in-kenosha-as-protesters-shout-f-k-the-police/,Officer knocked out by brick as riots in Wisconsin escalate,,20200825-0000
https://nypost.com/2020/08/24/deaths-of-five-uk-couples-may-have-been-work-of-serial-killer-report/,Is a serial killer behind the deaths of several couples?,,20200825-0000
https://nypost.com/2020/08/24/woman-declared-dead-found-alive-inside-detroit-funeral-home/,Woman declared 'dead' found alive inside Detroit funeral home,,20200825-0000
https://nypost.com/covers/,Browse covers archive,,20200825-0000
https://nypost.com/2020/08/24/allan-rich-actor-in-serpico-quiz-show-and-amistad-dead-at-94/,"Allan Rich, actor in ‘Serpico,’ ‘Quiz Show’ and ‘Amistad,’ dead at 94",,20200825-0000
https://nypost.com/horoscopes/virgo/,Virgo,,20200825-0000
https://nypost.com/horoscopes/,See all Horoscopes,,20200825-0000
https://nypost.com/2020/08/24/there-is-a-mets-surprise-waiting-for-all-of-us/,There is a Mets surprise waiting for all of us,,20200825-0000
https://nypost.com/2020/08/24/fantasy-football-zero-rb-strategy-could-the-draft-day-difference/,The fantasy football strategy that could transform your draft strategy,,20200825-0000
https://nypost.com/2020/08/24/exiled-mike-clevinger-is-among-intriguing-yankees-trade-targets/,Exiled Indians ace among intriguing Yankees trade possibilities: Sherman,,20200825-0000
https://nypost.com/2020/08/23/kim-jong-un-in-a-coma-as-his-sister-takes-control-report/,Kim Jong Un reportedly in a coma as his sister takes control,,20200825-0000
https://nypost.com/2020/08/24/giants-loving-family-overjoyed-to-have-jason-garrett-back-home/,Giants-loving family overjoyed to have Jason Garrett back home,,20200825-0000
https://nypost.com/2020/08/24/shaquille-oneal-saddened-by-things-he-cant-say-to-kobe-bryant/,Shaq still haunted by his Kobe Bryant regrets,,20200825-0000
https://nypost.com/2020/08/24/fan-less-pga-events-taking-toll-on-tiger-woods-rory-mcilroy/,"Tiger Woods, Rory McIlroy struggling with new PGA reality",,20200825-0000
https://nypost.com/2020/08/24/mta-offers-10k-reward-to-find-serial-subway-window-smasher/,MTA offers $10K reward to find serial subway window smasher,,20200825-0000
https://nypost.com/2020/08/24/dermot-shea-blames-legislators-for-nyc-crime-spike/,NYPD commish says allegations of a slowdown make his 'blood boil',,20200825-0000
https://nypost.com/2020/08/24/nypd-detective-helps-distressed-woman-on-jetblue-flight/,NYPD detective helps distressed woman on JetBlue flight,,20200825-0000
https://nypost.com/2020/08/24/strapped-tourist-busted-with-firearm-in-empire-state-building/,Strapped tourist busted with firearm in Empire State Building,,20200825-0000
https://nypost.com/2020/08/24/de-blasio-questionably-says-homeless-encampments-in-nyc-are-rare/,De Blasio makes questionable claim about NYC homeless encampments,,20200825-0000
https://nypost.com/2020/08/24/robins-wish-looks-at-comedian-robin-williams-tragic-final-days/,'Robin's Wish' looks at comedian Robin Williams' tragic final days,,20200825-0000
https://nypost.com/2020/08/24/beyonce-drops-video-for-brown-skin-girl-starring-blue-ivy-and-kelly-rowland/,"Beyoncé drops video for ‘Brown Skin Girl,’ starring Blue Ivy and Kelly Rowland",,20200825-0000
https://nypost.com/2020/08/24/the-batman-everything-we-learned-from-the-dark-new-trailer/,'The Batman:' Everything we learned from the dark new trailer,,20200825-0000
https://nypost.com/2020/08/24/dennis-quaid-making-non-scripted-series-about-rescue-cat-saving-dennis-quaid/,"Dennis Quaid making non-scripted series about rescue cat, 'Saving Dennis Quaid'",,20200825-0000
https://nypost.com/2020/08/24/delta-doubles-staffers-handling-cabin-cleaning-in-pit-stop-revamp/,Delta doubles staffers handling cabin cleaning in 'pit stop' revamp,,20200825-0000
https://nypost.com/2020/08/24/tiktok-sues-us-government-over-trump-ban-forced-sale/,"TikTok sues US government over Trump ban, forced sale",,20200825-0000
https://nypost.com/2020/08/24/microsoft-backs-epic-games-in-fight-over-apples-app-store-fees/,Microsoft backs Epic Games in fight over Apple fees,,20200825-0000
https://nypost.com/2020/08/24/virgin-islands-to-subpoena-leon-black-apollo-over-jeffrey-epstein-ties/,"Virgin Islands to subpoena Leon Black, Apollo over Epstein ties",,20200825-0000
https://nypost.com/2020/08/24/facebooks-mark-zuckerberg-lobbied-against-tiktok-last-fall/,Zuckerberg lobbied against TikTok in Washington,,20200825-0000
https://nypost.com/2020/08/23/new-york-city-will-rise-again/,New York City will rise again,,20200825-0000
https://nypost.com/2020/08/23/its-time-to-loosen-lockdown-rules-for-restaurants-and-others/,Enough! Time to seriously loosen lockdown rules for restaurants and others,,20200825-0000
https://nypost.com/2020/08/23/how-nyc-could-make-remote-learning-into-a-winner-for-many-kids/,How NYC could make remote learning into a winner for many kids,,20200825-0000
https://nypost.com/2020/08/23/andrew-cuomo-doubles-down-in-his-war-on-fun/,Andrew Cuomo doubles down in his 'war on fun',,20200825-0000
https://nypost.com/2020/08/21/do-you-own-any-of-the-most-iconic-items-in-fashion-history-list/,These are the top 40 most iconic fashion items of all time,,20200825-0000
https://nypost.com/2020/08/24/reebok-sale-running-shoes/,Reebok takes 50 percent off select running shoes for daily deal,,20200825-0000
https://nypost.com/article/where-to-buy-n95-masks-online-to-protect-yourself-from-covid-19/,Mask and you shall receive: Where to pick up the best face coverings,,20200825-0000
https://nypost.com/2020/08/24/instant-post-aura-sale-amazon-discounts-multicooker-54-percent/,Instant Pot Aura discounted 54 percent for Amazon sale,,20200825-0000
https://nypost.com/2020/08/18/juice-press-sale-blueberries-avocados-jp-organic-market/,Juice Press launches 99-cent sale on organic blueberries and avocados,,20200825-0000
https://nypost.com/list/cole-haan-sale/,Cole Haan shoes up to 75 percent off for Grand Summer Sale,,20200825-0000
https://nypost.com/2020/08/24/video-10000-liters-of-coca-cola-combined-with-baking-soda/,"YouTuber combines 10,000 liters of Coca-Cola with baking soda to explosive effect",,20200825-0000
https://nypost.com/2020/08/24/shakespeare-was-undeniably-bisexual-scholars-argue-in-new-book/,Romeo and Juliet? Researchers reveal Shakespeare's sexuality,,20200825-0000
https://nypost.com/2020/08/23/how-to-use-this-time-during-the-pandemic-to-advance-your-career/,How to use this time during the pandemic to advance your career,,20200825-0000
https://nypost.com/2020/08/22/inside-charlotte-kirks-aggressive-tactics-with-hollywood-men/,The 'aggressive' tactics that allowed one actress to take down 2 H'wood honchos,,20200825-0000
https://nypost.com/2020/08/22/8-year-old-boy-becomes-youngest-person-to-solo-pilot-hot-air-balloon/,8-year-old boy becomes youngest person ever to solo pilot hot-air balloon,,20200825-0000
https://nypost.com/2020/08/23/sag-harbors-barons-cove-offers-six-month-stay-from-14k-to-20k/,"Sag Harbor resort offers six-month stay starting from $14,000",,20200825-0000
https://nypost.com/2020/08/23/brooklyns-city-point-complex-adding-private-school/,Brooklyn's City Point complex adding private school,,20200825-0000
https://nypost.com/2020/08/20/john-legend-chrissy-teigen-list-beverly-hills-home-for-24m/,"John Legend, Chrissy Teigen selling massive LA mansion for more space",,20200825-0000
https://nypost.com/2020/08/20/gov-andrew-cuomo-extends-eviction-moratorium-for-commercial-tenants/,Gov. Andrew Cuomo extends eviction moratorium for commercial tenants,,20200825-0000
https://nypost.com/2020/08/24/zoom-suffers-outage-blocking-users-from-video-meetings/,"Zoom suffers outage blocking users from hosting video meetings, webinars",,20200825-0000
https://nypost.com/2020/08/24/instagram-deletes-account-advertising-asu-covid-19-parties/,Instagram deletes account advertising 'COVID parties' at Arizona State University,,20200825-0000
https://nypost.com/2020/08/20/tiktok-removes-380000-videos-in-us-for-violating-hate-speech-policy/,TikTok removes 380K videos in US for violating hate speech policy,,20200825-0000
https://nypost.com/2020/08/21/nasa-working-to-isolate-space-station-air-leak/,NASA working to isolate space station air leak,,20200825-0000
https://nypost.com/2020/08/21/apple-asks-judge-to-reject-fortnite-makers-bid-to-be-kept-in-app-store/,Apple asks judge to reject 'Fortnite' maker's bid to be kept in App Store,,20200825-0000
https://nypost.com/2020/08/24/shepard-smiths-cnbc-premiere-set-for-sept-30/,Shepard Smith's CNBC premiere set for Sept. 30,,20200825-0000
https://nypost.com/2020/08/21/david-pecker-leaves-helm-of-national-enquirer-owner-american-media/,David Pecker leaves helm of National Enquirer owner American Media,,20200825-0000
https://nypost.com/2020/08/21/the-kelly-clarkson-show-to-start-filming-season-2-with-virtual-audience/,‘The Kelly Clarkson Show’ to start filming Season 2 with virtual audience,,20200825-0000
https://nypost.com/2020/08/24/sorry-seinfeld-your-love-of-nyc-wont-change-the-facts-about-its-crisis/,"Sorry, Seinfeld: Your love of NYC won't change the facts about its crisis",,20200825-0030
https://nypost.com/2020/08/24/ex-throuple-pol-katie-hill-rips-jerry-falwell-jr-over-sex-scandal/,Ex-'throuple' pol rips Falwell Jr. over pool boy sex scandal,,20200825-0030
https://nypost.com/2020/08/24/lebron-james-knows-how-ridiculous-his-balding-head-looks/,LeBron knows how ridiculous his balding head looks,,20200825-0030
https://nypost.com/2020/08/24/missing-nj-girl-dulce-maria-alavez-likely-snatched-by-predator-fbi/,Feds reveal disturbing new details in disappearance of missing NJ girl,,20200825-0030
https://nypost.com/2020/08/24/kim-yo-jong-could-be-north-koreas-worst-dictator-yet-experts-say/,Kim Yo Jong could be North Korea's worst dictator yet,,20200825-0030
https://nypost.com/2020/08/24/young-people-dont-trust-anyone-who-use-this-punctuation-mark/,"Young people don't trust anyone who uses this punctuation, period",,20200825-0030
https://nypost.com/2020/08/24/brooklyn-club-called-the-illmore-ignores-coronavirus-precautions/,"This NYC club is throwing secret, indoor ragers amid pandemic",,20200825-0030
https://nypost.com/2020/08/23/at-least-13-die-in-peru-running-away-from-cops-amid-covid-19-club-raid/,At least 13 die in stampede as cops raid club breaking COVID-19 rules,,20200825-0030
https://nypost.com/2020/08/21/social-distancing-and-school-reopening-the-posts-week-in-photos/,Social distancing and the struggle to reopen schools: The Post's week in photos,,20200825-0030
https://nypost.com/2020/08/24/trump-to-direct-federal-agencies-to-move-into-opportunity-zones/,Trump to direct federal agencies to move into 'Opportunity Zones',,20200825-0030
https://nypost.com/2020/08/24/covid-19-researchers-record-first-case-of-reinfection/,COVID-19 researchers record first case of reinfection,,20200825-0030
https://nypost.com/2020/08/24/scott-peterson-spared-from-death-penalty-in-infamous-slaying-of-pregnant-wife/,Scott Peterson spared from death penalty in infamous slaying of pregnant wife,,20200825-0030
https://nypost.com/2020/08/24/kellyanne-conways-daughter-claudia-reacts-to-her-moms-resignation/,Claudia Conway reacts to her mom Kellyanne's resignation,,20200825-0030
https://nypost.com/2020/08/24/2020-rnc-guide-when-its-on-how-to-watch-plus-speaker-schedule/,The RNC kicks off on Monday: Here's what to expect and how to watch,,20200825-0030
https://nypost.com/2020/08/24/first-gay-cabinet-member-says-trump-rejects-identity-politics/,First openly gay cabinet member: Trump rejects 'identity politics',,20200825-0030
https://nypost.com/2020/08/24/officer-knocked-out-by-brick-thrown-in-kenosha-as-protesters-shout-f-k-the-police/,Officer knocked out by brick as riots in Wisconsin escalate,,20200825-0030
https://nypost.com/2020/08/24/deaths-of-five-uk-couples-may-have-been-work-of-serial-killer-report/,Is a serial killer behind the deaths of several couples?,,20200825-0030
https://nypost.com/2020/08/24/woman-declared-dead-found-alive-inside-detroit-funeral-home/,Woman declared 'dead' found alive inside Detroit funeral home,,20200825-0030
https://nypost.com/covers/,Browse covers archive,,20200825-0030
https://nypost.com/2020/08/24/allan-rich-actor-in-serpico-quiz-show-and-amistad-dead-at-94/,"Allan Rich, actor in ‘Serpico,’ ‘Quiz Show’ and ‘Amistad,’ dead at 94",,20200825-0030
https://nypost.com/horoscopes/virgo/,Virgo,,20200825-0030
https://nypost.com/horoscopes/,See all Horoscopes,,20200825-0030
https://nypost.com/2020/08/24/there-is-a-mets-surprise-waiting-for-all-of-us/,There is a Mets surprise waiting for all of us,,20200825-0030
https://nypost.com/2020/08/24/fantasy-football-zero-rb-strategy-could-the-draft-day-difference/,The fantasy football strategy that could transform your draft strategy,,20200825-0030
https://nypost.com/2020/08/24/exiled-mike-clevinger-is-among-intriguing-yankees-trade-targets/,Exiled Indians ace among intriguing Yankees trade possibilities: Sherman,,20200825-0030
https://nypost.com/2020/08/23/kim-jong-un-in-a-coma-as-his-sister-takes-control-report/,Kim Jong Un reportedly in a coma as his sister takes control,,20200825-0030
https://nypost.com/2020/08/24/giants-loving-family-overjoyed-to-have-jason-garrett-back-home/,Giants-loving family overjoyed to have Jason Garrett back home,,20200825-0030
https://nypost.com/2020/08/24/shaquille-oneal-saddened-by-things-he-cant-say-to-kobe-bryant/,Shaq still haunted by his Kobe Bryant regrets,,20200825-0030
https://nypost.com/2020/08/24/fan-less-pga-events-taking-toll-on-tiger-woods-rory-mcilroy/,"Tiger Woods, Rory McIlroy struggling with new PGA reality",,20200825-0030
https://nypost.com/2020/08/24/mta-offers-10k-reward-to-find-serial-subway-window-smasher/,MTA offers $10K reward to find serial subway window smasher,,20200825-0030
https://nypost.com/2020/08/24/dermot-shea-blames-legislators-for-nyc-crime-spike/,NYPD commish says allegations of a slowdown make his 'blood boil',,20200825-0030
https://nypost.com/2020/08/24/nypd-detective-helps-distressed-woman-on-jetblue-flight/,NYPD detective helps distressed woman on JetBlue flight,,20200825-0030
https://nypost.com/2020/08/24/strapped-tourist-busted-with-firearm-in-empire-state-building/,Strapped tourist busted with firearm in Empire State Building,,20200825-0030
https://nypost.com/2020/08/24/de-blasio-questionably-says-homeless-encampments-in-nyc-are-rare/,De Blasio makes questionable claim about NYC homeless encampments,,20200825-0030
https://nypost.com/2020/08/24/robins-wish-looks-at-comedian-robin-williams-tragic-final-days/,'Robin's Wish' looks at comedian Robin Williams' tragic final days,,20200825-0030
https://nypost.com/2020/08/24/beyonce-drops-video-for-brown-skin-girl-starring-blue-ivy-and-kelly-rowland/,"Beyoncé drops video for ‘Brown Skin Girl,’ starring Blue Ivy and Kelly Rowland",,20200825-0030
https://nypost.com/2020/08/24/the-batman-everything-we-learned-from-the-dark-new-trailer/,'The Batman:' Everything we learned from the dark new trailer,,20200825-0030
https://nypost.com/2020/08/24/dennis-quaid-making-non-scripted-series-about-rescue-cat-saving-dennis-quaid/,"Dennis Quaid making non-scripted series about rescue cat, 'Saving Dennis Quaid'",,20200825-0030
https://nypost.com/2020/08/24/delta-doubles-staffers-handling-cabin-cleaning-in-pit-stop-revamp/,Delta doubles staffers handling cabin cleaning in 'pit stop' revamp,,20200825-0030
https://nypost.com/2020/08/24/tiktok-sues-us-government-over-trump-ban-forced-sale/,"TikTok sues US government over Trump ban, forced sale",,20200825-0030
https://nypost.com/2020/08/24/microsoft-backs-epic-games-in-fight-over-apples-app-store-fees/,Microsoft backs Epic Games in fight over Apple fees,,20200825-0030
https://nypost.com/2020/08/24/virgin-islands-to-subpoena-leon-black-apollo-over-jeffrey-epstein-ties/,"Virgin Islands to subpoena Leon Black, Apollo over Epstein ties",,20200825-0030
https://nypost.com/2020/08/24/facebooks-mark-zuckerberg-lobbied-against-tiktok-last-fall/,Zuckerberg lobbied against TikTok in Washington,,20200825-0030
https://nypost.com/2020/08/24/democrats-are-pretending-the-cities-arent-burning/,Democrats are pretending the cities aren’t burning,,20200825-0030
https://nypost.com/2020/08/24/why-the-fifth-avenue-black-lives-matter-mural-is-another-de-blasio-disaster/,Why the Fifth Avenue 'Black Lives Matter' mural is another de Blasio disaster,,20200825-0030
https://nypost.com/2020/08/23/how-nyc-could-make-remote-learning-into-a-winner-for-many-kids/,How NYC could make remote learning into a winner for many kids,,20200825-0030
https://nypost.com/2020/08/23/new-york-city-will-rise-again/,New York City will rise again,,20200825-0030
https://nypost.com/2020/08/21/do-you-own-any-of-the-most-iconic-items-in-fashion-history-list/,These are the top 40 most iconic fashion items of all time,,20200825-0030
https://nypost.com/2020/08/24/reebok-sale-running-shoes/,Reebok takes 50 percent off select running shoes for daily deal,,20200825-0030
https://nypost.com/article/where-to-buy-n95-masks-online-to-protect-yourself-from-covid-19/,Mask and you shall receive: Where to pick up the best face coverings,,20200825-0030
https://nypost.com/2020/08/24/instant-post-aura-sale-amazon-discounts-multicooker-54-percent/,Instant Pot Aura discounted 54 percent for Amazon sale,,20200825-0030
https://nypost.com/2020/08/18/juice-press-sale-blueberries-avocados-jp-organic-market/,Juice Press launches 99-cent sale on organic blueberries and avocados,,20200825-0030
https://nypost.com/list/cole-haan-sale/,Cole Haan shoes up to 75 percent off for Grand Summer Sale,,20200825-0030
https://nypost.com/2020/08/24/video-10000-liters-of-coca-cola-combined-with-baking-soda/,"YouTuber combines 10,000 liters of Coca-Cola with baking soda to explosive effect",,20200825-0030
https://nypost.com/2020/08/24/shakespeare-was-undeniably-bisexual-scholars-argue-in-new-book/,Romeo and Juliet? Researchers reveal Shakespeare's sexuality,,20200825-0030
https://nypost.com/2020/08/24/teens-find-treasure-trove-of-1100-year-old-pure-gold-coins-in-israel/,Teens find treasure trove of ancient pure gold coins in Israel,,20200825-0030
https://nypost.com/2020/08/24/you-can-rent-taylor-swifts-former-tour-bus-for-2k-per-night/,You can stay inside Taylor Swift's former tour bus for $2K per night,,20200825-0030
https://nypost.com/2020/08/24/pranksters-dressed-as-mario-and-luigi-take-joyride-through-nyc/,'Mario and Luigi' go on wild joy ride through NYC in viral stunt,,20200825-0030
https://nypost.com/2020/08/23/sag-harbors-barons-cove-offers-six-month-stay-from-14k-to-20k/,"Sag Harbor resort offers six-month stay starting from $14,000",,20200825-0030
https://nypost.com/2020/08/23/brooklyns-city-point-complex-adding-private-school/,Brooklyn's City Point complex adding private school,,20200825-0030
https://nypost.com/2020/08/20/john-legend-chrissy-teigen-list-beverly-hills-home-for-24m/,"John Legend, Chrissy Teigen selling massive LA mansion for more space",,20200825-0030
https://nypost.com/2020/08/20/gov-andrew-cuomo-extends-eviction-moratorium-for-commercial-tenants/,Gov. Andrew Cuomo extends eviction moratorium for commercial tenants,,20200825-0030
https://nypost.com/2020/08/24/billions-of-rogue-planets-may-be-drifting-through-milky-way-unattached-to-star/,Billions of ‘rogue planets’ may be drifting through Milky Way unattached to star,,20200825-0030
https://nypost.com/2020/08/24/instagram-deletes-account-advertising-asu-covid-19-parties/,Instagram deletes account advertising 'COVID parties' at Arizona State University,,20200825-0030
https://nypost.com/2020/08/24/nose-swabbing-covid-19-robot-offers-terrifying-vision-of-the-future/,Nose-swabbing COVID-19 robot offers terrifying vision of the future,,20200825-0030
https://nypost.com/2020/08/24/ai-pilot-beats-human-in-clean-sweep-of-virtual-f-16-dogfights/,AI pilot beats human in clean sweep of virtual F-16 dogfights,,20200825-0030
https://nypost.com/2020/08/24/science-foundation-discusses-funding-giant-hawaii-telescope/,Science foundation discusses funding giant Hawaii telescope,,20200825-0030
https://nypost.com/2020/08/24/shepard-smiths-cnbc-premiere-set-for-sept-30/,Shepard Smith's CNBC premiere set for Sept. 30,,20200825-0030
https://nypost.com/2020/08/21/david-pecker-leaves-helm-of-national-enquirer-owner-american-media/,David Pecker leaves helm of National Enquirer owner American Media,,20200825-0030
