,name,text,id,url,created_at
0,NBCNews,Opinion | David Litt: Republicans are no longer hiding that the D.C. statehood fight is about race. https://t.co/1YAVhqivTW - @NBCNewsTHINK,1277391844884824064,https://www.nbcnews.com/think/opinion/d-c-statehood-fight-part-ugly-effort-disenfranchise-black-brown-ncna1232176?cid=sm_npd_nn_tw_ma,Mon Jun 29 00:02:03 +0000 2020
0,NBCNews,"A student at a private Baptist university in Texas who posted a racist TikTok video online earlier this week is “no longer enrolled,"" school officials say. https://t.co/ySrRFGtDec",1277398633831424002,https://www.nbcnews.com/news/us-news/hardin-simmons-university-texas-says-student-who-made-racist-tiktok-n1232325?cid=sm_npd_nn_tw_ma,Mon Jun 29 00:29:01 +0000 2020
0,NBCNews,"An organizer of the first gay pride march says she's optimistic the revolution she's been fighting for since 1970 ""might just come into being now."" https://t.co/gZuxc5VZTE",1277422039796719616,https://www.nbcnews.com/feature/nbc-out/pride-s-50th-anniversary-revolution-may-have-finally-arrived-n1232172?cid=sm_npd_nn_tw_ma,Mon Jun 29 02:02:02 +0000 2020
0,NBCNews,"A Virginia man has been accused by federal authorities of burning a cross on the front lawn of a Black neighbor's home, authorities say. https://t.co/XzRy7QH8fk",1277429601900339204,https://www.nbcnews.com/news/us-news/virginia-man-accused-burning-cross-black-neighbors-front-lawn-n1232345?cid=sm_npd_nn_tw_ma,Mon Jun 29 02:32:05 +0000 2020
0,NBCNews,"In midst of a campaign interrupted by the coronavirus pandemic, Jill Biden's presence is a constant as her husband contemplates his VP pick. https://t.co/qS2u4PMeM7",1277438154576986117,https://www.nbcnews.com/politics/2020-election/running-mates-biden-considers-vp-pick-jill-biden-his-side-n1232196?cid=sm_npd_nn_tw_ma,Mon Jun 29 03:06:04 +0000 2020
