,text,notes,date
/military/202008251080256337-trump-administration-is-actively-moving-to-turn-space-into-a-war-zone-expert-warns/,"Despite attempts by countries such as Canada, China and Russia to ""keep space for peace"", the US government has proceeded upon a dangerous path that will lead ""the heavens to become a war zone"", explains author and journalist Karl Grossman.",,20200908-1100
/analysis/202008191080208481-how-local-arab-uprising-in-northeast-syria-may-wipe-us-forces--their-sdf-proxies-out-of-the-region/,US bases and personnel have been increasingly attacked by unidentified actors in Syria over the past several months. Political analyst Christopher Assad and US military veteran Mark Sleboda have shed light on the trouble brewing for US occupation forces in the northeastern Syrian provinces of Al-Hasakah and Deir ez-Zor.,,20200908-1100
/analysis/202008171080199122-biden-yet-to-step-foot-in-wisconsin-a-key-battleground-state-he-needs-to-win-pac-director-says-/,"The Democratic National Convention will kick off in Milwaukee, Wisconsin on Monday night, with the four-day event where Democrats formally select their nominee expected to be held mostly online this year due to coronavirus-related health fears. The state is also a key battleground, which Donald Trump won by less than 23,000 votes in 2016.",,20200908-1100
/analysis/202008181080200606-tune-has-not-changed-a-pardon-for-snowden-wont-end-trumps-major-attack-on-whistleblowers/,"US President Donald Trump on Saturday said he would consider pardoning Edward Snowden, the former National Security Agency (NSA) employee who faced criminal charges after leaking classified information about government surveillance.",,20200908-1100
/tags/covid-19/,COVID-19 global dataConfirmed cases:  Recoveries:  Deaths:,,20200908-1130
/europe/202009081080396431-wikileaks-founder-assanges-extradition-hearing-continues-in-london---video/,WikiLeaks Founder Assange's Extradition Hearing Continues in London - Video,,20200908-1130
/europe/202009081080396455-boris-johnson-reportedly-poised-to-inform-brussels-legally-ambiguous-brexit-deal-needs-reworking/,Boris Johnson Reportedly Poised to Inform Brussels ‘Legally Ambiguous’ Brexit Deal Needs Reworking,,20200908-1130
/asia/202009081080396396-china-accuses-india-of-illegally-crossing-line-of-actual-control-amid-renewed-tensions/,China Accuses India of Illegally Crossing Line of Actual Control Amid Renewed Tensions,,20200908-1130
/sport/202009081080396877-what-the-hell-is-that-manchester-uniteds-new-zebra-kit-creates-a-stir-on-social-media/,What The Hell Is That? Manchester United’s New Zebra Kit Creates A Stir On Social Media,,20200908-1130
/europe/202009081080396576-absolutely-counterproductive-bundestag-member-slams-calls-to-halt-nord-stream-2-over-navalny-case/,'Absolutely Counterproductive': Bundestag Member Slams Calls to Halt Nord Stream 2 Over Navalny Case,,20200908-1130
/uk/202009081080396885-buildings-reported-shaking-as-earthquake-hits-southeast-england/,Buildings Reported Shaking as Earthquake Hits Southeast England,,20200908-1130
/military/202009081080397822-poland-reaches-deal-with-us-to-purchase-fgm-148f-javelin-anti-tank-missiles-reports-suggest/,"Poland Reaches Deal With US to Purchase FGM-148F Javelin Anti-Tank Missiles, Reports Suggest",,20200908-1130
/military/202009081080397874-unstoppable-usaf-training-robot-dogs-to-secure-perimeter-as-part-of-digital-battle-network/,‘Unstoppable’: USAF Training Robot ‘Dogs’ to Secure Perimeter as Part of ‘Digital Battle Network’,,20200908-1130
/india/202009081080397152-24-india-made-apps-have-emerged-of-global-quality-indian-it-minister-ravi-shankar-prasad/,24 India-Made Apps Have Emerged of Global Quality: Indian IT Minister Ravi Shankar Prasad,,20200908-1130
/art_living/202009081080391641-the-lord-of-the-rings-contains-coded-clues-as-to-how-covid-19-crisis-will-end-says-tolkien-expert/,"'The Lord of the Rings' Contains Coded Clues as to How COVID-19 Crisis Will End, Says Tolkien Expert",,20200908-1130
/india/202009081080396228-from-disengagement-along-lac-to-sputnik-v-top-agendas-on-indias-foreign-ministers-moscow-visit/,"From Disengagement Along LAC to Sputnik V, Top Agendas on India's Foreign Minister's Moscow Visit",,20200908-1130
/videoclub/202009081080391001-messi-in-the-making-watch-baby-elephant-playing-football-with-watermelon/,Messi in the Making? Watch Baby Elephant Playing Football with Watermelon,,20200908-1130
/world/202009081080396912-close-quarter-face-off-erupts-in-rezang-la-as-chinese-troops-attempt-to-dislodge-indian-army/,Close Quarter Face-off Erupts in Rezang La as Chinese Troops Attempt to Dislodge Indian Army,,20200908-1130
/world/202009081080397750-moscow-expects-germany-to-share-alleged-evidence-on-navalny-and-bundeswehr-lab-tests/,Moscow Expects Germany to Share Alleged Evidence on Navalny and Bundeswehr Lab Tests,,20200908-1130
/viral/202009081080397638-absolute-madman-tom-cruise-is-captured-making-a-death-defying-stunt-for-mission-impossible-7/,'Absolute Madman': Tom Cruise is Captured Making a Death-Defying Stunt For 'Mission: Impossible 7',,20200908-1130
/europe/202009081080397715-lukashenko-says-he-may-have-overstayed-a-little-in-his-post-as-belaruss-president/,Lukashenko Says He May Have 'Overstayed a Little' in His Post as Belarus's President,,20200908-1130
/russia/202009081080397596-production-of-second-batch-of-russian-sputnik-v-vaccine-for-public-use-underway/,Production of Second Batch of Russian Sputnik V Vaccine for Public Use Underway,,20200908-1130
/europe/202009081080397519-french-police-briefly-detain-alleged-culprit-of-mysterious-attacks-on-horses-reports-say/,"French Police Briefly Detain Alleged Culprit of Mysterious Attacks on Horses, Reports Say",,20200908-1130
/india/202009081080396781-indian-economy-recovering-better-than-i-thought-three-months-ago-brics-bank-ex-chief/,Indian Economy Recovering Better Than I Thought Three Months Ago: BRICS Bank Ex-Chief,,20200908-1130
/asia/202009081080397432-servility-to-imperialist-interests-duterte-slammed-for-pardoning-us-marine-who-killed-filipina/,‘Servility to Imperialist Interests’: Duterte Slammed for Pardoning US Marine Who Killed Filipina,,20200908-1130
/europe/202009081080397133-leaked-diplomatic-cables-reportedly-lay-bare-plummeting-trust-in-uk-amid-brexit-talks/,Leaked Diplomatic Cables Reportedly Lay Bare Plummeting Trust in UK Amid Brexit Talks,,20200908-1130
/world/202009081080397081-kremlin-expects-belarusian-government-to-launch-public-discussion-on-constitutional-reform/,Kremlin Expects Belarusian Government to Launch Public Discussion on Constitutional Reform,,20200908-1130
/analysis/202009051080375191-the-notion-that-us-debt-can-ever-be-paid-back-is-ridiculous-analyst-says/,"'The Notion That US Debt Can Ever Be Paid Back is Ridiculous', Analyst Says",,20200908-1130
/middleeast/202009051080374005-hezbollah-was-on-verge-of-war-with-israel-minutes-after-beirut-blast-field-commander-says/,"Hezbollah Was on Verge of War With Israel Minutes After Beirut Blast, Field Commander Says",,20200908-1130
/middleeast/202009061080381823-natanz-blast-iran-identifies-forces-responsible-for-sabotage-at-countrys-largest-nuclear-site/,Natanz Blast: Iran Identifies 'Forces Responsible for Sabotage' at Country's Largest Nuclear Site,,20200908-1130
/russia/202009051080376079-german-newspaper-suggests-russia-now-immune-to-any-new-sanctions-west-may-roll-out/,German Newspaper Suggests Russia Now 'Immune' to Any New Sanctions West May Roll Out,,20200908-1130
/viral/202009061080381177-us-troops-spark-fury-after-tiktok-clip-where-they-bug-syrians-with-questions-about-mia-khalifa/,US Troops Spark Fury After TikTok Clip Where They Bug Syrians With Questions About Mia Khalifa,,20200908-1130
/us/202009051080376487-chuck-schumer-backs-bernie-sanders-call-for-regime-change-plan-to-force-trump-from-office/,Chuck Schumer Backs Bernie Sanders' Call For Regime Change Plan To Force Trump From Office,,20200908-1130
/us/202009071080393098-trump-us-to-ban-companies-outsourcing-to-china-from-getting-federal-contracts/,Trump: US to Ban Companies Outsourcing to China From Getting Federal Contracts,,20200908-1130
/military/202009071080385939-pentagon-claims-chinese-air-force-rapidly-catching-up-to-its-western-counterparts/,Pentagon Claims China's PLAAF 'Rapidly Catching Up' to Western Air Forces,,20200908-1130
/uk/202009081080397094-head-of-uk-governments-legal-dept-quits-over-johnsons-attempts-to-alter-brexit-deal-reports-say/,"Head of UK Government's Legal Dep't Quits Over Johnson's Attempts to Alter Brexit Deal, Reports Say",,20200908-1130
/europe/202009081080395791-sunken-nazi-german-wwii-warship-found-off-norwegian-coast---photo/,Sunken Nazi German WWII Warship Found Off Norwegian Coast - Photo,,20200908-1130
/world/202009081080395928-china-touts-new-global-data-security-drive-amid-heightened-naked-bullying-from-us/,China Touts New Global Data Security Drive Amid Heightened ‘Naked Bullying’ from US,,20200908-1130
/world/202009081080395379-covid-19-live-updates-us-case-count-surpasses-63-million/,"COVID-19 Live Updates: Pandemic Situation in Country is 'Worrying', French Health Minister Says",,20200908-1130
/columnists/202009071080382164-questions-on-russias-sputnik-v-vaccine-answered/,"Questions on Russia’s Sputnik V Vaccine Answered, Time for Critics to Look for Plank in Own Eyes",,20200908-1130
/columnists/202009041080367400-poisoning-nord-stream-2/,Poisoning Nord Stream-2,,20200908-1130
/columnists/202009041080368881-bbc-new-boss-tim-for-pm/,BBC New Boss Tim for PM!,,20200908-1130
/columnists/202009031080359734-on-behalf-of-gus-and-millions-like-him--pay-our-carers-properly/,On Behalf of Gus and Millions Like Him – Pay Our Carers Properly,,20200908-1130
/videoclub/202009081080388806-goofball-playing-football-adorable-golden-retriever-wants-to-become-next-messi/,Goofball Playing Football: Adorable Golden Retriever Wants to Become Next Messi,,20200908-1130
/videoclub/202009071080389164-hold-now-crunch-watch-this-little-monkey-tune-the-life-skills-of-its-human-friend/,"'Hold, Now Crunch': Watch This Little Monkey Tune the Life Skills of its Human Friend",,20200908-1130
/videoclub/202009071080381644-adorable-golden-retriever-is-puzzled-by-strange-mask/,Adorable Golden Retriever Puzzled by Strange Mask,,20200908-1130
/videoclub/202009061080381038-you-definitely-want-to-hear-this-conversation-monkey-shares-secret-with-hooman-friend/,You Definitely Want to Hear This Conversation: Monkey 'Shares Secret' with 'Hooman' Friend,,20200908-1130
/videoclub/202009061080380021-wild-animals-get-scared-too-leopard-holds-on-tightly-to-a-cot-during-rescue-mission/,Wild Animals Get Scared Too: Leopard Holds on Tightly to a Cot During Rescue Mission,,20200908-1130
/world/202009071080391482-bin-laden-may-have-used-his-porn-collection-to-send-encrypted-messages-documentary-claims/,"Bin Laden May Have Used His Porn Collection to Send Encrypted Messages, Documentary Claims",,20200908-1130
/radio_double_down/202009081080396734-tech-bloodbath/,"On today’s episode of Double Down, Max Keiser and Stacy Herbert talk to Rick Ackerman for his analysis of the ‘tech bloodbath.’",,20200908-1130
/radio_fault_lines/202009051080368304-portland-antifa-murder-suspect-killed-by-police/,"On today’s episode of Fault Lines, hosts Shane Stranahan and Jamarl Thomas talked about a variety of issues from the police killing of the suspect in the murder of a Trump supporter in Portland to the People’s Convention to the “Rittenhouse Method” of avoiding being killed by police.",,20200908-1130
/radio_the_critical_hour/202009051080370875-covid-19-model-predicts-us-death-toll-will-surpass-410000-by-january-1/,"On this edition of The Critical Hour, co-Hosts Dr. Wilmer Leon and Garland Nixon talk to Dr. Yolandra Hancock and Dr. Lisa Lewis about a COVID-19 model predicting that the disease's American death toll will exceed 410,000 by January 1.",,20200908-1130
/radio_double_down/202009011080334821-profoundly-consequential-zirp/,"On today’s episode of Double Down, Max Keiser and Stacy Herbert talk to Wolf Richter of WolfStreet.com about the latest market insanity.",,20200908-1130
/photo/202009011080337062-sputniks-best-august-photos/,Sputnik's Best August Photos,,20200908-1130
/photo/202008311080326678-messi-leaves-barcelona-looking-back-at-argentinian-superstars-career-with-spanish-club/,Messi Leaves 'Barcelona': Looking Back at Argentinian Superstar's Career With Spanish Club,,20200908-1130
/infographics/202008111080136705-russias-vaccine-against-covid-19-in-facts-and-details/,Russia’s Vaccine Against COVID-19 in Facts and Details,,20200908-1130
/cartoons/202009031080361443-vote-early-vote-often/,"Vote Early, Vote Often",,20200908-1130
/cartoons/202009021080344128-mini-stroke-over-parmini-stroke-over-par/,Mini-Stroke Over Par,,20200908-1130
/analysis/202009031080348868-uk-complicity-in-sri-lankan-war-crimes-formed-part-of-securing-its-imperial-interests-expert-says/,Britain’s complicity in war crimes in Sri Lanka have been brought into the spotlight by a new book by investigative journalist Phil Miller about the mercenary firm Keenie Meenie.,,20200908-1130
/analysis/202009021080337386-latest-assange-documentary-is-about-the-most-courageous-and-principled-man-i-know-director-says/,"People in the West are witnessing ""increasing authoritarianism"" and need more than ever to know what is being done by their governments and in their name, the director of the new documentary The War on Journalism: The Case of Julian Assange tells Sputnik.",,20200908-1130
/military/202008251080256337-trump-administration-is-actively-moving-to-turn-space-into-a-war-zone-expert-warns/,"Despite attempts by countries such as Canada, China and Russia to ""keep space for peace"", the US government has proceeded upon a dangerous path that will lead ""the heavens to become a war zone"", explains author and journalist Karl Grossman.",,20200908-1130
/analysis/202008191080208481-how-local-arab-uprising-in-northeast-syria-may-wipe-us-forces--their-sdf-proxies-out-of-the-region/,US bases and personnel have been increasingly attacked by unidentified actors in Syria over the past several months. Political analyst Christopher Assad and US military veteran Mark Sleboda have shed light on the trouble brewing for US occupation forces in the northeastern Syrian provinces of Al-Hasakah and Deir ez-Zor.,,20200908-1130
/analysis/202008171080199122-biden-yet-to-step-foot-in-wisconsin-a-key-battleground-state-he-needs-to-win-pac-director-says-/,"The Democratic National Convention will kick off in Milwaukee, Wisconsin on Monday night, with the four-day event where Democrats formally select their nominee expected to be held mostly online this year due to coronavirus-related health fears. The state is also a key battleground, which Donald Trump won by less than 23,000 votes in 2016.",,20200908-1130
/analysis/202008181080200606-tune-has-not-changed-a-pardon-for-snowden-wont-end-trumps-major-attack-on-whistleblowers/,"US President Donald Trump on Saturday said he would consider pardoning Edward Snowden, the former National Security Agency (NSA) employee who faced criminal charges after leaking classified information about government surveillance.",,20200908-1130
/tags/covid-19/,COVID-19 global dataConfirmed cases:  Recoveries:  Deaths:,,20200908-1200
/europe/202009081080396431-wikileaks-founder-assanges-extradition-hearing-continues-in-london---video/,WikiLeaks Founder Assange's Extradition Hearing Continues in London - Video,,20200908-1200
/europe/202009081080396455-boris-johnson-reportedly-poised-to-inform-brussels-legally-ambiguous-brexit-deal-needs-reworking/,Boris Johnson Reportedly Poised to Inform Brussels ‘Legally Ambiguous’ Brexit Deal Needs Reworking,,20200908-1200
/asia/202009081080396396-china-accuses-india-of-illegally-crossing-line-of-actual-control-amid-renewed-tensions/,China Accuses India of Illegally Crossing Line of Actual Control Amid Renewed Tensions,,20200908-1200
/sport/202009081080396877-what-the-hell-is-that-manchester-uniteds-new-zebra-kit-creates-a-stir-on-social-media/,What The Hell Is That? Manchester United’s New Zebra Kit Creates A Stir On Social Media,,20200908-1200
/europe/202009081080396576-absolutely-counterproductive-bundestag-member-slams-calls-to-halt-nord-stream-2-over-navalny-case/,'Absolutely Counterproductive': Bundestag Member Slams Calls to Halt Nord Stream 2 Over Navalny Case,,20200908-1200
/europe/202009081080397715-lukashenko-says-he-may-have-overstayed-a-little-in-his-post-as-belaruss-president/,Lukashenko Says He May Have 'Overstayed a Little' in His Post as Belarus's President,,20200908-1200
/society/202009081080397969-boris-the-pig-on-drugs-ecstasy-pumped-animal-reportedly-prompts-investigation-into-its-owners/,Boris the Pig on Drugs: Ecstasy-Pumped Animal Reportedly Prompts Investigation Into Its Owners,,20200908-1200
/world/202009081080397796-bollywood-actress-rhea-chakrborty-arrested-by-indias-anti-narcotics-agency-for-alleged-drug-abuse-/,Bollywood Actress Rhea Chakrborty Arrested by India’s Anti-Narcotics Agency for Alleged Drug Abuse,,20200908-1200
/military/202009081080397822-poland-reaches-deal-with-us-to-purchase-fgm-148f-javelin-anti-tank-missiles-reports-suggest/,"Poland Reaches Deal With US to Purchase FGM-148F Javelin Anti-Tank Missiles, Reports Suggest",,20200908-1200
/military/202009081080397874-unstoppable-usaf-training-robot-dogs-to-secure-perimeter-as-part-of-digital-battle-network/,‘Unstoppable’: USAF Training Robot ‘Dogs’ to Secure Perimeter as Part of ‘Digital Battle Network’,,20200908-1200
/india/202009081080397152-24-india-made-apps-have-emerged-of-global-quality-indian-it-minister-ravi-shankar-prasad/,24 India-Made Apps Have Emerged of Global Quality: Indian IT Minister Ravi Shankar Prasad,,20200908-1200
/art_living/202009081080391641-the-lord-of-the-rings-contains-coded-clues-as-to-how-covid-19-crisis-will-end-says-tolkien-expert/,"'The Lord of the Rings' Contains Coded Clues as to How COVID-19 Crisis Will End, Says Tolkien Expert",,20200908-1200
/india/202009081080396228-from-disengagement-along-lac-to-sputnik-v-top-agendas-on-indias-foreign-ministers-moscow-visit/,"From Disengagement Along LAC to Sputnik V, Top Agendas on India's Foreign Minister's Moscow Visit",,20200908-1200
/videoclub/202009081080391001-messi-in-the-making-watch-baby-elephant-playing-football-with-watermelon/,Messi in the Making? Watch Baby Elephant Playing Football with Watermelon,,20200908-1200
/world/202009081080396912-close-quarter-face-off-erupts-in-rezang-la-as-chinese-troops-attempt-to-dislodge-indian-army/,Close Quarter Face-off Erupts in Rezang La as Chinese Troops Attempt to Dislodge Indian Army,,20200908-1200
/world/202009081080397750-moscow-expects-germany-to-share-alleged-evidence-on-navalny-and-bundeswehr-lab-tests/,Moscow Expects Germany to Share Alleged Evidence on Navalny and Bundeswehr Lab Tests,,20200908-1200
/viral/202009081080397638-absolute-madman-tom-cruise-is-captured-making-a-death-defying-stunt-for-mission-impossible-7/,'Absolute Madman': Tom Cruise is Captured Making a Death-Defying Stunt For 'Mission: Impossible 7',,20200908-1200
/russia/202009081080397596-production-of-second-batch-of-russian-sputnik-v-vaccine-for-public-use-underway/,Production of Second Batch of Russian Sputnik V Vaccine for Public Use Underway,,20200908-1200
/europe/202009081080397519-french-police-briefly-detain-alleged-culprit-of-mysterious-attacks-on-horses-reports-say/,"French Police Briefly Detain Alleged Culprit of Mysterious Attacks on Horses, Reports Say",,20200908-1200
/india/202009081080396781-indian-economy-recovering-better-than-i-thought-three-months-ago-brics-bank-ex-chief/,Indian Economy Recovering Better Than I Thought Three Months Ago: BRICS Bank Ex-Chief,,20200908-1200
/asia/202009081080397432-servility-to-imperialist-interests-duterte-slammed-for-pardoning-us-marine-who-killed-filipina/,‘Servility to Imperialist Interests’: Duterte Slammed for Pardoning US Marine Who Killed Filipina,,20200908-1200
/analysis/202009051080375191-the-notion-that-us-debt-can-ever-be-paid-back-is-ridiculous-analyst-says/,"'The Notion That US Debt Can Ever Be Paid Back is Ridiculous', Analyst Says",,20200908-1200
/middleeast/202009061080381823-natanz-blast-iran-identifies-forces-responsible-for-sabotage-at-countrys-largest-nuclear-site/,Natanz Blast: Iran Identifies 'Forces Responsible for Sabotage' at Country's Largest Nuclear Site,,20200908-1200
/russia/202009051080376079-german-newspaper-suggests-russia-now-immune-to-any-new-sanctions-west-may-roll-out/,German Newspaper Suggests Russia Now 'Immune' to Any New Sanctions West May Roll Out,,20200908-1200
/viral/202009061080381177-us-troops-spark-fury-after-tiktok-clip-where-they-bug-syrians-with-questions-about-mia-khalifa/,US Troops Spark Fury After TikTok Clip Where They Bug Syrians With Questions About Mia Khalifa,,20200908-1200
/us/202009051080376487-chuck-schumer-backs-bernie-sanders-call-for-regime-change-plan-to-force-trump-from-office/,Chuck Schumer Backs Bernie Sanders' Call For Regime Change Plan To Force Trump From Office,,20200908-1200
/us/202009071080393098-trump-us-to-ban-companies-outsourcing-to-china-from-getting-federal-contracts/,Trump: US to Ban Companies Outsourcing to China From Getting Federal Contracts,,20200908-1200
/military/202009071080385939-pentagon-claims-chinese-air-force-rapidly-catching-up-to-its-western-counterparts/,Pentagon Claims China's PLAAF 'Rapidly Catching Up' to Western Air Forces,,20200908-1200
/world/202009061080382407-vucic-explains-why-he-looked-puzzled-when-trump-announced-serbias-embassy-transfer-to-jerusalem/,Vucic Explains Why He Looked 'Puzzled' When Trump Announced Serbia's Embassy Transfer to Jerusalem,,20200908-1200
/europe/202009081080397133-leaked-diplomatic-cables-reportedly-lay-bare-plummeting-trust-in-uk-amid-brexit-talks/,Leaked Diplomatic Cables Reportedly Lay Bare Plummeting Trust in UK Amid Brexit Talks,,20200908-1200
/uk/202009081080397094-head-of-uk-governments-legal-dept-quits-over-johnsons-attempts-to-alter-brexit-deal-reports-say/,"Head of UK Government's Legal Dep't Quits Over Reported Plans to Alter Brexit Deal, Media Says",,20200908-1200
/europe/202009081080395791-sunken-nazi-german-wwii-warship-found-off-norwegian-coast---photo/,Sunken Nazi German WWII Warship Found Off Norwegian Coast - Photo,,20200908-1200
/world/202009081080395379-covid-19-live-updates-us-case-count-surpasses-63-million/,"COVID-19 Live Updates: Pandemic Situation in Country is 'Worrying', French Health Minister Says",,20200908-1200
/columnists/202009071080382164-questions-on-russias-sputnik-v-vaccine-answered/,"Questions on Russia’s Sputnik V Vaccine Answered, Time for Critics to Look for Plank in Own Eyes",,20200908-1200
/columnists/202009041080367400-poisoning-nord-stream-2/,Poisoning Nord Stream-2,,20200908-1200
/columnists/202009041080368881-bbc-new-boss-tim-for-pm/,BBC New Boss Tim for PM!,,20200908-1200
/columnists/202009031080359734-on-behalf-of-gus-and-millions-like-him--pay-our-carers-properly/,On Behalf of Gus and Millions Like Him – Pay Our Carers Properly,,20200908-1200
/videoclub/202009081080388806-goofball-playing-football-adorable-golden-retriever-wants-to-become-next-messi/,Goofball Playing Football: Adorable Golden Retriever Wants to Become Next Messi,,20200908-1200
/videoclub/202009071080389164-hold-now-crunch-watch-this-little-monkey-tune-the-life-skills-of-its-human-friend/,"'Hold, Now Crunch': Watch This Little Monkey Tune the Life Skills of its Human Friend",,20200908-1200
/videoclub/202009071080381644-adorable-golden-retriever-is-puzzled-by-strange-mask/,Adorable Golden Retriever Puzzled by Strange Mask,,20200908-1200
/videoclub/202009061080381038-you-definitely-want-to-hear-this-conversation-monkey-shares-secret-with-hooman-friend/,You Definitely Want to Hear This Conversation: Monkey 'Shares Secret' with 'Hooman' Friend,,20200908-1200
/videoclub/202009061080380021-wild-animals-get-scared-too-leopard-holds-on-tightly-to-a-cot-during-rescue-mission/,Wild Animals Get Scared Too: Leopard Holds on Tightly to a Cot During Rescue Mission,,20200908-1200
/world/202009071080391482-bin-laden-may-have-used-his-porn-collection-to-send-encrypted-messages-documentary-claims/,"Bin Laden May Have Used His Porn Collection to Send Encrypted Messages, Documentary Claims",,20200908-1200
/radio_double_down/202009081080396734-tech-bloodbath/,"On today’s episode of Double Down, Max Keiser and Stacy Herbert talk to Rick Ackerman for his analysis of the ‘tech bloodbath.’",,20200908-1200
/radio_fault_lines/202009051080368304-portland-antifa-murder-suspect-killed-by-police/,"On today’s episode of Fault Lines, hosts Shane Stranahan and Jamarl Thomas talked about a variety of issues from the police killing of the suspect in the murder of a Trump supporter in Portland to the People’s Convention to the “Rittenhouse Method” of avoiding being killed by police.",,20200908-1200
/radio_the_critical_hour/202009051080370875-covid-19-model-predicts-us-death-toll-will-surpass-410000-by-january-1/,"On this edition of The Critical Hour, co-Hosts Dr. Wilmer Leon and Garland Nixon talk to Dr. Yolandra Hancock and Dr. Lisa Lewis about a COVID-19 model predicting that the disease's American death toll will exceed 410,000 by January 1.",,20200908-1200
/radio_double_down/202009011080334821-profoundly-consequential-zirp/,"On today’s episode of Double Down, Max Keiser and Stacy Herbert talk to Wolf Richter of WolfStreet.com about the latest market insanity.",,20200908-1200
/photo/202009011080337062-sputniks-best-august-photos/,Sputnik's Best August Photos,,20200908-1200
/photo/202008311080326678-messi-leaves-barcelona-looking-back-at-argentinian-superstars-career-with-spanish-club/,Messi Leaves 'Barcelona': Looking Back at Argentinian Superstar's Career With Spanish Club,,20200908-1200
