,text,notes,date
/videoclub/202009061080380021-wild-animals-get-scared-too-leopard-holds-on-tightly-to-a-cot-during-rescue-mission/,Wild Animals Get Scared Too: Leopard Holds on Tightly to a Cot During Rescue Mission,,20200908-1600
/world/202009071080391482-bin-laden-may-have-used-his-porn-collection-to-send-encrypted-messages-documentary-claims/,"Bin Laden May Have Used His Porn Collection to Send Encrypted Messages, Documentary Claims",,20200908-1600
/radio_double_down/202009081080396734-tech-bloodbath/,"On today’s episode of Double Down, Max Keiser and Stacy Herbert talk to Rick Ackerman for his analysis of the ‘tech bloodbath.’",,20200908-1600
/radio_fault_lines/202009051080368304-portland-antifa-murder-suspect-killed-by-police/,"On today’s episode of Fault Lines, hosts Shane Stranahan and Jamarl Thomas talked about a variety of issues from the police killing of the suspect in the murder of a Trump supporter in Portland to the People’s Convention to the “Rittenhouse Method” of avoiding being killed by police.",,20200908-1600
/radio_the_critical_hour/202009051080370875-covid-19-model-predicts-us-death-toll-will-surpass-410000-by-january-1/,"On this edition of The Critical Hour, co-Hosts Dr. Wilmer Leon and Garland Nixon talk to Dr. Yolandra Hancock and Dr. Lisa Lewis about a COVID-19 model predicting that the disease's American death toll will exceed 410,000 by January 1.",,20200908-1600
/radio_double_down/202009011080334821-profoundly-consequential-zirp/,"On today’s episode of Double Down, Max Keiser and Stacy Herbert talk to Wolf Richter of WolfStreet.com about the latest market insanity.",,20200908-1600
/photo/202009081080398561-ocean-yachts-and-bikini-clad-ladies-trump-supporters-parade-off-west-palm-beach/,"Ocean, Yachts and Bikini-Clad Ladies: Trump Supporters Parade Off West Palm Beach",,20200908-1600
/photo/202009011080337062-sputniks-best-august-photos/,Sputnik's Best August Photos,,20200908-1600
/photo/202008311080326678-messi-leaves-barcelona-looking-back-at-argentinian-superstars-career-with-spanish-club/,Messi Leaves 'Barcelona': Looking Back at Argentinian Superstar's Career With Spanish Club,,20200908-1600
/infographics/202008111080136705-russias-vaccine-against-covid-19-in-facts-and-details/,Russia’s Vaccine Against COVID-19 in Facts and Details,,20200908-1600
/cartoons/202009031080361443-vote-early-vote-often/,"Vote Early, Vote Often",,20200908-1600
/cartoons/202009021080344128-mini-stroke-over-parmini-stroke-over-par/,Mini-Stroke Over Par,,20200908-1600
/analysis/202009031080348868-uk-complicity-in-sri-lankan-war-crimes-formed-part-of-securing-its-imperial-interests-expert-says/,Britain’s complicity in war crimes in Sri Lanka have been brought into the spotlight by a new book by investigative journalist Phil Miller about the mercenary firm Keenie Meenie.,,20200908-1600
/analysis/202009021080337386-latest-assange-documentary-is-about-the-most-courageous-and-principled-man-i-know-director-says/,"People in the West are witnessing ""increasing authoritarianism"" and need more than ever to know what is being done by their governments and in their name, the director of the new documentary The War on Journalism: The Case of Julian Assange tells Sputnik.",,20200908-1600
/military/202008251080256337-trump-administration-is-actively-moving-to-turn-space-into-a-war-zone-expert-warns/,"Despite attempts by countries such as Canada, China and Russia to ""keep space for peace"", the US government has proceeded upon a dangerous path that will lead ""the heavens to become a war zone"", explains author and journalist Karl Grossman.",,20200908-1600
/analysis/202008191080208481-how-local-arab-uprising-in-northeast-syria-may-wipe-us-forces--their-sdf-proxies-out-of-the-region/,US bases and personnel have been increasingly attacked by unidentified actors in Syria over the past several months. Political analyst Christopher Assad and US military veteran Mark Sleboda have shed light on the trouble brewing for US occupation forces in the northeastern Syrian provinces of Al-Hasakah and Deir ez-Zor.,,20200908-1600
/analysis/202008171080199122-biden-yet-to-step-foot-in-wisconsin-a-key-battleground-state-he-needs-to-win-pac-director-says-/,"The Democratic National Convention will kick off in Milwaukee, Wisconsin on Monday night, with the four-day event where Democrats formally select their nominee expected to be held mostly online this year due to coronavirus-related health fears. The state is also a key battleground, which Donald Trump won by less than 23,000 votes in 2016.",,20200908-1600
/analysis/202008181080200606-tune-has-not-changed-a-pardon-for-snowden-wont-end-trumps-major-attack-on-whistleblowers/,"US President Donald Trump on Saturday said he would consider pardoning Edward Snowden, the former National Security Agency (NSA) employee who faced criminal charges after leaking classified information about government surveillance.",,20200908-1600
/tags/covid-19/,COVID-19 global dataConfirmed cases:  Recoveries:  Deaths:,,20200908-1630
/business/202009081080399012-merkel-says-decision-on-future-of-nord-stream-2-will-be-made-by-europe-not-germany/,"Merkel Reportedly Says Decision on Future of Nord Stream 2 Will Be Made by Europe, Not Germany",,20200908-1630
/world/202009081080399684-julian-assange-reportedly-rapped-by-judge-after-this-is-nonsense-outburst-at-extradition-trial/,Julian Assange Reportedly Rapped by Judge After ‘This is Nonsense’ Outburst at Extradition Trial,,20200908-1630
/us/202009081080400018-thugs-donald-trump-takes-a-dig-at-blm-shares-clip-of-protesters-harassing-elderly-diners-/,"'Thugs': Donald Trump Takes a Dig at BLM, Shares Clip of Protesters 'Harassing Elderly Diners'",,20200908-1630
/us/202009081080399555-americas-worst-president-how-us-oil-barons-helped-get-warren-g-harding-into-the-white-house/,America’s Worst President? How US Oil Barons Helped Get Warren G. Harding Into The White House,,20200908-1630
/viral/202009081080400571-joe-average-bidens-top-5-gaffes-to-date/,Joe Average: Biden’s Top 5 Gaffes to Date,,20200908-1630
/columnists/202009081080400450-we-need-farage-back/,We Need Farage Back!,,20200908-1630
/middleeast/202009081080401077-hamas-fatah-agree-to-join-forces-against-israel-in-wake-of-uae-peace-deal-senior-official-says/,"Hamas, Fatah Agree to Join Forces Against Israel in Wake of UAE Peace Deal, Senior Official Says",,20200908-1630
/analysis/202009081080400768-exclusive-a-danger-for-justice---assange-defence-expert-explains-how-us-conspiracy-trials-work/,EXCLUSIVE: 'A Danger for Justice' - Assange Defence Expert Explains How US Conspiracy Trials Work,,20200908-1630
/videoclub/202009081080396726-fluffy-cat-overestimates-its-climbing-skills/,Fluffy Cat Overestimates Its Climbing Skills,,20200908-1630
/us-elections-2020/202009081080400953-trump-says-he-would-spend-personal-funds-on-election-campaign-if-necessary/,Trump Says He Would Spend Personal Funds on Election Campaign If Necessary,,20200908-1630
/sport/202009081080400857-messis-tactical-position-under-barsas-new-coach-unveiled-/,Messi’s Tactical Position Under Barсa’s New Coach Unveiled,,20200908-1630
/world/202009081080400781-china-will-reportedly-sanction-senior-us-officials-who-visit-taiwan/,China Will Reportedly Sanction Senior US Officials Who Visit Taiwan,,20200908-1630
/world/202009081080399857-trump-lauds-johnson-as-leaked-notes-show-prime-minister-praised-him-for-making-america-great-again/,Trump Lauds Johnson as Leaked Notes Show Prime Minister Praised Him For 'Making America Great Again',,20200908-1630
/europe/202009081080400559-lukashenko-claims-allies-threw-opposition-figure-kolesnikova-out-of-car-at-ukrainian-border/,Lukashenko Claims Allies Threw Opposition Figure Kolesnikova Out of Car at Ukrainian Border,,20200908-1630
/analysis/202009081080399982-we-need-to-hear-more-stories-from-domestic-abuse-workers-on-the-frontline-professor-says/,"We Need to Hear More Stories From Domestic Abuse Workers on the Frontline, Professor Says",,20200908-1630
/middleeast/202009081080400217-irans-khamenei-says-charlie-hebdo-cartoon-scandal-may-be-diversion-for-evil-us-and-zionist-plots/,Iran’s Khamenei Says Charlie Hebdo Cartoon Scandal May Be Diversion for ‘Evil US and Zionist Plots’,,20200908-1630
/business/202009081080399883-brent-crude-slips-below-40-per-barrel-first-time-since-30-june/,Brent Crude Slips Below $40 Per Barrel First Time Since 30 June,,20200908-1630
/uk/202009081080399284-japan-reportedly-aims-to-finalise-uk-trade-deal-this-week-/,Japan Reportedly Aims to Finalise UK Trade Deal This Week,,20200908-1630
/middleeast/202009061080381823-natanz-blast-iran-identifies-forces-responsible-for-sabotage-at-countrys-largest-nuclear-site/,Natanz Blast: Iran Identifies 'Forces Responsible for Sabotage' at Country's Largest Nuclear Site,,20200908-1630
/viral/202009061080381177-us-troops-spark-fury-after-tiktok-clip-where-they-bug-syrians-with-questions-about-mia-khalifa/,US Troops Spark Fury After TikTok Clip Where They Bug Syrians With Questions About Mia Khalifa,,20200908-1630
/us/202009071080393098-trump-us-to-ban-companies-outsourcing-to-china-from-getting-federal-contracts/,Trump: US to Ban Companies Outsourcing to China From Getting Federal Contracts,,20200908-1630
/us/202009051080376487-chuck-schumer-backs-bernie-sanders-call-for-regime-change-plan-to-force-trump-from-office/,Chuck Schumer Backs Bernie Sanders' Call For Regime Change Plan To Force Trump From Office,,20200908-1630
/military/202009071080385939-pentagon-claims-chinese-air-force-rapidly-catching-up-to-its-western-counterparts/,Pentagon Claims China's PLAAF 'Rapidly Catching Up' to Western Air Forces,,20200908-1630
/world/202009061080382407-vucic-explains-why-he-looked-puzzled-when-trump-announced-serbias-embassy-transfer-to-jerusalem/,Vucic Explains Why He Looked 'Puzzled' When Trump Announced Serbia's Embassy Transfer to Jerusalem,,20200908-1630
/society/202009071080386845-declassified-fbi-files-confirm-existence-of-gigantic-human-like-aliens-report-claims/,"Declassified FBI Files Confirm Existence of Gigantic 'Human-Like Aliens', Report Claims",,20200908-1630
/europe/202009061080383673-german-defence-minister-says-nord-stream-2-sanctions-depend-on-russias-steps-regarding-navalny-case/,German Defence Minister Says Nord Stream 2 Sanctions Depend on Russia's Steps Regarding Navalny Case,,20200908-1630
/europe/202009081080397715-lukashenko-says-he-may-have-overstayed-a-little-in-his-post-as-belaruss-president/,Lukashenko Says He May Have 'Overstayed a Little' in His Post as Belarusian President,,20200908-1630
/russia/202009081080397596-production-of-second-batch-of-russian-sputnik-v-vaccine-for-public-use-underway/,Production of Second Batch of Russian Sputnik V Vaccine for Public Use Underway,,20200908-1630
/world/202009081080395379-covid-19-live-updates-us-case-count-surpasses-63-million/,"COVID-19 Live Updates: EU Parliament Session Moved to Belgium Amid Case Spike in France, Reports Say",,20200908-1630
/columnists/202009081080399290-assange-and-charlatan-trump/,Assange and Charlatan Trump,,20200908-1630
/columnists/202009071080382164-questions-on-russias-sputnik-v-vaccine-answered/,"Questions on Russia’s Sputnik V Vaccine Answered, Time for Critics to Look for Plank in Own Eyes",,20200908-1630
/columnists/202009041080368881-bbc-new-boss-tim-for-pm/,BBC New Boss Tim for PM!,,20200908-1630
/columnists/202009031080359734-on-behalf-of-gus-and-millions-like-him--pay-our-carers-properly/,On Behalf of Gus and Millions Like Him – Pay Our Carers Properly,,20200908-1630
/videoclub/202009081080388806-goofball-playing-football-adorable-golden-retriever-wants-to-become-next-messi/,Goofball Playing Football: Adorable Golden Retriever Wants to Become Next Messi,,20200908-1630
/videoclub/202009071080389164-hold-now-crunch-watch-this-little-monkey-tune-the-life-skills-of-its-human-friend/,"'Hold, Now Crunch': Watch This Little Monkey Tune the Life Skills of its Human Friend",,20200908-1630
/videoclub/202009071080381644-adorable-golden-retriever-is-puzzled-by-strange-mask/,Adorable Golden Retriever Puzzled by Strange Mask,,20200908-1630
/videoclub/202009061080381038-you-definitely-want-to-hear-this-conversation-monkey-shares-secret-with-hooman-friend/,You Definitely Want to Hear This Conversation: Monkey 'Shares Secret' with 'Hooman' Friend,,20200908-1630
/videoclub/202009061080380021-wild-animals-get-scared-too-leopard-holds-on-tightly-to-a-cot-during-rescue-mission/,Wild Animals Get Scared Too: Leopard Holds on Tightly to a Cot During Rescue Mission,,20200908-1630
/world/202009071080391482-bin-laden-may-have-used-his-porn-collection-to-send-encrypted-messages-documentary-claims/,"Bin Laden May Have Used His Porn Collection to Send Encrypted Messages, Documentary Claims",,20200908-1630
/radio_double_down/202009081080396734-tech-bloodbath/,"On today’s episode of Double Down, Max Keiser and Stacy Herbert talk to Rick Ackerman for his analysis of the ‘tech bloodbath.’",,20200908-1630
/radio_fault_lines/202009051080368304-portland-antifa-murder-suspect-killed-by-police/,"On today’s episode of Fault Lines, hosts Shane Stranahan and Jamarl Thomas talked about a variety of issues from the police killing of the suspect in the murder of a Trump supporter in Portland to the People’s Convention to the “Rittenhouse Method” of avoiding being killed by police.",,20200908-1630
/radio_the_critical_hour/202009051080370875-covid-19-model-predicts-us-death-toll-will-surpass-410000-by-january-1/,"On this edition of The Critical Hour, co-Hosts Dr. Wilmer Leon and Garland Nixon talk to Dr. Yolandra Hancock and Dr. Lisa Lewis about a COVID-19 model predicting that the disease's American death toll will exceed 410,000 by January 1.",,20200908-1630
/radio_double_down/202009011080334821-profoundly-consequential-zirp/,"On today’s episode of Double Down, Max Keiser and Stacy Herbert talk to Wolf Richter of WolfStreet.com about the latest market insanity.",,20200908-1630
/photo/202009081080398561-ocean-yachts-and-bikini-clad-ladies-trump-supporters-parade-off-west-palm-beach/,"Ocean, Yachts and Bikini-Clad Ladies: Trump Supporters Parade Off West Palm Beach",,20200908-1630
/photo/202009011080337062-sputniks-best-august-photos/,Sputnik's Best August Photos,,20200908-1630
/photo/202008311080326678-messi-leaves-barcelona-looking-back-at-argentinian-superstars-career-with-spanish-club/,Messi Leaves 'Barcelona': Looking Back at Argentinian Superstar's Career With Spanish Club,,20200908-1630
/infographics/202008111080136705-russias-vaccine-against-covid-19-in-facts-and-details/,Russia’s Vaccine Against COVID-19 in Facts and Details,,20200908-1630
/cartoons/202009031080361443-vote-early-vote-often/,"Vote Early, Vote Often",,20200908-1630
/cartoons/202009021080344128-mini-stroke-over-parmini-stroke-over-par/,Mini-Stroke Over Par,,20200908-1630
/analysis/202009031080348868-uk-complicity-in-sri-lankan-war-crimes-formed-part-of-securing-its-imperial-interests-expert-says/,Britain’s complicity in war crimes in Sri Lanka have been brought into the spotlight by a new book by investigative journalist Phil Miller about the mercenary firm Keenie Meenie.,,20200908-1630
/analysis/202009021080337386-latest-assange-documentary-is-about-the-most-courageous-and-principled-man-i-know-director-says/,"People in the West are witnessing ""increasing authoritarianism"" and need more than ever to know what is being done by their governments and in their name, the director of the new documentary The War on Journalism: The Case of Julian Assange tells Sputnik.",,20200908-1630
/military/202008251080256337-trump-administration-is-actively-moving-to-turn-space-into-a-war-zone-expert-warns/,"Despite attempts by countries such as Canada, China and Russia to ""keep space for peace"", the US government has proceeded upon a dangerous path that will lead ""the heavens to become a war zone"", explains author and journalist Karl Grossman.",,20200908-1630
/analysis/202008191080208481-how-local-arab-uprising-in-northeast-syria-may-wipe-us-forces--their-sdf-proxies-out-of-the-region/,US bases and personnel have been increasingly attacked by unidentified actors in Syria over the past several months. Political analyst Christopher Assad and US military veteran Mark Sleboda have shed light on the trouble brewing for US occupation forces in the northeastern Syrian provinces of Al-Hasakah and Deir ez-Zor.,,20200908-1630
/analysis/202008171080199122-biden-yet-to-step-foot-in-wisconsin-a-key-battleground-state-he-needs-to-win-pac-director-says-/,"The Democratic National Convention will kick off in Milwaukee, Wisconsin on Monday night, with the four-day event where Democrats formally select their nominee expected to be held mostly online this year due to coronavirus-related health fears. The state is also a key battleground, which Donald Trump won by less than 23,000 votes in 2016.",,20200908-1630
/analysis/202008181080200606-tune-has-not-changed-a-pardon-for-snowden-wont-end-trumps-major-attack-on-whistleblowers/,"US President Donald Trump on Saturday said he would consider pardoning Edward Snowden, the former National Security Agency (NSA) employee who faced criminal charges after leaking classified information about government surveillance.",,20200908-1630
/tags/covid-19/,COVID-19 global dataConfirmed cases:  Recoveries:  Deaths:,,20200908-1700
/business/202009081080399012-merkel-says-decision-on-future-of-nord-stream-2-will-be-made-by-europe-not-germany/,"Merkel Reportedly Says Decision on Future of Nord Stream 2 Will Be Made by Europe, Not Germany",,20200908-1700
/world/202009081080399684-julian-assange-reportedly-rapped-by-judge-after-this-is-nonsense-outburst-at-extradition-trial/,Julian Assange Reportedly Rapped by Judge After ‘This is Nonsense’ Outburst at Extradition Trial,,20200908-1700
/us/202009081080400018-thugs-donald-trump-takes-a-dig-at-blm-shares-clip-of-protesters-harassing-elderly-diners-/,"'Thugs': Donald Trump Takes a Dig at BLM, Shares Clip of Protesters 'Harassing Elderly Diners'",,20200908-1700
/us/202009081080399555-americas-worst-president-how-us-oil-barons-helped-get-warren-g-harding-into-the-white-house/,America’s Worst President? How US Oil Barons Helped Get Warren G. Harding Into The White House,,20200908-1700
/viral/202009081080400571-joe-average-bidens-top-5-gaffes-to-date/,Joe Average: Biden’s Top 5 Gaffes to Date,,20200908-1700
/interviews/202009081080397944-enter-the-matrix-nations-tech-firms-race-to-deploy-blockchain-to-digitise-global-power-futurist/,"Enter the Matrix? Nations, Tech Firms Race to Deploy Blockchain to Digitise Global Power: Futurist",,20200908-1700
/military/202009081080401207-russias-mig-29-intercepts-second-norwegian-spy-plane-over-barents-sea-in-one-day/,Russia's MiG-29 Intercepts Second Norwegian Spy Plane Over Barents Sea in One Day,,20200908-1700
/analysis/202009081080400903-johnsons-ultimatum-to-eu-on-brexit-talks-is-quite-a-risk-for-london-professor-says/,"Johnson's Ultimatum to EU on Brexit Talks is 'Quite a Risk' for London, Professor Says",,20200908-1700
/columnists/202009081080400450-we-need-farage-back/,We Need Farage Back!,,20200908-1700
/middleeast/202009081080401077-hamas-fatah-agree-to-join-forces-against-israel-in-wake-of-uae-peace-deal-senior-official-says/,"Hamas, Fatah Agree to Join Forces Against Israel in Wake of UAE Peace Deal, Senior Official Says",,20200908-1700
/analysis/202009081080400768-exclusive-a-danger-for-justice---assange-defence-expert-explains-how-us-conspiracy-trials-work/,EXCLUSIVE: 'A Danger for Justice' - Assange Defence Expert Explains How US Conspiracy Trials Work,,20200908-1700
/videoclub/202009081080396726-fluffy-cat-overestimates-its-climbing-skills/,Fluffy Cat Overestimates Its Climbing Skills,,20200908-1700
/us-elections-2020/202009081080400953-trump-says-he-would-spend-personal-funds-on-election-campaign-if-necessary/,Trump Says He Would Spend Personal Funds on Election Campaign If Necessary,,20200908-1700
/sport/202009081080400857-messis-tactical-position-under-barsas-new-coach-unveiled-/,Messi’s Tactical Position Under Barсa’s New Coach Unveiled,,20200908-1700
/world/202009081080400781-china-will-reportedly-sanction-senior-us-officials-who-visit-taiwan/,China Will Reportedly Sanction Senior US Officials Who Visit Taiwan,,20200908-1700
/world/202009081080399857-trump-lauds-johnson-as-leaked-notes-show-prime-minister-praised-him-for-making-america-great-again/,Trump Lauds Johnson as Leaked Notes Show Prime Minister Praised Him For 'Making America Great Again',,20200908-1700
/europe/202009081080400559-lukashenko-claims-allies-threw-opposition-figure-kolesnikova-out-of-car-at-ukrainian-border/,Lukashenko Claims Allies Threw Opposition Figure Kolesnikova Out of Car at Ukrainian Border,,20200908-1700
/analysis/202009081080399982-we-need-to-hear-more-stories-from-domestic-abuse-workers-on-the-frontline-professor-says/,"We Need to Hear More Stories From Domestic Abuse Workers on the Frontline, Professor Says",,20200908-1700
/middleeast/202009081080400217-irans-khamenei-says-charlie-hebdo-cartoon-scandal-may-be-diversion-for-evil-us-and-zionist-plots/,Iran’s Khamenei Says Charlie Hebdo Cartoon Scandal May Be Diversion for ‘Evil US and Zionist Plots’,,20200908-1700
/middleeast/202009061080381823-natanz-blast-iran-identifies-forces-responsible-for-sabotage-at-countrys-largest-nuclear-site/,Natanz Blast: Iran Identifies 'Forces Responsible for Sabotage' at Country's Largest Nuclear Site,,20200908-1700
/viral/202009061080381177-us-troops-spark-fury-after-tiktok-clip-where-they-bug-syrians-with-questions-about-mia-khalifa/,US Troops Spark Fury After TikTok Clip Where They Bug Syrians With Questions About Mia Khalifa,,20200908-1700
/us/202009071080393098-trump-us-to-ban-companies-outsourcing-to-china-from-getting-federal-contracts/,Trump: US to Ban Companies Outsourcing to China From Getting Federal Contracts,,20200908-1700
/us/202009051080376487-chuck-schumer-backs-bernie-sanders-call-for-regime-change-plan-to-force-trump-from-office/,Chuck Schumer Backs Bernie Sanders' Call For Regime Change Plan To Force Trump From Office,,20200908-1700
/military/202009071080385939-pentagon-claims-chinese-air-force-rapidly-catching-up-to-its-western-counterparts/,Pentagon Claims China's PLAAF 'Rapidly Catching Up' to Western Air Forces,,20200908-1700
/world/202009061080382407-vucic-explains-why-he-looked-puzzled-when-trump-announced-serbias-embassy-transfer-to-jerusalem/,Vucic Explains Why He Looked 'Puzzled' When Trump Announced Serbia's Embassy Transfer to Jerusalem,,20200908-1700
/society/202009071080386845-declassified-fbi-files-confirm-existence-of-gigantic-human-like-aliens-report-claims/,"Declassified FBI Files Confirm Existence of Gigantic 'Human-Like Aliens', Report Claims",,20200908-1700
/europe/202009061080383673-german-defence-minister-says-nord-stream-2-sanctions-depend-on-russias-steps-regarding-navalny-case/,German Defence Minister Says Nord Stream 2 Sanctions Depend on Russia's Steps Regarding Navalny Case,,20200908-1700
/europe/202009081080397715-lukashenko-says-he-may-have-overstayed-a-little-in-his-post-as-belaruss-president/,Lukashenko Says He May Have 'Overstayed a Little' in His Post as Belarusian President,,20200908-1700
/russia/202009081080397596-production-of-second-batch-of-russian-sputnik-v-vaccine-for-public-use-underway/,Production of Second Batch of Russian Sputnik V Vaccine for Public Use Underway,,20200908-1700
/world/202009081080395379-covid-19-live-updates-us-case-count-surpasses-63-million/,"COVID-19 Live Updates: EU Parliament Session Moved to Belgium Amid Case Spike in France, Reports Say",,20200908-1700
/columnists/202009081080399290-assange-and-charlatan-trump/,Assange and Charlatan Trump,,20200908-1700
/columnists/202009071080382164-questions-on-russias-sputnik-v-vaccine-answered/,"Questions on Russia’s Sputnik V Vaccine Answered, Time for Critics to Look for Plank in Own Eyes",,20200908-1700
/columnists/202009031080359734-on-behalf-of-gus-and-millions-like-him--pay-our-carers-properly/,On Behalf of Gus and Millions Like Him – Pay Our Carers Properly,,20200908-1700
/videoclub/202009081080388806-goofball-playing-football-adorable-golden-retriever-wants-to-become-next-messi/,Goofball Playing Football: Adorable Golden Retriever Wants to Become Next Messi,,20200908-1700
/videoclub/202009071080389164-hold-now-crunch-watch-this-little-monkey-tune-the-life-skills-of-its-human-friend/,"'Hold, Now Crunch': Watch This Little Monkey Tune the Life Skills of its Human Friend",,20200908-1700
/videoclub/202009071080381644-adorable-golden-retriever-is-puzzled-by-strange-mask/,Adorable Golden Retriever Puzzled by Strange Mask,,20200908-1700
/videoclub/202009061080381038-you-definitely-want-to-hear-this-conversation-monkey-shares-secret-with-hooman-friend/,You Definitely Want to Hear This Conversation: Monkey 'Shares Secret' with 'Hooman' Friend,,20200908-1700
/videoclub/202009061080380021-wild-animals-get-scared-too-leopard-holds-on-tightly-to-a-cot-during-rescue-mission/,Wild Animals Get Scared Too: Leopard Holds on Tightly to a Cot During Rescue Mission,,20200908-1700
/world/202009071080391482-bin-laden-may-have-used-his-porn-collection-to-send-encrypted-messages-documentary-claims/,"Bin Laden May Have Used His Porn Collection to Send Encrypted Messages, Documentary Claims",,20200908-1700
/radio_double_down/202009081080396734-tech-bloodbath/,"On today’s episode of Double Down, Max Keiser and Stacy Herbert talk to Rick Ackerman for his analysis of the ‘tech bloodbath.’",,20200908-1700
