,text,notes,date
/middleeast/202009081080395034-yemens-houthis-say-targeted-saudi-arabia-abha-airport-with-number-of-drones/,Yemen's Houthis Say They Targeted Saudi Arabia's Abha Airport With 'Number of Drones',,20200908-0600
/middleeast/202009081080395050-khashoggis-family-considers-sentences-in-journalists-murder-case-fair/,Khashoggi's Family Considers Sentences in Journalist's Murder Case Fair,,20200908-0600
/us/202009081080394915-san-francisco-salon-owner-accused-of-setting-up-speaker-pelosi-raises-300k-in-gofundme-campaign/,San Francisco Salon Owner Accused of ‘Setting up’ Speaker Pelosi Raises $300k in GoFundMe Campaign,,20200908-0600
/analysis/202009051080375191-the-notion-that-us-debt-can-ever-be-paid-back-is-ridiculous-analyst-says/,"'The Notion That US Debt Can Ever Be Paid Back is Ridiculous', Analyst Says",,20200908-0600
/middleeast/202009051080374005-hezbollah-was-on-verge-of-war-with-israel-minutes-after-beirut-blast-field-commander-says/,"Hezbollah Was on Verge of War With Israel Minutes After Beirut Blast, Field Commander Says",,20200908-0600
/middleeast/202009061080381823-natanz-blast-iran-identifies-forces-responsible-for-sabotage-at-countrys-largest-nuclear-site/,Natanz Blast: Iran Identifies 'Forces Responsible for Sabotage' at Country's Largest Nuclear Site,,20200908-0600
/russia/202009051080376079-german-newspaper-suggests-russia-now-immune-to-any-new-sanctions-west-may-roll-out/,German Newspaper Suggests Russia Now 'Immune' to Any New Sanctions West May Roll Out,,20200908-0600
/latam/202009051080373590-venezuelan-cities-flooded-with-water-and-crude-oil-following-heavy-rains---video/,Venezuelan Cities Flooded With Water and Crude Oil Following Heavy Rains - Video,,20200908-0600
/us/202009051080376487-chuck-schumer-backs-bernie-sanders-call-for-regime-change-plan-to-force-trump-from-office/,Chuck Schumer Backs Bernie Sanders' Call For Regime Change Plan To Force Trump From Office,,20200908-0600
/military/202009071080385939-pentagon-claims-chinese-air-force-rapidly-catching-up-to-its-western-counterparts/,Pentagon Claims China's PLAAF 'Rapidly Catching Up' to Western Air Forces,,20200908-0600
/viral/202009061080381177-us-troops-spark-fury-after-tiktok-clip-where-they-bug-syrians-with-questions-about-mia-khalifa/,US Troops Spark Fury After TikTok Clip Where They Bug Syrians With Questions About Mia Khalifa,,20200908-0600
/europe/202009071080392122-navalny-coming-out-of-coma-proves-no-novichok-used-against-him/,"Navalny Coming Out of Coma Proves No Novichok Used Against Him, Expert Says",,20200908-0600
/columnists/202009071080382164-questions-on-russias-sputnik-v-vaccine-answered/,"Questions on Russia’s Sputnik V Vaccine Answered, Time for Critics to Look for Plank in Own Eyes",,20200908-0600
/columnists/202009041080367400-poisoning-nord-stream-2/,Poisoning Nord Stream-2,,20200908-0600
/columnists/202009041080368881-bbc-new-boss-tim-for-pm/,BBC New Boss Tim for PM!,,20200908-0600
/columnists/202009031080359734-on-behalf-of-gus-and-millions-like-him--pay-our-carers-properly/,On Behalf of Gus and Millions Like Him – Pay Our Carers Properly,,20200908-0600
/videoclub/202009071080389164-hold-now-crunch-watch-this-little-monkey-tune-the-life-skills-of-its-human-friend/,"'Hold, Now Crunch': Watch This Little Monkey Tune the Life Skills of its Human Friend",,20200908-0600
/videoclub/202009071080381644-adorable-golden-retriever-is-puzzled-by-strange-mask/,Adorable Golden Retriever Puzzled by Strange Mask,,20200908-0600
/videoclub/202009061080381038-you-definitely-want-to-hear-this-conversation-monkey-shares-secret-with-hooman-friend/,You Definitely Want to Hear This Conversation: Monkey 'Shares Secret' with 'Hooman' Friend,,20200908-0600
/videoclub/202009061080380021-wild-animals-get-scared-too-leopard-holds-on-tightly-to-a-cot-during-rescue-mission/,Wild Animals Get Scared Too: Leopard Holds on Tightly to a Cot During Rescue Mission,,20200908-0600
/world/202009071080391482-bin-laden-may-have-used-his-porn-collection-to-send-encrypted-messages-documentary-claims/,"Bin Laden May Have Used His Porn Collection to Send Encrypted Messages, Documentary Claims",,20200908-0600
/radio-political-misfits/202009051080369802-the-peoples-party-convention-tx-governor-wants-changes-in-policing/,"The US is a two party system, but is it time for one more? The People's Party says they have America's best interest in mind.",,20200908-0600
/radio_fault_lines/202009051080368304-portland-antifa-murder-suspect-killed-by-police/,"On today’s episode of Fault Lines, hosts Shane Stranahan and Jamarl Thomas talked about a variety of issues from the police killing of the suspect in the murder of a Trump supporter in Portland to the People’s Convention to the “Rittenhouse Method” of avoiding being killed by police.",,20200908-0600
/radio_the_critical_hour/202009051080370875-covid-19-model-predicts-us-death-toll-will-surpass-410000-by-january-1/,"On this edition of The Critical Hour, co-Hosts Dr. Wilmer Leon and Garland Nixon talk to Dr. Yolandra Hancock and Dr. Lisa Lewis about a COVID-19 model predicting that the disease's American death toll will exceed 410,000 by January 1.",,20200908-0600
/radio_double_down/202009011080334821-profoundly-consequential-zirp/,"On today’s episode of Double Down, Max Keiser and Stacy Herbert talk to Wolf Richter of WolfStreet.com about the latest market insanity.",,20200908-0600
/photo/202009011080337062-sputniks-best-august-photos/,Sputnik's Best August Photos,,20200908-0600
/photo/202008311080326678-messi-leaves-barcelona-looking-back-at-argentinian-superstars-career-with-spanish-club/,Messi Leaves 'Barcelona': Looking Back at Argentinian Superstar's Career With Spanish Club,,20200908-0600
/infographics/202008111080136705-russias-vaccine-against-covid-19-in-facts-and-details/,Russia’s Vaccine Against COVID-19 in Facts and Details,,20200908-0600
/cartoons/202009031080361443-vote-early-vote-often/,"Vote Early, Vote Often",,20200908-0600
/cartoons/202009021080344128-mini-stroke-over-parmini-stroke-over-par/,Mini-Stroke Over Par,,20200908-0600
/analysis/202009031080348868-uk-complicity-in-sri-lankan-war-crimes-formed-part-of-securing-its-imperial-interests-expert-says/,Britain’s complicity in war crimes in Sri Lanka have been brought into the spotlight by a new book by investigative journalist Phil Miller about the mercenary firm Keenie Meenie.,,20200908-0600
/analysis/202009021080337386-latest-assange-documentary-is-about-the-most-courageous-and-principled-man-i-know-director-says/,"People in the West are witnessing ""increasing authoritarianism"" and need more than ever to know what is being done by their governments and in their name, the director of the new documentary The War on Journalism: The Case of Julian Assange tells Sputnik.",,20200908-0600
/military/202008251080256337-trump-administration-is-actively-moving-to-turn-space-into-a-war-zone-expert-warns/,"Despite attempts by countries such as Canada, China and Russia to ""keep space for peace"", the US government has proceeded upon a dangerous path that will lead ""the heavens to become a war zone"", explains author and journalist Karl Grossman.",,20200908-0600
/analysis/202008191080208481-how-local-arab-uprising-in-northeast-syria-may-wipe-us-forces--their-sdf-proxies-out-of-the-region/,US bases and personnel have been increasingly attacked by unidentified actors in Syria over the past several months. Political analyst Christopher Assad and US military veteran Mark Sleboda have shed light on the trouble brewing for US occupation forces in the northeastern Syrian provinces of Al-Hasakah and Deir ez-Zor.,,20200908-0600
/analysis/202008171080199122-biden-yet-to-step-foot-in-wisconsin-a-key-battleground-state-he-needs-to-win-pac-director-says-/,"The Democratic National Convention will kick off in Milwaukee, Wisconsin on Monday night, with the four-day event where Democrats formally select their nominee expected to be held mostly online this year due to coronavirus-related health fears. The state is also a key battleground, which Donald Trump won by less than 23,000 votes in 2016.",,20200908-0600
/analysis/202008181080200606-tune-has-not-changed-a-pardon-for-snowden-wont-end-trumps-major-attack-on-whistleblowers/,"US President Donald Trump on Saturday said he would consider pardoning Edward Snowden, the former National Security Agency (NSA) employee who faced criminal charges after leaking classified information about government surveillance.",,20200908-0600
/tags/covid-19/,COVID-19 global dataConfirmed cases:  Recoveries:  Deaths:,,20200908-0630
/us/202009071080393098-trump-us-to-ban-companies-outsourcing-to-china-from-getting-federal-contracts/,Trump: US to Ban Companies Outsourcing to China From Getting Federal Contracts,,20200908-0630
/asia/202009081080395630-indian-army-says-china-continues-to-undertake-provocative-activities-to-escalate-tensions/,Indian Army Says China Continues to Undertake 'Provocative Activities' to Escalate Tensions,,20200908-0630
/us/202009081080395003-mixed-reactions-as-trump-slams-pentagon-chiefs-for-reluctance-to-pull-out-of-endless-wars/,Mixed Reactions as Trump Slams Pentagon Chiefs For Reluctance to Pull Out of 'Endless Wars',,20200908-0630
/analysis/202009081080393784-us-2020-vote-why-russia-denigrating-bidens-health-story-unlikely-to-scare-off-trumps-supporters/,"US 2020 Vote: Why Russia ""Denigrating Biden’s Health"" Story Unlikely to Scare Off Trump’s Supporters",,20200908-0630
/europe/202009081080395252-islamist-terrorist-leader-burns-swedish-norwegian-flags-in-retaliation-for-quran-torching/,"Islamist Terrorist Leader Burns Swedish, Norwegian Flags in Retaliation for Quran Torching",,20200908-0630
/russia/202009081080395808-russia-to-start-developing-next-generation-helicopter-engine-in-2021/,Russia to Start Developing Next Generation Helicopter Engine in 2021,,20200908-0630
/india/202009081080395562-ruling-shiv-sena-files-complaint-against-kangana-for-comparing-mumbai-to-pakistan-occupied-kashmir/,Ruling Shiv Sena Files Complaint Against Kangana for Comparing Mumbai to Pakistan-Occupied Kashmir,,20200908-0630
/analysis/202009081080395493-weak-iran-and-peace-with-israel-heres-why-gulf-states-would-rather-see-trump-re-elected/,"Weak Iran and Peace With Israel, Here's Why Gulf States Would Rather See Trump Re-Elected",,20200908-0630
/europe/202009081080395679-one-third-of-finns-have-downloaded-the-countrys-new-covid-19-tracking-app/,One-Third of Finns Have Downloaded the Country's New Covid-19 Tracking App,,20200908-0630
/us/202009081080395449-bill-gates-suggests-teslas-electric-semi-trucks-not-a-practical-solution-for-long-haul-vehicles/,Bill Gates Suggests Tesla's Electric Semi Trucks Not a ‘Practical Solution’ for Long Haul Vehicles,,20200908-0630
/europe/202009081080395664-three-members-of-belarus-opposition-council-cross-border-with-ukraine---border-committee/,Three Members of Belarus' Opposition Council Cross Border With Ukraine - Border Committee,,20200908-0630
/business/202009081080395239-investment-researchers-label-tesla-most-dangerous-stock-on-wall-street/,Investment Researchers Label Tesla 'Most Dangerous' Stock on Wall Street,,20200908-0630
/us/202009081080395417-facebook-ready-to-shell-out-50-mln-to-get-people-off-its-apps-before-us-elections-in-november/,Facebook Ready To Shell Out $50 Mln To Get People Off Its Apps Before US Elections in November,,20200908-0630
/world/202009081080395379-covid-19-live-updates-us-case-count-surpasses-63-million/,"COVID-19 Live Updates: Pandemic Situation in Country is 'Worrying', French Health Minister Says",,20200908-0630
/asia/202009081080395350-china-does-not-request-chinese-companies-to-transfer-data-overseas-to-govt-foreign-ministry-says/,"China Does Not Request Chinese Companies to Transfer Data Overseas to Gov't, Foreign Ministry Says",,20200908-0630
/us/202009081080395302-mans-body-found-in-new-york-citys-central-park-reports-say/,"Man’s Body Found in New York City's Central Park, Reports Say",,20200908-0630
/videoclub/202009081080388806-goofball-playing-football-adorable-golden-retriever-wants-to-become-next-messi/,Goofball Playing Football: Adorable Golden Retriever Wants to Become Next Messi,,20200908-0630
/middleeast/202009081080395034-yemens-houthis-say-targeted-saudi-arabia-abha-airport-with-number-of-drones/,Yemen's Houthis Say They Targeted Saudi Arabia's Abha Airport With 'Number of Drones',,20200908-0630
/analysis/202009051080375191-the-notion-that-us-debt-can-ever-be-paid-back-is-ridiculous-analyst-says/,"'The Notion That US Debt Can Ever Be Paid Back is Ridiculous', Analyst Says",,20200908-0630
/middleeast/202009051080374005-hezbollah-was-on-verge-of-war-with-israel-minutes-after-beirut-blast-field-commander-says/,"Hezbollah Was on Verge of War With Israel Minutes After Beirut Blast, Field Commander Says",,20200908-0630
/middleeast/202009061080381823-natanz-blast-iran-identifies-forces-responsible-for-sabotage-at-countrys-largest-nuclear-site/,Natanz Blast: Iran Identifies 'Forces Responsible for Sabotage' at Country's Largest Nuclear Site,,20200908-0630
/russia/202009051080376079-german-newspaper-suggests-russia-now-immune-to-any-new-sanctions-west-may-roll-out/,German Newspaper Suggests Russia Now 'Immune' to Any New Sanctions West May Roll Out,,20200908-0630
/latam/202009051080373590-venezuelan-cities-flooded-with-water-and-crude-oil-following-heavy-rains---video/,Venezuelan Cities Flooded With Water and Crude Oil Following Heavy Rains - Video,,20200908-0630
/us/202009051080376487-chuck-schumer-backs-bernie-sanders-call-for-regime-change-plan-to-force-trump-from-office/,Chuck Schumer Backs Bernie Sanders' Call For Regime Change Plan To Force Trump From Office,,20200908-0630
/military/202009071080385939-pentagon-claims-chinese-air-force-rapidly-catching-up-to-its-western-counterparts/,Pentagon Claims China's PLAAF 'Rapidly Catching Up' to Western Air Forces,,20200908-0630
/viral/202009061080381177-us-troops-spark-fury-after-tiktok-clip-where-they-bug-syrians-with-questions-about-mia-khalifa/,US Troops Spark Fury After TikTok Clip Where They Bug Syrians With Questions About Mia Khalifa,,20200908-0630
/europe/202009071080392122-navalny-coming-out-of-coma-proves-no-novichok-used-against-him/,"Navalny Coming Out of Coma Proves No Novichok Used Against Him, Expert Says",,20200908-0630
/columnists/202009071080382164-questions-on-russias-sputnik-v-vaccine-answered/,"Questions on Russia’s Sputnik V Vaccine Answered, Time for Critics to Look for Plank in Own Eyes",,20200908-0630
/columnists/202009041080367400-poisoning-nord-stream-2/,Poisoning Nord Stream-2,,20200908-0630
/columnists/202009041080368881-bbc-new-boss-tim-for-pm/,BBC New Boss Tim for PM!,,20200908-0630
/columnists/202009031080359734-on-behalf-of-gus-and-millions-like-him--pay-our-carers-properly/,On Behalf of Gus and Millions Like Him – Pay Our Carers Properly,,20200908-0630
/videoclub/202009071080389164-hold-now-crunch-watch-this-little-monkey-tune-the-life-skills-of-its-human-friend/,"'Hold, Now Crunch': Watch This Little Monkey Tune the Life Skills of its Human Friend",,20200908-0630
/videoclub/202009071080381644-adorable-golden-retriever-is-puzzled-by-strange-mask/,Adorable Golden Retriever Puzzled by Strange Mask,,20200908-0630
/videoclub/202009061080381038-you-definitely-want-to-hear-this-conversation-monkey-shares-secret-with-hooman-friend/,You Definitely Want to Hear This Conversation: Monkey 'Shares Secret' with 'Hooman' Friend,,20200908-0630
/videoclub/202009061080380021-wild-animals-get-scared-too-leopard-holds-on-tightly-to-a-cot-during-rescue-mission/,Wild Animals Get Scared Too: Leopard Holds on Tightly to a Cot During Rescue Mission,,20200908-0630
/world/202009071080391482-bin-laden-may-have-used-his-porn-collection-to-send-encrypted-messages-documentary-claims/,"Bin Laden May Have Used His Porn Collection to Send Encrypted Messages, Documentary Claims",,20200908-0630
/radio-political-misfits/202009051080369802-the-peoples-party-convention-tx-governor-wants-changes-in-policing/,"The US is a two party system, but is it time for one more? The People's Party says they have America's best interest in mind.",,20200908-0630
/radio_fault_lines/202009051080368304-portland-antifa-murder-suspect-killed-by-police/,"On today’s episode of Fault Lines, hosts Shane Stranahan and Jamarl Thomas talked about a variety of issues from the police killing of the suspect in the murder of a Trump supporter in Portland to the People’s Convention to the “Rittenhouse Method” of avoiding being killed by police.",,20200908-0630
/radio_the_critical_hour/202009051080370875-covid-19-model-predicts-us-death-toll-will-surpass-410000-by-january-1/,"On this edition of The Critical Hour, co-Hosts Dr. Wilmer Leon and Garland Nixon talk to Dr. Yolandra Hancock and Dr. Lisa Lewis about a COVID-19 model predicting that the disease's American death toll will exceed 410,000 by January 1.",,20200908-0630
/radio_double_down/202009011080334821-profoundly-consequential-zirp/,"On today’s episode of Double Down, Max Keiser and Stacy Herbert talk to Wolf Richter of WolfStreet.com about the latest market insanity.",,20200908-0630
/photo/202009011080337062-sputniks-best-august-photos/,Sputnik's Best August Photos,,20200908-0630
/photo/202008311080326678-messi-leaves-barcelona-looking-back-at-argentinian-superstars-career-with-spanish-club/,Messi Leaves 'Barcelona': Looking Back at Argentinian Superstar's Career With Spanish Club,,20200908-0630
/infographics/202008111080136705-russias-vaccine-against-covid-19-in-facts-and-details/,Russia’s Vaccine Against COVID-19 in Facts and Details,,20200908-0630
/cartoons/202009031080361443-vote-early-vote-often/,"Vote Early, Vote Often",,20200908-0630
/cartoons/202009021080344128-mini-stroke-over-parmini-stroke-over-par/,Mini-Stroke Over Par,,20200908-0630
/analysis/202009031080348868-uk-complicity-in-sri-lankan-war-crimes-formed-part-of-securing-its-imperial-interests-expert-says/,Britain’s complicity in war crimes in Sri Lanka have been brought into the spotlight by a new book by investigative journalist Phil Miller about the mercenary firm Keenie Meenie.,,20200908-0630
/analysis/202009021080337386-latest-assange-documentary-is-about-the-most-courageous-and-principled-man-i-know-director-says/,"People in the West are witnessing ""increasing authoritarianism"" and need more than ever to know what is being done by their governments and in their name, the director of the new documentary The War on Journalism: The Case of Julian Assange tells Sputnik.",,20200908-0630
/military/202008251080256337-trump-administration-is-actively-moving-to-turn-space-into-a-war-zone-expert-warns/,"Despite attempts by countries such as Canada, China and Russia to ""keep space for peace"", the US government has proceeded upon a dangerous path that will lead ""the heavens to become a war zone"", explains author and journalist Karl Grossman.",,20200908-0630
/analysis/202008191080208481-how-local-arab-uprising-in-northeast-syria-may-wipe-us-forces--their-sdf-proxies-out-of-the-region/,US bases and personnel have been increasingly attacked by unidentified actors in Syria over the past several months. Political analyst Christopher Assad and US military veteran Mark Sleboda have shed light on the trouble brewing for US occupation forces in the northeastern Syrian provinces of Al-Hasakah and Deir ez-Zor.,,20200908-0630
/analysis/202008171080199122-biden-yet-to-step-foot-in-wisconsin-a-key-battleground-state-he-needs-to-win-pac-director-says-/,"The Democratic National Convention will kick off in Milwaukee, Wisconsin on Monday night, with the four-day event where Democrats formally select their nominee expected to be held mostly online this year due to coronavirus-related health fears. The state is also a key battleground, which Donald Trump won by less than 23,000 votes in 2016.",,20200908-0630
/analysis/202008181080200606-tune-has-not-changed-a-pardon-for-snowden-wont-end-trumps-major-attack-on-whistleblowers/,"US President Donald Trump on Saturday said he would consider pardoning Edward Snowden, the former National Security Agency (NSA) employee who faced criminal charges after leaking classified information about government surveillance.",,20200908-0630
/tags/covid-19/,COVID-19 global dataConfirmed cases:  Recoveries:  Deaths:,,20200908-0700
/us/202009071080393098-trump-us-to-ban-companies-outsourcing-to-china-from-getting-federal-contracts/,Trump: US to Ban Companies Outsourcing to China From Getting Federal Contracts,,20200908-0700
/asia/202009081080395630-indian-army-says-china-continues-to-undertake-provocative-activities-to-escalate-tensions/,Indian Army Says China Continues to Undertake 'Provocative Activities' to Escalate Tensions,,20200908-0700
/us/202009081080395003-mixed-reactions-as-trump-slams-pentagon-chiefs-for-reluctance-to-pull-out-of-endless-wars/,Mixed Reactions as Trump Slams Pentagon Chiefs For Reluctance to Pull Out of 'Endless Wars',,20200908-0700
/analysis/202009081080393784-us-2020-vote-why-russia-denigrating-bidens-health-story-unlikely-to-scare-off-trumps-supporters/,"US 2020 Vote: Why Russia ""Denigrating Biden’s Health"" Story Unlikely to Scare Off Trump’s Supporters",,20200908-0700
/europe/202009081080395252-islamist-terrorist-leader-burns-swedish-norwegian-flags-in-retaliation-for-quran-torching/,"Islamist Terrorist Leader Burns Swedish, Norwegian Flags in Retaliation for Quran Torching",,20200908-0700
/europe/202009081080395791-sunken-nazi-german-wwii-warship-found-off-norwegian-coast---photo/,Sunken Nazi German WWII Warship Found Off Norwegian Coast - Photo,,20200908-0700
/russia/202009081080395808-russia-to-start-developing-next-generation-helicopter-engine-in-2021/,Russia to Start Developing Next Generation Helicopter Engine in 2021,,20200908-0700
/india/202009081080395562-ruling-shiv-sena-files-complaint-against-kangana-for-comparing-mumbai-to-pakistan-occupied-kashmir/,Ruling Shiv Sena Files Complaint Against Kangana for Comparing Mumbai to Pakistan-Occupied Kashmir,,20200908-0700
/analysis/202009081080395493-weak-iran-and-peace-with-israel-heres-why-gulf-states-would-rather-see-trump-re-elected/,"Weak Iran and Peace With Israel, Here's Why Gulf States Would Rather See Trump Re-Elected",,20200908-0700
/europe/202009081080395679-one-third-of-finns-have-downloaded-the-countrys-new-covid-19-tracking-app/,One-Third of Finns Have Downloaded the Country's New Covid-19 Tracking App,,20200908-0700
/us/202009081080395449-bill-gates-suggests-teslas-electric-semi-trucks-not-a-practical-solution-for-long-haul-vehicles/,Bill Gates Suggests Tesla's Electric Semi Trucks Not a ‘Practical Solution’ for Long Haul Vehicles,,20200908-0700
/europe/202009081080395664-three-members-of-belarus-opposition-council-cross-border-with-ukraine---border-committee/,Three Members of Belarus' Opposition Council Cross Border With Ukraine - Border Committee,,20200908-0700
/business/202009081080395239-investment-researchers-label-tesla-most-dangerous-stock-on-wall-street/,Investment Researchers Label Tesla 'Most Dangerous' Stock on Wall Street,,20200908-0700
/us/202009081080395417-facebook-ready-to-shell-out-50-mln-to-get-people-off-its-apps-before-us-elections-in-november/,Facebook Ready To Shell Out $50 Mln To Get People Off Its Apps Before US Elections in November,,20200908-0700
/world/202009081080395379-covid-19-live-updates-us-case-count-surpasses-63-million/,"COVID-19 Live Updates: Pandemic Situation in Country is 'Worrying', French Health Minister Says",,20200908-0700
/asia/202009081080395350-china-does-not-request-chinese-companies-to-transfer-data-overseas-to-govt-foreign-ministry-says/,"China Does Not Request Chinese Companies to Transfer Data Overseas to Gov't, Foreign Ministry Says",,20200908-0700
/us/202009081080395302-mans-body-found-in-new-york-citys-central-park-reports-say/,"Man’s Body Found in New York City's Central Park, Reports Say",,20200908-0700
/videoclub/202009081080388806-goofball-playing-football-adorable-golden-retriever-wants-to-become-next-messi/,Goofball Playing Football: Adorable Golden Retriever Wants to Become Next Messi,,20200908-0700
/analysis/202009051080375191-the-notion-that-us-debt-can-ever-be-paid-back-is-ridiculous-analyst-says/,"'The Notion That US Debt Can Ever Be Paid Back is Ridiculous', Analyst Says",,20200908-0700
/middleeast/202009051080374005-hezbollah-was-on-verge-of-war-with-israel-minutes-after-beirut-blast-field-commander-says/,"Hezbollah Was on Verge of War With Israel Minutes After Beirut Blast, Field Commander Says",,20200908-0700
/middleeast/202009061080381823-natanz-blast-iran-identifies-forces-responsible-for-sabotage-at-countrys-largest-nuclear-site/,Natanz Blast: Iran Identifies 'Forces Responsible for Sabotage' at Country's Largest Nuclear Site,,20200908-0700
/russia/202009051080376079-german-newspaper-suggests-russia-now-immune-to-any-new-sanctions-west-may-roll-out/,German Newspaper Suggests Russia Now 'Immune' to Any New Sanctions West May Roll Out,,20200908-0700
/latam/202009051080373590-venezuelan-cities-flooded-with-water-and-crude-oil-following-heavy-rains---video/,Venezuelan Cities Flooded With Water and Crude Oil Following Heavy Rains - Video,,20200908-0700
/us/202009051080376487-chuck-schumer-backs-bernie-sanders-call-for-regime-change-plan-to-force-trump-from-office/,Chuck Schumer Backs Bernie Sanders' Call For Regime Change Plan To Force Trump From Office,,20200908-0700
/military/202009071080385939-pentagon-claims-chinese-air-force-rapidly-catching-up-to-its-western-counterparts/,Pentagon Claims China's PLAAF 'Rapidly Catching Up' to Western Air Forces,,20200908-0700
/viral/202009061080381177-us-troops-spark-fury-after-tiktok-clip-where-they-bug-syrians-with-questions-about-mia-khalifa/,US Troops Spark Fury After TikTok Clip Where They Bug Syrians With Questions About Mia Khalifa,,20200908-0700
