,name,text,id,url,created_at
0,CNBC,"Michael Strickland, chair and founder of lighting company Bandit Lites, says the live event industry will remain at zero income until at least next March, unlike some other businesses that have been shut down due to the coronavirus and may recover. https://t.co/uNYpekqHWc https://t.co/1oPEzHTHdf",1300226294257520642,https://www.cnbc.com/video/2020/08/25/live-event-industry-went-to-zero-income-in-march-and-will-remain-at-zero-until-next-year-bandit-lites-founder.html?&qsearchterm=Bandit%20Lites%20founder?__source=twitter%7Cmain,Mon Aug 31 00:18:00 +0000 2020
0,CNBC,Brain coach used by Elon Musk's SpaceX: Here are 3 tips to learn anything faster. https://t.co/pCktKtsFhH (via @CNBCMakeIt),1300226680955469827,https://www.cnbc.com/2020/05/24/elon-musks-former-brain-coach-3-tips-to-learn-anything-faster.html?__source=twitter%7Cmain,Mon Aug 31 00:19:32 +0000 2020
0,CNBC,Renaissance Capital expects fewer Chinese companies to list in the U.S. once new regulations kick in https://t.co/zRdpAYZ7fj,1300226870730993666,https://www.cnbc.com/2020/08/31/us-china-tensions-more-chinese-companies-could-list-in-hong-kong.html?__source=twitter%7Cmain,Mon Aug 31 00:20:17 +0000 2020
0,CNBC,"The average American scored an ""F"" on this investing quiz — see how you do. (via @CNBCMakeIt) https://t.co/m9Bm1UObqL",1300229468074770433,https://www.cnbc.com/2020/06/29/average-american-failed-investing-quiz-find-out-your-money-score.html?__source=twitter%7Cmain,Mon Aug 31 00:30:36 +0000 2020
0,CNBC,"Warren Buffett calls this ""indispensable"" life advice: ""You can always tell someone to go to hell tomorrow."" (via @CNBCMakeIt) https://t.co/SjCJDZzyLZ",1300246035835609090,https://www.cnbc.com/2020/01/09/billionaire-warren-buffett-shares-indispensable-life-advice-he-learned-more-than-40-years-ago.html?__source=twitter%7Cmain,Mon Aug 31 01:36:27 +0000 2020
0,CNBC,From the best major to finding purpose in life — how going to college affects your happiness. (via @CNBCMakeIt) https://t.co/b3smm3pxGf,1300248821507780608,https://www.cnbc.com/2020/08/17/does-getting-a-college-degree-make-you-happier.html?__source=twitter%7Cmain,Mon Aug 31 01:47:31 +0000 2020
0,CNBC,"Training has a significant influence on how police officers react during routine traffic stops and during life-or-death encounters. In the U.S., there are no federally mandated training minimums for police officers. https://t.co/KbuMPescKw https://t.co/3kacJ3emoB",1300256744871022592,https://www.cnbc.com/2020/08/24/the-business-and-money-behind-police-training-in-the-united-states.html?__source=twitter%7Cmain,Mon Aug 31 02:19:00 +0000 2020
0,CNBC,Millennials who tripled their salaries in 10 years share their best advice for getting a raise. (via @CNBCMakeIt) https://t.co/IvT7z2PKYx,1300261261503066117,https://www.cnbc.com/2020/06/15/how-to-get-a-raise-from-millennials-who-tripled-their-salaries.html?__source=twitter%7Cmain,Mon Aug 31 02:36:57 +0000 2020
0,CNBC,ByteDance says it will abide by tightened China export laws as TikTok sale looms https://t.co/DoIU28TFyO,1300261397729890305,https://www.cnbc.com/2020/08/31/tiktok-sale-bytedance-says-it-will-abide-by-amended-china-export-rules.html?__source=twitter%7Cmain,Mon Aug 31 02:37:29 +0000 2020
0,CNBC,"Maye Musk shares her ""crazy"" childhood trekking through the African desert in search of a lost city. (via @CNBCMakeIt) https://t.co/wuF152ja7N",1300264335932088321,https://www.cnbc.com/2020/08/21/maye-musks-crazy-childhood-trekking-through-the-desert-in-africa.html?__source=twitter%7Cmain,Mon Aug 31 02:49:10 +0000 2020
0,CNBC,"The government has the power to print money, but the process may be different than you think. Watch this video to learn where the money comes from for your stimulus check. #investinyou (in partnership with @acorns) https://t.co/4E9xlSbc7W https://t.co/LFLBZVGbWG",1300271844273147905,https://www.cnbc.com/2020/08/21/second-stimulus-check-how-congress-will-fund-the-payment-you-get.html?__source=twitter%7Cmain,Mon Aug 31 03:19:00 +0000 2020
0,CNBC,China warns Czech senate speaker will pay 'heavy price' for Taiwan visit https://t.co/b4AnYcWCc7,1300291395203346432,https://www.cnbc.com/2020/08/31/china-threatens-czech-senate-speaker-vystrcil-over-taiwan-visit.html?__source=twitter%7Cmain,Mon Aug 31 04:36:41 +0000 2020
0,CNBC,"Review: Samsung’s Galaxy Note 20 Ultra is a huge 5G phone for people who want everything, @robotodd says. https://t.co/yJAcTXm1IF",1300293686941618176,https://www.cnbc.com/2020/08/18/samsung-galaxy-note-20-ultra-review.html?__source=twitter%7Cmain,Mon Aug 31 04:45:47 +0000 2020
0,CNBC,Stockton Mayor Michael Tubbs: From son of a teen mom and incarcerated dad to one of America's youngest mayors. (via @CNBCMakeIt) https://t.co/yMffXoemlr,1300296480176197635,https://www.cnbc.com/2020/08/18/stockton-california-mayor-michael-tubbs-on-his-success.html?__source=twitter%7Cmain,Mon Aug 31 04:56:53 +0000 2020
0,CNBC,"This 37-year-old makes up to $3,200 per month in side hustle income—and works just 20 hours a week. (via @CNBCMakeIt) https://t.co/48TZUGZw3a",1300306807986978817,https://www.cnbc.com/2020/02/21/this-millennial-makes-3200-a-month-in-side-hustle-incomeon-a-20-hour-workweek.html?__source=twitter%7Cmain,Mon Aug 31 05:37:56 +0000 2020
0,CNBC,"If your summer plans were cancelled, here are 3 steps to try to get your money back. https://t.co/egdPTMdTMg",1300309636764127234,https://www.cnbc.com/2020/08/19/lost-your-summer-getaway-due-to-covid-19-how-to-get-your-money-back.html?__source=twitter%7Cmain,Mon Aug 31 05:49:10 +0000 2020
0,CNBC,"Don’t try to break your habits, “The Power of Habit” author Charles Duhigg says. Change them. #investinyou (In partnership with @acorns.)  https://t.co/TSZVkBWZ2h https://t.co/cu5LXlijK1",1300312864666783748,https://www.cnbc.com/2020/01/30/the-power-of-habit-author-says-this-is-how-to-start-new-routines.html?__source=twitter%7Cmain,Mon Aug 31 06:02:00 +0000 2020
0,CNBC,"U.S. Treasury yields fall ahead of data, Fed speeches https://t.co/jbCcchGWUj",1300314641248157698,https://www.cnbc.com/2020/08/31/us-treasury-yields-fall-ahead-of-data-fed-speeches.html?__source=twitter%7Cmain,Mon Aug 31 06:09:03 +0000 2020
0,CNBC,European stocks seen higher as dovish Fed boosts sentiment https://t.co/Kna5eLkn3y,1300316336258678786,https://www.cnbc.com/2020/08/31/europe-markets-stocks-seen-higher-on-dovish-fed-china-pmi-data.html?__source=twitter%7Cmain,Mon Aug 31 06:15:47 +0000 2020
0,CNBC,China's mega banks lost billions of dollars in profit as bad loans rise during coronavirus pandemic https://t.co/3Lju7P3Cfe,1300318584321835009,https://www.cnbc.com/2020/08/31/profit-declines-for-chinas-big-banks-in-first-half-of-2020-due-to-bad-loans-during-coronavirus.html?__source=twitter%7Cmain,Mon Aug 31 06:24:43 +0000 2020
0,CNBC,Kevin O'Leary and Mark Cuban both agree that this is your most valuable asset. (via @CNBCMakeIt) https://t.co/FDOOuEpKwP,1300322277008052224,https://www.cnbc.com/2020/08/19/kevin-oleary-mark-cuban-both-agree-time-is-the-most-valuable-asset.html?__source=twitter%7Cmain,Mon Aug 31 06:39:24 +0000 2020
0,CNBC,"An 80-year-old doctor on why he refuses to retire anytime soon — ""I plan to die in the office."" (via @CNBCMakeIt) https://t.co/YxDOCvHce4",1300325094833745921,https://www.cnbc.com/2020/08/18/80-year-old-doctor-longevity-expert-why-i-refuse-to-retire-early.html?__source=twitter%7Cmain,Mon Aug 31 06:50:36 +0000 2020
0,CNBC,Here's how frugal Warren Buffett spends his billions. (via @CNBCMakeIt) https://t.co/LeOuxLetAw,1300337371800653827,https://www.cnbc.com/2020/08/19/how-warren-buffett-spends-his-billions.html?__source=twitter%7Cmain,Mon Aug 31 07:39:23 +0000 2020
0,CNBC,25-year-old Black tech lead in Silicon Valley: I want to use my influence to combat systemic racism. (via @CNBCMakeIt) https://t.co/PMnPsHMCFN,1300340269322297344,https://www.cnbc.com/2020/08/19/black-silicon-valley-entrepreneur-on-combating-racism.html?__source=twitter%7Cmain,Mon Aug 31 07:50:54 +0000 2020
