,name,text,id,url,created_at
0,NBCNews,"From ""Drag Race"" to ""Queer Eye,"" casting directors discuss finding honest and open personalities.

“We talk to individuals over Skype, and you’re peeling back the layers and seeing this kid has been through so much.”  https://t.co/zOqFiv6Mhy - @NBCOUT",1293698805557268481,https://www.nbcnews.com/feature/nbc-out/drag-race-queer-eye-casting-directors-finding-honest-open-personalities-n1236524?cid=sm_npd_nn_tw_ma,Thu Aug 13 00:00:05 +0000 2020
0,NBCNews,Android users who have enabled location services and are near a quake of magnitude 4.5 or greater will receive a full-screen earthquake warning telling them to drop to the floor and seek cover. https://t.co/6k1ofRsTmX,1293699069479657472,https://www.nbcnews.com/tech/tech-news/new-earthquake-warning-system-comes-california-powered-google-rcna79?cid=sm_npd_nn_tw_ma,Thu Aug 13 00:01:08 +0000 2020
0,NBCNews,Uber CEO says the company will halt service in its home state of California for a few months if a judge’s groundbreaking ruling this week is upheld on appeal. https://t.co/dnlp3WHBQb,1293701314602504193,https://www.nbcnews.com/tech/tech-news/uber-ceo-we-will-shut-down-months-california-if-new-n1236506?cid=sm_npd_nn_tw_ma,Thu Aug 13 00:10:03 +0000 2020
0,NBCNews,"A Georgia school district that does not require masks has closed a high school and now has over 1,100 students and staff in quarantine due to the coronavirus. https://t.co/sXQkNB8MxR",1293702833745928192,https://www.nbcnews.com/news/us-news/coronavirus-prompts-closing-georgia-high-school-district-over-1k-quarantine-n1236492?cid=sm_npd_nn_tw_ma&fbclid=IwAR02TXVtUbw1UsT3jsFTOO-qfdCvCoc8tgUZgAKn1BF5iqMy5awOtUz_vmU,Thu Aug 13 00:16:06 +0000 2020
0,NBCNews,"From Houston to Atlanta, AAPI organizations are preparing for full reopening with new initiatives to support small businesses, boost testing and tackle hate crimes. https://t.co/G7qxxsMYCx - @NBCAsianAmerica",1293703838323679240,https://www.nbcnews.com/news/asian-america/asian-americans-south-lack-covid-resources-found-n-y-l-n1236285?cid=sm_npd_nn_tw_ma,Thu Aug 13 00:20:05 +0000 2020
0,NBCNews,"Florida sheriff orders deputies not to don masks

""We can debate and argue all day of why and why not. The fact is, the amount of professionals that give the reason why we should, I can find the exact same amount of professionals that say why we shouldn’t"" https://t.co/2RrWpQxLnK",1293703843075719171,https://www.nbcnews.com/news/us-news/florida-sheriff-orders-deputies-not-wear-masks-bans-civilians-masks-n1236502?cid=sm_npd_nn_tw_ma,Thu Aug 13 00:20:06 +0000 2020
