,name,text,id,url,created_at
0,NewYorker,"In a talk delivered to a group of educators in 1963, James Baldwin insisted that a more honest reckoning with history was necessary. https://t.co/WIGjhANWzZ",1269421232216252417,-1,Sun Jun 07 00:09:41 +0000 2020
0,NewYorker,"""The mixture of rage and resignation I felt after watching was compounded by the suspicion that 'On the Record' may get lost in the shuffle,"" @dstfelix writes, about the new show on HBO Max. https://t.co/gS56KC5zx3",1269429979336630273,-1,Sun Jun 07 00:44:26 +0000 2020
0,NewYorker,"Not all novels should be, or could be, as playful as this one, Dave Eggers writes, ""but it wouldn’t hurt to have a few more that allow humans—characters, readers, authors even—to laugh.""
https://t.co/nZcZM6XlxG",1269446662872858624,-1,Sun Jun 07 01:50:44 +0000 2020
0,NewYorker,"Craig Atkinson’s 2016 documentary film “Do Not Resist” traces the transformation of U.S. police departments into forces that often look and act like our Army and Marines.
https://t.co/K7gMQrZirJ",1269454615663259648,-1,Sun Jun 07 02:22:20 +0000 2020
0,NewYorker,"On Friday, Mayor de Blasio answered questions about the N.Y.P.D. response to the protests on “The Brian Lehrer Show.” It was a 30-minute performance of defensiveness, denial, and bizarre false equivalence. https://t.co/YTiDnr6IJr",1269463403392839680,-1,Sun Jun 07 02:57:15 +0000 2020
0,NewYorker,"In the years after her mother and eight other members of the Emanuel A.M.E. Church were murdered by a white supremacist, Reverend Sharon Risher rose above her doubts in humanity to become an activist against gun violence. https://t.co/0PEn2iGZ2S",1269471682068131840,-1,Sun Jun 07 03:30:09 +0000 2020
