,name,text,id,url,created_at
0,BostonGlobe,Apply to spend a year working with the investigative reporters and editors at @GlobeSpotlight. https://t.co/VEp293zJsS https://t.co/hYGg7sSYeE,1301311108343648257,-1,Thu Sep 03 00:08:40 +0000 2020
0,BostonGlobe,Recipe: Let your teenager make slow-cooker pulled pork for dinner sandwiches or enchiladas https://t.co/AZzm22c63X,1301322931360993281,-1,Thu Sep 03 00:55:38 +0000 2020
0,BostonGlobe,Hall of Famer Tom Seaver dies at age 75 https://t.co/k0oW2EUkxq,1301329114213822464,-1,Thu Sep 03 01:20:13 +0000 2020
0,BostonGlobe,"Marcus Smart fined $5,000 for Game 2 flop https://t.co/rezcL1Te0A",1301330267903275008,-1,Thu Sep 03 01:24:48 +0000 2020
0,BostonGlobe,"112 years ago, Providence was a national leader during a different public health crisis https://t.co/pBSH8WxTeo",1301334125153050627,-1,Thu Sep 03 01:40:07 +0000 2020
0,BostonGlobe,"Dwayne “The Rock” Johnson said Wednesday night in a video posted to Instagram that he, his wife Lauren, and his two daughters have tested positive for COVID-19. https://t.co/PvtNKiKqYj",1301337570811564034,-1,Thu Sep 03 01:53:49 +0000 2020
0,BostonGlobe,Boston startup Biofourmis raises $100m for remote medical tech https://t.co/veFfErm10m,1301344184088121346,-1,Thu Sep 03 02:20:05 +0000 2020
0,BostonGlobe,"The #Braves defeated the #RedSox, 7-5, at Fenway Park for a three-game sweep. https://t.co/HW1Z9ga7ZX",1301348959483559943,-1,Thu Sep 03 02:39:04 +0000 2020
0,BostonGlobe,Aroldis Chapman draws three-game suspension https://t.co/gbHPVO0zYY,1301349215998705665,-1,Thu Sep 03 02:40:05 +0000 2020
0,BostonGlobe,"Julian Alaphilippe stripped of Tour de France lead, yellow jersey https://t.co/dsay0Y4dkV",1301354261188669445,-1,Thu Sep 03 03:00:08 +0000 2020
0,BostonGlobe,‘Ted Lasso’ is a true anomaly — a TV series adapted from an ad that’s actually worth watching https://t.co/ALMNORtQ3f,1301361823472644099,-1,Thu Sep 03 03:30:11 +0000 2020
0,BostonGlobe,"With a live album, Christian Scott aTunde Adjuah captures the moment of an arriving pandemic https://t.co/hmSC9m0ouc",1301369355532464133,-1,Thu Sep 03 04:00:07 +0000 2020
0,BostonGlobe,BC football team makes progress in preseason camp https://t.co/iKp1fMGdKU,1301377389449162757,-1,Thu Sep 03 04:32:02 +0000 2020
0,BostonGlobe,Hurricane Nana nears Belize as residents brace for landfall https://t.co/zc4d340gJw,1301384046522634240,-1,Thu Sep 03 04:58:29 +0000 2020
0,BostonGlobe,"Doc Talk: On the medal stand, teens battling addiction, Werner Herzog speaks https://t.co/mGMhbrfaVs",1301387046033018880,-1,Thu Sep 03 05:10:25 +0000 2020
0,BostonGlobe,Man hospitalized after manhole cover smashes into his car https://t.co/Uwe0tPplNk https://t.co/4feEDfJtLo,1301392562444554240,-1,Thu Sep 03 05:32:20 +0000 2020
0,BostonGlobe,Lack of play-making depth spells doom for Revolution https://t.co/WBC6TZ2ZMZ,1301400125743542272,-1,Thu Sep 03 06:02:23 +0000 2020
0,BostonGlobe,Blues trade Jake Allen to Montreal https://t.co/wvgPyYpkL5,1301407604070125568,-1,Thu Sep 03 06:32:06 +0000 2020
