,name,text,id,url,created_at
0,FortuneMagazine,Novavax expects results from new human trial of coronavirus vaccine in July https://t.co/ZHscLyichE,1265432602871283713,https://fortune.com/2020/05/25/novavax-coronavirus-vaccine-human-trial-results/?utm_medium=social&utm_campaign=fortunemagazine&utm_source=twitter.com&xid=soc_socialflow_twitter_FORTUNE,Wed May 27 00:00:17 +0000 2020
0,FortuneMagazine,Coronavirus apps’ fatal flaw: Almost everyone has to use them or they won’t work https://t.co/sWTosteM0O,1265447682358853632,https://fortune.com/2020/05/26/coronavirus-app-fatal-flaw-google-apple/?xid=soc_socialflow_twitter_FORTUNE&utm_source=twitter.com&utm_campaign=fortunemagazine&utm_medium=social,Wed May 27 01:00:13 +0000 2020
0,FortuneMagazine,The global liquor industry might not fully recover for another five years https://t.co/6H5AvU0CAx,1265455191652007939,https://fortune.com/2020/05/26/alcohol-consumption-liquor-industry-coronavirus-pandemic/?xid=soc_socialflow_twitter_FORTUNE&utm_source=twitter.com&utm_campaign=fortunemagazine&utm_medium=social,Wed May 27 01:30:03 +0000 2020
0,FortuneMagazine,Amy Cooper called the cops on Christian Cooper when he asked her to leash her dog in Central Park. The confrontation shows the impact of still-widespread segregation. https://t.co/qorZR7B7Nk,1265462779646967808,https://fortune.com/2020/05/26/amy-cooper-video-central-park-ramble-christian-cooper/?utm_source=twitter.com&xid=soc_socialflow_twitter_FORTUNE&utm_medium=social&utm_campaign=fortunemagazine,Wed May 27 02:00:12 +0000 2020
0,FortuneMagazine,The U.K.’s lockdown is making the country’s electricity grid greener—for good https://t.co/JHquMq3rsU,1265470314273800193,https://fortune.com/2020/05/26/uk-coronavirus-green-electricity-grid-lockdown-coal-free/?utm_campaign=fortunemagazine&utm_source=twitter.com&xid=soc_socialflow_twitter_FORTUNE&utm_medium=social,Wed May 27 02:30:08 +0000 2020
0,FortuneMagazine,"""I can be more vulnerable"": Citi President Jane Fraser on female leaders’ pandemic-era advantage https://t.co/D0gnPARITt",1265470315989282818,https://fortune.com/2020/05/26/citi-president-jane-fraser-women-leadership-vulnerability-coronavirus/?utm_source=twitter.com&xid=soc_socialflow_twitter_FORTUNE&utm_campaign=fortunemagazine&utm_medium=social,Wed May 27 02:30:09 +0000 2020
