,name,text,id,url,created_at
0,businessinsider,Later-stage fintechs that offer digital solutions to mitigate the impacts of the pandemic continue to net large funding rounds https://t.co/l0oFGJx4Tw,1324139964989362177,https://www.businessinsider.com/private-fintech-funding-continues-to-rise-q3-2020-2020-11?IR=T&itm_source=twitter&itm_medium=social&itm_content=briefings_post&itm_campaign=11-4-2020,Thu Nov 05 00:02:23 +0000 2020
0,businessinsider,"RT @thisisinsider: BREAKING: Sen. Gary Peters wins reelection in Senate, Insider reports via @DecisionDeskHQ: https://t.co/1LWw9ysGx5 https://t.co/lQzSZfpO3R",1324149113143906304,https://www.businessinsider.com/gary-peters-vs-john-james-michigan-senate-polls-fundraising-2020-8,Thu Nov 05 00:38:44 +0000 2020
0,businessinsider,PayPal is adding a number of offerings that should help it drive further engagement from its rapidly growing user base https://t.co/vv6rcIRnFv,1324154777782149123,https://www.businessinsider.com/paypal-posted-record-payment-volume-growth-q3-2020-2020-11?IR=T&itm_source=twitter&itm_medium=social&itm_content=briefings_post&itm_campaign=11-4-2020,Thu Nov 05 01:01:15 +0000 2020
0,businessinsider,"RT @thisisinsider: Democratic Sen. Gary Peters has won reelection in Michigan, per Insider and @DecisionDeskHQ. 

Follow along here for live results of the Senate races: https://t.co/y2qFXDgB7M https://t.co/tfFv7xIflb",1324157011706171392,https://www.businessinsider.com/2020-senate-election-results,Thu Nov 05 01:10:07 +0000 2020
0,businessinsider,Here's when we can expect presidential race results from the key swing state of Arizona https://t.co/c4kVMAo8fv,1324158728212566016,https://www.businessinsider.com/when-we-can-expect-results-from-the-key-swing-state-of-arizona-2020-11,Thu Nov 05 01:16:57 +0000 2020
