,name,text,id,url,created_at
0,AJEnglish,Can sound nurse dying coral reefs back to health? https://t.co/yKytlPxEL0,1285363861776814080,,Tue Jul 21 00:00:00 +0000 2020
0,AJEnglish,WHO sounds alarm at spread of coronavirus in Africa https://t.co/QVnhfottsd,1285363891833315328,https://www.aljazeera.com/news/2020/07/sounds-alarm-spread-coronavirus-africa-200720184812122.html?taid=5f163007c3d9480001c44c54&utm_campaign=trueAnthem%3A+Trending+Content&utm_medium=trueAnthem&utm_source=twitter,Tue Jul 21 00:00:07 +0000 2020
0,AJEnglish,Mexican president sticks to no-war approach after cartel video https://t.co/gf3fUB33LH,1285367639670390788,https://www.aljazeera.com/news/2020/07/mexican-president-sticks-war-approach-cartel-video-200720204624484.html?taid=5f163384c3d9480001c44c68&utm_campaign=trueAnthem%3A+Trending+Content&utm_medium=trueAnthem&utm_source=twitter,Tue Jul 21 00:15:00 +0000 2020
0,AJEnglish,"Riding high in polls, Biden begins courting Republican voters https://t.co/FV1I9A9wOG",1285371420051222530,https://www.aljazeera.com/news/2020/07/riding-high-polls-biden-begins-courting-republican-voters-200720183147996.html?taid=5f16370a502a3e0001d633d0&utm_campaign=trueAnthem%3A+Trending+Content&utm_medium=trueAnthem&utm_source=twitter,Tue Jul 21 00:30:02 +0000 2020
0,AJEnglish,Scattered protests in Mali after crisis mediation falters https://t.co/5jiTIMBghc,1285375189690261509,https://www.aljazeera.com/news/2020/07/scattered-protests-mali-crisis-mediation-falters-200720160435591.html?taid=5f163a8cc3d9480001c44c79&utm_campaign=trueAnthem%3A+Trending+Content&utm_medium=trueAnthem&utm_source=twitter,Tue Jul 21 00:45:00 +0000 2020
0,AJEnglish,Judge allows lawsuit challenging US terror watchlist to proceed https://t.co/24AbvMwYZD,1285379005835862017,https://www.aljazeera.com/news/2020/07/judge-lawsuit-challenging-terror-watchlist-proceed-200720203517486.html?taid=5f163e1a977e0100010f1331&utm_campaign=trueAnthem%3A+Trending+Content&utm_medium=trueAnthem&utm_source=twitter,Tue Jul 21 01:00:10 +0000 2020
0,AJEnglish,Couple who pointed weapons at St Louis protesters charged https://t.co/8ZsDTcrbfH,1285390290476564482,https://www.aljazeera.com/news/2020/07/couple-pointed-weapons-st-louis-protesters-charged-200720222921430.html?taid=5f16489d977e0100010f1345&utm_campaign=trueAnthem%3A+Trending+Content&utm_medium=trueAnthem&utm_source=twitter,Tue Jul 21 01:45:01 +0000 2020
0,AJEnglish,"Zimbabwe police detain prominent journalist, protest leader https://t.co/WCDXWzBQOF",1285394085679964160,https://www.aljazeera.com/news/2020/07/zimbabwe-police-detain-prominent-journalist-protest-leader-200720193232172.html?taid=5f164c26502a3e0001d63411&utm_campaign=trueAnthem%3A+Trending+Content&utm_medium=trueAnthem&utm_source=twitter,Tue Jul 21 02:00:06 +0000 2020
0,AJEnglish,"Trump says he may not sign a new virus relief package into law unless it includes a payroll tax cut for US workers.

Will it help the US economy? https://t.co/7iSVeg6AuN https://t.co/MfAdk6rKgj",1285394139828363264,https://www.aljazeera.com/ajimpact/trump-payroll-tax-cut-economy-200720163856858.html,Tue Jul 21 02:00:19 +0000 2020
0,AJEnglish,Coronavirus outbreak in Australia's Victoria grows: Live updates https://t.co/6zA4VCrp2y,1285397845873504257,https://www.aljazeera.com/news/2020/07/coronavirus-outbreak-australia-victoria-grows-live-updates-200720235536147.html?taid=5f164fa6977e0100010f135f&utm_campaign=trueAnthem%3A+Trending+Content&utm_medium=trueAnthem&utm_source=twitter,Tue Jul 21 02:15:02 +0000 2020
0,AJEnglish,Scaled-down Hajj pilgrimage to start on July 29: Saudi officials https://t.co/NQQb8ungWi,1285405390579085317,https://www.aljazeera.com/news/2020/07/scaled-hajj-pilgrimage-start-july-29-saudi-officials-200721013258024.html?taid=5f1656ad977e0100010f1371&utm_campaign=trueAnthem%3A+Trending+Content&utm_medium=trueAnthem&utm_source=twitter,Tue Jul 21 02:45:01 +0000 2020
0,AJEnglish,China to 'fight back' as UK suspends Hong Kong extradition deal https://t.co/gOoEd28PXn,1285412939693010944,https://www.aljazeera.com/news/2020/07/china-fight-uk-suspends-hong-kong-extradition-deal-200721010339774.html?taid=5f165db5977e0100010f1384&utm_campaign=trueAnthem%3A+Trending+Content&utm_medium=trueAnthem&utm_source=twitter,Tue Jul 21 03:15:01 +0000 2020
0,AJEnglish,"The Iranian authorities are ramping up repression. They fear mass protests now more than ever https://t.co/fubzaLuAeE  — #AJOpinion, by @saeidgolkar. https://t.co/bVjZLPp2MW",1285424329245831168,https://www.aljazeera.com/indepth/opinion/iran-message-people-revolt-die-200713160012571.html,Tue Jul 21 04:00:16 +0000 2020
0,AJEnglish,"A year to go, rearranged Tokyo Games still face uncertainty https://t.co/9lFAaGSTMQ",1285428037836779522,https://www.aljazeera.com/news/2020/07/year-rearranged-tokyo-games-face-uncertainty-200721021610847.html?taid=5f166bc4c3d9480001c44d57&utm_campaign=trueAnthem%3A+Trending+Content&utm_medium=trueAnthem&utm_source=twitter,Tue Jul 21 04:15:00 +0000 2020
0,AJEnglish,These YouTubers created functioning replicas of their dream cars using cardboard. 🚗 https://t.co/3tEAGx4YQ8,1285439360607944705,,Tue Jul 21 05:00:00 +0000 2020
0,AJEnglish,Locked down between poverty and internet deprivation in Botswana https://t.co/gcA0G9mCow https://t.co/qUbEtzRrFr,1285446954395348997,https://www.aljazeera.com/indepth/features/locked-poverty-internet-deprivation-botswana-200407071910740.html,Tue Jul 21 05:30:11 +0000 2020
0,AJEnglish,"Flying has become an even bigger headache. 

From social distancing and masks to extra documents - has the COVID-19… https://t.co/KYVd5unLzW",1285454458843848705,https://twitter.com/i/web/status/1285454458843848705,Tue Jul 21 06:00:00 +0000 2020
0,AJEnglish,"Automatically labelling people who use an encrypted chat 'criminals' threatens our fundamental right to privacy https://t.co/EZJn5qlVXv  — #AJOpinion, by @abbas_nawroz. https://t.co/qd4X4cdtVT",1285462045371052034,https://www.aljazeera.com/indepth/opinion/encrochat-police-hacking-sets-dangerous-precedent-200718102811036.html,Tue Jul 21 06:30:09 +0000 2020
0,AJEnglish,@sandra Do you trust airlines to keep passengers safe during the pandemic? | Share with us below #AJStartHere https://t.co/y4bMzloi87,1285477109121646592,,Tue Jul 21 07:30:00 +0000 2020
0,AJEnglish,"There's been a major development in the race to develop a COVID-19 vaccine as scientists at Oxford University say trials  involving more than 1,000 people show early promise.  

Read more: https://t.co/HSbOQNWV1b https://t.co/r7l1Bdpocn",1285480882976043009,https://www.aljazeera.com/news/2020/07/human-trial-oxford-coronavirus-vaccine-shows-promise-200720140307414.html,Tue Jul 21 07:45:00 +0000 2020
0,AJEnglish,"COVID-19 updates 👉 https://t.co/CN8DTaJZis 

• EU leaders reach deal on massive post-pandemic economic recovery plan
• Possible vaccine could be rolled out by end of the year
• Ukraine's cases exceed 60,000
• Brazil to start advance testing of vaccine developed by China https://t.co/qyw7BZvFZs",1285486096655286272,https://www.aljazeera.com/news/2020/07/coronavirus-outbreak-australia-victoria-grows-live-updates-200720235536147.html,Tue Jul 21 08:05:43 +0000 2020
0,AJEnglish,China to 'fight back' as the UK suspends its extradition deal with Hong Kong https://t.co/QOgIiVMsUw https://t.co/ETJUs8CD47,1285489161651322880,https://www.aljazeera.com/news/2020/07/china-fight-uk-suspends-hong-kong-extradition-deal-200721010339774.html,Tue Jul 21 08:17:54 +0000 2020
0,AJEnglish,"Some 2.5 million pilgrims from around the world flock annually to Saudi Arabia for Hajj, the week-long ritual scheduled to begin in late July. But this year, no overseas visitors will be allowed.

🎧 Listen to this episode of @AJTheTake 👇 https://t.co/ZjJ30sei8Q",1285492242501730304,https://www.aljazeera.com/podcasts/thetake/2020/07/coronavirus-cancelled-hajj-millions-200720141304388.html,Tue Jul 21 08:30:08 +0000 2020
0,AJEnglish,African Union-led talks to be latest bid to break deadlock over Ethiopia's #GERD | https://t.co/Kb0ypoJ5J6 https://t.co/1dZNJEizCo,1285496000904343552,https://www.aljazeera.com/news/2020/07/au-led-talks-latest-bid-break-deadlock-ethiopia-gerd-200721055355142.html,Tue Jul 21 08:45:04 +0000 2020
0,AJEnglish,"Sudan's ex-President Omar al-Bashir, who was overthrown last year by the military in the face of mass protests against his rule, is set to go on trial over the 1989 coup that brought him to power https://t.co/SQXSVrVt5a https://t.co/nI2Eky8KJp",1285499828596813829,https://www.aljazeera.com/news/2020/07/sudan-bashir-trial-1989-coup-brought-power-200721072640425.html?__twitter_impression=true,Tue Jul 21 09:00:17 +0000 2020
0,AJEnglish,How do you make sports events safe during the COVID-19 pandemic? https://t.co/Xu2VVsMw7H https://t.co/Xno3N240m5,1285504169693130753,https://www.aljazeera.com/indepth/features/coronavirus-sports-events-safe-pandemic-200720064551659.html,Tue Jul 21 09:17:32 +0000 2020
0,AJEnglish,South Korea launches its first military satellite https://t.co/KgCko8scEA https://t.co/JVySXLsmQw,1285507318361317382,https://www.aljazeera.com/news/2020/07/south-korea-launches-military-satellite-200721051821473.html,Tue Jul 21 09:30:02 +0000 2020
0,AJEnglish,"""This is a good deal, this is a strong deal and, above all, it is the right deal for Europe now."" 

EU leaders reac… https://t.co/dHMLqKypmD",1285511081847402500,https://twitter.com/i/web/status/1285511081847402500,Tue Jul 21 09:45:00 +0000 2020
0,AJEnglish,The protests in Serbia were not against the anti-pandemic measures by the government. — writes @pantelichmarija for #AJOpinion https://t.co/90E8cgXoFH,1285514912433868800,https://www.aljazeera.com/indepth/opinion/protests-serbia-200718175749533.html,Tue Jul 21 10:00:13 +0000 2020
0,AJEnglish,"Europe's anti-migrant stance resulted in the deaths of thousands trying to flee persecution and conflict, analysts say https://t.co/D6Cf0V6JjO https://t.co/2M5Lz6g5tQ",1285522445445869568,https://www.aljazeera.com/indepth/features/black-lives-matter-drowning-mediterranean-200715170152666.html,Tue Jul 21 10:30:09 +0000 2020
0,AJEnglish,Court in Malaysia to hear bid to overturn caning of Rohingya refugees https://t.co/EGIfDXMFi0 https://t.co/LKWNINlEIm,1285526207245754368,https://www.aljazeera.com/news/2020/07/malaysia-court-hear-bid-overturn-caning-rohingya-men-200721085717482.html,Tue Jul 21 10:45:06 +0000 2020
0,AJEnglish,Iran records its highest daily death toll from COVID-19 https://t.co/AKqRMqDk2S https://t.co/2aaG518rOC,1285529956219412481,https://www.aljazeera.com/news/2020/07/coronavirus-outbreak-australia-victoria-grows-live-updates-200720235536147.html,Tue Jul 21 11:00:00 +0000 2020
0,AJEnglish,Russia meddled in the 2014 Scottish referendum says new UK parliament report https://t.co/7LQm9sVTBX https://t.co/pPnHusx7pr,1285533759295586307,https://www.aljazeera.com/news/2020/07/russia-meddled-scottish-vote-unclear-brexit-uk-parliament-200721094341178.html,Tue Jul 21 11:15:06 +0000 2020
0,AJEnglish,"Trump’s ""beautiful"" failures in the Middle East are only matched by his failures in East Asia.  — writes @marwanbishara for #AJOpinion https://t.co/bDJ7AyNCZM",1285537529698164736,https://www.aljazeera.com/indepth/opinion/trump-beautiful-failures-200721083557552.html,Tue Jul 21 11:30:05 +0000 2020
0,AJEnglish,Rescuers have been working for days to free a large sperm whale caught in an illegal fishing net off the coast of S… https://t.co/kFwB1jSOod,1285541280953651200,https://twitter.com/i/web/status/1285541280953651200,Tue Jul 21 11:45:00 +0000 2020
0,AJEnglish,RT @AJENews: Tanzania presidential election to be held on October 28 https://t.co/sYVfS5mLSM https://t.co/xh77M6kuZ0,1285548897977405441,https://www.aljazeera.com/news/2020/07/tanzania-presidential-election-held-october-28-200721100331444.html,Tue Jul 21 12:15:16 +0000 2020
0,AJEnglish,COVID-19 hits Brazil's quilombos hard — in pictures https://t.co/Ku3YLXZxRq https://t.co/gkCIPEdhvm,1285556380867284993,https://www.aljazeera.com/indepth/inpictures/pictures-covid-19-hits-brazil-quilombos-hard-200721063942159.html,Tue Jul 21 12:45:00 +0000 2020
0,AJEnglish,Iraqi PM Mustafa al-Kadhimi arrives in Iran in first trip abroad https://t.co/AJMTr2KTng https://t.co/RS8g9xPtUW,1285563957374095360,https://www.aljazeera.com/news/2020/07/iraqi-pm-mustafa-al-kadhimi-arrives-iran-trip-200721102057555.html,Tue Jul 21 13:15:06 +0000 2020
0,AJEnglish,"The problem of performative activism https://t.co/KDvvZGtIHY — #AJOpinion, by @JohnMetta https://t.co/ZhdTsVqpc2",1285567761205297157,https://www.aljazeera.com/indepth/opinion/problem-performative-activism-200715111635687.html,Tue Jul 21 13:30:13 +0000 2020
0,AJEnglish,"""There has been credible open source commentary suggesting that Russia undertook influence campaigns in relation to the Scottish independence referendum in 2014,"" says report. https://t.co/Yt7Jdccu5C",1285571480303079425,https://www.aljazeera.com/news/2020/07/russia-meddled-scottish-vote-unclear-brexit-uk-parliament-200721094341178.html,Tue Jul 21 13:45:00 +0000 2020
0,AJEnglish,Spain to give 1.7 billion euros in COVID-19 aid to developing countries https://t.co/BEQbfppAQg https://t.co/j8TpN4BLEs,1285579425329876994,https://www.aljazeera.com/news/2020/07/coronavirus-outbreak-australia-victoria-grows-live-updates-200720235536147.html,Tue Jul 21 14:16:34 +0000 2020
