,name,text,id,url,created_at
0,AJEnglish,Supreme Court leaves voting rights of some Floridians in limbo https://t.co/Q4LyaDRida,1283921875530387457,https://www.aljazeera.com/news/2020/07/supreme-court-leaves-voting-rights-floridians-limbo-200716180746494.html?taid=5f10f10b502a3e00018644c9&utm_campaign=trueAnthem%3A+Trending+Content&utm_medium=trueAnthem&utm_source=twitter,Fri Jul 17 00:30:03 +0000 2020
0,AJEnglish,Twitter hacking: What we know so far https://t.co/R6EEOWD84c,1283936974173339653,https://www.aljazeera.com/news/2020/07/twitter-hacking-200716114235384.html?taid=5f10ff1b502a3e00018644e9&utm_campaign=trueAnthem%3A+Trending+Content&utm_medium=trueAnthem&utm_source=twitter,Fri Jul 17 01:30:03 +0000 2020
0,AJEnglish,Brazil tops 2 million coronavirus cases: Live updates https://t.co/C6qAa5vnbf,1283940736174624768,https://www.aljazeera.com/news/2020/07/brazil-tops-2-million-coronavirus-cases-live-updates-200717001908280.html?taid=5f11029c977e0100010f05a1&utm_campaign=trueAnthem%3A+Trending+Content&utm_medium=trueAnthem&utm_source=twitter,Fri Jul 17 01:45:00 +0000 2020
0,AJEnglish,"Wilson was not only an avowed racist, but also an architect of a sanctions regime that continues to kill to this day https://t.co/ZmuVHkJT6C — #AJOpinion, by Eva Nanopoulos. https://t.co/ANJaCTKv24",1283944547391868928,https://www.aljazeera.com/indepth/opinion/woodrow-wilson-racist-legacy-decolonising-modern-sanctions-200714125436461.html,Fri Jul 17 02:00:09 +0000 2020
0,AJEnglish,'Cascading crises': UN calls for more funding for poorer nations https://t.co/H40yYAutqE,1283948286387331072,https://www.aljazeera.com/news/2020/07/crises-calls-funding-poorer-nations-200717003051811.html?taid=5f1109a4502a3e000186450f&utm_campaign=trueAnthem%3A+Trending+Content&utm_medium=trueAnthem&utm_source=twitter,Fri Jul 17 02:15:00 +0000 2020
0,AJEnglish,"""When I started the training I felt like I got back my amputated leg.""

Gaza’s young amputee football players are b… https://t.co/8BNLX54dba",1283959612937568257,https://twitter.com/i/web/status/1283959612937568257,Fri Jul 17 03:00:01 +0000 2020
0,AJEnglish,Easing of #coronavirus lockdowns helped China's economy grow by 3.2% in Apr-Jun after plunging in Jan-March https://t.co/RdWbCAJe12 https://t.co/wkyQaLLhwl,1283974734271729665,https://www.aljazeera.com/ajimpact/china-big-bounce-economy-posts-stronger-expected-rebound-200716015552617.html,Fri Jul 17 04:00:06 +0000 2020
0,AJEnglish,A sculpture of a #BlackLivesMatter protester erected on the plinth where the toppled statue of slave trader Edward… https://t.co/d0G8JpnW66,1283989807685918723,https://twitter.com/i/web/status/1283989807685918723,Fri Jul 17 05:00:00 +0000 2020
0,AJEnglish,A group of Rohingya refugees who were rescued off the coast of Indonesia’s Aceh last month are being welcomed and s… https://t.co/GEJm6pHVFD,1284004907251576835,https://twitter.com/i/web/status/1284004907251576835,Fri Jul 17 06:00:00 +0000 2020
0,AJEnglish,"Coronavirus could cause US to lose Iraqi Kurdish region to China https://t.co/TpqPbw7fyI — #AJOpinion, by @YerevanSaeed. https://t.co/9DYjKDeqY8",1284012487092973574,https://www.aljazeera.com/indepth/opinion/coronavirus-lose-iraqi-kurdish-region-china-200716114705668.html,Fri Jul 17 06:30:07 +0000 2020
0,AJEnglish,There’s growing demand for robots that can cook and serve food amid concerns over hygiene and the spread of disease… https://t.co/0ZYxI9pT3I,1284024124181012481,https://twitter.com/i/web/status/1284024124181012481,Fri Jul 17 07:16:21 +0000 2020
0,AJEnglish,Shelling between Azerbaijan and Armenia ends brief ceasefire https://t.co/50NcWikDoH https://t.co/hd5skdp8Rl,1284027796340314112,https://www.aljazeera.com/news/2020/07/shelling-azerbaijan-armenia-ends-ceasefire-200716184550121.html,Fri Jul 17 07:30:57 +0000 2020
0,AJEnglish,"COVID-19 updates 👉 https://t.co/0CzGUVL3DW

🇮🇳 India's coronavirus cases cross one million
🇧🇷 Brazil cases reach two million, doubling in less than a month
🇺🇸 US reports another record for new infection cases https://t.co/U0Dfx6jxju",1284037377888063488,https://www.aljazeera.com/news/2020/07/brazil-tops-2-million-coronavirus-cases-live-updates-200717001908280.html,Fri Jul 17 08:09:01 +0000 2020
0,AJEnglish,Top legislators on Capitol Hill told Twitter CEO Jack Dorsey to brief committee staff members on the hack by next week https://t.co/iRHFMAvUp7 https://t.co/Lf5DKfuXPP,1284039151160090629,https://www.aljazeera.com/news/2020/07/fbi-joins-hunt-twitter-hackers-hijacked-eminent-accounts-200716184339323.html,Fri Jul 17 08:16:04 +0000 2020
0,AJEnglish,Melbourne sees record rise of more than 423 new infection cases despite lockdown https://t.co/aGJrLKKSJz https://t.co/ifXzKeEgpk,1284046430936670209,https://www.aljazeera.com/news/2020/07/australia-posts-record-daily-rise-coronavirus-cases-200717031513043.html,Fri Jul 17 08:45:00 +0000 2020
0,AJEnglish,"""This makes us confident that Solar Orbiter will help us answer profound open questions about the Sun.""

Solar Orbiter gives closest photos of the Sun, ever https://t.co/lYgirrbaSp https://t.co/8qmS2yVYHU",1284050257878425600,https://www.aljazeera.com/news/2020/07/solar-orbiter-closest-photos-sun-200716152522999.html,Fri Jul 17 09:00:12 +0000 2020
0,AJEnglish,"In a Chinese Buddhist orphanage in Malawi, a teenager finds himself torn between African roots and a Chinese upbringing.

▶️ Watch Buddha in Africa: The Story of a Malawian Kung Fu Fighter 👉 https://t.co/jqaWHSBsW3 [via @AJWitness] https://t.co/53zu33AF0H",1284053995313672192,https://www.aljazeera.com/programmes/witness/2020/07/buddha-africa-story-malawian-kung-fu-fighter-200714164321878.html,Fri Jul 17 09:15:03 +0000 2020
0,AJEnglish,"A lower-caste Dalit couple in Madhya Pradesh state attempted suicide after police beat them and destroyed their crops, causing outrage in India https://t.co/cOkj9wbzuz https://t.co/vT35tLpRfV",1284057785408393217,https://www.aljazeera.com/news/2020/07/outrage-india-dalit-couple-thrashed-crops-bulldozed-200717050044891.html,Fri Jul 17 09:30:07 +0000 2020
0,AJEnglish,"New York will not open malls and museums on Monday even if the city is allowed to move into the next phase of reopening, says Governor Andrew Cuomo https://t.co/JzHNAHTwW4 https://t.co/2GJ3e9DwBn",1284062681348149249,https://www.aljazeera.com/news/2020/07/brazil-tops-2-million-coronavirus-cases-live-updates-200717001908280.html,Fri Jul 17 09:49:34 +0000 2020
0,AJEnglish,"RT @AJEnglish: There’s growing demand for robots that can cook and serve food amid concerns over hygiene and the spread of disease. 

Would you rather have a robot or human prepare your meal? 🤖 https://t.co/ZdJKwdSU10There’s growing demand for robots that can cook and serve food amid concerns over hygiene and the spread of disease… https://t.co/0ZYxI9pT3I",1284065376456839174,https://twitter.com/i/web/status/1284024124181012481,Fri Jul 17 10:00:17 +0000 2020
0,AJEnglish,"""If it does not take swift action to assure Iraqi Kurds that the US still has their back, China can easily take its place as the primary benefactor - and decision-maker - in the region."" https://t.co/OPjkPCn95V — writes @YerevanSaeed for #AJOpinion.",1284069259774173184,https://www.aljazeera.com/indepth/opinion/coronavirus-lose-iraqi-kurdish-region-china-200716114705668.html,Fri Jul 17 10:15:43 +0000 2020
0,AJEnglish,"""If it does not take swift action to assure Iraqi Kurds that the US still has their back, China can easily take its place as the primary benefactor - and decision-maker - in the region."" https://t.co/HHIVmvqSw3 — writes @YerevanSaeed for #AJOpinion.",1284069573814292481,https://www.aljazeera.com/indepth/opinion/coronavirus-lose-iraqi-kurdish-region-china-200716114705668.html,Fri Jul 17 10:16:57 +0000 2020
0,AJEnglish,@AJpeoplepower ▶️  Watch part two of @AJPeoplePower's investigation on Ireland's mother and baby scandal https://t.co/9sB9FWyA02 https://t.co/3AzDchyl6z,1284077762622390272,https://www.aljazeera.com/programmes/peopleandpower/2020/07/ireland-mother-baby-scandal-200708133901707.html,Fri Jul 17 10:49:30 +0000 2020
0,AJEnglish,"Demonstrators shut down main oil production in southern Tunisia, escalating weeks of protests for jobs and economic development in the deprived region https://t.co/mSSwKSeV3w https://t.co/bdAzTmt0dN",1284083325821505536,https://www.aljazeera.com/news/2020/07/tunisia-protesters-shut-main-oil-production-site-south-200717071254691.html,Fri Jul 17 11:11:36 +0000 2020
0,AJEnglish,⚡️ Stories you shouldn't miss today - Friday https://t.co/zndYlGksTD,1284087767522095104,https://twitter.com/i/events/1284081028169183235,Fri Jul 17 11:29:15 +0000 2020
0,AJEnglish,"""Unfortunately, European politicians and the public appear to have grown weary with the refugee issue, and are no longer moved by images of people in distress and dying at sea.""

#BlackLivesMatter, 'even the ones drowning in the Mediterranean' https://t.co/S7GMeHM7ji https://t.co/Gc3NpFn3Zq",1284095546878304256,https://www.aljazeera.com/indepth/features/black-lives-matter-drowning-mediterranean-200715170152666.html,Fri Jul 17 12:00:10 +0000 2020
0,AJEnglish,British Airways retires 747 early due to #coronavirus crisis https://t.co/FN0NU9nEVw https://t.co/vR3d23dzwQ,1284099279989202945,https://www.aljazeera.com/news/2020/07/brazil-tops-2-million-coronavirus-cases-live-updates-200717001908280.html,Fri Jul 17 12:15:00 +0000 2020
0,AJEnglish,"For Black and Indigenous people and other persons of colour, the backbreaking weight of American racism is inescapable https://t.co/VKpDAVgVr8 — #AJOpinion, by @decollins1969. https://t.co/jAvZ8vG1Pz",1284103083430207489,https://www.aljazeera.com/indepth/opinion/weight-pressure-american-racism-200715091405840.html,Fri Jul 17 12:30:07 +0000 2020
0,AJEnglish,"RT @AJWitness: Man or woman; ""who is full of substance?"" 

Watch the full film #GhanaControversial to explore a kaleidoscope of perspectives (and contradictions) characterising #Ghana today: https://t.co/bDNq0lEvgs https://t.co/NmLN4O0MEY",1284109575982129152,https://www.aljazeera.com/programmes/witness/2019/08/ghana-controversial-music-ground-190819152636521.html,Fri Jul 17 12:55:55 +0000 2020
0,AJEnglish,Analysts say African Americans targeted in US voter suppression https://t.co/jLNa20zUJL https://t.co/2Tpr18bZDP,1284123622194515969,https://www.aljazeera.com/news/2020/07/voter-suppression-analysts-african-americans-targeted-200717131455227.html,Fri Jul 17 13:51:44 +0000 2020
0,AJEnglish,Delhi Minority Commission report accuses police of failing to protect Muslims during the Delhi riots https://t.co/fh8eqcQu3R https://t.co/lRgkUBvWvZ,1284125713742860289,https://www.aljazeera.com/news/2020/07/minority-body-faults-police-role-anti-muslim-riots-delhi-200717110600080.html,Fri Jul 17 14:00:02 +0000 2020
