,name,text,id,url,created_at
0,NPR,"Sen. Tim Scott says Senate Republicans are considering a proposal to increase police training to focus on de-escalation tactics — as well as setting up a commission to get a handle on concerns facing policing today.
https://t.co/bQqHP33XSw",1270508233980096513,https://www.npr.org/2020/06/09/873356229/led-by-tim-scott-senate-republicans-begin-drafting-their-own-police-reform-plan?utm_term=nprnews&utm_medium=social&utm_campaign=npr&utm_source=twitter.com,Wed Jun 10 00:09:02 +0000 2020
0,NPR,"North Korea will cut off all communications with South Korea and treat it as an ""enemy,"" according to North Korea's state media. 

The move comes just a month after the countries traded fire at their heavily patrolled border.
https://t.co/FWEc5XDOnz",1270508735534960642,https://www.npr.org/2020/06/09/873118843/north-korea-says-it-will-sever-contact-with-south-korea-and-will-treat-it-as-ene?utm_medium=social&utm_term=nprnews&utm_campaign=npr&utm_source=twitter.com,Wed Jun 10 00:11:02 +0000 2020
