,name,text,id,url,created_at
0,NPR,"At least 71 nations have already imposed limitations or full bans on exports of essential COVID-19 supplies — forcing many of the poorest countries into bidding wars over highly urgent, highly priced medical products. https://t.co/9WhrEKC60o",1271957773962575872,https://www.npr.org/sections/goatsandsoda/2020/06/13/864563401/pandemic-perspective-what-the-20-poorest-and-richest-countries-spend-on-health-c?utm_term=nprnews&utm_campaign=npr&utm_source=twitter.com&utm_medium=social,Sun Jun 14 00:08:59 +0000 2020
0,NPR,"From the adoption of a teenage daughter to the birth of a baby boy, here are a few of the best things that happened to @NPRItsBeenAMin listeners this week.

Check out the podcast at https://t.co/uq1X48zQdp. https://t.co/2YuA4kGMga",1271976631570239489,https://www.npr.org/podcasts/510317/its-been-a-minute-with-sam-sanders,Sun Jun 14 01:23:55 +0000 2020
0,NPR,"Stephania Ergemlidze has been bringing a portable basketball hoop to protests. 

""Obviously, basketball is not going to solve the problem,"" she says. ""We were more looking towards trying to ease the tension ... that way, maybe messages can get across."" https://t.co/P3bwgH0Wsc",1271987155246727170,https://www.wbur.org/onlyagame/2020/06/12/stephania-ergemlidze-portable-basketball-hoop?utm_medium=social&utm_source=twitter.com&utm_term=nprnews&utm_campaign=npr,Sun Jun 14 02:05:44 +0000 2020
0,NPR,"""I don't necessarily agree with defunding police,"" says Memphis Police Association President Michael Williams, but he agrees ""whole-heartedly"" that the city's budget isn't equitably spread to address the needs of the people of Memphis. https://t.co/zvjVUy02SR",1271996875844005889,https://www.npr.org/2020/06/13/876522017/memphis-police-union-head-on-calls-for-reform?utm_source=twitter.com&utm_medium=social&utm_campaign=npr&utm_term=nprnews&utm_content=20200613,Sun Jun 14 02:44:22 +0000 2020
