,name,text,id,url,created_at
0,washingtonpost,"In poll watcher affidavits, Trump campaign offers no evidence of fraud in Detroit ballot-counting https://t.co/jIZ0c2MOGv",1326680041594515458,https://www.washingtonpost.com/politics/michigan--poll-watcher-affidavits/2020/11/11/4d073d7a-2447-11eb-a688-5298ad5d580a_story.html?utm_medium=social&utm_campaign=wp_main&utm_source=twitter,Thu Nov 12 00:15:45 +0000 2020
0,washingtonpost,Elizabeth Warren in Opinions: What a Biden-Harris administration should prioritize on its first day https://t.co/nK6a00V6D8,1326684166054948864,https://www.washingtonpost.com/opinions/2020/11/11/elizabeth-warren-biden-harris-first-day/?utm_campaign=wp_main&utm_source=twitter&utm_medium=social,Thu Nov 12 00:32:08 +0000 2020
0,washingtonpost,Biden taps Ronald A. Klain as White House chief of staff — the president-elect's first public personnel decision https://t.co/MqjxPyfxJ0,1326685143810125827,https://www.washingtonpost.com/politics/klain-biden-white-house/2020/11/11/3c64069a-21d3-11eb-a688-5298ad5d580a_story.html,Thu Nov 12 00:36:01 +0000 2020
0,washingtonpost,"Analysis: The Trump campaign’s bad-faith claims about the election, in two tweets https://t.co/gmNXu6jQDG",1326691143741018112,https://www.washingtonpost.com/politics/2020/11/11/trump-campaigns-bad-faith-claims-about-election-two-tweets/?utm_source=twitter&utm_medium=social&utm_campaign=wp_main,Thu Nov 12 00:59:52 +0000 2020
0,washingtonpost,"With streaming success and a debut hit, ""American Idol"" finalist Gabby Barrett has become a country music anomaly https://t.co/NlUup5O8EL",1326692956636655623,https://www.washingtonpost.com/arts-entertainment/2020/11/11/gabby-barrett-charlie-puth-i-hope/?utm_source=twitter&utm_campaign=wp_main&utm_medium=social,Thu Nov 12 01:07:04 +0000 2020
0,washingtonpost,"Trump rails against ""medical deep state"" after Pfizer vaccine news comes after Election Day https://t.co/8q2wxziR2O",1326696225308078088,https://www.washingtonpost.com/politics/2020/11/11/trump-angry-about-pfizer-vaccine/?utm_source=twitter&utm_medium=social&utm_campaign=wp_main,Thu Nov 12 01:20:03 +0000 2020
0,washingtonpost,Azerbaijan’s drones owned the battlefield in Nagorno-Karabakh – and showed future of warfare https://t.co/UMyo2BXgXe,1326703910283866113,https://www.washingtonpost.com/world/europe/nagorno-karabkah-drones-azerbaijan-aremenia/2020/11/11/441bcbd2-193d-11eb-8bda-814ca56e138b_story.html?utm_source=twitter&utm_campaign=wp_main&utm_medium=social,Thu Nov 12 01:50:35 +0000 2020
0,washingtonpost,"Biden and Benjamin Netanyahu have known one another for decades, but their relationship is expected to be quite different from what the prime minister had with Trump https://t.co/m0zbMxbEJP",1326704279877464065,https://www.washingtonpost.com/politics/biden-trump-israel-netanyahu/2020/11/11/d4cc8f60-22af-11eb-8672-c281c7a2c96e_story.html?utm_source=twitter&utm_campaign=wp_main&utm_medium=social,Thu Nov 12 01:52:03 +0000 2020
0,washingtonpost,"Amid Pentagon upheaval, military officers face a fraught few months https://t.co/YQ0IeNmR2z",1326706795876904963,https://www.washingtonpost.com/national-security/military-shakeup-election-transition/2020/11/11/1623009e-2444-11eb-8599-406466ad1b8e_story.html?utm_campaign=wp_main&utm_source=twitter&utm_medium=social,Thu Nov 12 02:02:03 +0000 2020
0,washingtonpost,"Prisons and jails have become a ""public health threat"" during the pandemic, advocates say https://t.co/vatyFumazS",1326729227018899460,https://www.washingtonpost.com/national/coronavirus-outbreaks-prisons/2020/11/11/b8c3a90c-d8d6-11ea-930e-d88518c57dcc_story.html?utm_campaign=wp_main&utm_medium=social&utm_source=twitter,Thu Nov 12 03:31:11 +0000 2020
0,washingtonpost,"Opinion: No, the ""Hail Mary"" plan for Trump isn’t going to work https://t.co/WxDsIHQAFn",1326735916656975872,https://www.washingtonpost.com/opinions/2020/11/11/no-hail-mary-plan-trump-isnt-going-work/?utm_campaign=wp_main&utm_source=twitter&utm_medium=social,Thu Nov 12 03:57:46 +0000 2020
0,washingtonpost,"As coronavirus soars, hospitals hope to avoid an agonizing choice: Who gets care and who goes home https://t.co/rL3ysndgvt",1326743495290261504,https://www.washingtonpost.com/climate-environment/2020/11/11/coronavirus-soars-hospitals-hope-avoid-an-agonizing-choice-who-gets-care-who-goes-home/?utm_source=twitter&utm_medium=social&utm_campaign=wp_main,Thu Nov 12 04:27:53 +0000 2020
0,washingtonpost,Still saintly? Vatican’s new report on McCarrick may complicate the legacy of Pope John Paul II. https://t.co/0I16zFYLKW,1326757733295681542,https://www.washingtonpost.com/religion/2020/11/11/pope-john-paul-saint-mccarrick-report-legacy-francis/?utm_medium=social&utm_source=twitter&utm_campaign=wp_main,Thu Nov 12 05:24:28 +0000 2020
0,washingtonpost,Opinion: Of course Republicans are doing this. It’s who they are. https://t.co/UydJZf8YXE,1326764632317505536,https://www.washingtonpost.com/opinions/of-course-republicans-are-doing-this-its-who-they-are/2020/11/11/ba57f780-2455-11eb-8672-c281c7a2c96e_story.html?utm_medium=social&utm_campaign=wp_main&utm_source=twitter,Thu Nov 12 05:51:53 +0000 2020
0,washingtonpost,"One name, two musical acts and a story of privilege: How the Lady A controversy captured the state of the music industry in 2020 https://t.co/YJLikdyg9J",1326778781000994821,https://www.washingtonpost.com/arts-entertainment/2020/11/11/lady-a-lady-antebellum-name-change-controversy/?utm_source=twitter&utm_medium=social&utm_campaign=wp_main,Thu Nov 12 06:48:06 +0000 2020
0,washingtonpost,Opinion: House Democrats didn’t do too well this year. But we should have seen this coming. https://t.co/0EO1ReBn0o,1326827435166486530,https://www.washingtonpost.com/opinions/2020/11/11/house-democrats-didnt-do-too-well-this-year-we-should-have-seen-this-coming/?utm_medium=social&utm_source=twitter&utm_campaign=wp_main,Thu Nov 12 10:01:26 +0000 2020
0,washingtonpost,"Former U.S. attorney in Opinions: I investigated voter fraud in New Mexico.

Barr’s investigate-now approach makes no sense. https://t.co/wynHaJfFw7",1326834090671222785,https://www.washingtonpost.com/opinions/2020/11/11/david-iglesias-barr-dangerous-voter-fraud-investigation/?utm_source=twitter&utm_medium=social&utm_campaign=wp_main,Thu Nov 12 10:27:53 +0000 2020
0,washingtonpost,Opinion: MSNBC’s Jon Meacham problem https://t.co/jOCI4Th0kM,1326840430802112514,https://www.washingtonpost.com/opinions/2020/11/11/msnbcs-jon-meacham-problem/?utm_campaign=wp_main&utm_source=twitter&utm_medium=social,Thu Nov 12 10:53:04 +0000 2020
0,washingtonpost,Audio recording shows Pa. postal worker recanting ballot-tampering claim https://t.co/k5cAgtZcNs,1326851245852811264,https://www.washingtonpost.com/investigations/postal-worker-hopkins-ballot-pennsylvania/2020/11/11/c9b70eda-2470-11eb-8599-406466ad1b8e_story.html?utm_medium=social&utm_source=twitter&utm_campaign=wp_main,Thu Nov 12 11:36:03 +0000 2020
0,washingtonpost,Opinion: Will a Biden-Harris administration stand up to Modi’s toxic rule in India? https://t.co/6tl6ymCjgN,1326852764702547969,https://www.washingtonpost.com/opinions/2020/11/11/will-biden-harris-administration-stand-up-modis-toxic-rule-india/?utm_source=twitter&utm_campaign=wp_main&utm_medium=social,Thu Nov 12 11:42:05 +0000 2020
0,washingtonpost,D.C.’s electoral votes will all be cast by women — including this Howard University graduate https://t.co/3iA3uqTmtj,1326852766816489472,https://www.washingtonpost.com/dc-md-va/2020/11/11/dc-elector-women/?utm_campaign=wp_main&utm_medium=social&utm_source=twitter,Thu Nov 12 11:42:05 +0000 2020
0,washingtonpost,"Live updates: Hospitalizations hit all-time high as U.S. sets another record with 145,000 new infections https://t.co/cXHqD4neem",1326855283109470208,https://www.washingtonpost.com/nation/2020/11/12/coronavirus-covid-live-updates-us/?utm_campaign=wp_main&utm_medium=social&utm_source=twitter,Thu Nov 12 11:52:05 +0000 2020
0,washingtonpost,Opinion: A fall coronavirus disaster is already here. We can’t wait until Inauguration Day to act. https://t.co/ZaTNxIGSaJ,1326865048267001856,https://www.washingtonpost.com/opinions/coronavirus-fall-wave-america-must-act/2020/11/11/985876a2-2430-11eb-a688-5298ad5d580a_story.html?utm_medium=social&utm_campaign=wp_main&utm_source=twitter,Thu Nov 12 12:30:54 +0000 2020
0,washingtonpost,"Analysis: Vaccines have never been distributed equally. A coronavirus vaccine would be no different, history suggests. https://t.co/Jif8CGvL07",1326871551241834496,https://www.washingtonpost.com/world/2020/11/12/vaccine-distribution-history-coronavirus-h1n1-h5n1/?utm_medium=social&utm_source=twitter&utm_campaign=wp_main,Thu Nov 12 12:56:44 +0000 2020
0,washingtonpost,"Typhoon Vamco batters the Philippines, leaving millions without power https://t.co/6IzgInBaie",1326876179761127424,https://www.washingtonpost.com/world/asia_pacific/typhoon-vamco-manila-damage-flooding/2020/11/12/fe05667e-248d-11eb-9c4a-0dc6242c4814_story.html?utm_source=twitter&utm_campaign=wp_main&utm_medium=social,Thu Nov 12 13:15:08 +0000 2020
0,washingtonpost,New York Republican vows to defy Cuomo’s new 10-person limit on Thanksgiving dinners https://t.co/XFtwlNvN9c,1326876429108318213,https://www.washingtonpost.com/nation/2020/11/12/staten-island-republican-thanksgiving-covid/?utm_campaign=wp_main&utm_medium=social&utm_source=twitter,Thu Nov 12 13:16:07 +0000 2020
0,washingtonpost,"A nest filled with hundreds of ""murder hornets"" was destroyed ""just in the nick of time,"" officials say https://t.co/bnAsWYIyHB",1326879453243387904,https://www.washingtonpost.com/nation/2020/11/12/murder-hornet-nest-us-washington/?utm_campaign=wp_main&utm_medium=social&utm_source=twitter,Thu Nov 12 13:28:08 +0000 2020
0,washingtonpost,"Arizona’s GOP attorney general rejects Trump’s unfounded voter fraud claims: ""There is no evidence"" https://t.co/cAqeC04UQl",1326886656515977216,https://www.washingtonpost.com/nation/2020/11/12/brnovich-arizona-attorney-general-trump/?utm_source=twitter&utm_medium=social&utm_campaign=wp_main,Thu Nov 12 13:56:45 +0000 2020
0,washingtonpost,"CMA Awards 2020: Complete list of winners, best and worst moments https://t.co/4h0cdMuWNp",1326892266271748096,https://www.washingtonpost.com/arts-entertainment/2020/11/12/cma-awards-list-winners-best-worst-moments/?utm_source=twitter&utm_medium=social&utm_campaign=wp_main,Thu Nov 12 14:19:03 +0000 2020
0,washingtonpost,Tech companies brace for the long haul with Trump’s unrelenting attacks on election outcome https://t.co/3bLBhT1nSP,1326892268276551680,https://www.washingtonpost.com/technology/2020/11/12/facebook-ad-ban-lame-duck/?utm_medium=social&utm_source=twitter&utm_campaign=wp_main,Thu Nov 12 14:19:03 +0000 2020
0,washingtonpost,"Carl June, MD, a pioneer in immunotherapy, and Wajahat Ali and Sarah Kureshi, MD, parents of a childhood cancer survivor, join The Post to talk about the latest developments in oncology and share their inspirational stories. https://t.co/vM8g1pTGKp",1326902545839779845,https://twitter.com/i/broadcasts/1BdxYYjwzXAxX,Thu Nov 12 14:59:54 +0000 2020
0,washingtonpost,"Analysis: GOP leaders’ embrace of Trump’s refusal to concede fits pattern of rising authoritarianism, data shows https://t.co/twNmLuGeoP",1326907629348773894,https://www.washingtonpost.com/business/2020/11/12/republican-party-trump-authoritarian-data/?utm_medium=social&utm_campaign=wp_main&utm_source=twitter,Thu Nov 12 15:20:06 +0000 2020
0,washingtonpost,Voter turnout reaches highest rate in more than a century https://t.co/8wDUfUVA5X,1326915343206453250,https://www.washingtonpost.com/graphics/2020/elections/voter-turnout/,Thu Nov 12 15:50:45 +0000 2020
0,washingtonpost,"Harris will be the first female, Black and Asian VP. But not the first VP of color https://t.co/JhcK4Cmz3O",1326926511346167809,https://www.washingtonpost.com/history/2020/11/12/charles-curtis-kamala-harris-vice-president-native-american/?utm_campaign=wp_main&utm_medium=social&utm_source=twitter,Thu Nov 12 16:35:08 +0000 2020
0,washingtonpost,"RT @thefix: What now? We’re chatting live with readers at noon about the latest on what we know about Biden’s presidency, and Trump’s resistance to conceding. Join us. https://t.co/AxnB3P7Iy7",1326928350762446849,https://www.washingtonpost.com/politics/2020/11/12/live-chat-politics-the-fix/,Thu Nov 12 16:42:26 +0000 2020
0,washingtonpost,Analysis: Biden got the highest percentage of eligible voters in about half a century https://t.co/HkVCqf3jzW,1326932791972536323,https://www.washingtonpost.com/politics/2020/11/12/how-big-is-joe-bidens-mandate/?utm_source=twitter&utm_medium=social&utm_campaign=wp_main,Thu Nov 12 17:00:05 +0000 2020
0,washingtonpost,"Lucille Bridges, who stood by daughter Ruby through school desegregation, dies at 86 https://t.co/5tv0abkHA0",1326934295714394112,https://www.washingtonpost.com/local/obituaries/lucille-bridges-who-stood-by-daughter-ruby-through-school-desegregation-dies-at-86/2020/11/11/ab37a36e-241d-11eb-952e-0c475972cfc0_story.html?utm_medium=social&utm_campaign=wp_main&utm_source=twitter,Thu Nov 12 17:06:04 +0000 2020
0,washingtonpost,"Perspective: In a grim year, a November Masters is something to be thankful for https://t.co/DJhL63CTAd",1326941861701881856,https://www.washingtonpost.com/sports/2020/11/12/grim-year-november-masters-is-something-be-thankful/?utm_campaign=wp_main&utm_medium=social&utm_source=twitter,Thu Nov 12 17:36:07 +0000 2020
0,washingtonpost,"Analysis: It’s really hard to describe how bad the Jets are, but here’s our best effort https://t.co/K9xiqywo0d",1326946137476124673,https://www.washingtonpost.com/sports/2020/11/12/new-york-jets-draft-worst-team-ever/?utm_source=twitter&utm_medium=social&utm_campaign=wp_main,Thu Nov 12 17:53:07 +0000 2020
0,washingtonpost,Cheating-detection companies made millions during the pandemic. Now students are fighting back. https://t.co/nuOYGleiaL,1326948386713575435,https://www.washingtonpost.com/technology/2020/11/12/test-monitoring-student-revolt/?utm_medium=social&utm_campaign=wp_main&utm_source=twitter,Thu Nov 12 18:02:03 +0000 2020
0,washingtonpost,Analysis: Turns out that media coverage of the virus wasn’t just a ploy to hurt Trump https://t.co/7khkMsEafM,1326950894961876993,https://www.washingtonpost.com/politics/2020/11/12/turns-out-that-media-coverage-virus-wasnt-just-ploy-hurt-trump/?utm_source=twitter&utm_medium=social&utm_campaign=wp_main,Thu Nov 12 18:12:01 +0000 2020
0,washingtonpost,"Senior Justice Dept. official stalled probe against former interior secretary Ryan Zinke, sources say https://t.co/aOxvtgvEhf",1326951157642784771,https://www.washingtonpost.com/climate-environment/2020/11/12/justice-department-zinke/?utm_campaign=wp_main&utm_medium=social&utm_source=twitter,Thu Nov 12 18:13:04 +0000 2020
0,washingtonpost,Opinion: Republicans may never have the nerve to quit Trump https://t.co/oyiEl28Vah,1326957665948463112,https://www.washingtonpost.com/opinions/2020/11/12/republicans-may-never-have-nerve-quit-trump/?utm_source=twitter&utm_campaign=wp_main&utm_medium=social,Thu Nov 12 18:38:55 +0000 2020
0,washingtonpost,"Democrats allege GOP refusal to accept election results is imperiling U.S. coronavirus response as cases, deaths spike https://t.co/CxuGzkhC27",1326968260634566657,https://www.washingtonpost.com/us-policy/2020/11/12/democrats-stimulus-coronavirus-election/?utm_medium=social&utm_campaign=wp_main&utm_source=twitter,Thu Nov 12 19:21:01 +0000 2020
0,washingtonpost,"Justice Dept. faults former top prosecutor for poor judgment in 2008 deal with sex offender Jeffrey Epstein, but finds no misconduct https://t.co/NaBodWKK6l",1326970213842235392,https://www.washingtonpost.com/national-security/jeffrey-epstein-alex-acosta-florida-plea-deal/2020/11/12/c960d078-243a-11eb-8672-c281c7a2c96e_story.html,Thu Nov 12 19:28:47 +0000 2020
0,washingtonpost,Their coronavirus vaccine candidate has made them billionaires. This modest German-Turkish couple doesn’t own a car. https://t.co/HMZopOfHQR,1326981423992098818,https://www.washingtonpost.com/world/europe/coornavirus-vaccine-biontech-pfizer/2020/11/12/37acb78c-2467-11eb-9c4a-0dc6242c4814_story.html?utm_source=twitter&utm_campaign=wp_main&utm_medium=social,Thu Nov 12 20:13:20 +0000 2020
0,washingtonpost,Perspective: The economics of government debt at this unique moment https://t.co/HLtnrTo5yG,1326987655398252544,https://www.washingtonpost.com/outlook/2020/11/12/economics-government-debt-this-unique-moment/?utm_medium=social&utm_source=twitter&utm_campaign=wp_main,Thu Nov 12 20:38:05 +0000 2020
0,washingtonpost,"As European leaders focus on Biden, European media outlets remain unsettled by Trump’s refusal to concede https://t.co/w6oL4Dg8qJ",1326992170860023814,https://www.washingtonpost.com/world/2020/11/12/europe-leaders-biden-trump-media/?utm_medium=social&utm_campaign=wp_main&utm_source=twitter,Thu Nov 12 20:56:02 +0000 2020
0,washingtonpost,Biden forges ahead with transition; Trump aides say he has no endgame https://t.co/SBFTe9lj3L,1327002768339513346,https://www.washingtonpost.com/elections/2020/11/12/joe-biden-trump-election-live-updates/?utm_medium=social&utm_campaign=wp_main&utm_source=twitter,Thu Nov 12 21:38:09 +0000 2020
0,washingtonpost,Opinion: Trump is now sabotaging the transition. Democrats have a way to fight back. https://t.co/KAgyVuYn7z,1327007037532868619,https://www.washingtonpost.com/opinions/2020/11/12/trump-is-now-sabotaging-transition-democrats-have-way-fight-back/?utm_medium=social&utm_source=twitter&utm_campaign=wp_main,Thu Nov 12 21:55:07 +0000 2020
