,name,text,id,url,created_at
0,washingtonpost,A woman died of coronavirus on a plane. Her fellow passengers were never notified. https://t.co/k5V38iq1w7,1322692100228632576,https://www.washingtonpost.com/local/trafficandcommuting/woman-dies-coronavirus-plane/2020/10/31/2d8246dc-1878-11eb-82db-60b15c874105_story.html?utm_source=twitter&utm_medium=social&utm_campaign=wp_main,Sun Nov 01 00:09:05 +0000 2020
0,washingtonpost,"The map is wide, Democrats tense and Republicans hopeful in the last days of campaign 2020 https://t.co/xxfhKAPIFv",1322698009323491328,https://www.washingtonpost.com/politics/trump-biden-last-weekend/2020/10/31/124bf452-1b08-11eb-befb-8864259bd2d8_story.html?utm_medium=social&utm_campaign=wp_main&utm_source=twitter,Sun Nov 01 00:32:34 +0000 2020
0,washingtonpost,7 festive drink recipes — warm and chilled — to sip your way through fall https://t.co/tVCflMjsZI,1322702670046613505,https://www.washingtonpost.com/food/2020/10/31/fall-drink-recipes/?utm_campaign=wp_main&utm_source=twitter&utm_medium=social,Sun Nov 01 00:51:05 +0000 2020
0,washingtonpost,"N.C. police arrest 8, spray ‘pepper-based vapor’ to disperse voter turnout march that included children https://t.co/c5QNkKNNlg",1322707930932748289,https://www.washingtonpost.com/politics/2020/10/31/graham-nc-police-voter-march/?utm_source=twitter&utm_campaign=wp_main&utm_medium=social,Sun Nov 01 01:12:00 +0000 2020
0,washingtonpost,Unions say arts organizations are using the pandemic to cut pay. Companies facing losses say they have no choice. https://t.co/8EUy0ybbCY,1322708967039160320,https://www.washingtonpost.com/entertainment/covid-layoffs-arts-groups-union-contracts/2020/10/30/30b112c4-187e-11eb-aeec-b93bcc29a01b_story.html?utm_source=twitter&utm_campaign=wp_main&utm_medium=social,Sun Nov 01 01:16:07 +0000 2020
0,washingtonpost,"""Princess Bride,"" ""Seinfeld"" and more: How nostalgic cast reunions became a Democratic fundraising weapon https://t.co/vtxrvVXrCF",1322715983912542208,https://www.washingtonpost.com/arts-entertainment/2020/10/31/princess-bride-veep-fundraiser-wisconsin-democrats/?utm_medium=social&utm_source=twitter&utm_campaign=wp_main,Sun Nov 01 01:44:00 +0000 2020
0,washingtonpost,Campaigning as we knew it ended https://t.co/wAnhY9kEIr,1322722843717718019,https://www.washingtonpost.com/elections/2020/10/31/campaigning-we-knew-it-ended/?utm_source=twitter&utm_campaign=wp_main&utm_medium=social,Sun Nov 01 02:11:15 +0000 2020
0,washingtonpost,A man tied to white supremacists is running for office in a Black D.C. neighborhood https://t.co/D0tgwaEJvz,1322730097858748416,https://www.washingtonpost.com/local/dc-politics/isaac-smith-anc-anacostia-white-supremacist/2020/10/31/863b5b62-192f-11eb-82db-60b15c874105_story.html?utm_campaign=wp_main&utm_medium=social&utm_source=twitter,Sun Nov 01 02:40:05 +0000 2020
0,washingtonpost,Democrats grow more anxious about Pennsylvania https://t.co/K0XCevRmmB,1322732739049775104,https://www.washingtonpost.com/politics/democrats-anxiety-pennsylvania/2020/10/31/10536746-1b19-11eb-aeec-b93bcc29a01b_story.html?utm_campaign=wp_main&utm_medium=social&utm_source=twitter,Sun Nov 01 02:50:34 +0000 2020
0,washingtonpost,The Nationals are in the middle of organization-wide changes and free agency is next https://t.co/4bHqNjWUp6,1322737379078230017,https://www.washingtonpost.com/sports/2020/10/31/nationals-free-agency-offseason/?utm_campaign=wp_main&utm_medium=social&utm_source=twitter,Sun Nov 01 03:09:01 +0000 2020
0,washingtonpost,"Thanksgiving vs. ""pandemic fatigue"": Fauci, experts warn against letting your guard down against covid-19 during the holiday https://t.co/aLIsAvIQUe",1322744647295373312,https://www.washingtonpost.com/health/holiday-coronavirus-family-gatherings/2020/10/30/3b938d48-14aa-11eb-bc10-40b25382f1be_story.html?utm_source=twitter&utm_campaign=wp_main&utm_medium=social,Sun Nov 01 03:37:53 +0000 2020
0,washingtonpost,U.S. Special Operations forces rescue American kidnapped in Niger https://t.co/5MGJR5xBX7,1322757857289342976,https://www.washingtonpost.com/world/africa/niger-us-rescue-kidnapped-seals/2020/10/31/2834f684-1b7a-11eb-8bda-814ca56e138b_story.html?utm_campaign=wp_main&utm_source=twitter&utm_medium=social,Sun Nov 01 04:30:23 +0000 2020
0,washingtonpost,Post-ABC polls: Biden has slight lead in Pennsylvania; Florida a toss-up https://t.co/otK2V5irYI,1322759006528692224,https://www.washingtonpost.com/politics/2020/11/01/post-abc-polls-biden-has-slight-lead-pennsylvania-florida-toss-up/?arc404=true,Sun Nov 01 04:34:57 +0000 2020
0,washingtonpost,SNL tells Halloween horror story warning that Trump could win reelection https://t.co/FCOd8rc0HA,1322783680146874368,https://www.washingtonpost.com/arts-entertainment/2020/11/01/snl-cold-open-trump-jim-carrey-biden-kate-mckinnon-hillary/,Sun Nov 01 06:13:00 +0000 2020
0,washingtonpost,"With coronavirus exploding in Europe, hospitals calculate how long until they hit capacity https://t.co/RU1sPasL0q",1322788736921382912,https://www.washingtonpost.com/world/europe/covid-coronavirus-europe-hospitals-capacity/2020/10/31/fe074b56-188a-11eb-8bda-814ca56e138b_story.html?utm_source=twitter&utm_medium=social&utm_campaign=wp_main,Sun Nov 01 06:33:05 +0000 2020
0,washingtonpost,League of Legends Worlds 2020: Tales from the bubble https://t.co/r9MCs09w7z,1322792756037693440,https://www.washingtonpost.com/video-games/esports/2020/10/31/league-legends-worlds-2020-bubble/?utm_source=twitter&utm_medium=social&utm_campaign=wp_main,Sun Nov 01 06:49:03 +0000 2020
0,washingtonpost,Trump critics hail accords between Israel and Arab countries even as original goal of Palestinian peace remains unmet https://t.co/ehgo7qwRad,1322794768523546625,https://www.washingtonpost.com/national-security/trump-middle-east-accords/2020/10/31/f0585dec-19fc-11eb-aeec-b93bcc29a01b_story.html?utm_source=twitter&utm_campaign=wp_main&utm_medium=social,Sun Nov 01 06:57:03 +0000 2020
0,washingtonpost,"Biden has a slight lead in Pennsylvania, while Florida remains a toss-up, Post-ABC polls find https://t.co/8iI8bfrdzj",1322840822493155329,https://www.washingtonpost.com/politics/2020/11/01/post-abc-polls-biden-has-slight-lead-pennsylvania-florida-toss-up/?arc404=true,Sun Nov 01 10:00:03 +0000 2020
0,washingtonpost,"Yurts, meditation and medication: Getting through election night by tuning it out https://t.co/CNRvqPuVdT",1322841190748856322,https://www.washingtonpost.com/technology/2020/10/31/election-night-ignore/?utm_campaign=wp_main&utm_medium=social&utm_source=twitter,Sun Nov 01 10:01:31 +0000 2020
0,washingtonpost,NASA’s new rocket would be the most powerful ever. But it’s the software that has some officials worried. https://t.co/ljiXqN42oK,1322847700560318464,https://www.washingtonpost.com/technology/2020/10/31/nasa-sls-moon-rocket/?utm_source=twitter&utm_campaign=wp_main&utm_medium=social,Sun Nov 01 10:27:23 +0000 2020
0,washingtonpost,"Whether Trump or Biden wins, Europe doesn’t think it can depend on U.S. https://t.co/GfWY4cad3X",1322854724543139840,https://www.washingtonpost.com/world/europe/europe-trump-biden-election/2020/10/30/7f7e6a62-188a-11eb-8bda-814ca56e138b_story.html?utm_campaign=wp_main&utm_source=twitter&utm_medium=social,Sun Nov 01 10:55:18 +0000 2020
0,washingtonpost,"Haven't voted yet?

Here's everything you need to know about voting by mail, in person, early or absentee. https://t.co/Mlijb8Y4bZ",1322901258685001729,https://www.washingtonpost.com/elections/2020/how-to-vote/?utm_medium=social&utm_campaign=wp_main&utm_source=twitter,Sun Nov 01 14:00:13 +0000 2020
0,washingtonpost,Review: How to track your ballot like a UPS package https://t.co/FT6F7jQGpl,1322901259075133440,https://www.washingtonpost.com/technology/2020/09/18/online-ballot-tracking/?utm_source=twitter&utm_medium=social&utm_campaign=wp_main,Sun Nov 01 14:00:13 +0000 2020
0,washingtonpost,"Past U.S. presidents took steps to prevent a pandemic from debilitating the nation’s economy and health-care system.

Our new 3-part documentary examines how Trump politicized the pandemic and ignored decades of preparation. https://t.co/R1mUC8DiQi",1322908772910702592,https://www.washingtonpost.com/graphics/2020/national/administrations-pandemic-documentary/?utm_campaign=wp_main&utm_medium=social&utm_source=twitter,Sun Nov 01 14:30:04 +0000 2020
0,washingtonpost,Super Typhoon Goni smashes into a Philippines already suffering from pandemic and earlier storms https://t.co/yz7w9OIJ0y,1322916329322647564,https://www.washingtonpost.com/world/asia_pacific/super-typhoon-goni-philippines/2020/11/01/f222d5e8-1b92-11eb-8bda-814ca56e138b_story.html?utm_medium=social&utm_campaign=wp_main&utm_source=twitter,Sun Nov 01 15:00:06 +0000 2020
0,washingtonpost,"Trailing in the polls, Trump enlists his administration and co-opts the government to bolster his reelection https://t.co/FLn727JRzO",1322919345475997697,https://www.washingtonpost.com/politics/trump-election-ethics/2020/10/31/46fb0948-1b19-11eb-82db-60b15c874105_story.html?utm_medium=social&utm_campaign=wp_main&utm_source=twitter,Sun Nov 01 15:12:05 +0000 2020
0,washingtonpost,"N.C. police arrest at least 8, spray ""pepper-based vapor"" to disperse voter turnout march that included kids https://t.co/tyzGGRNayI",1322921102994268160,https://www.washingtonpost.com/politics/2020/10/31/graham-nc-police-voter-march/?utm_source=twitter&utm_medium=social&utm_campaign=wp_main,Sun Nov 01 15:19:04 +0000 2020
0,washingtonpost,A woman died of coronavirus on a plane. Her fellow passengers were never notified. https://t.co/SrHhyl3Zmf,1322928555093884929,https://www.washingtonpost.com/local/trafficandcommuting/woman-dies-coronavirus-plane/2020/10/31/2d8246dc-1878-11eb-82db-60b15c874105_story.html?utm_campaign=wp_main&utm_medium=social&utm_source=twitter,Sun Nov 01 15:48:41 +0000 2020
0,washingtonpost,"Trump allies, largely unconstrained by Facebook’s rules against repeated falsehoods, cement pre-election dominance https://t.co/KzxGZdmPtb",1322935866776522752,https://www.washingtonpost.com/technology/2020/11/01/facebook-election-misinformation/?utm_source=twitter&utm_campaign=wp_main&utm_medium=social,Sun Nov 01 16:17:44 +0000 2020
0,washingtonpost,NFL live updates: 100 percent of the games are on; 90 percent of players have registered to vote https://t.co/oBSUDU27KQ,1322940215330295808,https://www.washingtonpost.com/sports/2020/11/01/nfl-today-week-8/?utm_source=twitter&utm_campaign=wp_main&utm_medium=social,Sun Nov 01 16:35:01 +0000 2020
0,washingtonpost,Election 2020 live updates: Trump holds rallies in five states; Biden focuses on Pennsylvania https://t.co/8uQlBPIBkE,1322947604074909698,https://www.washingtonpost.com/elections/2020/11/01/trump-biden-live-updates/?utm_campaign=wp_main&utm_source=twitter&utm_medium=social,Sun Nov 01 17:04:22 +0000 2020
0,washingtonpost,Democrats grow more anxious about Pennsylvania https://t.co/xJQK99bvFR,1322950540469391365,https://www.washingtonpost.com/politics/democrats-anxiety-pennsylvania/2020/10/31/10536746-1b19-11eb-aeec-b93bcc29a01b_story.html?utm_medium=social&utm_campaign=wp_main&utm_source=twitter,Sun Nov 01 17:16:02 +0000 2020
0,washingtonpost,Politics pit neighbor against neighbor as Election Day looms https://t.co/EUsfYNc2E0,1322950798297489409,https://www.washingtonpost.com/national/people-are-scared-politics-pit-neighbor-against-neighbor-as-election-day-looms/2020/10/31/ae4bb794-1a67-11eb-82db-60b15c874105_story.html?utm_source=twitter&utm_campaign=wp_main&utm_medium=social,Sun Nov 01 17:17:04 +0000 2020
0,washingtonpost,Analysis: Here are the states which have been the most likely to deliver the presidency https://t.co/GuBGnky9PU,1322952312625729536,https://www.washingtonpost.com/politics/2020/11/01/here-are-states-which-have-been-most-likely-deliver-presidency/?utm_campaign=wp_main&utm_medium=social&utm_source=twitter,Sun Nov 01 17:23:05 +0000 2020
0,washingtonpost,Analysis: Sen. Schumer could be the second-biggest winner in the election — or relegated to perennial political bridesmaid https://t.co/X33hlMrGeW,1322961708625920006,https://www.washingtonpost.com/powerpost/senate-democrats-schumer-liberals/2020/10/31/c6661332-1b21-11eb-aeec-b93bcc29a01b_story.html?utm_campaign=wp_main&utm_medium=social&utm_source=twitter,Sun Nov 01 18:00:25 +0000 2020
0,washingtonpost,"In Philadelphia this past week, the protests after Walter Wallace's death converged with the pandemic and election mayhem https://t.co/1UQvRpYsXS",1322968161067716618,https://www.washingtonpost.com/lifestyle/style/philadelphia-walter-wallace-protest-election/2020/10/31/051cb9cc-1a01-11eb-82db-60b15c874105_story.html?utm_campaign=wp_main&utm_medium=social&utm_source=twitter,Sun Nov 01 18:26:03 +0000 2020
0,washingtonpost,Biden’s still locked in a bitter fight. But the jockeying is already underway for jobs in his would-be administration. https://t.co/VNKCbKsSuu,1322969921022812161,https://www.washingtonpost.com/politics/biden-transition-jobs-jockeying/2020/10/31/2746968e-18a4-11eb-aeec-b93bcc29a01b_story.html?utm_source=twitter&utm_medium=social&utm_campaign=wp_main,Sun Nov 01 18:33:03 +0000 2020
0,washingtonpost,"The map is wide, Democrats tense and Republicans hopeful in the last days of campaign 2020 https://t.co/mCraQdZvTr",1322976324009529350,https://www.washingtonpost.com/politics/trump-biden-last-weekend/2020/10/31/124bf452-1b08-11eb-befb-8864259bd2d8_story.html?utm_source=twitter&utm_campaign=wp_main&utm_medium=social,Sun Nov 01 18:58:30 +0000 2020
0,washingtonpost,"Another election night nears, with trepidation replacing hope https://t.co/k2sL80a8J6",1322982245142069252,https://www.washingtonpost.com/politics/election-ptsd-trump-clinton/2020/10/31/da48be28-1a08-11eb-82db-60b15c874105_story.html?utm_campaign=wp_main&utm_source=twitter&utm_medium=social,Sun Nov 01 19:22:01 +0000 2020
0,washingtonpost,"For Russia, Biden is the foe they know. The Kremlin is studying old playbooks. https://t.co/Z2to1npXb7",1323002850805501953,https://www.washingtonpost.com/world/europe/russia-biden-trump-election/2020/10/31/1186305c-184f-11eb-8bda-814ca56e138b_story.html?utm_medium=social&utm_campaign=wp_main&utm_source=twitter,Sun Nov 01 20:43:54 +0000 2020
0,washingtonpost,Opinion: Trump was way worse than I feared in 2016. Here’s how. https://t.co/o65B3oLbSB,1323009861785964544,https://www.washingtonpost.com/opinions/trump-was-way-worse-than-i-feared-in-2016-heres-how/2020/10/30/fce38dd2-1ad5-11eb-befb-8864259bd2d8_story.html?utm_source=twitter&utm_medium=social&utm_campaign=wp_main,Sun Nov 01 21:11:46 +0000 2020
0,washingtonpost,Opinion: Nancy Pelosi is fixated on her battle plan https://t.co/jXTp9LKcNk,1323018071972499458,https://www.washingtonpost.com/opinions/nancy-pelosi-is-fixated-on-her-battle-plan/2020/10/31/95f05c96-1b88-11eb-82db-60b15c874105_story.html?utm_campaign=wp_main&utm_source=twitter&utm_medium=social,Sun Nov 01 21:44:23 +0000 2020
