,name,text,id,url,created_at
0,nypost,Relive the beginning of Islanders' dynasty: 'Oh my God' https://t.co/2qlotBn0o3 https://t.co/ah4LgYNuyH,1264708174524944392,https://nypost.com/2020/05/24/relive-the-beginning-of-islanders-dynasty-oh-my-god/?utm_medium=SocialFlow&utm_campaign=SocialFlow&utm_source=NYPTwitter,Mon May 25 00:01:40 +0000 2020
0,nypost,Memorial Day even more heart-wrenching for veterans due to coronavirus https://t.co/AAY5tRLlT5 https://t.co/R5SWdyrUyS,1264713835568664576,https://nypost.com/2020/05/24/memorial-day-even-more-heart-wrenching-for-veterans-amid-coronavirus/?utm_source=NYPTwitter&utm_campaign=SocialFlow&utm_medium=SocialFlow,Mon May 25 00:24:10 +0000 2020
0,nypost,Washington man allegedly falsely sought $1.5M in coronavirus biz relief funds https://t.co/sqmYFrfmtQ https://t.co/ZDcer0seTw,1264718918125531149,https://nypost.com/2020/05/24/washington-man-allegedly-falsely-sought-1-5m-in-coronavirus-relief-funds/?utm_source=NYPTwitter&utm_campaign=SocialFlow&utm_medium=SocialFlow,Mon May 25 00:44:22 +0000 2020
0,nypost,"Tiger Woods, Peyton Manning beat Phil Mickelson, Tom Brady in The Match https://t.co/s9JWZ5B66m https://t.co/ChqeIPRJ8m",1264719482649444358,https://nypost.com/2020/05/24/the-match-woods-manning-hold-off-brady-and-mickelson/?utm_campaign=SocialFlow&utm_source=NYPTwitter&utm_medium=SocialFlow,Mon May 25 00:46:36 +0000 2020
0,nypost,Knicks' draft possibility Tyrese Haliburton 'will wow people' https://t.co/L9Mu3Yanir https://t.co/viHz8por2I,1264721772793995264,https://nypost.com/2020/05/24/knicks-nba-draft-possibility-tyrese-haliburton-will-wow-people/?utm_medium=SocialFlow&utm_source=NYPTwitter&utm_campaign=SocialFlow,Mon May 25 00:55:42 +0000 2020
