,text,notes,date
https://nypost.com/2020/07/25/disaster-declaration-issued-as-hurricane-hanna-hits-texas/,Disaster declaration issued as Hurricane Hanna touches down in Texas,,20200726-0630
https://nypost.com/2020/07/25/trump-fans-eager-for-rallies-i-would-sit-through-a-hurricane/,Trump fans eager for rallies: 'I would sit through a hurricane',,20200726-0630
https://nypost.com/2020/07/26/trump-golfs-with-packers-legend-brett-favre-at-bedminster-course/,Trump hits links with Packers legend Brett Favre at Bedminster course,,20200726-0630
https://nypost.com/2020/07/25/utah-virginia-residents-warned-of-invasive-seeds-from-china/,"Utah, Virginia residents warned to not plant mysterious seeds from China",,20200726-0630
https://nypost.com/2020/07/25/large-apex-predator-on-the-loose-turns-out-to-be-stuffed-toy/,'Large apex predator' on the loose turns out to be stuffed toy,,20200726-0630
https://nypost.com/2020/07/25/how-the-college-admissions-grifter-got-parents-to-risk-it-all/,How a grifter persuaded wealthy parents to risk it all — just to get their kids into college,,20200726-0630
https://nypost.com/2020/07/25/singaporean-man-pleads-guilty-to-acting-as-chinese-spy-in-us/,Singaporean man pleads guilty to acting as Chinese spy in the US,,20200726-0630
https://nypost.com/2020/07/25/man-stuns-londoners-by-wearing-a-face-mask-as-a-g-string/,Man stuns Londoners by wearing a face mask — as a G-string,,20200726-0630
https://nypost.com/covers/,Browse covers archive,,20200726-0630
https://nypost.com/2020/07/25/the-late-regis-philbin-was-a-one-of-a-kind-tv-talent/,The late Regis Philbin was a one-of-a-kind TV talent,,20200726-0630
https://nypost.com/horoscopes/,See all Horoscopes,,20200726-0630
https://nypost.com/2020/07/26/buffalo-getting-well-deserved-call-up-to-majors-this-year/,Buffalo getting well-deserved call up to majors this year,,20200726-0630
https://nypost.com/2020/07/26/nhl-passes-first-coronavirus-test-but-now-comes-the-hard-part/,NHL clears first coronavirus hurdle but now comes big test,,20200726-0630
https://nypost.com/2020/07/25/covid-19-is-at-the-core-of-donald-trumps-election-woes-goodwin/,COVID-19 is at the core of Donald Trump's election woes: Goodwin,,20200726-0630
https://nypost.com/2020/07/25/kelsey-grammers-daughter-spencer-among-victims-in-east-village-slashing/,Kelsey Grammer's daughter among victims in NYC restaurant slashing,,20200726-0630
https://nypost.com/2020/07/24/cheers-erupt-as-karen-kicked-off-plane-for-not-wearing-mask/,Passengers cheer as 'Karen' is kicked off flight for refusing to wear mask,,20200726-0630
https://nypost.com/2020/07/25/james-paxton-struggles-as-yankees-get-pounded-by-nationals/,James Paxton didn't give Yankees a chance in this one,,20200726-0630
https://nypost.com/2020/07/25/jamal-adams-aftermath-jets-joe-douglas-must-avoid-porzingis-2-0/,Jets aftermath of Jamal Adams trade will be hardest part,,20200726-0630
https://nypost.com/2020/07/25/edwin-diaz-blows-save-as-mets-lose-crusher-to-braves/,Edwin Diaz's closing issues aren't behind him,,20200726-0630
https://nypost.com/2020/07/25/knicks-hiring-tom-thibodeau-is-a-slam-dunk-in-every-way/,Knicks coaching decision is a slam dunk,,20200726-0630
https://nypost.com/2020/07/25/jets-trading-disgruntled-jamal-adams-to-seahawks/,Jets trading disgruntled superstar Jamal Adams,,20200726-0630
https://nypost.com/2020/07/25/video-shows-nyc-sanitation-department-clearing-homeless-encampment/,Video shows NYC Sanitation Department clearing out homeless encampment,,20200726-0630
https://nypost.com/2020/07/26/house-probing-dhs-over-nys-exclusion-from-trusted-travelers-programs/,House investigating DHS over New York's exclusion from Trusted Travelers programs,,20200726-0630
https://nypost.com/2020/07/25/de-blasio-rips-yankees-for-inviting-trump-to-throw-first-pitch/,De Blasio rips Yankees for allowing Trump to throw first pitch at Yankee Stadium,,20200726-0630
https://nypost.com/2020/07/25/fdny-rescues-4-from-brooklyn-blaze/,FDNY rescues 4 from Brooklyn blaze,,20200726-0630
https://nypost.com/2020/07/25/nyc-gets-wet-and-wild-as-pools-reopen-after-budget-crisis-delay/,NYC gets wet and wild as pools reopen following a budget crisis delay,,20200726-0630
https://nypost.com/2020/07/25/andrew-lloyd-webbers-trial-live-performance-was-inspiring-and-weird/,Andrew Lloyd Webber's trial live performance was inspiring and weird,,20200726-0630
https://nypost.com/2020/07/25/warner-bros-sets-tentative-restart-date-for-vancouver-based-shows/,"Warner Bros. sets tentative restart date for 'Riverdale', other Vancouver-based shows",,20200726-0630
https://nypost.com/2020/07/24/meet-marco-from-the-kissing-booth-2-taylor-zakhar-perez/,"Meet Taylor Zakhar Perez, Marco from 'The Kissing Booth 2'",,20200726-0630
https://nypost.com/2020/07/24/did-taylor-swift-reveal-blake-livelys-babys-name-in-betty/,Did Taylor Swift reveal Blake Lively's baby's name in new song 'Betty'?,,20200726-0630
https://nypost.com/2020/07/24/carlos-ghosns-son-spent-500k-in-bitcoin-to-aid-escape-feds/,Carlos Ghosn's son sent $500K in bitcoin to American in escape effort: feds,,20200726-0630
https://nypost.com/2020/07/24/mcdonalds-will-require-all-customers-to-wear-masks-starting-next-month/,McDonald's will require all customers to wear masks starting next month,,20200726-0630
https://nypost.com/2020/07/24/bankrupt-brooks-brothers-offered-deal-to-sell-for-305m/,Bankrupt Brooks Brothers offered deal to sell for $305M,,20200726-0630
https://nypost.com/2020/07/24/ray-dalio-promotes-his-book-amid-layoffs-at-bridgewater/,Ray Dalio promotes his book amid layoffs at Bridgewater,,20200726-0630
https://nypost.com/2020/07/24/amc-lenders-try-to-outdo-silver-lake-on-debt-restructuring-offer/,AMC lenders try to outdo Silver Lake on debt-restructuring offer,,20200726-0630
https://nypost.com/2020/07/25/america-really-needs-john-lewis-kind-of-leadership-right-now/,America really needs John Lewis’ kind of leadership right now,,20200726-0630
https://nypost.com/2020/07/25/nycs-elected-leaders-havent-begun-to-face-its-economic-and-fiscal-horrors/,NYC’s elected leaders haven’t begun to face its economic and fiscal horrors,,20200726-0630
https://nypost.com/2020/07/25/nike-should-quit-lecturing-on-social-justice-and-atone-for-using-slave-labor-in-china/,Nike should quit lecturing on social justice — and atone for using slave labor,,20200726-0630
https://nypost.com/2020/07/25/these-are-the-innocuous-words-progressives-want-to-ban/,These are the innocuous words progressives want to ban you from using,,20200726-0630
https://nypost.com/2020/07/24/celebrities-show-off-the-latest-in-covid-fashion-sloppy-clothes/,"ScarJo, is that you? Sloppy 'COVIDcore' fashion has replaced celeb couture",,20200726-0630
https://nypost.com/2020/07/24/zappos-sale-sandals/,Zappos takes up to 45 percent off sandals for summer sale,,20200726-0630
https://nypost.com/2020/07/24/reebok-clearance-sale/,Reebok offers an extra 50 percent off clearance for flash sale,,20200726-0630
https://nypost.com/article/best-camping-tents-backpackers-families-solo/,"10 best camping tents for backpackers, families and solo trekkers",,20200726-0630
https://nypost.com/list/cute-face-masks/,The 31 cutest face masks available online for covering up in style,,20200726-0630
https://nypost.com/article/lululemon-sale/,"Lululemon offers up to 75 percent off apparel, accessories and more",,20200726-0630
https://nypost.com/2020/07/25/carrie-fishers-assistant-dishes-on-time-with-leia-in-new-book/,Carrie Fisher's ex-assistant dishes on four years with Leia in new book,,20200726-0630
https://nypost.com/2020/07/25/christian-group-mad-at-cascade-for-do-it-every-night-ad/,Conservative Christian group angry at Cascade's 'Do It Every Night' ad,,20200726-0630
https://nypost.com/2020/07/25/ex-hollywood-madam-heidi-fleiss-on-celibacy-meth-and-steve-bing/,"Former Hollywood madam Heidi Fleiss on celibacy, meth and Steve Bing",,20200726-0630
https://nypost.com/2020/07/24/the-most-over-the-top-outdoor-dining-options-in-nyc/,These are the most over-the-top outdoor dining options in NYC,,20200726-0630
https://nypost.com/2020/07/24/doctors-share-bikini-selfies-to-protest-controversial-study/,Doctors are sharing bikini selfies after study criticizes 'inappropriate' attire,,20200726-0630
https://nypost.com/2020/07/23/stooping-free-furniture-off-nyc-streets-better-than-ever-thanks-to-virus/,New Yorkers revel in virus-fueled gold mine of free street furniture,,20200726-0630
https://nypost.com/2020/07/25/6-gorgeous-affordable-spots-around-the-globe-to-work-from-home/,"6 gorgeous, affordable spots around the globe to work from home",,20200726-0630
https://nypost.com/article/most-expensive-apartments-townhouses-nyc/,"Inside NYC's most expensive homes, topped by Epstein's $88M mansion",,20200726-0630
https://nypost.com/2020/07/23/hamptons-home-prices-skyrocket-due-to-demand-from-coronavirus-fleers/,Coronavirus fleers send Hamptons home prices through the roof,,20200726-0630
https://nypost.com/2020/07/22/swedish-journalist-catarina-lundgren-astrom-selling-ny-farmhouse/,Swedish journalist lists upstate New York farmhouse built in 1830,,20200726-0630
https://nypost.com/2020/07/25/amazon-google-and-wish-remove-neo-nazi-products-from-sites/,"Amazon, Google and Wish finally remove Neo-Nazi products from sites",,20200726-0630
https://nypost.com/2020/07/23/most-americans-accept-they-may-only-be-able-to-attend-virtual-parties-for-the-rest-of-2020/,Most Americans accept they'll probably only attend virtual parties for the rest of 2020,,20200726-0630
https://nypost.com/2020/07/25/how-mars-and-the-moon-could-become-your-next-neighborhood/,How Mars and the moon could become your next neighborhood,,20200726-0630
https://nypost.com/2020/07/24/over-1000-twitter-employees-had-access-to-hacked-accounts/,"Over 1,000 Twitter employees had access to hacked accounts",,20200726-0630
https://nypost.com/2020/07/23/instacart-user-data-for-sale-on-dark-web-at-2-per-account/,Instacart user data for sale on dark web at $2 per account,,20200726-0630
https://nypost.com/2020/07/24/washington-post-settles-250m-suit-with-covington-teen-nick-sandmann/,WaPo settles $250M suit with Covington teen over botched reporting,,20200726-0630
https://nypost.com/2020/07/24/espns-adrian-wojnarowski-opens-up-about-email-suspension/,Woj opens up about 'F--k you' email that led to ESPN suspension,,20200726-0630
https://nypost.com/2020/07/24/sean-hannity-tucker-carlson-accuser-sent-gushing-emails-after-show-report/,"Sean Hannity, Tucker Carlson accuser sent gushing emails after show appearance: report",,20200726-0630
https://nypost.com/2020/07/24/mets-honor-late-post-photographer-anthony-causi-on-opening-day/,Mets honor late Post photographer Anthony Causi on Opening Day,,20200726-0630
https://nypost.com/2020/07/24/eagle-eyed-viewer-spots-local-reporters-thyroid-cancer/,Eagle-eyed viewer spots local news reporter's cancer on air,,20200726-0630
https://nypost.com/2020/07/26/utah-plane-crash-kills-at-least-three-including-baby-girl/,9-month-old girl among those killed in Utah plane crash,,20200726-0700
https://nypost.com/2020/07/25/nypd-looks-for-man-connected-to-spencer-grammer-slash-attack/,NYPD releases footage of man connected to slash attack on Kelsey Grammer’s daughter,,20200726-0700
https://nypost.com/2020/07/26/police-declare-riot-at-seattle-protests-more-than-two-dozen-arrested/,Police declare riot at Seattle protests; more than two dozen arrested,,20200726-0700
https://nypost.com/2020/07/25/yankees-giancarlo-stanton-aaron-hicks-kneel-during-national-anthem/,Two Yankees kneel during national anthem,,20200726-0700
https://nypost.com/2020/07/25/dr-birx-covid-19-may-be-starting-to-slow-down-in-certain-states/,Dr. Birx: COVID-19 may be starting to slow down in certain states,,20200726-0700
https://nypost.com/list/worst-first-pitches-ever/,"From Dr. Fauci to 50 Cent, these are the 10 worst first pitches ever",,20200726-0700
https://nypost.com/2020/07/23/florida-man-tries-to-evade-arrest-by-cartwheeling-away-from-cops/,Only in Florida: Man tries to evade arrest via cartwheel,,20200726-0700
https://nypost.com/2020/07/24/the-city-heats-up-and-reopens-more-in-phase-4-the-posts-week-in-photos/,The city heats up and reopens more in Phase 4: The Post's week in photos,,20200726-0700
https://nypost.com/2020/07/26/north-korea-declares-emergency-as-first-covid-19-case-reported/,North Korea declares emergency as first suspected COVID-19 case reported,,20200726-0700
https://nypost.com/2020/07/25/disaster-declaration-issued-as-hurricane-hanna-hits-texas/,Disaster declaration issued as Hurricane Hanna touches down in Texas,,20200726-0700
https://nypost.com/2020/07/25/trump-fans-eager-for-rallies-i-would-sit-through-a-hurricane/,Trump fans eager for rallies: 'I would sit through a hurricane',,20200726-0700
https://nypost.com/2020/07/26/trump-golfs-with-packers-legend-brett-favre-at-bedminster-course/,Trump hits links with Packers legend Brett Favre at Bedminster course,,20200726-0700
https://nypost.com/2020/07/25/utah-virginia-residents-warned-of-invasive-seeds-from-china/,"Utah, Virginia residents warned to not plant mysterious seeds from China",,20200726-0700
https://nypost.com/2020/07/25/large-apex-predator-on-the-loose-turns-out-to-be-stuffed-toy/,'Large apex predator' on the loose turns out to be stuffed toy,,20200726-0700
https://nypost.com/2020/07/25/how-the-college-admissions-grifter-got-parents-to-risk-it-all/,How a grifter persuaded wealthy parents to risk it all — just to get their kids into college,,20200726-0700
https://nypost.com/2020/07/25/singaporean-man-pleads-guilty-to-acting-as-chinese-spy-in-us/,Singaporean man pleads guilty to acting as Chinese spy in the US,,20200726-0700
https://nypost.com/2020/07/25/man-stuns-londoners-by-wearing-a-face-mask-as-a-g-string/,Man stuns Londoners by wearing a face mask — as a G-string,,20200726-0700
https://nypost.com/covers/,Browse covers archive,,20200726-0700
https://nypost.com/2020/07/25/the-late-regis-philbin-was-a-one-of-a-kind-tv-talent/,The late Regis Philbin was a one-of-a-kind TV talent,,20200726-0700
https://nypost.com/horoscopes/,See all Horoscopes,,20200726-0700
https://nypost.com/2020/07/26/buffalo-getting-well-deserved-call-up-to-majors-this-year/,Buffalo getting well-deserved call up to majors this year,,20200726-0700
https://nypost.com/2020/07/26/nhl-passes-first-coronavirus-test-but-now-comes-the-hard-part/,NHL clears first coronavirus hurdle but now comes big test,,20200726-0700
https://nypost.com/2020/07/25/covid-19-is-at-the-core-of-donald-trumps-election-woes-goodwin/,COVID-19 is at the core of Donald Trump's election woes: Goodwin,,20200726-0700
https://nypost.com/2020/07/25/kelsey-grammers-daughter-spencer-among-victims-in-east-village-slashing/,Kelsey Grammer's daughter among victims in NYC restaurant slashing,,20200726-0700
https://nypost.com/2020/07/24/cheers-erupt-as-karen-kicked-off-plane-for-not-wearing-mask/,Passengers cheer as 'Karen' is kicked off flight for refusing to wear mask,,20200726-0700
https://nypost.com/2020/07/25/james-paxton-struggles-as-yankees-get-pounded-by-nationals/,James Paxton didn't give Yankees a chance in this one,,20200726-0700
https://nypost.com/2020/07/25/jamal-adams-aftermath-jets-joe-douglas-must-avoid-porzingis-2-0/,Jets aftermath of Jamal Adams trade will be hardest part,,20200726-0700
https://nypost.com/2020/07/25/edwin-diaz-blows-save-as-mets-lose-crusher-to-braves/,Edwin Diaz's closing issues aren't behind him,,20200726-0700
https://nypost.com/2020/07/25/knicks-hiring-tom-thibodeau-is-a-slam-dunk-in-every-way/,Knicks coaching decision is a slam dunk,,20200726-0700
https://nypost.com/2020/07/25/jets-trading-disgruntled-jamal-adams-to-seahawks/,Jets trading disgruntled superstar Jamal Adams,,20200726-0700
https://nypost.com/2020/07/25/video-shows-nyc-sanitation-department-clearing-homeless-encampment/,Video shows NYC Sanitation Department clearing out homeless encampment,,20200726-0700
https://nypost.com/2020/07/26/house-probing-dhs-over-nys-exclusion-from-trusted-travelers-programs/,House investigating DHS over New York's exclusion from Trusted Travelers programs,,20200726-0700
https://nypost.com/2020/07/25/de-blasio-rips-yankees-for-inviting-trump-to-throw-first-pitch/,De Blasio rips Yankees for allowing Trump to throw first pitch at Yankee Stadium,,20200726-0700
https://nypost.com/2020/07/25/fdny-rescues-4-from-brooklyn-blaze/,FDNY rescues 4 from Brooklyn blaze,,20200726-0700
https://nypost.com/2020/07/25/nyc-gets-wet-and-wild-as-pools-reopen-after-budget-crisis-delay/,NYC gets wet and wild as pools reopen following a budget crisis delay,,20200726-0700
https://nypost.com/2020/07/25/andrew-lloyd-webbers-trial-live-performance-was-inspiring-and-weird/,Andrew Lloyd Webber's trial live performance was inspiring and weird,,20200726-0700
https://nypost.com/2020/07/25/warner-bros-sets-tentative-restart-date-for-vancouver-based-shows/,"Warner Bros. sets tentative restart date for 'Riverdale', other Vancouver-based shows",,20200726-0700
https://nypost.com/2020/07/24/meet-marco-from-the-kissing-booth-2-taylor-zakhar-perez/,"Meet Taylor Zakhar Perez, Marco from 'The Kissing Booth 2'",,20200726-0700
https://nypost.com/2020/07/24/did-taylor-swift-reveal-blake-livelys-babys-name-in-betty/,Did Taylor Swift reveal Blake Lively's baby's name in new song 'Betty'?,,20200726-0700
https://nypost.com/2020/07/24/carlos-ghosns-son-spent-500k-in-bitcoin-to-aid-escape-feds/,Carlos Ghosn's son sent $500K in bitcoin to American in escape effort: feds,,20200726-0700
https://nypost.com/2020/07/24/mcdonalds-will-require-all-customers-to-wear-masks-starting-next-month/,McDonald's will require all customers to wear masks starting next month,,20200726-0700
https://nypost.com/2020/07/24/bankrupt-brooks-brothers-offered-deal-to-sell-for-305m/,Bankrupt Brooks Brothers offered deal to sell for $305M,,20200726-0700
https://nypost.com/2020/07/24/ray-dalio-promotes-his-book-amid-layoffs-at-bridgewater/,Ray Dalio promotes his book amid layoffs at Bridgewater,,20200726-0700
https://nypost.com/2020/07/24/amc-lenders-try-to-outdo-silver-lake-on-debt-restructuring-offer/,AMC lenders try to outdo Silver Lake on debt-restructuring offer,,20200726-0700
https://nypost.com/2020/07/25/america-really-needs-john-lewis-kind-of-leadership-right-now/,America really needs John Lewis’ kind of leadership right now,,20200726-0700
https://nypost.com/2020/07/25/nycs-elected-leaders-havent-begun-to-face-its-economic-and-fiscal-horrors/,NYC’s elected leaders haven’t begun to face its economic and fiscal horrors,,20200726-0700
https://nypost.com/2020/07/25/nike-should-quit-lecturing-on-social-justice-and-atone-for-using-slave-labor-in-china/,Nike should quit lecturing on social justice — and atone for using slave labor,,20200726-0700
https://nypost.com/2020/07/25/these-are-the-innocuous-words-progressives-want-to-ban/,These are the innocuous words progressives want to ban you from using,,20200726-0700
https://nypost.com/2020/07/24/celebrities-show-off-the-latest-in-covid-fashion-sloppy-clothes/,"ScarJo, is that you? Sloppy 'COVIDcore' fashion has replaced celeb couture",,20200726-0700
https://nypost.com/2020/07/24/zappos-sale-sandals/,Zappos takes up to 45 percent off sandals for summer sale,,20200726-0700
https://nypost.com/2020/07/24/reebok-clearance-sale/,Reebok offers an extra 50 percent off clearance for flash sale,,20200726-0700
https://nypost.com/article/best-camping-tents-backpackers-families-solo/,"10 best camping tents for backpackers, families and solo trekkers",,20200726-0700
https://nypost.com/list/cute-face-masks/,The 31 cutest face masks available online for covering up in style,,20200726-0700
https://nypost.com/article/lululemon-sale/,"Lululemon offers up to 75 percent off apparel, accessories and more",,20200726-0700
https://nypost.com/2020/07/25/carrie-fishers-assistant-dishes-on-time-with-leia-in-new-book/,Carrie Fisher's ex-assistant dishes on four years with Leia in new book,,20200726-0700
https://nypost.com/2020/07/25/christian-group-mad-at-cascade-for-do-it-every-night-ad/,Conservative Christian group angry at Cascade's 'Do It Every Night' ad,,20200726-0700
https://nypost.com/2020/07/25/ex-hollywood-madam-heidi-fleiss-on-celibacy-meth-and-steve-bing/,"Former Hollywood madam Heidi Fleiss on celibacy, meth and Steve Bing",,20200726-0700
https://nypost.com/2020/07/24/the-most-over-the-top-outdoor-dining-options-in-nyc/,These are the most over-the-top outdoor dining options in NYC,,20200726-0700
https://nypost.com/2020/07/24/doctors-share-bikini-selfies-to-protest-controversial-study/,Doctors are sharing bikini selfies after study criticizes 'inappropriate' attire,,20200726-0700
https://nypost.com/2020/07/23/stooping-free-furniture-off-nyc-streets-better-than-ever-thanks-to-virus/,New Yorkers revel in virus-fueled gold mine of free street furniture,,20200726-0700
https://nypost.com/2020/07/25/6-gorgeous-affordable-spots-around-the-globe-to-work-from-home/,"6 gorgeous, affordable spots around the globe to work from home",,20200726-0700
https://nypost.com/article/most-expensive-apartments-townhouses-nyc/,"Inside NYC's most expensive homes, topped by Epstein's $88M mansion",,20200726-0700
https://nypost.com/2020/07/23/hamptons-home-prices-skyrocket-due-to-demand-from-coronavirus-fleers/,Coronavirus fleers send Hamptons home prices through the roof,,20200726-0700
https://nypost.com/2020/07/22/swedish-journalist-catarina-lundgren-astrom-selling-ny-farmhouse/,Swedish journalist lists upstate New York farmhouse built in 1830,,20200726-0700
https://nypost.com/2020/07/25/amazon-google-and-wish-remove-neo-nazi-products-from-sites/,"Amazon, Google and Wish finally remove Neo-Nazi products from sites",,20200726-0700
https://nypost.com/2020/07/23/most-americans-accept-they-may-only-be-able-to-attend-virtual-parties-for-the-rest-of-2020/,Most Americans accept they'll probably only attend virtual parties for the rest of 2020,,20200726-0700
https://nypost.com/2020/07/25/how-mars-and-the-moon-could-become-your-next-neighborhood/,How Mars and the moon could become your next neighborhood,,20200726-0700
https://nypost.com/2020/07/24/over-1000-twitter-employees-had-access-to-hacked-accounts/,"Over 1,000 Twitter employees had access to hacked accounts",,20200726-0700
https://nypost.com/2020/07/23/instacart-user-data-for-sale-on-dark-web-at-2-per-account/,Instacart user data for sale on dark web at $2 per account,,20200726-0700
https://nypost.com/2020/07/24/washington-post-settles-250m-suit-with-covington-teen-nick-sandmann/,WaPo settles $250M suit with Covington teen over botched reporting,,20200726-0700
https://nypost.com/2020/07/24/espns-adrian-wojnarowski-opens-up-about-email-suspension/,Woj opens up about 'F--k you' email that led to ESPN suspension,,20200726-0700
https://nypost.com/2020/07/24/sean-hannity-tucker-carlson-accuser-sent-gushing-emails-after-show-report/,"Sean Hannity, Tucker Carlson accuser sent gushing emails after show appearance: report",,20200726-0700
https://nypost.com/2020/07/24/mets-honor-late-post-photographer-anthony-causi-on-opening-day/,Mets honor late Post photographer Anthony Causi on Opening Day,,20200726-0700
https://nypost.com/2020/07/24/eagle-eyed-viewer-spots-local-reporters-thyroid-cancer/,Eagle-eyed viewer spots local news reporter's cancer on air,,20200726-0700
https://nypost.com/2020/07/26/utah-plane-crash-kills-at-least-three-including-baby-girl/,9-month-old girl among those killed in Utah plane crash,,20200726-0730
https://nypost.com/2020/07/25/nypd-looks-for-man-connected-to-spencer-grammer-slash-attack/,NYPD releases footage of man connected to slash attack on Kelsey Grammer’s daughter,,20200726-0730
https://nypost.com/2020/07/26/police-declare-riot-at-seattle-protests-more-than-two-dozen-arrested/,Police declare riot at Seattle protests; more than two dozen arrested,,20200726-0730
https://nypost.com/2020/07/25/yankees-giancarlo-stanton-aaron-hicks-kneel-during-national-anthem/,Two Yankees kneel during national anthem,,20200726-0730
https://nypost.com/2020/07/25/dr-birx-covid-19-may-be-starting-to-slow-down-in-certain-states/,Dr. Birx: COVID-19 may be starting to slow down in certain states,,20200726-0730
https://nypost.com/list/worst-first-pitches-ever/,"From Dr. Fauci to 50 Cent, these are the 10 worst first pitches ever",,20200726-0730
https://nypost.com/2020/07/23/florida-man-tries-to-evade-arrest-by-cartwheeling-away-from-cops/,Only in Florida: Man tries to evade arrest via cartwheel,,20200726-0730
https://nypost.com/2020/07/24/the-city-heats-up-and-reopens-more-in-phase-4-the-posts-week-in-photos/,The city heats up and reopens more in Phase 4: The Post's week in photos,,20200726-0730
https://nypost.com/2020/07/26/north-korea-declares-emergency-as-first-covid-19-case-reported/,North Korea declares emergency as first suspected COVID-19 case reported,,20200726-0730
https://nypost.com/2020/07/25/disaster-declaration-issued-as-hurricane-hanna-hits-texas/,Disaster declaration issued as Hurricane Hanna touches down in Texas,,20200726-0730
https://nypost.com/2020/07/25/trump-fans-eager-for-rallies-i-would-sit-through-a-hurricane/,Trump fans eager for rallies: 'I would sit through a hurricane',,20200726-0730
https://nypost.com/2020/07/26/trump-golfs-with-packers-legend-brett-favre-at-bedminster-course/,Trump hits links with Packers legend Brett Favre at Bedminster course,,20200726-0730
https://nypost.com/2020/07/25/utah-virginia-residents-warned-of-invasive-seeds-from-china/,"Utah, Virginia residents warned to not plant mysterious seeds from China",,20200726-0730
https://nypost.com/2020/07/25/large-apex-predator-on-the-loose-turns-out-to-be-stuffed-toy/,'Large apex predator' on the loose turns out to be stuffed toy,,20200726-0730
https://nypost.com/2020/07/25/how-the-college-admissions-grifter-got-parents-to-risk-it-all/,How a grifter persuaded wealthy parents to risk it all — just to get their kids into college,,20200726-0730
