,text,notes,date
/bayarea/article/Child-care-is-on-the-verge-of-collapse-in-the-Bay-15424605.php,Child care on verge of collapse in Bay Area. Can parents go back to work?,,20200725-0030
/bayarea/article/Presidio-on-course-to-lose-up-to-30-million-this-15430798.php,Presidio on course to lose up to $30 million this year,,20200725-0030
/living/article/Anti-Asian-and-anti-Black-racial-housing-15426732.php,"Anti-Asian, anti-Black racial housing covenants still in Bay Area. Why?",,20200725-0030
/bayarea/article/Should-I-get-a-coronavirus-test-before-seeing-15322424.php,Should I get a coronavirus test before seeing friends and family?,,20200725-0030
/food/article/I-m-breaking-up-with-sourdough-bread-baking-15426080.php,I’m breaking up with sourdough bread baking,,20200725-0030
/bayarea/otisrtaylorjr/article/Old-new-Martinez-clash-amid-debate-over-defacing-15411610.php,"Old, new Martinez clash amid debate over defacing of BLM mural",,20200725-0030
/bayarea/philmatier/article/SF-Chief-Bill-Scott-defends-Black-Lives-Matter-15424671.php,SF Chief Bill Scott defends Black Lives Matter posters hung in...,,20200725-0030
/bayarea/heatherknight/article/I-feel-desperate-Some-workers-with-COVID-15414563.php,‘I feel desperate’: Some workers with COVID-19 couldn’t...,,20200725-0030
/politics/article/Longtime-activists-defend-Pelosi-foe-Shahid-15432809.php,Longtime activists defend Pelosi foe Buttar against sex harassment...,,20200725-0030
/politics/article/Sierra-Club-distances-itself-from-John-Muir-15426324.php,Sierra Club distances itself from John Muir,,20200725-0030
/politics/article/California-Assembly-will-allow-proxy-voting-for-15430481.php,Assembly will allow proxy voting for legislators,,20200725-0030
/bayarea/article/List-of-over-50-John-Muir-namesakes-shows-how-15427102.php,Here’s a list of over 50 places in California named after John Muir,,20200725-0030
/environment/article/Sweeping-federal-conservation-bill-offers-15424575.php,Sweeping federal conservation bill offers billions for parks across West,,20200725-0030
/politics/article/Shahid-Buttar-Nancy-Pelosi-s-election-15424675.php,"Shahid Buttar, Nancy Pelosi’s election opponent, accused of...",,20200725-0030
/business/article/Businesses-in-Bay-Area-s-watch-list-counties-15430252.php,Businesses in Bay Area’s watch list counties confront abrupt changes,,20200725-0030
/business/article/U-S-California-job-losses-grow-as-unemployed-15428366.php,"US, California job losses grow as unemployed face benefit cuts",,20200725-0030
/business/networth/article/Unemployment-will-drop-by-600-next-week-unless-15427260.php,Unemployment payments will drop by $600 next week unless Congress acts soon,,20200725-0030
/business/article/Silicon-Valley-Leadership-Group-names-former-15429868.php,Silicon Valley Leadership Group names former Feinstein aide as CEO,,20200725-0030
/business/article/Google-commits-over-100-million-of-1-billion-15428754.php,Google commits over $100 million of $1 billion affordable housing pledge,,20200725-0030
/business/article/Coronavirus-eviction-ban-What-Bay-Area-renters-15188641.php,Eviction ban: What renters and landlords need to know,,20200725-0030
/bayarea/article/Bay-Area-coronavirus-How-do-I-renew-my-drivers-15169362.php,"How do I renew my driver’s license, vehicle registration?",,20200725-0030
/business/article/California-homeowners-Can-t-pay-your-mortgage-15188637.php,Can’t pay your mortgage because of the coronavirus? Here’s what to do,,20200725-0030
/bayarea/article/Coronavirus-Bay-Area-help-to-get-your-will-and-15177648.php,Bay Area help to get your will and other affairs in order,,20200725-0030
/business/networth/article/Healdsburg-garden-spread-once-called-Noci-Sonoma-15417021.php,Healdsburg garden spread once called Noci Sonoma goes on the...,,20200725-0030
/business/article/There-s-a-name-for-tech-s-attitude-problem-15424561.php,There’s a name for tech’s attitude problem: toxic positivity,,20200725-0030
/news/article/It-s-almost-like-there-s-this-monster-15347676.php,Survivors share battles with COVID-19,,20200725-0030
/bayarea/article/One-bright-moment-brings-people-together-briefly-15429348.php,One bright moment brings people together briefly,,20200725-0030
/culture/article/Essential-and-ignored-How-should-we-honor-our-15413437.php,Essential workers are asked to risk the most. How do we honor them?,,20200725-0030
/culture/article/Poet-Tongo-Eisen-Martin-s-view-of-San-Francisco-15413557.php,Video: Poet Tongo Eisen-Martin’s view of San Francisco,,20200725-0030
/culture/article/1-000-per-month-How-would-a-universal-income-15415898.php,"$1,000 per month: How would a universal income boost Marin City?",,20200725-0030
/culture/article/UCSF-targets-health-inequity-by-leveraging-its-15415728.php,"UCSF targets health inequity by leveraging its power to hire, train locals",,20200725-0030
https://www.sfchronicle.com/culture/article/Welcome-to-the-Throughline-Your-portal-to-the-15398468.php,The Throughline,,20200725-0030
/culture/article/One-vision-of-the-Tenderloin-s-future-Gardens-15398295.php,What the Tenderloin needs now to reverse decades of neglect,,20200725-0030
/culture/article/Welcome-to-the-Throughline-Your-portal-to-the-15398468.php,The Throughline: New series about the Bay Area of tomorrow,,20200725-0030
/oursf/article/Mitt-Romney-marched-for-Black-Lives-Matter-He-15414175.php,"Mitt Romney, in marching for BLM, inspired by father’s 1964 SF battle",,20200725-0030
/bayarea/article/San-Francisco-s-1918-Spanish-flu-debacle-A-15191518.php,SF’s 1918 Spanish flu debacle: Crucial lesson for the coronavirus era,,20200725-0030
/chronicle_vault/article/SF-murderer-escaped-lynching-only-to-be-executed-15431809.php,"SF murderer escaped lynching, only to be executed and have testicles...",,20200725-0030
/chronicle_vault/article/When-California-declared-war-on-cannabis-growers-15420394.php,When California declared war on cannabis growers and called in the Army,,20200725-0030
/chronicle_vault/article/Total-war-on-polio-in-the-Bay-Area-Archive-15408201.php,‘Total war’ on polio in the Bay Area: Archive finds on the ‘K.O....,,20200725-0030
/bayarea/article/How-to-get-the-most-out-of-your-San-Francisco-13902111.php,How to get the most out of your Chronicle subscription,,20200725-0030
/entertainment/article/I-m-glad-I-didn-t-write-those-kinds-of-columns-15414454.php,Caille Millner: I’m glad I didn’t write those kinds of columns,,20200725-0030
/opinion/lastword/article/Last-Word-Time-to-reject-facial-recognition-15432791.php,Last Word: Time to reject facial recognition,,20200725-0030
/opinion/lastword/article/A-daughter-and-a-warrior-A-O-C-gets-the-last-15432833.php,A daughter and a warrior: A.O.C. gets the last word,,20200725-0030
/opinion/openforum/article/Legislation-unfairly-burdens-insurance-companies-15430578.php,Legislation unfairly burdens insurance companies with COVID-19 losses,,20200725-0030
/opinion/editorials/article/Editorial-Four-tech-moguls-are-due-to-testify-in-15430291.php,Editorial: Four tech moguls are due to testify in Congress. It won’t...,,20200725-0030
/opinion/diaz/article/Former-Newsom-official-bravely-discloses-struggle-15401690.php,Former Newsom official bravely discloses struggle with mental...,,20200725-0030
/bayarea/williesworld/article/Willie-Brown-It-s-not-in-the-bag-for-Joe-15416772.php,Willie Brown: It’s not in the bag for Joe Biden. Far from it,,20200725-0030
https://www.sfchronicle.com/customer_service/article/How-Hearst-Newspapers-is-delivering-information-15151951.php,Newspaper Delivery Safety Procedures,,20200725-0030
https://www.sfchronicle.com/opinion/article/How-The-Chronicle-s-endorsement-process-works-14499467.php,Endorsement Process,,20200725-0030
