,name,text,id,url,created_at
0,thedailybeast,"In her first segment of #TheReidOut, Joy Reid welcomed Joe Biden for an interview that touched on everything from President Trump’s response to the coronavirus pandemic to his own complicated history on criminal justice reform https://t.co/i0G88UcgjK",1285371677971488770,https://www.thedailybeast.com/joy-reid-pushes-joe-biden-to-pick-black-woman-vp-in-msnbc-primetime-debut?via=twitter_page,Tue Jul 21 00:31:03 +0000 2020
0,thedailybeast,"Matt Schlapp went after Joe Biden on Fox News, saying “he did an interview with a rap star and he couldn’t even get through that without a big foible on the ‘You ain’t black.'” 

Only thing is, Charlamagne Tha God isn't a “rap star.”  https://t.co/Zau6Ta7Bon",1285379029961445381,https://www.thedailybeast.com/matt-schlapp-busted-for-calling-charlamagne-tha-god-a-rap-star-on-fox-news?via=twitter_page,Tue Jul 21 01:00:16 +0000 2020
0,thedailybeast,"When Customs and Border Protection joined the protest crackdown in D.C., they were made into U.S. Marshals. In Portland, they’re using new powers provided by Trump.
https://t.co/ZCwP2RLh1X",1285394118747852801,https://www.thedailybeast.com/its-spooky-right-now-inside-the-creepy-federal-crackdown-on-portland-protesters?source=articles&via=twitter_page,Tue Jul 21 02:00:14 +0000 2020
0,thedailybeast,"RT @NoahShachtman: On tomorrow's edition of THE NEW ABNORMAL with @MollyJongFast and @TheRickWilson  ...

@MaryLTrump!

Subscribe now to get the ep ASAP.

https://t.co/DuQVYRwkOm",1285398305745309697,https://podcasts.apple.com/us/podcast/the-new-abnormal-with-molly-jong-fast-rick-wilson/id1508202790,Tue Jul 21 02:16:52 +0000 2020
0,thedailybeast,Former Florida gubernatorial candidate Andrew Gillum says his 2018 loss to now-Gov. Ron DeSantis plunged him into depression and a battle with booze https://t.co/m1iqk1y3hH,1285415633975488513,https://www.thedailybeast.com/andrew-gillum-says-he-battled-booze-depression-after-loss-to-ron-desantis?via=twitter_page,Tue Jul 21 03:25:43 +0000 2020
0,thedailybeast,"Michael Cohen is suing Bill Barr, alleging he was tossed back in prison to stop him from writing a Trump tell-all book https://t.co/GhF8UQI0px",1285417989647605760,https://www.thedailybeast.com/michael-cohen-sues-bill-barr-says-he-was-jailed-to-stop-book-about-trump?via=twitter_page,Tue Jul 21 03:35:05 +0000 2020
0,thedailybeast,RT @MarlowNYC: Seth Meyers: “It sucks so hard that we have a president who says things like ‘we had a good slot.’ He’s bored by coronavirus but he loves TV.”  https://t.co/OOAPbsemSa,1285419887406518272,https://www.thedailybeast.com/seth-meyers-rails-against-trump-for-caring-about-coronavirus-tv-ratings-more-than-dead-americans,Tue Jul 21 03:42:37 +0000 2020
0,thedailybeast,"Seth Meyers rails against Trump for caring about his coronavirus presser TV ratings more than dead Americans: “Oh, I’m sorry, Commodus, were you not entertained?” https://t.co/8S6yh3bhFv",1285420507366645761,https://www.thedailybeast.com/seth-meyers-rails-against-trump-for-caring-about-coronavirus-tv-ratings-more-than-dead-americans?via=twitter_page,Tue Jul 21 03:45:05 +0000 2020
0,thedailybeast,"Trevor Noah is very worried about Kanye West: Someone ""take his mic away"" https://t.co/tgwSPLFCkm",1285425660744400897,https://www.thedailybeast.com/trevor-noah-is-very-worried-about-kanye-west-feels-someone-should-take-his-mic-away?via=twitter_page,Tue Jul 21 04:05:34 +0000 2020
0,thedailybeast,"RT @MarlowNYC: Trevor Noah on Kanye: “Honestly, guys, I don’t know what to make of this. Because my takeaway from this event is that Kanye West doesn’t seem well. I feel like someone who cares about him needs to take his microphone away.” https://t.co/dfH3GZksZQ",1285426022750523402,https://www.thedailybeast.com/trevor-noah-is-very-worried-about-kanye-west-feels-someone-should-take-his-mic-away,Tue Jul 21 04:07:00 +0000 2020
0,thedailybeast,Joe Biden could end up giving the only major speech at the DNC from the host city of Milwaukee https://t.co/WbtBDoOy5x,1285439381914951680,https://www.thedailybeast.com/leaked-documents-show-the-dncs-plans-for-a-reimagined-convention?via=twitter_page,Tue Jul 21 05:00:05 +0000 2020
0,thedailybeast,"“Men’s rights” lawyer’s screeds raged against Judge Esther Salas, whose family he later allegedly ambushed https://t.co/hs3bwGNre1",1285453570301722624,https://www.thedailybeast.com/mens-rights-lawyer-roy-den-hollanders-screeds-raged-against-judge-esther-salas?via=twitter_page,Tue Jul 21 05:56:28 +0000 2020
0,thedailybeast,"If you’re overheating and your AC isn’t keeping you as cool as you’d like, Daniel Modlin has rounded up some of his personal favorite products for you to beat the summer heat with —  from the bedroom to the kitchen and beyond
https://t.co/o0Z9PrvSNT",1285456989422850049,https://www.thedailybeast.com/best-ways-to-beat-the-summer-heat?source=articles&via=twitter_page,Tue Jul 21 06:10:03 +0000 2020
0,thedailybeast,Kanye West's cries for help https://t.co/IgNrnelRjc,1285461758459682818,https://www.thedailybeast.com/kanye-wests-cries-for-help?via=twitter_page,Tue Jul 21 06:29:00 +0000 2020
0,thedailybeast,"RT @MarlowNYC: Kanye West's support system has broken down, and it's painful to watch https://t.co/rbElGOV3RT",1285462078636068865,https://www.thedailybeast.com/kanye-wests-cries-for-help,Tue Jul 21 06:30:16 +0000 2020
0,thedailybeast,"“I asked a customer if they had a mask, and she walked by me, completely ignored me as if I did not exist. Another one swore, ‘That's f*cking bullshit, and f*ck this place.’” https://t.co/u5viBbayTb",1285469592442339329,https://www.thedailybeast.com/walmart-target-workers-are-terrified-of-enforcing-mask-rules?via=twitter_page,Tue Jul 21 07:00:08 +0000 2020
0,thedailybeast,"Governor Doug Ducey has come under harsh criticism for refusing to issue a mask mandate or reinstitute a lockdown order. He eventually allowed cities to pass their own ordinances, and now nearly 90 percent of Arizona is under a local mask mandate. https://t.co/rl7qHsThJ6",1285484719631736832,https://www.thedailybeast.com/pence-tells-governors-masks-are-helping-turn-the-tide-on-coronavirus-in-arizona?via=twitter_page,Tue Jul 21 08:00:14 +0000 2020
0,thedailybeast,"“We are saying if we do these things, we can actually open and stay open. We can get back to school, to worship, to jobs,” U.S. Surgeon General Jerome Adams exclaimed. https://t.co/vj6CnqV6nT",1285499793423454209,https://www.thedailybeast.com/trumps-surgeon-general-jerome-adams-begs-fox-news-viewers-to-wear-masks-im-pleading?via=twitter_page,Tue Jul 21 09:00:08 +0000 2020
0,thedailybeast,"“New York, and Chicago, and Philadelphia, Detroit, and Baltimore, and all of these—Oakland is a mess—we are not going to let this happen in the country...” Trump told reporters. “We’re going to have more federal law enforcement, that I can tell you.” https://t.co/w5tNLQ7NZp",1285514928464498688,https://www.thedailybeast.com/trump-administration-plots-crackdown-by-feds-in-cities-nationwide?via=twitter_page,Tue Jul 21 10:00:17 +0000 2020
0,thedailybeast,"56% of U.S. voters say America is racist in new WSJ/NBC poll, two months after George Floyd killing https://t.co/r0nJnhZ1jj",1285520908019478530,https://www.thedailybeast.com/poll-shows-56-percent-of-american-voters-think-america-is-racist-two-months-after-george-floyds-killing?via=twitter_page,Tue Jul 21 10:24:02 +0000 2020
0,thedailybeast,Michael Cohen lawsuit: AG Bill Barr sent me to jail to stop my tell-all about Trump https://t.co/YgL2eVHHQ3,1285522685599121408,https://www.thedailybeast.com/michael-cohen-sues-bill-barr-says-he-was-jailed-to-stop-book-about-trump?via=twitter_page,Tue Jul 21 10:31:06 +0000 2020
0,thedailybeast,Prince Andrew’s team was initially “pleased” with his disastrous BBC interview about Jeffrey Epstein. Then they saw the public’s reaction https://t.co/iMr1rmuUQw,1285523426799767553,https://www.thedailybeast.com/prince-andrews-team-was-pleased-with-his-bbc-interview-about-jeffrey-epstein-until-they-saw-public-reaction?via=twitter_page,Tue Jul 21 10:34:03 +0000 2020
0,thedailybeast,"An estimated crowd of 2,000 people participating in the protests in Portland, Oregon, “tore open the doors of a federal courthouse and then beat back the agents inside,” a journalist on the scene reported on Twitter
https://t.co/4XU8AJdYDl",1285533839906025478,https://www.thedailybeast.com/federal-agents-beaten-back-into-portland-courthouse-by-2000-protesters-including-parent-groups?via=twitter_page,Tue Jul 21 11:15:26 +0000 2020
0,thedailybeast,"San Francisco Giants Manager Gabe Kapler, along with several of his players, took a knee during the national anthem before the Giants’ 6-2 exhibition victory against the Oakland Athletics 
https://t.co/piFGMB2NoF",1285535583880781825,https://www.thedailybeast.com/san-francisco-giants-gabe-kapler-kneels-during-national-anthem-first-mlb-manager-to-take-a-knee?via=twitter_page,Tue Jul 21 11:22:21 +0000 2020
0,thedailybeast,"European Union leaders agreed Tuesday to a €750 billion ($858 billion) coronavirus stimulus fund after 90 hours of negotiations, the second-longest European Council meeting in history
https://t.co/cb92OnVygJ",1285535836415627265,https://www.thedailybeast.com/european-union-agrees-to-dollar858-billion-coronavirus-recovery-fund?via=twitter_page,Tue Jul 21 11:23:22 +0000 2020
0,thedailybeast,"European Union leaders agreed to a €750 billion ($858 billion) coronavirus stimulus fund after 90 hours of negotiations, the 2nd-longest European Council meeting in history
https://t.co/yicwgqSNoI",1285536036148449280,https://www.thedailybeast.com/european-union-agrees-to-dollar858-billion-coronavirus-recovery-fund?via=twitter_page,Tue Jul 21 11:24:09 +0000 2020
0,thedailybeast,"Getting turnt up on the water is contributing to the alarming spike in COVID-19 cases in Miami-Dade, a top pandemic hot zone, health experts and frontline workers warned
https://t.co/nEAnFban6z",1285540043256483841,https://www.thedailybeast.com/miami-south-florida-boat-parties-spread-covid-19?ref=home&via=twitter_page,Tue Jul 21 11:40:05 +0000 2020
0,thedailybeast,"While the title of National Geographic’s new special ""Sharkcano"" may be titillating, it comes with a certain, conditioned expectation of cheesy effects and a total and complete lack of scientific basis.

 But no. Friends, the ""Sharkcano"" is real. 
https://t.co/LiWD3U9tZp",1285545083937476608,https://www.thedailybeast.com/sharkcano-there-are-sharks-living-in-a-volcano-for-the-love-of-god?ref=home&via=twitter_page,Tue Jul 21 12:00:06 +0000 2020
0,thedailybeast,"An influential group of large investors, including asset managers and pension-fund executives, have signed a letter warning top U.S. economic officials that climate change is threatening to create turmoil in the financial markets
https://t.co/nKO7WVbNYc",1285552955119276032,https://www.thedailybeast.com/big-us-investors-warn-regulators-climate-change-is-ready-to-upend-economy-and-financial-markets?via=twitter_page,Tue Jul 21 12:31:23 +0000 2020
0,thedailybeast,"“[Kanye's] going to go after Harriet Tubman for not getting the slaves better jobs? What was she supposed to do, run the Underground Railroad and LinkedIn?” said Trevor Noah on last night's episode of ""The Daily Show.""
https://t.co/sHaa6NvfZ1",1285555383071899648,https://www.thedailybeast.com/trevor-noah-is-very-worried-about-kanye-west-feels-someone-should-take-his-mic-away?source=articles&via=twitter_page,Tue Jul 21 12:41:02 +0000 2020
0,thedailybeast,"In a screed against cancer doctors, “men’s rights” attorney Roy Den Hollander, who allegedly gunned down Judge Esther Salas’ family, saved some venom for her, writes @michaeldalynyc 
https://t.co/2QvbsnDZfv",1285560226503184384,https://www.thedailybeast.com/mens-rights-lawyer-roy-den-hollanders-screeds-raged-against-judge-esther-salas?source=articles&via=twitter_page,Tue Jul 21 13:00:17 +0000 2020
0,thedailybeast,"Michael Cohen will allege in his forthcoming memoir that Trump has made “virulently racist” comments about Barack Obama and Nelson Mandela
https://t.co/FCNA6KNxve",1285565516833226752,https://www.thedailybeast.com/michael-cohen-disloyal-book-alleges-trump-made-virulently-racist-comments-about-obama-mandela-docs-state?via=twitter_page,Tue Jul 21 13:21:18 +0000 2020
0,thedailybeast,"An insider’s account of the alleged scientific cybercrime is unlikely in Russia. “Russian special services almost never leak information about their operations,” an investigative reporter at the BBC Russian service told us.
https://t.co/24iuxneoLy",1285570236918489088,https://www.thedailybeast.com/the-real-reason-behind-russias-covid-19-vaccine-hacks?source=articles&via=twitter_page,Tue Jul 21 13:40:03 +0000 2020
0,thedailybeast,"The Democratic Party’s left and moderate wings continue to reach tentative compromises on a number of issues that once fiercely divided them. But there’s one perennial political sticking point that’s proving immune to the party’s kumbaya moment: Israel. 
https://t.co/mRdmlnNx2d",1285570237027450881,https://www.thedailybeast.com/biden-and-sanders-teams-stand-off-over-israeli-occupation?source=articles&via=twitter_page,Tue Jul 21 13:40:03 +0000 2020
0,thedailybeast,"The president of Portland’s police union met with the DHS head last week to discuss the agents, apparently without the knowledge of the city’s police chief. The president of Chicago’s police union made his own envoys, asking for federal intervention. 
https://t.co/gItQA610iI",1285575324290424833,https://www.thedailybeast.com/police-unions-tell-trump-to-send-in-the-feds-to-cities-like-portland-and-chicago?source=articles&via=twitter_page,Tue Jul 21 14:00:16 +0000 2020
0,thedailybeast,FBI agents storm Ohio House Speaker Larry Householder's farm over $60M bribes scandal https://t.co/99LFuj5p1z,1285582981625716738,https://www.thedailybeast.com/fbi-agents-storm-ohio-house-speaker-larry-householders-farm-in-dollar60-million-bribes-scandal?via=twitter_page,Tue Jul 21 14:30:42 +0000 2020
0,thedailybeast,"The “Bridesmaids” director and “Freaks and Geeks” creator opens up to Marlow Stern about empowering minority voices, far-right smear campaigns, and the return of “Other Space”
https://t.co/XfgkJ0LJF3",1285585095806652416,https://www.thedailybeast.com/paul-feig-on-hollywood-sexism-trumps-war-on-ghostbusters-and-a-spy-sequel?source=articles&via=twitter_page,Tue Jul 21 14:39:06 +0000 2020
0,thedailybeast,"The mother of Lorenzo Anderson, a Seattle 19-year-old who was shot dead in the Capitol Hill Occupied Protest zone in June, has filed a wrongful-death claim against the city
https://t.co/f7TbmcL6GL",1285590231459266562,https://www.thedailybeast.com/mother-of-teen-shot-in-seattles-chop-zone-files-wrongful-death-lawsuit-against-city?via=twitter_page,Tue Jul 21 14:59:30 +0000 2020
0,thedailybeast,"What makes the Roku Soundbar so excellent is the simplicity of it. It’s easy to set up, easy to use, and you don’t need a million things—just this one. 
https://t.co/WAsbyJqpsn",1285590415488569346,https://www.thedailybeast.com/roku-smart-soundbar-combines-streaming-and-audio-for-the-ultimate-viewing-experience?source=articles&via=twitter_page,Tue Jul 21 15:00:14 +0000 2020
0,thedailybeast,"Here's what Mary Trump told @mollyjongfast and @therickwilson about her grandfather's arrest at a KKK rally.

Listen to today's episode of Thew New Abnormal for a peek behind the Trump family veil.
APPLE: https://t.co/oAxMB5dO6l
SPOTIFY: https://t.co/EQcdW6VyR9 https://t.co/SEFmKukRtN",1285594358864064517,https://podcasts.apple.com/us/podcast/mary-trump-what-really-shocked-me-about-my-family-the-kkk/id1508202790?i=1000485588126&via=twitter_page,Tue Jul 21 15:15:54 +0000 2020
0,thedailybeast,"Britain’s Conservative government never bothered to find out whether the Brexit referendum was influenced by the Kremlin, according to a scathing report by parliament’s Intelligence and Security Committee
https://t.co/V9xjnbqBzk",1285595653234733056,https://www.thedailybeast.com/russia-report-finds-scandal-that-uk-failed-to-probe-russian-interference-in-brexit?source=articles&via=twitter_page,Tue Jul 21 15:21:03 +0000 2020
0,thedailybeast,"Here's what Mary Trump told @mollyjongfast and @therickwilson about her grandfather's arrest at a KKK rally.

Listen to today's episode of The New Abnormal for a peek behind the Trump family veil.
APPLE: https://t.co/oAxMB5dO6l
SPOTIFY: https://t.co/EQcdW6VyR9 https://t.co/rGVs3fUsC2",1285596001512849409,https://podcasts.apple.com/us/podcast/mary-trump-what-really-shocked-me-about-my-family-the-kkk/id1508202790?i=1000485588126&via=twitter_page,Tue Jul 21 15:22:26 +0000 2020
